,page,text
0,1,parentyaduitemenfant lesitroisipoleside lfanalyseltransactionnelle quiztquellelimage vousidewotrelcoorpse belgique mensuel/diffusion nmp
1,2,"d'ex découper recopier rappelant 255 pss retourner culture art loisirs france 114 champs-ely- sées 75391 paris cedex 08. belgique palais st-jacques 7500 tournai suisse rte d'oron 1010 lausanne 10. fft veuillez m'envoyer encyclopédie plantes d'appartement accompagnée cadeau durant jours j'aurai tout loisir l'utiliser passé délai pourrai garder payer men- sualités première 27,30 5,55 autres 27.30 m'engage.à rien d'autre. pourrai retourner sans rien cas pourrai gar- devoir der cadeau prénom nom rue code postal ville sin obligatoire tety 114 champs-elysées 75391 paris cedex agir rose rer grand ooo plantes pus dealoo photos encyclopédie slantes d'apparteivient tout réussir garder longtemps nantes 1eurs dour décoration intérieur lvre oues lou rce couleur dessins aussi doigts verts combien fois arrive-t-il voir dépérir effet guide débutant apprend tout lumière dont fleurs plantes besoin guide problème eaux maison températu- offert terres terreaux ... lopéd comment dépoter ncyclopédie comment plantes fer bauturer grefd'appartement l'entretien feuillage dépoussiérage plante nouvellement acquise faute d'information soins donner livre donne tous renseignements pratiques planter soigner réussir encyclopedie plantes d'appartement pratique l'amateur averti aussi bien fenêtres fleuries balcons maladies plantes jardins bouteille saurez inventer réussir vous-même quand précises explications livre donne etc"
2,3,bhiveusité lahsan êcole hohshocs sociales dibliothèque dsycholioule connaissance soi connaissance autres janvier 1978 editorial jeunesses d'europe jacques mousseau forum lecteurs écrivent quiz quelle image avez-vous corps marie-josé wagner société comment vend-on candidat élections marketing politique yannick bourdoiseau couple femmes battues dossier ouvert mouvements féministes marie-france elliott ——— connaissance soi l'ennui comment combattre sam keen bref belgique ———— ———————— …—……——————— bande dessinée loi 1838 serge tisseron ——— —————————— dossier mois hypnose nouveau jean chaguiboff —————————————— psychologie comportement l'etat moderne behavioriste préfère punir plutôt récompenser burrhus skinner ——— bref france ————————— ————— …—… …—…… .…—…… mouvement idées peut-on humaniser l'homme credo psychologie humaniste ulrich vülker nouvelles thérapies l'analyse transactionnelle france technique pleine effervescence gysa jaoui librairie vie après vie r.a. moody l'imagination dialectique jay autres parutions who who psychologie prochain numéro paraîtra jeudi février 1978. psychologie edite centre d'etude promotion lecture abonner departement retz 114 champs-elysees 75008 paris 359.84.16. voyez page
3,4,"cles rencontres prendrez sérieux hasard parfois fait bien choses maïs est-il plus sérieux l'aider peu méthode simple otre étude psychologique détaillée véritable profil compatibilité analyse personnalité plans intellectuel affectif sexuel définit types psychologiques compatibles vôtre fichesportraitvous envoyées sans limitation nombre durée mariage lire notamment vers unc civilisation couple jentel préfnco louis armand l'académie française toutes librairies tion international leston fydidige nris ltieses geneve æmontr late rencontre sous jours envoyez-moi gratuitement docu- mentation couleurs sous pli neutre cacheté mme mlle prénom adresse attente nee mme lion france sainte lazare 75009 paris tél. 0.8 salnt-lazare rhone-alpes psrig focksfaller 60093 lyon tél 25.44 cours berriat 23009 grenoble tél ion belgique psb rue mar herbes 105 bto 1000 bruxell ion suisse pss ruo geneve tél 022.45,72.80 1203 sos soi ooioio marcel turbiaux répond lecteurs ... précisions dienne ecole freudienn possible m'apporitr précisions sujet l'eco freudienne dont parle souven untel membre l'ecole freu ais également très heureux d'avoir renseignements l'institut psychothérapie établissement libre d'enseignement supérieur notamment possibilité d'inscription étudiants province possibilités poursuivre parallèlement études sdecine ya.-cornimont appelle ecole freudienne tendance psychanalytique issue travaux jacques lacan faut rappeler qu'en 1953 première scission produit l'intérieur mouvement psychanalytique français jacques lacan rejoint alors groupe anciens analysés rené lajorgue premiers divulgateurs pensée sig- mund freud dès thèse 1919 chef file psychana- lyse france daniel lagache mme favez- boutonnier françoise dolto fondé groupe recherches d'études freudiennes devenu suite société fran- çaise psychanalyse 1963 seconde scission l'intérieur cette société permit jacques lacan fonder l'ecole freudienne paris tandis membres demeurés société fran- çaise psychanalyse daniel laga- che jean laplanche pontalis changèrent nom celle-ci celui l'association psychanalyti france deux mouvements iront exercer influence parallèle universités instituts sciences humaines ares jacan diffuse doctrine mnaires l'ecole pratique hautes études scrits direction revue champ collection fous textes élan publiés éditi sen. éditions l'espace nes succinc- l'apport spécifique jac- ques lacan pourrez consulter ouvrages suivants comprendre manquant co- exposer jacques lacan jean-baptiste fages toulouse privat 1971 titre lettre jeanlx nancy lacoue-labarthe paris galilée 1973 lacan jean marie palmier paris editions uni versitaires 1969 jacques lacan rifflet-lemaire bruxelles dessart mardaga 1970 méro spécial revue l'arc 1974 consacré lacan l'histoire psychanalyse après freud jean-baptiste fages toulouse privat 1976 indiquera place jacques lacan l'his toire psychanalyse d'autre part recherches demeurées vaines concerne l'institut psychothérapie auquel faites allusion appel lecteurs intéressée travail thérapeuti claude christiane aïais centre d'évolution rue saints-pères j'aimerais connaître personnes participé exemple analyse affective ci-joint numéro téléphone 010.13.16 adresse m.-y meur godets rue prés 91120 palaiseau pourriez-vous m'aider peut-être courrier lecteurs entrer contact personnes remercie d'avance ferez permets demander service tant fidèle lectrice depuis création journal achète régulièrement cet excellent outil vulgarisation psychologie m.-y m.-palaiseau l'intention lecteurs cel appel pourrait intéresser antipsychiatrie france pourriez-vous m'indiquer adresses centres établissements penchent question l'an- tipsychiatrie l.a. a.- hongeuil canada préface qu'il rédigée clefs l'antipsychiatrie chantal brasseur paris seghers 1974 roger gentis explique ceux france réclament l'antipsychiatrie rattachent psychanalyse plus précisément l'ecole freudienne groupée autour jacques lacan c'est cas particulier maud mannoni"
4,5,fondé robert lefort 1969 ceurre recherches pédagogiques psychanalytiques bonneuil cette institution éclairée comme définissent eux-mêmes fondateurs accueille enfants psychotiques débiles anorexiques cependant bien qu'il n'existe connaissance france comnnunautés analogues celles d'arcinvay animée ronald laing lieux d'accueil comme kingsley hall disparu 1970 créé philadelphia association fondée ronald laing david cooper aaron esterson tentatives réactions contre institution asilaire traditionnelle lieu lieu encore peu partour france peut citer chesnaïe chailles fondée 1956 claude jeangirard pose anti-asile clinique borde cour-cheverny ouverte 1953 s'inspire mouvement psychothérapie institutionnelle laquelle s'attachent noms jean oury félix guaïtari tentative reprendre expression fernand deligny monoblet cévennes reçoit enfants peut être rattachée cet effort rupture thérapie règlement psychiatriques traditionnels faut souligner idées répandues ronald laing david cooper fait chemin établissements publics introduit réformes essayé expériences c'est ainsi belle etoile paul court équipe prendre corps grâce bienveillance pelletier directeur l'hôpital sainiylie jura nombreux neuropsychiatres imprégnés idées l'antipsychiatrie tel roger gentis déjà cité beaucoup écrit sujet médecin-chef d'un établissement psychiatrique fleury-les-aubraïs comment être musicothérapeute m'intéressant profession musicothérapeute entrant deuxième année psychologie j'aimerais m'indiquiez tous renseignements concernant cette profession at-il instituts france l'étranger préparent quelles conditions d'entrée durée études débouchés etc. m.-c. m.-monclar l'association recherches applications techniques psycho- musicales centre français musicothérapie dispense formation techniques psychomusicales terme employé comme recouvrant l'ensemble applications possibles rythme musique relation caractère psychothérapeutique cette formation sanctionnée certificat techniques psychomusicales présentation d'un mémoire conditions d'inscription suivantes exercer profession médicale paramédicale être engagé pratique mutsicale quelque niveau avoir fait moins stage dynamique groupe être déterminé travail équipe formation déroule deux ans stages réalisés externat paris trois stages d'une semaine chacun première année stage d'une semaine suivi trois stages trois jours deuxième année d'autre part l'art.p dont l'objectif développer recherches promouvoir applications effets psychophysiologiques affectifs musique particulier musicothérapie offre certain nombre d'activités adhérents stages soirée sensibilisation psychomusicale cours relaxation psychomusicale groupes recherche l'improvisation week-ends sensibilisation musicothérapie ateliers d'expression corporelle etc ajoutons qu'un congrès musicothérapie lieu novembre 1977 palais congrès paris programme perception auditive fœtale musicothérapie l'institution psychiatrique musicothérapie l'enfant handicapé présentation musicothérapie france analyse structures sonores inductrices thérapies musicales tous renseignements complémentaires peuvent être obtenus aurprès l'association rue frères-morane 75015 paris tél 533.27.07 lire également introduction musicothérapie gérard ducourneau vient paraître éditions privat toulouse abonner psychologie voyez laicrelvotr ouiavouspouvez timidité paralyse gâche vie ferme pories succès réussite pourtant autant valeur d'aptitudes autres donc pouvez devez réussir aussi biën au'eux tout entreprenez laissez dévorer etre sûr soi l'aise partout oser regarder gens face dire non quand c'est non cela s'acquiert parvenir existe méthode spéciale mise point d'après travaux psychologues éminents permet timides débarrasser terrible handicap décidez suivre plus jamais cet hésitant part battu d'avance solitaire sait faire amis cette victime personne n'écoutc l'assurance vraic personnalité s'épanouira s'apercevra enfin existez précieuses qualités volonté attirerez autres attitude franche sympathique n'ayant plus besoin suivre chemins tortueux parvenir bul travail enfin apprécié juste valeur tirerez plus grands avantages méthode proposons conçue apprendre connaître rééduquer réflexes contrôler réactions toutes circonstances parviendrez aisément lorsque compris îles mécanismes bloquent font perdre moyens donc avant tout pratique efficace tous anciens timides diront vie changé tout tout jour mis pratique celte méthode faites comme ceux mieux armé affronter vie chaque jour ... faire place soleil savoir plus demandez petit livre comment vaincre timidité gratuit engage rien recevoir postez simplement bon découper ci-dessous faites-le tout suite bénéficier cadeau-surprise absolument gratuit sonsnossssnice renvoyez bon atui service institut ama 'boulevard exelmans 75016 paris veuillez m'adresser gratuitement livret comment vaincre timidité détails cadeau-surprise joins timbre frais d'envoi pays hors d'europe joindre coupons-réponses nom prénom cititii111ii majuscules ossi ... vessreses ... code postal doooooosonoognnop ossi
5,6,pre opte pet dote arts tor mere tea sre ent ent écart pes pme torres rene our set free porn ares men eee rte séreués
6,7,onu han quelle image avez-vous uhiversité lausawde école sonnges sociales bibliothèque cle corfps marie-josé wagner livre l'image corps entité changeante croissance gallimard paul schilder écrit développement comment pensez-vous percevoir l'image corps humain c'est l'image propre corps formons esprit c'est façon dont tout corps apparaît selon schilder éprouvons grâce sensations l'existence corps tant qu'unité cette idée d'unité fondée également manière dont représentons corps tête quelque chose l'on appelle schéma corporel bien encore modèle postural corps ainsi schilder dit comme changeons tout temps position toujours train construire modèle postural nous-mêmes constante transformalion. modèle postural lnage varie selon l'humeur moral tempérament sujet photo francis goldstein armes name lun rsels modèle postural défini comme tel met jour l'idée maîtresse schilder savoir l'image formons corps perpétuelle autoconstruction autodestruction selon processus création comment repondre répondez propositions faites chaque question marquant rien n'êtes d'accord notant chiffre côté lettre d'accord ensemble proposition choisie considérez qu'il certaines nuances faire notant chiffre côté lettre lotalement accord proposition choisie mieux corps essentiellement yeux car vision favorise perception globale immédiate surtout mains attouchements peau contacts c'est combinaison toucher vision permet bonne perception corps lors entretien quelle dislance interlocuteur placez-vous préférence j'aime sentir très proche personne laquelle m'entretiens car contact bien meilleur jamais rendu compte l'éloignement favorisais entre autrui j'ai tendance varier dis- tances selon type liens j'entretiens
7,8,quelle attitude adoptez-vous face violence supporte violence tel point j'ai constamment peur d'être agressé n'aime violence pour- tant lorsque colère sais plus fais crois l'on tous cer- tain degré d'agressivité exlério- riser m'est déjà arrivé avoir envie battre plus plaisir nécessité pensez-vous être bonne forme physique fais sport très irrégulièrement ressens effets laisser-aller lors d'efforts inhabituels tiens l'être cela m'entraîne très régulièrement forme physique jamais bien éblouissante assez régulièrement malade comment pensez-vous rire j'ai fréquentes crises fou rire plutôt réservé m'esclaffe rarement sais sourire ous souciez-vous ligne ligne apparence extérieure toujours laissé parfaitement indifférent fais aucun effort changer quoi domaine tiens bien plus forme ligne car j'aime sentir bien peau j'aime plaire cela tiens garder ligne qu'attendez-vors dre u'attendez-vous d'un vêtement qu'il confortable afin gêner mouvements qu'il solide qu'il élégant permettant présentation irréprochable mettant avantage corre comment réagissez-vous lorsque l'occasion occasion exprimer groupe parlez-vous gestes dois certainement avoir bon nombre gestes aidant douen attendant passivement s'estompe soignant ment possible poussant plaintes qu'elle plus rapide. sou- propres servent ensée rends bien comple gestes fais plutôt raide tude doit demeurer assez riglae réservée plutôt genre gesti- culer sans arrêt façon rendre très présent comment découvrez-vous photo regarde jamais photo très longtemps frouve différences particulières trouve souvent cadrage mal fait j'ai dé- formé certaines fois reconnais d'autres m'étonne voir quel point l'image j'ai peut être différente réalité traversant rue failli faire renverser voiture quoi attribuez-vous cela cette voiture devait aller trop vite conducteur temps freiner devais certainement être préoccupé réflexions m'ont fait oublier prudence semble toujours invulnérable cela peut arriver qu'aux autres fais tout attention passe autour comment réa nee omment réagissez-vous voiture peur chirurgicales peur béni qu'un tas réflexes fait j'ai grande tendance laisser aller réflexions volant sens fois maître machine confondu plutôt crispé surveillant énormément conscient moindre erreur part peut m'être fatale mment endormez-vous m'endors lorsque j'ai pris position favorite faut vraiment fati gué endorme mmendors très facilement car sais détendr désire dre quand interventions cela fait absolument cela dépend l'opération bne n'aurai spécialement peur relativement brave ien événements vie mettent émoi croyez-vous rai m'empêcher d'avoir certaine appréhension l'idée plus petite intervention fait très peur capable cacher émotions personnellement j'ai sion savoir maîtriser sais maîtriser lorsque préparé événement l'on surprend peux absolument rien cacher trouble pret are comment apparaît vie sexuelle tout fait satisfaisante car choses sexuelles dégoûtent peu trouve satisfaisante bien manquant variété trouve très satisfaisante car m'efforce toujours d'aller découvertes découvertes domaine comment réagissez-vous spectacle d'ordre sexuel cela m'attire gêne tout fois j'évite plus possible genre spectacle trouve cela plutôt stimulant pensez-vous naturisme n'en ferai jamais car n'aime montrer trouve nécessaire redécouvrir sens nature cela surtout action plan psychologique comment ressentez-vous danse n'aime cela préfère regarder autres danser danse occasionnellement plus faire plaisir autres moi-même j'adore cela peux m'empécher bouger quand j'entends air plaît date —————————— pensez-vous être propre cela vaut peine perdre temps laver jamais trop pré occupé question pense l'essentiel laver temps temps trouve qu'il faut être mieux forme tout moment lave donc tous jours change aussi chaque jour tiens sentir bon l'impresee penser rous due part all forme poitrine d'autre couple pendan biberon utiliser ble cela reltion entre
8,9,one s'il n'existait plus miroirs monde cela manqueraïit-il non car regarde jamais volontairement miroir cela fait plutôt hasard beaucoup tel point trouverais solution inventer pourrais m'en passer bien cela soil assez ulile cer- laines circonstances nouer cravate exemple chez femme moyen embellir mettre traits valeur moyen utilisé discrétion peut servir effacer peu l'effet temps tout dépend femme moyen faire remarquer provoquer maquillage est-il pensezvous l'allaitement sein d'une part allaiter sein déforme poitrine femme d'autre part c'est gêne couple pendant longs mois biberon bien plus simple utiliser bien cela important relation entre mère l'enfant cela dépend bien souvent santé mère n'est donc élément essentiel bon développement l'enfant plus lait maternel composition unique l'allaitement sein favorise l'équilibre affectif l'enfant car celui-ci contact chaleur corps mère homme fait pousser moustaches porte barbe homme veut éviter avoir matin trouve séduisant cette façon considère comme forte personnalité tout protégeant derrière masque raser quelle attitude quand veut prendre photo prends pose avantage plus soucie chose poursuis occupations cela gêne énormément plupart temps cache derrière n'importe quoi fais grimaces dévoiler trouble quelle scrait attitude témoin d'un accident seule personne présente porter secours cas comme celui-là paniqué retrouve figé totalement incapable faire mouvement j'ai tendance devoir maîtriser appréhension pendant quelques secondes forçant réfléchir meilleur moyen venir aide reconnais jamais moments-là j'agis aulomatliquement sans avoir temps réfléchir quel facteur fait plus penser vieillesse manque temps m'empêche réaliser totalité désirs seul anniversaire jour l'an peuvent faire penser corps change fatigue plus vite pensez-vous l'infirmité rarement seulement croise infirme lieu public lis entend quelque chose sujet quand trouve situation critique exemple lorsque j'ai évité accident justesse j'ai toujours conscience cela peut m'arriver moment l'autre quel effet fait ventre rond d'une ferme enceinte trouve cela plutôt provoquant assez laïd toujours émerveillé voir quel point corps peut transformer tendre détendre cela procure aucun effet physique apparence physique convient-elle malgré quelques défauts apparence satisfait l'apparence physique m'importe peu concerne essentiel c'est pouvoir agir sans être empêché corps défaillant plais toui voir résultats lpinterprétation p.68 ecole peyci rapholoqie hold préparation poiession grephio- organisme privé d'enseignement distance fondé 1953 régi loi 12/7/71 cours correspondance cours oraux sessions confé- rences paris enseignement gradué professeurs spécialisés psychologie psychanalyse psychologie l'inconscient caractérologie morphopsychologie graphologie orientation sélection professionnelles inscriptions toute l'année rythme d'étude individualisé frais d'études comptabilisables dépenses formation permanente documentation gratuite gaïllat villa st-pierre 94220 charenton tél 368.72:01-376.72.01 analyses sélections professeurs réussite sociale-professionnelle parlez public réussite sociale-professionnelle aisance méthode moderne conseils personnels maurice ogier contacts faciles acquerrez confiance aisance parfaite personnalité s'épanouira réussirez mieux méthode audace parole exprimerez facilement clairement logiquement progrès très rapides qparis entraînement hebdomadaire petits groupes amicaux province technique pratique diffusée poste institut perfectionnement personnel mermoz 94160 st-mandé 328.89.19 oocumenranon eraruire documentation gratuite a.p 242 jnre mme mlle jprofession adresse ——— prénom ommqnm
9,10,pos lps setrertde rit \\\ het voie ars dit nat vin
