,page,text
0,1,lcr vous/abonner voyez'page 100 emma 125 ébiipensuisser belgique manie pme camera
1,2,"ardar ete régler mens pourra 41,9 5.65 por 1655 90° premiè deuxt rien atuit tourner sans rien devoir men gratuin dea jar ere rocop péo neyclo- end ver mmunieation gratuite code posts veuillez m'envo mer enr sas raie tout loisir duran passé délai signature-obliget use ecf augmente chances réussite vie sevor con savoir parler avoir parler can oir écrire savoir lire plus vite évelopper mémoire ôlle guide corr esspondance grand format 114 champs-elysées 75008 paris sre savoir présenter o'apprendre négocier o'communiquer famille 'etre leader.étc exemples exercices tests faire vous-même conseils pratiques cas vraiment concrets aidèr équipe spécialistes parmi lesquet métier famille secrétaire etud correspondance vves furet ntant déma rches homme étudiant réclamations cappris parler lycéen contrats etc grands 160815 actuels"
2,3,dsychoi® connaissance soi connaissance autres editoriaux quiz mois bande dessinée enfance adolescence dossier mois chercheur idées psychologie clinique société librairié bref ——— …—…——————— who who psychologie edité centre d'etude promotion lecture departement retz 114 champs-elysees 75008 paris 359.84 mai 1978 -in° 400 comment psychologie françois richaudeau 100 jacques 'mousseau quel type mémoire françoise gauquelin folie société serge tisseron premier jour vie faut réviser règlements maternités charles spezzano jill waterman bilan sciences humaines 1968-1978 psychologie jean chaguiboff psychiatrie roland jaccard psychanalyse docteur ghyslain lévy sociologie andré akoun l'édition claude sigismond bon annivérsaire docteur watson moins lbehavioriste disciples david côhen mythomanie fuite monde plus attrayant docteur jean-charles fébrinon france ras lle viol nouveau combat féministes hélène monneret cas doris feldenkrais autre moyen age jacques goff dernières parutions allemagne psychologie ——————————— prochain numéro paraîtra jeudi juin abonner voyez page 100 lan errant tin orme
3,4,comment psychologie françois richaudeau 966 créais c'est 1906 deb élite c.e.p.l. cela psychologie signifiait centre d'étuce promotion lecture toute petite equipe d'amis ens livre typographie modeste laboratoire comme premiers objectifs recherches publications lecture lisibilité pédagogie première parution méthode lecture rapide maintenant considérée comme classique cette discipline annee plus tard c.æ.p.l lançait collection psychologie voulait fois sérieuse populaire originale utile jour premier titre psychologie dépassé ventes 200 000 exemplaires c'est alors qu'encouragée premiers succès équipe concevait premier numéro psychologie démarche l'opposé passe habituellement l'édition c'est succès d'un périodique entraîne création livres exemples plus célèbres celui nouvelle revue française l'origine éditions gallimard celui groupe time life lançant multiples collections d'albums life d'autres collections livres d'autres périodiques venus grossir noyau premières publications toujours conformes philosophie initiale l'entreprise ouvrages encyclopédiques structure fonctionnelle dite algo-livre mathématiques titre plus connu vendu plus 200 000 exemplaires aussi philosophie cation classiques ipf javal lisibilité pollutions physiques économiques psychologiques civilisations gaspillage relaxation gymnastiques douces l'artisanat l'écologie outre trois autres périodiques venus s'ajouter psychologie revue théorique communication commuñication ilangages révué réflexion pensée traditionnelle spirituelle question revue nouvel art vivre dont ije parlais plus haut mieux-etre toutes productions livres revues maintenant préseritées sous nouvelle raison sociale morphologie plus simple plus directe éditions retz revenons 1968. j'avais proposé jeune journaliste ami compagnon travail depuis plusieurs années assumer rédaction chef psychologie qu'il accepté enthousiasme jacques type magazine ousseau maintenant centième numéro outre patronne dirige nombreux sonne psychologie nces humaines édité retz jai laisse vou entretenir psychologie françois richaudeau editorial jacques mousseau chiffres ronds fascinen 100. qu'il s'agisse d'un nom nées numéros d'une d'än prétexte commémo évocation bilan projets sociétés modernes sacrifie ass besoin archaïque l'an répétitifs suscités jointains stricte sou activités humaines l'aiter saisons jour spécialistes plupart jaborateurs longue date dre col. ailleurs bilan l'évolution sciences humaines cours dernières années voir page revient dresser ici psychologie depuis créatiq souci donner lee teurs information éclairante enquêtes réalisons fil années toutes appris lecteurs moyenne d'âge vingt-cinq ans plus jeunes aujourd'hui dixhuit dix-neuf ans peine dix ans quand revue née plus jeunes lecteurs l'époque approchent trentaine plupart quitté fallu plusieurs années comprendre admettre psy chologie revue moment vie temps études ternps d'une crise temps d'une interrogation soi-même autres cette étape franchie chacun pris complètement acli vités ambitions responsabilités laisse ainsi absorbé conquête monde extérieur jusqu nouveau vie invite scruter trame derrière tissu apparences sciences humaines dom cette mission décoder souligner rapports entre wages nomènes épars démonter canismes dégager lois mission chologie s'est donné d'expliquer langage clair attrayant démarches apports sciences fpt ère revue premiére reste seule langue frança faire travail comparable atd font depuis pus nombre d'années d'autres dre sciences début l'été 1969 note équipe réunissait mière fois discutant févré titre revue
4,5,ere diu imaginant différentes rubriques organisation logique faisant choix typographie maquette créant sommaire forme d'un donnerait donnerait c'était risque image d'une revue neuve originale utile premier numéro publié février 1970. sûmes tout suite répondions aspiration comme l'on dit partie gagnée premier numéro tiré 000 exemplaires vendu 000. rapidement psychologie atteignit tirage moyen 000 exemplaires pointes au-delà 80000 vente moyenne approchant 000 exemplaires dont plus moitié abonnement cette action menée sans grand tapage pouvait encore dix ans créer magazine moyens limités l'équipe premier jour continue retrouver chaque mois discuter articles engrangés bâtir sommaire corresponde sensibilité public toujours mouvement créer rapports suggestifs entre textes illustrations cette équipe formée d'individus venus d'horizons différents complémentaires formation leurs goûis françois richaudeau moment création psychologie menait depuis plusieurs années travaux minutieux perception mémoire axés problèmes lisibilité françoise michel gauquelin psychologues professionnels formés sorbonne institut psychologie paris jean feller passé comme beaucoup philosophie sciences humaines moimême enfin doté d'un certain savoir psychanalyse d'un doctorat sociologie daniel sinay directeur artistique réunir équipe photographes d'illustrateurs jeunes plupart parvenus traduire concrètement idées souvent abstraites fil années annick lacroix dominé dextérité croissante maniement maquetfe également responsable technique cette mécanique complexe comme horloge toujours parvenue secondée techniciens compétents maintenir montre l'heure faire sorte revue livrée sans moindre retard bilan d'un nurnéro 100 c'est abord celui d'un travail exécuté professionnels depuis février 1970 près mille articles fond publiés près quinze cents analyses livres petit petit revue s'est enrichie rubriques nouvelles informations l'activité sciences humaines france hélène monneret allemagne françoise koëtolany grande-bretagne david cohen belgique lydia flem canada jean-noël vigneault marcel turbiaux assure rubrique forum laquelle met science documentation service lecteurs psychologie dès printemps 1970 établi liens privilégiés etais unis scientes humaines soutenues crédits recherche importants connaissent développement intense signant contrat d'échanges éxclusifs psychology today accords comparables passés vec revues eüfopéennes nature mesure qu'ellés apparues psychologie heute allemagne psicologiàa conternporanea italie psychology today grande-bretagne grâce antennes l'étranger particulier etats-unis suivre l'évolution psychologie parfois précéder certains phénomènes avant émergence france premiers souvent parmi premiers toujours publié articles fondamentaux recherches nouvelles sexologie techniques groupes gestaltthérapie cri primal créativité l'analyse transactionnelle tout récemment nouvelles percées psychologie sophrologie biofeedback suggestologie valent toutes techniques quel avenir l'histoire psychologie jugera rôle d'informer honnêtement complètement non distribuer prix nobel psychologie bouge croyons c'est heureux fil cent numéros certaines signatures apparues bas nombreux articles personnalités accordé entretiens jean piaget claude lévi-strauss garants sérieux l'utilité action beaucoup d'auteurs trois quatre cents collaboré psychologie plupart portaient deux articles faits montré domaines explorons connaissance suffit doit s'accompagner d'une certaine expérience d'une certaine implication n'écril l'homme société simple commande comme peut faire physique nucléaire richesses pétrolières globe psychologie revue largement ouverte ceux quelque chose dire cette ouverture contrepoids nécessaire l'étroitesse l'équipe permanente base cependant quelques collaborateurs accompagnent depuis preiniers numéros semi-permanents informent maintiennent éveil auxquels pouvons toujours faire appel urgencé sociologue andré akoun psychologue jean chaguiboff philosophe pierrefrançois moreau ainsi roland jaccard claude bonñafont marie-france elliott sans sérions moins assurés risquerions d'être moins accuéillants tous projets collaboration ainsi cent numéros structures légères sûres construites new york londres montréal journalistes spécialisés pensent machine rodée fiable faire maintenant eviter tout vieillissement toute sclérose rouages rester éveillé saisir évolutions manqueront faire jour persuadé vingt-cinq prochaines années dominées l'éclosion sciences humaines serait-ce parce qu'on commence comprendre société moderne d'abord économie peuvent gouverner sans tenir compte psychologie individuelle collective toutes imparfaites qu'elles sciences humaines apportent quelques lumières gouvernement guelteurs l'avenir appartient donc ... jacques mousseau
5,6,quelest type mémoire mémoire parfois défaillances constalons dépit comparant d'autres paraissent plus dotés sont-ils réellement probable qu'ils leurs points forts aussi leurs points faibles paraissent remarquables domaine peut-être moins uit autre. quant réfléchissez devez-vous admettre s'il cas n'arrivez retrouver devriez savoir surpassez aussi ceux vons entourent mémoire n'est machine retient automatiquement qu'elle reçoit absorbe ceci laisse passer cela pourquoi c'est problème complexe pouvons discuter ici d'ores déjà tious pouvons supposer comme toute mémoire vôtre autssi points forts points faibles questionnaire suit destiné aider identifier comporte série questions générales expériences passées matière mémorisation questions suivies petits tests d'aptitude variés enfin tableau correction résultats guidera l'évaluation voire type mémoire répondez chaque question cochant réponses c.… proposées choix lopour savoir davantage reporter onmment développer voire ménioire paris reiz paraître fai oublier faites-vous erait obligation tisqu peu mouchoir note feuille place 'bien vue portée main comme rappel constant note agenda rien car n'oublie jamais j'ai faire agenda est-il mégulièrement tenu jour oui assez régulièrement moment l'oublie tout j'utilise rarement agenda c'est rop ennuyeux actuellement semble-t-il plus facile mémoriser chiffres renseignements sous forme graphiques schémas vers rythmés mélodies cours scolarité préfé- riuz-vous être interrogé algèbre géométrie langues vivantes langues mortes apprendre cœur était-il plus efficace rire vous-mêm mémoriser données françoise gauquein répéter plutôt nées autre technique adoptée voïx don résumez phrase lignes suivañtes premier souve nir d'enfance resté présent classez-le catégories suivantes perception sensorielle avant tout facteurs complexes indémélables impression visuelle avant toul impression auditive avant tou problème affectif problème raisonnement anniversaire offre abonner parmi liste sujets propose lequel choisissez-vous psychologie histoire politique littérature poésie musique peinture arts graphiques bricolage jardinage cuisine
6,7,durant rèves souvent parfois très rarement sommeil faites-vous rappelez-vous avoir fait rêves couleur imposait 10nalités rarement couleur joue généralement rôle rêves jamais oui souvent sons imaginaires interviennent-ils souvent rêves oui sons peuvent devenir mème intenses parfois réveillent matin m'arrive parfois rêver réveil sonne avant qu'il fasse réalité part cela rappelle avoir entendu cours rêves sons imaginaires n'en sais rien certains mels goûlez évoquent-ils parfois netlement couleurs sons non jamais goût sutfit amplement oui couleur bien sonorité peut s'associer goût parfum agréable peut-il associer couleur couleur oui exemple vois rose quand sens l'odeur d'une rose vois jambon quand sens l'odeur d'un jambon façon très indistincte telles associations produisent chez sans raison apparente m'arrive souvent d'associer très nettement perceptions d'origine différente sais pourquoi c'est jeu plaît non jamais avezvous parlois fait l'expérience décrite proust madeleine trempée lasse thé sensation caractéristique a-t-elle réveillé succession souvenirs croyiez effacés oui cela m'est arrivé plusieurs fois semble oui n'en certain non cela m'est jamais arrivé diverses lectures quotidiennes qu'estimez-vous plus facile enregistrer idécs générales traitées plutôt données chiffrées expérimentales général n'enregistre rien tout car lis m'amuser seulement cestil arrivé devant suite lettres isolées liste mots suivent sans ordre faire l'expérience décrite rim- baud poème îles voyelles avez-vous îles lettres bien mots parés couleurs spécifiques oui très souvent sais non certainement jamais ——— quand lisez livre d'histoire avez-vous l'impression retenir plus facilement dates plutôt noms propres noms propres plutôt dates dates noms uniquement succession événements relatés maurice ogier créateur nouvelles métiodes développement dela personnalité conseil perfectionnement relatlons fumaines expression orale sachez parler aisance bons contacts vie transformée techniques parole portée tous audace parole exprimerez nisance clairement mots viendront l'acilemenl apprendrez techniques purole l'improviste trucs professionnels saurez convaincre cette nouvelle méthode très concrète permettant chacun mettre valeur capacités bourrécs conseils personnels débloquera apprendra développer sans cesse plus confiance mnitriser émotivité contacts dialogue apprendrez l'urt contacts faciles tous cttoutes faire amis assimilerez techniques négociations conversation comment démarrer l'entretenir faire face tout entretien difficile surpris progrès psychologie comprendrez mieux réactions autres saurez comment rendre encore plus sym- c7a quand reprenez lecture pathique vie privée comme interrompue veille est-il vie professionnelle facile rappeler ile chiffre page laquelle resté non cela m'arrive jamais préfère mettre marque page j'en reste souviens page exacte seulement l'en droit approximatif après tant livre oui rappelle sans peine page exacte prêté garde lorsqu'un objet rappelez-vous prix oui sans difficulté non sauf désire beaucoup l'objet souhaite rappeler prix peux jamais parvenir peine choses ai-je lus oublie connaissez-vous montant compte banque économies argent liquide n'avez encore comp banque doit situer environs connais montant cxacl idées retrouve feuilleintéresse actuel personnalité épanouira découvrirez raisons blocages moyens pratiques éliminer certitude la-parole ouvre porte réussite écoutera parce saurez mettre valeur qualités autorité croîtra projets réaliseront æpanoui dynamique réconcilié vous-mème etavec société connaitrez enfin vraiejoie vivre vie ferez quéls âge situation sociale instruction quelques semaines tout pèul changer paris maurice ogier entraïnera conseillera personnellement petits stages amicaux partout ailleurs recevrez posle sous pli personnel méthodes d'action conseils institut maurice ogier rue jean-mermoz 94160 saint-mandé tél paris 328.89 bon l'envoi livre maurice ogier parler aisance sans engugement d'aucune sorte sous pli fermé confidentiel ainsi références renseignements concernant méthodes d'action mie sommsosssnesesses mile profession .... ...... agc prénom ssscssssssss tél ... aulcssg sens seersseseonereseseseeeseesee steve seesresressss ... 292 sono sreussreese ensure sense enesnrenesese ser
7,8,égal douce peux dire n'al dernier relevé pou trois minutes maximum pole tous numéros utiles savez cœur exemple numéro téléphone celui amis connaissances sécurité sociale d'identité compte bancaire puosssrsseseer mémoire consulter connaître déraseeressssesseceesse fin total nombre numéros notés ———— pendant trois minutes maximum dates notez plus possible apprises histoire signalant quel événement elles rapportent exemple naissance jésuschrist fin trois minutes faites total nombre dates nolées .... pendant trois minules maximum notez dates naissance eumplètes jour mois année connaissez cœur exemple date naissance celle membres famille amis relations d'hommes femmes célèbres intéressent particulièrement msn sms sonores tresse fin trois minutes faites total nombre dates naissance complètes ....... pendant cinq minutes maximum énumérez poésies dont savez cœur strophe moins identifiant quelques mots début exemple maître cor beau arbre perché cre cre au-dessous souviendrez reproduction importe compte c'est corre set sent pendant cinq cœut uses jossmesss const pendant cinqi minutes all maximum cherchez non prénom camarades classe dont souvenez précisant possible également quelle classe exemple philippe souchet anne-marie ... gendrot pascall cossonet claudia ... doses sesreeeeesssesess etre dosseret sert dave sesrsmmsdeneeeesesseeeret duos susecseeeeeeesenesess total deux points chaque nom prénom associés point chaque nom prénom isolé l'exemple ci-dessus total sept points nombre points obtenus ..... pendant minute maximum regardez image ci-contre parue psychologie puis masquez-la notez l'espace blanc ci-dessous éléments ell qu'elle conte- nait l'ordre reviennent cce .... cee ... sus ... ons pendant mire regardez ave nute maximum dessins attention petits couvre géométriques suiv uvrez-les ants puis votr notez ice l'espace blanc tous sssins l'org don clion corrigé comptez point chaque reproduction exacte demi-point reproduction déformée total ........ pendant minuie maximum étudiez mots désordre indi qués ci-dessous ensuite cauvrez-les main gauche nok l'espace blanc sui sol tous mots dont viendrez l'ordre retrouverez etrane tolette +22 arb qùÿ boule lial ruisseau e187 gi£ course serres
8,9,
9,10,jusqu'où eut-on reculer jeslimites mémoire curieuse expérience rapide timent montal premier compar parut vide sans douter qu'un compagnon visible trouvait déjà dont conversatt büin stonnante devait tenir éveillé jusqu train s'ébranla lente dai mières stockholm soulal couvertures cor alors face sommell j'aperçus banquette livre laissé voyageur pris machinalement j'en parcourus remières lignes cinq minutes plus tard ficais avidité comme récit d'un ami révélait trésor apprenals ellet tout monde ssëdé mémoire mémoire suflisante réaliser prouesses lantastiques rares personnes savent sefvir cette merveilleuse faculté mème expliqué titre d'exemple comment l'homme moins doué peul retenir facilement après seule lecture altentive toujours notions aussi compliquées liste cent rincipales villes monde chiffre eur population parut invraisemblable d'arriver caser pauvre tête quarante ans énumérations interminables chiffres dates villes souverains fait désespoir lorsque j'allais l'école mémoire élait toute fraiche résolus vérifier livre disait élaît blen exact tirai indicateur valise mis lire posément manière prescrite nom cent stations chemin fer séparent stockholm trehôrnings constatal qu'il suffisait seule lecture pouvoir réciter cette liste l'ordre lequel l'avais lue puis sens inverse c'est-à-dire commençant fin pouvais indiquer instantanément position respective n'importe quelle ville exemple énoncer qu'elle 27° 36° tant leurs noms s'étaient gravés profondément cerveau demeural stupéfait d'avoir acquis pouvoir aussi extraordinaire passai reste nuit tenter nouvelles expériences toules plus compliquées unes autres sans arriver trouver limite forces bien entendu bornal exercices amusants dès lendemain j'utilisai d'une façon plus pratique connaissance lois l'esprit pus ainsi retenir incroyable facilité lectures airs musique j'entendais nom physionomle personnes venaient voir adresse rendez-vous d'alfalres apprendre quatre mois langue anglaise j'ai obtenu vie fortune bonheur quantité suffisante c'est livre dois car révélé comment fonctionne cerveau voulez savoir comment obtenir mémes résultats acquérir cette puissance mentale encore meilleure chance réussir ans vie priez w.a borg envoyer intéressant petit ouvrage documentaire lois eternelles succès distribue gratuitement quiconque désire améliorer mémoire voici adresse w.r. borg dpt 189 chez aubanel place st-pierre 84028 avignon nom aubanel garantie sérieux depuis 225 ans aubanel difiusent travers monde mellleures méthodes psychologie pratique dorlier p———— bon gratuit découper iwr bore dpt crt aubanes jiessor plerre 84028 avignon recevolr fans part lols eternelles succès pli fermé nom prenom 1n°- rue code postal ville fes lage profession corrigé chaque mot total suivante ensuite lerez noterez ivé cet effet retenu procéderez deux autres suivent première point demi-point comptez exact déforme yous-même dis our lisez unc fois lentement haule voix phr ase ins dissimul'espace téserous hrases première phrase lire puis repro duire mémoire j'en l'exemple €en grandmère fort instruite n'arriva jamäis enseigner petite fille calcul l'orthographe deuxième phrase temps concours récita tion celui n'était sûr mémoire trichait peu non conquérir bonne place éviter punition troisième phrase jeunes musiciens assez physiciens pinule lancent soxes temps ressemblent dernière paraes vitesses ones étrros ... soso présent corrigez cherchant inexactituge contiennent soulignez d'un trail sions îles mots reproduiss exemple parvena extug place n'arriva mettez lorsqu'un jama complètement exemple petite fille torthographe pendant minute max téponses ares pres mot mot ais cotation 29/4 nombre soulignés semble trois phrases 29/2 nombre d'omissions semble trois phrases ven ven regardez attention gran ©bservant loutes comp ensuite marquez-je santes essayez île reproduire plus détails possible tout res pectant aussi proportions modèle ent repro comparez dessin notez point élément duit peu près deux points élément tout fait exact total propos tirées l'ouvrage d'alain l'éducation paris p.u.f 1932 voir résultat
