,page,text
34,35,mène dernier trait changement conte marne ans n'était évi recherche biologique aire quelque chose voir nue sciences humaines affaire talistes surtout recherche rnalt nature technique aujourd'hul pense d'abord jications humaines d'un tel savoir politique d'implantation centrales interrogations éthologiques semblent relever naturellement clologues mieux physiciens biologistes posent eux-mêmes questions sociologues dix ans croire c'était sciences nature donner modèle sciences humaines aujourd'hui contraire celles-ci mettent phagocyter nombre étonnant questions dont n'aurait jamais cru qu'elles pulssent jour finir tom ber sous coupe cas plus frappant peut-être celui l'histoire tant celle-ci n'était travail chronologique politico-militaire biographie quelques grands hommes soigneusement choisis qu'avait-elle donc voir psy chologie sémantique l'anthropologie certes l'école annales commencé faire changer cette conception n'avait toujours réussi faire pénétrer vues jusque grand public vanche depuis travaux philippe ariès l'histoire faire passer premier plan problèmes comme vie mort l'enfance famille rapproche plus plus qu'étudiént disciplines voisines aborde mêmes instru ments cas plus net celui recherches actuelles famille voit publier sujet travaux philosophes d'historiens psychanalystes d'ethnologues chacun d'eux fait appel matériaux fournis recherches autres quitte discuter propre point vue n'est parvenu cette interdisciplinarité volonté d'un recteur d'un conseil d'université s'est faite toute seule pärce qu'il demande sociale conscience collective uti- liser terme durkheimien exigeait informations phénomène éctuellement mutation parole tout monde rollaire cette transformation veaux rapports s'établissent entre ecteurs auteurs autrefois place here 2cun claire psychana- nalys confirmé écrivait psychaau l'étudiant s'instruisait quant patlent pouvait toujours essayer littérature s'adresonnajt tout cas au- jourd'huÿ parole qu'en multiplier fevues écrivent d'autres maîtres confirmés revue comme ordinaire psychan parole tous ychanalyste donne port l'analyse d'un côté autre divan psychanalyse comme dit titre l'an dernier analysés pare ceux autrefois patients exécutants prennent façon décisive ila parole entend qu'ont dire l'asile non seu- lement médecins encore infirmiers roumleux enfermés perceval prison anciens prisonniers claude charmes cette prise parole n'est détail plus change complètement perspective car désormais plus barrière insurmontable entre l'objet étudié patient malade pauvre fou sauvage celui l'étu- die soigne professeur médecin savant l'ethnologue nul n'est plus propriétaire droit divin savoir discours cet accès plus massif dont traitent sciences humaines conséquence passage llvres poche dix ans collec- tlons poche 10/18 excepté publialent surtout romans aujour- d'hui chaque éditeur crée série poche sciences lhumaines tel champs ipluriel3 points peuvent ëên témoigner lés chiffres donnent c'est fomancciers autre conséquence vulgarisation n'est seulement freud l'on traduit c'est aussi jpar éxémple seuléent irelch marcuse lorénz aussh présenta tions résumés conñdensés parfois honorables parfols caricaturaux peu importe besoln succès constituent signe comme aussi îles innombrables volumes conseils d'explications -et recettes pratiques uns autres mmar quent fait qu'un travail autrefois senvé cercles étroits cherl cheurs trouve désormais assez l'accordé mentalité collective pénétrer domaine public claude sigismondi analysés parlent dominique fisher stock 1977 20. roumieux travaille l'asile d'aliénés jou bre bateson perceval d'un schizophrène payot charmes maximtuni stock gallimard 22. flammarion ffachette seuil. dont 800 000 exemp psvchanalvse jjaires l'introduotion vivez trop tendu lnnill vamnal l'elatez-vous méthode.moderne permet d'acquérir week-end technique relaxation simple développer efficacement puissance mentale stress dela vie moderne entame peu peu facultés intellectuelles imémoire concentration intui- lon imagination qualité repos dépendent grande partie dell ac- tivité subconscient pou- voir subconscient peut être facilement stimulé méthodes imentales c'est qu'on appelle dynamique imentale cette méthode enseignée iun week-end cours séminaires alpha pratiquée milliers barticipants depuis ans france suivant cet enseignement pratique eni séminaire découvrirez tout d'abord lun état relaxation physique mentale pourrez reproduire loisir vie quotidienne développer lle plan psycho logique dynamique mentale permettra ensuite d'utiliser niveau conscience mentale particulier .préparer ipsychologiquement situations quotidiènnes difficiles exemple préparer des-examens tâches professionnelles vaincre trac timidité maigrir croître mémoire trouver sornmeil dévéloppér imagination créatrice arrêter furnér contrôler émotions ... lvivre expériences extra-sénsorielles j'après exercicés concentration dé- véloppant concrètement votie iintuition vivrez expériences extra sensorielles étonnantes iprouveront l'existence facultés parapsychologiques insoupçonnéés sommeillent prochains séminaires alpha marsellle paris bordeaux nantes lille strasbourg lyon-st-etienne toulouse belgique bill belléns tél :058-23-43-79 genève suisse documentez-vous retournant bon gratuit ci-dessous bon gratuit retourner axe formation rue deves 92200 neuilly tél 624.33.49 adressez-moi sans engagement l'article psychologie dynamique mentale renseignements séminaires alpha nom ... prénom rub erresersrenenseeneoneerersnees code ... tioieneneur l'ile alpha ville ...
35,36,anerracion henri galleron
36,37,cimustrarion ftenrs galleros bon anniversaire docteur watson david cohen john broadus watson fondateur behaviorisme article psychology the behaviorist views psychologie telle behavioriste voit paru 1913 psychological review considéré comme manifeste behavioriste marquant naissance psychologie scientifique watson psychologie devait être élevée rang science titre physiologie biologie n'avoir aucune connexion conscience elie devait avoir objet d'étude pensées sentiments historiens psycho logie font référence watson comme révolutionnaire renvoyait l'âme métaphysique c'est encore watson l'on doit dit-on transformation psychologie discipline principalement étudiée laboratoire coup premier responsable véritable obsession développée psychologues expériences réalisées rats pensait l'observation l'apprentissage d'un labyrinthe rat pouvait fournr nombreux renseignements loutes autres formes apprentissage effectuées être humain out apprentissage produit conditionnement dée aussi attribué watson repré l'instinct l'hérédité sage sentent rien l'apprentismodele conditionnement peut être guise watson affirmé s'il prenait charge groupe trente enfants composé dix enfants race blanche dix enfants race noire dix entotal bôn stimulus provoquérait invariablement bonne réponse garnement burrhus frederic skinner actuellement grandi behavioriste père spirituel l'on pardonne d'employer terme aussi freudien décrire relation aussi behavioriste john watson aujourd'hui occasion centenaire naissance watson vit jour janvier 1878 moment semble bien choisi examiner travaux d'un œil neuf bien points n'était behavioriste endurci qu'ont décrit historiens psychologie exemple join d'être partisan acharné expériences laboratoire souhaitait psychologie fondée l'observation vie réelle destinée fournir aide pratique individus tout comme société €ensemble plus d'un titre théories beaucoup moins quées thèses défendues parce qu'il évinc milieux psychologiques alors n'avait quarante-deux ans lepère dubehaviorisme moins behavioriste disciples parce qu'il s'attira l'hostilité plus d'un psychologue conservé l'image d'un ibehavioriste très intransigeant watson naquit famille pauvre mère femme très croyante père casanova caroline sud étoffe d'uñ aventurier jeune watson d'aimait beaucoup d'école beaucoup plus doué travaux manuels somme toute adoléscence assez oïisive défaut d'être paisible compagnie d'un atni afnusait tabasser noirs c'était principale distraction quinze ans abandonna passe-tétnps décida moment venu recevoir instruction appropriée parvint persuader dirigeants l'université furman greenville l'accepter comme étudiant réussir tel exploit alors qu'il trop pauvre payer études qu'il mauvais résultats scolaires outre arrêté deux fois police qu'il aussi jeune tenait prodige watson consacra l'étude philosophie psychologie plus tard reprocha rien connaître problèmes philosophiques behaviorisme rejetés pourtant déclaré qu'il s'était fait griffes métaphysique dix-sept ans écrivait longues dissertations problème libre arbitre sait naturellement behaviorisme toujours accusé vo67
37,38,libre arbitre l'université furman celle chicago doctorat ler individu watson quitta rendre sujet l'apprentissage d'un rails education préoccupations peur behavioriste watson contenta consignèr résultats visant mettre évidence temps d'apprentissage d'un labyrinthe rat jivra observation extrêmement détaillée comportement animaux watson nota quels moments rats donnaient signes per plexité décrivit leurs réactions l'un rats essayail grimper barrière l'intérieur jlabyrinthe l'image découragement d'autres mmoments rats tellement désemparés qu'ils s'endormaient faut voir simple observation sentimentale jeune psychologue conscient l'observation détaillée indispensable relater correctement manière dont rats résolvaient différents problèmes contentait noter résultats font bchavioristes modernes débutant l'universite chicago thèse watson bien reçue offrit poste d'assistant psychologie expérimentale l'université chicago poursuivit recherches l'apprentissage labyrinthe commença série d'expériences vision couleur chez animaux cette époque ignorait animaux perception couleur identique celle humains cette idée fut-progressivement admise encore l'étude réalisée watson s'inscrit parfaitement cadre développement behaviorisme revanche paraît beaucoup plus surprenant c'est watson entrepris partir 1906 études l'on doit d'appeler éthologiques cours d'une interview accordée niko tinbergen celui-ci mis évidence problèmes fondamentaux auxquels confrontés éthologues vers fin années 1930 l'observation comportement animaux milieu naturel méthode totalement dénigrée behavioristes américains cette méthode watson pourtant prise compte peut donc refuser titre d'éthologue 1906 watson contacté certain docteur alfred meyer biologie carnegie ndation amé travaill'été docteur d'effectuer centre ricaine comme lait qurant ever propos merches dome l'intéressait particulièrem tson profit carnegie inst rendit epta ren key floride carnegie fnstitute précurseur éthologie surtout deux quest watson voulait approfone 1900 parlait beaucoup prodigieux dont étaien certains animaux exemple cheval dénommé clever hans capable parler russe citer racine d'extraire racines carrées bien étrange éventail talents cette époque fréquemment évoqué problème retour nid oiseaux certaines espèces disait-on capables parcourir plusieurs milliers kilomètres revenir nid cela laissait watson plutôt sceptique aussi décida-t-il d'effectuer expériences deux espèces différentes sternes hirondelles mer fallut abord surmonter quel ques problèrnes techniques n'était mince affaire transporter oiseaux excellente santé floride jusqu new york cela avant développement transports âériéns après quoi watson put effet administrer preuve 6iséaux retournaieñt nid petites îles appe- vers exploits capables lées dry tortugas après avoir par- couru plus quinze cents kilomètres au-dessus l'océan volant au-dessus l'eau oiseaux n'avaient aucun point repère ipossible infirmait l'hypothèse parfois émise qu'ils pouvaient trouver chemin nid grâce acuité visuelle vision nette distance six cents kilomètres nécessaire hirondelles mer apercevoir terre plus proche watson limita cette expérience réalisée conditions encore trop artificielles donner tout autre die mension voulut replacer contexte naturel 1906 1915 passa presque tous îles faire observations détaillées comportement qoeaux milieu naturel spécialistes appel- éthogramme watson nota comportements sexuels oi- seaux méthodes d'édification nids suivit petits décrivit eppemeny décienchant comportement alions sif celles déclenchant comportement défense comment lorsqu'un œuf vservait nid mâle femelle menaçaient d'attaquer oiseau pénétrant tertitor d'autres moments l'approche l'intrus déclenchait bas comportement agressif stimulus provoquait donc toujours réponse après avoir terminé étude lois l'apprentissage chez rat watson entreprit étude étapes développement chez jeune singe écrivit article collaboration karl lashjey premiers mois vie d'ün singe effectuer obserya tions emmena quatre jeunes singes floride bientôt écrivit ami robert yerkes psycho logue yale qu'il émerveillé richesse variété comportements singes sortis conditions artificielles laboratoire remarquablement spontanés watson ajoutait expériences laboratoire parfaitement adaptées l'étude comportement certaines espèces comme rat poulet convenaient beaucoup moins bien mammifères supérieurs c'est partir cette époque jusqu'en 1915 qu'il consacra toute énergie obtenir appuis financiérs nécessaires création d'un ceñtre d'expérimentation permettant d'observer comportement animal nature études oiseaux singés permis watson découvrir iles limites expériences läboratoiré animaux lorsque watson passa psychologie animale psychologie maine n'oublia enseignements qu'il tirés l'observation animaux milieu naturel professeur titulaire baltimore 1908 watson nommé titulaire chaire psychologie l'un versité john-hopkins baltimore n'avait vingtneuf ans l'empêcha dévelop per rapidement remarquable département psychologie pril l'assurance commença exp mer idées psychologie male public avant watson estimait qu'il impossible d'utiliser thodes identiques étudier comportement animal compot tement humain êtres humain
38,39,doués raison âme volonté rence pout william james fondamentale psycholo comprendre courant dessein appliquaient psycho rospective montraient ode cujets carte laquelle ferit chiffre penser new york demarre temps sujets pans invités dire haute voix étaler présentait tour sence c'était idée bizarre one ceux acharnaient dre physique comme modl c'était première fois dernière sychologie tentait singer jque hysiciens venaient tout juste d'établir classification éléments chimiques connaissaient désormais éléments constitutifs matière psychologues aussi efforçaient d'en arriver atomes conscience exemple analyser perception d'une chaise bleue composée treize atomes d'un certain type conscience trois atomes d'un autre type conscience important replacer méthode introspective contexte l'époque watson car aujourd'hui prononçant terme évoquons immédiatement île divan l'analyste groupes rencontre coup duisons qu'en rejetant introspection watson attaquait cette forme d'autorévélation c'est absolument faux méthode introspective appliquée 1900 n'était comparable celle utilisée actuellement sujets contentaient dire entrait sortait conscience pendant qu'ils regardaient chiffre qu'ils pensaient new york malheureusement expériences pratiquées différents sujets n'étaient superposables permettait d'obtenir informations précises quantifiables watson savait bien luimême recours méthodes inlrospectives lorsqu'il étudiant enseigné l'introspection l'université chicago donc parfaitement apte juger väleur constat d'échec l'inlrospection l'amena décréter qpéhavioristes devaient éliminer psychologie écouvert qu'il possible anima apn are comportement ieu nat laboratoire miintros urel sans avoir recours pection ice watson condamna l'in- conscience trospection nait exclusivement vrai plus exclure psycho- liments pensées estimait fai time demander sue primer qu'il pensait qu'il ssentait seulement type questions trés simples n'avait rien voir l'introspection laquelle livraient contemporains watson skinner watson partisan d'une chologie fondée fois périence psyl'ex- érlenc observation détaillée situations .de vie réelle sujet ill intéressant kinner travaux skinner réalisés majeure partie laboratoire conditions strictement contrôlées minutie qualité particulièrement appréciée ibehavioristes fondant expériences conditionnement jes ani maux skinner cessé mainte- nir qu'un conditionnement similaire pouvait induire n'importe quel type conduite cliez êtres humains postulât constituait base deux ouvrages science and human behavior \walden two pôur skkinnér îlà condition humaine ést issue éondition rat côté watson effectua comportement humain partir 1910 plupart études importantes réalisées sujets humains elles montrent variété centres d'intérêt watson certaines d'entre elles révèlent préoccupations surprenantes behavioriste. 1910 watson poursuivit recherches l'apprentissage comme nombreux psychologues après considérait l'apprentissage comme questions fon damentales psychologie vivre c'est apprendre mois adapter watson finit être convaincu l'apprentissage fonction conditionnement tout pouvait résumer conditionnement c'est-à-dire l'entraînement enseignement dont individu l'objet cours peotte conviction conduisit watson encher l'apprentissage chez ner l'enfant l'adulte chez enfant améri1842-1910 philosop nue doreur médecine passionn psy chologie philosophie couple est-il condamne a'etre machine sagrifiant desirs individus inousine voulonsipas.avoir d'apriorisurla question chaque couple estla conjugaison iparticulière.de deux corps.uniques 'de.deux histoiresindividuelles ihnepeutdoncy avoir derrecelte-enicettesmatière silles couples quelque chose commun c'est pressions qu'exerceile socialipour lesimoduler qu'il fautile chercher juillet 1978 cepreg -organiseiune session couple corpsinconscient iparilemoyen dupsychodrame deil'expression corporelle analytique -chacun -enicouple ouinon aurail'occasion deirepérer ettransformer questions vitales tout renseignement adresserau cepreg rue 'brignole-galliéra 92140 clamart tél 642.56.05 savoir exprimer lest moyen plus sûr celui oui -célle désire faire écouter s'ini-i poser toutés circonstances vie sociale privée milieux profes- -sionnels affaires amitiés relations rap- ports familiaux.et affectifs n'être écouté déprime l'puralyse dessert personnalité arrive certainement dire après unentretien n'estipas ainsique j'aurais aborder conversation faire comprendre l'pourtant 'la conversation science règles clés s'acquiert analysant chez grâce cours technique conversation différents problèmes soulevés ïles rapports humains gagnerez quelques mois force persuasion suroren- vous-même cours corres-i pondance traite d'une manière pratique détaillée tous aspects conversation psychologie conversation technique l'élocution pratique contacts humains susciter l'intérêt sympathie l'estime animer diriger conversation langage affaires corres- pondance privée affaires etc demain saurez utiliser toutes ressources parole disposerez meilleurs atouts ceux d'une personne sait parler facilement efficacement documentation gratuite 573 simple demande c.t.c rue collange paris-levallois publioté
39,40,1878 naissance près greenville oline sud parents fermiers 1890 famille watson s'installe greenville 1896 près études moyennes hprson devient assistant chimiste métier qu'il exercera deux ans 1900 étudiant furman university greenville 1903 watson étudient chicago passe neuropsychologie sous direction professeur angell 1904 épouse mary ickes 1906 atson effectue recherches carnegie institute floride 1908 watson nommé titulaire chaire psychologie l'université doctorat étapes d'ure vie baltimore poste jusqu'en 1908-1915 dirige psyg 1911 parution tome premler behavior monographs ronographie comportement 1913 parution l'article psychology the behaviorist views psychologie telle ile behaviorisie voi psychological review crade article behaviorlsme connaît brusquement €ss0r prodigleux etats-unis 1915 watson prés américalne psychologie dirige revue journal experimental psychology jusqu'en 1927 première guerre mondiale interrompt quelque temps activités sert comme major conservera 1920 hologlcal review ident l'association army signal corps 4920-1921 watson colläboratrice rosalle rayner laquelle divorcera second femme ill renvoyé l'université john-hopkins 4924 après lle scandale divorce doit abandonner lonctions devient alors vice-président l'agence publicité thompson 1925 behaviorism 'behaviorisme 4936 quitte l'agence thompson compagnie william esty rédige notes autoblographiques 1946 prend retraite recherches 'en psychologie deviennent seule occupation totalement cessé d'écrire septembre 1958 watson meurt new york conseiis lashley s'intéressa l'apprentissage tir l'arc départ archers débutants effectuaient leurs gestes beaucoup lenteur maladresse saient rater cible meilleur cas planter flèche très loin centre puis très lentement faisaient progrès arrivait moment leurs progrès s'accéléraient atteignaient rapidement palier ensuite pouvaient difficilement réaliser score meilleur suite expériences watson appoïtà collaboration court ouvrage intitulé thoughts education lequel précisait certains apprentissages peuvent pàs s'assimiler celui tir l'arc relation stimulus-réponse l'idée watson l'initiateur fameuse formule s-r stimulus-réponse fait partie légende conditionnement stimulus entraîne invariablement réponse l'expérience pavlov réaction salivation toujours déclenchée sonnerie êtres humains fois l'individu conditionné adopter comportement s'en départ plus banlieusard prend tous jours train ouvrira tous jours journal fera mots croisés vue plat four d'une casserole feu incitera systématiquement embonpoint complexe fait ase n'est tout peñsait watson contraire serñblait perception réaction stimulus dépéndent l'état .de l'organisme watson programma série d'études manière dont l'alcool médicaments fatigue affectent processus d'apprentissage cela précisément dessein savoir comment différents états l'organisme affectent l'équation expérience non publiée watson étudiait effets prise boissons alcoolisées verre whisky ingéré toutes deux heures l'apprentissage d'un sujet voit mal comment quelqu'un convaincu fixité relation pourrait jamais envisager d'effectuer telle étude passage ouvrage psychology from the standpoint behaviorist psychologie point vue d'un behavioriste passage intitulé the determiners âcts déterminants actes watson cite parmi fac- teurs essentiels déterminant ré- ponse éléments suivants situations l'individu affron- ter durant heures précédant in- cidence stimulus auquel doit maintenant réagir tensions émotionnelles activités pré cédentes suscitées ainsi réaction habituelle vue d'un volver posé tiroir sans doute nettoyer l'essuyer temps temps ais quel du'un vient forcèr coffre fort tiroir caisse bouvez ... saisir l'arme autre situation pourriez état très dépressif prendre revolver manipuler l'idée l'uti liser contre watson ajoutait iles facteurs intra-organiques temporaires influencent énormément réactions maladie grande fatigue lassitude interrompent relation invariable fois seulement watson l'occasion d'effectuer expérience destinée vérifier théories ill réussit l'époque prohibition convaincre autorités céder quarante-cinq litres whisky véritable mine d'or pendant seize heures étudia effets l'alcool sujets jouant fléchettes certains sujets jouaient plus plus mal fur mesure qu'ils imbibaient d'alcool chez autres sujets watson nota l'effet inverse plus saoûls mieux jouaient watson envisagea recherches collaboration edward lee thorndike doyen sychologu péricl expédes habl- suivre thorndike 1874-1949 américain mit point rimental étudier formation tudes chez l'animal
