,page,text
52,53,are cocoon loctrvotiote répression font journaux bats féministes sujets succon luttes contracepcèden liberté l'avorte- ion défense homo lexualité l'association féministe choisir animée gisèle .halimi acceptée comme partie civile première fois pro- cès viol décembre 1977. condamnations viol devenues plus lourdes peine prison ferme cinq ans six ans vingt ans vrai dernier cas s'agissait nord-africain victimes ellesmêmes fait appel faveur jugeant condamnation excessive rapport crime passé d'une attitude extrême autre femmes disent elles-mêmes qu'elles n'ont voulu cela devant vingt années prison données assises l'oise février dernier vingt-cinq années celles l'isère mars elles sentent prises piège système judiciaire hier encore sujet interdit nié viol aujourd'hui pris consi- dération société en- semble journées d'information organisées mouvements femmes trois mille femmes val rencontrées thème mutualité paris question judiciaire remis sujet enis médias saisissent sers feon télévisée dossur ccran discute change place publique signe éement mentalité mort labou s'agit d'abord prise conse nscience femmes somme 776 quotidiennes ommes aires pouvoir one prés 1500 plaintes recensées 1974 peu plus 1976. encore 1977. dre naguère elles tai déjà l'anecdote biblique joseph l'un disaitélle tenté vio guise preuve délit dañs cet l'exode violeur lapidé d'aventure réchappait chage condamné payer qu'ils sont. plus plagiant balzac ler aiguille statistiques annoncent ehon globale qombre plaintes enregistrées yument mesure traduit nécessairement augmentation nombre viols montre d'abord mur silence commence rompre femmes osent désormais parler plus ouvertement plain augmen- depuis 1970. saient honteusement l'histoire montre phéno- mene viol toujours existé femme püutiphar dénonçait dés douze fils jacob ier fausse dénonciätion ailleurs puisque n'ayant réussi duire ellé volé chemise autre récit biblique qu'est cinquante pièces d'or proprié taire légitime père bien plus tard l'on pensé devoir dédommager femme semble donc l'inté rêt phénomène viol pre- cède recrudescence alors passe t-il certaine ministère justice n'est exempt genre d'échappa- loires ibien sûr viol problème difficile d'en parler faire part choses entre véritable viol simulation longtemps femmes res- tées muetles proie honte culpabilité silencieuses barce coupables dira michèle solat journaliste monde honte femmes s'enracine teur plus petite enfance peur père peur punition tabou sexe prolonge crainte dénoncer crime compte tenu huriliation qu'elles savent devoir subir sous prétexte consentement obtenu bar force lorsqu'elles font appel procédure judiciaire peut lire prograrñme commun femmes l'enquête moralité déshabille complètement vie pri vée femme subit l'inter- rogatoire dés policiers masgis- trats instructeurs bsychiatre fait enfin procès d'intention moiïiñdre gestes regards vêtéments viendra reprocher s'être lavée après purifier physiquement moralement quelle idée diræton reprochera s'être promenée seule endroit peu fréquenté quelle imprudence image virilité c'est qu'elles ivé hommes èle dira peut enfiqui bouge volonté rappelons clichés îles plus cou rants parlez viol autour enregistrez réactions stéréotypées n'existe femmes violées qu'el bien arrin bien cherché bien femme peut être violée viol veulent l'homme aussi bien femme imprégnés d'une image standardisée véhiculée culture sexualité masculine marquée l'agressivité revanche sexualité féminine doit être passive soumise spécialistes expliquent cette différence fait qu'il équilibre entre sexes faudrait plus femelles mâles femme limitée conception homme non donc fa1 edité grasset
53,54,cacher visage longs cheveux ... procès malaisés aussi procès l'incroyable cest homme bien physiquement por mari père remarquable don vingl camarades promotion venus faire l'éloge accus naît plupart 1emps hasard l'occasion présente c'est raison laquelle lieu fréquemment entre per sonnes classe sociale race aussi milieu familial quant vic time peut avoir douze ans être sénile aucune femme nest l'abri d'une agression sexuelle viol semble être lié rectement pénurie sexuelle l'apparence provocatrice victime contrairement l'idée s'en fait l'opinion publique n'est donc spécialement femme attitude vêlement talement développer chez l'homme esprit compétition conquérir femmes l'inverse femme certaine passivité désir fidélité enfermés démarche culturelle pousse l'agression sexuelle bénigne attouchements subreptices grave viol l'attitude femme consolide malentendu donc tout contribue enfermer femme passivité silence tout pousse homme être convaincu pulsions agressives enracinées code génétique conditionnement culture passe effet volontiers l'explication nature tant femmes n'auront cessé percevoir comme objets passifs sexualité masculine viol perpétuera car devenu lieux l'affrontement jouent fondements civilisation forme patriarcale société homme ordinaire sans maquillage font viopour acte peu ordinaire heurteront plus cas viol miputieuse étude violeur type autant qu'on puisse décrire n'est psychopathe violeurs disent statistiques pervers n'est adolescent délinquant n'est arabe africain seulement viols commis émigrés alors ceux-ci vivent plus souvent grand isolement sexuel c'est homme ordinaire plus souvent français souche procès parole d'une prostituée mise doute plus force parole d'une mère famille cornmé ile fait .de dispo soufiaite donnaït droit conque d'en disposer sans infrac tion gré proclame disponibilité absolue jeune hippy cheveux longs ler revanche elles comportement sexuel habituel ser .de soû corps femme comme jeune fille plusieurs hommes violeur moyen adulte fäire quelque chose 124i majeurs 1468 homrnes l'onine fait d'hâbitude mis cause affaires viol 1975 plupart temps quatre voyous ävaient violé marié père famille ménie grégoire rapporte chronique francesoir femmes écrit affirment avoir violées trois quarts l'ont membre famille père frère beau-père oncle cas niveau tellectuel l'agresseur égal bac d'un niveau supérieur écrit m.-o fargier3 violeur c'est homme l'on croise rue voisin palier père famille honorable commerçant estimé l'étudiant sympa- thique s'ils bonne conscience c'est qu'ils font exprimer conditionnement sexuel imprimé culture mœurs camarade parce qu'ils s'ennuÿyaient faire quelque chose l'on fait d'habitude c'est risquer ment cette merde mouvement choisir entamaient cette occasion février 1977 mineure journal france-soir relaté ainsi faits box accusés quatre jeunes gar- çons dix-sept visiblement n'ont compris arrive pour- quoi après pri- préventive tout avoir voulu simplement s'amuser encore peu aut regarder vérité face soir d'avril 1976 prendre dit benoîte groult l'espace quelques heures fait divers parmi d'autres héros orange mécanique ... modèle confirme cette véri lois tromper ennui sent victime rencontrée pourrait tous semblables choisis- fallait voir cette salle archi- première fille comble metz sourijait rica- nait l'évocation certains détails victime recroqueviller essayer multiplier cas. ennui recherche coup c'est sortir pendant gisèle halimi anne fichot lutte contre viol plaidant pau assises victime l'un d'eux dit violer c'est échapper situation diffici loin femme toujours nét-deux ans d'un coup faire seul bande espoir gagner peu dar gent comme quatre adolescents après l'avoir violée louent quelques poignées francs pourquoi viole-t-on jeu oue cfa leurs cris quotidien tensions ion faire peur femmes roucher s'amuser .de puis prend jeu occa sion hasard fait stop c'est qu'elle cherche quelque chose ... toutes explications jamais rès claires rejoi gnent thèse d'un problème cultu rel c'est l'homme tout temps sollicité l'accouplement poussons théorie peu plus isponible puisqu'elle fait demande aime être forcée ic'est pourquoi dit-on ile viol inscrit l'homme c'est pulsion fondamentale ïles freudiens c'est répression sexuelle cause pourtant paradoxe viol pulsion fondamentale pourquoi est-il universellement condamné cas cependant viol n'est condamnable juridiquement viol feñnme couple n'est retenu mariage vertu obligations qu'il impose époux autorise mari accomplir femme malgré violence l'acte conforme äux fins mariage permet revanche d'obtenir violence relatioñs contre nature viole propriété l'épouse légitirie échappe définition violeur donne fernme l'on demande bourreaux épouse violée assez mots démontrer monstruosité geste jouit l'immunité autres femmes domaine public elles seules crime violenter qu'en conclure femme être elle-même doit être sous pro- tection d'un homme toute vie avoir maître père puis mari souteneur prostituée faut aller jusqu'au bout constat société femme n'est propriétaire corps n'est sujet part entière c'est qu'elle acquiert enfin statut d'être libre voir l'article tahar ben jelloun misère sexuelle travailleurs nord cains psychologie voir fargier viol paris set répertoire pratique dalloz vio gras
54,55,féministes battent particulier contre ent murest viol faut-il comme pré- pie d'instruction faire suit voyager chargé jsiter d'un œil critique a£ons train l'on our repérer j'éventuel vioe jeune fille monte nuit recherche d'une train complet ssleur galant propose con l'avant véhicule one pplément s'installe artiment vide sans aperce coms wagon entier désert voir réleur entre comparû ant jette viole piment tabous vie dure c'est parce tout contribue imposer silence femmes vioées mouvements partis guerre conire viol afin dénoncer comme laspect plus spectaculaire domination l'homme femme viol meilleure caricature au-delà rôles habitudes préjugés discrimination sociale entre sexes partout rue quand quelqu'un permet mettre main fesses dame comme dit couple bureau métro sans coups sans bruits existe chaque fois qu'un corps s'oppose autre corps veulent femmes c'est qu'il reconnaissance publique elles droit disposer corps d'avoir identité elles veulent essayer changer tout persuade femmés destin soumettre nouveau choque morale traditionnelle n'est femmes violées l'on parle ouvertement grelques années grand qu'avec sujets n'étaient abordés sexualité sue allusion tolence délinquance folie tan drogue mainte sexualité publiquement sujet pus encore autres out participait mystère prouche sexe s'inscrit réunit phére sacré viol seu tous tabous viole pouvoir délinquance ormais désir vengeance doma institutions couvrent sion crée commis© violence délinla °mue-ménage con allté faits particuvenaneee 2pports sociaux habitudes font clusion criminelle commis adolescente personne autorité père frère patron ... condamna tion prévue code pénal réclusion perpétuité violeur fonc tionnaire ministre culle connaissant victime lorsque viol commis lusieurs sccompagné violences tor ture passible peine mort forts lequel collectifs écrit onlë monde n'parlera comme propre fille violé sexuelles poire contes retirer réalité revan pris comme cas parti particu- inspire silence arfaitement segr arguments divers êlent lorsqu'il s'agit viol loi justice répression préjugés l'histoire lâctualité psychologie l'ordre social france ila loi viol apparence sévère .et précise c'est crime relevant cour d'assises passible selon article 332 code pénal date 1832 dix vingt ans rési viol deux personnes s'il encore faut-il définir viol cette définition très restrictive intromission foret vagin vict qu'il viol qu'il conformes sous autre tendre création toute autre force pénis ime loi exige donc relations sexuelles nature c'est dire forme qu'elles doivent fin légitime pro violence so- ail sentence quatre homme bucaux défloraison sans phallus 3707 cus viols pudeur ttfés attenlat coups iblesmenace l'ordre social phénomènes superpocises toner lois pré- fais justice frappe défie urement d'autre part tout ition viol donne latitude juge porter faits montrent avoir violé ente trois quarts consen- jeu moins prévenue l'en irois vus incarcérer pendant années deux algériens condamnés vingt ans réclusion 'inelle vaucluse sans motifs verdicl connus revanche jeune femme s'est vue devenir consen- tante d'un jour autre lorsqu'on découvert viôleur n'était autre qu'un personnage bien vue commune viol plus qu'ailleurs dépersonnalisation l'individu corps femme devient entité abstraite dont l'enjeu pose termes portait-elle vê- terments indécents sexy chet- chaitelle plaire était-elle viergé mariée procès verbal police fapporte cette histoire docteur après examen mlle déclare m'avoit jamais viol sernblable vétements n'étaient déchirés soi-disant victime portait aucune marque violence enñ outre mile vêtue d'une mini-jupe outrageusement courte dos d'un blouson lorsqu'elle prise auto stop avoir droit parole face violeur femme doit prouver matérialité faits souffre lésions organiques graves retrouvera face homme bien sûr niera machine judiciaire retourne contre transformant accusée victime devient coupable femme coupable d'être femme mouvement choisir proposé l'affichage public décision justice mairie lieux travail violeur ainsi l'interdiction d'exercer profession quand violeur servi abuser autorité l'efficacité psychologique est-elle meillèure lutte contre viol bien sûr peut réviser lois accrocher écriteau dos bourreau violeur problème plus important c'est profond changement mentalité qu'il faut susciter hélène monneret
55,56,librairie psychologie aventures jungle cérébrale cas doris moshe feldenkrais traduit présenté etienne lalou paris hachette moshe feldenkrais peu connu france seuls quelques initiés s'intéressent malgré parution français livre conscience corps robert laffont 1971 pourtant celui l'on peut considérer comme pape l'antigvmnastique célèbre monde entier particulier etats-unis canada depuis années enseigne centre international recherches théâtrales dirigé peter brook ainsi qu'aux cours internationaux chefs d'orchestre organisés igor markévitch récemment colombie britannique s'est occupé d'un groupe cent vieillards afin aider tirer meilleur profit possible retraite moshe feldenkrais russie vit tel-aviv dirige propre école enseigne l'universilé docieur sciences naturelles l'assistant joliot curie moment déclaration secunde guerré mondiale lança jude france comme fit plus tard grande-bretagne pavs gravement blessé genou cours rencontre football refusa l'intervention chirurgicale imposait fit pari rééduquer luimême c'est ainsi qu'il retrouva non seulement guéri possession d'une méthode tout fait originale façon concevoir rapports entre corps cerveau théorie situe reprendre termes mêmes feldenkrais mi-chemin entre l'in tuition d'aujourd'hui vérité scientilique demaïn pratique feldenkrais utilise deux techniques première intégration fonctionnelle c'est-à-dire manipulation individucile sans recours presque parole seconde conscience mouvement pratique utilisant parole toutes objet donner moyen d'utiliser méthotoutes facultés lieu laisser vie cas sions mmaation groupe deux chacun île diquement tout potentiel faire hasard doris assisior vistrale mise applic première technique condamnée science officielle l'histoire doris histoire réelle c'est celle d'une grande dame soixante ans trouve ibrulalement privée don lire d'écrire matin réveil éprouve dificultés lever constate certaine raideur physique temps qu'un peu lenteur confusion jangage quelques jours plus tard s'aperçoit qu'elle s'exprime plus parfaitement essaie lire lle journal soudain tout trouble mosbe feldenkrais l'intuition vérité comprend bientôt qu'elle sait plus lire écrire transporiée service neurologie zurich diagnostique lésion l'hémisphère gauche cerveau garde près clinique intelligence souffert dort très bien comme fait aucun progrès lecture écriture renvoie chez doris donc condamnée abandonnée science officielle quand j'ai fait connaissance doris écrit feldenkrais dit c'était cas désespéré comme représentais dernier espoir l'ai fait s'allonger table j'ai commencé examiner façon dont remuait tête. ainsi commence l'aventure doris voilà confrontés dès premières lignes mystère dont suivons espoirs échecs effet comme énigme méandres tâtonnements jusqu solution l'énigme cas doris cas bien réel présent policière énigme policière n'était seulement lecture l'écriture allaient mal sens l'espace doris aussi teint comment corriger telle déficience partir quoi faisant quoi conscience corps c'est-à-dire sens mou vement corps façon dont déplaçait l'espace étail défaillante allait donc commen cer restruclurer conscience l'espace avant recréer culté lire d'écrire cet ouvrage participons étape étape récupération doris corps esprit sous forme concrète vécue hisloire doris révèle système pensée ainsi personnalité moshe feldenkrais marie-josé houareau psychiatrie approche thérapeutique schizophrénie l'effort rendre l'autre fou harold searles paris gallimard ouvrages intéressants .uñ titre autre manquent psvchañalyse grands jiivres evanche exceptionnels il'effort rendre l'autre psvchanalvste américain harold scarles ceux grands livres j'entends non seulement ceux modifient durablement regaïd portons sujet ceux interpellent amènent faire travail nous-même ceux reprendre forte expression kafka brisent mer gelée avant tout clinicien hors pair briser mer gelée voilà définit admirablement finalité l'approche thérapeutique schizophrènes telle l'entend telle pratique harold searles résident fois l'intérêt profonde human analyses jamais considère comme différent comme étranger l'autre qu'il plus vulnérable plus démur plus apparemment insense voire plus inquiétant perçoil sympiômes schizo
56,57,débris inertes ifestalion d'un effort inmal ent inconscient libérer qu'il connues dre enfin sotalement engagé lolaent travail thément searles cesse s'in ape motivations admette tiers qu'il cherche aussi yon lui-même cette aide comme part tit enfant abandonné effrayé affamé étonconfus irsuit-il psychothéranant pit attiré travail eute sophrènes car ceux-ci très tendance établir forte l'enfant pacontae ainsi isolé effrayé ent soulager mme pierre fédida note réface searies clinicien air invitant plus juste émotions diverses survem parfois sauvagement cours qune psychothérapie donne entendre mots simples ions humaines haine amour chagrin vengeance mépris adoration estime excelle outre mettre évidence qu'il psychose sans interaction processus inconscients ranger premier rayon bibliothèque concerne folie comme tentative maintenir équilibre sein famille searles extrêmement proche bowen lidz johnson arieti bateson l'une études plus originales livre celle donne titre l'effort rendre autre fou passe revue techniques plus moins conscientes selon cas conduisent meurtre psychique l'autre moyen plus efficace consistant saper confiance victime propres réactions affectives perception réalité extérieure exemple passant sans transition d'un tebistre affectif autre utilisant stratagème prototypique erreur est-à-dire doublem injonction contradictoire propos searles note ironiquedu l'on peut sentir meurtre loi commettre ment physique pratique ucune raison sentir dé- retiendrai désir d'exté rec ncr folic ainsi élimi soi cgard scarles l'amaunles réflexions tude l'enf cette der perturbée c'est amener l'enfant individualité symbiose indis allé équilibre pensable fragile terai-ie ralcrnel paternel ajou- l'effort fou peut êtr rendre l'autre désir également l'effet ésir trouver doucr âme sœur adoucir solitude ins celui supportable rouver gratifications nhérentes mode relat relati biotique sym l'ouvrage sear confidence raconte comment cours études universitaires fait l'expérience d'une angoisse intense qu'il gardé désir comprendre fascination personnalité humaine forces mystérieuses assurent cohérence fonctionnement causent dissolution rendent capable reconstituer poursuivre développement c'est très précisément thème recherches pratique quotidienne chesnut lodge clinique psychothérapique internationalement connue rôle pilote traitement schizophrènes gros livre l'effort rendre l'autre fou excéllemment traduit brigitte bost dorénavant place bibliothèques côtés freud klein winni- cott bettelheim szasz roland jaccard débute essaî oubli suicidaire mémoire sacré pierre chaunu paris calmann-lévy pierre chaunu surtout connu contribution mise pee nouvelles formes nouve conceptions science historique l'un créateurs histoire quantitative monument thèse séville l'atien fait date cette ici pline compétence rête ges synthèse également l'auteur n'êtes l'aise entourage corps groupes vie cepreg travaille depuis dix ans questions fondamentales met œuvre instruments d'analyse fournis psychanalyse l'analyse institutionnelle culturelle 'la bio-énergie cepreg propose paris province sessions expression semaine cinq jours cycles psychodrame sessions expression corpoirelle analytique week-end étargi sessions dynamique groupe semaine cinq jours tout renseignement s'adresser cepreg rue brignole-galliéra 92140 clamart tél :642.56.05 sociétés sophrologie médicale langue française journees internationales association corps vivre journées internationales l'art guerir l'art vivre par-dela techniques four recherche sens mai 1978 casino municipal pau pyrénées-atlantiques france jeurs ouvra rasé lorsqu'il s'agit d'un meurtre plusi moyen age l'eu psychique fin telle somme secretariat ice motivati ent rope classique l'informa- avenue mirabelle 6400 pau fran conduire vations peuv pelle dépassement quelques téléphone 32.902 sonnelle affaiblir l'intégration per c'est pourquoi depuis jux- autrui accroître l'aire commencé j77 processus dissuciés refoulés années fee ouvrages historique® men personnalité bien évidem- taposer ages réflexion l'hismu tiples ouvra part jen
