,page,text
20,21,herr neal panne 1968-1978 bilan sciences humaines psychologie publie numéro cette occasion plusieurs collaborateurs spécialisés analysent 00. numéro tombe dix ans après mai 1968. lignes force l'évolution domaine cours ces.dix dernières années prudents assurés jean chaguiboff réflexion l'évoiution récente psychologie conduit d'emblée faire deux constatations principales première tient l'extrême diversité travaux methodes comme toute science arrivée certain état développement historique psychologie suhdivise domaines spécialisés sein desquels s'effectue préférentiellement telle telle approche auxquels correspond vocabulaire spécifique devient plus plus difficile passer égal bonheur l'étude l'hypnose ce'le mémoire pouvait faire exemple pierre janet l'unité psychologie demeure cependant objet analyser comprendre fonctionnement l'esprit rapport monde lors diversité moyens venir reflète dénominations diverses appliquées ppsychologie sociale physiologique psychanalytique etc seconde constatation tient également fait psycho ogie psychologie déjà nantié diun passé fructuëux découvertes nière fracassänte reméttent cause donnéés acquises rares iles multiples laboratoires nombreux chercheurs travaillent peu partout plänète font avancer science plutôt légers coups pouce bouleversements irrémédiables c'est presque insensiblement pensée transforme savoir s'accumule peu peu anciennes conceptions tombent muent donner panorama s'est passé psychologie cours dix dernières années revient davantage décrire étapes plus récentes d'une évolution retracer série d'événements bruts spectaculaires lois l'apprentissage trait plus souvent souligné développement considérable l'in térêt porté facteurs d'ordre cognitif longtemps négligés raison popularité l'école behavioriste rôle science certes d'expliquer phénomène complexe décomposant schémas plus simples vient cependant moment modèle trop épuré telle fameuse formule s-r watson 1913 fournit plus explication suffisante faits permet cerner plus grande sophistication pensée méthodes psychologiques la- quelle peut-être justement rendue possible l'existence préalable cette volonté simplificatrice l'étude aptitudes intellectuelles perception langage dévedoppant heurte difficultés croissantes résolution desquelles faut improviser nouveau type d'explication piaget bruner chomsky l'origine d'un mouvement apparemment irréversible tieñt compte l'étude comportements d'une activité mentale sujet schématisant sait qu'il passe quelque chose tête êtres l'on observe sait aussi analyse explicative devient plus plus difficile d'ignorer quelque chose récemment certains chercheurs tel t.g bower fait expériences modifient quelque peu conception l'an pouvait avoir stades piagétiens derniers résultats néanmoins remettent cause l'œuvre globale grand psychologue suisse limitent rien portée influence convient signaler toute façon certaines théorles s'opposalent déjà hypothèses piaget notamment celle bruner rôle langage développement aptitudes intellectuelles fait important souligner controverses s'effectuent terrain l'analyse pure simple comportement complète ré23
21,22,cogniflexion processuñ d'ordre cog tif mis jeu mémoire cru pouvoir étu d'ebbinghaus lysée complexes temps avalt long mét odes tériel proposé tout lien fication sait maintenant impossible pensait cernes l'état mécanismes mnémoniques pur retient surtout mois phrases textes cours entiers poursuivre indéfinimen recherches faisant abstraction signification c'était rester coupé réalité assiste ainsi grand développement études mémoire sémantique sait stocké n'est seulement mot c'est sens cela explique également l'essor psycholinguistique carrefour mémoire communication genèse opérations mentales langage toutes activités humaines plus caractéristique joue rôle considérable vie tout individu devient plus plus sujet réflexion recherche psychologue d'aujourd'hui nouvelle vision cerveau exemple toutes tentatives nouvelles débusquer pensée partout trouve fourni psychologues américains premack époux gardner enseignent singes langage gestuel rendre conversations plus faciles réussissent communiquer oue l'on méprenne degré symbolisme d'abstraction possible chez anthropoïdes paraît pouvoir dépasser celui d'un enfant humain deux ans environ néanmoins certain nombre d'opérations mentales qu'on soupçonnait chez animaux ainsi possibles elles fournissent indications précieuses l'acquisition genèse d'aptitudes intellectuelles peut-être après l'ère rat behavioriste assistons-nous l'ère singe cognitiviste outre singes ordinateurs éga lement poussent psychologues approfondir leurs thèmes machines offrent effet modèles fonc- tionnement plus élaborés ceux mécaniques simples posent problèmes souvent relation activités d'ordre logique mémoriel n'hésite sujet appa- rells parler mémoire d'intelli- gence artificielles domaine s'efforcent tracer paral ele entre fonctionnement entaux processus systèmes naturels mp'exe connaission nature encore jours cest milliards hu- plus dernières vise étudier deux hémisphères traitement l'incon david galin formation robert ornstein pau dée d'un cerveau présent l'idée eches partagées certains ent d'activités incombant préfére rtie partie droite d'autres afficile ara che quoiqu'il app éiques résumer deux mois téri tions ensemble fonc eralent l'un autre hémisphère piaget l'origine mouvement différences manifestent entre hommes femmes sujet ensemble faits nombreux déjà collecté permet plus mettre doute l'hypothèse d'une telle asymétrie voit problèmes l'on pose psychologie d'une complexité sans cesse croissante sans doute peut-on permettre grâce corps connaissances déjà constitué affinement méthodologie expérimentale revers progrès réside éparpillement recherches malgré quelques tenta tives particulier celles plu- sieurs soviétiques réhabiliter étude globale l'individu pris contexte social historique cela liaison notion enselence scientifiques conduisent fait travaux plus plus borés domaines plus plus spécialisés désir mieu eparpillement thèmes diversité méthodes hétérogénéité gages approches sycho logie aussi multiples blèmes posés comprendre proun aspect qu'il faut évoquer qu'elle peut revètir vie individus pensée attaché xixe disparaître tab lézardent après autres faites cèdent pla rend compte explicables déterminent origin sorte fatalité inévitapu grand compren s'adapter monde création psycholo oure signe note auss l'appa ondes radiophoniques auditeurs parlent blèmes psychanalyste françoise dolto répond parents l'éducation ques rature tout public abondante questions touchant chologie l'enfant déde psy semble l'on s'interroge soi-même rapports autres lieu privilégié d'une révolution corps sexe ouvrages librairie télévision abondent plient jusqu quand faut remonter trouver époque sujet autant évoqué l'impression l'on cherche rattraper tout retard questions long temps occultées psychologie aider réinsertion cet élément naturel aussi important vie autre signe multiples tion techniques groupe plus classiques plus étonnantes etats-unis surtout l'europe n'en autant épargnée blo-énergie gestalt cri primal analyse transactionnelle rebirthing chaque technique grands prêtres disciples qu'elle initiatrice seulement bénéficiaire d'un tel mouvement psy chologie entre mœurs s0î importance vie dépasse largement ile cadre d'une application ponë tuelle ici comme l'utilisation tests sélection scolaire professionnelle rééducatlon dyslexie puisqu'elle vient jouer rôle l'orlentation pensée voit-on apparaitre exemple nouvelle concepiio notion violence tout tout monde cherche expliquer manque tribunaux pressive société ous ren fondrent veth fictions guest conde dre snoiré voir piaget inhelder intelligence paris p.u.f 1968 noir voir tulving moose nuit tique bulletin psychol®ë spécial 1975 voir miller commit pensée 1975 voir notamment rent psychisme amication tonf iev pate pus editions suc
22,23,"aussi parer d'une violence sourde celle s'exerce l'encontre sala rié exploité chômeur femme l'homosexuel l'immigré.… l'analyse psychologique parfois sauvage ainsi irrémédiablement fait entrée vie soclale d'un autre côté grands problèmes posés monde lors dernières années n'ont laissé psychologues indifférents nombreuses recherches porté l'étude comportements agressifs chez l'homme chez l'animal chez dernier contrairement légende fort répandue comportements révèlent parfois aussi féroces inutiles chez karli strasbourg étudie conduites agressives effectuant série d'expériences rats postule l'intervention nombreux facteurs liés aussi bien l'expérience passée l'état physiologique l'organisme expliquer comportements d'agression destruction l'excitation certaines structures l'encéphale amène modifications comportements psychologie écologique jour étudie comportement l'homme fonction milieu conditions travail préoccupations métaphysiques elles-mêmes continuent trouver écho travers parapsychologie malgré efforts parvient rattacher psychologie traditionnelle dont recoupe aucune interrogations grande théorie comme behaviorisme aujourd'hui symbolisée personne skinner cherche généraliser déductions faites partir résultats expérimentaux situations réellesé l'application plus connue plus discutée prin cipes conditionnement celle train développer manière florissante pays anglosaxons théraple comportementale appelée plus justement modification comportement fait telle méthode néglige pensées sentiments enfouis sujet traiter l'aspect visible comportement choque beaucoup thérepeutes traditionalistes d'inspiration freudienne notamment d'autant plus résultats souvent nets rapides l'état actuel connaissances toutefois difficile savoir laquelle deux techniques comportementale clinique plus sûre parfois relents idéologiques certains thèmes traités provoquent remous débordent largement simple cadre psychologie tourner controverses d'intérêt général c'est cas abondantes prises position qu'ont suscité comparaisons quotient intellectuel encore seulement terre quelle terre genèse d'une aptitude sans référer entre blancs noirs effectuées arthur jensen saurait féliciter publicité faite autour travaux effectués l'hérédité psychologique l'information répandue nombreuses études sérleuses portant génétique comportements iles problèmes intrinsèques statistiques notamment posent tel .domaine ceux-ci généralement restés l'ombre c'est dommage car sempltiernelle opposition inné-acquis apparait comme problématique déjà dépassée certains auteurs s'obstinent calculer pourcentages expliquant part nature part culture intervenant telle telle aptitude conjonction hérédité-environnement probablement combinatoire type multiplicatif plutôt qu'additif l'on saurait concevoir germination d'une plante seulement graine qualité cette graine cette ées rencontres difficile d'expliquer genèse d'une rétéer prendrez l'une l'autre catégorie fac- teurs surtout eur interaction sérieux faudrait être mouche donner panorama complet qu'est psychologie aujourd'hui survoler rapidement choses ïes observer œil imille facettes sent petit face domaine immense désormais rencontrez grâce étude psychologique préalable par- tepaires dont ile caractère l'affectivité ila sexualité compatibles vôtres connaissance aussi développées riques techniques aussi ardente inentation couleurs sous pli neutre soif connaitre reste ccheté rons toujours face mystère mme mile jean chaguiboff prénom adresse lugues préoccupés métaphysique savoir c'est comme accumuler îla chesse quelle fortune touffu äux ramificätions innom brables idées évoquées crest chance fantastique article concernent qué quelques unes mutations 5syshologie monde change éhañgez aussi vot peu recull férà sañs dônte faconcde caange chadbez aussi vole rennes façonide découvrir celle cherapparaître dés évolutions l'on chez vie ignore -éñcore l'avenir peut être l'étude l'homme vait ellé déve lopper tenant davantage compte environnement l'importance appartenance groupe culturel social pourrait être il'étape vers laquelle mène l'étude approfonäle facteurs cognitifs ouoi qu'il réalité vraie échappera toujours accumuler ile parle beaucoup ion depuis :1950 315 articles plus 100 émissions radio t.v livres lifüm -traité progrès scientifique plus extruordinoire temps .dans'le domaine -matiage lire notamment vers uno civilisation couple jestel 'préfuce louis armand deil'acudémie française toutes librairies l'on amasse peut jamais tout acquérir aussi loin qu'aille progrès rencontre sous jours deviennent compétences théo- envoyez-moi gratuitement docus cela veut dire parapsyche nécessairement pur essence voir b.f. skinner par-delà liberté ion france ruo saint-lazaro dignité paris robert lulfunt 1972 voir seron lambert van der linden modification comportement bruxelles dessurt marduga 1977 voir h.j eysenck l'indgalité l'honmu paris copernic 1977 voir carlier roubertuux gündtique comvortement paris masson 1976 10. voir gobard l'aliénation linguistique paris flammarion 1976 75009 paris tél 526.70.05 ion rhone-alpes psr23 avonue cketoliur 69003 lyon tôl. 54.25.44 cours borrial 38000 grenoble tèl 44,19.61 lgique psb mue marché-aux- blo 1000 bruxelles téléphone 74.30. ion suisse pss rue lyon 1209 geneve tél 022.45,72.60. mie ess sti"
23,24,qu'est-ce changé psycho durant dix dernières ann répondre cette question off per susciter l'embarras effet peut défendre fols l'impression psychiatrie ins tionnellc coercitive subi redou tables assauts tant théoriques pratiques qu'en temps système folie-exclusion-enfermement tend reproduire sous déguisements divers non moins redoutable persistance certes livres films émissions télévision sensibilisé l'opinion publique problème droits malades mentaux tout insistant complexité richesse vie intérieure certes n'est indifférent l'œuvre bruno bettelheim ainsi émissions télévision consacra daniel karlin connu grandi retentissement n'est indifférent non plus qu'après magistrale histoire folie l'âge classique michel foucault plon 1961 travaux thomas szasz critique plus informé temps plus acerbe psychlatrie insti tutionnelle enfin traduits france chez payot p.uf. comment féliciter aussi réussite d'une expérience comme celle bonneuil menée maud mannoni robert lefort comment réjouir l'attention prêtée démarche politique basaglia jervis italie l'essaimement free clinics etats-unis encore tentatives dés antipsychiatres britanniques laing cooper esterson créer lieux d'accueil folie bref semblerait assisté durant dix dernières années processus démédicalisation folie aussi blen d'ailleurs l'intérieur l'institution psychiatrique conscience médecins cela dit pressons-nous d'ajouter c'était cas problème folle resterait entier poserait plus pressante jamais question qu'en faire sensibilité nouvelle succès films comme vol dessus d'un nid coucou milos forman femme sous fluence john casavettes men citer deux témoigne éga- lement d'une sensibilité nouvelle conditions jamais vaurai nées dix dernières maladie men autant mythe réalité implications norme rapports également pli unes psychiatres ébran ditiques émises contre urement médicale voire dique pdes troubles compo tournés psychanalyse revue trouver loto être niquer leurs patl d'ailleurs toujours bien hèrs- l'on peut distribuer 1psy rouge oucault uni travail inagistral ples comme médicaments psychanälyse l'hôpital psychia trique avest plus souvent qu'un .alibi point précis auteur comme harold searlesi suite grandement amener partager l'univers intérieur schizophrène n'est bien sûr possible d'éva luer effets mouvement anti psychiatrique autant qua lificatif désigne encore quelque chose précis pourra produire l'ave- nir tort cependant avis d'être trop optimiste effet psychiatrie médicale traditionnelle constamment banc accusés n'en demeure moins cest snselgnée universités bénéficie deniers publics jouit solli citude pouvoirs politique 8pparait d'une certai forte jamais christian delacampa tion support advient jour place outre sectorisation manière plus comme waterloo psychlate médicale comment lipharmaceutique appuie psychiatre tentative ouen d'ailleurs bruno bettelheim dit choses essentielles contribuant l'observe gne dispari hospitalier nullement contraire l'événemen mettra révéler vral nature pouvoir médical soutenue effet toute médecine rellgios voir sociétés modernes tend diffuser tous société tous vie fonctionner îleuy permanente continue manthy quasi automatique mme qutre cela puissante voire éffore s'imposer comme vrai île prestige iles pouve ecin ment être inquiet com assiste recrudescence rations cerveau lobotomie opé traiter névroses obsesslonnel qur juguler l'agressivité viants politiques inon comment frémir lorsqu'on assiste tration chimique pervers seu îles iprisons allemandes peu propos vient demand s'il n'en ila psychiatrie comme socialisme tous deux iprétenden œuvrer ile 'bien sujet collectivité légitimés science n'auraient guère noue proposer deux formes ide ibaibarie plutôt survolèr trop succiñcte ment l'histoire ipsychiätrle .et l'antipsychlatrié durant cette dernière deux trois poiñts lesquels porté réquisitoires contre psy chlatrie médicale ainsi il'eñjeu ral politique ide controverses dot tout porte croire qu'ellés prêtes s'éteindre paräphrasant clemenceau prôfesseur psychiatrie ajuriaguerra mondialement connu déclarait jour guerre iune chose trop sérieuse ila laisser entre îles mains militaires crois .que vie uné chose trop sérieuse lalsser seulement mains psy chiatres cette formule ipourralt êlte reprise compte tous ceux réclament d'une manière d'une autre courant antipsyeh après cette courageuse claration principe ajurlagl® lire d'article sychologle pis mousseau thomas szasz roland jaccard paru l'entretien jacques psychologie l'artitlè ronald laing lire fogie simon monneret paru speo coli l'entretien david cohen notamil psychanalyste américain auteur cor d'un livre schizophrénie rendre l'autre fou paris gallima roppréss delacampagne figures aris p.u.f. 1977 lire dossier psveho paru psvehologie rune
24,25,apprenant mieux connaître pouvez transformer vie parfois sans raison déprimé angoissé injustement agressif égard'de proches n'arrivez comprendre pourquoi savez-vous cause profonde réactions trouve peut-être sonorigine conflit lointain souveniroublié petite enfance c'est révèle premier livre cette collection l'œdipe complexe universel. invitant mieux voir clair sentiments plus intimes aide prendre enfin conscience richesses personnalité secrète mieux exploiter chances réussite bonheur n'avez-vous tout gagner complexes obsessions fantasmes désirs inconscients voici lapremièrefois grands lapsychanalyse parlent-votre langage tous noms célèbres ila psychanalyse sontprésentsidans cette collectionexceptionnelle freud\bien sûr maisaussises-disciples plus réputés 'ferenczi abraham jones mélanie klein reich .etc serezsurpris l'aisance laquelle allez pouvoir aborder leursitextesles plus-significatifs iis sontyroupésithèmeparthèmertvous yitrou verez enfinlesiréponses concrètes ädesque tions voustouélent près comme païvenir àäplus d'harmonie vie couple comment mielix aiderses énfants acoinént établir rneil jeursrappoñrtsavec somemourageprofession neli 'etc etc uñe aventure exaltañté énrichissañte vousiétésconvié avecivotrel volumevous recevrez cadeaulexclusif réservé souscripteurs uneimédaidtefrappée pancéffigiede rreud sanne rate iécœdire meet ccr obert enfin expliquées commentées manière passionnante mois ouvrages abondammentillustrés direliured'unibleu profondipleinskiver texdoréäll'or fin format:15 5x24cm ia'lesiprincipaux texteside freud-et disciples titre'personnel examen gratuit recevrai.ainsi examen jours volume ide grandes découvertes ide anal accompagné imédaille-cadeau rés réservée souscüpieurs oisi cet'examénim convaincu gardérai woluïne êtile régléraiendeux meénsualités seulement païticipation ifrais-d'envoi jerecevraialors rythme d'untometousiles deux mois lles d'autres volumes cette col lection mêmes cônditionsexceptionneiles gbien entendu premier volume décevait attente vous'le-renverrais-dansiles 110 jours avecile.cadeau sans rienipayèr devoir sclonitanif desipostes ux-de taxes vigueur 1.3.78. il086afhwi nom 1majuscules iprénom eee adresse complète code postal vilte signature indispensable tous mineurs signature desiparents retourner dès aujourd'hui éditions robert laffont b.p -95112 sannois cedex seine b'875 prix total 960 port taxes compris
25,26,tâche propre d'agir grand logie symptomato ceux idité non-réverde souffrance rigi slour d'absence nouveau jus fait l'intervention spéciale l'expert formé discipline vie cales invité intervenir ffrance sujet souffrant colt cet éternel alibi sans fait moindre allusion désire-t-il non être pris charge sans non plus ere moindre allusion faite carac partiel arbitraire idéologique tout dire d'une approche individualise trouble l'envisage sous angle médical fait s'il fallait résumer quelques lignes l'acquis majeur durant dix dernières années partisans d'une psychiatrie différente domaine éminemment passionnel concessions mutuelles tenants l'organogenèse psycho sociogenèse pure forme dirais ceci qu'ils appartiennent groupe palo alto mouvement antipsychiatrique anglais l'ecole freudienne plupart spécialistes s'accordent reconnaître îles causes désordres psychiques situées sujet dénoncent conception traditionnelle selon laquelle trouble renvoie personne malade double contrainte double bind'- batesont discours familial tel qu'il démonté laing esterson discours l'autre selon lacan centrent l'attention l'extériorité sujet celui-ci conçu comme lieu d'un discours étranger ajoutail chiatre combat idéologique outre également remis cause c'est l'acte d'étiqueter sujet dérange et/ou diffère quête savoir psychiatre explique lgor caruso jadis semblable celle zoolcgue élle s'efface jourd'hui derrière l'indéfinition partenaire cet égard devenus plus plus attentifs fait dès moment patient trouve classé nosographie quitte position sujet l'on parle devenir l'objet dont parle dont dispose pourrait ici tracer parallèle instructif zoclogue mesure devenu étho- lcgue l'animal n'est plus simple sujet d'observation car fait partie d'un champ commun soumis règles relation sujet-chiet plus plus psychiatres prennent ponscience l'observation psychoimplique mer portement social l'observalane the réciproque entre cbjet obser vatlon bref éch poser ange ière plus dix dernières idéologique bat faveur jenfant parent lle criminel tient juges jent alade fiental n'appartient psychiatre trer séduire c'est sous prétexte quelque térieux nature île toute façon cet vrai l'on trop'ten traiter taux comme comme trait 'mmystres part égaux tière ras dép photaidorka sre szasz plus catégorique comme êtrés incomplets c'est-à- dire ravalés l'état choses possède moment-là liinhumain apparaît aussi bien chez ipossédé chez ile possédant propos comme note szasz comment être sensible psychiatrie coercitive effets d'une rares lois rapports humains loi veut non seulement ceux souitrir dune autorité arbitraire également ceux l'exercent deviennent étrangers autres donc déshumanisés effet l'opprimé tend transformer objet passif l'oppresseur per- sonnage divin mégalomane lorsque premier rend compte qu'il n'est qu'un semblant dieu aboutit plus souvent violence explosive victime cherchant venger hôpitaux-prisons bilan dix ann fâcheusement mention n'était faite l'internement pale encore droits criminels gros faire tique quotidienne appartient femme n'appar- eur souveraineté l'état choses. malades men- sons dissidents .jes pays totalltaires lièrement urss cariceturale cette pratile selon certains tions psychiatrie ncipales qu'elle s'exerce szatitütlon écrit hôpitaux nat camps prisonnt matt guerres civiles larvées nlérs cela pondre qu'un abime chiatrie soviétique respond pays démbe cor cet abime existe latlques psychiatres c'est quil existe n'importe tien fait subit tique fait ter manière iles subit occidentales iles régimes gouvernent venaient durci porte croire 1psychiatrl aussi durcirait jusqu verner qu'il s'en faudrait d'une différence ide degré non manqué sparait psy nature transformer d'opinion folie hhônitass succursales iprisons ipropos 1ngtons encre certain nombre ipsychiatres songe notamment loger gentis france peter breggin tas unis dénoncé torture propre c'est-àsdire naissance nouvelles formes coercition don caractéristique principale tient fait qu'elles s'attaquent l'esprit sujet qu'elles laissent ipas peu traces qu'ellés sémblent morale menñt justifiées mesure où.élles appliquées médecins psychiatres dés psychôlogues doxälement d'aillèurs coercltions religieuse militairé sociale lés diverses formes col niälisme semblent aujourd'iui condamnables ila coercition médicale thérapeutique ileur succédé jouit d'un consensus quasi général c'est cette dernière fondée science qu'elle gens procurer santé part quél ques intellectuels iconoclastss irresponsables oseralt déboulonn deux idoles l'homme modernité déclaration d'hawaïli concernant problème slgne psychiatrisés convient ternés ler france charte pau der rappeler l'occasion chat nier congrès mondial article gregory bateson michael freeman psycho tee jacques lacan lire akoun psychologie malodie nusographie description deben crait sujet lire l'article psvchologie
