,page,text
35,36,init dit actuellement etats-unis l'hypnose intimement lée psychiatrie médecine cesse faire preuve utilité tant qu'instrument lutte contre douleur peur toutes sortes désordres physiques l'amerlcan society clinical hypnosis fondée 1957 vingt professionnels plus tard groupe composait 1060 membres aujourd'hui compte 600. cependant hommes science encore mis d'accord dire qu'est l'hypnose existe aujourd'hui deux groupes professionnels the amerlcan soclety for clinical hypnosis déjà mentlonnée society for clinical and experimental hypnosls 1956 l'american medical assoclation déclara l'hypnose thérapeutique parallèle valeur signlilait l'hypnose étalt enfin devenue outil sérieux sclence médicale bienfaits l'hypnose mals quelles circonstances falt-on appel l'hypnose besoin peut peut tirer bénéflce l'une principales utilisations l'hypnose jours objet calmer douleur interventions chirurgicales graves comme l'amputation d'une jambe pratiquées sous hypnose cette pratique peu courante l'hypnose plus souvent utilisée cas partlcullers exemple accouchements douleur liée peur d'autres causes d'origine psychologique l'hypnose s'est également révélée fort utile chlrurgle dentalre patlents vue bruit roulette terriflalent l'hypnose peut encore soulager douleurs physiques chronlques malades souffrant déplacement disques vertébraux cancer d'arthrite constatent anesthésiants sans effet préfèrent avoir recourir abus narcotiques intervention chirurgicale calmer douleur l'hypnose recours peu coûteux sans risque c'est alnsl l'hypnose utilisée plus moltié malades walter reed army medical clinle parmi hôpitaux proposent cette thérapeutique contre douleur peut citer nee née l'hvpmose etats-unis columblan presbyterlan new york écoles médecine harvard stanford l'université new york accéder l'inconsclent l'hypnose peut fort rarement guérir maladie provoque douleur falt peut qu'altérer perception malade douleur douleur compose deux sortes signaux confondent sensation physique enregistrée cerveau réaction psychologique cette sensation l'angolsse peut exagérer douleur l'hypnose permet certains cas réduire cette angoisse faire reculer seuil réaction douleur aïlnsl l'hypnose peut-elle être utile tous cas tension l'angoisse part importante comme allergies l'hypertension collte l'eczéma l'impulssance frigidité l'asthme migraines l'insomnle l'obésité problèmes liés menstruation fatigue n'en citer quelques-uns mails c'est certalnement psychothérapie l'hypnose permet d'obtenir plus résultats nombreux thérapeutes maladies mentales traditlonnels l'utiliseront jamals mals d'autres considèrent comme partle intégrante technique analytique lewls wolberg analyste new york auteur plusieurs ouvrages l'hypnose estime qu'elle peut alder utilement certains patients passer psychanalyse cas existe blocage part exemple lorsqu'un patient incapable falre l'assoclation libre l'hypnose lul permet d'accéder inconscient bon nombre thérapeutes proches analystes pensent l'hypnose excellent outil déceler certains symptômes psychologiques avantage appréclable malades nécessitent soins rapides thérapeutes comportement exemple utilisent parfois l'hypnose détendre leurs patients alder relaxer l'hypnose utillsée seule cependant insuffisant cette méthode plus souvent employée conjointement d'autres thérapies mélange chacun cas dépendant formation thérapeute besoins patlent daniel goleman spéclallsé chacun hémisphères cérébraux présent acquis majorité cas l'hémisphère gauche contrôle partie droite corps siège d'activités ratlonnelles logiques analytiques droit contrôle partle gauche plutôt dévolu syn- thèse l'imagination observa- tlons peu surprenantes faites montrent qu'au moment cher- chent réponse certaines questlons sujets tendance tourner yeux manière quasl systématique solt vers droite solt vers gauche sulvant individus inté- resse lei c'est expérlences sélectionnés patlents hautement hypnotisables d'autres très peu hypnotisables premiers regardent vers gauche sup- pose activité plus grande l'hé- misphère droit alors seconds regardent vers droite l'hémisphère gauche seralt cas davantage sollicité tels résultats donc parfaitement accord l'on connaît maintenant nature l'hypnose conscience nouveau centre psychologie toutefois trouvons ici face d'un domaine recherches apparemment font commencer moyens d'investigation limités d'autres données viennent apporter l'image d'une réalité singu- lièrement plus complexe effet l'on tlent compte sexe dominance latérale gaucher droi- tier s'aperçoit corréla- tions entre hypnotisabilité sens regard deviennent faibles contra- dictoires trouve hommes droitiers regardent systématiquement plus vers gauche lorsqu'ils plus hypnotisables déjà beaucoup moins évident gauchers s'inverse complètement femmes droitières elles plus elles hypnotisables plus elles vont diri- ger regard vers drolte ré- ponse question demande ré- flexion trouve ici présence d'un problème reste élucider montre qu'en cette matière peut asséner vérités monolithi- ques définitives surtout l'état actuel connaissances coucou revollàl après demi- slècle behavlorisme s'est effor- d'éliminer notion consclence toute recherche toute réflexion psychologique volt réapparaître toutes parts slmple schéma stimulus-réponse devalt expliquer toutes conduites sétant révélé depuls fort longtemps déjà trop simpliste l'une caractéristiques essen- telles l'expérience hypnotique c'es
36,37,"van meuf justement vécu subjectif sujet décrit comportement comme quelque chose apparaît non comme quelque chose qu'il détermine lul-même très nombreux cas c'est seule différence existe entre sltuation d'un sujet réellement hypnotisé celle d'un sujet feint seulement d'être hypnotisé agit conformément instructions données fait assez difficile tenter expériences permettent montrer manière behavioriste différence objective entre comportements d'un vral d'un faux hypnotisé sans référer relation verbale qu'ils peuvent faire leurs propres réactions expériences existent cependant quelques-unes racontées cours cet article l'on veut étudier l'hypnose faut donc bien référer conscience d'autant plus l'hypnose peut définir justement comme sorte modification l'état conscience observation plus spectaculaires peut être obtenue sujets très hautement hypnotisables sous suggestion analgésique effet certains patlents alors qu'ils main gauche plongée l'eau glacée stimulus douloureux qu'ils déclarent verbalement rien sentir écrivent fait main droite sulte suggestion d'écriture automatique sensations douloureuses liées stimulus dissimule généralement main drolte qu'elle écrit sous boîte éviter interférences chercheurs étudié phénomène décrivent employant dénomination observateur caché c'est comme partie sujet ressentalt effectivement douleur alors qu'une autre partie restait insensible cela peu difficile admettre cherche concilier phénomène conceptions habituelles conscience cadre parfaltement d'autres observations faltes l'hypnose tel cas l'hypnotisé évite chaise qu'il déclare voir salt aussi certains stimui influence comportement alors qu'on endormi rare qu'on tombe lit l'on bouge beaucoup tout dormant évite dépasser bord dire cette expérience sous anesthésie opératoire patients entendu bande magnétique quarante-trois d'entre suggérait prompt rétablissement trente-huit autres diffusalt simplement musique sllence premiers quitté l'hôpital après moyenne 8,63 jours seconds après 11,05 jours seulement tels falts illés sommeil l'hypnose révèlent morcellement conscience amènent révlser conception qu'on pouvait avoir celle-ci peut-être mieux comprendre mécanismes l'état hypnotique qu'on appelle parfois sommeil hypnotique possède fait caractéristiques décelables l'électro-encéphalographie distingue complètement sommell normal aussi l'état vellle comment falt- parmi tous bruits annonces d'un aéroport auxquels prête guère attention subltement perçoive clairement nom lorsqu'il appelé hilgard dont livre question vient d'être publié récemment etats-unis décrit conscience comme réalité multiple composée d'éléments juxtaposés interviennent plus moins d'importance comportement sulvant cas voit l'hypnotisme comme induction établissant barrières déterminent cet état particulier conscience. certalns auteurs rapproché relation hypnotisé-hypnotiseur relation patient-thérapeute deux cas trouve situation quelqu'un détient savoir sinon pouvoir l'autre tient état relative dépendance mécanismes bien connus produisent alors qu'on qualifle généralement 1de transfert difficile décrire exactement quoi consistent mécanismes parle souvent sujet régression transfert approche expérimentale expérience montré l'existence d'un transfert moins d'un certain désir plaire l'hypnotiseur situation hypnotique sous hypnose peut suggérer quelqu'un d'effectuer certaine action comme gratter l'oreille lever bras chaque fois qu'un certain mot clé prononcé cette réaction mot clé produit jusqu l'hypnotiseur annule suggestion cours cette expérience utilisé sujets instrults préalable mécanismes hypnotiques dont certains hypnotisables d'autres devaient jouer rôle simulateurs moment donné vers fin séance l'expérimentateur annonçait qu'il point d'annuler suggestion qu'il donnée antérieurement lever bras l'énoncé tel mot clé puls continuant parler utilisait incidemment mot clé choix posait donc patlents entre qu'ils savaient l'intention l'hypnotiseur avalt décidé d'annuler suggestion fait suggestion n'avalt encore annulée manière effective face cette alternative seuls simulateurs lèvent bras vrais hypnotisés conforment volonté l'hypno- l'énoncé tiseur malgré caractère seulement implicite celle-ci ainsi comportement l'hypnotisé est-il doué d'une certalne plasticité n'est réponse purement mécanique suggestion donnée inclut semble-t-il donnée plus fine propre situation telle relation l'hypnotiseur cependant suite cette expérlence peut conclure transfert c'est cause transe hypnotique résultats expérimentaux montrent jusqu présent qu'on s'achemine vers confirmation explications psychanalytiques l'hypnose psychosomatique l'hypnose confirme n'est plus possible aujourd'hui d'ignorer l'influence qu'exerce psychique corporel domaine comme d'autres l'hypnose fait miracles cependant efficacité très probante certains cas vient confirmer qu'on savait rapports entre mental certaines altérations cutanées vasculaires respiratoires suggestion hypnotique permis guérir asthmatiques soulager maux tête freiner hémorragles notamment cas d'une opération dentaire faite hémophile encore faire disparaître verrues l'effet l'hypnose indéniable faut souligner qu'il n'est cependant systématique traitement hypnotique réduit tour passe-passe après lequel patient s'en retourne chez lul immédiatement qguéri généralement constitué plusieurs séances n'est effectif tous cas autre preuve l'hypnose n'est phénomène caractère magique semblables effets peuvent être obtenus dehors d'elle exemple sujets dont deux mains atteintes d'éruptions verrues traitées rayons sans qu'ils s'en doutent main seulement leurs deux mains guérir temps comme volt l'hypnose plus moyen permet certains mécanismes mettre place substitue ceux-ci jean chaguiboff l'auteur tlent remercier michel sabourin professeur l'université montréal chercheur spécialiste problèmes d'hypnose aldé consells mis disposition documentation précieuse permettant rédaction cet article"
37,38,mecs utetetiteteteteunt pisar aud leo murs rss lus uouwss loqoh z1oy2p vou jnap0op xn2p 2ab sue 42h 210j210qe jou ver uawuii2dx2 huzuo maire nerpen ntspacaueurr rar drenreeutetat atatalie
38,39,robert grossman ssl denaviorisie tort préférer punition récompense comme méthode gouvernement burrhus skinner behaviorisme règne encore l'amérique b.f. skinner repris flambeau allumé début siècle watson reste actif écouté bien qu'officiellement retraite depuis livre par-delà liberté dignité paru france chez robert laffont étendu réflexion l'application travaux politique gouvernement hommes texte publions illustre cette extension cependant etats-unis réaction amorcée depuis dix ans accuse réductionnisme écoles behavioriste néo-behavioriste c'est pourquoi suite l'article b.f. skinner publions étude mouvement psychologie humaniste lancé abraham maslow fin années 1960. j.m ————————————————— ———— ——————— cette nation providence divine renalsse liberté contrôle peuple peuple peuple disparaisse terre est-ce d'abraham lincoln exactement lincoln dit gouvernement peuple non contrôle peuple différence entre deux concepts jadis gouverner signiflait simplement guider mails terme progressivement acquis sens plus fort gouvernements imposent l'obéissance l'autorité d'autres termes exercent répression gens punissant lorsqu'ils conduisent mal retirant menace punition lorsqu'ils conduisent bien quand gouvernement trop répressif tente soustraire contrainte bien cherche l'attaquer l'affalblir divers moyens violence terrorisme manifestations grèves révolution crée ainsi opposition reconnue pouvoir punition lorsqu'une forme d'équilibre attelnte parle alors d'un gourvernement consensus gouvernés terme consensus marque limite au-delà laquelle l'autorité peut plus imposer l'obéissance faut noter cette opposition tout comme contrôle répressive l'intérêt présumé d'un gouvernement peuple vient fait peuple gouverne lui-même usera parcimonie mesures répressives pourquoi gouvernements limitent-ils contrôle répressif pourquoi n'utilisent-ls renforcement positif être moins précis récompenses plusieurs d'entre pourtant moyens puisqu'ils possibilité pourvoir besoins autant punir renforcement négatif punition comportent sérieux inconvénients qu'il convient d'examiner détail car l'heure actuelle notion démocratie tant qu'éthique gouvernement perd prestige reste plus aujourd'hui quelques démocraties véritables travers monde encore n'est plus semble-t-il très longtemps quant pays voie développement tendent adopter systèmes exigeant l'obéissance l'autorité traduit dictature militaire partout démocratie perd terrain est-il encore temps sauver préserver qu'elle réalisé plus valable faire supplémentaire avant avantages renforcement positif pourrait dire type tentative déjà réalisé quand l'etat devient l'etat providence gouvernement américain préoccupe autant pourvoir besoins citoyens supprimer causes peur efforts falts domaine santé l'enselgnement politique sociale meilleure preuve matière grande-bretagne pays scandinaves évidemment beaucoup plus loin encore pays communistes théorie tout moins renforcement positif tout cela l'etat acquiert blens consommation sytème d'imposition renforcé amendes politique rendement travail s'il distribue biens selon besoins c'est éviter revendications consommateurs donc aucun cas utilise comme agents renforçants simple souci d'apaisement pays préoccupation majeure développement d'une politique sociale continuent user mesures répressives certain pays communistes encore recours très fortes sanctions apparaît donc systèmes gouvernement négligé jusqu'ici élément essentiel île renforcement positif celui-ci l'avantage d'éviter effets secondaires fois suppression d'agressivité contenus punition également dépourvu effets provoqués renforcement négatif c'est-à-dire l'anxiété peur l'utilisation renforcement positif doit conduire citoyens participer activement vie sociale plus être sujets l'ennui dépression lorsque comportement positivement renforcé sentons heureux vivre parce nouveau aimons faisons voilà bien l'un objec1 n.d.l.r france aussi notamment domaine sécurité sociale aide chômeurs etc
39,40,tifs vers lequel devraient tendre tous efforts d'un gouvernement peuple mals cet objectif peut au- cun moment être attelnt cadre d'un système gouvernemental contente d'imposer l'obélssance question savoir 'll peut sérieu- sement être inscrit programme d'un gouvernement démocratique faut d'abord examiner deux pro- blèmes fondamentaux auxquels heur- tent actuellement tous systèmes gouvernement sans exception l'étude problèmes bien place ici puisqu'ils créés l'on peut considérer comme deux plus grandes réussites d'un mode vie démocratique outre pro- duit structures comportementales base analysons réac- tions individus renforcement po- sitif renforcement négatif conduit respectivement l'établisse- ment droits liberté quête bonheur elles aussi engendré sérieux problèmes processus aussi essentiel soitil survie d'une espèce peut devenir pro- blématique carrément néfaste lors- milieu subit modifications c'est précisément s'est passé renforcement positif ren- forcement négatif processus d'adaptation comportements conditions mi- lieu valeur survie absolu- ment évidente importance s'estompe sein d'un milieu dit civilisé peuvent deve- nir destructeurs exemple toute technologie perfectionnée mise point améliorer conditions travail supprimer ris- ques détérioration l'homme voilà maintenant cette technologie mise service futilités telles recherche d'un confort superflu non seulement souffrons plus froid chaleur parvenus réduire l'écart température appar- tements non seulement travalllons plus jusqu l'épuisement fleurs expe liances lieu dsns \abo j'ai sacré daubt cea ascenseurs place bons vieux escallers ouvrir fenêtres voiture n'avons plus appuyer bouton faute trouver substituts accenturer capacité résis- tance devenons vulnérables agressions environnement laissons influencer personnalités plus fortes nôtre l'archétype l'homme civilisé contre barbare améliorations n'ont rien vital impliquent outre effort financier supplémentaire contribuables moins favorisés plus peuvent profiter cette technologie liberté peut tuer libertés parallèle social encore beaucoup plus essentiel personne songerait contester légitimité lutte liberté engagée depuis siècles terme laquelle peuples affranchis joug l'oppression processus d'établissement droits vie liberté atteint tel degré plus infime violation droit liberté individueile énergiquement dénoncée gens re- vendiquent droit faire tout plaît perdre fortune jeu risquer vie plutôt d'attacher ceinture sécurité abuser boissons alcooliques point mettre santé danger tenir aucun compte problèmes pollution augmenter pouvoir d'achat sans soucier conséquences économiques étudiants rejettent désormais principe examens refusent cours magistraux gens problèmes doivent trouver eux-mêmes solution leurs difficultés plutôt recevoir conseils milleux professionnels financiers prône laisser-faire encore modestes libertés indi- viduelles coûtent très cher socié- car c'est tout entière subit conduire aämoins jeterles vigux papiers corballgg conséquences l'attitude permis- sive certains membres bref monde changé processus permis affranchir systèmes répression commencent retourner contre pulsqu'ils mettent danger culture peut- être survivance l'espèce humaine processus renforcement positif connu déviation peu près comparable technologie n'est plus mise service l'amélloration conditions travail désormais employée produire biens consommation faisant office d'agents renforçants l'on prend garde cela mènera tôt tard l'épuisement réserves mondiales l'autre inconvé- nient très grave provoqué ren- forcement positif réside accrois- sement inégalités d'une part amélioration pouvoir d'achat d'autre part plus grande pauvreté lorsque citoyens plus défavori- sés deviennent assez nombreux faire entendre voix réclamer leurs droits consent céder part richesses cela fait qu'aggraver situation puisqu'on débouche politique complète prise charge sociale voilà donc deux problèmes fond auxquels confrontés gou- vernements modernes entre liberté despotisme entre l'alsance maté- rlelle pauvreté existe point d'équilibre comment l'atteindre solution plus communément pré- conisée fait nouveau intervenir contrôle répressif faut appliquer lois réduire pouvoir d'achat accroître rendement donc d'alternative non punitive est-il absolument impossible d'envisager société laquelle relations entre individus harmonieuses taux natalité stable poli- tique sauvegarde l'environnement effective travail productif traite généralement genre projet d'utopique sens péjo- ratif terme c'est-à-dire impossible rer pte sas heérils bre cee ten géré
