,page,text
16,17,nouveau dossier ouvert mouvements féministes ligues féministes soulèvent sans cesse nouveaux lièvres auxquels pense tant font partie paysage habituel tant refoulés l'ombre société lutte femmes faire re- connaître leurs droits s'est arrêtée loi l'interruption volontaire grossesse d'autres dpssiers ouverts égalité devant l'échelle salaires viol plus récemment dossier femmes battues fléau dont soupçonnait l'ampleur femmes battues sourires iro- niques entendus hommes si- lence peu gêné femmes incré- dulité plus souvent problème femmes battues quel problème cela n'existe plus guère ai-je en- tendu sauf peut-être certains pays moins civilisé cer- tains milieux défavorisés bien aime bien châtie bien d'ailleurs beaucoup font provo- cätion efc trois phrases quelques idées reçues sujet abordé brüle-pour- point cours d'un dîner d'amis définitivement cos. problème vieux comme adam eve effet universel temps civilisations jaissé inchangé peur sujets concernés l'igno- rance loi dignité pathé- tique aussi servi depuis siècles conjuration silence alors violence rue dénoncée réprimée vio- lence domestique ignorée déniée retranchée derrière l'intoufhable respect vie pri- vée violence lointaine indigne toujours celle touche plus près parfois plus difficile reconnailire femmes battues laisent tout passe comme degrés divers elles résignaient accepter sort femme sort tradition culturelle tendance encore dévaloriser ainsi tou- jours peu infantilisées certaines femmes acceptent d'être frappées leyr mari après père fait compléter éducation femmes sentent coupables ailleurs paradoxalement femmies portent yeux fous famille amis voisins responsa- bilité réussite l'échec mariage avouer l'on femme battue c'est s'exposer rires aussi accusations c'est s'entendre dire l'on pre- voqué coups pis qu'on appré- cie semble essence femmes sentent coupables proverbe dit-il bats femme tous matins saïs pourquoi sait devant violence d'un mari d'un compa- gnon elles s'interrogent rai- sons avant s'indigner révolter cette interrogation peut paraître saugrenue pourtant favorisée l'entourage lorsqu'il mis cpurant en- courage jes victimes compren- dre mari l'aider certain taux violence communément admis fa- milles toujours quelques nuages ciel bleu mariage déclarait femme régulièrement battue depuis années avocate aidait défendre enfin au- jourd'hui cependant voix mouvements féministes conjura- tion silence cède peu partout marie-france elliott etats-unis aussi angle- terre allemagne suisse italie france femmes s'efforcent dénoncer tabou pèse fort perpétue dépit d'une apparente d'ailleurs incomplète égalité devant loi structures couple homme droits femme enfants battues nombreuses femmes encore bel bien 1977 comme moyen âge tous milieux permanence télé- phonique paris reçoit appels femmes battues recueilli depuis plus d'un témoi- gnages émanant toutes classes socioprofessionnelles partout relations autres inexis- tantes réalité confirme l'angleterre erin pizzey ceux appelle gentiemen bien loin d'en être aytant d'in- génieurs d'ouvriers cadres routiers dentistés mécaniciens médecins sälariés trouve quelquefois dom- mage pen femmes classes moyennes franchissent porte osent dire eur nom toutes faisaient assisterions changement jour lende- main car justement leurs maris fonctionnaires juges méde- cins avocats conscillers munici- paux plus aptes amélio- rer situation loutes femmes plus réactions police devant jes appels secours femmes battues m'étonne voir arrivêr centre femmes policiers réclamant aide. erin pizzey créé londres 1971 premier reluge femmes jes enfants battus raconte cèlte bouleversante expérience crie moins fort voisins vont l'entendre paris editi femmes 1975 aris editions
17,18,certaines femmes plus dili- eultés défendre faire valoir leurs droits moins informées celles n'ont aucune autonomie financière métier celles restées maison élever enfants lemmes travaillent l'extérieur débroull- lent mieux peuvent cci taine mesure échapper contrôle l'homme bat aller trouver avocat femmes viennent souffert souvent pen- dant longues années elles plupart aucun métier sentent dévalorisées rapport elles-mêmes leurs enfants femmes n'ayant réussi professionnellement affectivement elles n'ont recours correspondre l'image femme diffusée largement mass media faux croire qu'il s'agit d'un problème marginal c'est vie plupart femmes manifeste-à niveaux plus moins dramatiques. fait femme battue l'homme bat explique genc- viève piret fondatrice genève mouvement terre femmes très souvent conditionnés violence comme enfants baltus qu'ils assisté scènes brutales entre leurs parents gar- çon perpétue ainsi tradition fami- liale violence femme quant jeune fille tendance rechercher type fort sail bagarrer pensec-t-elle saura défendre contre autres n'imagine instant cette violence qu'elle admire retourner contre l'homme bat souvent homme soutfert l'enfance souffre reconnaître doit autant aboutir excu- ser violence aucun cas n'est justifiée certes scènes violence souvent lieu cours crises d'éthylisme certes horames battent souffrent parfois graves perturbalions psychologi- ques remnrques amènent parfois poser problème celui hommes evictimes sociales soumis stress vie moderne travail rentrés chez défoulent compagne faux problème conduit toutes justifications dénoncé énergiquement s.os.-femmes-alternative femmes totalement désarmées culpabilisées humiliées déprimées dévalorisées pendant années peu peu perdu considération leurs enfants mère battue n'offre image séduction alors qu'un père violent ost tort correspond l'image cullure donnc fonte batiues perdent aussi possibil faire face c'est prenc racine plus commode plus lâcho idées reçues celle prétend qu'une femme battue aimé violence l'avoir acceptée aussi longtemps non soulignait psy- chologue fommes aiment être batlues. ajoutons cela aidera comprendre bien pa- licences elles aiment l'homme bat moins tani qu'elles l'espoir qu'il changer s'amender lémoigne celle ——— toute femme doit savoir violence physique fentme battue peut répondre certaine violence juridique dat faire établir certificat médical constatant traces coups exigeant lorsqu'elle femme foyer mention l'incapacité travail c'est formalité légale tucapacité huit jours plus peut faire porter l'affaire devant tribunal correctionnel cas d'une incapacité moins d'une semaine portée devant tribunal simple police certificat porter plainte contmissarial cette plainte enregistrée main courante c'est cas faut signaler l'on quitté domicile coujugal raison violence ainst abandon domicile conjugal exiger récépissé dépôt plainte aller voir avocat doit dtablir requête résidence sdparée garde enfants ————— —————————… femme fini après années perdre illusions divorcer femmes heureuses méprisent idiotes laissent battre disant partirais part tout suite espère d'abord cela renouvellera plus ensuite enfants j'ai deux filles quinze onze ans faut l'argent élever témoigne aussi cette autre jeune femme secrétaire vingt-deux ans rélugiée deuxième fois chez parents bébé j'aime encore mari préférence loin face j'ai peur laire avenir celui enfant qu'il adore d'autres encore téléphonent s.o.s.-femmes batlués uniquement parler dire écoutes comprises sans vouloir autant cntrepren- dre aclion contre jeur compa- gnon parce gil clles espérent cela s'attangétn fantasmes masochisles sou- vent mis avant sujet rarissimes servent surlout semble- lil apaiser consciénces n'ai jamais rencontré seule femme subisse genre vio- lence mâchoise brisée fracture colonne vertébrale veuille sortir personne veut payer prix rôle mar- tyre écrit erin pizzey certains psychiatres quant rangent femmes laissent battre catégorie vic- limes naturelles recherchent inconsciemment bourreaux honte peur représailles empêchent aussi bien sûr d'agir quelquefois aussi île chan- lage enfants trois ans j'ai voulu m'en aller après avoir battue j'avais avoué m'avail donné marche suivre c'est dernier enfant suppliée n'en rien faire car chaque fois qu'il cajola père l'embrasse faif rabrouer témoignage d'une femime cinquante ans réalité femmes battues décident partir c'est cela impossible c'est ma- jorité cas sans ressources finan- cières enfants has âge faute d'un lieu êtré accueillies quand propre fàmille peut souhaite fafre partout ouverts lieux d'accueil femmes venues nombreuses partout tous milieux demander secours dès qu'elles qu'elles pouvaient êlre écoulées aidées efficacement quand risque devient trop grand faut scène particulièrement violente qu'une femme battue décide pris peur vie celle enfants faire quelque chose stades dit geneviève piret élé elle-même maltraitée avant meltre service femmes battues suisse jour mari battait dit descendrai moque conséquences allée voir avocat fallu menace mort j'agisse faut femmes sentent c'est arrivé dossier justificatif d'une demande ation d'émplols d'utilité collective jassocintion s.o.s.-femmes-aliernative vue créer centre d'héborgement expérimental fommes bultuen s.o.s femmes-alternative erin pizzcy crie voisins vont l'entendre s.os.-femmes battues reçoit ycnnc douznine d'appels pur jour quatre heures permanence moins fort
18,19,"tel paroxysme risque plus grand rester tenter action quels recours quels se- cours pratique femmes veulent fuir violence compagnon théorie certain nombre fait fort peu effet heurte ici l'impuis- sance parfois mau- vaise volonté police assistantes sociales médecins aussi bien avocats tous organismes d'une société voca- tion pourtant humanitaire échouent plus souvent fondamen- talement parce motivation base services d'ordre comme services d'aide maintien famille pires circonstances presque toujours femme déci- dée quitter mari fuir violence heurte hostilité plus moins déclarée mau- vaise volonté patente tou- jours encouragée reprendre vie commune après dix essais manqués chaque fois pre- nais coups n'étais proté- gée police quand portais plainte jeunes policiers commen- çaient rire demandant décrire scène dissuadait donner suite. témoignage d'une femme vingt-sept ans mère trois enfants actuellement instance divorce société peu encourageante l'accueil commissariats pourrait être amélioré femme pouvait l'assurer malheureusement plupart commissariats personnel exclusivement masculin plus services sociaux sans cesse confrontés violence arrivent avoir vision banalisée problème admettre certaine violence toute famille normale tendance encourager femmes battues accommoder situations -dangereuses tous sens terme erin pizzey cite passage bulletin trimestriel service d'aide familles paru hiver 1973 pensons qu'il important faire différence entre coups donnés façon occasionnelle peuvent être considérés comme faisant partie d'un mariage normal particulièrement certains groupes culturels coups donnés façon plus continue pourtant seule manière d'inter impuissance .des organismes officiels général très bien décrite erin pizzey dre crie moins fort voisins vont l'entenre cet égard france malheureuse7 rien envier grande-bretagne ouvrage cité l'ensemble sociétés modernes prennent violence physique sérieux instances spécialisées assistent protègent citoyens police tribunaux organismes sociaux etc pourtant quand coups blessures lieu domicile conjugal contre femmes celles-ci toutes peines monde encore faut-il qu'elles osent parler faire croire coups font croit-on partie vie conjugale tolérance traduit souvent refus d'assistance réticence extrême intervenir etre baïtue n'est recevoir quelques gifles outre gifles prétendument anodines inadmissibles femmes baitues prises violence autrement difficile voici deux témoignages parmi dizaines parviennent paris permanence s.o.s.-femmes-alternative plus extrêmes avant mariage n'avait jamais levé main savais qu'il arrivait battre copains pensais qu'avec responsabilité d'une famille calmerait soir quelques mois après inariage rous sortis boire verre ariis retour prétendit l'un d'eux élait amant évidemment faux prit cheveux cogna tête contre lavabo gifla fort l'oreille j'ai tympan crevé puis demanda pardon jura qu'il toucherait plus jamais mois voulais aller deux témoignages déjeuner chez parents voulait dis pouvais aller seule encore fois soupçonna tromper malgré bonne foi retrouvai deux dents nez cassés œil bouffi poignée cheveux arrachée réfugiée chez parents enceinte trois mois j'ai vingt ans veux vivre mariée depuis quinze ans jamais n'ai ôsé parler tout cela mari bat depuis début dès choses vont comme veut compte plus gifles j'ai reçues jour frappée traînée cheveux j'avais lèvre fendue lendemain voisine aidée soigner sans trop poser questions j'ai dit j'étais tombée tellement j'avais honte autre fois jetée bas lit coups pied coups poing j'ai deux côtes cassées médecin voulait m'aider porter plainte voulais faire l'époque pensais scandale enfants dernière scène s'est passée devant fille treize ans punifion lycée dit c'était faute parce l'avais mal élevée jeté tête verre s'est cassé j'avais éclats verre joues bouche j'avais numéro téléphone magazine maintenant décidée défendre j'ai peur représailles sos femmes france permanences téléphoniques s.o.s.-femmes-alternative moment aucun centre d'hébergement spécialisé donnent conseils pratiques renseignements juridiques adresses utiles surtout soutien moral paris 584.72.52. strasbourg 61.26.02 après heures battues marseille 62.28.09 tous jours 90.79.07 jeudi concarneau 97.05.22. suisse genève 022 31.38.97. pays-bas amsterdam 020.942,758. guy min"
19,20,rompre cercle vicieux violence bien séparation condition bien entendu femme accueillie milieu comprenne sans juger donne l'occasion retrouver sor tir cycle peur cul pabilité d'un énorme sentiment d'infériorité déprimée écrasée amoindrie parce battue dévalorise toujours avoir accepté telle humiliation idéalement dit avocate s.o.s.-femmes battues enfants toujours gravement perturbés devraient être placés quelque temps foyer normal pourraient rendre compte qu'il existe familles sans violence plus cela permettrait mère récupérer join d'eux image sécurisante. n'est loin l'avis beaucoup femmes battues genevière piret réagit violemment cette proposition femme s'arrache mari menaçant besoin présence enfants besoin dévouer revaloriser mouvement s'étend plusieurs pays d'europe fonctionnent déjà refuges femmes victimes sévices corporels france centre héberun visage peut mentir voix peut tromper l'écriture ment c'est vrai presque toutes offres d'emplois portent mention écrire lettre manuscrite afin permettre chefs d'entreprises sélectionner candidats graphologie i.p.s. réunit meilleure équipe graphologues français gement expérimental ouvert offre démonstration gratuite suffit cela écriviez quelques octobre l'initiative l'association lignes l'encre l'espace ci-dessous sans oublier signer retour s.o.s-femmes-alternative dont recevrez diagnostic révélera traits dominants caractère permanence téléphonique reçu décidé donner suite premier contact contri-l plus mille appels l'assorvice recherches étonné vérité denos ciation décidée obtenir subrévélations découpez bon adressez-le joignant enveloppe nom ventions l'etat timbres frais centre accueillera lp.s. 277 rue saint-honoré paris boîte postale 53-08 paris-ge femmes battues leurs enfants pourra procurer secours provisoire quelques mois surtout possibilité réinsertion nouveau départ vie relationnelle hodosoodogner régularisation situations jurir diques sociales souvent complexes grapho-test gratuit écrivez ici ailleurs centre jouera rôle recopiez simplement cette phrase prevention rea désire recevoir sans engagement part diagnostic gratuit écriture jans société famille sert base l'éducation enfants n'ont bien souvent vécu rapports violence l'image père surtout celle mère dévalorisées but prévenir délinquance revaloriser mère faire comprendre mécanisme rend adultes violents façon qu'ils possibilité vivre autrement choisir tant peu vie reproduire tour violence marie-france elliott collaboration geneviève piret texte alternative gné l'association s.o.s.-femmes
20,21,jenmesses l'amérique souvient sar- casmes européens comporte- ments jeunesse jeunes gens désertaient aller guerrover viêt-nam étudiants berkeley contestaient plus qu'ils travaillaient trois quatre cent mille hippies réinventaient vie quartier haïght ashbury san francisco autour was- hington square new york l.s.d menaçait remplacer coca- cola comme symbole amérique c'était vrai début an- nées 1960 avant mai mit déjà sourdine superbe pouvons plus pavoiser drogue délinquance nihilisme ter- rorisme fait fructifier l'héritage américain récent dos- siecr l'hebdomadaire timel braque projecteur non tel tel aspect mal jeunesse européenne peut-être cœur chômage six millions chômeurs to- talisent principaux pays euro- péens jeunes deux millions moins vingt-cinq ans majorité d'une génération pié- tine portes société consommation question combien temps va-t-elle accepter patience docilité cette attente parmi délinquants par- drogués parmi terroristes quel pourcentage ceux n'auraient demandé mieux d'accepter société consom- mation place annoncée pendant toute durée enfance jeunes refusent emplois subalternes activités proposées sans rap- port études faites parfois contraints faire jeunes acceptent travaux manuels expliqué naguère machine ferait place jeunes trou vent certaines tâches idiotes abru- tissantes adultes accomplissent considèrent autrement seulement plus résignés être entrés plus douce- ment moule génération arrive âge d'homme plus précédentes inventé propres idées éduquée d'kurope formée convictions qu'elle exprime considérations relèvent analyse qualitative elles donc discutables voyons alors phéno- mène sous angle quantitatif indiscutable france million chô- meurs jeunes gouverne- ment récemment donné priorité problème éducation apprend n'est vraiment homme lorsqu'on travaille jeune trouve premier emploi malheureux désemparé fanfaronuades masque temps études encore france période relativement heu- reuse car -étudiants vivent monde clos explique jean rous- selet responsable service ern- ploi jeunes l'institut national études démographiques i.n.e.d. pessimisme croît mesure qu'approche dernière année formation qu'il faut sortir cocon allemagne l'ouest chô- meurs moins vingt-cinq ans 400 000 représentent total sans-emplois diplômes toujours garantie succès outre-rhin aussi compéti- tion est-elle sévère universi- tés allemandes pendant temps leurs études beaucoup d'étudiants coupent toute autre activité déception grande lorsqu'ils échouent examen lorsque munis leurs diplômes trou- vent d'emploi ceux res- tent chômeurs pendant plus dit reiner kutschale sociologue travail perdent tout désir travail- ler pays peut supporter qu'une génération tout entière baisse bras italie c'est rage plutôt résignation caractérise jeunes italiens slogans comme votez tirez ornaient ban deroles manifestation gauchiste septembre dernier rassem- blé bologne 40000 personnes million jeunes sans emploi total million chô- meurs l'italie sûrement pays dont problème jeunesse plus préoccupant plus explo- sif j'aie diplôme j'échoue dit étudiant représenta- tif d'un état d'esprit répandu cela editorial jacques mousseau change rien après position décrocher emploi rien nulle part. grande-bretagne 232000 jeunes attendent trouver premier em- ploi certain vandalisme déve- loppe jeunes supporters équipes football britanniques viennent continent font par- fois dure démonstration l'ennui plane jeunesse anglaise quitte école parce qu'elle ennuie déserte tâches qu'on pro- pose parce qu'elle trouve trop ennuyeuses société bloquée moins paraît-elle yeux toute cette jeunesse européenne partout tourne regard trouve guère compassion italie parti communiste sent animosité encontre grandir depuis qu'il accepté coopérer gou- vernement démocrate-chrétien tous pays européens syndi- cats contraints donner priorité défense emplois existants afin préserver puis- sance politique france lois protégeant travailleurs rendent coûteuses compressions per- sonnel patrons petits grands retardent moment d'emm- baucher paradoxalement pays rencontre gens sans emploi gens surmenés conception travail fossé entre génération vingt- cinq ans celle cinquante ans immense première rêve motos grosses cylindrées chaînes hi-fi manifeste mépris certaines formes d'activités seconde souvient encore guerre l'occupation pri- vations multiples peut consé- quence avoir sympathie jeunesse dont attitudes demeu- rent incompréhensibles reste comme déclaré l'équipe en- quêteurs time jean-louis mis- sika professeur d'économie paris société peut offrir d'emplois jeunes société condamnée effet condamne elle-même puisqu'elle cesse reproduire —————— time novembre 1977
21,22,use sis ietre pre arrivent cae seu cure rey rte rire prit rer nes rat ets doter tele
22,23,comment combattre jour l'autre retrouve creux vague moral zéro vision monde noir blanc sent vraiment triste malheureux simplement ressent grand vide intérieur l'enthousiasme bonheur vivre disparu laissant rivage qu'une traînée souvenirs chaque jour s'étire longueur d'acteur devient spectateur cet état tellement répandu chaque langue existe mot l'exprimer l'ennui c'est rhume psychisme depuis quelques années malaise s'est amplifié psychiatres constatent symptômes qu'ils retrouvent plus souvent chez leurs patients l'ennui dépression sentiment d'échec ressens rien docteur quelque chose manque sais quoi. phrases semblables copiées qu'on entend tous jours retrouvent peine transposées œuvres majeures littérature contemporaine vide personnage central pièce samuel beckett attendant godot souffrons d'une douleur physique plutôt d'une sensation vide envahit s'accompagne sentiment d'échec déception arrive temps cette conclusion c'est donc seulement vie explications sociologiques développement phénomène claires toute culture occicontre l'ennui dieux eux-mêmes luttent vain nietzsche dentale fondée consommation nourriture distractions luxes superflus lorsque besoins fondamentaux satisfaits crée nouveaux inciter l'achat pourvu organisions rationnellement vie partageant temps façon équitable entre travail l'accomplissement tâches routine presque tous mesure jouir confort naguère réservé grands monde cette démocratisation aussi inconvénients aujourd'hui plupart d'entre peuvent s'offrir luxe souffrir maladie princes rois l'ennui cette société consommation quête incessante bonheur épuisés vidés forces gagné bataïlle contre pauvreté bien embarrassés cette victoire fond psychologiquement chômage besoin nouveaux objectifs nouveaux intérêts stimuler imagination nature l'ennui réussir combattre l'ennui faut d'abord démonter mécanisme premier degré phénomène semble apparenter simple inertie provoquant perte d'élan vital motivation lancer entreprise volonté chancelante plus rien suscite l'intérêt analyse superficielle conduirait conclure man d'énergie l'excès fatigue seules causes l'ennui l'impression d'ennui éprouvons temps autre due effectivement baisse temporaire tonus d'énergie sam keen rythmes cycliques vie déterminent processus alternance tous domaines donc tout fait normal traversions périodes d'excitation d'intérêt suivies périodes routine ennuyeuses monotones guerre civile manque motivation adéquate peut également être source d'ennui l'excès confort étouffe paralyse velléités d'action tel besoïn casser habitudes qu'entre souffrance routine choisissons souvent première solution lorsque ennui s'attaque personne habituellement débordante dynamisme d'enthousiasme c'est signal d'alarme l'indication moment venu briser rythme quotidien prendre risque d'explorer domaines inconnus lorsque l'ennui devient chronique qu'il débouche état dépressif devient clair alors causes réduisent manque momentané d'intérêt motivation mal plus profond deux parties personnalité engagées conflit épuisant drainant toute l'énergie bloqués aussi bien accomplir obligations réaliser désirs l'opposition entre dois veux absorbe telle quantité d'énergie qu'elle freine l'élan avant l'envie tenter expérience nouvelle retrouve cafard différents noms attribués deux systèmes conflit ça/moi enfant/adulte opprimé/oppresseur désir/obligation personnage bon scout digne confiance
