,page,text
51,52,message partir d'un états mol mlle petit répondre depuis parent aduite enfant suivant relations entre sereines conflictuelles complexes transactions complémentaires croisées cachées leurs transactions complé- mentalres azæa pse entretiendront rapports d'égalité dépendance communication fera sans heurts pourra poursuivre sans interruption cas martin émet parent adulte enfant message destiné parent adulte enfant mile petit celle-ci répond l'état interpellé vers l'état émetteur revanche communication entre bloque exemple partant d'un sujet dévient vers reproches réciproques c'est leurs transactions croisées mar- tin adressait message états mlle petit celle-ci répondait depuis autre états transactions croisées per- turbent circuits communication entraînent rupture dévia- tion celle-ci peut prévoir mar- tin mile petit entretiennent relations suivies vont s'en tenir transactions annoncent couleur communication entre pourra faire plusieurs regis- tres apparence niveau social transactions adressées d'un état autre niveau psy- chologique façon cachée deux autres états mis jeu transactions appelées transactions cachées déguisées plus complexes plus difficiles re- connaître elles peuvent conduire malentendus l'iincompréhension voire mauvaise fol compare souvent l'analyse tran- sactionnelle panoplie d'outils états mol transactions parmi outils sans doute plus populaires nombreux autres fonction problème traité profondeur travail mené durée travail lieu groupe thérapeutique institution entreprise déroule etc. deux plu- sieurs outlis utilisés difficile tous décrire ici voici quelques îignes façon très sommaire recouvrent termes positions vie structuration temps jeu scénarlo dési- gnent quatre autres outils l'ana- lyse transactlonnelle positions vie positions vie définissent perceptions fondamentales nousmêmes autres position vle plus satisfafsante consiste avoir sens propre valeur temps l'on reconnaît l'on accepte autres tels quils alors prêt agir collaboration c'est position celui base vie position doute perpétuellement lui- sent hauteur facilement découragé perçoit autres comme juges donne droit d'être parents égard souvent souhaite l'on décide agisse jui position naissance a.t etats-unis dès naissance plus quinze ans l'analyse transactionnelle rencontralt public d'abord celui psychothérapeutes d'obédiences diverses puis grand public cela grâce particulier deux ouvrages games people play d'eric berne père l'at ok. you 're ok. thomas harris peu plus tard born win james jongeward obtenait tel succès qu'il tiré plus d'un million d'exemplaires très vite californie association l'lt.a.a créait rassemble aujourd'hui plusieurs milliers membres cette association édite importante revue trimestrielle ccmposée d'articles fondamentaux publie journal mensuel d'information chaque année organise congrès auquel participent plusieurs centaines personnes france après débuts difficiles l'at s'affranchir d'un scénario vouait disparition précoce redécider destin développer prospérer s'engager voie l'autonomie berne jeux hommes paris slock édition 1975 première édition 1966 passée presque lolalement t.h harris d'accord soi lex paris l'enl 1976 üel autres voir également berne analyse transactionnelle thérapie paris pavot 1977 adoptée quelqu'un plus souvent branché parent croit qu'en propres valeurs solt parce qu'il pense autres besoin comme guide protecteur parce qu'il méprise croit seul capable d'agir façon efficace enfin position plus désespérée position conduit refuser tout espoir tre valeur temps celle d'autrul orme d'ectlon paralyse toute grille structuration épertorle différentes manlèras dont utlllsons heures vie pouvons retrait couper toute transaction rituel permet d'échanger transac- tions extrêmement codées dont l'en- chaînement réglé comme papier musique bonjour bonjour comment allez-vous très bien etc facon d'occuper temps passe-temps caractérise séries transactions complémentaires général dénuées toute valeur in- formative s'agit d'échanges agréables temps qu'il fait mérites comparés différentes marques voitures richesses gastronomiques tel tel pays etc l'activité consiste ensemble transactions d'opérations condui- sent vers but s'accomplit travail effectif sport d'autres activités loisirs occupons aussi grande partie temps jouer jeux psychologiques eric berne consacre tout livre jeux hommes notion jeu l'analyse transactionnelle lecture cet ouvrage très instructive meilleur moyen comprendre qu'est jeu repérer siens propres essayons d'éclairer propos jeu compose d'une série tran- sactions cachées commençce appât lance joueur direc- tion partenaire partenaire connaît règles jeu sans s'en rendre compte aime jouer jeu donner réplique trouver ferré échanges vont succéder jusqu'au coup théâtre final l'objet jeu alors révélé moins partenaires recueillir sentiments négatifs bénéfice martin d'un air ennuyé j'ai problème ... réunion préparer groupe constituer déplacement organiser milé petit pourquoi ne. consacrer l'heure déjeuner faire alder ... martin oui mais. déjeune malade tout l'après midi personne ... mlle petit pourquoi ne. faites monter sandwich adressez-vous mile etc martin oui jeu poursuit jusqu mile petit lasse abandonne martin sort sentiment frustration avoir réussi tentative côté martin éprouve sorte satisfaction ————— ox. ok. -3e o.k ok. o.k n'êtes ok. o.k n'êtes o.k pile plan jet rio mêmes teminé cage finit dan ferop
52,53,omprendre érer sfr tre propos sérle menge ueur dit partenéie sets alme jour réplique êl= enaires négatifs een perverse devant résultat jeu objectif initial n'était l'on trouve solution problème bien contraire confirmé l'idée personne peut rien lui-même n'est ok. l'autre l'est non plus plus alimente doit être passe-temps favoris débordé una minute soi l'intimité autre façon structurer temps implique relations totalement confiantes avance sans masque l'enchaînement transactions totalement im- prévisible c'est donc mode rela- tion risqué jeu pourrons avoir transactions plus exci- tantes celles passe-temps l'activité mails sans affronter tous dangers plus moins réels l'intimité autre raisons laquelle jouons jeux c'est cela permet falre avancer scénario plan vie jeux l'on joue l'on retrouve toujours englué mêmes jeux l'on sentiment tout l'on entre- prend termine façon chaque fols l'on vit nouvel amour finit larmes l'indifférence l'on dit toute façon finis toujours faire avoir etc sert rien d'accuser malchance autres destinée fait suit destin doit rien hasard divinité plutôt nécessité interne prend forme d'un scé- narlo plan vie l'on s'est fixé très tôt arsque en- fants bombardés messages parfois contradictoires adressalent parents depuis propre enfant depuis parent faire déci- der possible permis falsable dessiné canevas seralf existence future partir messages canevas rose travaillerai réussirai plus fort meilleur. canevas noir méfierai tout monde aimé travaillerai dur n'au- rai droit aucun plaisir chacun propres canevas rose noir noir toujours prêt comme comédie tourne drame travail thérapeutique consiste retrouver quelles décisions originelles condyits vivre scénarip pren- dre nouvelles décisions chacun instruments qu'offre l'analyse transactionnelle apporte éclairage passe relations jes autres permet mieux maîtriser l'at utilisée thérapie dé- veloppement personnel travail institution entreprise c'est éga- lement excellent instrument d'ana- lyse historique sociale arrivant terrain déjà très défriché etats-unis européens français particulier pour- vaient avoir l'impression tout dit qu'ils n'avaierit plus apprendre appliquer leçons leurs prédécesseurs théorie ouverte n'en rien fait l'at théorie très ouverte intègre bien apports nouveaux certes français commencé apprendre lectures voyages etats-unis sémi- naires animés thérapeutes amé- ricains chevronnés répondu par- tie continuent répondre besoin d'information formation temps groupes recherche théorique pratique s'or- ganisaient assoclation l'institut français d'analyse transactionnelle lf.at créalt cette dernière re- groupe aujourd'hul plus cent vingt membres enfin chaque année depuis trois ans cangrès européen ras- semble trois cents personnes euro- péens américains échanges points vue confrontations communications etc c'est cette occasion l'on peut mesurer développement l'at europe france fait seulement l'apprentissage d'une théorie américaine également apports originaux théoriciens praticiens européens effet alors qu'au cours premier congrès conférenciers étalent presque exclusiveexemples différents types transactions entre martin mile petit partagent bureau diriez-vous venir chez terminer travail soupir rapport leblanc jamais n'aurai fini rapport rapport leblanc soir second tiroir suis-je chargée-de veiller inquiétez ferai dernière partie transaction complémentaire horizontale affaires transaction croisée transaction complémentaire oblique oui c'est bonne idée devons supposer fait cour depuis déjà quelque temps leurs deux enfants augurent plus cette soirée tête tête simple échange professionnel transaction cachée
53,54,es1.1 han l'at france concerne tout rapporte recherche théorique appliquée recherche théorique personnes isolées groupes travail s'emploient approfondir adulte aider trouver chemin optimal découvrent jeux qu'ils jouent animateur année congrès tiendra précil'aide groupe l'ani échanger vent apprendre développés l'at france largement peu uc- thèmes majoritaires contre démarches plus const enrichir recherches positions tives per nano vie états nger scénario sions chang l'animateur correspondances entre fat aucun vas autres théories psychologiques etc comme gourou très vite consacrent aussi égiés d'appli- æppet roupes travail trois domaines privilég transmet groupe l'essentiel recherche appliquée l'at appor ransactlonnelle analyse thérapie dév techniques dont dispose tant nouvel éclairage suggestif ment américains chaque année in- tervenants européens plus nom- breux espérons qu'en 1979 trois domaines thérapie développement person- nel l'intervention institu- tions entreprises thérapie individuelle groupe certain nombre praticiens français utilisent pratique privée comme instrument travail parfois associée d'autres techniques comme gestalt-thérapie bio- énergie l'at commence aussi être introduite milieu hospitalier exemple traitement patients postcure expérience égale- ment faite hôpital parisien malades partie per- sonnel soignant réunissent groupes hebdomadaires régulation l'aide d'un psychologue formé l'analyse transactionnelle d'autre part certain nombre médecins psy- chiatres d'hôpitaux province s'inté- ressent d'assez près l'at com- mencer l'utiliser travail thérapeutique encore trop tôt tirer bilan diverses expériences au- jourd'hui pouvons seulement dire l'intérêt cette nouvelle ap- proche grandissant aussi bien parmi soignants parmi soignés praticiens directement contact patiénts senti tout l'intérêt cette thérapie résis- tances plus grandes milieu universitaire notons cependant qu'un certain nombre mémoires thèses cours rédaction centrés l'at l'utilisent comme grille décodage phéno- mènes psychologiques sociaux d'au- tre part l'université vincennes unité valeur consacrée partie l'analyse transactionnelle technique groupe groupes développement personnel j'at plus plus nombreux france ceux souhaitent mieux connaître mieux gérer évolution diminuer leurs conflits eux-mêmes autres découvrent séminaires weekend groupes travail hebdomadalres trols états mol apprennent prêter l'oreille messages chacun émet entendent voix parent interne continue dicter préceptes positifs négatifs apprennent reconnaître peurs besoins enfant faire conflance travail faite commun guide progression membres groupe chacun libre d'accepter refuser l'interprétation qu'il donne relations entre participants meneur groupe deviennent celles partenaires disposant rapidement mêmes cartes endroits s'échangent plus transactions jouent plus jeux l'activité mêle passe-temps jeux rituels c'est l'entreprise cette dernière révèle comme très intéressant champ d'application l'at fait expériences plus plus nombreuses variées séminaires interentreprises apportent partici- pants informations temps qu'un début formation personnelle aperçus utilisations pos- sibles l'analyse transactionnelle travail plus fructueux fait l'intérieur chaque entreprise entreprises l'analyse transactionnelle déjà droit cité certain nombre d'entreprises françaises comme banque france cii -honeywell bull utilisation concerne d'abord relations l'intérieur d'une équipe travail entre différents services s'applique aussi développement général l'entreprise car comme personne entreprise scénario propre vient personnalité fondateur marché trouve événements capitaux l'ont marquée fusion absorption rachat ... connaître tenants aboutissants scénario peut être extrêmement utile direction d'eñtreprise l'at sert aussi mieux comprendre relations entre produit consommmateurs mieux cerner l'image marque d'une firme d'un service savoir s'ils plutôt perçus cumme parent adulte enfant quel type transactions entretlennent jeur public etc. permet d'affiner communication jes produits services entreprises macralse transactlonnelle donc ment intéressant aussi bien relations l'intérieur nombreux phénomènes historiques sociaux part mené chaîne télévision étude fertile enseignements l'application grilles transactionnelles série d'émissions poursuivons île instrument l'analyse phénomènes président l'étouffement développement créativité chez individus groupes venons d'entreprendre recherche îles jeux scénarios plus spécifique- ment français enfin études également menées relations entre enseignants élèves île plan pratique l'institut supérieur psychologie groupe d'enseignants utilise l'at régulation interne travail formation d'inforrnation d'application recherche développement membres l'lf.at d'autres france entrepris faisons parce que'nous prenons l'analyse transactionnelle nouvelle panacée considérons seulement comme instrument valide efficace mérite place l'univers contemporain sciences l'homme gysa jaoui gysa jaoui âgée trente-quatre ans fait études linguis- rique sémic- logie licence maîtrise in- térêt tous problèmes communication relations hu- maines conduite avoir acti- vilés conseil formation l'industrie cadre cabinet gimca anime également oupes développement personnel elie s'est formée pratique l'analyse transactionnelle depuis 1974. termine livre cette thé- tapie doit paraître éditions robert laffont collection réponses
54,55,repris onsidé ument place scien librairie psychologie sources psychothérapies modernes eee médecines initiatiques pierre solié paris l'epi psychologie moderne redécouvre depuis quelques dizaines années liens étroits existent entre psyché corps ailleurs constatons intérêt croissant médecines sacrées religieuses survécu travers siècles parfois conservant forme initiale pierre solié médecin psychothérapeute analysé comparé rituels différentes médecines initiatiques civilisations anciennes contemporaines montre étonnante clarté non seulement similitudes existant entre différents cultes aussi lès correspondances l'on peut trouver elles nombreùses psychothérapiés médecines psychosomatiques modernes. décrit différents types initiations cheminements prêtres mystes sorciers doivent suivre devenir intermédiaires entre hommes dieux entrer possession secrets santé maladie mort analyse rites épreuves subies futurs initiés surtout nombreux mythes religieux rend aisé rapprochement démarche psychanalystes actuels démarche instaurée grands prêtres comme freud lacan jung sorcier africain sud-américain prêtres l'egypte ancienne initiés mystères d'eleusis grèce antique participaient sans doute autant thérapie globale âme corps psychosomatologues mystères l'âme humaine n'ont changé leurs modes résolution pris formes peu différentes pierre solié montre qu'une véritable réalisation soi situe au-delà discours logos dieux archétypes l'inconscient forces ténèbres l'individuation rédemption médecines théurgiques psy- chothérapies mystiques l'art général doivent rester intimement liés essence objectif communs c'est peutêtre seule condition travers âges poursuive métamorphose d'un chaos insensé genèse créatrice olivier holl frontières mort vie après vie moody paris robert laffont vie après vie d'abord recueil témoignages personnes frontières mort ensuite essai classificatiôn témoignages partir desquels dégage exemple passage autre vie témoignages proviennent trois sources personnes gravement accidentées malades déclarés cliniquement morts ressuscitent récits mourants rapportés leurs proches différents phénomènes cet état spécifique d'inconscience fait d'entendre ten s.à aus sre moody faire saut diagnostic terminal médecin l'audition bruits singuliers passage travers tunnel dédoublement rencontre autres esprits dont l'être lumière jugement actions vision vie rencontre limite sentiment bien-être ineffable enfin retour essentiellement coefficient réalité propre visions sous coma marquera jes ressuscités différence entre elles rêves hallucinations l'auteur américain r.a. moody psychiatre philosophe donne livre caution scientifique ouvertures culturelles effet après avoir dressé l'inven- laire phénomènes l'expérience l'approche mort near death experience d'une part retrouve traces travers platon livre morts tibétain swedenborg d'autre part montre l'incapacité hypothèses pharmacologiques neurophysiologiques rendre compte phénomènes décrits finalement psychologie mourant différerait plus processus mentaux apparentés hallucinations drogues connus psychiatres qu'elle ressemble livre r.a. moody s'inscrit courant revalorisation mourants face technicité inhumaine médecine mouvement poursuit depuis dizaine années pays anglo-saxons l'impact donné psychiatre elizabeth kübler-ross lors publication interviews mourants alors suivie divers chercheurs société américaine parapsychologie côté l'aspect humanitaire livres succès partie renouveau merveilleux mort qu'ils formulent lorsque comme moody prennent précaution d'affirmer qu'ils apportent aucune preuve l'existence l'au-delà lecteur peut empêécher faire saut contresens scientifique psychologique vouloir expliquer phénomènes mourir s'appuyant seulement classe spectaculaire récits valable point vue l'imaginaire mythe peut absolument tenir lieu raison scientifique simon monneret pédagogie enseigner endoctriner l'endoctrinement olivier reboul paris p.u.f l'endoctrinement n'est aventure exceptionnelle n'arrive qu'aux autres montre olivier reboul cléricalisme dressage jeunesse hitlérienne propagande totalitaire guerre psychologique lavage cerveau cas particulièrement graves d'endoctrinement celui-ci menace pèse loute éducation qu'est-ce l'endoctrinement avant répondre olivier reboul explicite dès départ deux postulats sous-tendent réflexion agit d'une part kübler-ross derniers instants vie genève labor fides 1975
55,56,pape pse exagérat omission l'exagération celui selon lequel enseignement ais lronqués plutôt gas former érisent unez trop éendu coma eneemmats 22e quo viv tres aaues trinement eux-mêmes respecter eur base cette haine dont spinoza disait gét quand unes qu'elle toujours mauväise o7désir d'écouter d'autre différence propagdnde l'endoc quand contrée trinement vise croyance seuer part celui selon lequel enselil s'agit d'inculquer gnement véritable rie saurait être lement l'action inculqu croyance durable indélébile neutre car professeur tendan- cleux risque évidemment d'influencer élèves professeur ennuyeux risque dépoûter finalement pire influence unë méthode moderne permet d'acquérir week-end technique relaxätion simple développer efficacement selon plan d'éducation s'adresse avant tout jeunes l'on adtière doctrine possible l'enseigner sans puissä endoctrinement dès lors noces entame peu por givi font lou eme l'on reconnait façon peu focuhés mer nue dufer explicite positions vont mémoire concentration intui- ploie défendre l'idée lon soi tion imagination qualité être libéral sans être neutre. repos dépendent grande partie l'acune attitude fréquente définir tivité subconscient poul'endoctrinement comme doc neutralité impossible voir subconséient peut êtrel l'adversaire ainsi éclaircissements appornt facilement stimulé méthodes anglo-saxons voient-ils volontiers tés olivier reboul s'interroge cest qu'on appelle dynamique cathblicisme romain raisons font qu'in mentale cette méthode enseignée marxisme-léninisme doctrines peut devenir endoc rin 1er week-end cours séminaires étrangères culture cas comme pensent certains philo- sophes l'éducation hare snook white l'intention fait l'endoctri- alpha pratiquée milliers types d'endoctrinement tandis participants depuis ans france marxistes gauchisies diront nant tout autant l'enseignement d'etat nerent montre olivier fer état relaxation physique mentale ensemble définir l'endoctrine rebüul nul endoctrine volontaire ofntlr pourrez reproduire loisir rent comme doctrine l'adverment celui endoctrine juiex mênie endoctriné croit enseigner rechercher bien celui qu'il vie quotidienne développer plan psychosaire couperait court toute inter- rogation suffirait d'identifier logique dynämique mentale permettra ensuite d'utiliser niveau conscience mentale particulier préparer psychologiquement situations quoti- dienhes difficiles exemple préparer examens tâches professionnelles vaincre trac timidité maigrir ac- croître mémoire trouver sommeil développer imagination créatrice atrêter fumer contrôler émotions vivre expériences extra-senso- rielles après exercices concentration dé- veloppant concrètement intuition vivrez expériences extra-senso- rielles étonnantes prouveront l'existence facultés parapsychologiques insoupçonnées sommeillent prochains séminaires alpha paris marseille bordeaux nantes lille strasbourg lyon-st-elienne toulouse belgique bill bellens tél 053-66-59-97 suisse genève documentez-vous retournant bon gratuit ci-dessous bon gratuit retourner sodiac formation vraie doctriné celle permettant qualifier lout discours conteste d'endoctrinement l'on admet fait qu'en dehors sciences exactes dont énoncés objectifs peuvënt rallier tous îles esprits raisonnables reste tières d'enseignement plus moins conjectural personne peut prétendre avoir raison façon infaillible définitive esl conduit s'interroger endoctri- nement possibilité distinguer nettement d'un enseigne- ment véritable action long terme l'endoctrinemient apparaît comme type d'enseignement perversion enseignement partage tout ënseighement caractère viser action lon£ terme différence pro- pagande cherche mobiliser action court terme d'être lié situation d'autorité endoctirinement lorsque l'énseignant propage opinion partisane lieu n'est destiné cet effet l'écôle exemple quand sert autorité proéduque nôn tant tel endoctrinethent est-ce alors conte- l'enseignement cri- tère essentiel philosophes anglo-saxons sôus l'influence po- sitivisme logique tendent méfier toutes propositions soht objectives n'étant tau- tologiques vérifiables c'est cas selon positivistes affirmé métaphysique éthique esthétique philosophie valeurs théblokie. dahs cette perspective l'endoctri- nement surgit dès qu'interviennent au-delà disciplines objectives croyances subjectives seule atti- tudé convienne derriler do- maine neutralité olivier reboul montre neutralité n'est possiblé enseignement devait être neutre faudrait renoncer exemple enseigner larigage d'ailleurs définition rñême l'on propose neutralité neutre dépend milieu d'où ehe provient d'autre part heutralité n'est souhaitable selon reboül mênie possible olivier rebotl rappelle propos l'école laïque voulue nevitre wagram 75017 paris tél 754.43.64 adressez-moi sans engagement l'article psychologie dynamique mentale renseignements séminaires alpha pager cetle opinion partisane comnle l'était bas comme objective comme seule doctrine possible s'il arrive cas limités endoctrinement repose mensonge flagrant voir protocole sages sion utilisé jusqu'en 1945 mouvements añtisémit souveñt cependant len tion repogncation car toute éduer €n- hon repose valeurs qu'on rapport religions qu'en républicaine n'était neutre politiquement liée sou- veraineté peuple l'égalité tous devant loi l'instruction uni- verselle loin alors d'être admises tous français poser neutralité totale renontt code nnnnnnses willie alpha ville ...
