,page,text
0,1,euires sna dur 1cc cmaoa 126 mesuev/deeusion aaa
1,2,out las ceux fau robert volumes instrument réussite tous monde moderne savez qu'on juge façon parler d'écrire savez cela peul dépendre réussite grâce robert volumes disposez d'un instrument culture idéat véritable placement effet robert seul diclionnaire alphabélique analogique langue française permel d'exprimer clairement voire pensée remédier défaillances mémoire construire correctement phrases rappeler exaclliude citation célèbre auteur chaque mot robert donne bien entendu définition étymologie prononcialion analogies contraires synonymes difficullès grammaticales citalions robert contient opinion general gaulle cette œuvre rendre plus grands services tous ceux usent langue française souci respecter désir qu'elle inspire ... jules romains l'académie française ouvrage considérable fait beaucoup soin j'espère succès couronnera courage élé indispensable entreprendre lâche pareille tous vœux félicitations ... poursuivez labeur magnifique conslance cape lemmelé propos donl nolre époque bousculée offre peu d'exemples œuvre monumentale j'admire sans réserve palience l'érudltion conscience lilléraire dont fall preuve ... andre malraux chacun réjouit réussilé cette œuvre mainis égards exemplaire laquelle langue française cessé vivre 1850 ... fautes francak uvent cause d'echec guioit hot plus 200000 plus c'est seul dictionnaire alphabétique analogique langue classique moderne permet découvnr mol inconnu oublié tout indispensable ceux veulent réussir robert volumes aussi l'instrument langage excellence dont doivent disposer enfants parce qu'il occupera place choix bibliothèque d'homme cullivé robert you ajreçu présentation grande ciasse luxueusàl eqener ale flauett inscriptions gravées l'or fin papier hayle onf valu prix plus bel ouvragè imprimé alfa jkiflfis recevoir gratuitement documentation détaillée monument langue française robert volumes découpez bon documentation ci-contre retournez-le dès aujourd'hui sans l'affranchir snl robert 107 parmentier 75011 paris
2,3,eee voyait etaut amel nan novembre 1973 -6f quiz mois avez-vous esprit ouvert fermé nathalie robatel contre-courant jacques mousseau l'université nouvelle l'échec mathématiques comment l'expliquer com comment surmonter gérard guillerault chercheur idées ernst kretschmer psychologie fondée biologie claude malard connaissance autres groupes rencontre leader fait différence l'étude expérimentale dynamique groupe morton lieberman irvin yalom matthew miles psychologie clinique victime est-elle parfois vrai coupable criminologie moderne cherche cause d'un crime ezzat abdhel fattah psychologie avancée doigts voient couleurs phénomène physiologie suffirait éclaircir richard youtz ———————— entretien nikolas tinbergen exclusif prix nobel médecine 1973 parle propos recueillis david cohen psychologie expérimentale l'acquisition langage développement cerveau linguistique peut tout expliquer yudhishthir raj isar librairie génétique l'intelligence jacques larmat psychanalyse d'un enfant mélanie klein fêtes civilisations jean duvignaud langage efficace françois richaudeau dernières parutions bref france grande-bretagne états-unis who who psychologie numéro mis vente décembre prochain présentation 07010 010 abonner voyez page ture psychologie edite centre d'étude promotion lec champeriveccoscane madir sen enot296 02.88. urss chantier his sos
3,4,rnranme ire den aaa papa 222 2tase 22795 nhhhltiliune mrc 222222222222 0020l nra aa22222 2228 2222070000 uuuuiuu eden rzz222 pet à4p uuuiuil heart luz zzl2tl22 272 casses delta 127227 2222227220 los elu nan papa delle lif 222782227 eee duu lcd bsl ferme avez-vous lesprit ouvert nathalie robatel idiai deux amis rencontrent pre croyances intermédiaires rappelons rue pourquoi m'as-tu rendu fournit autorité extérieure aucun opinions pot t'ai prêté demande croyances périphériques dérivent luer nant dote l'un d'eux t'ai jamais em- précédentes qu'elles sctio res révolution prunté pot répond autre tout système situe gauche réactionna sou mode toute façon cassé quand perspective temporelle définit naires mniqu formez l'as donné plus l'ai façon dont l'individu réfère selon lequel déjà rendu intact passé présent futur utilisez cette histoire illustre notion chacune dimensions possède système clos professeur milk outre attributs spécifiques rokeach analysé varient selon individus c'est ouvrage the open and closed ainsi systèmes d'affirmation mind plusieurs affirmations iso négation peuvent être plus lées contredisent unes moins isolés différenciés rap- premiere partie ions autres caractérisent non port l'autorité plus moins étroit chacune propre etre contenu spécifique conception temps orientée dif- entourez d'un cercle réponse structure interne car lorsqu'on féremment correspondant voire dit individu qu'il l'esprit fer- c'est l'agencement diverses étroit seulement caractéristiques déterminera nature pensées l'on juge façon dont pense professeur rokeach prend comme point départ l'étude fin compte l'esprit ouvert fermé bien selon définition milton rokeach ca- pacité laquelle recevez évaluez utilisez informations etats-unis l'union sovien n'ont absolument rien accor partiellement d'accoï d'accord système pensée pry0- fournies priétés fondamentales qu'il énonce après avoir étudié critères gé- ins ans déraux caractérisent sys existe traits comm tout système constitué d'afüir- tèmes ouverts fermés l'auteur catholicisme communs mations négations certitudes mis point plusieurs tests permet- d'accord doutes concernant différentes tant mesurer différences indi- partiellement d'accoï croyances viduelles c'est partir tests d'accord croyances irois élaboré série types croyances primitives propositions concernant pro- pli tous naturellement blèmes politiques sociaux per partage prncpes environnement être pro- sonnels intéressent part individu
4,5,inintinniniin nes ntnt ent ent ent nonn tests évaopinions volutionje mode d'accord partiellement d'accord uis d'accord suprême démocratie démocratie suprême celle gouvernent individus plus ——— liberié d'expression tous droit sacré malheureusement nécessaire refuser cerlains groupements politiques d'accord partiellement d'accord d'accord ———— ——— îû—— ûû——— ———— crois l'intelligence sagesse tout être humain j'avoue masses couvent comportement stupide d'accord partiellement d'accord d'accord trouve très grands esprits l'histoire l'humanité d'accord partiellement d'accord d'accord certains êtres j'en viens haïr cause principes qu'ils défendent d'accord partiellement d'accord accord vie justifie voue idéal d'accord partiellement d'accord d'accord jons religion faut tous ransiger ceux croient d'accord partiellement d'accord d'accord faut être fonc foncièrement tenir compte bonheur personnel d'accord partiellement acco d'accord rien pire d'attaque publiqueme pda ceux partagent d'accord partiellement d'accord d'accord tout groupe tolère chez membres trop grande diversité opinions condamné disparaître d'accord partiellement d'accord d'accord deux types d'individus ceux défendent vérité ceux opposent d'accord partiellement d'accord d'accord faut jamais être trop critique j'égard opinions d'autrui d'accord partiellement d'accord d'accord vaut mieux essayer comprendre soi-même plutôt remettre responsables experts d'accord partiellement d'accord d'accord préférable porter aucun jugement avant connaître l'opinion quelqu'un l'on respecte d'accord partiellement d'accord d'accord fin compte vaut mieux choisir amis entourage parmi ceux partagent mêmes goûts mêmes idées sol accor partiellement d'accord d'accord quoi bon journaux propagande dépenser argent font d'accord partiellement d'accord d'accord deuxieme partie choisissez maintenant proposition paraît plus juste l'homme fondamentalement solitaire impuissant gens tiennent peu compte d'autrui quand problème trou- toujours quelqu'un prêt aider quand discute tellement absorbé veux dire j'oublie d'écouter disent autres quand discute toujours prêt écouter interlocuteur partage idées quand discute j'ai souvent envie d'interrompre interlocuteur tant impatient exposer point vue j'ai parfois l'impression vaux rien redoute toute intimité autres car sais qu'ils déçus quand ïls connaîtrent mieux connais j'accepte qualités défauts entre bonheur grandeur choisirais bonheur importe plus vie c'est faire quelque chose d'intéressanti recherche célébrité j'aimerais avoir position importante faire quelque chose d'utile j'ai beau raisonner j'ai souvent l'impression l'on critique sans raison plupart gens essaient comprendre autrui avant juge
5,6,see date oem hear tout individu sent naturellement coupable faut jamais recourir force faire progresser idées fin justifie moyens quand peut convaincre raison bien obligé recourir d'autres moyens cee ccd cce j'ai parfois l'impression gens discute politique comprennent réellement passe comprend réellement monde lequel vit parvient prédire l'avenir sert rien préjuger l'avenir mieux vaut vivre préseat faut toujours agir selon principes l'on défend parfois difficile conformer principes dangereux s'identifier entièrement cause l'on défend j'ai parfois peur avoir assez temps réaliser tout voudrais redoute toujours l'avenir peut réserver faut avoir confiance pro- vidence faut profiter moment pré- sent souvent l'occasion regret- ter passé présent rop souvent dé- plaisant c'est l'avenir importe troisieme partie comme première série eniourez lettre correspond voire réponse faut être vrai croire certaines races périeures d'autres d'accor d'acc partiellement d'accord d'accord écrivent croient tout qu'écrivent jes journaux pensent pays communistes menacent reste monde d'accord partiellement d'accord d'accord ceux envie battre veulent maintenir service militaire d'accord partiellement d'accord d'accord femmes vraiment aveugles voir libération passe l'avortement d'accord partiellement d'accord d'accord ridicule penser 0cialisation médecine résoudre problèmes santé d'accord partiellement d'accord d'accord paresseux font continuellement grève d'accord partiellement d'accord d'accord comment peut-on croire parti communiste représente vraiment intérêts peuple d'accord partiellement d'accord d'accord plains ceux croient l'existence dieu d'accord partiellement d'accord d'accord epp pop puident riches devien- plus riches pauv pauvres plus d'accord partiellement d'accord d'accord vérité vérité bouvernement partie liée prises d'accord partiellement d'acco d'accord brandes entre système d'entreprise privée l'origine dépressions sst guerres d'accord partiellement d'ac d'accord suffit réfléchir compre— dre système scolaire antidémocratique d'accord partiellement d'accord d'accord cord besoin d'être génie sa- voir qu'il faut entretenir bonnes relations toutes grandes puissances quelles qu'elles d'accord partiellement d'accord d'accord l'histoire pays montre bien c'est l'industrie contribue plus progrès société d'accord partiellement d'accord d'accord nnnnnnne nnnni nnnnnnnnnuqn nnnnnnnnnnonneoqn nnnnn nnnn 2222222222 pre rts ste nnnnnnnnnnnnnnnnnnnnnnen nnnnnnnnnnnnnnnnnnnnnnn nnnnnnnnnnnonnnnnnnnnnne nnnnnnnnnnnnnnnnnnn nnnnnnnnnnnnnnonnnnnnnn nnnnnnnnnnnnnntn snnnnnnnnnnnnnnnnonsqnneos doute force frappe indispensable sécurr d'un pays d'accord partiellement d'accord d'accord suffit d'un peu bon comprendre travaille étrangers occupent places autres accor partiellement d'accord d'accord voir résultats
6,7,conitecoutanti l'intérêt suscitent aujourd'hui sciences humaines révélé fois plus place accordée récemment grande presse plusieurs manifestations scientifiques viennent tenir congrès neuropsychiatrie marseille congrès sciences l'éducation paris congrès l'arriération mentale haye congrès u.n.af.a.m lille congrès criminologie belgrade etc l'article d'ezzat abdhel fattah criminologue égyptien installé aujourd'hui canada fait écho travaux cette dernière assemblée débats l'efficacité peine mort comme moyen dissuasion l'aménagement l'échelle peines prévues codes l'évolution régime prisons l'utilisation juges notion circonstances atténuantes relèvent seulement morale politique controverses sujets l'ordre jour elles influencées changements mentalité collective également résultats d'enquêtes objectives menées spécialistes l'étude d'ezzat abdhel fattah victime est-elle parfois vrai coupable peut choquer prime abord titre démarche pensée l'auteur celui spolié maltraité battu tué parfois soudain mis accusation tenté borner plaindre sans pencher cas autrement panser plaies morales matérielles procès inattendu ouvert a-t-il créé lui-même situation dont victime a-t-il attitude comportement appelé spoliation coups cette étude constitue bon test ceux précédemment répondu questions quiz mois avez-vous l'esprit ouvert fermé seuls individus prêts réviser leurs idées l'épreuve faits sans sourciller l'argumentation d'ezzat abdhel fattah gagerais majorité lecteurs classent après avoir joué jeu catégorie gens l'esprit ouvert fréquentation sciences humaines entraîne effet révision préjugés cette gymnastique devient routine deux autres articles numéro moins constituent d'excellentes séances d'entraînement préjugés mieux ancrés tête parents enfants aussi maîtres s'appelle bosse maths l'avez découverte grattant sommet crâne jour séchiez devant équation sûrement renoncé devenir ingénieur informaticien imaginez descendants abandonnés bas-côté route l'histoire moment celle-là s'engage monde plus plus mathématisé abandonnés comme dinosaure mammouth diplodocus parce organes n'ont passé l'examen l'évolution gérard guillerault montre blocage mathématiques tient nature culture n'est d'origine chromosomique d'origine psychologique pédagogique démonstration centralien fait également terrain tirant l'ornière écoliers noyés théorie ensembles importante moment dossier mathématiques modernes rouvert changer mathématiques suffit faut aussi changer ceux enseignent enfin groupes mode portent noms magiques bio-énergétique satori créativité group groupe gestalt mots magiques désignent techniques d'animation communication thérapie conviction répand temps expériences. technique cet outil psychologique certains vont forger san francisco londres tout n'importe peut devenir animateur groupes rencontre etats-unis justement équipe psychologues s'est demandé fait qu'un groupe marche marche découvert nest technique engendre automatiquement succès mals leader animateur doté d'un magnétisme personnel atteindra but recherché tattoo lin dar présentation jacques mousseau autre pourra varier recettes échouera toujours quand psychologue fait gourou devient toujours sage cesse d'être psychologue congrès l'association américaine psychologie s'est tenu montréal début septembre donald hebb mis garde collègues contre dangers confusion genres rappelant psychologie science science l'esprit proche parente biologie peut guider vie rôle appartient philosophie morale psychologie n'est normative peut tout plus donner éléments d'appréciation d'une nature différente ceux lesquels l'homme traditionnellement fondé conduites toujours l'individu doit dernier ressort faire l'appréciation n'est exactement l'avis éthologues konrad lorenz nikolas tinbergen leurs écrits émerge l'incitation regarder côté biologie sociologie animale afin mieux appréhender résoudre certains problèmes posent l'humanité xx° siècle n'est sans doute exactement non plus l'avis l'académie suédoise décernant prix nobel médecine deux chercheurs temps qu'au professeur von frisch semble lancer appel psychologie fûüt-elle animale demander baliser l'avenir préparions mettre sous presse numéro lorsque noms lauréats prix nobel 1973 rendus publics programme prochain numéro entretien exclusif professeur tinbergen réalisé grande-bretagne correspondant david cohen réagi journalistes demandé l'imprimerie danel merci équipes d'avoir compris raisons bouleverser programmes retiré article numéro cours d'impression substituer l'entretien nikolas tinbergen afin lecteurs découvrent plus rapidement possible premiers sans doute grand chercheur assez peu connu france l'actualité projette soudain premier plan attend papers
7,8,mbijections .... sous -ensembles ... injections ... inter- ensembles équivalent ensembles deux éle- ments ... ensembles ensemrs sauwz.\ fait combieu
8,9,l'échec mathématiques comment l'expliquer comment surmonter gérard guillerault dessin extrait charlie brown charles schulz new-york chicago san francisco holt rinebart and winston iiau comprend rien mathémade français qu'il face problème maths c'est terminél…. apprend bêtement machinalement résultats catastrophiques ... père beau rabâcher cent fois chose heurte mur. tous entendu entourage réflexions type eventuellement convenir première personne jamais rien compris donc problème l'incompréhension mathématiques problème au-delà filandreuses discussions réformes enseignement connaît aujourd'hui ampleur accrue laquelle font d'ailleurs écho aussi bien parents d'élèves enseignants question posée double représentent quoi correspondent l'enfant difficultés auxquelles heurte coup quels peuvent être moyens lever cauchemar mathématisé constat d'évidence réforme mathématiques demeure beaucoup d'élèves synonyme ennui sinon panique voire terreur objet phobique responsable multiples dérèglements inquiétudes frustrations angoisses tant enfants eux-mêmes parents enseignants pétition principe abusif d'isoler seules difficultés mathématiques autres problèmes rencontre inévitablement enfant l'adolescent d'en faire maladie moins déficience parfaitement isolable repérable comme telle déjà baptisée certains dyscalculie remarquons simplement l'élève champ mathématique semble manifester cas échéant comme espace privilégié déployer actualiser poids déchirements représenter conflits intérieurs proprement parler donc mauvais élève cancre maths jindividu pis vit oppositions partir desquelles s'élabore personnalité. mesure l'incompréhen- sion mathématiques ainsi tribulaire difficultés plus décisives nature psychologique légitime parents viennent consulter leurs enfants institutions psychopédagogiques dont tant autres ignorent jusqu l'existence certains établissements effet permettre programmations séances hebdomadaires général dites rééducation mathématique dont l'idée base suivante difficultés spécifiques qu'éprouve l'élève apprentissage mathématiques forment qu'un aspect problèmes d'ensemble cependant possible parvenir débloquer ceux-ci intervenant niveau celles-là telle tout cas visée rééducateur l'on confie l'enfant l'adolescent fer lance civilisation position rééducateur première analyse nature idéologique doit être faite2 comment situetil appareïl enseignement rééducation fonctionne-t-elle comme poubelle l'education nationdle cette dernière déversant inadaptés circuit parallèle institutions dites médico-pédagogiques quelle mission réinsérer déviants filière normale dont momentanément écartés administrant pédagogie plus douce non moins contraignante n'est hasard telles questions peuvent être tout particulièrement soulevées sujet mathématiques semble bien celles-là joué jouent encore rôle déterminant tant qu'instrument sélection moins deux raisons abord parce qu'étant fer lance civilisation techno-industrielle c'est rapport elles peut s'évaluer l'adaptation individus service production ensuite ———————— façon regroupés sous nom dyslexie certain nombre troubles langage essayé coq héron groupe d'études centre etienne-marcel juin 1972 noter dit ici rééducation mathématiques pourrait l'être toutes rééducations
9,10,put vient paraître pleine psychan pelanie lyse nouvelle collection psychanalyse chez tchou sciences humaines docteur jacques chazaud 17.60f georges genevieve rousseau 15.00f docteur jacques chazaud 22.00f mots .blts poenananae cole atidn role travail social educatif rencontre personnelle prenons elles introduction approche psychanalitique net sonne fournissent mel telle évaluation sure dogmatq joni ment appliquées elles pre yrai mode ais das faux sais mauvais eielle n'es qu'un garde r'eje légion d'honcancre lég l'éans doute celle approche lype jli épuise-t-elle sociopolitique epl dar problème qu'il suffñise d'évoqu exemple fail n'est fes ment détail l'enseignemen mathématiques sans elles l'apanage d'ailleurs peut susc ter chez pédagogue attitu l'occasion sadique faisant user toute-puissance supposée savoir fins manifestement perséculrices bizarrement certains pédagogues parents conservent nostalgie nseignants enfonçaient principes mathémaliques coups règle doigts gifles partie s'être heurtés tel dirigisme d'une certaine manière peut paraître tenir mathématiques elles-mêmes nombre enfants n'ayant plier envoyés réaction n'en revêt autant aspect caractériel brutal violent viennent leurs séances rééducation contraints forcés contraire paraît général dominer attitude c'est sait quelle crainte peu triste quelle peur secrète dont maths l'objet parce moyen tive mathématiciens sans savoir priori mathématique rien soi effrayant insinue cœur vie plus quotidienne après tout enfiler vesile pantalon c'est faire topologie contourner table aller chercher objet c'est tenir compte groupe déplacements monter escalier c'est faire confiance transitivité rela- tion d'ordre etc voulions non portions ainsi potentiellement principes mathématiques sans qu'ils autant réductibles quelconque physiologie motri- cité car ajoute tout poids l'ordre symbolique humain mathématique sans lan- gage rien pourtant suffise expliquer l'effet d'effroi dont êtres mathématiques éventuelle- ment marqués chez l'idée cet effet partir moment rale désir l'indi adolescent doit élève avançons manifeste façon génévidu enfant muer savoir sous pression l'institutio laire élait chez jui construction manipulation doit devenir théorisation délicat processus s'enclencher tous ratés mathématiques scolaires égard terrain vulnérabie l'enfant peut être plus tante c'est mesure réalisent cette lransmutation désir désordonné affranchi deur savoir codifié dogmatique d'une façon lou fait exemplaire discours magique l'homme primitif face objets mathématique teintés l'angoisse l'on dite l'enfant réagit tel primitif confron l'orage nuit conduites magiques érige qu'il comprend mages démons vers lesquels élever morose invocation incantatoire processus contribuent ren forcer tant structures l'idéo logie actuel système d'en seignement structures parce devant nombre élèves extrêmement difficile pédagogue faire sorte chacun d'eux comprenne l'idéolo gie mesure généralement mathématiques conçues davantage comme outil utilisable fins concrètes construire pont calculer force tempé rature comme permettant réflexion soi monde l'es pace c'est-à-dire limite mathématiques elles-mêmes forme praticiens efficaces non spéculateurs intelligents anciens bons élèves bref effort remémoration indique l'on plus pris mathématiques qu'on désir apprendre qu'on effectivement apprises trouve marché autre face d'un mystère l'avantage cadre rééducation l'on travaille seul élève mouvement esl essentiellement celui d'un dialogue non plus transmission unilatérale c'est mettre îes mécanismes vicient processus d'apprentissage établisse ments scolaires habituels couvre ainsi particulier quel point mathématique park ressemble surtout magima tique discours proprement magr propos enfants offrent rien n'indique cela rique cause réforme mathématiq modernes
