,page,text
28,29,couple triomphes.… échecs bazoilles éco guy monceau fallu vingt siècles l'amour physique ose exister tabous interdits secret tombent jour livre bazoilles apprend surtout connaître comprendre l'amour médecins formels c'est méconnaissance totale d'euxmêmes conduit tant couples faillite sans fausse pudibonderie sans choquer livre instruit réalités biologiques causes maladies corps qu'on appelle frigidité l'impuissance l'incompréhension qu'il suffit souvent bien peu choses guérir aisé comprendre livre doit aider tous jeunes couples fait sort bien préjugés apporte réponses claires bien questions confirme corps chantent cœurs taisent contraception service l'amour lagroua weill-hallé lagroua weill-hallé con 1l'amour commonlalros sexualité dtvalensin editions guy monceau depuis quinze ans plus grandes gynécologues françaises dr. lagroua weill-hallé bat femmes obtiennent seuil droit fera d'elles êtres libres droit contraception ecrit collaboration valensin livre recueil témoignages bouleversants trente-sept cas cliniques observés sans préjugés complaisance deux spécialistes font tour contraception cariln contraceptions livre sans fard manuel d'éducation aborde tous problèmes celui mari volage couple dix enfants virginité disparition désir l'angoisse cardiaque amitiés particufières… confessions toutes montrent mieux longues explications contraception morale rendre l'amour dignité beauté calendrier conceptionnel n'est noir qu'un petit agenda cuir peut cronyme apparence anger vie femmas libérant cette terreur maternité transformé tant vies enfer tué tant couples force d'enfants venus trop tôt trop vite celles veulent prendre pilule l'agenda calendrierconceptionnel grâce auquel n'importe quelle femme peut appliquer méthode naturelle découverte docteurs ogino krauss suffit noter chaque mois date d'apparition règles simple marque graduée contenue ogenda posée page mois correspondent indique premier coup d'œil période critique méthode température aussi expliqués carnet donne sécurité supplémentaire méthode naturelle doic compléter cette dernière femmes dont cycles irréguliers épargner toutes femmes peur avoir enfants contre volonté aussi surtout risques inutiles c'est sans doute vraie victoire contraception naturelle l'amour après quarante ans valensin-dr weill-hallé l'amour apres cagreua intel haul d'yslonsen mme c.… quarante-sepl ans depuis trois ans vis grand amour ... ... j'ai soixante-sept ans etme voici marié depuis trentaine d'années amour faibli demeure fort empressé femme bien qu'elle n'ait cinquantecinq ans prétend n'est plus âge deux exemples choisis parmi ————————— ttttzddd——————— différents ouvrages vente correspondance bureaux éditions guy monceau rue chazelles paris-17e tél wag 34-62. modes paiement chèque bancaire chèque postal c.c.p 67-47-57 timbres français ——————————— dizaines lettres toutes appels miroirs angoisses ceux plus jeunes pourtant résignent tant parler jeunesse oublie qu'elle n'est début vies souvent bien longues ferme yeux adultes jamais n'ont osé confier leurs problèmes âge viennent maladies lassitude solitude conseillera écoutera valensin fair livre cette révélation l'amour n'est l'apanage adolescents jeunes couples l'amour meurt jamais s'il existe jeunesse cœur celle artères muscles existe aussi ceux veulent bien garder jeunesse corps celle l'amour jeunesse d'âge gel sexuelle technik sha kokken 500 000 exemplaires c'est tirage atteint actuellement angleterre allemagne pays nordiques naturellement japon livre d'un plus éminents sexologues pays docteur sha kokken chiffre suffit exprimer nécessité d'un tel ouvrage sexe technique texte l'image titre peut choquer choquera ceux n'ouvriront livre docteur kokken première fois médecin ose dire chacun devrait penser apprend tout hommes sauf essentiel l'amour pourtant d'échecs drames d'insatisfactions n'avoir admis cette évidence n'est possible amour vrai séparer vient corps vient l'esprit fallu sans doute bien courage beaucoup vraie simplicité docteur kokken réussir cette gageure livre met l'amour images sans tomber aucun moment pornographie petites poupées médecin japonais heurteront elles franchise fraicheur contes adultes trop souvent enfants de- vant l'amour rsa tens sean pure tee dce doses tue
29,30,"femmes victimes d'homicide liées plus fréquemment hommes leurs tueurs relation interpersonnelle effet comme montré recherche home office grande-bretagne plus deux tiers femmes tuées marl amant proches parents tandis qu'elles rarement tuées inconnus hommes contraire beaucoup plus fréquemment tués inconnus environ cas cours rixes cours d'un vol plus souvent gens connaissance membres famille enfants moins seize ans plus cas tués leurs parents membres famille moitié meurtres lieu l'intérieur famille semble déprimant penser beaucoup plus chances d'être tués membre parenté entourage immédiat quelqu'un connaissons assez bien individu n'avons jamais pourtant étudiant meurtres commis angleterre pays galles entre mars 1957 décembre 1960 morris cooper constaté commis personnes apparentées connues leurs victimes tandis seulement commis inconnus svalastoga constaté danois commet homicide probabilité victime parmi membres propre famille qu'elle parmi connaissances qu'elle parmi danois qu'il connait personnellement avant crime d'environ total 550 cas d'homicides criminels commis philadelphie 1948 1952 deux tiers cas 66,4 existait entre criminel victime relation parenté d'amitié connaissance statistiques l'homicide publiées récemment canada couvrant période dix ans 19611970 révèlent 41,7 tous homicides signalés commis foyer entre personnes liées lien conjugal lien proche parenté présence d'une relation personnelle entre criminel victime crimes passionnels doit étonner car éclosion crimes saurait être comprise qu'en fonction psychologie lien existait entre deux personnages drame mals meurtre vue vol constaté cas seulement relations connaissances antérieures entre criminel victime cas relation caractère personnel relation parenté relation d'amitié relation sexuelle caractère impersonnel situationnelle professlonnelle présente relation criminel-victime existe également cas viol comme montré l'étude d'amir viol philadelphie relation préa able entre criminel victime existait presque moitié cas amir relevé pourcentages sulvants inconnus 51,9 connaissances 14,4 voisins 19,3 amis intimes amis famille 5,3 membres parenté 2,5 l'existence relations fait comprendre pourquoi grande majorité délits contre personne délits sexuels intraraciaux études menées etats-unis population peut être nettement divisée noirs blancs mettent sans exception évidence fait l'homicide attentats contre personne coups blessures certains délits sexuels comme viol essentiellement commis l'intérieur d'une race toutes études démontrent forte majorité cas pourcentage allant quelquefois jusqu criminel victime appartenalent race certaines victimes exercent véritable attraction criminel s'il vrai certains cas personne devient victime sans aucune intervention contribution part plus souvent victime contribue activement attltude très nette devenir victime comme dit ellenberger certains individus exercent criminel attraction semblable celle l'agneau exerce loup plusieurs victimes séducteurs sans savoir sans vouloir particularités manière d'être mode vie provoquent tentations auxquelles difficile résister exemple certaines femmes incitent viol rien attitude tenue maquillage elles peuvent donner l'impression qu'elles femmes légères femmes faciles étudiant l'histoire certaines personnes tuées peut résister l'idée qu'il s'agissait victimes recherche d'un assassin toutefois rôle victime n'est toujours rôle actif conscient simple fait d'exister peut être suffisant notamment cas l'infanticide être peut comme amplement mon- tré tennyson jesse imposer présence façon irritan meurtre devient seul moy délivrer tensj cependant faut admettre cas l'agression provoq attitude passive vict l'exception radical créée uée parfois hasard décide criminel victime cas rixes tous part pants fois victimes délin quants potentiels c'est hasard détermine sortira comme offenseur sortira comme offensé souvent victime meurtre contribue propre mort non seul acte suite d'actes plupart meurtres familiaux qu'il s'agisse d'un parricide d'un matricide meurtre conjoint victime peut pendant nombreuses années préparer triste sort final comportement n'est rare non plus déclenche l'acte l'homicide ici peut citer disputes conflits surgissent entre sujet actif sujet passif jalousie kinberg attiré l'attention contri bution victime meurtres commis alcooliques jaloux cite cas d'une femme d'alcoolique croyait mari avill qu'elle estimait qu'il n'oserait commettre d'actes violents plaisait attiser irritation jalousie paroles lroniques ambiguës sorte qu'un jour tua accès fureur arrive souvent aussi comportement victime aggrave degré violence criminel ainsi comportement agissant comme élément actif frustration peut amener perturbation affective profonde colère plus intense imprévue non désirée c'est explique pourquoi vol rapine viol peuvent transformer homicide bien auteur n'en nullement l'intention l'origine cas meurtre commis but lucratif tel vol victime peut créer imprudence situation particulièrement propice réalisation crime c'est cas personne état d'ébriété montre inconsidérément argent payant note tout suite après accepte d'accompagner quelqu'un qu'il vient rencontrer endroit isolé victimes accidents circulation souvent responsables enquête entreprise france voir suite criminologues anglais criminologues danois"
30,31,"faire parents maltraitent leurs enfants problème enfants maltraités leurs parents devenu aigu grande-bretagne abord pensé parents particulier mères poussés viojence souffrent d'un environnement stressant difficultés d'argent difficultés logement difficultés émotionnelles l'enfant devient alors bouc émissaire tous maux dont souffre famille solution alors d'améliorer situation parents logeant offrant aide matérielle l'enfant automatiquement bénéficiaire recherche poursuivie selwyn smith équipe queen elizabeth hospital suggère cet optimisme peu simpliste smith équipe pris électroencéphalogrammes mères trente-cinq cas d'enfants maltraités smith trouvé anormalités considérables e.e.g huit trente-cinq mères moyenne d'anormalités légères contre population normale smith pense qu'il deux genres mères battent leurs enfants catégorie menée mauvaises conditions vie familiale améliorer conditions peut être solution l'autre catégorie c'est-à-dire moins quart mauvaises mères poussée maltraiter enfants condition organique héréditaire meilleures intentions l'entourage n'aideront enfant cette recherche montre fois plus théories attribuent environnement toutes causes comportements anormaux plus valables selwyn smith précise qu'il inutile cruel nier facteurs organiques jeu chez quelques parents british journal psychiatry tests procès shipstone burt deux chercheurs l'université nottingham comparé attitudes l'égard tests partir deux enquêtes l'une réalisée flugel 1947 l'autre réalisée eux-mêmes 1972. propre enquête interrogé six cents personnes ressort bre grance-bretagne david cohen comparaison beaucoup plus gens aujourd'hui critiquent tests qu'il vingt-cinq ans public croit moins moins mesures données tests infaillibles certains doutent psychologie arrive jamais formuler tests valables exacts comparaison 1947 montre ailleurs moins d'hommes aujourd hui pensent admettent qu'ils pensent sexe masculin intellectuellement supérieur sexe féminin néanmoins hommes estiment hommes plus intelligents femmes contredisent d'après elles deuxième sexe fond premier majorité l'égalité intellectuelle semble règle recherches shipstone burt montrent l'on croit 1972 comme 1947 fois différences héréditaires matière d'intelligence l'influence l'environnement presque plus personne pense l'intelligence totalement dépendante circonstances lesquelles enfant trouve placé british journal educational psychology psychiatrie sociale est-elle efficace danemark 1957 île samso vivent 6000 personnes s'est vue dotée d'un service psychiatrie nilssen videbeck étudié l'existence service réduit nombre suicides cet indice considéré comme révélateur santé mentale d'une collectivité résultats décevants psychiatrie 1946 1957 nombre suicides 0,14 000 personnes année après création service 1957 1968 pourcentage monté 0,70 1000 année différence n'est importante cette recherche montre psychiatres toujours aussi caces qu'on pourrait désirer auteurs l'expérience estiment éviter suicides faut assistance sociale voire spirituelle plus qu'une assistance purement médicale british journal psychiatry effi- méthode réflexe-orale donne résultats stupéfiants tellement rapides nouvelle méthode plus facile plus efficace nt1lz connaitre l'anglais n'est déchif rer lentement quelques lignes d'un texte zalis écrit connaitre l'anglais c'est comprendre instantanément dit pouvoir répondre immédiatement anglais méthode réllexe-orale conçue amver résultat non seulement donne sohdes connaissances anglais surtout amène infailliblement parler cette méthode progressive commence leçons très faciles amène peu peu niveau supérieur sans avoir jamais quoi apprendre paf cœur artiverez comprendre rapidement conversation radio encore journaux peu peu commencerez penser anglais parler naturellement tous ceux l'ont essayée avis méthode réllexeorale amène parler anglais délar record convient aussi bien débutants n'ont jamais fait d'anglars ceux pris mauvais départ ressentent nécessité rafraichir leurs connaissances d'arriver bien parler résultats tels ceux suivi cette méthode pendant quelques mois semblent avoir étudié pendant années avoir séjourné longtemps angleterre méthode réflexe orale conçue spécialement être ätudiée chez soi pouvez donc apprendre l'anglais chez heures liberté habitiez quelles occupations consacrant minutes jour cette étude passionnera commmencerez débrouiller mois lorsque terminé trois mois plus tard parlerez remarquablement spécialistes l'enseignement stupéfaits voir quel point élèves parlent accent impeccable commencez dès possible apprendre l'anglais méthode réflexe-arale rien peut rapporter autant petit effort monde d'aujourd'hui passer l'anglais priver d'un atout essentiel réussite demandez passionnante brochure offerte ci-dessous faites-le tout suite car actuellement pouvez bénélicier d'un avantage supplémentaire exceptionnel gratuie tre d'etudes avenue mallarmé paris 17° veuillez m'envoyer sans aucun engagement brochure comment réussir parler anglais donnant tous détails méthode l'avantage dont peux bénéficier pays hors d'europe jondre coupons-réponse bon recopier renvoyer service cenmon nom code postale mue dune adresse danone comes"
31,32,"dont résultats présentés vile congrès français criminologie lille 1966 révèle lors collisions entre véhicule pléton responsabilité piéton engagée trois cas quatre délits sexuels plus moitié victimes consentantes contribution victime encore plus évidente domaine délits sexuels bien délits contre mœurs écrit von hentig8 témoignent nettement contribution existant entre fonction protectrice désir être protégé attend victime qu'elle manifeste résistance rend plus difficile l'accomplissement l'acte consentement victime abolit derniers scrupules rapport délits sexuels publié quelques années l'institut criminologie l'université cambridge constate victimes n'ont résisté activement n'ont refusé n'ont fait d'objection indécences commises l'étude d'amir viol philadelphie montre qu'un cinquième victimes victimescatalyseurs précipité l'acte commis contre elles plus l'attitude victime qualifiée d'attitude soumission cas plusieurs études entreprises allemagne enfants victimes d'attentats sexuels démontrent qu'un pourcentage victimes variant victimes consentantes participantes suisse reinhart constaté étude l'attentat pudeur filles moins seize ans presque trois quarts filles 73,3 consentantes provoqué délit tandis qu'un quart seulement 26,7 opposé résistance quelconque doit oublier non plus l'imprudence certaines filles contribuent souvent viol cas typique celui files acceptent promenades automobile enquête menée récemment montréal montré majorité cas viol contribution part victime attitude imprudente provocante plusieurs études montré également cas l'une deux parties mineure comme exemple majorité cas d'inceëtes d'attentats pudeur enfants viol statutaire vic- time mineure consentante faut repousser systématiquement l'argument corruption l'adulte mineur études victimes d'inceste montrent qu'il n'est rare délinquant souvent ancienne victime majorité délinquants perçoivent plus moins comme victimes victimes leurs parents famille leurs éducateurs police société ... sentiment lorsqu'il s'agit d'une victimisation d'injustice réelle n'est sans importance perpétration crimes fait d'avoir lui-même victime réelle d'un délit quelconque constitue l'individu moyen justification assez fort transformer délinquant exemple constate dès l'école enfants dont camarades classe volé livres crayons plumes font justice eux-mêmes volant mêmes articles d'autres camarades semble passage l'état victime l'état délinquant assez aisé arrive souvent qu'un propriétaire voiture l'on volé rétroviseur l'enjoliveur vole chose autre voiture debuyst joos relatent l'histoire d'un garçon dix-sept ans suite d'un vol s'est dépossédé d'une arme feu collection quelque emmps après pénètre chez armurier vole tour série d'armes mère effondrée conduite fils put expliquer garçon aussi honnête élevé milieu aisé travailleur bien considéré tous commettre tel fait filles jouent rôle provocateur l'initiative encore prennent ent active l'accomplissement l'inceste cette réalité souvent ignorée juges continuent parfois croire présomption légale adulte corrupteur enfant corrompu self-service constituent parfois véritable provocation vol rôle victime vol l'étalage évident qu'il peine nécessaire l'analyser connaît dicton populaire l'occa sion fait larron grands maga sins surtout magasins self service connaissant psychologie consommateur spéculent tentation irrésistible provoque l'étalage marchandises jes divers rayons essayer tâter goûter ajoutent encore attraits marchandises étalées tentent ainsi non seulement acheteurs aussi voleurs puissance longtemps juge allemand noté jugement acquittant voleur l'étalage fait d'étaler sous yeux public sans apparente défense surveillance objets présentés conditions savamment organisées provoquer convoitise porter jusqu l'irrésistible désir l'appropriation constituait véri table provocation vol rôle victime vol d'automobile vol d'objets laissés voiture bien connu cette négligence part propriétaires d'automobiles conduit certains pays comme danemark certaines villes comme montréal édicter lois règlements punissant telle imprudence d'une amende pénale passer l'acte faut délinquant surmonte inhibitions résistance face crime consentement victime confère l'acte certaine légitimité cas d'homicide demande victime sollicitation cette dernière peut constituer force apte vaincre toute conviction religieuse morale justifier acte rendre inopérantes différentes formes contrôle social délinquant éventuel peut nier l'existence victime réduire celle-ci abstraction objet cette réification victime s'observe souvent infractions bandes d'adolescents fille violée fois niée réifiée utilisée ensuite rejetée sans être niée réifiée victime peut être dévalorisée cette dévalo risation permet d'esquiver culpabilité certaines qualités victime peuvent servir raisons dis——— von hentig the criminal and his vir lim ouvrage cité"
32,33,créditer justifier l'acte l'on veul commettre égard cela presque toujours observé cas d'attaques contre homosexuels prostituées victime choigle parce comportement offre alibl facile sentiments culpapilité remords conscience processus aboutissant crime passionnel futur criminel juge pus plus défavorablement future victime dévalorise luimême finit faire être mauvais nuisible dangereux crime apparaît ainsi comme nécessité comme intervention légitime devoir moral criminel pose justicier face victime semble aussi l'antériorité culpabilité victime débarrasse criminel sentiments culpabilité greeff beaucoup insisté l'aspect justicier crime passionnel affirme sujet s'avance vers l'acte criminel mesure cet acte paraît justifiable indispensable crime vengeance vendetta l'exemple typique cas l'injure conçue comme acte justicier certains crimes foules comme exemple lynchage reflète remarquablement cet aspect justicier offre exemple frappant d'une légitimation collective spontanée provoquée conduite victime crime politique peut être aussi provoqué parfois l'attitude victime l'assassin peut concevoir comme devoir moral fait tuer despote dictateur cruel simplement grand personnage détesté puissance coupable injuste cas bourreau familial tué fils crime souvent conçu auteur comme l'acte d'une justice vengeresse cruauté père envers mère s'ajoute souvent l'hostilité l'agressivité fils envers père faciliter crime politique préventive peut protéger victimes comme individus dangereux contre société doit défendre individus vulnérables société doit protection vulnérabilfté victime peut jouer déroulement crime rôle aussi important danger représente criminel peut envisager années venir mise place d'une nouvelle politique préventive passe délinquant potentiel victime latente cette inversion prévention exige dépistage ceux vulnérables attaques criminelles afin accorder meilleure protection recherches actuelles réussil démontrer personnes entreprises possèdent telles telles caractéristiques victimes plus vulnérables d'autres telles telles infractions produiront plus probablement certains lieux plutôt d'autres mesures prises lutter contre criminalité donneront résultats plus probants d'ici quelques années tests soigneusement préparés destinés dépister victimes latentes potentielles déterminer chances probabilité d'un certain individu devenir victime d'un certain type criminalité l'instar tables prédiction récidive criminalité criminologues train d'établir tables construites évaluer probabilité individu devenir victime semble certain nouvelle prévention point départ non délinquant victime potentielle ezzat abdhel fattah savoir davantage von hentig the criminal and his victim new haven yale university press 1948 paasch grundprobleme der vikrimologie thèse doctorat droit münster 1965 gasser viktimologie kritiche betrachtungen einem neuen kri- minologischen begriff 1965 ranjeva contribution l'étude personnalité victime thèse doctorat médecine tarbes imprimerie tarbaise 1964 castro victimologia consideraciones generales thèse doctorat droit maracaïbo univer sidad del zulia 1969 gratus victimes paris stock 1969 amelunexen das opfer der strafsat ein beitrag zur viktimologie hambourg kriminalistik verlag 1970 abdhel fattah viclime est-elle coupable montréal presses l'université montréal 1971 facteurs contribuent choix victime cas meurtre vue vol thèse doctorat criminologie montréal 1968 wolfgang patterns criminal homicide philadelphie university pennsylvania press 1958 arnir patterns forcible rape chicago university chicago press 1971 mcdonald the murderer and his victim springfield charles and thomas 1961 schuh-kuhimann aspects vic- timologiques délits d'extorsion chantage thèse doctorat criminologie montréal university press 1970 ediatgraphologie crête cours l'école psycho-craphologie etablissement privé fondé 1953 régi loi 12-7-71 professeurs spécialisés psychologie générale psychanalyse psychologie l'inconscient caractérologie morpho-psychologie graphologie d'orientation sélection professionnelles préparation profession graphologue cours oraux sions formation conférences paris cours correspondance inscriptions toute l'année frais comptabilisables dépenses formation permanente documentation gratuite p.-s. gaillat villa saint-pierre 94220-charenton tél 368.72.01 analyses sélections professeurs publicité l'est faux cette écriture cella parfait séducteur elld révèle égoïsme habileté inconstance tout caché sous apparences séduisantes ——— visage peut montir voix pout tromper l'écriture ment sontiments plus cachés dons plus ignorés opparaissent noir blanc celui saï analyser scientifiquement l'écritura i.p.s réunit mail leurs équipe graphologuos offro démonstra tion gratuite suffit cela qua écriviez quelques ligues l'encro l'ospaco ci-dessous per ratour rocovrez diagnostic dont l'oxoctitude stupôfiera profitez cetto offre oxcoptionnella postant aujourd'hu bon découper i.p.s. 53-08 paris diagnostic gratuit recopiez cette phrase désire recevoir sans engagement part disgnostic écriture signez joignez onvelopps adresse timbres lrais era internationauresychoservice 270 saone bape 0brpstisles
33,34,
