,page,text
13,14,ques responsables sommeil exemple mettaient jeu complexe neurones situés tronc cérébral endroit formation réticulée pont appelé complexe noyaux locus cæruleus subcæruleus sir enaux mettraient jeu pprogramme génétique dont aspect s'exprime point vue électrique l'activité d'un pace maker c'est-à-dire véritable chef d'orchestre exciter selon modalités séquentielles très complexes peut-être selon code majorité cellules nerveuses certains neurones présentent actlvation plus intense pendant l'éveil neurones moteurs cortex pyramidal également excités envoient décharges descendantes arrivent jusqu moelle cet endroit partir portion inférieure pace maker s'exerce mécanisme inhibiteur puissant vient bloquer l'excitation niveau dernier neurone celui fait bouger muscles ainsi aucun mouvement sauf mouvements oculaires soumis rythme pace maker peut venir réveiller dormeur conçoit l'importance mécanisme blocage car permettre presque toutes cellules nerveuses d'être soumises sorte programmation génétique système nerveux tournera alors vide fermé portes l'entrée signaux sensoriels afférents effet grande partie inhibés fermé portes sortie seuls mouvements ocu laïres peuvent renseigner peu cet étrange codage encore loin déchiffrer cette situation dangereuse bien sûr c'est pourquoi rêve peut apparaître qu'au cours sommeil effet signifie sommeil cela signifie non danger plan éco-éthologique animaux dorment territoire endroit ïls risquent d'être agressés exemple arbres sommeil babouins afrique plan neurophysiologique sommeil signifie absence excitation système d'éveil télérécepteurs l'ouïe l'odorat exemple l'absence d'aboïiement d'odeur chien lièvre c'est seulement quand signal sommeil profond donc sécurité apparu processus rêve peuvent être mis route car contrairement qu'écrit freud rêve n'est gardien sommeil c'est contraire moment plus dangereux animal car seuil d'éveil très augmenté quelque sorte para disse soa vable railre lin éveil aucune esp animale n'aurait survivre telle paralysie périodique survenait moment pouvais avoir fuir défendre mutants cataleptiques catalepsie survenue rêve plein éveil chez homme descendance bien avoir limitée comunent peut-on savoir passe cerveau cours prétendu projet génétique bien sûr loin animal doué d'une grande capacité sommeil savoir cependant semble cette programmation projet n'entraîne sélectionne l'activité neurones cérébraux hasard comme crise d'épilepsie exemple qu'elle semble avoir but chez chat effet possible bien qu'assez difficile faire lésions sup- priment sélectivement blocage moteur tout laissant programmation cérébrale intacte ani- maux peuvent alors extérioriser rêve motricité l'on assis- alors périodiquement cours sommeil épisodes spectacu- laires cours desquels chats attaquent souris imaginaires défendent façon adaptée très suggestive contre prédateurs aus- imaginaires attaqueraient malgré comportement peut effrayer observateur non averti chats réagissent sti- muli extérieurs leurs pupilles restent myosis présentent l'aspect sommeil plus profond donc ainsi argument assez solide montrant vent rêver capables deviner projet comportement cours rêves encore loin l'homme ment moyen savoir sale gramme déclenché penda rêve dépend aveuglément génome peut être modifié événements épigénétiques suppo sons puissions élever sieurs chatons otté idéalement homozygotes façon normale capables jouer battre d'autres complète ment isolés dès naissance sans aucun contact milieu exté rieur possible lorsque animaux adultes pourrons effectuer lésion supprime blocage moteur observer ensuite comportement moteur cours rêve deux groupes présentent comportement d'agression défense alors très probable comportement bien génétiquement programmé rêve coitespond l'irruption programme cours sommeil fait rien s'oppose l'aspect programme différent deux groupes comment cela serait-il possible problème savoir quelle mesure cours maturation cours certains stades critiques certains événements pourraient venir modifier déroulement l'activité génome pendant rêve sait nome certaines cellules nerveuses peut être modifié certaines hormones exemple injection d'hormones mâles chez raton melle fera celui-là pourtant géné tiquement fernelle mâle vie n'apparaît donc impossible certains événements l'éveil puissent retentir ultérieure ment déroulement projeis génétiques rêve ainsi certains types d'apprentissage peuvent entra ner augmentation secondaire durée sommeil paradoxal outre connaissons depuis uné dizaine d'années phénomène rebond rêve effet rêve supprimé manipulations expérimentales certaines cafégories drogues pendant plusieurs jours tend augmenter considéré blement suite façon rembourser dette presque moe lement faut donc admettre existe quelque part certe mécanisme très précis permetiaf als peu ausn eve meer lus dal ets dont cellules possèdent double gène d'un caractère donné
14,15,événements épigénéliques retenlir l'expression génome conçoit ainsi cette hypothèse rêve esl exactle grande plasticité qu'aurail apportée l'apparition rêve cours l'évolution chaque stade développement l'apprentissage influences génétiques pourraient être modifiées l'environnement alors pourquoi reptiles poissons rêvent-ils possible développement système nerveux central poissons reptiles fasse selon programmation génétique extrémement stricte aveugle génome tenant sous dépendance l'organisation séquentielle mise place architecturale différents systèmes cadre très sirict laissant peu place modifications épigénétiques peuiêtre poïkilothermie possibilité suspension l'activité cérébrale rendu impossible l'apparition rêve qu'arrive-l-il l'on supprime rêve c'est tout problème début pensé privation rêve chez l'homme chez l'animal adulte pouvait entraîner troubles graves cela vrai faux fois difficile effet réveiller sujet chaque nuit début rêves car tendent répéter ensuite plus plus souvent stimuli doivent devenir plus plus forts réveiller sujet comprend certains individus puissent présenter troubles caractériels après quelques jours ensemble apparaître troubles bien spécifiques outre expériences n'ont jamais dépassé dizaine jours façon chez l'animal s'est aperçu beaucoup troubles entraînés suppression rêve dûs stress agression non spécifique provoquée privation instrumentale sait maintenant supprimer sélectivement rêve drogues cela parfois obligatoire cas narcolepsie très sévère chez l'homme c'est chose courante chez chat cependant difficile mettre évidence troubles spécifiques suite privations niveau mémoire l'intelligence l'apprentissage alors rêve sert rien non cela signifie façon d'étudier comportement n'esl assez raffinée savons explorer suffisamment différentes variélés comportement chez chat rat laboratoire possible conditions normales chat sauvage privé rêve présenterail troubles importants reconnaissance défense territoire lactique recherche nourriture chasse siralégie amoureuse etc c'est sans doute niveau l'on trouverait troubles chez chat adulte privé rêve pendant longtemps bien sûr s'il étail possible supprimer rêve utero immédialement après naïissance fortes chances troubles plus apparents jusque-là cependant n'avons garder vie chatons ralons totalement privés rêve pensons cela possible devrions arriver celle année chez l'homme chez l'homme c'est pareil l'homme privé rêve pharmacologiquement homme civilisé vit souvent l'hôpital alors tendance mettre compte drogues l'environnement hospitalier changement important personnalité pouvant être partie provoqué l'absence programmation génétique fait qu'un individu différent autre l'expression instincts caractère malades reçoivent fortes doses drogues supprimant rêve souvent air famille deviennent beaucoup plus malléables l'environnement savons encore retentissement privation rêve chez nourrisson certaines maladies car jusqu présent peu d'études faites sujet n'est impossible graves états dénutrition puissent entrainer privation rêve modifications secondaires permanentes personnalité toutes étapes développement d'autre part privation rêve prolongée chez homme placé conditions vie naturelle indien amazonie l'aborigène australien entraînerait peut-être troubles plus importanis pourrait retentir survie l'individu groupe cette privation atteint groupe société industrielle l'homme adulle peul vivre peut-être sans rêve car société prend charge réprime l'expression plupart projets génétiques l'individu adulte 15. phénomène fait varier température d'un corps fonction celle milieu collection nouvelle psc lue cote oran dirigée parjacques mehler sre jexppiestiestr peeioiorie viennent paraître l'explication psychologie jerry fodor 208 pages histoire l'aystérie isa veith 288 pages illustrations paraître vers psychologie l'art rudolf arnheim trois ouvrages fondamentaux traduits l'américain
15,16,"d'après quels éléments l'environnement nocturne pourraient éventuellement perturber rêve nuit après nuit légion bruit exemple nombreuses drogues compris beaucoup prétendus hypnotiques tout facteur perturbant c'est-à-dire retardant l'appart tion rêve perturbant phase sommeil normalement destinée préparer peul-être néfaste sait peu près quel profil idéal d'une nuit sommeil chez l'homme adulte stades rêve rêve rêve sait mal passe séquences différentes exemple succession stades éveil rêve puis 3,4 rêve moment produit rêve nature sommeil précède suit peut-être aussi importants rêve lui-même semble cela puisse être cas certaines psychoses difficile reconnaitre déroulement bien tranché différents stades sommeil rêve tout passe alors comme readout programmation onirique effectuait petits morceaux cours nuit c'est produit également très nombreuses drogues crois qu'il faut préciser lecteurs point tout exposé rêve veut dire imagerie mentale comment savoir chez raton nouveau-né aveugle rêve signifie sommeil paradoxal c'est-à-dire phénomène biologique périodique dont tous neurophysiologistes monde peuvent noter début fin quelques secondes près chez l'oiseau tous mammifères traduit constellation polygraphique signes électriques corticaux sous-corticaux très spécifiques mouvements oculaires rapides d'une atonie totale muscles corps particulier muscles nuque tout monde d'accord là-dessus problème relation chez l'homme entre mouvements oculaires l'imagerie visuelle loin d'être résolu certain beaucoup mouvements oculaires exécutés cours rêve impossibles exécuter pendant l'éveil car trop rapides disconjugués c'est-à-dire chaque œil regarde dehors exemple revanche existe certaines séquences mouvements correspondent parfaitement déroulement scène onirique rapportée ensuite rêveur supposer proissu tronc cérébral uer façon relalivement aléatoire certains mmouvelaires landis parfois ments ocu élecce programme déclenche tionne certaines séquences privi giées études faites luellement chat semblent montrer qu'au sein modalités séquentielles décharges neurones moteurs yeux système visuel peut itouver deux types d'organisation mouvements oculaires cours rêve ceux spécifiques sommeil paradoxal d'autres identiques ceux l'éveil dire qu'un chat rêve cela veul dire qu'il voil train courir après souris certain moment peut-être plupart temps comportement d'un chat rêve dont supprime blocage moteur lésion comportement défense contre agresseur comportement d'attaque parfois jeu souris imaginaire n'ai encore jamais observé comportement sexuel l'électroencéphalogramme tous homines rêvent centaine minutes nuit disiez-vous cependant hommes réveil souviennent d'avoir rêvé sens subjectif terme m.j. cela c'est domaine psychanalystes parce qu'ils explications toutes trouvées bible freudienne persuadé l'on pouvait réveiller gens souviennent d'avoir rêvé moment rêve trouverait proportion plus grande vécu onirique sujets souvien- nent rêve parce qu'ils réveillent longtemps après celui-ci lieu peut-on parler d'une pathologie rêve m.j. oui exemple certaine forme narcolepsie appelle maladie gelineau s'agit d'accès teve surprenant sujets plein éveil parfois suite émotion d'un accès rire sujets écroulent brusquement car fois plus faut insister point rêve s'accompagne ensence totale tonus musculaire pee pare omrambulisme rêve traduit pabnologie réveil incompl cor traire plet cours sommeil pourquoi jet génétique puisse provoq exi xste-t-il d'autres syndromes m.j. probablement connaissons encore ous tre aspect lroubles l'or nate tion sommeil-rêve trad banisa. uit certains llypes d'hypersomnie dique sujets dorment das vingt heures jour rêvent deux cents minutes souvent accès s'accompagnent troubles instincts hypersexualité boulimi enfin domaine lrouble sommeil rêve psychis trie encore trop tôt savoir s'il existe relations causalité entre l'apparition log bles psychoses contraire troubles cycle sommeil-rêve psychose relèvent biochimique commune insomniagues admettiez qu'ilyaun syslème responsable sommeil système responsable l'éveil devi nez comment peut avoir deux types d'insomnies deux types diminution l'éveil abord deux façons d'être insomniaque activant système d'éveil désactivant inhibant système sommeil premier cas plus fréquent devient hyperéveillé insomniaque parce l'on boit trop café exemple café agit effet acti vant certains neurones responsables l'éveil thé amphétamines douleurs l'angoisse agissent façon grande majorité insomnies ainsi dues l'activation système d'éveil type d'insomnie peut durer très longtemps ennuis douleurs dormirez mal deux trois nuits quatrième nuit dormirez bien récupérerez cette constatation signifie système sommeil capable fonctionner normalement malheureusement possédons encore drogue hypnotique physiologique aussi insomniaques prennent-ils dormir drogues dépriment l'âctivilé système d'éveil plupart drogues véritables narcott ques sens étymologique car surdosage conduit narcose coma non véritable sommeil outre presque toutes drogues diminuent suppriment rêve qualité sommeil devient mauvaise gens réveil lent alors fatigués vont donc boire plus café rentre cercle vicieux augmentation café thé matin midi entraîne davantage somnifère soir davantage suppression rêve c'est-à-dire davantage fatiglif lendemain matin ensuite c'est caus"
16,17,tour amphétamines l'insomniaque rentre cercle vicieux drogués quand veut guérir faire sortir cercle vicieux peut vraiment parler désintoxication oui sevrage esi nécessaire tout qu'il comporte rebond rêve donc risque narcolepsie privation d'amphétamines peut entraîner ainsi véritables syndromes narcoleptiques expérimentaux ailleurs faut faire sevrage brusque barbituriques d'hypnotiques chez gens troubles cardiaques sout-ils condamnés hypnotiques vie obligatoirement peu peu mettre point drogues agissant façon plus plus physiologique drogues indispensables traiter l'autre forme d'insomnie plus sévère heureusement plus rare c'est l'insomnie provoquée déficit système sommeil s'agit d'une insomnie chronique sans jamais bonnes nuits peut persister mois années entraîne souvent troubles secondaires incompalibles vie sociale normale problème pose devant type d'insomnie rétablir fonctionnement système séroloninergique cela commence être possible certains cas malheureusement encore trop rares dernière question portera recherches actuelles laboratoire recherches devenues multidisciplinaires couvrent nombreux aspects cycle veille-sommeilrêve comprendre rêve faut effet comprendre sommeil donc l'éveil équipes neurophysiologistes pharmacologistes essaient délimiter l'organisation différents systèmes neurones responsables cet état cela faut également histochimistes neuro-anatomisies neuro-chimistes côté étudient techniques plus plus complexes cuuieuses métabolisme cellules nerveuses cours l'éveil sommeil rêve interrelation outre faut essayer classer sinon déchiffrer codage neurones cours rêve cela suppose l'emploi d'ordinateur donc d'informaticiens mathématiciens d'électroniciens faut également étudier aspects génétiques phylogéniques ontagéniques rêve c'est pourquoi travaillons nombreuses souches souris ratons quelquefois animaux aussi étranges l'iguane python tanche enfin recherches effectuées chez homme moment intéressons surtout mécanismes mouvements oculaires cours rêve profitant bien entendu résullats obtenus chez l'animal d'autre part beaucoup d'enregistrement sommeil effectués titre diagnostique pronostique thérapeutique car commençons savoir uliliser certains troubles spécifiques l'électroencéphalogramme sommeil rêve repérer lésions troubles biochimiques portant certains neurotransmetteurs finalement l'aspect subjectif rêve intéresse devient freud tout cela m.j. pourrais presque répondre n'ai besoïin connaître freud efforcé relire l'interprétation rêves récemment voulez-vous interprétations rêve l'injection faite irma apportent neurobiologiste bilan cinquante ans d'étude rêves méthodes psychanalytiques consternant quinzaine années cornnent avez-vous élé amené choisir domaine d'étude sommeil m.j. raisons idéologiques lors allé première fois etats-unis 1954 j'étais imprégné idées pavloviennes rôle cortex cérébral processus d'apprentissage puis j'ai appris quelques éléments neurophysiologie chez h.w magoun los angeles cetle époque tronc cérébral plutôt formation réticulée deus machina nécessaire suffisant assurer mécanismes transactionnels plus complexes compris l'apprentissage lorsque rentré lyon 1956 j'ai décidé tester raison l'est l'ouest comme j'avais très peu d'équipement cette époque arrêté forme plus simple croyais d'apprentissage c'est-à-dire l'habituation réaction d'éveil c'est phénomène assez facile étudier lorsque l'on enregistre l'activité cérébrale d'un chat dort l'on fait bruit cela entraîne réaction d'éveil facilement enregistrable qauantifiable grâce l'électroencéphalogramme après quelques répétitions réaction d'éveil disparaît chat appris plus réagir stimulus non significatif pavlov raison chal sans cortex devait habiluer magoun raison devait s'habiluer très naïvement j'ai donc essayé abord garder vie chals totalement décortiqués ensuile d'enregistrer l'activité qu'il restait cerveau c'est commencé problèmes donc questions impossible moyens techniques 1956 d'objecliver variations l'activité électrique cérébrale chez animaux sans cortex donc impossible répondre question savoir raison pavlov l'école magoun j'ai donc élé amené choisir autre critère l'habituation c'est-à-dire activilé électrique muscles nuque c'est enregistrant pendant quelques heures jour cette activité l'on s'est aperçu qu'il périodiquement épisodes silence électrique lotal moment chat bougeait yeux moustaches coupé moustaches chats heureusement phénomène s'est encore reproduit c'était souvenir paradoxal c'est comme cela tout commencé ... publicité découvrez diverses techniques psychologiques graphologie grâce cours l'école psycho-graphologie etablissement privé fondé 1953 professeurs spécialisés psychologie générale psychanalyse psychologie l'inconscient caractérologjie morpho-psychologie graphologie d'orientation sélection professionnelles préparation profession graphologue cours publics séminaires conférences paris cours correspondance inscriptions toute l'année documentation gratuite p.-s. gaillat villa saint-pierre 94220-charenton tél 368.72.01 analyses graphologiques professeurs
17,18,
18,19,chiffre d'affaires réalisé l'industrie crèmes beauté semble témoigner fait suivant sévérité d'un jugement peut être fonction qualité peau pouvons l'enduire coldcream fond teint blanchir retendre farder pouvons changer apparence physique reste plus évidente caractéristiques personnelles cours dernières années attachées étudier force d'impact l'un aspects l'apparence physique beauté relations interpersonnelles lorsque commencé cette étude l'importance beauté semblait négligeable conformément l'opinion démocratique selon laquelle l'apparence physique serail qu'une caractéristique superficielle sans influence profonde déroulement vie pourtant elliot aronson suggéré sociologues jusqu'alors évité s'intéresser l'impact social beauté c'était précisément crainte d'en découvrir puissance l'opinion collective veut rôle joué qualités intérieures défaites réussites affectives plus important celui apparence extérieure n'est peut-être aussi exacte qu'on pense résultats expériences laissent supposer non seulement l'influence aspect physique déroulement vie plus importante l'avions cru tout abord encore cette influence peut commencer très tôt enfants déjà accordent préjugé favorable beauté physique plupart temps éducateurs écoles maternelles affrment ious enfants beaux demande n'en restent moins capables classer leurs élèves d'après apparence enfants eux-mêmes —————— semblent adopter comportement conforme jugement adultes deux constatations issues d'une enquête effectuée auprès écoles maternelles quelques écoles essayé d'analyser manière dont élèves voyaient uns autres exemple instituteur remettait élève photographies condisciples demandant sélectionner celui qu'il préférait celui qu'il aimait moins l'instituteur posait aussi quelques questions telles chouchou maître commence toujours chahut classe cherche plus souvent querelle camarades enfants soumis enquête âgés quatre six ans pensions enfants plus âgés ceux plus temps assimiler stéréotypes liés l'apparence aussi plus influencés séduction physique leurs camarades vérifier cette hypothèse divisé sujets deux classes d'âge puis étudié réactions enfants l'égard ceux leurs camarades jugés plus séduisants plus rebutants adultes premier lieu constater garçons considérés adultes comme relativement peu attirants jouissaient sympathie garçons jugés plus séduisants cela quel âge garçon contraire groupe plus jeune fillettes peu attirantes plus populaires autres mesure qu'elles grandissaient petites filles laides perdaient popularité profit plus jolies également étudié manière dont enfants décrivalent comportement leurs camarades classe découvert qu'ils tendance décrire garçonnets affligés d'un physique ingrat comme plus agressifs plus asociaux
