,page,text
0,1,lee ean sens
1,2,publicité baine architecturale mieux comprendre mieux aîmer villes faites connaissance l'équipe fait reculer l'administration promoteurs destrucieurs combat qualité ville vie connaissances paramet france 18.dec.1986 contre pollution passe jour l'on découvre iles prennent tout doucement valeur exacapres objet bibliophilie saitpresse télévision bonne adresse passe ement comme monument sauver demeure bef soninagé =gxemplé ouvrages paris deviennent rares cote monte plus plus mesure jour non plus l'on parle valeurs années passent menacées civilisation moderne connaissances paris france monde effet passionnant beau- comporte coup côtés quelquefois trop vite cette hâte numéros d'actualité destructions restaurations sans casse problèmes d'urbanisme société scandales victimes désignées moins moins numéraux spéciaux vieilles boutiques consentantes cette évolution ville ville rues souterraines etc tour tour vieux quartier villes aimons leurs vieux quartiers rue pittoresque étudiés détail maison extraordinaires environnement leurs arbres histoire maison défendre groupes plus plus puissants plus chaque numéro révèle lieux interdits lèvent certains déjà obtenu beaux succès car public visites-conférences elles-mêmes effet quoi bon applaudir progrès cosmo- autorisées nautes autre côté exemple promoteurs immobiliers saccagent reste environ- quelques exemples nement 3/4 canal saint-martin ceux s'intéressent toutes choses maintenant revue passionnante c'est connais- 4/5 rue mouffetard maison maison sances paris france 1971-1972 8/9 auteuil village paris 12/13 premier guide touristique moritmartre aussi curieux cela puisse paraître n'existe guide montmartre celui-ci permet visiter vieux village maison maison rue rue enseigne sans pitié aucune îles bons restaurants mauvais belles galeries autres encore gibets marais d'hier demain enseignes connaissances paris france c'est équipe dirigée payen-appenzeller concours plus célèbres amoureux paris jacques hillairet pillement etc d'anvcects connaissances paris france plus qu'une luxueuse revue mieux dire fait partie revues l'on heureux après avoir lues ranger bibliothèque rayon d'art tellement elles belles bien illustrées aussi parce qu'elles contiennent études uniqu renseignements rarissimes sujets lon one contre permet recevoir content relire montrer amis enfin parce conditions apéch france éciales d'abonnement von
2,3,comprendre savoir agir monde d'aujourd'hui avril 1973 chercheur idées ferdinand saussure naissance linguistique structurale monique chassang entretien professeur michel jouvet connaissances sommeil remises question jacques mousseau société beauté physique rend vie plus facile devrait être aveugle être impartial ellen berscheid elaine walster couple l'homme face contraception souvent attitude inconsciente refus gilbert tordjman enfance adolescence enfants télévision mass media font jeunes générations robert liebert rita poulos connaître autres langage corps vérité sort bouche alain drimmer psychologie expérimentale effort physique effet psychologique sport peut transformer personnalité ismaïl l.e trachman psychologie clinique psychiatrie service l'etat questions propos passe u.r.s.s. david shaw sidney bloch ann vickers librairie corps michel bernard psychodrame gennie paul lemoine alfred adler manès sperber chronique indiens guayaqui paul clastres bref allemagne france etats-unis angleterre informations echos who who psychologie prochain numéro mis vente mai 1973 centre d'etude promotion lecture abonner paris 359.86.50 225.02.88. voyez page rtttcttt true pet lun centaine etes inr
3,4,chercheur iclèes —————— monique chassang langues parentes peuvent devenir ferdinau saussure professeur linguistique moscou commençait cours demandant élèves faire l'analyse logique d'une phrase dont voici traduction approximative kouzdre gloqueuse chtèquement boldané bocre coudrille boquereau1 voulait ainsi prouver formés partir racines inexistantes mots prennent sens obscur soit-il partir moment obéissent algèbre langue cette découverte langue comme système parole comme fonctionnement système niveau individuel marqué l'avènement linguistique moderne début siècle effet n'est qu'en 1870 vint demander quelles conditions vie langues écrit lui-même saussure cette réflexion naissante reprendre poursuivre.jusqu fin vie donnant ainsi naissance première véritable théorie langage pressentant première véritable théorie signe linguistique famille savants milieu familial vieille famille genevoise souche française huguenote compte nombreux scientifiques lequel naît ferdinand saussure novembre 1857 pensée œuvre future importance décisive fera très jeune l'apprentissage d'une forme d'esprit culture essentiellement scientifique dont trace retrouve aussi bien premiers mémoires cours linguistique générale marquera l'aboutissement pensée dès l'âge quinze ans entreprend rédaction d'un essai langues prouvant ainsi précocité intérêt problème linguistique pourtant après traditionnelles études classiques genève saussure hésitera quelque peu avant s'orienter définitivement propre aveu note qu'il perdit année suivre cours chimie confor smer sorte tradition famille n'est l'année suivante 1876 qu'il décide s'inscrire faculté leipzig alors capitale jeune linguistique étudiera pendant deux ans langues anciennes sanskrit vieil iranien vieil irlandais vieux slave lituanien grammaire res cru sos comparée surtout nouera relations tous jeunes linguistes formeront plus tard mouvement junggrammatiker néo-grammairiens effet renouveau train dessiner cette science s'est constituée autour faits langue moment saussure entreprend carrière linguiste peut être utile connaître évolution antérieure avant d'aller plus avant saussure fournit aperçu l'introduction cours lin- guistique générale parlant mésa- ventures qu'elle subit avant re- connaître quel véritable unique objet5 linguistique avant saussure c'est 1826 qu'apparaît première fois terme linguisti- désigner l'étude comparative historique langues nouvelle tendance s'attache alors étudier rapports langues entre elles saus- sure note signification l'impor- tance cette vérité souligne mérite jones bopp compris relations entre photo extraite saussure mounin/segher matière d'une science autonomes autour bopp former école dont fera partie curtius futur profes seur saussure leipzig critiques qu'adresse saussure cette école mettent lumière propres exigences non plus s'est jamais préoccupée dégager nature objet d'étude faute méthode permettre conclure limitant comparer demeurant malgré tout étrangère réalité véritables conditions tout langage grammaire langues manes diez publiée 1836 1838 vie langage whit ney paraît 1875 l'impulsion donnée dernière école forme celle junggrammatiker grâce cette école replacés perspective historique tous résultats comparaison chaînés faits ordre naturel8 saussure reconnaîtra mérite d'avoir établi langue n'est organisme déve loppe lui-même produit l'esprit collectif groupes linguis tiques dès cette époque saussure participe donc façon très active vie linguistique peine dix-huit ans demi lorsqu'il accueilli comme membre société linguistique paris premier grand ouvrage mémoire indo-européen paraît 1877 suivi 1878 d'un mémoire système primitif voyelles langues indo-européennes études universitaires leipzig s'achèveront l'année suivante thèse doctorat traitant l'emploi génitif absolu sanskrit 1880 saussure vient fixer paris restera dizaine d'années d'abord étudiant l'ecole pratique hautes études sous direction bréal occupe l'année suivante chaire dernier grammaire comparée relations meillet sommité linguistes grec ——— glokaïa kouzdra chtéco boldanoula bocra koudriatchit bocrenka cité oupensky slovo slovakh 1954 gné- saussure cours linguistique rale abrégé c.l.g paris payot etudes documents 1971 saussure souvenirs saussure genève droz 1980 c.l.g. c.l.g. c.l.g. c.l.g. c.l.g. c.l.g.
4,5,suivront jusqu mort bien meillet n'ait toujours admis compris exactitude îles théories saussure écrira 1916 doc trines qu'il enseignées explicitement cours linguistique géné rale celles dont s'inspirait déjà l'enseignement grammaire compa rée qu'il donné vingt ans plus tôt l'ecole hautes études j'ai reçu retrouve telles qu'il souvent possible îles devi ner dès l'année 1882 saussure nommé secrétaire adjoint société linguistique donne chaque année communications notes mémoires importants tout dirigeant mémoires société cours linguistique generale cette période d'activité intense fera suite retour définitif genève l'on crée chaire extraordinaire professeur d'histoire comparaison langues indo-européennes n'est partir 1907 qu'il donnera enfin cours linguistique générale jusqu'en 1911. c'est aussi paradoxalement cette époque qu'il pratiquement cesser toute publication suspendre tout contact relations s'enfoncer silence progressif dont raisons n'ont clairement élucidées jour seuls quelques témoignages saussure lui-même donnent idée bien dégoûté tout cela difficulté qu'il général écrire seulement dix lignes sens commun matière faits langage ll. l'incompréhension amis plus proches inaptitude suivre terrain nul encore s'était aventuré peuvent expliquer quasi-silence marquera dernières années vie lorsqu'il meurt février 1913 cessé d'enseigner depuis deux ans laisse notes éparses fragmentaires rien publié cours linguistique générale celui-là paraîtra trois ans plus tard rédigé charles bally albert sèchehaye partir leurs notes celles cinq autres auditeurs enrichi notes personnelles laissées ferdinand saussure peut demander quelle mesure cours représente effectivement pensée auteur quelle mesure traduite reproduite fidélité propre aveu charles bally albert sèchehaye tenté constitution synthèse base troisième cours travaux plus récents effectués godel sources manuscrites ceux mauro rudolf engler cours lui-même montrent bien cette entreprise avoir châtrant face pensée encore très fluctuante indécise cette responsabilité initiateurs l'ont discernée assumée d'entrée espérant seulement critique saura ... distinguer d'elle-même entre maître interprètes définir objet d'étude avant l'aborder voilà peut aujourd'hui passer évidence l'était 1907 surtout lorsqu'il s'agissait d'une science déjà ancienne reconnue quel l'objet fois intégral concret linguistique comment fonder réellement nouvelle science plutôt concevoir nouvelle approche d'un vieux problème lorsque multiples directions semblent avoir exploitées sans but n'ait jamais réellement atteint quel but difficulté principale matière langage réside fait bien loin l'objet précède point vue dirait c'est point vue crée l'objet île fait langage s'éclaire différemment selon l'angle sous lequel l'observe sans jamais vue d'ensemble possible expression d'une idée enchaïînement signes symboles filiation naturelle depuis racine latine grecque autre etc quelle perspective adoptée obtient autant définitions langage être toutes exactes n'en moins incomplètes qu'est-ce linguistique quelle parmi multiples approches possibles part exacte linguistique saussure répugnera élucider cette question priori préférant noter parmi tâches linguistique celle délimiter définir ellemêmelé cela démarquant sciences connexes concourent l'éclairer l'enrichir linguistique rapports très étroits d'autres sciences sociologie physiologie psychologie phonologie etc tantôt pruntent données tantôt fournissent limites l'en sépa rent n'apparaissent toujours net tement c'est donc double définition ————— 10. bulletin société linguistique paris tome 1916 11. lettre meillet janvier 1894 godel sources manuscriles cours bailly sèchehaye c.l.g. c.l.g. c.l.g. c.l.g. 20. c.l.g. suivantes apprenez psycho logie évolution personnelle sociale proiessionnelle enseignement individualisé correspondance cours oraux soir paris lille stages pratiques paris lausanne ... frais d'études déductibles revenu brut préparation divers diplômes sous conduite praticiens réputés psychotechnique graphologie morpho-psychologie psychopédagogie symbolisme rorschach cours international sexologie normale pathologique rééducation graphique relaxation psychosomatique etc dirigeants cadres médecins étudiants infirmières assistantes sociales enseignants parents tous ceux s'intéressent problèmes humains éclairés psychologie moderne profession vue d'une carrière principale secondaire institut francais culture humaine établissement privé d'enseignement distance paris lille direction administrative foch 59-marcq-lille nom profession adresse souhaïite recevoir gratuitement documentation générale formule d'orientation contre timbres spécial revüe vie action mesure l'intelligence
5,6,ferdinand saussure linguistique éfructurale qu'invite saussure celle l'étude celle l'objet d'étude l'originalité cette démarche réside fait.que élucidées choses non mots expliquer langue langue entreprise hasardeuse toute définition faite propos d'un mot vaine certains termes ambigus recouvrent d'une langue l'autre prouvent ainsi l'allemand sprache signifie langue langage rede veut dire parole discours latin sermo signifie /angage parole lingua langue langue langage parole discours donc aucun cas synonymes malgré parenté importe avant tout fixer postulats d'assigner chacun signification dont l'immutabilité respectée chacun points l'étude entreprendre langue n'est qu'une partie langage ainsi situer objet d'étude importe différencier objets parents proches première différenciation celle touchera langue langage saussure lan gue seule apparaît être susceptible d'une définition autonome ... faut placer prime abord ter rain langue prendre norme toutes manifestations langage langue peut confondre langage car n'en qu'une partie déterminée raison choix entre autres langage multiforme hétéroclite fois physique physiologique psychique individuel social d'unité réelle alors langue contraire tout soi suite seul principe classification naturelle domaine prête aucune autre opter langue comme objet d'étude donc choix nécessaire l'on veut maintenir étude cadre rigoureusement linguistique nouvelle distinction s'impose car saussure langue trésor déposé pratique parole sujets appartenant communauté qu'est-ce distingue langue parole l'observation phénomènes produisent l'acte parler c'est-à-dire communiquer montre impliqués fois falts naissance ondes sonores physiologiques phonation audition psyentr ques images verbales concep faits conscience quoi vient s'ajouter faculté d'association coordination manifeste dès qu'il s'agit plus faits isolés cela peut s'exprimer schéma suivant physiques mécanisme parole phonation audition concept image acoustique audition phonation saussure explique schématise ainsi deux domaines langue parole langue existe collectivité sous forme d'une somme d'em preintes déposées chaque cer veau c'est donc quelque chose chacun d'eux tout commun tous placé dehors volonté dépositaires mode d'existence peut être repré senté formule p1+1+1+1.=1 tif parole somme gens disent comprend combinaisons individuelles pendant volonté ceux parlent actes phonation également volontaires nécessaires l'exécu tion combinaisons donc rien collectif parole ... rien plus somme cas particuliers selon formule 4177 linguistique proprement dite celle dont langue l'unique objet modèle collecla langue comme systeme déterminé objet saussure définir qu'il entend système comparaison demeurée célèbre celle jeu d'échecs langue dit-il système connaît ordre propre possède donc logique interne faudra chaque fois poser ques- tion nature tout phénomène agissant interne externe s'il externe étude appartient propre linguis- tique recouvre sphère délimitée jeu d'échecs remplace pièces bois pièces d'ivoire changement indifférent système diminue auc mente nombre pièces chan gement-là atteint profondément grammaire jeu notion système existait linguistique bien avant saussure n'avait guère jusqu'alors qu'une valeur métaphorique 1751 james harris écrivait qu'on peut donc dernière analyse définir langage comme système sons articulés signes symboles idées5 parle système linguistique comme sys tème nerveux veineux politique ensemble choses liées entre elles cette figure discours saussure faire processus opératoire déterminant exactement éléments système îles distinguant entourage première question poser donc nature tous phénomènes agissant langue externes étude indépendante l'étude linguistique proprement dite internes feront partie jeu-langue pieces jeu-langue ————————— quelles donc pièces jeu langue jeu d'échecs tout entier combinaison différentes pièces langue caractère d'un système basé complètement l'opposition unités concrètes signes linguistiques nature concrète c'était caractéristiques langue abstractions réalités eur siège cerveau signes tangibles l'on peut fixer l'écriture image sensible langue signes constituent saussure nomme unités entités concrètes linguistique deux principes définissent d'une part elles n'existent l'association signifiant signifié d'autre part elles doivent être délimitées agir opposition mécanisme langue association signifiant suite sons nest linguistique support d'une idée syllabe valeur qu'en phonologie signifiant donc partie l'entité signifié séparé signifiant appäl tient psychologie c'est concept idée d'arbre maison devient entité linguistique association image acoustique c.l.g. c.l.g. c.l.g. c.l.g. c.l.g. c.l.g. c.l.g. 43. cal 25. harris hermes philosophica uc- quiry concerning universal grammar fon thurot 1796 336. c.l.g. c.l.g.
6,7,"l'association signifiant/signifié donc entité deux faces l'on peut comparer composé chimique comme l'eau composée d'hydrogène d'oxygène dont aucun éléments pris séparément propriétés l'eau délimitation lorsqu'on entend langue inconnue impossible d'en analyser suite sons car peut tenir compte l'aspect phonique l'entité linguistique figure chaîne parlée immédiatement délimitée chaîne phonique linéaire l'oreille perçoit aucune division suffisante précise cela faut faire appel significations alors seulement voit parties détacher quel sens quel rôle attribuer chacune condition essentielle l'étude linguistique seule définition l'on puisse finalement donner unités tranche sonorité l'exclu sion précède suit chaîne parlée gnifiant d'un certain concept primauté donne saussure notion système déterminer second grand choix théorique qu'il opérera après distinction langue/parole seconde bifurcation constitutive linguistique moderne considérait jusqu'alors l'étude langues comme science unique plutôt historique s'attachait l'évolution celles-là axe successivité altération saussure sans renier allouer cette linguistique évolutive place revient affirmant primauté linguistique synchronique diachronique effet linguistique diachronique peut étudier rapports reliant termes successifs non aperçus conscience collective substituent uns autres sans former système entre facteur temps dont l'action système indépendant système luimême intervient parmi règles contraire linguistique synchronique masse parlante seule réalité étudie objet cast 0,9 état donné l'axe simultact néités laps temps miki nimal peut être considéré comme équilibre soustrait l'évolunu tion mouvement l'évolution d'une langue temps effet inexisais tante sujet parlant linguisju tique synchronique donc qu'une perspective non temporelle alors diachronique deux l'une prospective l'autre rétrospective quoi fonder affirmer comasset ploreuue édition langue française autres langues plus ancienne revue concernant l'éducation santé gage sérieux relativèment peu connue c'est qu'elle vend depuis création 1890 uniquement abonnement gage confiance quelle autre publication faire autant sait qu'elle peut compter fidélité lecteurs nombre toujours croissant l'intérêt rubriques culture humaine psychologie corps humain médecine traitements naturels diététique page femme troisième âge enfants etc gage utilité pratique apporte chaque mois lecteurs l'essentiel vie physique mentale plus harmonieuse gage d'enrichissement manque d'être plus connue n'hésitez profiter l'offre ci-dessous possible s'abonner directement siège revue emilezola 77190 dammarie lys france abonnement annuel 35ff 400 feb étrangor sièges nationaux belgique rue ernest allard 1000 bruxelles canada 7250 rue valdombre saint-léonard montréal 451 suisse l'eglise-anglaise 1006 lausanne revue internationale d'éducation familiale sanitaire bon spécimen gratuit découper recopier mentionnant référence ps1 renvoyer vie santé emile-zola 77190 dammarie lys france veuillez m'envoyer sans engagement part spécimen revue mme mlle n°1 111 rue code postal ville llllelllliiitli ps1"
