,page,text
48,49,linguistique appliquée problèmes fondamentaux l'apprentissage langues l'école vie quotidienne encore apporté beaucoup solutions pratiques bien qu'ils annexés d'autres sciences humaines modèles linguistiques n'ont général peu rapport processus lesquels individu acquiert langue cependant c'est processus doit passer toute tentative mieux enseigner langue surmonter obstacles apprentissage atteindre mécanismes acquisition question fallu étendre recherche vers monde extérieur sujet l'intermédiaire sociolinguistique discipline vise vie langage contexte social travers diverses situations d'interaction entre hommes mener temps exploration monde intérieur grâce psycholinguistique étudie processus psychologiques sous-tendent production langage reconnaissance compréhension aussi mémorisation ... jeune science neurolinguistique plus récemment encore bases offertes neurophysiologie s'est cristallisé l'on appelle neurolinguistique évident premiers intéressés cette nouvelle approche interdisciplinaire 1ous ceux affectés perturbations langage émanant cerveau malades handicapés parents derniers au-delà cas cliniques cesse tirer l'observation fonctionnement pathologique langage données fondamentales mécanismes cérébraux expli- quent fonctionnement normal ainsi peut-on espérer grâce l'étude neuropsychologique non seulement posséder connaissances mieux agir devant problèmes communication cause biologique aussi surtout arriver meilleure compréhension façon dont apprend langue passe-t-il donc cerveau lorsqu'on met parler lire écrire neurolinguistique tant branche spécialisée sciences cerveau encore toute jeune précédée travaux étendus plus cent ans travaux débuté tentative d'analyse mécanismes langage partir conditions pathologiques provoquées certaines lésions cérébrales 1861 chirurgien anatomiste français paul broca établi qu'une lésion tiers postérieur circonvolution frontale l'hémisphère cérébral gauche provoque trouble l'élocution alors mouvements lèvres langue larynx affectés cette région siège mécanismes lesquels reposent schémas moteurs parole 1874 psychiatre allemand carl wernicke3 fait seconde découverte montré qu'une lésion tiers postérieur circonvolution temporale supérieure l'hémisphère gauche perturbe perception langage sans affecter l'aptitude parler ainsi identifier schémas sensoriels parole recherches grand mneurologue anglais john hughlings jackson permis époque d'émettre l'hypothèse l'unité linguistique tant mot isolé l'énoncé global cet énoncé trouve perturbé lorsque cerveau souffre lésions localisées cette découverte suivie bien d'autres conduit étudier minutieusement l'unité phrase linguistique elle-même définie plus tard comme principale partie constitutive langage recherches ultérieures toute série grands neurologues psychologues divers pays délimité aires cortex cérébral ————— sciences humaines france peut-être plus qu'ailleurs particulier l'anthropologie structurale l'étude communication humaine sémiologie études littéraires dérivées cette dernière emprunté adapté mesure variable plus moins succès selon cas méthodes d'analyse appartenant linguistique structurale broca 1824-1880 chirurgien anthropologiste français étudia principalement cerveau localisa fonction parole l'hémisphère gauche celui-là 3.c wernicke 1848-1905 neurologue allemand élevé l'analyse langage troubles niveau jamais atteint auparavant. j.h jackson 1834-1911 physicien neurologue anglais développa théorie affirmant crises d'épilepsie résultent décharges soudaines matière grise cortex cérébral
49,50,lesquelles localisés divers aspects langage production réception organisation sémantique etc. ensuite grâce développement chirurgie cerveau aujourd'hui l'échelle microscopique techniques complexes l'électroencéphalographie accompagnées stimulation électrique cerveau esquisser sorte cartographie régions cérébrales particulier corticales reliées différentes fonctions spécialisées cependant abandonner théories localisation trop simplistes fondées ftopographie détaillée tel tel centre chargé d'une fonction particulière théories très prisées début siècle s'agit contrôle exclusif d'un aspect langage zone donnée l'aire langage n'opère isolément plutôt identifier mode dynamique d'interrelation entre différentes zones dont l'une sans doute dominante malgré fait dessins cerveau semblent présenter localisations bien établies voir l'encadré ci-contre l'interaction fonctions relativement localisées différentes régions n'est explication neuropsychologique elle-même processus spécifiques d'ordre psychologique linguistique constituent langage pouvons décrire fort difficile trouver mécanismes cérébraux correspondant ceux-là non seulement sciences humaines sciences cerveau utilisent vocabulaires distincts mêmes mots réfèrent réalités totalement différentes concepts unes d'une utilité limitée autres propositions l'analyse linguistique lorsqu'elles réfèrent système nerveux incertaines jorsqu elles certaines elles réfèrent nullement système nerveux écrit exemple éminent chercheur n'est reproche modèles formels linguistique seulement conçus autres fins psychologie travaux piaget grand avantage lier langage connaissance travers analyses successives perceptions notions l'enfant peuvent être mis corréla- tion développement physiologique cerveau malgré difficultés bien d'autres cette étude langage nécessairement psychoneurolinguistique dont bases interdisciplinaires s'établissent plus plus sûrement aujourd'hui l'un pionniers cette approche mul52 hémisphère gauche d'un droitier face externe scissure rolando image mai motricité lecture oreille corticale perceptions visuelles temporal langage entendu cerveau noëtique vue latérale face externe s'agit l'hé misphère gauche dominant d'un droitier voit diverses régions aires frontale avant occipitale arrière pariétale baut temporale bas localisations cérébrales région frontale centres primaires moteurs circonvolution frontale ascendante avant scissure rolando avant zone prémotrice coordination motrice gestes centres l'écriture langage parlé centre broca tout avant zone préfrontale cerveau contrôle soi région pariétale centres primaires sensibilité générale peau muscles arrière scissure rolando circonvolution pariètale ascendante arrière bas zone coordination sensitive sens palper image schéma corporel vocal région occipitale arrière zone primaire réception visuelle précision couleur correspondant centre rétine fovea avant zone coordi- nation visuelle perception centre lecture région temporale centre réception pri- naïve auditive oreille corticale des- sous zone coordination auditive reconnaissance sons centre langage entendu machine penser cerveau noëtique gtveau sensorimoteur comprend zones frontale motrice sauf préfrontal parié- tale occipitale temporale tiple psychoneurolinguiet lennebergf dont livre bio eric foundations language 1967 synthèse indispensable recherche plus prometteuse compris propre théorie teur professeur lenneberg achs maintenant réalisation ouvrage collectif compte l'unesco premier panp rama complet problèmes développement langage abordé toutes disciplines intéres emprunté arguments cet article quels donc façon très schématique fondements l'acquisition langage tels qu'un certain nombre chercheurs découvrir peut-on crire quelques découvertes récentes doinaïne pathologie langage surtout devraient vraisemblablement permettre mieux agir problèmes concrets sées ssentie naissance homme cerveau moins développé singe lenneberg langage classe parmi fonctions cognitives évoluent selon programme biologique déterminé relativement indifférencié différencié simple complexe grandes étapes l'acquisition langage liées grandes étapes maturation physique développement cognitif affectif tout tient différents niveaux exerçant influence réciproque uns autres impossible faire apprendre langue enfant dont maturité sensori-motrice insuffisante période critique entre dix-huit 1irente-six mois l'apprentissage langage dix-huit mois l'enfant moyen appris entre trois cinquante mots puis subitement spontanément extension activité paraît simple évidente arrive dominer vers fin troisième année vocabulaire quelques milliers mots commence maîtriser règles siructurales langue limite inférieure cette période peu aprés naissance système nerveux possède aucune caractéristiques jacobson brain development rele- tion language manuscrit non publié paraître l'ouvrage collectif préparé lenneberg lennebétg professeur département psychologie neurobiologie l'univ sité cornell etats-unis cognition comprend tout processus lequel l'organisme prend connaissance objet perception reconnaissance conceptualisation jugement ral ment tie lroan l'et
50,51,géfinissent maturation fin ériode marquée celr plasticilé possibide s'adapter réorganiser lhê jan fonctions propre sure eune cerveau liée tés mène uniquement humain éralisation fonctions période critique passée cerveat- jamais apprendre langue facilité qu'au âge vie ailleurs ations cas récun parole après montrent qu'une fois latéétablie puberté l'aphasie irréversibles entre trois six mois plus tard marc richelle résume ainsi processus déroule pendant celte période privilégiée vie exposé entourage linguistique pourtant relativement constant jeune enfant commence parler d'emblée développement langage réalise travers succession d'étapes s'actualisent clairement potentiels organiques chaque fois accrus lenneberg voit réalisation structure potentielle innée sans pouvoir encore définir correspondances neurophysiologiques iangage lenneberg néanmoins dégagé tableau substrats biologiques permettent l'émergence spontanée entre dix-huitième vingt-huitième mois parole voir tableau 54-55 quel l'état cerveau surlout cortex pendant cette période privilégiée lenneberg dégagé trois séries changements fondamentaux changements cerveau changements composition chimique cerveau changements électrophysiologiques caractéristique principale cerveau humain l'explosion fibres nerveuses cortex après naissance naissance cerveau chimpanzé plus mûr celui l'homine dessins faits laboratoire d'après coupes sériées cerveau montrent façon nette l'augmentation unes connexions entre perd dendrites dre réseau très dense grou ifférentes aires cortex eur pes dendrites atteignent rentes nuitée époques difféque l'âge deux ans marphase approximatif d'une période rpissance plus lente après suit croissance explosive naissance suite sance iquement plus croisout recherches domaine structuraux chimie cérébrale beaucoup plus den durs nee blème veux pto dire développement rame ppement gaine substance blanche appelée myéline priélanl fibres nerveuses grises gaine déclench entre axe recherches mix cre fai récentes fait apparaitre phénomène cycle myélogénétique tel cycle compose période allant première apparilion gaines myéline zone donnée jusqu'au moment l'observation montre arrêt rapport cerveau adulte normal peut commencer plus tôt plus tard peut être long court cycle myélogénétique certaines fibres voie auditive celui fibres liant deux hémisphères d'autres faisceaux d'association silue pendant période critique l'augmentation quantité d'éléments comme cholestérol également liée cette phase l'électroencéphalographie peut fournir preuves d'un changement rythme ondes cérébrales prime enfance courbe croissance rythme alpha central particulièrement intéressante taux augmente très précisément l'âge deux ans l'important l'examen détaillé faits évoqués brièvement ici semble-t-il pouvoir définir atteignant petit petit plus grand degré précision qu'est maturation cerveau rapport fonctionnement langage comment développe réalise l'information contenue matière grise elle-même aclivilés complexes l'acquisition langage lieu réalité bases physiologiques simplicité rapport l'extraordinaire complexité opérations doivent assurer aires langage seule adapjation respiration l'appareil musculaire connexe fait appel plus cent muscles doivent exécuter mouvements infiniment précis rapides qualorze fois chaque seconde ordre doit être transmis chacun muscles contracter relâcher maintenir tonus lorsqu'on parle outre production sons niveau phonologique cerveau doit régler taux débit êvenements articulatoires mots ensuite l'agencement événements capacités cognitives imposent vitesse maximale quatorze syllabes seconde opérations musculaires percep fives nécessaires l'encodage décodage sons peuvent produire toutes fois échanges enire neurones peuvent non plus correspondre exaclement contractions musculaires parole car fibres nerveuses sensilives motrices longueurs largeurs très variables doit donc rechercher firing order ordre tir séquences aulomaliques réglant synergies neuromusculaires neurolinguistique peut donc faire appel modèles linéaires fondés l'idée d'une simple chaîne d'associalions chaîne parlée préprogrammée c'est sorte mosaïque assemblée pièce pièce dont l'image totale existe départ l'acte linguistique découle donc possibilités création génération possède l'organisme préoccupations neurolinguistique grammaire générative rejoignent seulement cette dernière s'intéresse uniquement —————— latéralisation spécialisation chacun hémisphères s'établit maturation cerveau naissance pendant quelque temps après différentes onctions peuvent être assurées l'hémisphère gauche l'hémisphère droit indifléremment fur mesure système nerveux différencie fonctions viennent être localisées l'un hémisphères ainsi c'esi l'hémisphère gauche dominant concerne langage chez droiliers c'est-à-dire plupart sujets latéralisalion cérébrale voir l'article paru psychologie pense gauche aime droite l'aphasie perle langage due général lésion cerveau rend inguérissable chez l'adulte revanche chez l'enfant d'étonnantes récupérations possibles grâce capacité d'autres régions cerveau venir aide assumer responsabilité fonctionnement langage classification très schématique aphasies d'après langage paris c.e.p.l.-denoël 1973 aphasies d'expression malade éprouve difficultés réalisation phonèmes parvient manier morphèmes constituent mots concalénation éléments fait difficilement l'aphasie réception surdité verbale malade présente troubles compréhension verbale l'aphasie amnésique trouble sélection morphèmes traduit souvent l'incapacité nommer objets faits désorganisations langage écrit 10. richelle l'acquisition langage bruxelles dessart 1971 170. cellule nerveuse neurone coïprend soma corps cellulaire muni d'un noyau arrivent fibres influx centripète dendrites d'où part fibre elfectrice longue axone 12. voir a.r lecours myelogenetic correlates the development speech and language manuscrit non publié paraître l'ouvrage collectif préparé lenneberg 13. sujet repos sensoriel mental cerveau puise régulièrement rythme dix seconde intensité quelques millionièmes volt ondes alpha traduisent synchronisation toutes pulsions neuroniques provoque activité cérébrale ondes alpha remplacées ondes d'activité fréquence plus grande moindre intensilté voir sujet article chauchard cerveau système nerveux psychologie moderne paris c.e.p.l.denoël 1967 associalion plusieurs facteurs concourent action effet unique
51,52,srétnetiele den nee age d'après lenneberg developpement lang etapes développement maturation ste nerveux développement normal age langage peut soutenir tête position allongée environ achevé sveloppen mois mois émergence roucoulement babillage premiers mots biological foundations language 128-130 180 181 moleur poids coudes marcher commence pouvoir sauter courir manipuler bien objets meilleure position assise capacité rythme maturation ralentit coordination mouvements complexes mois acquisition langage ans certain affinage grammaire expansion vocabulaire apprentissage lecture l'écriture 11à 14ans accent étrange quand langue nouvellement apprise adolescence sénilité plus difficile l'équipotentialité éventuellement remplacée lateralisation grâce peuvent charger l'activité affectée compétence fois qu'elle acquise aujourd'hui neurologues font aborder mystère l'acquisition cette compétence s'interrogent temps l'existence d'un principe organisateur vraisemblablement rythme biologique permette comportements aussi élaborés commandes aussi nombreuses étroitement synchronisées cette coordination merveilleuse fondée équilibre très délicat moindre atteinte architecture neuronique cerveau peut complètement bouleverser l'étude cas pathologiques éclaire problèmes langage préhistoire neurolinguistique commence débuts aphasiologie c'est-à-dire l'étude aphasies pathologie cesse renseigner normal l'avons dit comment clinique offre expérience effectuée nature elle-même lésion déforme schéma normal d'interaction parmi en- semble d'activités n'ajoutant rien réduisant complexité éli- minant plusieurs facteurs résulte toutes sortes ré- arrangements étudiant neurolinguiste accéder interrelations qu'il n'aurait devinées autrement ainsi l'évo- lution l'aphasie l'âge sujet acquisition d'une seconde langue plus démontré l'équipotentialité primitive hémisphères diminution plasticilé cerveau trouble peut informer fonctionnement normal quels mécanismes correspondent oppositions phonologiques quelles conditions sous-tendent l'attribution sens mot formation phrases quels mécanismes transformation pensée l'énoncé linguistique recherches importantes menées l'équipe soviétique professeur alexander romanovich lurialé doyen neuropsychologie clinique prenons exemple problème sens mot n'est simplement tiré d'un stock donné lexique langue n'est non plus simple désignation d'un objet pro- noncer comprendre mot exi- gent choix certain complexe sonore combinaisons sons souvent distinguées unes autres différences in- fimes également réper- toire d'objets possibles exem- ple homonymes synonymes analogues certaines langues comme l'anglais français beaucoup mots dont significa- lon multiple outre derrière mots tout système généralisation dont l'évolution expansion contraction selon achèvement très lent maturation asymptote tous sauf myélinisar e.e.g päramètres aucune cas observe manière frappante développement lan gage chez l'enfant raisons professeur luria conçoit émis sion d'un mot comme choix matrice connexions potentielles deux niveaux sens quels moyens utilisés établir connexions voulues qu'elles dominantes secondaires c'est-à-dire liées l'arrière-fond d'un mot gnifications analogues grâce méthode expérimentale tester choix mots leurs champs sémantiques l'école luria ensuite aborder question savoir quels mécanismes neurologiques participent 15. noam chomsky linguistés comme réclament méthodes grammaire générative compétence possibilité créatrice illimitée poss l'esprit construire comprendre nombre infini phrases alors formance constituée actes guistiques sujet parlant comme ruwet jntroduction out maire générative paris plon 1267 sujet adulte parlant langue donnée tout moment capable d'émettre spontanément percevoir comprendre art indéfini phrases eupara- jamais prononcées entendues peer vant tout sujet parlant possède peler taines aptitudes spéciales qu'on peu pré compétence linguistique qu'il lriode enfance cours brève d'apprentissage langage. s16 luria psychologue soviétique pro seur psychologie l'université qur travaux portent principalemen lire rapports langage pensée chologie sujet long entretien paru 17. proc 131 essus ion gamme :8ë rex plasticité jeune cerveau naissance jusqu quatorzième année pius tard deu brt
52,53,gont capables d'assurer arisation définitive gauche cas langage cerveau normalement très sélectif grâce deux caractéristiques définies loi force pavlov excitation forile provoque réaction forte excitation faible réaction faible constituent relation entre excitation inhibition d'une part possibilité variation d'autre part certaines conditions exemple lésion cette sélectivité entamée réactions normales perturbées luria cite description admirable tolstoï d'un état somnolence cela produit également .…sur cette croupe s'étalait tache blanche rostov parvenait identifier etait-ce clairièrc forêt éclairée lune maisons blanches sembla quelque chose bougeait long cette tache neige sans doute cette tache tache lache rêvassait rostov non tache ... natacha sœur yeux noirs tacha… oui oui natacha ... attaque attaque taquer hussards moustaches ans rue tverskaïa hussard moustachu… surtout pensais quelque chose latte rtant oui ... na-tacha tache laque oui oui oui c'est bien ça. cortex aire core entraîne dérangement nexions potentielles derrière aucune concerne cinq mois après l'accident irréversibles sens l'on attribue mots ainsi peut s'établir connexions inappropriées malade atteint l'aphasie amnésique oubliera mots cause d'une véritable concurrence enire différentes liaisons possibles pourra aussi trouver mots apparentés plan sémantique phonologique ceux qu'il cherche cela simple raison cerveau établit connexions inadéquates lésion zone responsable l'intégration audio-motrice provoque l'incapacité trouver phonème désiré ainsi malade souffrant d'une lésion lobe temporal gauche aphasie acoustico-cognitive répétait mot okno fenêtre russe comme oglo… on0… 08n0.…… skano mot belka écureuil comme beska ljaska… liska plan formation phrases luria expliqué clairement l'énoncé forme selon processus complexe commence projet global pensée sousjacente l'énoncé passe stade langage intérieur schéma sommaire proposition codifie réalise langage explicite chez l'auditeur cet énoncé suit chemin inverse réception message puis décodage identification informations essentielles enfin schéma conceptuel compréhen- global éprouvé comme chr lol griller symptômes subsistent trois ndifféremment plupart fonctions cas lésion autre dérangement d'une partio cerveau d'autres régions compris l'autre hémisphère sion message entendu comment travers étapes transmission sens peut-elle être bloquée suite lésions limitées zones préfrontales malades incapables formuler intentions nécessaires émettre mots construire parole intérieure extérieure peuvent mieux répondre écho monosyllabes comme grammaire reste intacte trouble touche structure linguistique stfriclo sensu suite lésions parties antérieures l'aire langage proprement dit revanche agit cas classiques aphnasie dynamique transcorlicale structure langage complètement bouleversée tout pouvant nommer choses malade peut lier mots trouve verbes faire d'où style télégraphique bataillon front bien comment c'était puis c'était hôpital ... alors zut zut zut alors mieux mieux s'agit forme plus grave 'aphasie dynamique ———— 17. tolstoï guerre paix partie chapitre xiii 354 trad boris schlæzer gallimard 18. luria problèmes faits neurolinguistique revue internationale sciences sociales vol xix 1967 19. luria cit.
53,54,rene aters pss nes pts lan udc latls rna ant slr das narex piste ana rites prolifération cellules nerveuses développement cortex humain autour l'aire broca enfant vient naître mois mois mois mois mois l'examen vif sections originales cerveau partir duquel effectués dessins montre encore plus nettement l'augmentation remarquable densité fibres nerveuses entre mois schéma extrait conel roy the postnatal development the human cerebral cortex cambridge massachusset harvard university press publié l'ouvrage d'eric lenneberg biological foundations language d'autres cas iles malades mal s'exprimer spontanément bien déclarent qu'ils peuvent donner forme cohérente lambeaux pensée surgissent tête bien rempla cent l'énoncé atlendu for mule toute faite professeur luria frappé ma- lades l'on demandé dire quelque chose régions nord déclarait après long silence nord ours lorsqu'on deman- dait développer sujet ajou- lail après second silence prolon- porte fait connaissance d'après luria lésion perturberait genre cas fonction prédicative an- gage aspect langage intérieur représente étape importante transformation pensée langage explicite cette remarque quittera domaine l'aphasie sans essayer d'en inventorier outes variétés d'en imposer classi fication n'est possible non plus présenter résultats clairs définitifs car l'étude phénomènes n'est réalité débuts intention simplement d'illustrer ici façon dont neuropsychologie clinique peut éclai rer divers processus linguistiques lecture aussi repose bases biologiques spécifiques plupart problèmes communicalion surtout cadre l'école affectent lecture l'écriture linguistique toujours traité deux domaines annexe sciences cerveau abordés qu'assez récemment certains troubles ant longtemps confondus tant problèmes étendus mal compris d'autres retards dérangements capacités finguistiques dont l'explication devrait être recherchée plutôt côté personnalité malade place sein famille milieu sociologique existe cependant syndrome neurologique distinct dyslexie développementale spécifique n'est due traumatisme défaut perception dysfonction causée lésion grande instabilité fonction symbolique selon certaines estimations environ populations l'angleterre etats-unis atteints verses dyslexies s'agit d'un pro 20. luria basic problems languse® the light psychology and nera l'ou manuscrit non publié paraître vrage collectif préparé lenneberg 21. voir note colonne
