,page,text
15,16,tan uelle oasis ividus kretschmer classification ind type pycnique type leptosome type athlétique silhouette générale thorax leptosome falble développement largeur polds souvent intérieur moyenne individu malgre élancé paralssant plus grand qu'il n'est long et.mince épaules étroites athlétique fort développement squelette musculature l'éplderme stature moyenne supérieure moyenne rellef renflé muscles lourdeur structure osseuse développement extraordinaire partle supérieure corps pycnique prépondérance dimensions horizontales verticales taille moyenne inlérleure tendance engralsser silhouette tassée cou massif court enfoncé entre épaules forte expansion cavités viscérales cräne thorax abdomen thorax court profond bombé abdomen mince dépourvu tendu musclé ventre gras extré- longues osseuses forte tendance développement graclle mités croissance bras jambes mous accrue mains ronds peu pieds grande rellefs osseux taille musculaires mains molles courtes larges attaches fines souvent frêles peau sèche epiderme peau lisse molle fortement développé muscu- peu développée musculature peu dév muscles longs fins parlois exagérée pps damme rod maxlllaire inférieur face forme aclpeux. peu développé d'ovale allongé proéminence pommettes arcades sourcillères ondant pileux souvent gen analogue celui système plleux limites moyennes partie tronc blen développé nuque front très barbus cheveux souples mals tempes sourcils très tombent précocement larges bien fournis sourcils peu fournis barbe irrégulière der généralement gnes inlériorité rapport cet pertleu poids/taille tour ranlerieee diagnostic poitrine/hanches per fler lourdeur générale très disgracleuse grossière suriout visage dépots graisseux signes plus stables rapports largeur épaules/tour poitrine structure proportion cac plupart sychot comme n'appartient epeug particulière désigne con pelle homme lrrésolu peut roue vérité comme critique rlen clinique encore tend ennemi empêche sulvre chemin cette situation deux fronts fols utte sité monde médical aidé l'obtention chair marburg 1926 assure position imprenable désormais professeurs représentent plus danger car leurs kretschmer s'est fixé but ficile attelndre veut réunir aut d'une table psychothérapeute toutes tendances afin échangent fleurs expériences vent moins chemin d'une prati commune l'intérêt patients connaissance scientifique psychothérapeutes qu'ils solent isolés constitués groupe seulement broulilés kretschmer mals également brouillés entre congrès met lumière nombre dissensions ouvertes cachées ressort surtout querelles d'écoles loin science 1927 hommes gene ernst kretschmer continue pourtant s'efforcer ramener l'unité tourbillon passions parviendra l'aide d'autres personnalités telles c.g jung schultz kronfeld schilder créant société médicale universelle psychothérapie qu'il dirige jusqu'en 1933. alors centre mouvement psycho thérapeutique cette époque poursuit cherches constitution l'homme étudie portraits blographies d'hommes génie européens découvre qu'il peut appliquer beaucoup d'entre types corporels interprète leurs œuvres partir constatations morphologiques hommes génies paraît 1927 fait différence essentielle entre pycnique-cyclothyme leptosome-schizothyme premier typ£ constitution physique donné écrivains réalistes pleins d'humour érudits intuitifs emplristes organisateurs bons vivants volent grand politiciens médiateurs concillants second type artistes pathétiques romantiques hommes style formaliste expressionnisté érudits logiques systématiques métaphysiciens soclété idé® our cet ouvrage vient d'être traduit première fois français éditeur psychologie hontnei len paris ce.pl. 1973 diftusé libi® bernard laville d'étudier çallon chothéral tants psychol
16,17,listes moralistes despotes fanatiques froids calculateurs… œuvres créateurs interrétées fonction tournants naturels vie comme puberté changements spontanés constitution psychophysiologique cours certaines maladies donnant ainsi limites génie kretschmer suscite remous chez beaucoup lecteurs certains trouvent hommes distingués déva- lorisés d'autres contraire voient présentation kretschmer l'arrière-plan dramatique décisif grands accomplissements kretschmer justifie disant qu'il désire dénicher côté maladif caractère génie admirer génial caractère extra-ordinaire lorsque paraît hommes génie 1927 kretschmer écrit cinq livres ambitieux nombreux articles tirant enseignements travail considérable médecin chaque minute liberté l'h6pital consacrée l'écriture possibilité l'hôpital marburg d'étudier façon systématique l'application clinique théories psychothérapie fait travailler assistants différentes méthodes psychologie profondeurs particulier fait mettre l'épreuve comparer signification rêves selon freud adler jung critiques passées envers psychanalyse semblent justifier s'il vérifie différentes motivations mises lumière psychologie individuelle l'école adlérienne applicables nombreux cas apparaît contraire implications complexes l'instinct sexuel cher freudiens concernent rares cas apparaît également qu'il possible parler leurs rêves malades assis non plus allongés divan comme situation psychanalytique outre méthodes suggestion training autogêne l'hypnose utilisés seuls soil liaison psycho- logie profondeurs donnent résultats très satisfaisants lun 1933 kretschmer retire vie publique l'année 1933 marque nouvelle étape vie kretschmer comme celle beaucoup d'intellectuels allemands toutes disciplines facile comme tous savants s'occupant d'hérédité d'exploiter profit situation politique l'époque montée nazisme renie retire thèse selon laquelle croisements entre races douées bénéfiques développement culturel continue vouer freud respect certain allemagne psychanalyse psychologie individuelle quasiment interdites comme sciences juives kretschmer l'occasion quotidienne voir combien justifié aâphorisme psychopathes toujours parmi temps paix étudions faisons diagnostic période troubles règnent dominent retire plus plus vie publique doit prudemment limiter cadre hôpital discussions psychothérapie abandonne bientôt présidence société psychothérapie déclarent assistants malgré divergences d'opinions politiques trahirent jamais avoir caractère c'est avoir intelligence voit loin jusqu fin vie 1964 kretschmer continue travailler élèves développement bases scientifiques théorie structure corps découvre différents modes psychologiques prise conscience chez sujets normaux différents modes travail groupe différentes formes comportements mouvements note particulier courbes pression l'écriture apparaissent comme critères singulièrement précis dynamique affective individus différents types morphopsychologiques n'obtient succès modérés recherches entreprises partir gens sains comme malades portant l'existence différences niveau échanges biologiques réactions hormonales régulations neurovégétatives manque alors vrai techniques modernes recherches endocrinologie particuller cependant possible vérifier quelque soixante mille cas répartis monde corrélations entre psychose ——— peut rapprocher cela hermann rorschach voir l'article marie-josé houereau psychologie 10. technique relaxation inventée psychiatre allemand h.j schultz jusqu peut-on reculer limites mémoire curieuse expérience rapide montai premier compartiment parut vide sans douter compagnon invisible trouvait déjà dont conversation passlonnante devait tenir éveillé jusqu'au matin train ébranla lentement regardai lumlères stockholm s'étendre peu peu puis roulai couvertures attendant sommell j'aperçus alors face mol banquette livre laissé voyageur pris machinalement j'en parcourus premières lignes cinq minutes plus tard isals avidité comme récit d'un ami révélerait trésor apprenais effet tout monde possède mémoire mémoire sufflsante réailser prouesses fantastiques mals rares personnes savent servir cette mervellleuse faculté étalt expliqué titre d'exemple comment l'homme molns doué peut retenir facilement après seule lecture attentive toujours notlons aussi compliquées liste cent principales villes monde chiffre population parut invraisemblable d'arriver caser pauvre tête quarante ans énumérations interminables chiffres dates villes souverains avalent fait désespoir lorsque j'allais l'école mémoire toute fraiche résolus vérifler livre disait blen exact tirai indicateur valise mis llre posément manière prescrite nom cent stations chemin fer séparent stockholm trehürningsj6 constatal qu'il sufflsalt d'une seule lecture our pouvoir réciter cette liste l'ordre equel l'avais lue puis sens inverse c'està-dire commençant fin pouvals indiquer instantanément position respective n'importe quelle ville exemple énoncer quelle étalt 27° 84° 86° tant leurs noms s'etalent gravés profondément cerveau demeural stupéfalt d'avoir acquis pouvoir aussi extraordinaire passal reste nuit tenter nouvelles expériences toutes plus compliquées unes autres sans arriver trouver limite forces bien entendu bornal exercices amusants dès lendemain j'utillsal d'une façon plus pratique connaissance lois l'esprit pus ainsi retenir incroyable facilité lectures airs musique j'entendals nom physlonomie personnes venaient voir adresse rendez-vous d'affalres apprendre quatre mols langue anglaise j'ai obtenu vie fortune bonheur quantité suffisante c'est llvre dols car révélé comment fonctlonne cerveau trois ans j'eus bonheur rencontrer auteur lul promis parler méthode pays lorsqu'elle traduite français v.m borg actuellement passage france vient publier cette traduction suls heureux aujourd hui pouvoir lul exprimer publiquement reconnaissance sans doute désirez-vous acquérir aussi cette puissance mentale mellleur atout réussir l'existence prlez alors v.m borg envoyer petit ouvrage lois éternelles succès distribue gratultement quiconque veut améllorer mémoire voicl adresse v.m borg chez aubanel place st-pierre avignon dorlier méthode borg bon gratuit découper recopler adresser v.m borg chez aubanel st-pierre avignon recevoir sans engagement part sous pll fermé lois éternelles succès nom
17,18,"comparaison mensurations gens nor mensurations élé prises groupe jeur trente ans s'agit naturellement moy leptosome athlétique pycnique 1,71 ———— ———— 0,74 0,60 0,79 tête 0,56 nes tour poitrine tour ventre 796 tour hanches 0,39 0,37 largeur d'épaules 577 0,81 0,75 ———————————— maux vingt poitrine 100 46,9 51,5 55,7 ventre 100 39,4 44,6 49,4 taille taille poids 115,6 191 92.1 taille poltr poids 34,2 lante contre post ————— rapports entre morphologie temperament traits personnalité cyclothyme schizothyme rythme personnel lent vite rythme travail irrégulier régulier eique menleste manlese progressivement soudain forme-couleur perçoit perçoit torme couleur extension champ large etroit d'observation tachistoscope perlormance attention ouantitativement quantitativement bonne faible oualitativement qualitativement faible bonne synthétique analytique concentrée certains points durable persévératif répartie l'ensemble changesnte associatif tension intrapsychique déroulement représentations adaptabilité situation nouvelle comportement rapport objets coloration coloration change facilement change difficilement affective affective lente facile sans répercussion répercussion durable rolongée situations excitation excitation initiale ouvelles initiale faible forte répercussion répercussion courte durée prolongée netveux situations explosif maîtri xcllantes 75e soi rapport tâches commençant commençant plus faciles plus difficiles nuttin structure personnalité paris p.u.f. 1965 179 forme tout lequel structure corporelle entr ments types constitution pérz finalement pensée sclentife base kretschmer l'organt sme esprit priori coordonnes telle façon qu'une modification toujours accompagnée d'une l'un fication l'autre apport rod dépendance doit reposer inter restent explorer dispos lols bien particulières émanent guons stature fonctions méts lismes régulations neuro-horm tabo tensions musculaires onales exprimées particulier divers traits tempérament tels l'énergie faiblesse l'expansion rétraction l'humeur sensibilité forme fonctions conditionnent mutuellement interaction perpétuelle constitution physique présente d'emblée partie héritée partie modifiée réactions l'individu l'environnement types consti tution gens sains malades présentent combinaisons psychophysiques déterminées dont centre gravité situe psychique cas maladie mentale corps cas disproportion dysharmonle claude malard savoir davantage ouvrages kreischmer manuel théorique pratique psÿchologie imédicale traduit jankélévitch paris payot 1927 structure corps caraciére paris payot 1930 psychologie médicale paris doin 1956 paranoïa sensibililé contripi problème paranoïa théorie psychiatrique caractère traduit horinson duché paris p.u.f. 1963 hommes génie paris c.e.p- 1973 aulf tout cert"
18,19,etude d'un prodige mystique congrés e.e.g résultats d'une expérience extraordinaire présentés vii congrès d'électrophysiologie marseille élève henri gastaut annette beaumanoir professeur l'université genève beaumanoir équipe d'électroencéphalographie filmer intégralement déroulement d'une fête traditionnelle danse feu chez secte orthodoxe grecque enregistrer téléélectroencéphalographie manifesjations e-e.g cancomitantes l'extase danseurs résultats plus frappants suivants danse pieds nus braises ardentes fait bien établi cbservable loisir tout long film couleurs présenté congrès l'équipe genève contrôler l'état cutané plantaire avant après danse constater l'absence toute trace brûlure cemme tout onguent tout autre dispositif protecteur tout trucage certains danseurs certes peau épaisse travailleurs force beaumanoir observé également fine peau pieds d'une jeune étudiante mêmes résultats non-initiés s'ils tentent imiter processus adeptes brûlent adeptes marchent braise lorsqu'ils sentent certain état intérieur qu'ils savent reconnaître s'ils tentent danser quand cet état brülent cet état cesse hâtent alors sortir feu l'état propice semble créé danse chant musique foule bruit cérémonie nocturne l'état propice manifeste l'ee.g l'inébranlable permanence rythme alpha qu'aucune réaction d'arrêt vient bloquer tant dure cet état contradiction observe tout cerveau normal plus cet alpha aussi net électrodes antérieures autres extension rythme alpha cerveau antérieur discuté résulfats beaumanoir admet caractère incompréhensible notamment concer uns ers crise france l'immunité cutanée brûlure quant permanence l'alpha disposition réaction d'arrêt cette expérience confirme nettement résultats déjà observés mystiques d'autres obédiences religieuses vient donc encore renforcer fait bien établi certains états mystiques s'accompagnent signes objectifs irrécusables difficiles interpréter certains auteurs dont gastaut luimême demandent observations plus nombreuses avant prononcer aimé michel nouveau cerveau lors d'une séance consacrée l'exploration fonctions supérieures cerveau plusieurs congressistes fait état méthodes visant mesurer activités cérébrales s'efforçant mettre évidence spécificité faut retenir propos communication originale professeur ingvar l'université lund suède concernant parole préhension d'un objet lecture professeur ingvar mis point l'aide d'un gaz radioactif méthode permettant mesurer divers points cerveau débit sanguin observer zones celui-là augmenté témoin d'une activité accrue lors telle telle tâche mentale spécifique ainsi détecter zones cérébrales interviennent lors récitation d'un poème d'un calcul menial lecture d'un journal observations faites divers malades atteints troubles cérébraux permis résultats parfois surprenants ainsi aphasique malade privé l'usage parole dont zone très étroite très spécifique cerveau montrait déficience débit sanguin retrouvé parole quelques instants après l'on augmenté débit administration gaz carbonique accélère respiration donc circulation phénomène malheureusement trop particulier pouvoir être retenu thérapeutique monde limitation naissances chine limitation nombre naissances s'impose évidemment chine familles comptaient couramment huit dix enfants serre interrompue provisoirement 10ment révolution culturelle campagne planification vise ramener taux d'augmentation population l'an 2000. nombre deux enfants famille paraît désirable techniques suivantes utilisées recommandation mariage tardif plus vingt-huit ans jeunes filles trentaine hommes utilisation d'un type spécial stérilet dénommé fleur utilisation pilules fabriquées masse utilisées gratuitement bas prix avortements technique vide dispensés demande gratuitement sous anesthésie l'acupuncture comportent femme travaille congé quinze jours répandre directives onl mobilisées courroies transmissions c'est-à-dire syndicats fédérations femmes organismes d'éducation naticnale santé publique consultations individuelles données femmes sortie cliniques frappés côté personnel préside échanges montre bien chinois bien nombreux soumis directives masses loin être traités comme robots minkowski revue impact vol lecon courage effort fait partie sous pression sciences sociales handicapés physiques mentaux plus possible intégrés société participent activités normales celle-là c'est sens s'inscrit récente exposition d'œuvres d'art crganisée l'association nationale amis handicapés physiques dont siège social paris 10° rue d'hauteville l'originalité cette manifestation résidait fait toutes œuvres exposées toiles aquarelles dessins sculptures bijoux etc exclusivement réalisées handicapés moteurs bien souvent n'ont l'usage leurs membres peignent leurs pieds bouche
19,20,etude its intéré clin
20,21,dons groupes fenconte déceler ici clrérence vers fin l'année 1968 entrepris étude séances dynamique groupe intérêt cette expérience d'un certain climat d'excitation suscité rencontres rapide extension phénomène paraissait porter marques d'un vaste mouvement social riche d'implications double domaine l'éducation santé mentale pensions également formes multiples présentées réunions jointes diversité techniques adoptées moniteurs constituaient base excellente analyse comparative comportement meneurs jeu réactions ultérieures participants sélectionné l'université stanford 206 étudiants désireux participer rencontres répartis hasard dix-sept groupes dirigés professionnels expérimentés appliquant techniques difféles résultats dépendent plus qualité 1noniteuts technique utilisée hlustration john oldenkamp/1bol psychanalyse analyse transactionnelle gestaltthérapie etc. comme base comparaison formé groupe contrôle réunissant étudiants n'avaient être intégrés groupes ordinaires raison d'un lourd passif conflits internes but collecter plus grande variété possible résultats premier lieu participants subi tests base suivis plusieurs épreuves contrôle quelques semaines avant l'entrée séminaire puis testés nouveau deux semaines après fin rencontre enfin soumis troisième série tests six huit mois plus tard certains participants décrivaient changements ressentis termes révélation religieuse pouvaient isoler aucune transformation spécifique comportement définir changé cependant affirmaient être absolument convaincus cette expérience influence considérable significative existence d'autres clé ren- contres résidait modification
21,22,"x-mêmes d'autres encore venus réunions espoir trouver solution crises ordre person professionnel derniers plus frappants expériences tee saient travail effectué dessein aider résoudre tels dilemmes l'évennous d'une part attachés even tualité d'une modification système vale sujets mesure sens onné per l'expérience refléter rec ment réorientation leurs root d'autre part seconde implication possi rencontres affecter l'attitude participants face leurs problèmes personnels sujet pouvait exemple comprendre exploration attentive vie intérieure résoudre problèmes apprendre faire fréquemment appel potentiel émotionnel enfin diverses formes changements éventuels relations interpersonnelles intéressaient également vision autres d'eu impressions subjectives tests reduisent neant outre impressions participants eux- mêmes recueilli témoignages d'individus appartenant proche entourage amis conjoints parents etc ceux leurs coparticipants réunion effets participation rencontres paraissaient fonction perspective sous laquelle changement envisagé concernait membres groupes euxmêmes déclaraient avoir l'objet d'un changement positif pensaient qu'il s'agirait d'un changement durable nombreux cas participants sentiment d'être devenus plus ouverts plus honnêtes plus liants plus compréhensifs plus conscients autres d'eux- mêmes plus spontanés plus confiants plus communicatifs fait participants tendance considérer rencontres comme expériences positives utiles surprenait pour- tant suite impressions devaient révéler éphémères cours d'une nouvelle entre- vue lieu six huit mois plus tard degré enthousiasme participants dimi- nué leurs jugements bénéfices tirés rencontres n'étaient plus mêmes immédiatement après séminaire rapport entre estimations positives estimations négatives exemple expérience jugée person- nellement inutile perte temps etc 4,75/1 rapport six mois plus tard 2,33/1 outre demandions change- ments perçus reflétaient modification effective comportement adressé six mois après naire questionnaires familles pants leurs collègues leurs intimes demandions derniers décrire tous changements être observés sémis partici- comportement sujets après expérie groupe familiers étudiants grou contrôle reçu questionnaires tiques ainsi sujets groupes ordinais ceux groupe contrôle plus personnes sollicitées prirent question naires très sérieux adressèrent longues réponses réfléchies détaillées quelque fois poignantes constatâmes l'écart entre chan ments observés tant chez sujets grou geordinaires chez membres groupe contrôle qu'il s'agisse transformations dos tives négatives pouvait faire l'objet d'au cune statistique cas groupe changements spécifiques post tifs signalés familiers cas modification comportement être observée l'entourage social sujets l'étape suivante proposait rassembler opinions moniteurs auxquels demandé noter chaque membre eur groupe base neuf fois onze points évaluant respectivement l'ouverture d'esprit sensiti vité spontanéité connaissance soi sociabilité l'agressivité coopération l'autovalo risation l'aptitude bonheur notes devaient être attribuées deux reprises l'issue première réunion fin séminaire bien différents meneurs jeu aïent situé changements importants ljes domaines plus divers presque tous signalaient transformations notables ouverture d'esprit sociabilité règle générale meneurs jeu montraient optimistes signalaient environ membres groupe nette amélioration participants amélioration élevée manifestait minimum deux points supplémentaires question également demandé tous membres chaque groupe s'évaluer uns autres chaque participant devait établir incluant lui-même classement décroissant acquisitions tous membres groupe sujets signalaient plus changements positifs chez leurs coparticipants lorsque comparâmes quatre évaluations établies sujets eux-mêmes leurs coparticipants leurs proches meneurs jeu trouvâmes présence d'un puzzle tout d'abord changements compor- tements individuels observés immédiatement aprés l'expérience paraissaient substantiels peu plus tard mêmes changements devenaient négligeables puis encore plus tard semblaient nouveau substantiels outre évaluations fournies différents groupes d'observateurs trouvaient déplacées finalement rap ports entre notations participants chefs groupe coparticipants oscillaien autour zéro tout d'abord cru devoir attribuer contradictions certaines imprécisions noir systèéme notation devions réalise suite problème surtout foncti"
