,page,text
17,18,"0 
= 
ACER 
SES 
€ 
CN 
mme mem em 
[l 
ll 
l 
l 
[ 
[l 
l forte que la méfiance ! Puis, petit 
à petit, Lous les chimpanzés prirent 
l'habitude de venir s'y nourrir. 
Par la suite, par un système très 
perfectionné de boîtes métalliques, 
elle s'arrangea pour offrir les 
bananes aux chimpanzés d'une 
manière qui ressemblât le plus à 
une fructification naturelle, afin 
d'affecter le moins possible leur 
comportement. 
Elle suivit de très près Flo, la 
vieille femelle, au « sex-appeal ra- 
vageur », et sa famille: ses fils 
Faben, l'aîné, et son frère de 3 ou 
4 ans plus jeune, sa fille Fil, qui 
avec férocité attaquait les amants 
de Flo et qui par la suite devint 
« nymphomane » (elle courait s'of- 
frir aux mâles avant même que 
ceux-ci ne l'aient regardée ou ne 
lui aient manifesté le moindre 
signe d'intérêt). Elle vit naître 
deux bébés chimpanzés : Gobbin, 
le fils de Mélissa, et Pom, la fille 
de Passion. Elle suivit l'évolution 
des troubles du comportement du 
petit orphelin Merlin qui, livré à 
lui-même, sombra dans la « neu- 
rasthénie ». Elle vit Mike détrôner 
le mâle dominant Goliath. Enfin, 
elle vit Mac Gregor, le vieux Mac 
Gregor, mourir de poliomyélite 
(les singes sont vulnérables à 
presque toutes les maladies infec- 
tieuses de l'homme). Elle « par- 
tagea » la vie du groupe et apprit 
à les aimer. Au lerme de cette 
extraordinaire expérience vécue, 
voici les conclusions scientifiques 
qu'elle tira. 
Le chimpanzé dans son milieu 
Dès les premiers mois, elle réussit 
à faire toute une série d’observa- 
lions, en traquant les chimpanzés 
et en les regardant vivre. 
Les chimpanzés se déplacent en groupes. Certains de ces groupes 
né comprennent que des mâles adultes ; d'autres des femelles el des jeunes; quelques-uns réunis- 
sent des mâles, des femelles et des Jeunes. D'autre part, ces groupes 
ne Sont pas stables : à l'intérieur de la communauté, les individus 
s'associent en groupes temporaires 
et sujets à changements. Mais quand vient le soir, chaque indi- vidu — exception faite des très Jeunes qui dorment avec leur mére — fait son propre nid. On croyait que le chimpanzé était avant tout végétarien et fru- givore el ne se nourrissait qu’occa- 
20 d'insectes €l .de 
-s, Jane Van Lawick- 
Goodall découvrit que le chimprn 
76 sauvage mangeail ce Ja ie ee 
des jeunes guibs (espèce danse 
lope), des jeunes potamocl 
(espèce de sanglier), et des jeunes 
de singe), ainsi ai espèce 
ee des PPbes roux (singes à 
longue queue pendante), des singes 
bleus ou à queue rouge adultes, 
qu'il chasse et qu'il tue. Que peul- 
on dire sur les techniques de chas- 
se du chimpanzé ? Il semble que 
dans certains cas, la caplure d une 
proie soil presque accidentelle : 
un chimpanzé en promenade ren- 
contre sur son chemin un petil 
potamochère, le saisit et le tue. 
Dans d'autres cas, par contre, Ja 
chasse semble être une activité 
plus volontaire el préméditée : les 
différents individus d’un groupe de 
chimpanzés coopèrent alors d'une 
façon remarquable (par exemple, 
ils se postent au pied des arbres 
qui pourraient offrir un moyen 
d'évasion à la victime). Du reste, 
il semble que le comportement 
carnivore du chimpanzé survienne 
par cycles. Si une proie tuée par 
hasard déclenche dans le groupe 
un appétit frénétique de viande, 
les mâles adultes et adolescents, 
pendant un ou même deux mois, 
se mettent délibérément en chas- 
se. Puis, leur envie une fois satis- 
faite, ils reviennent à un régime 
de fruits, légumes et insectes, jus- 
qu'à ce que, quelques mois plus lard, un incident fortuit les pousse 
a Se mettre en chasse à nouveau. 
Quand un chimpanzé est la proie 
d'une excitation émotionnelle — 
par exemple, s'il arrive à une 
Source de ravitaillement, s'il se 
joint à un autre groupe, s'il est frustré — il exécute des numéros 
jements han Ge de Rue le verrons ces a Ne Re Tous ns 7 narges ont une Signification sociale : elles permet- sionnellement 
petits rongeul 
eo 0 2 Le : ? tent d'établir un prestige et d'im- POSEr Un pouvoir aux autres mem- bres de la bande, 
Le chimpanzé se sert d'outils 
Afin de se nourrir 
chimpanzé enfonce dans les termi lières des brins d'herbe u'il choisit avec soin (il les choisit nsamment longs et suffisam h pa de pants) et qu'il prépare. € boire, il fabrique une ; 
? Ch n PL j J éponge I udimentaire 
(à l'ai de de feuilles dont il augmente l'absorp. 
rivité avec sa salive), Ainsi, non 
seulement le chimpanzé uiilise des 
objets en guise d'instruments 
mais encore il les modifie, ce qui 
représente les débuïts d'une fabrica. 
tion. S'il est encore très loin de 
l'Homo faber, il n’en est pas moins 
« anthropo faber ». Avec la fabrica. 
tion d'outils, il montre qu'il es 
capable de dépasser le simple étar 
de nalure pour créer une cullure 
élémentaire. Une démonstration à 
un niveau supérieur est encore 
donnée par le fait qu'il dépasse 
la pure sexualité biologique pour 
constituer une famille organisée 
autour de la mère. 
L'inceste semble admis 
Lorsqu'un chimpanzé femelle es! 
en œstrus, la peau de sa région 
génitale est enflée. L’enflure per. 
siste pendant une dizaine de jours 
avant de se ramollir, de se rider 
et de disparaître. C'est durant cette 
période que la femelle peut s'ac- 
coupler avec les mâles. 
L'accouplement des chimpanzés 
est le plus bref possible: d'ordi- 
naire, il dure de dix à quinze se- 
condes seulement. Tous les mâles 
adultes — et quelquefois les ado- 
lescents — s’accouplent avec la 
femelle. Pendant sa « période d'en- 
flure », la femelle est constamment 
entourée d'une cour de mâles 
adultes. 
Chaque fois que survient une 
cause quelconque de surexcitation 
— quand les chimpanzés arrivent 
à une source de ravitaillement, 
quand ïils quittent leurs nids le 
matin, quand d'autres chimpanzés 
les rejoignent — tous les mâles 
adultes s'accouplent successive 
ment avec la femelle en cœstrus. 
Les adolescents peuvent aussi s'ac- 
coupler, à condition d'attendre que 
les adultes soient satisfaits. 
IH] convient de moter que les 
frères et les sœurs ont des rap- 
ports sexuels. Ainsi, le tabou de 
l'inceste me semble pas exister 
chez les chimpanzés. Quant l'en- 
flure de la femelle disparaît, elle 
perd sa cour de soupirants. Il est 
intéressant de constater que, Par 
lois, la femelle refuse de s'accou- 
pler avec tel ou tel mâle. Choisr 
ail-elle son partenaire sexuel ? 
La naissance d’un bébé dans l 
communauté chimpanzé — surtoul 
quand la mère est jeune — Pr 
voque une grande émotion. À "
18,19,"D SYCHOMMERAPIE EDUCATION -PERSONNALITE -MOTIVATIONS - SEXUALITÉ - EOUILIBRE - 
men À ADOLESCENCE-INTELLIGENCE-ORENTATION-TESTS-PROJECTIONS-CONSEIL -GROUPES- 
ri ] RELAXATION - HYPNOSE - 
Lin «e ] DEVELOPPEMENT - MATURITE- S Moins « = 
“brie, [ PUBLICITE + ENTREPRIS 
pe cu ![ DOUr À première dors Cullure 
til) UN GRAND PSYCHOLOGUE DE NOIRE EPOQUE 
LE V épood lu: meur 
UNE GRANDE VUE D'ENSEMBLE 
ENFIN SERIEUSE 
CLAIRE ET NEUVE Chorlote Bthler 
la ssrehologie 
cons le vie 
ce notre lampes Dé5B801000fexemplalresivendustentAllemagne elle est 
. Tépion 
Te per. 
le jours 
e rider 
ni cette 
ul s'ac. Î 
poing Npanzés 
d'ordi- 
inze se. 
s mâles 
es ado- 
avec la 
de d'en- ""+ 
un volume relié . 
les AO de 560 pages, ! qui est charlotte hühler ? Ü 
i ni une Frais de port abondammen 
en illustré. 
lement format 16 x 24 
nids le } 
és LI L] 
les parution: avril 1972 
cessive 
Par eco CHEZ VOUS ds poruien en Avr 
TPE Ethouviagekessentielfpouvoiseminionmation e les Directrice durant de longues années du cé- 
rap a ie con, mac IMMEDIATEMENT et sons lôbre nollut Ge psychologie de l'université e Vienne, elle devait (avec son marl, Kar de A Q # C} 
Jou niSQU CIE Oint Bühier, grand spéclallste de la psychologie exister le commande du langage) fuir les nazis pour s'installer 
l J'en” aux Etats-Unis. C'est là qu'elle poursuit son , enselgnement et 6es recherches, notamment jt, ele Vous resterez libre de retourner cet ouvrage dans les dans le domaine du développement person- 
j} el huit jours qui suivent sa réception dons son emballage nel. 
e, par d'origine pour êfre remboursé aussitôt, frais d'envoi 
'accos compris, 
choi 
? (e) el? o 
L D t - Hachett dit ns} FIVAT ACINELLE, EUIIEUTS ur 
L po AW 
A ep ET ten men"
19,20,"Fu ee at 2 = + nn en Mn 0 PE 
À Sn 
dessous de cinq mois, les bébés 
sont normalement protégés Par 
leurs mères de tout contact avec 
d'autres individus, à l'exception 
de leurs frères ou Sœurs. Les en- 
fants dépendent de leur mêre pen- 
dant plusieurs années: la plupart 
continuent de téter leur mere, de 
dormir avec elle durant plus de 
quatre ans. ÀÂU COUTS de cette pé- 
tiode de dépendance, l'enfant mai 
trise graduellement son environ 
nement physique : il apprend à se 
déplacer sur le sol et dans les 
arbres, à manipuler des objets, à 
se nourrir, à faire son nid. Nor- 
malement, le bébé bénéficie d'une 
tolérance pratiquement illimitée 
de la part de tous les autres mem 
bres de la communauté. 
Les jeunes chimpanzés passent 
beaucoup de temps à jouer. Par le 
jeu, ils apprennent à se familiariser 
avec ce qui les entoure; dans leurs 
rapports avec les autres jeunes, 
ils s’initient à la structure com- 
plexe de la société des chimpanzés. 
Il n'y a guère de différences évi- 
dentes dans les comportements 
des bébés des deux sexes. Cepen- 
dant, on constate chez le mâle une 
précoce évolution sexuelle. Entre 
1 et 4 ou 5 ans, le bébé mâle si- 
mule très souvent l’accouplement. 
D'autre part, lorsqu'il voit un mâle 
en train de « monter » une femelle, 
il accourt et essaie d'intervenir en 
assaillant le mâle (c'est surtout là 
que se manifeste l’indulgence et 
la tolérance de l'adulte). Il convient 
de préciser que le bébé agit ainsi 
même si la femelle en train de 
s'accoupler n'est pas sa mère : cela 
n'est donc pas une manifestation 
de « jalousie»; ce comportement 
du jeune mâle reste inexpliqué. 
Au cours de la quatrième année 
d'existence, période du sevrage, on 
commence à montrer moins de to- 
lérance à l'égard du jeune chim- 
panzé. L'enfant, et notamment si 
sa mère a un nouveau bébé, doit 
désormais apprendre que c'est à 
lui de ne pas perdre de vue sa 
mère, alors qu'autrefois c'était le 
contraire. Le jeune mâle, même 
s'il est fortement perturbé lors- 
qu'il perd sa mère par hasard, peut 
manifester son indépendance beau- 
coup plus tôt que la jeune femelle. 
Certains n'hésitent pas à se dépla- 
cer avec d’autres chimpanzés pen- 
dant plusieurs jours quand ils 
n'ont que Six ans. 
Les jeunes mâles sont très pru- 
dents dans leurs relations avec 
24 notamment, alors que 
les bébés « chevauchent » les fe 
melles, les jeunes n€ Je font & ë 
par respect pOur les adultes. tra . 
ralement, ils témoignent 
grand respect pour leur mère. Jeurs aînés : 
doit : impanzé 
Le jeune chimp d'adulte conquérir son statut 
La phase de l'adolescence est df- 
ficile pour le jeune © mpanze ; 
elle l’est encore plus pour le mâle 
que pour la femelle. Le mâle at- 
teint sa maturité physique à la pu- 
berté, quand il a entre sept et huit 
ans, mais il n'est pas encore pleï- 
nement développé. En tout Cas, il 
est encore loin de sa maturité SO- 
ciale: il faudra six ou sept ans 
avant qu'il ne figure au nombre 
des mâles à maturité accomplie. 
Si la période de l'adolescence est 
si pénible pour lui, c'est qu'elle 
est celle de son apprentissage de 
mâle. Il lui faut multiplier les 
chances de s'introduire dans la 
hiérarchie de ses aînés. Il lui faut 
conquérir le titre de mâle adulte. 
Pendant cette période, sa capacité 
à dominer les femelles augmente. 
Dans ses relations avec les grands 
mâles, il fait preuve de prudence. 
L'un des facteurs de stabilité 
pour le mâle adolescent se trouve 
dans les rapports qu'il a avec sa 
mère. La mère vient toujours au 
secours de son fils adolescent, sauf 
si celui-ci se trouve aux prises avec 
un mâle de haut rang. Lorsqu'il 
grandit, c'est lui qui de plus en 
plus vole au secours de sa mère, 
si celle-ci est attaquée ou menacée. 
D'ordinaire, l'adolescent ne parti- 
cipe pas aux séances d’« épouillage 
social », lesquelles sont réservées 
aux adultes. 
.Ces séances d’« épouillage so- 
cial» tiennent une place impor- 
tante dans la vie des chimpanzés : 
il arrive qu'une telle séance entre deux individus adultes dure deux 
aenres. Pour eux, le grattage social la plus pacif e contact physique 
la plus amigale 4 plus I elaxante, 
panzé étant ta SbÉ Chim- 
mère, n’est AS Due ent avec sa 
physiques Ën Pan de contacts 
met à jouer a É d'annren n S€ . vec d’autres jeunes ce qui est une autre façon d’'avoi ! 
des contacts physiques. Puis fl consacre de plus en plus de tem , au . ps grattage Social, tout d'abord 
avec sa mère et ses frères où ŒUTS, puis, à sa maturité, avec d'autres adultes. Quand l'enfant 
chimpanzé sort de l'adolescence, 
quand il arrive à la maturité, il 
lui faut désormais s'intégrer dans 
Ja hiérarchie sociale, trouver sa 
place dans la société très complexe 
des chimpanzés. 
Dans la société chimpanzé, il exis- 
te une hiérarchie. Au sommet se 
trouve le mâle dominant. Devant 
lui, les autres mâles, dominés, 
s'effacent et présentent les mar. 
ques de la plus grande soumission. 
Par contre, ceux qui se classent 
tout en bas de la hiérarchie de 
prédominance des mâles adultes 
sont menacés et attaqués par les 
autres. Il faut noter que cette 
hiérarchie peut être sujette à des 
bouleversements. Quelquefois, un 
des chimpanzés se trouvant au bas 
de l'échelle hiérarchique fait une 
ascension fabuleuse et devient 
«mâle dominant». Réussit-il ce 
coup d'Etat ? 
Il faut évincer le mâle dominant 
du moment. Pour cela, le « préten- 
dant au pouvoir» va se livrer à 
toutes sortes d’exhibitions et de 
charges, et se mesurer à celui qu’il 
veut détrôner. Les deux chim- 
panzés s’exhibent à tour de rôle, 
chaque numéro étant plus poussé 
et plus artistique que le précédent. 
Si le « bluff » du prétendant réus- 
sit, l’ex-mâle dominant capitule. 
Les deux mâles, alors, ne s’affron- 
tent plus et procèdent à un « grat- 
tage réciproque», signe de la 
réconciliation. 
Une communauté de chimpanzés 
est une organisation sociale 
complexe. Les chimpanzés forment 
des associations qui se modifient 
constamment, et cependant, alors 
que la société semble organisée 
dans l'insouciance et le hasard, 
chaque individu connaît sa place 
dans l'édifice social, son statut par 
rapport à n'importe quel autre in 
dividu de la communauté. Dans 
leurs rapports entre eux, on COn$- 
tate une grande diversité de rela- 
tions. 
Il existe une relation qu'on pour 
rait qualifier « d'amitié», et qui 
semble prévaloir chez les mâles: 
deux chimpanzés se déplacent el 
semble, se montrent une considé- 
ration et une tolérance affectueuse, 
se secourent mutuellement. SOU 
vent, on constate chez deux mâles 
liés par «l'amitié» une certaine 
Similitude, soit dans l'aspect phy- 
sique, soit dans les caractéristir 
ques du comportement, soit dans Au Fe 
pi i 
E \] 5 
et 
DL 
Se sL- 
Fi 
[ 
pt n fn"
20,21,"« Préten. 
livrer à 
IS et de 
lui qu'il 
x chim- 
de rôle, 
 POUSSÉ 
écédent. 
int rêus- 
capitule, 
s'affron- 
a « gral- 
de la 
npanzés 
sociale 
forment 
odifient 
t, alors 
rganisée 
hasard, 
a placé 
TIME ECURIES DEC CONTE 
D 
+ 
* les deux à la fois. Cependant, il 
n'existe aucune relation entre deux 
chimpanzés mâles qui puisse être 
qualifiée d'homosexuelle. Si, dans 
des instants de surexcitation, un 
mâle peut en « monter » un autre, 
si, pour s'apaiser, il peut caresser 
les organes génitaux d'un autre 
mâle, il n'y a cependant jamais de 
rapport sexuel véritable. 
La femelle du chimpanzé 
est une « femme » soumise 
Les femelles adultes sont presque 
toujours humbles devant les mâles 
— sauf peut-être pendant leur pé- 
riode de fécondation — et devant 
de nombreux adolescents. Mais 
elles ont leur propre hiérarchie 
de domination. 
Dans les communautés de chim- 
panzés, la cellule familiale ne 
comprend que la mère et quelques- 
uns de ses enfants — ou tous. Le 
père, en dehors de sa contribution 
nécessaire à la conception d’un en- 
fant, ne joue plus aucun rôle dans 
son développement. Par consé- 
quent, le mâle est complètement 
déchargé de toute responsabilité fa- 
miliale et c'est la mère qui élève le 
bébé chimpanzé. Aussi, si le bébé 
perd sa mère, on constate une dé- 
térioration marquée dans ses réac- 
tions sociales. Le chimpanzé orphe- 
lin manifeste une soumission exa- 
gérée vis-à-vis des adultes et une 
agressivité marquée à l'égard des 
jeunes. Il montre aussi d'autres 
troubles du comportement, tels 
que l'incapacité ou le manque 
d'habileté à se servir d'outils. 
On s'attendrait que ce soit une 
femelle expérimentée, ayant déjà 
un enfant et pouvant allaiter, qui 
prenne en charge l'enfant orphelin 
et lui assure une protection sociale 
appropriée. Or, dans la société des 
chimpanzés, il n'en est pas ainsi. 
C'est toujours un aîné (ou une 
aînée) qui adopte le bébé. Celui-ci, 
privé de havre, présente alors des 
troubles psychologiques résultant 
d'un sentiment d'insécurité sociale. 
Quelquefois, un changement d'atti- 
tude de la mère provoque les 
mêmes troubles du comportement 
chez le bébé. 
On constate donc un extrême de- 
gré de dépendance de l'enfant vis- 
à-vis de sa mère. Qui auraït pensé 
qu'un chimpanzé de trois ans pou- 
vait mourir s'il perdait sa mère ? 
Qui aurait supposé qu'à cinq ans, 
un enfant pouvait encore téter sa mère et dormir parfois avec elle ? 
Des expériences récentes! ont 
ouvert des horizons nouveaux sur 
le chimpanzé et permis de réviser 
certains concepts bien enracinés 
en ce qui concerne les primates. 
Elles ont prouvé que le chimpanzé 
est capable de communiquer avec 
les gens d'une manière très subtile. 
Deux savants américains ont 
exercé un jeune chimpanzé femelle 
à utiliser les signes des sourds- 
muets. Ils pensaient en effet que, 
puisque le geste et l'attitude repré- 
sentent un aspect très important 
du mode de communication des 
chimpanzés, un langage par signes 
conviendrait mieux que toute autre 
chose pour communiquer avec 
ceux-ci. L'expérience a parfaite- 
ment réussi, puisque, à cinq ans, 
la jeune chimpanzé peut compren- 
dre trois cent cinquante symboles 
différents (dont beaucoup repré- 
sentent des groupes de mots plu- 
tôt qu’un simple mot) mais elle 
peut aussi en utiliser correctement 
cent cinquante environ. 
Une autre expérience est encore 
plus passionnante. On présenta à 
une jeune chimpanzé un miroir. 
Elle vit son reflet dans la glace, 
et lorsqu'on lui demanda dans le 
langage par signes « Qui est-ce ? », 
elle répondit « Moi». C'est là la 
preuve scientifique que le chim- 
panzé a une conscience primitive 
de lui-même. Qui sait à quoi res- 
semblera le chimpanzé dans qua- 
rante millions d'années ? Si nous 
lui laissons la chance de vivre, la 
chance d'évoluer. 
Anne Balandier 
a —————— 
1. Relatées dans un article de Gordon G. Gal- 
lup paru dans Psychologie n° 21. 
ER 12 a LS 
, se 
24 ONE 04 DE Cyr 
ON LR 
ZA Se TS Apprenez le 
PSYCHO - 
LOG@UE 
pour VOTE 
Évolution 
personnelle 
cocale 
proiessionnale 
Enseignement individualisé, par 
correspondance, cours oraux du soir 
(Paris, Lille) ou stages pratiques 
(Paris, Lausanne...) (Frais d'études 
déductibles du revenu brut) 
Préparation à divers diplômes sous la 
conduite de praticiens réputés. 
Psychotechnique — Graphologie — 
Morpho-psychologie — 
Psychopédagogie — Symbolisme — 
Rorschach (cours international) — 
Sexologie normale et pathologique — 
Rééducation graphique — Relaxation 
psychosomatique — etc. 
Pour dirigeants et cadres, 
médecins, étudiants, infirmières, 
assistantes sociales, enseignants. 
parents et tous ceux qui s'intéressent 
aux problèmes humains éclairés par la 
psychologie moderne, dans leur 
profession ou en vue d'une carrière 
principale ou secondaire. 
INSTITUT FRANÇAIS 
DE CULTURE HUMAINE Établissement privé 
d'enseignement à distance 
(PARIS et LILLE) 
Direction administrative : 
62 P, av. Foch 
59-MARCQ-LILLE 
Profession : 
Adresse : 
Souhaïte recevoir gratuitement: 
documentation générale et formule 
d'orientation. Contre 4 timbres, n° 
spécial de la revue VIE & ACTION 
(mesure de l'intelligence). 
25 "
21,22,"la 
Une question de personna té 
ou de circonstances ? 
Comment devient-on un leader st (À 4 
La la (à Eu G 
y 
mn #6 
é HE) EE 
Li 2 
A 
ee 
? ÉS 
pr 
À #9 
LR 
EI CR LE 
ré 
€ nr 
/ f4 4 £ re Ge 
A ee Le £ sf FT ERA LL 
É 
ff je F7 
Tr A 
# OMR pe 
AS PES PA s 
pute o Le 4 
= 
es cf 
If 
LS d 
LE 
SE OP"" 
Z LE 
LR 
ES 
LS"" TA 
= A É 
dé 
2 
LE 2 PA 
KL « 
SN 
par Fred E. Fiedier ARS NX 
LT \"
