,page,text
0,1,"\ HwR2-6F-02 
û Eno rende ser 4 
MMENT R L 
‘} Ë 
ENLFON Û E ‘i 14 à: 
li. 1° 
! . + 
} 
‘ , 
; SA 
ii ue 
MARSEAEREENRMAR 
EL TR "
1,2,"IS 
HBLIDTNEQUE CAUTUR 
ET UNIVERSITAIRE 
18.0EC.1986 
LAUSANNE 
PS 
(ous 
C’est parce qu'il nous arrive d’être gai et triste en même temps, parce que nous rêvons tous d’une grande passion impossible, défiant la société et la morale, parce qu’enfin nous sommes tous un peu ‘ fous ”' à nos heures, que nous comprenons si bien l'âme russe. 
L'âme russe, c'est Anna Karénine, Cette femme de trente ans, belle, merlée et qui en aime un autre. Début d’une aventure ? Non, c'est le commencement du plus beau roman d’amour qui ait Jamais été écrit. Pour que vous découvriez la Russie des passions, cette Russie qui, entre deux sanglots, éclate de rire nous vous offrons absolument gratuitement ‘“ chef-d'œuvre de Léon Toltsoï. exaltée et géniale, et se met à danser, Anna Karénine ”, le 
( 
I 
I 
I 
Î 
je pourrai refuser d'avance ou même Vous (riens Cr. dans pes que 
Ï 
I 
Ï 
I 
l Rue NO 
Dépl LL vite D vres ve muiay dy 4 ; STtétire dy Jinists oo de et 
9142-5027 19 
2 ANETIES .‘ ""p RL : 1 À À 
RL ant RAT US PEER: 
4 au : nl ES ne : 
EE NE A PRE 
JS l'âme russe 
à mos heures ? Ve c £ ER 
a 7e No] f.: ‘. A 72.7 Sa, à \ a, 
: le . D a TNT 
NET : 
Si nous vous donnons en cadeau ce très beau livre sans aucune e: 
gation d’achat, c’est parce que nous pensons que vous aussi, VOUS ] 
la ‘‘ révélation russe ”. Vous serez émerveilé par l'analyse del dienne ” avant Freud du caractère des personnages, de leurs comporl ments, de leurs sentiments. Après avoir lu ‘“ Anna Karéning pu L 
pensons que vous serez sous le charme, comme emo mi 
romans russes, que vous voudrez en lire bien d’autres de Tolstoi.… mi 
aussi de Dostoïevski, de Pouchkine, Gorki, Tchekov. Il 
A . hoisi 1 Dans notre collection Les Classiques Russes, nous ont Vbrer romans les plus russes... ceux qui vous toucheront, vous pleurer et... rire,comme cela ne vous est jamais arrivé. . A : t atuitf; Maintenant, il ne vous reste plus qu’à demander votre INT E nou: ‘ Anna Karénine ” et vous serez surpris de voir ä quel P sommes tous un peu russes à nos heures. 
UX CERCLE DU BIBLIOPHILE, 27-EVREU*E 
en plein maroqual rouge vif 
dorures au luxor en 
tranche supérieure dorée à l'or 
signet tressé 
nombreux dessins originaux 
d'artistes divers. ENS ee "
2,3,"comprendre, Savoir, agir psyenologie dans le monde d'aujourd'hui 
Mars 1972 - 5 F - N° 26 
Un chercheur et ses idées 6 Henri Piéron 
La psychologie française lui doit son organisation, u 
par Jean Chaguiboff 
EE 
2, p = : = 
— Notre époque 11 Où en est la science du crime ? 
Comment et pourquoi on devient un délinquant, 
par Georges Fully . 
Psychologie animale 19 Deux ans parmi les chimpanzés 
La passionnante aventure d'une psychologue américaine, 
Connaissance des autres 27 Comment devient-on un leader ? Ÿ 
Une question de personnalité ou de circonstances ? 
par Fred E. Fiedler - 
Psychologie clinique Ma découverte du psychodrame”"" 
Des réunions mondaines aux hôpitau 
À 
IN par Claude Bonnafont 
Tests 44 Que valent les tests ? 
Un rideau de fumée qui nous masqué la vérité du sujet, 
51 Georges Balandier —— — 
Pourquoi j'ai voulu passer un an aux Etats-Unis, 
par André Akoun et Jacques Mousseau 
L'on Dem 
crntque 
33 É 
x psychiatriques 
Connaissez-vous Konrad Lorenz ? 
l Notre quiz du mois 62 
Recyclez-vous en éthologie. 
pots En librairie 68 Modèles d'enfants, enfants modèles (Roger Perron) l 
pire La conscience du corps (Moshe Feldenkrais) 
je La vision des vaincus (Nathan Wachtel) 
jsi É 
RE Echos 74 et Informations 
l Who's who 75 dans « Psychologie » 
Le prochain numéro sera en vente le 6 avril 1972 
POUR VOUS ABONNER 
VOYEZ PAGE 76 "
3,4,"par Jean Chaguibof 
in chercheur et ses ES 
aux mathématiques ; mais, par goût et 
si I ——— 
UN BEHAVIORISTE En face du Jardin du Luxem- 
bourg, un immeuble bourgeois fat 
l'angle de la rue Soufflot et de fi rie 
Gay-Lussac. Nous sommes à la "" 1 
siècle dernier. Du cinquième étage, Ÿ 
rière le balcon de fer qui protege là 
fenêtre, un petit garçon regarde les 
gens et les fiacres qui circulent dans 
la rue. Plus tard, lorsqu'il se mêlera 
aux manifestants qui défilent devant la 
Sorbonne et ira jusqu'à se battre 
contre des représentants d'extrême 
droite, c'est encore dans le quartier 
Latin que s'organisera son existence. 
Même lorsque, marié et peut-être avide 
de calme, il aura installé son domicile 
dans la banlieue parisienne, au Vésinet, 
ce seront encore maints endroits du 
quartier qui garderont la trace d'Henri 
Piéron: le Conservatoire des arts et 
métiers, la Sorbonne, le Collège de 
France ou l'Institut de psychologie. 
Henri Piéron (1881-1964) est loin 
d'avoir la notoriété de Freud ou même 
celle de Watson. Pourtant, l'impul- 
sion qu'il a pu donner à la psychologie, 
et à la psychologie française en parti- 
culier, n'est pas dénuée d'importance. 
S'il est moins célèbre, c'est sans doute 
qu'il a été le contraire de ce que sont 
les héros de la psychologie. Fils de 
brillants universitaires, il a suivi pres- 
que sans histoires une brillante carrière 
de brillant universitaire à laquelle seules 
les deux guerres qui ont bouleversé ce 
pays sont venues infliger quelques ac- 
crocs. 
Son cheminement vers la psycholo- 
gie scientifique semble s'amorcer et se 
trouver favorisé dès sa naissance. Son 
père est un personnage profondément 
intelligent qui, originaire d'une famille 
de souffleurs de verre lorrains, a gravi 
d'examen en examen les échelons qui 
le menèrent au poste de directeur du 
lycée Saint-Louis (où son buste fut 
plus tard érigé) ou à celui d'inspecteur 
en chef de l'Education nationale. Autre- 
fois classé premier au diplôme de 
sciences de l'Ecole normale supérieure, 
il rêve, sans jamais en parler expres- 
sément, de voir son fils suivre ses 
traces. De son père, Henri Piéron, outre 
les vastes capacités intellectuelles, hé- 
rite d'une certaine froideur, d'une ré- 
serve assez générale aux habitants de 
l'est de la France, qui fait qu'on sait 
faire talre ses émotions. I[ regrettere 
plus tard ce manque de contacts plus 
étroits entre son père et lul, bien que 
sans doute il reproduise avec ses colla- 
borateurs la même distance dans les Paris. 
rapports qui le fera paraître froid, 
comme il l'avoua lul-même. L'héritage 
6 
(Photo 
Larousse) 
d'un tel trait de caractère n'est pas 
sans influencer la maturation intellec- 
tuelle du petit garçon qui, du haut de 
son balcon, regarde s'agiter le monde, 
place Médicis. L'enfant acquiert le sens 
de la réflexion en même temps que le 
contrôle de ses émotions. Au moment 
de l'affaire Dreyfus, lorsque dans cha- 
que famille de France on s'insulte ou 
on se bat, bien que père et fils soient 
de bord opposé, l'appartement des Pié- 
ron reste calme, le silence est main- tenu Sur ce sujet. Autre facteur favo- rable à l'évolution du jeune garçon : les réceptions données à la maison, où ne viennent que les collègues universitai- res du père, réceptions où « l'étroitesse » d esprit qu'avaient parfois les épouses » était contrebalancée par la grande » largeur d'esprit de Ja plupart des n hommes », Enfin, l'éducation hors pair qu'il reçoit — j] se trouve Un moment au lycée dans une classe de trois élè- ves — alliée à des Capacités incontes- tablement brillantes, lui permet de progresser hardiment et sans fournir RS efforts dans la réussite univer- 
son Dane baccalauréat ilest destiné par Par Sa formation d'esprit par tendance, Il est plus attiré par L 
ï : DE Po philosophie, davantage avide d'explica. 1 Ÿ FE 
tions des mécanismes de la réalité que PE 
de la formulation de lois abstraites, et. DATE 
après un an d'études philosophiques, 1 À ::1 FL 156 
s'attache bien vite 3 l'aspect le plus PT 
positiviste et scientifique de la disc. ar EE 
pline : la psychologie. pes 
af LE 
LES DEBUTS AT. 
DE LA PSYCHOLOGIE pt at SCIENTIFIQUE nes F 
B os 2 
A la fin du XIX° siècle, des noms illus- re 
trent en France le glissement de la psy. À Br se 
chologie vers l'expérimentation. Théodule } 2°; : 
Ribot!, puis Pierre Janet? proclament ET 
que, pour devenir science, la psycho- En 
logie doit renoncer à l'étude d'entités enr 
telles que l'âme et qu'elle doit porter ae L 
ses observations sur les phénomènes rer 
objectifs et extérieurs. La plupart des cie 
travaux de ces pionniers se font à Est 
l'ombre des hôpitaux. Ils estiment que, À LETÈE 
pour comprendre l'homme, l'étude des pren dia 
déviations du comportement et de leurs ! #1: 
causes est une base des plus solides. dat Ës 
Alfred Binet3, connu pour l'invention [ 1£3#r 
de son test d'intelligence, commence ! 
également sa carrière dans cette voie. Le 
Passionné par ces voies nouvelles de ABC 
la psychologie, entre deux bagarres au Le à 
quartier Latin, du côté des socialistes à QU! 
contre les antidreyfusards, Piéron court — 
du Collège de France à la Sorbonne, Be 
et vice versa, pour écouter les leçons Re 
de ces grands maîtres. ll passe licence Fer 
et agrégation; entre-temps, il est le RE 
secrétaire de Janet à la Salpêtrière. fre 
Les activités des divers laboratoires de FR ee 
psychologie et de physiologie, rattachés = & : 
soit à l'université, soit aux hôpitaux, MT 
le captivent. Il y rencontre des scien- ER N 
tifiques qui partagent ses préoccupir Le ‘ 
tions et auxquels il se lie. ll PEU DR 
enfin installer, à l'asile de Villejuif. “ n Rs"" 
propre laboratoire de physiologie où , ! 
il trouve les conditions les plus jus TR 
rables à la poursuite des recherche S nu 
qu'il a lui-même déjà commencées: : ; fus lEx ee Le siècle a basculé. L'affaire Dr LT 
s'est apaisée. Piéron s'est Le chi Les gagne sa vie comme professeur ee. NT losophie tout d'abord, puis comm PE FAUS 
crétaire de la «Revue scientifian EN 
et il devient bientôt maître de © NUS 
SN NN 
: fran- [, NL l. Théodule Ribot (1839-1916) : philosophe céri. Le ë çais, L uteur d'études de psychologt R, k NS mentale. . cline LE SAS 2. Sur Pierre Janet, voir l'article de Jacqau N AN 
Hubert paru dans Psychologie n° ""prançoise LÉ 
3. Sur Alfred Binet, voir l’article de SES Gauquelin paru dans Psychologie 0 & &"
4,5,"rences à l'Ecole pratique des hautes 
études. Parallèlement, il poursuit ses 
recherches personnelles à Villejuif. 
Dès lors, on peut dire que toutes ses 
activités se tournent exclusivement vers 
la science. Il publie des articles, s'oc- 
cupe de revues et d'encyclopédies. 
A la mort de Binet, à 31 ans, il est 
nommé directeur du laboratoire de psy- 
chologie physiologique de la Sorbonne. 
Au même moment, il devient responsa- 
ble de la revue «l'Année psycholo- 
gique », qu'il dirigera pendant 50 ans. 
La réorganisation du laboratoire, que 
Binet avait délaissé au profit de ses 
recherches dans les écoles publiques, se 
trouve entravée par l'irruption de la 
guerre contre l'Allemagne. Piéron est 
envoyé comme assistant médical dans 
un centre de neuropsychiatrie, à Mont- 
pellier. En 1920, après publication d'une 
loi qui en permet la création, il fonde 
le premier institut d'université de 
France, l'Institut de psychologie. Trois 
ans plus tard, il est élu au Collège de 
France à la chaire de physiologie des 
sensations. Peu après, il crée l'Ins- 
titut d'orientation professionnelle. Après 
sa fondation par Jean Perrin, dont Il 
est devenu l'ami à la suite d'une contro- 
verse sur l'existence de rayons N, il est 
nommé au Conseil supérieur du Centre 
national de la recherche scientifique. 
La Seconde Guerre mondiale l'envoie à 
Bordeaux, où il est chargé de la sélec- 
tion pour le recrutement de pilotes 
d'avion. Cet épisode rapidement terml- 
né, il décide de revenir à Paris. 
IL AURA MANQUE 
À SA GLOIRE DE FONDER 
UNE GRANDE THEORIE 
La guerre terminée, et jusqu'à sa mort, 
en 1964, Piéron ne cesse de poursuivre 
ses activités. Publications d'articles, de 
revues, d'ouvrages, du « Traité de psy- 
chologie appliquée », conférences, 
congrès, responsabilités officielles de 
toutes sortes, préoccupations toutes 
tournées vers le dessein unique du dé- 
veloppement de la science psychologi- 
que auront dessiné toute la texture de 
l'existence du savant et absorbé toutes 
ses énergies. L'austérité, la probité 
scientifique ainsi qu'une réelle introver- 
sion ont fait que Piéron ne s'est jamais 
signalé par une action d'éclat, une 
grande découverte ou une théorie tapa- 
geuse. Il a toujours préféré la recherche 
minutieuse ou la réflexion méthodologi- 
que. On aura compris qu'il est à l'oppo- 
sé d'un Watson qui, au même moment, 
S agite aux Etats-Unis pour donner nais- 
sance à l'école behavioriste — bien que 
le fondement de leur activité scienti- 
fique soit le même. Piéron, déjà avant 
Watson, affirme aussi sa prédilection 
pour le comportement. Il écarte, lui 
aussi, le problème de la conscience. 
De même, dans ses méthodes — re- 
cherches psychologiques sur l'animal ou utilisation des appareils — il suit 
un cheminement parallèle à celui de 
Watson. Mais il n'est pas l'homme des 
développements  abstraits. Dans son 
œuvre scientifique, il s'attache aux 
choses dans ce qu'elles ont de concret 
et ne s'aventure pas dans les grands 
problèmes de fond. Cela ne veut pas 
dire pour autant qu'il se refuse à la 
controverse, comme on a pu le voir 
pour l'affaire des rayons N, ni que les 
prolongements philosophiques ou méta- 
physiques que peut avoir toute recher- 
che psychologique le laissent indiffé- 
rent. Il sait l'évolution lente de toute 
science, qui est d'avancer pas à pas. 
De la même manière, du fait de sa 
personnalité peu expansive, les gens 
qui travaillent avec lui sont des colla- 
borateurs et non pas des disciples. 
Piéron a créé nombre d'institutions qui 
ont permis le développement de la psy- 
chologie française ; il n'a pas créé une 
« école », qu'on aurait pu appeler l'école 
behavioriste française. Le terme « pié- 
ronien », outre qu'il est imprononçable, 
n'existe pas, au contraire de « Watso- 
nien » ou « freudien ». 
Son unique conviction est celle-ci: 
la psychologie est une science. Il es- 
time que toute science, dans son deve- 
nir, Va vers une épuration des schémas 
explicatifs, que toutes les sciences sont 
destinées à se résorber les unes dans 
les autres : la psychologie dans la phy- 
siologie, la physiologie dans la chimie, 
la chimie dans la physique. Dans son 
ouvrage «la Sensation, guide de vie », 
étudiant les mécanismes perceptifs, Il 
constate que nos centres nerveux ne 
sont alertés que par des séries de si- 
gnaux qui sont mille fois plus éloignés 
de la réalité que ne l'étaient les ombres 
de la caverne de Platon. Cependant, 
ces messages nous sont nécessaires et 
servent à l'organisation de notre exis- 
tence au seln du monde extérieur dont 
nous ne connaissons ainsi que l'appa- 
rence biologique qui est nôtre. La 
connaissance d'une chose — elle n'est 
jamais la chose elle-même — s'échafau- 
derait par progrès consécutifs de divers 
mécanismes, aboutissement à l'épanouis- 
sement de l'intellection, de l'intelli- 
gence. 
Par l'éclectisme de ses intérêts en psy- 
chologie, Piéron fait progresser la 
connaissance dans tous les domaines : 
psychologie, physiologie, psychologie 
animale, psychologie appliquée, psycho- 
logie scolaire. Au début de sa carrière, 
à la demande d'un de ses amis, il 
est amené à se pencher sur le problème 
du rêve. Après avoir consulté sur le 
sujet toute une littérature plus ou 
moins brumeuse (nous sommes au dé- 
but du siècle, les spéculations philo- 
sophiques vont bon train), il décide de 
réaliser lui-même des expériences 
concrètes prouvant des faits concrets. 
La première nécessité, estime-til, pour 
comprendre le rêve est d'étudier le 
sommeil, recherche dans laquelle il se lance avec passion et qui aboutira 
plusieurs années plus tard, toute idée 
de rêve étant écartée, à son doctorat : 
«Le mécanisme du sommeil ». Le prin- 
cipe de cette recherche consiste à em- 
pêcher des chiens de dormir pour étu- 
dier les conséquences qui s'ensuivent. 
© 
UN PIONNIER DES RECHERCHES 
SUR LA PHYSIOLOGIE 
DU SOMMEIL 
Une première constatation va de soi: 
si un chien ne peut jamais dormir, il 
meurt au-delà d'une certaine limite de 
temps. Piéron constate que le manque 
de sommeil provoque l'altération de 
cellules nerveuses. Il en vient à 
conclure à la possibilité d'une hypotoxi- 
cité provoquée par une veille trop pro- 
longée. Le mot hypotoxine est même 
prononcé, mais sans qu'il lui soit pos- 
sible d'isoler une substance particuliè- 
re répondant aux propriétés qu'un tel 
composé chimique supposerait. Comme 
on le voit, et la démarche est courante 
chez Piéron, un comportement psycho- 
logique particulier (ici, le sommeil) est 
étudié en fonction de ses soubasse- 
ments physiologiques. Dès cette épo- 
que, le jeune psychologue ne conçoit 
pas que des conduites puissent être 
réalisées sans être en quelque sorte 
le fruit d'une quelconque réaction biolo- 
gique. L'être humain, ou l'être vivant, 
n'est pas un esprit débarqué par 
hasard dans la réalité des choses maté- 
rielles. 11 est un organisme en lutte 
pour sa survie, un centre d'adaptation 
physiologique. C'est pourquoi Piéron 
explore les neurones de la moelle, du 
bulbe, du cervelet, pour enfin constater 
dans les couches profondes du cortex 
des chiens involontairement insomnia- 
ques l'altération des cellules. 
Deux sortes d'attaques sont portées 
à propos de cette expérimentation. La 
première vient des amis des animaux, 
qui reprochent au chercheur de mal- 
traiter ainsi les bêtes. Piéron se défend 
alors en invoquant le droit pour 
les savants d'utiliser des animaux à 
des fins scientifiques. Une autre objec- 
tion est plus technique: on lui fait 
remarquer qu'il étudie non pas le som- 
meil, mais’ l’insomnie. I[ rétorque en 
déclarant que sa méthode est la meil- 
leure pour étudier les causes du som- 
meil, causes simplement accusées par 
la prolongation de l'insomnie imposée. 
L'expérimentation suppose toujours né- 
cessairement une certaine déviation 
par rapport aux mécanismes naturels 
afin d'observer plus aisément les réac- 
tions, ici un grossissement du phéno- 
mène, comme si l'on pouvait approcher 
une loupe d'un comportement à étudier. 
Poursuivant sa recherche, il prélève 
les humeurs, sang, liquide céphalora- 
chidien, des animaux en état de veille 
prolongée et les injecte à des animaux 
témoins. !l constate alors une augmen- 
7"
