,page,text
35,36,"RATE RTE EURE) LRETUR LICE RSS RAATISNRENANEES 
al 
Ge 9 oià. longtemps, j'avais À st nn NN ren SSIRS suivi différents cours $ Hi J QUE VALENT LES TESTS? re] x mais le jour où la classe fa 
 SOuUT-US UN RIDEAU DE FUMÉE smaiea Les résultat dur À 2 ' > test des taches d'encre de Rorschach mil DIE OINMIE ©) et la façon dont le professeur se pas- ail AS OUTA NT [La] FE =) sionna pour l’une des réponses : as 
«… Et ici, disait le sujet, je vois nt] »le clocher d'une église, là l'église pr , par Frank McMahon »et en bas de l'herbe.» né \ « Vous voyez, expliqua le profes. ja 
» seur, le clocher représente le phal- (i gË 
»lus, et l'herbe, les poils du pubis: LÉ » nous avons manifestement affaire à CR »un conflit entre la contrainte reli. té: » gieuse et le désir sexuel. » bus 
Une autre fois, nous discutâmes un ne test de personnalité dans lequel Je ! À Lt sujet devait compléter des phrases: l! D fs « Une nuït, je. m'éveillai et allai ï ER » prendre quelque chose à manger rs » dans le réfrigérateur, un hot-dog, {! hs » je crois.» D 
C'est une jeune femme qui avait ! til écrit cela et je laisse le lecteur ! Lai l'interpréter. Ses fantaisies les plus ! pe extravagantes ne pourront surpasser 
celles des psychologues. 
À propos de cet élément d’un test 
objectif : «Je ne me porte pas aussi 
»bien qu'avant» (ce qui s'était avé- 
ré après vérification), on nous fit 
Parcourir tous les autres tests du 
Sujet pour y rechercher des traces 
d'anxiété anormale ou de désordres 
mentaux, sans envisager un seul ins- 
tant la possibilité que le sujet pou- vait simplement avoir besoin ce jour- 
là d'un cachet facilitant la digestion. Freud a été l'un des grands génies de Ja psychologie ; il a secouru tout 
le monde, sauf le psychologue. À celui-ci, il a donné la méthode psy- 
chanalytique, qui permet à l'analyste 
l 
l 
[l 
! 
l l J de discourir librement sur le sub- Conscient d'un patient sans se sou- cier des contradictions de son dis- Cours. La méthode freudienne est de- venu Un outil qu'il est possible d'utiliser en toute circonstance, une méthode qui permet des diagnostics Contradictoires : elle trompe le psy- chologue en même temps qu'elle éga- re le patient. Quand on interprète le subconscient d'un individu, il est 
Iustrations : 44 
TT TAN"
36,37,"évident que ce qu'on recherche est 
inconnu à la fois du patient el du 
psychologue. Ces propos amers n’en- 
lèvent rien au fait que les travaux 
de Freud ont permis des progrès re- 
marquables : nous savons grâce à eux 
que l'être humain n'est pas toujours 
ce qu'il paraît être superficiellement ; 
nous savons également que la sexua- 
lité est une caractéristique de l'en- 
fance aussi bien qu'une préoccupa- 
tion de l'âge adulte. 
Pourtant, ne va-t-on pas trop loin ? 
Un spécialiste de la recherche sur 
les rêves, Calvin Hall, de l'université 
de Californie (Santa Cruz) a dénom- 
bré les symboles sexuels énumérés 
dans différents livres ou articles de 
psychologie. Il en a compté 107, 
ayant retenu tout ce qui ressemble 
à un fusil ou un bâton et tout ce 
qui rappelle le labourage ou la fla- 
gellation. Comme les automobiles, les 
symboles sexuels sont soudain deve- 
nus trop nombreux: la théorie, 
exacte à l'origine, nous entraîne fina- 
lement dans un brouillard asphyxiant ; 
les symboles sexuels et leur interpré- tation ont presque pris la place de 
l'étude du patient lui-même. 
Gordon Allport, professeur à Har- 
vard et ancien président de l’Asso- 
ciation américaine de psychologie, a 
suggéré un jour que la première 
chose à faire pour connaître quelque 
chose sur quelqu'un était de le de- 
mander directement à l'intéressé. 
Nous avons malheureusement négli- 
gé cette suggestion. Nous autres, 
psychologues, craignons de perdre 
le pouvoir que nous avons sur notre 
patient en faisant appel à l'aide que 
cet être doué d'intelligence pourrait 
nous apporter. 
De nos jours, la psychologie clini- 
que est dominée par un sentiment 
mitigé de peur et de fascination à 
l'égard du pouvoir dont dispose le 
psychiatre !. Ce goût pour le pouvoir 
se manifeste dans les tentatives de 
l'Association américaine de psycho- 
logie pour faire admettre des clini- 
ciens comme experts dans les pro- 
cès ; une récente victoire en cour de 
justice a couronné ces efforts, éten- 
dant ainsi le pouvoir de la psycho- 
logie clinique. Quant à la peur, elle 
se manifeste dans les restrictions im- 
posées aux étudiants non diplômés 
qui veulent acquérir des planches 
de Rorschach, ainsi que dans le 
jargon incompréhensible inventé pour 
parler des troubles psychologiques. Les psychologues ont mené une 
lutte longue et difficile pour parve- 
nir à se faire reconnaître. Le prix de 
leur réussite est l'obscurcissement de 
la compréhension et du diagnostic 
par la création d'un langage Ppsy- 
chologique à double et même triple 
sens. 
Il importe peu que cela maintienne 
le patient dans l'ignorance de ses 
problèmes car, pour la plupart des 
psychologues, celui-ci n'a pas voix 
au chapitre. Il suffit d'observer ce 
phénomène courant, lors d'une réu- 
nion de cliniciens : hochements de 
tête, légers sourires, enfin toutes ma- 
nifestations possibles, hormis les 
acclamations, à l'énoncé d’une for- 
mule aussi dépourvue de sens que: 
« Il fait une fixation à ce niveau car, 
» pendant son enfance, son père était 
» sévère, indulgent, hostile, neutre, 
» castrateur, trop protecteur.» Choi- 
sissez indifféremment l’un de ces qua- 
lificatifs. Ils font tous l'affaire ! Main- 
tenant que la psychologie s'est fait 
admettre comme science, il est regret- 
table que nous ne fassions pas mar- 
che arrière pour examiner les élé- 
ments que nous possédons. Quand 
nous utilisons les tests, testons-nous 
vraiment ce que nous croyons tes- 
ter ? 
La psychologie s'est développée 
de façon paradoxale. Pour combat- 
tre l'idée selon laquelle l'homme est 
un animal absolument rationnel, nous 
avons souligné son incapacité à se 
comprendre lui-même. Nous avons 
déclaré que le porte-plume repré- 
sente autre chose que le porte-plume, 
qu'il présente un pénis. Mais après 
avoir apporté la preuve de notre ar- 
1. ND.L.R.: on peut rapprocher ce propos 
d'un Américain de tout le mouvement de 
l'antipsychiatrie en Europe, Ce mouvement 
commence à gagner les Etats-Unis. Sur l'anti- 
psychiatrie, on lira l'étude de Jacques Mous- 
seau dans Psychologie n° 21"
37,38,"gument (que l’homme n'est pas tou- 
jours rationnel), nous nous relrou- 
vons prisonniers d'un autre mythe, 
aussi excessif, selon lequel l'homme 
n'est qu'un enchevêtrement de mala- 
dies inavouables. 
Nous devons faire marche arrière, 
et parler avec notre patient, de choses 
aussi insignifiantes que le porte-plume 
s'il en est besoin. Si nous lui deman- 
dons ce que signifie ce porte-plume 
dans son rêve ou dans son test de 
Rorschach, il nous répondra peut- 
être simplement que cela représente 
son désir d'être écrivain et l'impres- 
sion qu'il a d'être réprimé dans son 
imagination créatrice et sa faculté 
d'expression. 
Mais au lieu de nous inspirer seu- 
lement du passé, au lieu de le figer, 
nous continuons à interpréter de la 
même façon stéréotypée ces tests 
psychologiques et à rechercher par- 
dessus tout des symboles cachés et 
des significations profondes. Le pa- 
tient se méfie légitimement ; le psy- 
chologue se méfie légitimement : 
c'est alors à celui qui pourra mysti- 
fier l’autre. Le psychologue a natu- 
rellement le dessus, car il peut inter- 
préter le contenu des tests de la 
façon qu'il veut. 
Un autre problème a été fréquem- 
ment soulevé par des hommes 
comme Hans Eysenck?, Gordon All- 
port3 et Carl Rogers4: c'est au ha- 
sard que nous nous fions quand nous 
prédisons quoi que ce soit d'essentiel 
au moyen des tests psychologiques 
tels qu'ils existent actuellement. Ain- 
si, les vérifications concernant la va- 
lidité du Rorschach sont positives à 
50 % seulement. Vous pouvez déduire 
ce que vous voulez de ce résultat ! 
D'après les estimations de validité 
— les études sur la validité vérifient 
si un test mesure bien ce qu'il est 
censé mesurer — les tests de per- 
sonnalité remplissent si peu cette 
condition que le problème fondamen- 
tal n'est souvent pas abordé. Alors 
que la validité parfaite devrait être 
de 100%, on admet que 25% suf- 
fisent pour fonder les tests de per- 
sonnalité. Un chercheur comme Lee 
Cronbach souligne combien ce pour- 
centage est faible dans son ouvrage 
« Essentials of Psychological Tes- 
Ling ». Selon la façon dont on mesure 
la validité, selon les sujets testés, 
leur histoire et leur intelligence, une 
validité de 25% peut signifier que le Lest n'a qu'un peu plus de 50 % de 
Jrécision. 
PLa fidélité, qui découle de la va- 
lidité, indique avec quelle précision le test mesure ce qu'il est censé Ine- 
surer. Le M.M.P.I. (Minnesota Muiti- 
phasic Personality Inventory) a un 
coeficient de fidélité qui peut atteim- 
dre le pourcentage très faible de 
50%. Il est pourtant considéré 
comme le meilleur des tests dans 
lesquels le sujet fournit lui-même des 
indications sur sa personne en répon- 
dant par vrai ou faux à ce type de 
questions : «Je suis satisfait de ma 
» vie sexuelle. » Le docteur Anne Anas- 
tasi, spécialiste des problèmes de 
tests, cite une estimation de fidélité 
selon laquelle une échelle de para- 
noïa M.M.P.J. atteignait un pourcen- 
lage négatif de 0,5; elle ajoute alors 
que les échelles ne sont pas signi- 
ficatives. 
Je pense qu'il existe deux raisons 
fondamentales à la stagnation pro- 
longée des tests psychologiques. Pre- 
mièrement, afin de maintenir le 
mythe du professionnalisme, nous 
surinterprétons, nous poussons trop 
loin l'interprétation et craignons par- 
dessus tout de ne pas voir quelque 
chose dans le dépouillement d’un 
test. Deuxièmement, pour compren- 
dre l'infinie complexité de l'esprit 
humaïn, nous devrions demander au 
sujet de nous aider, tenir compte 
de ce qu'il nous dit littéralement et intégrer son matériel à notre test. 
Malheureusement, certains psycholo- 
gues estiment que ce serait agir 
comme le chirurgien de la fable qui demande au malade où il doit opérer. Fondamentalement, il existe trois 
types de tests psychologiques: les tests objectifs, les tests semi-projec- 
tifs et les tests projectifs, dont les formes diffèrent. Le sujet répond 
par exemple à des questionnaires 
cans le premier cas, complète des 
des “faches d'ensse “dans Le tros roisième. En 1959, K.B. Little, de l'université 
de Denver, et Edwin Schneïdman, de 
l'{nstitut national de la santé men. 
tale, étudièrent ces différents lypes 
de tests et firent évaluer par 48 psy. 
chologues cliniciens des tests de su. 
jets déjà interviewés et analysés par 
d'autres spécialistes qui les avaient 
classés par catégories allant du psy. 
chotique au normal. Ces 48 cher. 
cheurs découvrirent que les premiers 
psychologues avaient eu tendance à 
surinterpréter les tests du groupe de 
sujets normaux et à les placer dans 
la catégorie des névrosés. 
Par la suite, je décidai de faire 
personnellement une expérience pour 
approfondir cette hypothèse de Ja 
surinterprétation. J'entrepris de com- 
parer les évaluations de tests faites, 
d'une part, par des étudiants diplô. 
més en psychologie, et, d’autre part, 
par des étudiants de disciplines diffé- 
rentes. Différentes données, objec- 
tives, semi-projectives et projectives, 
furent recueillies auprès de 36 indi- 
vidus qui suivaient une psychothéra- 
2. H. Eysenck : psychologue anglais, spécialiste 
de l'étude de Ja personnalité. L'un de ses 
ouvrages, Us et abus de la psychologie, est 
paru en français aux éd. Delachaux, en 1956. 
3. G. W. Allport : psychologue américain qui 
s'est préoccupé également d'étudier la per- 
sonnalité dans un ouvrage intitulé Personality 
(New York, Holt, 1937). 
4. Sur C. Rogers, lire l’article de M. Bernard 
dans le n° 14 de Psychologie."
38,39,"per 
alify 
Inard pie el de 27 autres qui disaient 
n'avoir jamais subi aucun traitement 
psychologique (ces derniers précisè- 
rent dans un questionnaire anonyme 
qu'ils n'avaient jamais ressenti le be- 
soin d'un tel traitement). Statisti- 
quement, il devait donc y avoir un 
nombre plus important d'individus 
instables dans le groupe de ceux qui 
suivaient un traitement. Je sélection- 
nai les réponses des 63 sujets aux 
différents tests en éliminant celles 
qui n'étaient pas représentatives, 
puis les distribuai d'une part à 
16 étudiants diplômés en psychologie 
clinique qui avaient tous suivi des 
cours sur les méthodes de tests et 
préparaient leur doctorat, et d'autre 
part à 16 étudiants de même niveau 
dans un domaine différent. Les deux 
groupes évaluèrent les réponses des 
groupes «normaux » et « nÉVrosés » 
selon qu'ils pensaient que les sujets 
étaient normaux où névrosés. 
Je m'aperçus alors qu'en ce qui 
concernait le M.M.P.I. et le test semi- 
projectif, le second groupe d'étu- diants avait été capable de différen- 
cier les réponses avec autant de pré- 
cision que les étudiants en psycho- 
logie; surtout, ils avaient obtenu de 
meilleurs résultats que ces derniers 
en classant les réponses « normales » et «névrosées» des tests de Rors- 
chach. Une analyse plus détaillée fit 
apparaître que, dans le cas du 
Rorschach, les étudiants en psycho- 
logie avaient interprété les réponses 
des sujets les plus intelligents comme 
étant les plus anormales : ils avaient 
surestimé le contenu symbolique 
fourni par les individus les plus bril- 
lants. 
Selon d'autres études, il paraît évi- 
dent que les sujets les plus intelli- 
gents produisent plus de symboles. 
Si c'est bien dans l'interprétation 
symbolique que le risque de surin- 
terprétation est le plus grand, il s'en- 
suit donc que l'on assigne facilement 
des coefficients anormaux à des in- 
dividus normaux d'une grande intel- 
ligence. Cela ne signifie pas que les 
profanes interprètent nécessairement 
mieux les tests que les psychologues, 
mais que les psychologues élaborent 
des interprétations toujours plus 
compliquées qui éloignent toujours 
plus le clinicien de la réalité de son 
patient. On pourrait dire à La limite 
que, dans le cas cité, la formation 
clinique n'était d'aucun secours pour 
le diagnostic. En fait, je veux seu- 
: lement montrer que la formation est 
RD) 
FT mal digérée. Elle incite les psycho- 
logues à exhumer ce qui n'est peut- 
être même pas la psyché de l'in- 
dividu : des significations inconscien- 
tes, secrètes et élaborées. 
Les psychologues devraient plutôt 
utiliser leur formation clinique 
conjointement avec leur sens com- 
mun et celui du patient qui se décrit ; 
ils devraient accorder plus d'impor- 
tance à ce que dit le sujet de lui- 
même et admettre que, dans la plu- 
part des cas, il dit la vérité (ce qui 
est certainement aussi efficace que 
de deviner), puis essayer d'intégrer 
ces sources dans un tout intelligible. 
Chose curieuse, alors que les étu- 
diants ont bien su séparer les deux 
catégories (« normal » et « névrosé »), 
il ne semble pas que le contenu 
même des items soit essentiel dans 
le processus d'évaluation. Je veux 
dire que si certains items indiquaient 
uniformément l'existence de troubles, 
ils auraient dû être uniformément 
évalués comme tels, ce qui ne fut 
pas le cas. Il y eut seulement 22 items 
sur 376 que 75% des étudiants éva- 
luèrent de la même façon. Il semble 
donc que le contenu des items eux- 
mêmes ne soit pas interprété avec 
précision. Le test psychologique tra- 
ditionnel pourrait bien ne pas révé- 
ler le contenu qui serait le plus si- 
gnificatif pour le sujet et le psycho- 
logue. 
En 1963, je mis au point un nou- 
veau test de personnalité destiné à 
être appliqué de façon plus person- 
nalisée. Toutes les questions étaient 
transparentes, évidentes, et le sujet 
pouvait s'apercevoir aisément qu'une 
certaine réponse compterait « contre » 
lui. 
5. Item : chaque question d'un test psycholo- 
gique, 
47"
39,40,"1963"" 
Ey"" 
Western 
Psychological 
Services ] 
. - 
. Je ne crois pas que Diew existe VF; 
b. SI VRAI: Ma vie semble vide parce 
qu'elle ne semble pas avoir 
de finalité. V F . 
. Je ne suis pas une personne importante! 
au moins pour ceux qui 
m'entourent. V F 
b. SI VRAI: Je me sens un être sans 
valeur, V F é 
Î 
. Je passe parfois tant de {emps sur 
un problème que les autres perdent 
patience à mon égard. V F . 
b. SI VRAI : Je perds souvent mol-mÉmME 
patience en raison de mon 
perfectionnisme. V F 
. J'ai atteint un équilibre satisfaisant 
en ce qui concerne Ja vie sexuelle. V F 
b. SI FAUX: Je me sens capable de 
trouver un tel équilibre dans un proche 
avenir. V F 
. J'ai des périodes d'une telle agitation 
que je ne peux rester en place. V E 
b. SI VRAÏ : Le plus souvent, je me sens 
comme un ressort constamment 
tendu. V F 
1l.a. Je m'interroge sauvent à propos de 
questions religieuses. V F 
b. SI VRAI : Je vis en pleine confusion en 
ce qui concerne la religion. V KF 
. Dans ma famille, on ne manifeste pas 
beaucoup de tendresse et on 
communique peu. V EF 
b. SI VRAI: Je reçois suffisamment de 
tendresse de mes amis et je commu: 
nique suffisamment avec eux. V F 
13. a. Notre société me paraît plus proche de 
la jungle que de la civilisation. V F l 
b. SI VRAI : Je ne me sens pas en sécurité 
dans ma vie quotidienne. V F 
LES QUESTIONS COUPLEES : Les ques- 
tions ci-dessus sont des exemples du 
test établi par le professeur McMahon! 
Il a été conçu de facon à combattre les 
pièges et les insuffisances des tests 
psychologiques courants. Pour la réussite de cette technique, 
je devais éviter l'ambiguité du test 
habituel. Aussi, après chaque Item, 
j'introduisis un modicateur qui eV 
tait au sujet de se sentir (et d’être) 
pris au piège. Par exemple : « Cer- 
»taines personnes m El veulent » — 
Vrai ou Faux — suivi par: « Si cela 
»est vrai: Je ne peux m'empêcher 
»d'y penser» — Vrai ou Faux. Ce 
type de questions couplées pousse 
l'individu qui répond «vrai» aux 
deux éléments à reconnaître que le 
problème est assez important pour 
être souligné deux fois. Cela n'éclair- 
cit évidemment pas la signification 
profonde de l'item, pas plus qu'elle 
ne l'est dans aucun test. Mais ce 
procédé indique les domaines dont 
le patient désire discuter de façon 
plus approfondie et leur accorde 
beaucoup plus d'importance. Le test 
est ensuite évalué. Mais, plutôt que 
d'en faire un rapport connu du seul 
psychologue, comme le veut l'usage, 
nous le rendons au sujet pour en 
discuter. 
Il serait trop long d'analyser de 
cette façon chaque item d'un test 
objectif habituel, étant donné le très 
grand nombre d'éléments dont ils 
sont formés (plus de 500 pour le 
M.MP.I.); mais il est possible de 
construire un test efficace de 50 élé- 
ments seulement en utilisant la tech- 
nique des questions couplées. Le psy- 
chologue peut alors indiquer que 
certaines réponses suggèrent l'exis- 
tence de problèmes et la discussion 
ultérieure clarifiera encore la signi- 
fication de chaque item et indiquera 
la mesure dans laquelle, selon le pSy- 
chologue ou le sujet, un de ces items 
doit être approfondi. Je considère la 
discussion comme une part essen- 
tielle du processus. 
Les psychologues s’aperçurent ra- 
pidement, en utilisant ce test, qu'il permettait de bâtir la relation pa- 
tient/médecin sur des bases plus franches. Il était possible d'analyser avec une confiance mutuelle la si- 
les problèmes que res 41e neoudre 
géraient. ° 9 ements sug- 
ire”, ralysâmes ensuite la struc- 
quelle était la. sñn de déterminer all la signification inhérente à l'élément d'un test babituel, par 
opposition à la question couplée, Par 
exemple, l'item suivant d'un test tra. 
ditionnel : « Certaines personnes 
»m'en veulent», fut évalué par un 
groupe de psychologues et les inter. 
prétations qu'ils en firent s'échelon- 
nèrent entre les deux catégories sui. 
vantes : «indique un individu agres- 
» sif» et «présente des caractéristi 
»ques paranoïaques ». Un second 
groupe évalua le même item auquel 
nous avions ajouté le modificateur : 
« Je ne peux m'empêcher d'y penser », 
suivi de la mention «Faux». Les 
interprétations  changèrent alors 
considérablement. Peu de psycholo- 
gues estimèrent encore que l'affirma- 
tion «Certaines personnes m'en 
» veulent » indiquait des troubles pro- 
fonds, mais leurs interprétations 
différaient largement. 
Je fis alors une estimation de va- 
lidité de mon test. Après trois 
séances, on demanda aux sujets qui 
avaient discuté des items avec les 
psvchothérapeutes d'indiquer les pro- 
blèmes importants qui n'avaient pas 
été encore abordés au cours de 
l'analyse. Seul un sujet sur 32 estima "
40,41,"Lee Freud a aidé 
tout le monde, 
sauf le psychologue 
qu'il n'avait pas cerné ses principaux 
problèmes. Au cours d’autres estima- 
tions de validité, cette technique a 
été comparée aux plus longs et moins 
transparents des tests objectifs. Les 
résultats de ces autres tests furent 
les mémes que ceux du test à ques- 
{ions couplées, dans une proportion 
- suffisante pour établir des coefficients 
de corrélation entre 0,8 et 0,95, qui 
sont des chiffres élevés. D'autres 
études de ce test donnent des esti- 
mations chiffrées de validité de 0,7 
et 0,8. Les thérapeutes qui ne connais- 
saient pas les résultats obtenus avec 
les tests à questions couplées éva- 
luèrent les sujets au moyen de tech- 
niques différentes. La comparaison 
de leurs résultats avec ceux des tests 
à questions couplées montre le ni- 
veau élevé de validité de ceux-ci. Le traitement des malades en ré- 
gression s'est révélé beaucoup plus 
efficace quand le thérapeute a pris 
le temps d'apprendre le langage spé- 
cifique du patient lui-même. Ïl peut 
être obligé d'apprendre que le ma- 
Jade conçoit Dieu comme un Chinois 
moustachu de 1,20 mètre; c'est une 
leçon lente et difficile et peu de 
spécialistes ont suffisamment de cou- 
rage pour l’entreprendre. De la même 
façon, la plupart d'entre nous ne tien- 
nent pas compte de la signification 
que les sujets donnent aux symboles 
quand ils passent des tests. Je ne 
veux pas dire par là que le symbo- 
lisme ou la signification cachée ne 
sont pas d'une extrême importance, 
mais il me semble simplement logi- 
que que le sujet nous aide à com- 
prendre les symboles. Je pense que 
le test à questions couplées atteint 
un niveau élevé de validité parce 
qu'il n'est ni ingénieux ni rusé. Il 
dit au sujet: « Vous m'aidez à vous 
comprendre. » 
l'essayer ? Pourquoi ne pas 
Franck B. McMahon Jr Pour vos problèmes 
de la vie de chaque Jour 
vous trouverez des 
Vient de paraître : 
PIERRE CAILLY 
9 LA no] 
L'éducation 
au fUTUr A travers les étapes de l'en- 
fance et de l'adolescence, en 
famille et à l'école, comment 
se prépare l'orientation pro- 
fesstonnelle et scolaire de nos 
enfants. 
A paraître fln Mars : 
DR JACQUES 
SARANO 
La séparation Vivre, c'est aussi se séparer 
et être séparé ; chacun en falt 
sans cesse, de tant de façons, 
l'expérlence, Comment ne pas 
s'enfermer dans une continuel- 
le frustration ? 
Déjà parus dans la collection : 
OLIVIER COTINAUD 
La rencontre du 
psychologue 
SUZANNE BRESARD 
Comment changer ? 
MARC ORAISON 
Les conflits 
de l'existence 
MONIQUE GUENEAU 
Réussir le métier 
de parents 
DR ABIVEN 
Vivre à deux 
LE CENTURION "
41,42,"HEGardIsUrs 
pointé débattre eademotretiilisanionts 
86 a SE À: : E 5 il 
ar 
268 
à 06 DO 
ee 
BA 
A 
men 
ea 
à 2 
2"
