,page,text
0,1,connaissance soi connaissance autres rer eee css crrpienrs
1,2,"stress licge sct tia fc'siio soc'ale volonté timidité vie deux monneret 41,50 tests j.-l. sellier france aix-en-provence asnières librairie nouvelle 10. rue maurice-bokanowski bordeaux librairie molat 83-91 portelibrairie saglima chambery librairie savoie place métropole grenoble librairie arthaud grande-au lille furet nord place g.-de-gaulle lyon librairie camugli rue charité librairie flammarion centre commercial régional part-dieu rue docteur-bouchut marseille editions flammarion cannebière montpellier sauramps rue saint-guilhem nice librairie actual rue masséna librairie rudin félix-faure sorbonne rue l'hôtel-des-postes nogent-sur-marne librairie berthet 105 grande-rue charles-de-gaulle paris librairie flammarion italiens 75002 paris gibert jeune quai st-michel 75005 paris gibert jeune place saint-michel 75005 paris larousse sorbonne rue ecoles 75005 paris rue grossi mmprendre répondre librairie provence 31. cours mirabeau digeaux l'éditeur sujets flèch collections cepl varenne memoires provisoires comment rater tout l'on réussit sternberg 37.f etonnante parapsychologie bender chez libraires flèche librairie prélat rue petit-pont 75005 paris presses universitaires.de france bd'saint-michel 75005 paris apostolat éditions 46. rue four 75006 paris fédérationinationale d'achat.des cadres 136 rue.de rennes 75006 paris joseph gibert rue ecole-de-médecine 75006 paris librairie l'œil écoute bdidu montparnasse 75006 paris librairie della procure rue mézières 75006 paris bon marché paris rue sèvres 75322 paris cedex chariot d'or bis avenue 'bosquet 75007 paris librairie julliard 229 bd'saint-germain 75007 paris librairie-au carrefour montmartre 75009 paris printemps haussman 75009 paris weil rue caumartin 75009 paris gibert jeune saint-denis 75010 paris librairie parisienne radio rue dunkerque 75010 paris librairie appel voltaire 75012 paris atout livre 176 daumesnil 75012 paris librairie lamartine 118 rue pompe 75116 paris librairie paris 7,9 place clichy 75017 paris librairie 36. ternes 75017 paris atout livre 141 gambetta 75020 paris tantrisme sexualité transcendée parmi lesquels reims librairie michaud rue cadran saint-pierre saint-laurent-du-var panorama dulivre cap 3000 saint-mande atout livre 3'bis rue maréchal leclerc toulouse librairie privat rue arts tours terre hommes grammont verdun librairie ducher rue mazel belgique bruxelles librairie castaigne rue fossés-aux-loups librairie libris toison d'or librairie sciences 76-78 rue coudenberg liège librairie halbart rue carmes mons librairie scientia 11-13. passage centre suisse geneve librairie l'université georg cie rue coratterie librairie payot canada montreal librairie flammarion 1243 université librairie renaund-bray 5212 côte neiges librairie garneau librairie scorpion"
2,3,psychologie connaissanco soi connolasonce dos autros mal 1977 forum lecteurs écrivent editorl révisions jacques mousseau chercheur idées francis galton fondateur psychométrie jean zurfluh bref france pédagogie jardin musical romainville enfants découvrent musique lemps guy demoy temps voulons vivre communauté après quoi courent gens marie-france elliott entretien edward hali psychologle soclologle geste propos recueillis elizabeth hall groupes animateurs groupe sont-ils veulent-ils jani brun principales thérapies groupes principales mpa psychologie clinique nouvelle approche troubles l'enfance dystonctionnement cérébral minime pierre debray-rltzen quentin debray tests mesure l'homme petite histoire tests psychologiques colin elliott parle gens mariés vivent plus longtemps librairie analysés parlent frischer pomme serpent guiducci biologie culture ruffié autres parutions parle langage corps chez poissons bref allemagne who who psychologie prochain numéro paraîtra jeudi juin psychologie edite centre d'etude promotion lecture abonner departement retz 114 champs-elysees 75008 paris 369 84.16. voyez page
3,4,cette écriture celle parlait séducteur tévèla égoïsme habileté inconstance tout caché sous apparences séduisantes visage peut mentir voix peut tromper l'écriture ment sentiments plus cachés dons plus iguorés apparaissent moir blanc celui seit analyser scienüfiquement l'écriture l'lp.s réunit meilleure équipe grophologues offre démonstration gratuite suffit cel quo äcriviez quelques lignes l'encre l'espace ci-dessous retour recevrez diagnostic dont l'exactitudo stupéfera profitez cotte offre exceptionnelle postant aujourd'hbui mème bon découper lp.s b.p 53.08 75362 paris cedex 08. diagnostic gratuit recopiez cette phrase désire recevoir sans engagement part diagnostic écriture signez joignez uns enveloppe adresse timbres frais ps5 internationalersychoeservice 'reariséss developpement personnel découvrir découvrir autres développer potentiel créatif mieux vivre corps cdph centre développement potentiel humain organise comme chaque ateliers et7jours sud france 1/7 31/8/77 bio-energie gestalt primal meditation massage soirées d'information gratuites 7-8-9 juin 1977 renseignements—cdph rue turenne 75003 paris tel277 4331 at-il droitiers contrariés gaucher moins llorsqu'il écrit écrit mal lente\ ment crée problèmes classe ailleurs certains gestes quotidiens ill semble droitier institutrices moi-même l'avons jamais contraint écrire main gauche comment expli quer cette anomalie faire .f.-roubaix parle souvent gauchers contrariés c'est-à-dire d'enfants gauchers l'on contraints écrire main droite peut arriver certains enfants gauchers s'astreignent propre chef écrire main droite faire comme autres bien l'institutrice maternelle cours prépara toire actuellement laisse toute liberté l'enfant quant choix main écrire c'est conformisme tendance puissante intériorisalion aboutit autocontrainte volontaire plus fréquente qu'on croit droitier contrarié c'est très rare connu cas l'enfant être placé près d'un gaucler l'avait imité l'ins situtrice n'intervenant l'enfant s'était luimême infligé choix inopportun l'habitude d'écrire mauvaise main stabilisée renforcée l'exercice sans toutefois permettre d'atteindre celte aisance donne bonne main naturelle c'est peut-être cas fils faudrait tout d'abord vérifier quel type latéralisation est-il véritablement gaucher droitier cela faut faire exécuter gestes fins complexes utiliser tirebouchon ouvrir boîte conserve jouer quelques notes instrument musique inhabituel etc gestes simples habituels force discriminants problème autant résolu car l'aspect technique subordonné l'aspect psychologique faut effet retour naturel pose problèmes nouveaux baisse performance inévitable début rééducation entraînant retombées scolaires début cette rééducation doit être entrepris pendant grandes vacances scolaires faut donc consulter psy- -chologue lancer rééducation hasardeuse tous gauchers droitiers contrariés névrosés complexés vral qu'une rééducation mal .conduite inopportune peut faire blen ina ... jean paulhac l'adolescence chez iles débiles m'intéresse problèmes l'adolescence chez lle débile pourriezvous m'indiquer bibliographie assez importante iles manifestations l'adolescence chez'les débiles tous niveaux j'aimerais avoir également ibibliographie concernant sujet suivant motivations enfants choisissant sport m.- tours n'importe quel manuel psychiatrie l'enfant fournira bibliographie d'arriération mentale pourrez trouver renseignements intéressent bibliographie complète mise jour 1970 éditée centre régional l'enfance l'adolescence inadaptées rue euler 75008 paris depuis revue enfance publié deux premiers numéros 1972 iles actes colloque déficiences men tales tenu 1971 dla société française psychologie cette abondante littérature n'existe connais sance d'étude récente traïtant spécifiquement manifestations l'adolescence chez débiles tous niveaux crois non plus qu'aït publiée étude motivations enfants choisissant sport ces. trouverez peut-être éléments l'ouvrage michel bovet motivations sportifs paris editions universitaires 1968 livre miroslav vanek bryant cratty psychologie sportive compétition paris editions universitaires 1972 ajoutons qu'il anglais revue consacrée exclusivement psychologie sportif international journal sport psychology antonelli via della camillucca 195 00135 roma ltalie marcel turbiaux erratum photo couverture attribuée erreur michel tiziou photographe edouard rousseau excusons
4,5,marxisme freudisme lacanisme maoïsme c'est curée voyez livres publient temps derniers d'andré glucksman maîtres penseurs grasset françois roustang destin funeste minuit passant philippe sollers alfred fabre-luce assiste mise mort tous hommes-dieux affublés d'un isme totalitaire caracole tête horde nouvelle génération d'intellectuels affirment enfants fois normale supérieure bancs université voisine mai 1968 psychanalyse pensée contemporaine rivalise concorde hier toute théorie présentant comme globale globalisante faisait recette trouvait disciples conforter ambition aujourd hui nul prétend plus cette ambition songe encore concilier marx freud science unique homme l'histoire révélations dissidents soviétiques passation pouvoirs chine populaire après mort mao désillusions plu ceux s'étaient rangés adolescents sous bannière d'un système d'explication monde prétention scientifique crient aujourd'hui déception désillusion voir particulier génération perdue recueil entretiens france-culture jacques paugam ceux vingt ans 1962 fin guerre d'algérie 1968 barricades écrivent œuvres tentatives définir nouvelles façons d'interroger monde trouver nouvelles raisons militer vent travers soufle côté politique emporte sciences humaines passage car amalgame créé entretenu entre idéologies paraïent qualificatif scientifiques .€t toutes recherches l'homme société cyisions réaction reproche aujourd'hui idéologies sciences confondues d'avoir jeté masque d'abstraction l'individu nom homme jean-paul dollé constatait france-culture demande parole fait jour après quinze vingt ans langage anonyme insignifiant dont sciences humaines abreuvés cesse croire maîtres doctrines paroles autre chacun réclame d'être soi penser soi d'interroger soi-même monde jeunes intellectuels colère récusent termes nouveaux philosophes sous lesquels cherche englober pourtant c'est bien d'un retour philosophie qu'il s'agit descente purgatoire sciences humaines assiste véritable retournement situation comme théâtre sauver quelque chose chacun balaie devant porte psychologie sociologie vouent recherches empiriques ponctuelles l'imitation équipes américaines longtemps dédaignées traque partout peste idéologique psychanalyse dont nature d'avoir nez creux met l'ordre propre maison plus exactement accepte sans broncher quelques-uns prétendent faire voler poussière amoncelée faut inscrire mouvement d'ensemble refus idéologies établies livre françois roustang déboulonne freud plus audacieusement encore lacan piédestal respectif exigeant chaque psychanalyste penser soi-même théoriser soi-même s'il veut encore prétendre analyste non homme eglise c'est l'inscription mouvement plus vasie s'explique fait iconoclaste n'ait jeté hors l'ecole freudienne dont membre editorial jacques mousseau courant actuel sensibilité intellectuelle avertissement sert peut-être plus psychanalyse qu'il dessert n'est-il temps prendre distances science quand celle-ci accusée d'idéologie psychanalyse n'est peut être science comme physique biologie écrit françois roustang chaque fois qu'un psychanalyste théoricien fait croire non laisse croire commencer travail chaque fois qu'il prétend détenir secret donnera l'intelligence vie toute psychanalyse rebascule religion qu'est-ce donc psychanalyse méthode bien sûr appuyée travaux antérieurs théorie close originalité cœur constitue justifie c'est transfert résolution chaque fois recommencée chaque fois autre transfert fait être autre psychanalysé psychanalyste psychanalyste contrôle souvent aussi homme texte disciple texte freud lacan fantasme tout cela qu'il faut analyser dépasser soudaine modestie scientifique déroute certains psychanalyse rejoint contestation générale renvoie chacun lui-même sans annoncer encore tient prête dominer nouveaux fantasmes nouveaux mythes assumer ambition profonde aider homme vivre monde dieu mort idéologies moribondes lire aussi jacques paugam robert laffont françoise lévy karl marx histoire d'un bourgeois allemand paris grasset jean-paul dollé désir révolution paris grasset christian aan rasset anis roustang destin funeste paris minuit génération perdue paris guy lardreau l'ange
5,6,mesure l'homme publié dens numéro voir page rappelle qu'au tout début l'histoire tests trouve nom francis galton c'est février 1977 donc tout juste cent ans cet anglais cousin edmirateur charles darwin présentait l'insti tution royale grande-bretagne résultats travaux mesure l'hérédité humaine présent ticle cherche faire mleux connaître cet homme rendre plus intelligible production concepts méthodes applications c'est-à-dire l'on nomme psychométrie francis galton habituellement considéré comme fondateur psychométrie reconnaît toujours traits caractéristiques génie cette reconnaissance très nette chez karl pearson premier biographe consacra vie œuvre ouvrage monumental quatre volumes publié 1914 trois années seulement après mort galton courte histoire psychologie britanni- publiée 1964 hearnshaw clare galton incontestablement génie l'héritier d'un nom fortune cette affirmation génie francis galton fonde principalement faits sulvants s'est distingué travaux géographie météorologie c'est introduit notion d'anticyclone premier mesurer différences individuelles physiques psychologiques classer comparer leurs distributions statistiques effectué mesures classements comparaisons l'aide méthodes statistiques nouvelles initié biologistes l'étude statistique l'hérédité fondateur blomé trie toute œuvre l'organisation premier laboratoire d'anthro- pologie d'anthropométrie essayé d'appliquer résultats travaux définissant prin- clpes créant institutions uni- versitaires d'un mouvement objectif l'amélioration l'espèce hu- maine l'eugénisme fondateur psychométrie francis galton naît février 1822 larches près birmingham famille fortunée notera plus tard qu'il année johann mendel fondateur gé- nétique famille galton dispose d'importants revenus qu'elle tire prin- cipalement l'activité d'une banque grand-père paternel samuel galton hérité dix mille livres 1775 devenu capitaine d'industrie cette région birmingham pleine phase d'essor prospérité prospérité fondée l'utilisation progrès scientifiques l'exploitation travail non seulement hommes mals aussi femmes enfants enfant remarquablement intelligent malgré participation société quaker samuel galton fondé manufacture d'armes liquidée 1804 maison devenant banque galton francis samuel tertius fait ère fortune père trois cent mille livres tour transmettra revenus confortables estimée gal mettront travailler per plaisir intérêts sclentpel francis dernier sept enfants nalssan grand événement familial violetta darwin écrira plus tard manifesta plus d'intérêt d'attentl d'affection deux frères quatre sœurs l'une celles adèle jouera grand rôle dons formation jusqu cinq ans lul fera connaître poésie anglaise l'ultade l'odyssée 1826 écrit sœur j'ai quatre ans peux lire livre anglais peux dire tous substantifs adjectifs latins ainsl verbes actifs sans compter clin quante-deux lignes poésie latine peux compter n'importe quelle somme addition multiplier 10. peux aussi dire table monnaies lis peu françals connais l'heure. hearnshaw rappelle cette fière claration d'après pearson estime l'enfant galton obtenu moins 200 points termans mesu- rer quotient d'intelligence pearson rapporte galton enfant très précoce connaissait lettres capitales alphabet dix-huit mois savalt lire deux ans l'âge sept ans lit sh- kespeare pope manifeste grandes aptitudes littéraires partir 1828 élève d'une école dames 1830 1831 mère l'en- vole boulogne qu'il apprenne parler français 1832 1837 élève kenilworth puls blrmingham partir selze ans entre- francis pearson the life letters and bours francis galton cambridge uni versity press 1914 l.s hearnshaw short history pri tish psychology 1840-1940 londres methuen and lid do63 morgan the mecanisms and laws heredity murcluson carl the fornde lions experimental psychology wnorcester clark university press 1929 galton afemories life londres methuen and ltd 1908 terman 1877 moditia l'échelle métrique l'intelligence bimet entre 1921 1930 étudia enfants douts pubia generic studies genitts. l.s hearnshaw short history bri- tish psychology 1840-1940 londres methuen and ltd 1364
6,7,prend études médicales blrmingham londres élève collège royal 1839 los termine goût insatiable l'observation effectue jusqu 1840 dix-huit ans premier voyage smyrne passant danube année commence cambridge études mathématiques dureront trols ans 1844 1852 voyage egypte syrie afrique sudouest réglon encore inexplorée européens voyages fois source distractions chasse d'observations géographiques météorologiques qu'il communique société royale géographie celle-ci lul décerne médallle d'or 1853 l'année épouse loulsa butler fllle doyen peterborough 1854 1864 publie art voyage travaux météorologie galton premier dresser cartes temps observer l'existence zones haute pression qu'il baptise anticyclones c'est entre 1844 1852 galton lit lettres théorle probabilités appliquées sciences morales politiques mathématicien belge adolphe quételet cette lecture influence importante travaux faisant découvrir champ d'application anthropologique théorie probabilités 1859 galton déjà montré désir insatiable d'observer mesurer désir dont l'expression plus extrême sans doute constitué petites expériences familiales qu'il réalise goût fraîcheur corps douceur thé mesure variabilité qualités fonction quantité d'eau utilisée température d'ébullititon cette année-là novembre cousin charles darwin fait paraître ouvrage l'origine espèces moyen sélection naturelle lutte l'existence nature avoir influence décisive l'évolution intellectuelle galton relations psychologiques entre francis galton famille mère semblent privilégiées blen grand-père paternel fait preuve intérêts scientifiques père lui-même amateur science mesure c'est surtout ascendance maternelle galton semble trouver modèles vocation scientifique livre dgénie héréditaire publié 1869 lequel étudie lignées d'hommes science présente darwin bonne place père mère erasme darwin d'abord montré comme physicien physiologiste peuvent avoir plus profondément influencés l'étais publi- cations elles élargissalent l'horizon idées j'en tirais souffle d'une tre sûrs d'eux lorsqu'ils consentent s'expriment approché présence géniale dévotion vénération valo monde entier j'éprouvais peu difficultés l'origine espèces dévotransformisme dégageant poète galton écrit grandipère maternel qu'il -un homme grande énergle plein d'humour bienvell lance c'est surtout relation charles darwin cousin privilégiée galton pense qu'il préparé 'hérédité famillale mieux comprendre mieux assl miler théories darwin cembre 1886 ill écrit peu gens article times publié vle scientifique .plus profonde dois plus pulsions scientifiques influences charles darwin peux aisément l'exprimer j'al raresans sentiment presque irrésistible risais encouragement approbation plus peut-être celui plus tard 1908 rappelle nouveau cette relation privilégiée pré- clsant publication l'origine espèces époque marquée développement personnel comme celui pensée humaine général rais contenus assimilais aussi vite qu'ils étalent dévorés fait peut être attribué disposition héréditaire l'esprit illustre auteur moi-même hérité grand-père commun docteur erasme darwin admirateur cousin darwin l'origine espèces révolutionne idées dominantes approfondit finalisme lamarcklen conséquences philosophiques importantes philosophie zoologique lamarck admettait cause première pulssance transcendante donné l'existence nature darwin développe concept sélection naturelle celle-ci n'agissant vle mort individus persistance plus aptes élimination plus faibles mémoires galton signale caractère révolutionnaire l'ouvrage l.s hearnshaw cit quütelet 1796-1874 astronome mathématicien statisticien belge darwin 1809-1882 naturaliste anglais l'origine espèces principal théoricien transtormisme 10. galton memories life londres methuen and ltd 1908 trans ormisme théorie biologique après laquelle espèces vivantes variables susceptibles transformer l'une l'autre 12. lamarck 1744-1829 naturaliste français écrivit philosophie zoologique considéré comme fondateur transformisme certains timides cachent personnalité étonnante rte ela peut sembler paradoxal maisiles timides ont'en général vie intérieure intense leursensibilitéiles.porte àrechercher le.calme s'enrichir intellectuellef ment plus parce qu'ils très mer -troprarement hélas c'est toujours propos sujets qu'ils connaissent parfaitement auxquels beaucoup réfléchi n'est question faire icil'éloge timidité cause trop souffrances chez ceux quien atteints peut tout s'étonner surtout regretter tant de-qualités restent inemployées comme elles masquées sous apparence froide distante cache enréaliré personnalité riche chaleureuse oril existe france méthode psychologie appliquée fait preuvés dès premières semaines permet déjà d'affronter situations difficiles rencontres importantes examens rendez-vous affaires plus naturel décontraction.elle apprend'acontrôler plus enplus efficacementilesréflexes fuites connaissent bien les.timides personnalité vraie peut enfin s'épanouir k.t borg donné nom cette méthode afin d'aider tous ceux veulent tirer parti maximum leurs ressources profondes il'la présenteilui-même petit livre qu'il envoie gratuitement fait demande suffit recevoir remplir poster bon d'envoi ci-dessous lois éternelles succès k.t.borg oui désire recevoir gratuitement sans engagement part livre k.t borg lois éternelles succès voici nom adresse k.t.borg c/o éditions aubanel place st-pierre 84028 avigno
