,page,text
31,32,arabe souffle cela veut dire qu'il sus consciemment respiration qu'il honte. l'occidental peut identifier toutes sources malaise l'impression l'arabe collant l'arabe rapproche l'occidental fait marche arrière l'arabe suit parce qu'il peut communiquer certaine distance fois l'occidental appris arabes manipulent espace différemment temps plus qu'une convention unssystème d'organisation souffler nez gens forme communication situation peut quelquefois être redéfinie l'occidental détend dimension cachée écrit chacun porte petite bulle d'espace autour cet espace appartient encore fois choses tenons données peuvent faire trébucher produire sentiment malaise indescriptible voire colère monde arabe droit sol sous pieds lorsque tenez coin d'une rue arabe peut pousser côté s'il désire placer cela met occidental moyen état tension très grand quelque chose fondamental violé comportement bizarre rude s'appuie conception entièrement différente propriété corps n'est sacré lorsqu'une personne public années américaines beyrouth abandonner l'usage tramways leurs corps propriété tous hommes trouvaient portée arrivait retrouve langue arabes mot violation droits d'une personne viol l'espace naturellement moyen communication chez langue montre dit d'un ami intime qu'il proche quelqu'un livre émotionnellement qu'il garde distances qu'il distant rappelle avoir entendu fois infirmières décrire médecins elles disaient qu'il médecins côté-du-lit s'inté ressalént patients méde- cins pied-du-lit s'intéressaient disposent d'un systèm onts médecins intégrant chaque chose atient rétat consciemment chaque être vivant exprimaient tionnel système l'on don propre gagement l'endroit iis chaque plante chaque animay dier absence propre perps système tenalent polychrone lus l'idée corps j'appoe eur avantage tou ours plus communiquer exemple hopis ilière livres large maïs maturation lente ele dense corps nit difficilement épis conso ment répandus bles fin saison accepte tendance -pter eh. d'un langage silen méti cieux veux sion devec espe cie corps fais allu insi mürissent plus tôt apèes gage comportement bois penseraient alté clens l'ensemble comportement hopi altérer qu'au produit accessoires système temporel vivant petit morceau lemps pol chrone aïderait bien mèyes dentales s'inquiètent parce temps l'espace tout plus importantes différences mportement leurs enfants marchent manière dont lent certai éfouvées temps com- partent âge beau dire chaque enfant développe propre rythme elles veulent croire c'est parce liés vague norme d'après laquelle tout mesuré maïs ménagères plus grande expérience ipul culture mahtpu ment temps affectetil joe d'une culture vision d'un individu e.h. temps comme l'espace rôle communication n'est sim plement convention système d'organisation culture plus grande exp sussit organiser plupart temps poly plupan réussi d'entre elles doivent assurer ivités base temporelle parlons temps comme départ leurs maris travail c'était l'argent dépen- celui leurs enfants âge sco sons l'économisons perdons laire bain repas bébés schémas temporels pro- préparation repas lavage fondément inscrits sys- repassage vêtements chacune tème nerveux central choses propre système pouvons imaginer vivre sans temporel c'est raisons monde occidental pourrait lesquelles femmes réagi fonctionner sans système li- contre mode vie tradition néaire chose fois nelle système polychrone tend technique besoin d'une approche réduire l'individualité profit monochrone chemins fer besoins groupe tandis qu'un sys- transports aériens pourraient tème monochrone peut restaurer fonctionner sans horaires sentiments d'identité parfois naturellement etats-unis jusqu narcissisme lorsque encore loin derrière l'identité issue groupe comme suisses concerne sou- —————— mission temps quel en- droit train suisse s'arrête aus- onen attive véritables quiproquos loin soit-il montagnes entre cultures différentes passagers peuvent regarder fenêtre plus proche poau élé- ———— graphique poteau trouve c'est cas chez indiens pueblos petite pancarte blanche portant système monochrone peut êtré ages milieu flèches parfaitement destructeur car inter deux sens fère oupé diquent combien minutes fys cohésion onyene bien kilomètres cette différence systèmes ocron dernière gare temps contribue-t-elle conflits interculturels n'est apparemment ha- perd suisses bons orlogers quelle aulre manière naturellement peut créer créé effectivement toutes sortes tensions entre peuples €xé -il mani cul tanipuler temps ple lorsque travaillais indiens hopi sons barrages fran opis isaient excellent fournissent construisaient barrages fin mmple parce qu'ils l'etat gouvernement
32,33,leurs tentatives collaborer uns autres hall travailla ensuite l'atolt micronésien truk interprétant mœurs locales compte marine règlements l'us navy compte indigènes foreign service institute département d'etat entreprit réalisation programmes d'instruction destinés techniciens devant plonger cultures étrangères hall voyagea travers l'amérique latine moyen-orient vérifiant l'efficacité programme observant américains empêirés cultures lesquelles n'étaient familiarisés écoutant exprimer leurs difficultés pendant cette expérience théories temps espace culture mirent place esprit désir jeter pont entre cultures conduisit écrire dimension cachée ouvrit voie proxémique c'est-à-dire l'étude façon dont différentes cultures divisent utilisent l'espace edward hall enseigné différentes universités denver bennington washington school psychiatry harvard graduate edward halls l'anthropologue non-verbal contrairement plupart collègues edward hall professeur d'anthropologie chats ainsi l'odeur formaldéhyde retiré biologie pouvoir northwestern university âgé aujourd'hui soixante-deux ans n'étudie cultures étudie relations entre cultures l'idée gens diverses cultures pensent façon toujours trouvé facilement place l'opinion hall porte monde grandi parmi hispano-américains indiens l'âge quatre ans savait déjà esprits fonctionnent manière différente différence veut dire infériorité propres difficultés l'apprentissage verbal l'ont rendu particulièrement ouvert concept langage non verbal tout d'abord voulut s'orienter vers biologie fréquenta école privée tenue biologiste dont méthodes d'enseignement consistait envoyer élèves chercher eau lac haute montagne faire étudier organismes vivants l'échantillon lorsque hall s'est irouvé collège cadavres grenouilles fascination charme reporté l'anthropologie intérêt êtres vivants chaque fois qu'il travaillé cadre extra-universitaire fallu interpréter culture compte d'une autre culture pendant grande crise années 1930 quitté collège aller travailler indiens hopis navajos sud-ouest résistance montraient fonctionnaires bureau affaires indiennes conseils hall recueillait auprès commerçants indiens expérimentés fait prendre conscience dédain bureaucrates informations pratiques lorsque seconde guerre mondiale éclata hall obtenu doctorat l'université columbia entra l'armée comme officier capitaine régiment essentiellement composé noirs après capitulation allemande suivit régiment d'europe philippines put observer américains tagalogs school business administration l'illinois institute technology travailla étudiants architecture art décoratif hall jamais universitaire traditionnel sent l'aise jargon universitaire préfère expliquer théories prenant exemples tirés expériences nombreuses cultures aujourd'hui pense connaissance d'autres cultures meilleure manière comprendre nous-mêmes jusqu faits culturels reconnus comme faits acquis êtres humains tendance voir comme l'expression nature humaine hall croit n'apprenons transcender propre culture résoudrons jamais problèmes politiques sociaux d'environnement lentement train détruire cités société elizabeth hall hall dimension cachée paris seuil
33,34,"route tout examiné fallait tré coût alor nre combien enrrages s'atteni gistré qu'il pans construire its bout bcstio construil américainc cours prive von hopis sériode barrage tout fait contnie gie parapsychologie pressaient opre lement inposé conducteur pratique temp pelois s'il pos poglement conformité aves ——— vaincre hopis comportentent.… ensolgnoment distanca structure méme barre ache- lot juillot 1971 supposé oui responsable arabe fait qu'il jours aussi mis place système régi ldix élé vite ame techniques déclencher déve- dième aur see lopper contrôler facultés exemple problèn jioration qualité gens supranormales cours essentielle- résolu comprenaient acceplaient fonction peut impose tel arrangement ment pratique l'exposé complet techniques secrètes utllisées asie europe afrique shamanes sibérlens gols lamos tibétains taoïstes chinois féticheurs africains derviches arabes sorciers amazoniens fakirs yogis indiens sujets traites hypnose magnétisme voyance dédoublement auto-hypnose télépsychie télépathie fakirisme psychourgle téléplastie télékinésie magie etc etc pays occidental chauffeurs américains tous temps monochrone cha ains nent-ils empiéter leurs privilèges comment pays latino- dire occuper entièrement aerranéens leurs camions prenon américains méditerra bons dirigeants seules personnes puissions créé ennuis diriger d'autres américains rommes d'affaires diplomates den litons souvent enga- top cains passe latino-américains autre aiflérence entre attendre longtemps européens rabes concerne inc américain s'il fait choses disputes manière atino- manière bureau rempli gler arabes attendent tiers chacun qu'ils interviennent dis mot tre putes sociétés arabes raison différente cun favoritisme néglige deux personnes querellent consacrer nord-américains l'une d'elles devient violente cou pable témoin n'aura viennent voir nord-américain able fonctionne système mono- téussi arrêter bagarre chrone croit presque invariablement latino-américain veut faire etats-unis toutes différences comprendre qu'il n'est impor- culturelles entre blancs noirs tant latino-américain peut inter- sont-elles cause malentendu préter ressentiment l'américain e.h. comme narcissisme données dont disposons montrent c'est bien cas comment cela affecte-t-il entre culture noire contexte beauprises compagnies améri coup plus élevé culture blancaines installées amérique che parle noirs latine appartiennent classes moyennes eh. derniers probablement aussi pendant années j'ai travaillé obsessionnels compulsifs bas compagnie américaine contexte îles blancs essayait faire marcher usine ———————— mexique finalement aban- donné disposait d'un produit culture noire grande qualité n'arrivait contexte plus élevé documentation contre timbres coupons-réponses internationaux cours prive parapsychologie pratique secrétariat mme pauze b.p 42001 saint etienne cedex schützenberger sauret corps groupe nouvelles thérapies groupe gastalt bioénergie groupes rencontre méditation vol 336 64,00 obtenir mexicains qu'ils produi- culture blanche sent suivant normes direction toujours solution mal- prenons manière dont etienne bofîtanski l'enfance handicapée handicaps physiques handicaps psycho-sociaux handicaps sociaux vol 416 88,00 renceusement j'méricains ris écoutuns dont montrons sociié ararago dan noms ver attentifs quand quelra l'argent perdait qu'un parle j'ai fois obtenu ons conne opéra emploi jeune dessinateur noir saoudite finalement arabe avid societé darts acheter concession monte paiement assez propre système connaiss faisait bien travail s0n peuple aussi ail établi employeur plaignait attr règles complexes ere lude cela m'étonna jusqu camion chaque conducteur mere acc action pénalisait chaque bouch n'obtenais aucune réaction valve manquant récon simplement assis tranquille conducteurs lorsque rien train dessiner supposé être dis estce quail niveau d'huile man- tez répondit puisque ter carnet d'entretien car pièce écout® feuille leurs relations noirs rue ars 31000- toulouse"
34,35,nnaissent ressentent regarder lorsqu'ils arlent hochent tête font petits bruits montrer qu'ils train d'écouter comme font blancs besoin peut-on dire sensation jes noirs celle d'être hommes invisibles cit d'une autre différence culturelle rue blanc regarder personne jusqu qu'il s'en approché disgance quatre cinq mètres ensuite sauf tous deux connaissent blancs vont automatiquement détourner regard éviter contact yeux cette façon automatique d'éviter contact donne noirs cette impression invisibilité car eux-mêmes n'utilisent tout leurs yeux comme blancs comme gens haut contexte engagés plus profondément uns envers autres plan visuel tous autres plans noirs blancs utilisent-ils temps différemment temps plus grande tendance polychronie nôtre entraîné problèmes détroit lorsqu'ils commencé travailler chaînes montage parfois plaisanter noirs faisaient allusion c.pt colored people time temps gens couleur lorsqu'ils affaire blancs système semble rester plus proche mode fonctionnement corporel noirs accordent aussi plus attention comportement non verbal j'ai fait fois expérience cours laquelle noir photographiait autre cours d'une interview professionnelle chaque fois quelque chose significatif passait noir jouait rôle d'observateur appuyait déclencheur l'appareil photographique lorsque j'ai regardé photos n'en croyais yeux rien s'était passé moins c'est croyais révélé opérateur pris identifié signes corporels aussi minces qu'un mouvement pouce faisant pressentir intention parler blancs aussi finement sensibles puisqu'un grand nombre groupes ethniques issus cullures haut contexte suppose manière voir bas contexte poser cerlain nombre problèmes parut trie problèmes rénovation questions dres aine entrent jeu seurs plans polin tendance identifier quartiers ethniques taudis déclarer bons rénodr parce qu'ils voient rare tient derrière apparence désordre communautés ethniques unies pleine activité parfaitement nécessaires détruites faire place université chicago urbanistes ainsi littéralement effacé quartier grec italien malgré d'intenses protestations cicatrices laissées cette histoire n'ont encore disparu important souligner lorsqu'on disperse communauté cette sorte rénover ville bien souvent ... détruire fait bien plus démolir maisons détruit plus grande partie donne sens vie surtout gens profondément engagés uns envers autres personnes déplacées souffrent leurs maisons comme s'ils perdu enfants parents blancs bas contexte quartier vaut autre gens haut contexte encore fois c'est très différent dit jour programmes rénovation urbaine aussi destructeurs bombardements ennemis n'était simple métaphore allez jeter coup d'œil quartier frappé rénovation urbaine ressemble ville européenne après bombardement aérien plus destruction communautés première étape d'un enchaînement d'événements aboutit destruction cités dernière ressource seulement c'est absolument nécessaire devrait procéder prévoyant relogement d'ensemble quartier communauté devrait être déplacée seul tenant policiers jocaux balayeurs boutiquiers employés postes devraient être déplacés bloc naturellement cela n'arrivera jamais bien trop sensé propos recueillis elizabeth hall traduction jean-françois blézot ———— expéditions \mini bwse découvrez monde petits groupes îde personnes maximum gexpeditions rue cirque 75008 ouvre quoi droisivi c£é déve ov.në désire recevoir 254 gratuitement documentation nom code postal box retourher asian far jean-claude sée anime groupes séances individuelles développement personnel gestalt thérapie vidéo-gestalt caméras t.v magnétoscope relaxation massage euphorisant connaître dates week-ends ascension pentecôte etc prix selon revenus jean-claude sée rue verneuil 75007 paris tél 261.16.44
35,36,malcolm mcneil
36,37,ang psychologie rendu compte nombreuses expériences groupe voir encadré cours divers reportages l'animateur habilement détourner l'attention personne faire porter groupe rédacteur chef jacques mousseau demandé jani brun n'avait aucune expérience domaine braquer cette fois-ci projecteur thérapeule comportements c'est marchant soir long grand trou halles paris j'eus sentiment sentir réalité cette petite phrase souvent entendue jours précédents faire tomber défenses j'avais sous yeux analogie détruire habitat environnement réduire terre initiale recréer nouvelle architecture plus adaptée phrase prenait corps chantier sous petite pluie fine d'avant-printemps ramenant groupes surtout animateurs j'essayais difficilement cerner définir depuis quelques semaines l'animateur groupe travers pluralité animateurs a-t-il lien unit pratique idéologie cri primal gestal passant bio-énergie clients fanatiques font toutes expériences girouuipie sont-ils veulent-ils jani brun objectif personnage nouveau quelque peu énigmatique est-il prêtre d'une religion psy culte comme présentent certains articles presse comment arriver tirer profil multiples flashes accumulés cours d'interviews d'écoutes séances thérapie lectures soudain cette petite phrase l'anima teur identifié promoteur terrassier l'architecte spécialiste l'agencement l'es pace intérieur plus collision plus espace perdu milieu structuré sono diffuserait permanence l'harmonie personne mission généreuse regard inconditionnellement positif cette personne-là ai-je rencontrée comment j'ai perdu innocence j'étais dois l'avouer malgré mois confrontations lectures innocente concerne groupes totalement sauvage milieu d'initiés pratiquants j'arrivais mots comme heureux joie sérénité répondait s'agit exactement cela heureux signifie rien l'important c'est d'être bonne relation soi parvenir meilleur investissement potentiel. j'ai vite compris qu'il fallait adopter nouveau langage l'un premiers animateurs interrogeais d'ailleurs rapide- ateurs ment fait sentir chère dites-là très c'est comme parlais chat répondiez blaireau agit s'entendre c'était bien avis s'entendre fallait rencontrer france lés animateurs répartis dizaine centres paris selon formation leurs techniques leurs affinités certains travaillent individuellement leurs propres locaux d'autres travaillent également individuellement plusieurs centres thérapie qu'ils louent quelques heures semaine d'autres enfin équipe collaborateurs qu'ils eux-mêmes formés tous animateurs connaissent s'observent certainement s'influencent s'ils très ouverts groupe hors thérapie assez réticents l'approche sais fait hasard thérapeute individuel également médecin reçue plus chaleureusement acceptant répondre surtout faire participer groupe sans émettre restrictions car plupart animateurs m'ont accordé entretien certains refusé laisser assister séance alléguant groupe fonctionnait depuis quelque temps rejetterait étrangère question d'éthique disaient-ils d'autres estimé avoir droit d'entrée devais payer gratuité
37,38,and hurleme grand oussa ranimateu contraire principe centre earendi ant quan enfin tous animaleurs dur nage regarde vingt ans centre refusé bloc rencontre faisant savoir pat roureux éme donn envie secrétaire qu'après avoir débattu silence déchir restait ensemble souhaitaient quê pleurer l'anire bleme payé l'on parlät étai déjà ésotérisme mystère faites are dit-il semblaient être deux atouts m'apportez ontée ani âlés certain sens ipan cun tragique roi gens vien- ance ralentit dce nent sauver peau m'avaiton due sollement s'arrédit vague parfum d'eros che ateur proposa lors dites venez ici n'aime voyeurs lorsque cesser avait-on ajouté néranie jus tard première séance thérapie eance cin minutes peut laquelle j'assistais recher- séanc l'espr celë che cri primal méthode d'arthur teur rencontré venue c'est assez secouant salle travail luxueuse sombre peine éclairée absorba comme utérus participants l'animateur présenta comme journaliste presque tous jeunes a-t-il semblé très angoissés appelaient thérapeute c'est ainsi définissent animateurs prénom tuyotaient souriant détendu bras chemise m'apparut comme sorte dieu protecteur annonça règle ici brutalité d'insultes n'es d'accord quelqu'un dis surtout traitant d'idiot car cette agression couperait communication puis alla s'asseoir milieu participants interrogea doucement écouta sans émettre critiques commentaires garçon s'excusait faire réflexion stupide dit aucune réflexion n'est sotte tout peut être dit. peu peu pièce s'animait chacun travaillait partir problème particulier l'animateur s'occupa successivement chaque participant demande selon intuition vigilant caressait visage inclinait tête murmurait phrase clé devait déclencher décharge j'avais l'impression d'assister pièce pirandellienne l'air devint chaud violent martelé d'appels maman aïme-moi laisse-moi vivre l'animateur palpait corps écoutait confessions suscitait essayant sentir faille prévoir celui allait craquer garçon ressemblait antonin artaud restait noué siège toxicomane complètement asocial lubrifer lan être l'animateur s'étendre matelas palpa bout doigts puis provoqua corps contorsionna plus plus fort plus vite plus jusqu moment inspirée janov l'animaveille m'avait pré- bon anim etre avoir j'écoute avoir l'empathie gen l'intérieur monde l'autre avoir don voir être rigoureux prudent proposer auires exercices qu'il n'ait lui-mêine expérimentés etre dur être tendre savoir analyser etre tolérant iné île problème hnulées cette menace quelques angoisses remontièrent monde pleura parce qu'elle toujours donné donné donné sans recevoir d'amour l'animateur laissa parler puis fit replonger réalité sexuelle usant mots directement sortis livre marcel aymé jument verte regardai montre déjà midi trois heures j'avais l'impression d'être restée peine heure sortant j'éprouvais sentiment béatitude j'aperçus sosie artaud filant toutes jambes fait progrès glissa voisine dernière fois parti début séance comment j'ai nagé contre-courant deuxième expérience plus difficile l'animatrice jeune femme douce d'apparence fragile demandais comment pouvait faire métier n'était sut enthousiaste m'accp arivai presque convaincre tisant parler d'un ani- man ans voir œuvre c'était parler picasso rennaitre peintures avant d'ob oul définitif l'acceptation pair eronnt groupe d'une conti tinu trois mois rais femme sier latin moderne comme autres ultra prévenueé d'objection majeure sence gêné fille sonne l'aimait qu'elle devenir folle qu'elle angoisses l'animatrice gards puis fit travailler séance semaine soir groupe quelqu'ur devrais retirer graversai donc paris plein cœur j'arrival cenire quart déchaussai m'assis err groupe a55€z hétérogène tout neuf hermétique lait tentait d'expliquer jeune per peur courapes quêter l'amour corps rien jeune file lamenta pareil ennuyait personnellema lle trouve particulière passionnante rétorqua l'as trice garçon s'était chien présence patron répondit effectivement vois bon oui longues oreilles ... uou tout île monde enchaîna ani quelques attributs chien pant particulièrement excédée voir traiter semblabl triste cabot j'intervins disan voyais tout chien garçon m'apparais sait assez sensé lourd silence s'ensuivit l'animatrice esquissa peine petit sourire dit rien j'appris ensuite cette thode l'analyse affective fis cher hoffman consiste être très négatif départ amener jes participants plus profond détresse faire ensuite découvrir côté positif certaines personnes pleuraient criaient thérapeute cares sait faisait imposilions main thorax bas l'estomac tout surveillant plus exaltés alla glisser cous sin sous tête l'ennuyeuse tapait crâne rompre cou grosse femme pleurail comme fontaine l'animatritt épongeait tous ruissellements consolait y'aidail seulement vider sac -d.g sexagénaire reluquant splendide adolescente d'impunt territoire thérapeutique qu'il craqué pleuré deux journée jui arrivé depuis lustres por l'animatrice pleurs semble promesse victoire esp après quelques exercices ration grimaces cris cun prit cahier inscrl voir l'enc cette méthode j'encadré cette méthode
