,page,text
11,12,conditions d'éclal rage illles réduit format relle entre elles obtenant ainsl livre peut donner directemen visage composé feuilletant rapldement comme jeu enfants l'on obtient animation personnages procédé livre fixé mur photographle chaque visage lai plaque sensible utilisera aussi lanternes projection cette recherche comporte idéologie faciès fondée l'hypothèse traits mentaux héréditaires identifiables traits physlonomie galton présentera travaux portraits composés dès 1878 publiera série d'extraits enquêtes faculté humaine développement paraissent 1883. débuts criminologie techniques portraits composés génériques très vite appliquées galton domaine criminologie angleterre depuis début siècle criminalité s'est développée temps prolétariat livre situation classe laborieuse angleterre publié 1845 engels écrit qu'entre 1805 1845 nation anglaise devenue plus criminelle monde entier n'est étonnant qu'un représentant éminent classe dominante pays s'intéresse criminologie 1878. cette orientation criminologique fait historiquement partie origines psychométrie chez galton fonde conception juridique psychologique crime lequel caractère instincts tentation galton divise délinquants plusieurs groupes meurtriers préméditation îles cambrioleurs escrocs faussaires délinquants sexuels s'appuyant l'exemple d'une famille délinquants américains dont reconnaît pourtant l'ancêtre vers 1730 n'était qu'un demi-sauvage sans instinct criminel galton développe concept classes criminelles dont traits caractéristiques tempérament instable émotionnel écrit naïvement explosions folie femmes emprisonnées phénomène tout fait curieux ... galton appartient société associe naturellement toute bonne conscience délinquance maladies mentales idées dernières ailleurs nullement dégagées préjugés cette époque maladies nerveuses affections hystériques regonnaît cependant parmi conditions il'extase désordres particulier conti1h avance l'idée neuve sseur métaphysique religion peut naître rements jee prete moir de.connaître iles jgne moins gone épllepsie® folle domaine d'application portrait composé recherche types raclaux construit type juif fournit ainsi quelques bases racisme scientifique dont peut prévoir l'avance ravages qu'il exercera xx° siècle galton ouvertement raciste écrit ans alphonse gandolle juifs spécialisés mener exis- tence parasite autres nations qu'il n'est évident qu'ils capables eux-mêmes remplir divers devoirs d'une nation civilisée lettre octobre 1884 soni intérêt criminologie recherche constante d'une identification individus permettant classer mené galton l'étude méthodes français bertillon cherche identifier délinquants leurs traits physiques plan statistique gälton compris il'établissement d'une relation entre tralts physiques criminels stature pointure tour tête ... comparable problème statistique déjà posé génie héréditaire approché 1877 notion réversion entre 1877 1885 essayé d'obtenir enregistrements facultés familiales .en offrant récompenses suite travaux régression l'hérédité trouve expression plus avancée 1885 cette année-là galton présente étude met relation tailles d'enfants adultes tailles leurs parents morbide religleuse sexualité nence extrême aucun profe l'intuition l'inconscient autre série travaux galton concerne psychométrie parfois moins connue parce ceux-ci n'ont donné lieu œuvre achevée parce qu'ils largement dépassés développements ulté rieurs psychologie expérimentale psychologie clinique recherches images formes assoclées nombres associations couleurs visions idées abstraites associations mots enfin qu'il appelle l'antichambre conscience étudier images galton procède habituellement voie d'interviews introspection interviews leu auprès d'hommes science d'intellectuels connus auxquels demande décrire faculté d'ima- giner galton tire manière générale voyons onc assez surprenantes pouvair visualiser plus élevé femmes chez frança s'intéresse hallucinations vue l'ouïe autres ser suggère propos concepyn processus mentaux dont certal conscients simple stade sérle proces sus mentaux émerge consciens tout précède suit demeure extérieur caractéristiques peu vent seulement être äinférées d'une quiune condition présentation visions demeure forte sensibilité certaines voies domaines l'action cérébrale faible sensibilité autres certains stades pro cessus mental représentés très nettement conscience tandis d'autres ressentis aussi cet individualisme changé dividualisme développer quelque peu cette topique l'appareil psychique texte intitulé antichambre conscience semble qu'il esprit chambre pré sence pleine conscience tient audience deux trois idées mêmé temps l'audience antichambre pleine d'idées plus moins liées située juste audelà la-pleine vue conscience hors cette antichambre idées plus liées celles chambre présence paraissent être convoquées d'une manière mécaniquement logique avoir tour d'audience incontestable génie galton certainement compris avant freud n'était indivisible s'il déve loppé cette conception véritable théorie personnalité peut dire qu'il première intultion divers processus mentaux inconscients près vingt ans avant publication science rêves convient aussi reconnaître rôle pionnier l'étude assoclations d'idées découvre après expérience lui-même qu'il qualifie travail répugnant laborieux l'association réitérée phénomène très marqué processus pensée découvrant ainsl répétition cœur processus pensée galton s'approche ici encore d'un concept freud développera 22. galton inquiries into human faculty aud its development londres j.m dent and 1883 23. galton cit galton cit 25. galton cit voir suite l'article
12,13,hiré ffoco stage biodynamique sud-est mai lieu vence alpes-maritimes stage intensif biodynamique objet d'aider l'individu analyser clarifier problèmes posés communication relation autres sexualité etc stage composé douze quatorze personnes maximum toutes informations concernant participation logement garde enfants écrire téléphoner vie action 418 boulevard emmanuel-maurel 06140 vence tél 58.23.06 trois journées adlériennes société française psychologie adlérienne organise durant weekend pentecôte trois journées thème travail loisirs jeux cette rencontre lieu mai château villeneuvesous-dammartin cadre verdure tous renseignements adresser schaffer société française psychologie adlérienne rue archives 75004 paris californie paris centre arkana organise mois mai deux ateliers atelier gestalt-thérapie bio-énergie paul rebillot animateur permanent l'institut esalen etats-unis paul rebillot associe bio-énergie gestalt-thérapie créativité théâtre l'imaginaire mental donner forme mythes universels démon héros chacun atelier quatre jours mai 1977. prix 600 atelier formation massage californien margaret elke enseignante centre médical l'univérsité californie mai juin renseignements auprès centre arkana boulevard magenta 75010 paris tél 246.97.09 france hélène monneret rencontre spécialistes v.n poitiers juin prochains rencontreront poitiers scientifiques différentes disciplines confronter résultats leurs recherches objets volants non identifiés deux journées animées jean-claude bourret présentateur journal télévisé tf1 luimême auteur d'études sujet parmi participants journées peut déjà citer claude poher chef département projets scientifiques centre national d'études spatiales pierre kohler astrophysicien docteur sciences auguste meesen professeur physique théorique l'université louvain ainsi nombreux chercheurs €.nrs l'audio-visuel sexologie équipe française recherches sexualité groupée autour docteur waynberg pris linitiative fabrication matériel audio-visuel sexologie l'originalité conception reçu accueil favorable part thérapeutes organismes formation concernés problèmes sexualité thérapeutiques visant mobilisation fantasmatique sen- sualisation didactiques massage relationnel masturbation masculine films sexographiques actuellement nombre cinq posent avant tout conime détonateurs non comme substituts dialogues érotiques rôle thérapeute demeure donc essentiel disponibles super-8 vidéocassettes sexographie rue clairaut 75017 paris tél 551.66.29 deux séminaires vittoz cet l'institut recherche développement contrôle cérébral méthode vittoz prévu deux séminaires cet méthode vittoz contrôle cérébral repose principalement trois étapes réapprendre cerveau accueiljir sensations faire silence idées techniques d'approche corps sensations apprendre prendre conscience actes exemple lire s'entendant lire éliminer idées pathogènes supprimer l'angoisse séminaires lieu baume-sainte-marie 13100 aixen-provence séminaire d'information générale leu juillet inclus prix 750 molezon 48110. sainte-croix-valléefrançaise séminaire approfondissement lieu septembre septembre inclus prix 750 psychologie a-t-elle place sport tel programme travail s'est fixé table ronde organisée groupement d'étude psychologie sport g-e.p.s entraîneurs cadres employés clubs fédérations médecins journälistes spor- tifs athlètes donc réunis réfléchir situation psychologie monde sport l'absence préparation psychologique mise relief faire exister sportif dehors rôle porteur d'exploit donner moyens d'approcher certains maux persistants d'une manière nouvelle étudier tous problèmes d'adaptation attiré l'attention fait entraineurs devaient approfondir personnellement leurs connaissances naturelles psychologie plutôt faire appel psychologues acquérir expérience afin faire point prolonger cette réflexion symposium langue française organisé sans doute courant l'année 1977 sous titre projets sport —————— méthode vittoz lire l'article paru psychologie
13,14,done minier merutnne glue canifmntinun vovaur antenne eur tre uerler tarnent pus eng pretanes nue otre ins enter fonmeute fgnnnns ùra fes œnne tre nue tin lattes frpnetm dun rap pause huoseces ges lee eusnigues vatinien denrisie vingt mille nonneee gone therche tale éñrlin pen entr crues prrmetennt fin gré eutvr vurioers gtees humnine enuteur run veus pes tours çhevrun penrann pont cure era peojeth tin gnnn bree ten inde elecin dre profennriors allemands ffablieent hein veux manstin unn éotrlin peaux tvon lunchan unn cher cheveux cote vrnr pieter gans doute conmvtenmalril d'étudier uupothôse telmtions idfésingiques méthodologiques entm l'ontheogotnmaln physique britennique dent gaïton fioure plus éminente travaux snvants atfrmands pule vants nazis untro 197 1699 golton dévelonpo travaus l'identilication por sonnes traces uertillon s'intéresse empreintes digltalns fascinent double titro comme gigna l'individunlité come papressien d'une pormananco horgditaire dont rochercho passion noment traces encore chor che classer fes empreintes publie 1491 patterns thumb and lingers marks développements travaux gaïon courelation l'horédità paraissent nature herilanco présonto nombreuses donnees entronometriques recuoilliès depuis ast6 traces thodes correlation mises point ontro 1877 4835. pesrson considère quo cot ouvrage point départ l'esnio biometio l'ocole biometrio première mouvement psychométrie tests mentaux dès 1579 garon donno definition nsvchomé triè contient devise iutur laboratoire biometrie has tèment necessaira diro psyghomëtrio l'an d'imposer mestre nombro onorations l'es prit comme nratique déter minauon temps réaction per sonnes difièrantes… jusqu phenomenss d'une branche sonnaiissanto men ete soumis mesure nombre peut ass mer statut dignité d'une science c'est sans douto 1855 galton miraent james mekoën corte tevua ados nlige payt mess é5û 184 galton fando 2ho hors cepvtrs ben peattté ppunrn pare puits ser lei asp file quart lue aus punn formation duna sélence morphologique ctydolgqqus lors duvotuppentents mmodurmes nulle emma moteur eat donné eur dun galten cette pdivttunllé conte oblet etiavé trouver yra conti aur l'approche créé orne cite rummntale mendal ceux peurs puma eheloute montré aan pet tarollactunlles d'un indlutdu vol trie use qunte peuvent êtrn conalfarnas cenim ent ért jus tests per etats ment rte rte gundtiquement détermindes ana autant ètre coneurs coin hitraditu chaque génération comin ortglnale gènes transmis arcendants lieu format atnotype original détormine pacités colles-cl étont aussi jête una paru ter néos conditions far encens prie tomes late habltudes classe opamisre apprentissages scolaires artistique eee cases londres l'ordre galtonien pren due rsa noie lee lib pure variere env aprieton 1969 lorsquo galton dit imp las lonco onvors prétontion trrirel lame herecsy mécalité naturollo lormule esnctrie exporiments thèse laquollo blologlo linéas rein lité donnora plus tard uno baso eclen mener jesces londres tiflquo mails commontalra kat pauhormotre pacte minetecnth poarson découvro nalvoment esters use heaven fecultv and monsion kiéoiogiqu cest dasseprent londres macmil doctrino oruollo démocrstis lens iles lan ad. the measurement character penny raa 114 etre defrnienve 1889 the pauerns themb and finger maikse p'aosophicul tranvacmac ens the ouvrese contribution each smere arcesror the total herisage oïspring 197 the possible improvement the human bre2d urder the existing conditions law and sentiment naure mezssrss life londres methousn 254 lrd 1503 faits lesquets fonde l'affirmation çcére indéniables ppertentent patrimoine sclentifique n'en fisurent moins ens contexte historique social restera vrai mêle souvent £sviendra faux l'expé- rence voyèces afrique moyerortent perçu très grande diversité êtres humains ghenché inscrire ordre dont normale trouvée teet fournissait butive mathé êtres natique cette diversité ou- 9rin fait ccrçent d'un ordre naturel fon s'otenco dieu créateur fyeis constituo différence mals sécurité l'etat demeure dns accoptatlon l'ordro galtonien rangemen roflète état rapport forcss aoclales soclété capitaliste pooë problèmes contrés d'intégration aoclale l'intérieur pays colonial soclété chaque père familles l'extérleur dana aon empire 1882 galton rêve d'une enfants jiralent régulièrement faire peser mesurer photographier tester leurs facultés labos toires anthropométriques techni ques mesure sens 9es phot génériques surtout études d'en preintes destinations pret ques parmi lesquelles contrôlé cier premier rang préècer pations galtonignnes théorles techniques cette orientation vont donner naissance mou ment tests mentaux jean zurfluh jus haldane p.u.f. 1943 27. pearson francis press 1314 the lije letters and galion cambridæ abonner psychologie heredité politidus unie voyez page
14,15,dès âge trois ans enfants découvrent musique temps guy demoy d'heure chaque semaine froisser papier gratter leurs ongles murs moquette broyer racler grincer.… bref émettre autant bruits divers qu'ils peuvent sans soucier définitions classiques musique plus tout tintamarre comme manqueraient dire mépris traditionalistes produit cœur l'institution île biennomrné conservatoiré musique. deux kilomètres capitale romainville conservatoire muni- cipal loge ancienñe poste bâtiment-caserne briques rouge sombre l'on s'atténd découvrir démarche pédagogique d'autres lieux culturels plus ciel imagine gros nuages noirs menaçants telle concentration laisse autant aucun sept petits bonshommes isolé groupe c'est parfaite symbiose qu'ils écoutent réagis- sent moindre signal grande partie musique créée aujourd'hui langage plus rien voir celui l'âge classique xix° siècle quel oreilles bon nombre d'amateurs restent obsfinément exclusivement sensibles comment initier enfants cette musique temps comment peut-on préparer être auditeurs celle xxxr° siècle l'article ci-dessous lecteurs découvriront nouvelle pédagogie musicale mise œuvre petit conservatoire banlieue répondre double objectif tout monde musicien vroom-vroom-vroom coup tonnerre éclate roule renvoyé tous murs salle tous arrêtés marquant légère inquiétude puis silence revenu sauvent tous sens comme promeneurs affolés l'imminence d'une averse uns protègent tête leurs mains d'autres chemise remontée rabattue comme foulard l'un d'eux tend visage vers bienfaisantes gouttes pluie broom bref lointain nouveau coup tonnerre moindre intensité immobilise encore tous enfants comme précédent émis huitième personnage juché tabouret fois chef d'orchestre instrumentaliste celuici prénomme pierre six ans c'est fils comme chaque mercredi participe cours musique certains lecteurs étonnés quoi cris pantomimes cours musique oui j'ajoute qu'il arrive enfants cours passent souvent temps irois quarts tels chats déplaçant sol mouillé centre d'une moquette jaune moutarde sept bambins dont l'âge oscille autour cinq ans tour tour lèvent jambe après l'autre d'infinies précautions pluie tombe encore fortement cela saurait tarder temps autre tête scrute attentivement plafond gris-blanc fait fonction
15,16,péri sophistiqués flatteraient d'ex menter quoi s'agit-il dès l'entrée programme écril main directeur philippe rrii igne visiteur arrii-blachette rense l'élève tout île monde peul faire musique tout monde peut deve- plus jeune plus âgé nir musicien amateur c'est-à-dire celui celle aime musique contact pratique conservatoire romainville offre pédagogie vivante fondée exclusivement travail bien entendu ici comme ailleurs peut apprendre jouer violon piano l'accordéon proposé neuf c'est sensibilisation formation hors instrument l'instrument limite créativité technique m'explique directeur beaucoup gens chez professionnels cette technique prend toute place détriment plaisir l'imagination encore fait pratique d'un instrument fait souvent peur interdit l'accès musique gens disent peux rien comprendre musique puisque sens incapable d'apprendre jouer violon désirais ici voulons renverser cette attitude généralisée face musique efforçons abord d'intéresser élèves petits âgés couleur structure désir d'apprendre instrument doit venir suite cet intérêt c'est pourquoi cette année ouverl classes ateliers préfère élèves étudient produisant eux-mêmes partir matériaux n'ont vocation spécifiquement musicale comme papier boîtes conserve etc. urs tournée aucun mépris véndier fou production l'ins- chez n'ont xtx° siècles l'orchestre pprocher musique possible lune sseurs prennent jeunesse voulu profs tale €po4 file maximum gel musique nusical savonl très pape occupé maic s'est beau sensibilité sap casait répéter nee ien tavo yai celle coéair jouer d'une certes années 407 risent moin d'eux d'ailleurs cave cercé nest facile léjèves chacun durée répéter l'appartement fami ment comment voulez-vous pren brêté gratuite l'instrument plaisir cave études dit di- choix idérons cons lun instrument recteur jouer indi mot l'indique philippe arrii-blachette mer mort dressage étre comme jeu donc plaisir œuvre vons cours solfège 'élè premier mao nscur d'instrument donne jour sente bien théoriques indispensables tout-petits exemple puise taper mieux mieux otio cours pratique l'instrument voulons rester petits dès moindre sign tout tigue retournon rue j'ai connu jeu sarents dunissaient enfant ainsi n'as sage alors vas faire gammes piano convertissaient l'instrument jeu instrument punition c'est d'ailleurs curieux comme pays occidentaux musique fois plaisir punition quelques mois employé p.t.t découvert conservatoire piano meuble sacré sal bourgeois c'est gardé mauvais souvenir propre mation musicien lui-même violoniste evide ment comme plupart musiciens professionnels choisi vocation instrumen puisque c'est tres petit vers l'âge six sept ans cette décision doit être prise donc parents opté violon treize ans s'était retrouve élève conservatoire national périeur paris cette univer sité musique rester jus l'âge vingt-trois ans cela vraiment très dur dit-il dix ans violon matin soir cette époque enseignement conçu façon ridicule l'élève apprenait s'exprimer l'instrument prenait guère goût jouer lui-même entourage tout dirigé vers technique virtuosité enfant adolescent c'était petit chien cirque apprenant sauter cerceau jusqu satisfaction dresseur c'était vraiment dressage municipalité romainville consciente l'intérêt l'expérience prévu conf truction d'un conservatoire l'attaque sons voix l'ins trument l'accent rythme timbre hauteur etc
16,17,beaucoup lecteurs n'ont étudié conservatoire national supérieur souviennent peut-être encore très bien façon dont subi l'initiation piano violon piètres résultats plus souvent comprendront bien alors véritable sens mot dressage employé directeur qualifier l'apprentissage futur virtuose évident qu'un enfant cinq six ans demande rien adultes concernant futur métier tous petits mozart dont biographies racontent abondamment comment très jeunes déjà manifestaient dons enthousiasme indescriptible musique peuvent aucunement témoigner faveur thèse d'un destin inscrit gènes revanche l'ethnologue margaret mead apprend beaucoup façon dont l'entourage façonne futur artiste certaines sociétés primitives pacifique raconte-t-elle l'enfant naît coiffé c'est-à-dire arrive monde poche placenta tête promis fonction peintre l'intérêt cette coutume enfants-là seuls deviennent effectivement peintres bons peintres alors tout autre membre l'ethnie prétend transgresser loi échoue cette constatation ethnologique rap- pellation don parents fant doué ceci cela parce tel propre désir fait constate don développe chez sujet ainsi marqué l'entourage pédagogie musicale toujours reste dla plupart temps malgré l'évolution découvertes psychologie lle reflet volonté brutale l'adulte former saltimbanques plaisirs traduit évidemment beaucoup d'échecs refus chez l'enfant contraignant philippe arrii-blachette voué musique dès enfance pris maîtres prestigieux hissé prima révolte comme fils l'épicier retenu sortit conservatoire comme nomène étrange sans vouloir analyser façon freudienne bien obligé considérer comme refus signifié non plus l'individu pensant propre corps philippe arri-blachette devint soliste magnifique comblé vœux familiaux effet alors qu'il répétait pièce cou l'endroit place violon devint brusquement très rouge mit enfler façon tout fait incompréhensible violoniste pelle étrangement sociétés connaissons sous l'ap professeur décrètent tel en\ désirs telle attitude celui-ci détournant art aussi charge grande école rang d'artiste milieu n'ex- piano lieu d'aller s'amuser cama- rades devint très bon élève violoniste brillamment confirmé devant belles années concertiste succès peut-être gloire passa alors phé- ture l'ait détourné d'une carrière qu'on imposée qu'elle l'ait amené réfléchir l'enseigne ment musique jouer plaisir directeur vient peine raconter cette anecdote mère fils entrant bureau viennent comme prolonger l'actualiser façon saisissante question dla mère directeur précise oui bien sûr fils peut apprendre chez guitare sans connaître solfège bien entendu s'il savait tout handicap faitil musique l'école tout répond mère professeur musique prévu depuis années jamais nommé directeur tourne vers devrions avoir cotophane archet résine dont enduit crins dut reposer quelque temps l'enflure disparut dès qu'il voulut reprendre nouvelle enflure pendant mois mois cette mauvaise surprise réapparut chaque fois qu'il entreprit jouer jusqu'au jour l'on mit pommade l'enflure nom maladie allergie colophane c'est ainsi envola brillante carrière dit philippe arrii-blachette ironiquement tout méconient cette mésaven1
