,page,text
51,52,personnes définition por leurs outils clentes moyennes nouveau fes sans dire iles tests psychols ape ence 100. cet sion ste telle donnent absolument 21e ser anford- comparables mesur süre l'importance donnalres datant cette d'abord parce fiequ yslques ques utilisés mesure d'un individu d'erreur époque encor moment-là tivement important dont ref g'est environ nça publication pris conscience jee n'avalt spearman con devait s'étendre peculée non-profe d'en début due vente ans l'idée pres nécessairement tarots fondé 1953 plus tous tests d'aptifut tests tendance cos. distance fon sogiqu rent jusqu psychologiques ction intellectuel sulte gst fol facteur iligence générale ant travaux spears phpbortait genre tests api raisonnement connal qu'il sances acquises mémoire comme invariable lay dérer mesure précise degré être gence d'une personne ile selon occasions tend ange selon test utilisé var d'autre part n'est mesure physique loin gare aussi objectif in'est étape échelle mesure physique pau régi loi 12/7/71 cours correspondance cours oraux sessions conférences paris. enseignement gradué professeurs spécialisés psychologie psychanalyse psychologie l'inconscient verbales éche sure logis graphologie orientation vseie théorie d'un seul facteur groupe ibien sélection professionnelles geo mise cause .par nombre dupe population rime dual théoriciens enfin mesure mental présente rythme d'étude inaiviaualisé connu louis difficulté particulière rare frais d'études comptabilisables ment sûr l'on mesure dépenses formation permanente documentation gratuite gaillat villa st-pierre 94220 charenton tél 368.72.01 analyses sélections professeurs int tement supposons exemple mise mectifs l'on fasse passer quelqu'un test tests col contraire qu'il appelé raisonnement verbal peut-on thurstone tudes mentales pri- accepter altomatiquement résultat existait sept numérique spatiale obtient comme mesure maires verbale isonnement fluidi raisonnement verbal résultat verbale ere idité visuelle est-il influencé connaissance recherche prétendait 1gnorance vocabulaire tivité intellectuelle com- compréhension structure grarnma toute activité combinaison ticale l'oubli rapide questions plexe mettait pré- posées s'il obtient faible résul cure plusieurs tat cela veut-il dire raisonne capte ment verbal déficient qu'il controverse cessa lorsque après avoir établi toute batterie tests sentait dehors coup tout sim plement qu'il voulait ipasser d'aptitudes mentales primaires thurs- tone découvrit qu'elles toutes test intimement liées qu'un facteur général rendait compte d'une proportion im- portante leurs variations deux prise compte parties arrivèrent donc compro- l'âge mis établie l'importance difficultés l'on vient d'exposer divers facteurs groupe mutuellement tournent toutes autour théorle gé- liés facteur désignait l'apti nérale voulant aptitudes s'ac- tude générale différents tests quièrent développent pendant mesuralent jusqu certain point l'enfance différence entre seulement personne douée autre l'est psychométrie lancée tests moins mesure niveau quan- binet prit essor important lors- tité d'aptitudes qu'elles possèdent arthur otis mit point tests certains théoriciens jean piaget notam- collectifs permettre classifica- ment pensent développement tion nouvelles recrues l'armée l'intelligence fait l'acquisition méricaine pendant première guerre différents stade développement men- mondiale cette expérience connut tal selon cette théorie tous indi- tel qu'après guerre tests vidus passent mêmes stades ent pus seulement utilisés pout développement mental cela selection recrues militaires ordre stades représentent aussi celle personnel l'in cadre références plus plus nombreuses l'enfant pendant notamment dépister apprentissage monde l'enfant déve- enfants pouvant pré tie présenter ultérieu- loppe chaque stade certaines rement difficultés l'orie précédent professionnelle ntation tudes qu'il n'avait cause grande nus ogdulge l.l 7-1955 psychologue tests collectifs souvent utilisés murstone 1887-1955 publicite savoir exprimer moyen plus sûr celui celle désire faire écouter s'im- poser toutes circonstances vie sociale privée milieux proles- sionnels affaires amitiés relations rap- ports familiaux affectifs n'être écouté déprime paralyse dessert personnalité arrive certainement dire aprés entrelien n'est ainsi j'aurais aborder conversation faire comprendre pourtant conversation science règles clés s'acquiert analysant chez grâce cours technique conversation différents problèmes soulevés rapports humains gagnerez quelques mois force persuasion suroren- dra vous-même couts corres- pondance traite d'une manière pratique détaillée tous jes aspects conversalion psychologie conversation technique l'élocution pratique contacts humains susciter l'intérêt sympathie l'estime animer diriger conversation langage affaires corres- pondance privée d'affaires etc demäin saurez utiliser toutes jes ressources parole disposerez meilleurs atouts ceux d'une personne parler facilement emicicement documentation gratuite 53j simple demande ct.c rue collange paris-lesallois
52,53,stade pensée forgénéralement atteint l'adolese individus capables façon hypothétique dont enfants stades incapables enfants différences individuelles rapidité laquelle assent travers stades maîtrise qu'ils acquièrent degré juvelles échelles d'intelligence olent mesurer fois ets qualitatif quantitatif ment but tests personnalité utilisalt beaucoup techniques prodont mieux connue rorschach montre cujets images formes non figuratives comme taches d'encre demandant dire qu'elles tent gens peuvent évidem- écédents pntrent fois représen ment dire veulent interprétation cartes donc haute ment personnelle toute évaluation douteuse quantitative l'aptitude personnalité divers questionnaires d'aptitudes essaient prévoir plus activement tests personnalité comment personne comportera s'acquittera d'une tâche comportement parfois fort lié personnalité exemple échelle mesurant l'ethnocentrisme n'essaie seulement d'évaluer probabilité laquelle sujet supportera contraire s'opposera l'intégration raciele écoles reflète temps trait personnalité conservatisme type mesure pose problèmes encore plus difficiles ceux fiabilité validité effet question supplémentaire pose vie réelle personne fait-elle qu'elle dit faire questionnaire toute partie controverse l'emploi tests psychométriques repose problème nature contre culture certains critiques mesurer implique qu'il hérité fixe divers chercheurs cyril burt années 1920 arthur jensen posé question rôle contributions relatives l'environnement l'hérédité différences niveau d'intelligence réussite scolaire personnalité chercheurs généralement ceux mis l'accent l'importance facteur plutôt multiples traité caractère porte ac2tions sociales comen grande pari cette question reste dès partie théorique tout débuts tests l'idée dre pouvait partir d'eux prenes décisions catégoriques défi- nitives considéren sens toujours scepticisme peut-être ntage profanes psychologues eux-mêmes sens semble juste méfiance public don gard tests envers cette méfiance bon sens tests probablement l'ox- 6ommune tout monde salt vie gent loours ment vite pendant t'onfar particulière chologues tradition once psyeux-mêmes consid mpirique ples expérimentateurs ceux nul jets ane pme simples suainsi assurer mesures eme gueur scientifique qu'en physique exemple inventeurs teste pris conscience résultats fourni risque d'aboutir standardiser seule moe con ceux subi nombreux questionnaires savent blen testeur façon tester affectent personne interrogée peehologues humanistes mettent aussi point d'autre part n'importe presque pouvant procurer tests non-psychologues rapidement adjugés droit d'en faire passer comportant ainsi comme tests donnaient résultats beaucoup plus précis qu'ils peuvent réellement cela nuit évidemment réputation psychométrie conception rationaliste psychométrie considère personne comme individu amené divers changements pratique vingt dernières années certains chercheurs commencent évaluer gens l'intérieur d'un système laissant l'individu libre percevoir l'environnement façon reconnaissant ensemble particulier d'attitudes envers vie l'un plus remarquables charles osgood mis point technique différenciateur sémantique s'est imposé partir méthodes psychologie expérimentale psychophysique autre psychologue george kelly développé technique repertory grid grille répertoire issu d'un milieu humar niste met l'accent développement personnalité deux techniques mesurent l'importance qu'un individu donne différents aspects vie moment particulier temps façon dont évalue importance sens relatifs recherche mesures fixes déflnitives d'aptitudes potentiel per sonnalité d'autre chose encore permis production techniques mesures l'on peut employer décrire l'état niveau d'un individu moment donné cet objectif extrêmement utile sol technicians engagés l'argent investl recherche psychophysique psychométrique montrent bien l'étude régularité autant diversité réponses humaines l'environnement présente intérêt considérable conséquences pratiques très importantes colin elliott traduction annick baudoin psychology today grande-bretagne colin elllott directeur projet baptisé échelle d'intelligence anglalse l'université monchester depuls 1973 tendance d'un individu valoriser roupe nativnalilé jensen psychologue américain cru pouvoir aflirmer suite résultais diverses expériences noirs réussis saivnt moins bien tests d'intelligence blancs vives polémiques nées prupus déclarations lire sujet dossier q.i pau psychologie déc 1972 15. ditférenciateur sémantique mis point psychologue américain osuood c'est plus simple échelles d'aptitudes demande chaque persunne participant enquête marche exemple situer produit service axe échelonné dont deux extrémités correspondent deux caractéristiques opposées situer telle vitesse truis axes bon marché chère stone see eeeeeeceeseeeeeeeeeee dangereux side cesse sesssescescne lrasile delta creation weeks-ends philippe girod stage d'êté animateur invité len hochmann l'institut d'analyse bio-énergètique new-york septembre conférence dijon docteur alexander lowen auteuyde hadépressonmemeuseetlelcotpss atbiosenerglegetcses publiésipa hchou grec men fese
53,54,estil vraj gens moriée vivent plus longremps cehbaraires hommes mariés femmes mariées également vivent plus longtemps c'est fait diverses explications avancées frances kobrin gerry hendershot brown university etats-unis groupées sous trois rubriques suivantes selon premier groupe d'explications gens destinés vivre longtemps parviennent marier rester gens marient alors mariage généralement considéré comme chose socialement désirable marginaux soumis toutes sortes pressions sociales tensions finissent user physiquement troisième groupe d'explications relie vie jongue mariage travers concept solidarité sociale idée émise récemment sociologue américain walter gove affirme gens mariés vivent plus longtemps parce célibataires vivent existence relativement isolée dépour- vue liens interpersonnels étroits clé maintien d'un cer- tain sens bien-être femmes vivent moyenne huit ans plus hommes ent parle ... gens mariés vivent plus longtemps différence moins grande entre hommes femmes mariés walter gove cela tient femmes célibataires tendance avoir liens plus forts famille leurs amis tandis femmes mariées rap- port hommes mariés rôle restreint frustrant d'autres termes femmes bénéfi- cient peu avantages conférés mariage expo- sées diflicultés dehors celui-ci frances kobrin gerry hen- dershot testé hypothèses walter gove comparant gens non mariés gens mariés selon façon vivre effet liens sociaux jouent rôle im- portant vie longue céli- bataires vivent parents devraient vivre plus longtemps ceux seuls mariage meilleur l'homme femme fait statut plus éle- l'homme hommes non mariés soutiens famille devraient vivre plus longtemps ceux font simplement partie famille frances kobrin gerry hender- parait elus long née sens shot ainsi étudié échantillon vingt mille individus décédés entre trente-cinq soixante-quatorze ans fonction certains critères apparu hommes célibataires soutiens fañille ceux plus longue longévité suivis hommes vivent famille sans être chef vivre seul qu'il pire hommes solitaires taux mortalité plus élevé celui hommes mariés contre chefs famille non mariés fernmes l'instar hommes chefs famille vivent plus longtemps elles suivies femmes seules enfin celles vivent mille sans être chef taux mortalité dernières 100 plus élevé celui femmes mariées contre seulement femmes célibataires soutiens famille celles vivent seules l'hypothèse walter gove selon laquelle liens sociaux stalut social combinent protégel gens mariés vérifié d'après psychology today
54,55,——— deux dernicrs lorarie insurmontabte ponts entraînent mrements alectifs causes reste état l'etat communauté scrait alors plus qu'un cadre nree sociologie face crise famille communauté eugène tisserand paris centurlon heure l'on parle beaucoup famille refus madans jeunes générations vie collective communautaire l'ouvrage d'eugène tisserand famille communauté constitue nouvel apport réflexion sociojogique problème partant phénomène crise famille auteur souligne l'ambiguité existe apparence mariage porte bien plus plus couples déclarent déçus après quelques années d'union prestige modèle famille bien instrument indispensable socialisation jeunes déjà discutable trouve yeux derniers fortement diminué raisons cette crise diverses grande famille réduite famille nucléaire l'investissement affectif devient insupportable famille subit contrecoup division travail bureau l'usine devenue petit noyau seul angoissé face grande société inquiétante cris riage étude comparative étude comparative phénomène europe etatsunis l'auteur constate l'apparition communautés comme conséquence cette crise comme alternative famille présente certain nombre kibboutzim israël communauté boimondau communauté l'arche france passant celles république fédérale allemande men d'argentine d'uruguay richesse composantes variées vités diversité leurs actiche sociales leurs gages eurs réussiles lémoif recueillis grande partie reus sources livresques nom- instructifs réhas l'auteu réflexion plus personnelle peulo suit cette énumération lio mettre commun habita- travail enfants sexualité approchont plures permettant réduire îles frais d'ha- l'ulopic domaine bitnt consommation arme révolutionnaire ferait éclater l'auteur structures tradilionnelles aboutiquelle commune meilleure formule masque eugène tisscrand communes jes choix entre grande collectifs d'habitat lévistiques dont carnc- autres rapport définir ailleurs très difficiles egrande fan ople sieurs amille c'est-à-dire plu- pagaille sous loil enfants rrime mari teur défaut réfrigéra- visée télévision personnels ter ondamentalc d'apporras ponse concrète embar- dossier mille nucléaire donc are files vie pratique gréable remède l'isolement veut offrir en- fon adre stable vie foyer trouvent refuge instrument éducation ... marque plus sûre c'est reconnaissance l'unité couple l'ensemble groupe l'auteur explique choix attachement certain style vie valeurs essentielles peuvent espérer trouver réalisation difficultés subsistent semblent inhérentes nature humaine l'appropriation affective matérielle problème pouvoir commurnication tendances commurnauté repli problème l'engagement grande famille résout qu'elle pose question d'un changement radical société reste mode d'intégration sociale mieux adapté monde actuel documents synthèse cet ouvrage offre intérêt grande diversité sources références tous aspects positifs négatifs problème communautaire abordés grand nombre témoignages enfin franchise l'auteur quant choix peut regretter cependant qu'eugène tisserand n'ait davantage pris considération rôle famille tant qu'instrument base maintien pouvoir capitaliste socialiste famille effet structure bien affirmée pays l'est chine albanie tant véhicule idéolpe permettant domination d'un etat individus l'oppre sion aspirations plus more taires l'homme cette famille grande petite ——————— ralt destruction toute société type autorilaire dommage cct aspect abordé trop rapidement toute façon d'eugènc tisserand reste avant tout outil d'analyse sociologique permettra chacun construire propre synthèse problème l'ouvrage michèle crès enquête autour divan analysés parlent dominique frischer paris stock faut méprendre démarche l'auteur livre dominique frischer parle psychanalyse point vue psychosociologie non celui théorie psychanalytique quelconque antipsychanalyse métier depuis années faire enquêtes marché selon méthodes éprouvées sondages entretiens non directifs analyse contenu appliqué expérience marché psychanalyse relations d'abord voie petites annonces ensuite recruté psychanalysés recueilli témoignages trentaine d'entre entretiens individuels ceux d'une autre trentaine réunions groupe dès lors propos analysés cure paraissent décevants renouveler sujet témoins chaud évoquent monotonie traitement longueur rareté moments exaltants problèmes d'argent qu'ils connus payer psychanalyste comportements aberrants certains analystes faut bien admettre qu'ils rendent compte réalité critiquer l'application méthode psychosociologique voire évoquer projections inconscientes l'auteur passé lui-même divan peut faire grief dominique frischer documents qu'elle rassemblés classés thèmes comme cela pratique analyse contenu plaçant d'un autre point vue sien depuis qu'il paru livre suscité nombreuses réactions hostiles curieusement elles viennent plus non-psychanalystes prompts s'indigner dès qu'on louche psychanalyse psychanalystes mêmes pourquoi donner parole psychanalysés examen conscience pro6
55,56,fondeur théorique maîtres castel dominique frischer connaître point vue consommateur cher apporte éclairage nécessaire point vue consommateur intéressera ceux analyse songent entrer devrait ici maintenant également apporter informations utiles praticiens etant donné nature contrat psychanalytique donné nature rapports dépendance nouent pendant trois quarts d'heure d'une séance entre psychanalysé allongé divan psychanalyste assis derrière fauteuil savent analystes pensent leurs patients lorsqu'ils sortis cabinet cure première fois sans doute patients s'expriment ici sans peur sans honte françois clairval psychiatrie pauvres infirmiers iles appelait gardiens fous henny zilliox toulouse privat derniers mois reçu tête avalanche livres- documents consacrés professions médicales grands médecins publié réflexions mémoires bat interne psychanalyse existe longue date livre robert psychanalysme vient d'être réédité petite bibliothèque payot récent ouvrage virulent françois roustang destin funeste paru éditions minuit l'enquête dominique fris- livres oni incontestab ccès celui d'henny zilliox comme c'est bizarre médecin psyens moins comme s'ils parte fumer cigarette png pital passent scène bien sûr temps temps leurs lules vertes rouges cäl fous médicaments noms enfin voil bien gros l'affaire îles infirmiers s'en chargent pensez population soignante soins responsabiliés incombent personnel infirmier salaires être répartis proportion différente ... délaissés tous pauvres infirmiers fous relégués prolétaires relégués infirmiers statut professionnel fin années trente mil neuf cent trente infirmiers dont jusqu cette époque n'exigeail possédassent certificat d'études primaires c'est aussi race seigneurs médecins chefs service bref infirmiers n'intéressent personne grand monde surtout théoriciens nouvelle folie livre d'henny zilliox aussi peu construit qu'il possible l'être malgré premièrement deuxièmement petits uns petits deux douceur onctueuse livres médecins marient élégamment doute compétence savoir scepticisme spéculations cas cliniques saignani point c'est livre d'infirmière infirmières sent qu'il impossible divaguer aussi bien moralement pratiquement parce qu'elle s'adresse gens bâtiment parties théoriques historiques inutiles n'écrit plus his- toire profession l'egypte jours vingl pages beaucoup moins intéressantes loul cas manuel syndical car horreur horreurs l'on parle sitralégie thé- rapeutique choix prophyl- lactique fait sans oublier lout c'est travail heures heures travail mal payé semble plus s'éloigne lit d'un malade plus définition maladie précise c'est pour- quoi livre d'henny zilliox contient définition seulement amour yannick bourdoiseau psychologie exemple auteurs francophones comportement humain l'homme femme cellu familiale l'homme l'organisation l'apprentisage time-life l'indiy éditions time-life diffus tuellement collection comportement humain cin titres île jour l'individu l'homme cet femme cel lule familiale l'homme l'orga nisation l'apprentissage ouvrages présentation conception objectif correspon- dent parfaitement collections internationalement connues timelife déjà entre mains exemplaire plus célèbre série monde sciences tous livres toutes collections reflètent unité conception reliure papier qua lité textes écrits rédacteurs professionnels illustrations nombreuses parfois d'abondams commentaires façon qu'une pre mière lecture sinon seule peut limiter regarder illustra tions commentaires succès commercial prouvé jusqu'ici produit marché aujourd'hui sciences comportement nouvelle cible services marketing time-life france après l'avoir pays langue anglaise titre original collection human behavior mérite quelques réflexions traduction littérale comportement humain doit faire oublier human behavior appartient fois langage courant langage scientifique parlons psychologie psychologie sociale sociologie anglo-saxons particulièrement américains parlent behavioral science science comportement tradition américaine étudie comportement humain c'est-à-dire concret observable avant faire psychologie psycho- ent ac€ livres sociologie sous-entendu spéculation discours philo- sophique lancement thème cette tradition retrouve conception cette collection aucun titre discipline chaque fois thème synthétique l'ouvrage l'apprentissage exemplaire point mêle fois conditionné ment acquisition concepts 4pprentissage social éducation celt
