,page,text
38,39,"les lieux où l'on boit. Comme les 
épouses japonaises ne soni pas aussi 
sévères que dans vos pays, ils ne 
redoutent pas la réaction de leurs 
femmes. Ils vont dans des cabarets 
ou des petits bars le soir, avant de 
rentrer. La frustration sera compen- 
sée en parlant, en critiquant les 
chefs dans les débits de boissons. 
En rentrant chez eux, ils sont assez 
stabilisés psychologiquement. Leurs 
femmes le savent et se disent: 
« Peut-être est-il nécessaire pour lui 
de se distraire ainsi. » 
Un autre point est que, dans Ja 
coutume japonaise, le lieu de boisson 
est distingué des autres situations 
ordinaires de la vie. Vous pouvez 
être ivre et vous battre; c’est per- 
mis parce que c'est un endroit spé- 
cial, une occasion spéciale. Le len- 
demain, ceux qui étaient avec vous 
auront oublié ou se diront « n'y pen- 
sons plus ». La vie est compartimen- 
tée. C'est là un compartiment dis- 
tinct des situations ordinaires. 
Quelquefois, les étrangers trouvent 
que nous ne sommes pas consis- 
tants. On nous apprend depuis l’en- 
fance à nous comporter de telle 
manière dans telle situation et à ne 
pas mélanger. Nous avons des sortes 
de comportements psychologiques 
avec chacun; c'est une règle de 
conduite parfois contradictoire. On 
peut être impoli dans un bar et poli 
dans la vie courante. 
Je pense que nous, Japonais, 
sommes une nation tendue et frus- 
trée sous bien des aspects, Pour ou- 
blier ces tensions, nous nous livrons 
ainsi à des activités diverses. 
P. 
Pour vous libérer d'une structure qui 
vous oppresse, vous cherchez alors 
plutôt une dérivation qu'un renver- 
sement de cette structure elle-même. 
La majorité du peuple 
est encore sous le contrôle 
sociopsychologique 
du système impérial 
En 
(Photo Jean Chaguwbott) HM. 
Vous avez peul-être remarqué que 
beaucoup de Japonais étaient apathi- 
ques politiquement. Ils pensent que 
la politique est affaire de politiciens 
el font peu attention à ce qui se 
passe : augmentation du coût de ja 
vie, crise, etc. Beaucoup pensent 
qu'il s’agit d'une sorte de désastre 
naturel. C'est le fatalisme japonais. 
« N'y pensons plus, on n'y peut rien. 
Il faut trouver quelque chose de 
plus gai, oublier les choses désa- 
gréables. » 11 s’agit là d'autre chose 
que du «divertissement  pasca- 
lien 0», car nous ne sommes pas 
une nation religieuse. 
Il y a cependant beaucoup de tern- 
ples, de monastères au Japon. Mais 
les dieux japonais sont « fonctionna- 
listes », ils ont des fonctions diffé- 
renciées pour aider les gens dans la 
vie ordinaire : protéger les enfants, 
guérir toutes sortes de maladies, etc. 
P. 
Pour résumer, s'il fallait définir le 
Japon d'aujourd'hui. 
Le fossé des générations s'accroît, 
mais très lentement. Les jeunes 
changent, mais surtout d'apparence : 
cheveux longs, blue-jeans, etc. Aux 
Etats-Unis, les jeunes sont contre le 
service militaire, contre la guerre; 
c'est pourquoi ils expriment leur op- 
position ainsi: les cheveux longs 
contre la coupe à ras et les habits 
variés contre l'uniforme militaire. 
Les jeunes Japonais ne font que 
prendre le style de vie, le style su- 
perficiel de la jeunesse américaine. 
Je pense néanmoins que c'est un pro- 
grès, parce que la possibilité de s’ex- 
primer se développe. Mais la 
conscience politique et sociale n'a 
pas encore beaucoup changé. 
Je pense que tant que le système 
impérial existera, il sera à peu près 
impossible de démocratiser la na- 
tion japonaise. Il ne faut pas sous- 
estimer la fonction politique du sys- 
tème impérial telle que cherche, par 
exemple, à l'utiliser le présent gou- 
vernement. La majorité du peuple 
est encore sous le contrôle politique 
et sociopsychologique du système 
impérial « démocratisé ». Ce sera là 
ma conclusion. ES 
10. En français dans le texte (N.D.T.). 
Je tiens à remercier MM. Minami, 
Takahashi, Sasaki, Umemoto, 
des universités de Tokyo et de Kyoto, 
pour l'accueil qu'ils m'ont réservé 
et le temps qu'ils m'ont accordé. 
Je remercie également M. Kawashima, 
Mme Baba et toute l'équipe 
de « Ningen sono michi naru mono », 
la revue japonaise équivalente 
de « Psychologie ». J.C. 
Z 5 Jia . . ° Apprence(E 
PSYCHO- 
LOGIE . 
POURAVOÏTREREVOLUMION 
FERMES COSAUE 
PROFESSIONNELLE 
Enseignement ndividualise pat correspondance 
cours oraux du soir (Paris) au stages pratiques 
{Pans] (Frais d'études deducubles du revenu brut) 
Preparanon à divers diplômes sous la condune de 
pralicions repules — Convention de formation 
COURS 
Psychotechnque — Graphologie — Morpho 
psychologie — Psychopedagogie — Symbolisme — 
Rorschach — Orientation — Sexologie normale 
el pathôlogique — Reeducaluon graphique — 
Relaxation psychosomatique — Grounrs 
Pour dirigeants et cadres medecins etudiants 
inhirmières assistantes sociales enseignants 
parents el lous ceux qui s intéressent aux problèmes 
humains eclarés par la psychologie moderne dans 
leur profession ou en vue d'une carriere principale 
ou secondaire 
INSTITUT FRANÇAIS 
DE CULTURE HUMAINE 
Etablissernent privé d'enseignement à distance 
29, rue Tronchet 
75008 PARIS 
\ (Tél. : 265-50-82) 
Informations à nos bureaux 
ou par correspondance 
SAS 
PARIS - 27/4 - Applications 
de la psychotechnique 
PARIS - 11-12/5 - L'angoisse 
de mort 
LYON - 11-12/5 - Relaxation 
psychosomatique 
LILLE - 18-19/5 - Sensibilisation à 
la grapho et morphopsychologie 
Nom : 
Profession : 
Adresse : 
———————————.—.…— 
demande une documentation gratuite sur votre en 
seignement 
O1 cours oraux 
O cours ecnts 
OÙ stages et seminaires 
cocher la ou les cases de votre choix 
43 "
39,40,"- Vous sr ste 
dir = SPA TA TT + \' at NINZN Î 
! 
ox À LC LAN 
= LA 
LA \ 
\ 
“ OS: A LS 
pes GR RENT "
40,41,"Ce n'est pas sans une certaine coquet- 
terie que, pendant trente ans, Freud 
a cultivé l'amitié d'Oskar Pfister, pas- 
teur et psychanalyste. Pour ce positi- 
viste athée, il devait y avoir quelque 
ironie à dialoguer viva voce ou par 
lettres avec un «homme de Dieu», 
même si celui-ci ne ressemblait en 
rien à ces clercs qui, au nom de leur 
foi, lui reprochaient hargneusement de 
tout corrompre, de tout salir, de ba- 
fouer les valeurs les plus sacrées de 
notre civilisation. 
Pfister ne ressemblait pas non plus 
aux autres psychanalystes. Anna Freud, 
qui n'avait que treize ans lors de la 
première visite du pasteur Pfister à son 
père, a écrit plus tard combien dans 
leur maison, où toute vie religieuse 
était absente, Pfister, en habit ecclé- 
siastique et avec sa mine et son com- 
portement de pasteur, était une appa- 
rition d'un monde étranger. « En lui, 
se souvient-elle, il n'y avait rien de 
cette attitude, passionnée et impa- 
tiente à l'égard de la science, propre 
aux autres pionniers de l'analyse qui 
considéraient le temps passé autour de 
la table familiale comme une interrup- 
tion intempestive de leurs discussions 
théoriques et cliniques. Au contraire, 
sa chaleur et son enthousiasme pleins 
d'humanité, sa propension à prendre 
aussi un intérêt vivace aux petits évé- 
nements quotidiens enchantaient les 
enfants de la maison et en faisaient 
à tout moment un visiteur bienvenu, 
une figure humaine unique en son 
genre. » 
EEEEEEEEEEEE—————………— 
POUR RÉPONDRE AU DÉSARROI 
DE SES PAROISSIENS 
EEEEEE———…—……——— 
Mais cette séduction était réciproque. 
Pfister, lors de ses séjours à Vienne, 
avait trouvé en Freud plus qu'un 
maître: un pater familias ; et, d'em- 
blée, il avait adopté cette famille 
Freud. «Pour moi, écrit-il, qui avait 
grandi sans père! et souffert ma vie 
durant d'une éducation unilatérale et 
trop indulgente, ce fut un éblouisse- 
ment que de voir la beauté de cette 
vie familiale qui, en dépit de la gran- 
deur presque inhumaine du chef de fa- 
mille et de son profond sérieux devant 
la vie, respirait la liberté et la joie, 
grâce à son amour et à son humour 
sans cesse Jaillissant. » 
Oskar Pfister — qui est mort en 1956 
— a vu le jour à Zurich, le 23 février 
1873. Zurich était alors, avec Vienne, 
le lieu où s'élaboralt la psychologie de l'inconscient. Aussi n'est-il guère éton- 
nant que ce jeune pasteur qui, dans 
l'un de ses premiers essais, avait pro- 
testé contre «le péché d'omission de 
la théologie actuelle envers la psy- 
chologie », ait été sensible aux travaux 
et aux recherches que quelques psy- 
chiatres zurichois, dont Bleuler, Jung et 
Riklin, menaient au Burghôlzli, ce 
temple de la psychiatrie helvétique. 
«Le péché d'omission de la théolo- 
gie actuelle envers la psychologie » : 
la formule est frappante et juste. Elle 
éclaire la démarche du pasteur Pfister ; 
elle explique le long cheminement qui 
l'a poussé à devenir l'un des propa- 
gandistes de la psychanalyse. Mais 
c'est surtout le désarroi de ses parois- 
siens, que sa seule qualité de pasteur 
d'âmes? ne parvenait pas à soulager, 
qui l'a conduit à se fraver une voie 
jusqu'aux sources inconscientes et à 
demi conscientes des états anxieux, 
des scrupules et des obsessions. 
""UN DIALOGUE PROFOND 
ET RESPECTUEUX 
psychanalyse est l'une 
des idéologies dominantes de notre 
temps; elle imprègne fortement jus- 
qu'à son langage ; aussi a-t-on quelque 
difficulté à imaginer le courage et la 
force de caractère nécessaires, au dé- 
but de ce siècle, pour s'intéresser à 
la « science juive ». Pour les contem- 
porains du pasteur Pfister, se ranger 
sous la bannière analytique était signer 
un pacte avec le diable, compromettre 
— et parfois irrémédiablement — leur 
réputation, leur situation sociale ou 
leur carrière. 
La première rencontre entre Freud et 
Pfister remonte au printemps 1909. Par- 
rainé par Carl Gustav Jung, Pfister se 
rend à Vienne le dimanche 25 avril. 
Freud, selon son habitude, l'emmène 
au parc du Belvédère pour une pro- 
menade, Intrigué sans doute par cet 
interlocuteur peu banal, se réclamant 
de convictions religieuses qui lui sont 
totalement étrangères, et néanmoins si 
réceptif à la psychanalyse. Probable- 
ment, lors de cette promenade, lui 
a-t-il tenu ce propos qu'il glissera éga- 
lement dans sa correspondance, à sa- 
voir que la psychanalyse n'est pas plus Aujourd'hui, la 
——— 
1, 1 avait trois ans lorsqu'il perdit son père. Freud, de seize ans son aîné, à pu jouer le 
rôle de père substitulif. 
2, En 1902, il fut attaché à la paroisse des prétlicateurs à Zurich, où il restera en fonc- lion jusqu'à sa retraite en 1939."
41,42,"religieuse qu'irréligieuse : « C'est un 
instrument sans parti, que peuvent uti- 
liser religieux et laïques, pourvu que 
ce soit uniquement au service de la 
délivrance d'êtres souffrants. » 
Pfister, vingt ans plus tard, le rap- 
pellera à Freud, lorsque ce dernier lui 
confiera son intention de protéger l'ana- 
lyse à la fois contre les médecins et 
contre les prêtres: «Et vous avez 
vous-même mis l'accent sur le fait que 
l'analyse est indépendante de toute 
conception du monde... » : 
En ce bel après-midi dominical 
s'amorce donc un dialogue qui se pour- 
suivra jusqu'à l'Anschluss et l'exil 
londonien de Freud, dialogue qui sera 
interrompu pendant la Première Guerre 
mondiale, et dont subsistent, témoi- 
gnages irremplacçables, les lettres de 
Freud 3, la plupart de celles de Pfister 
ayant été détruites sur sa demande. 
Dans cette correspondance, et à tra- 
vers le pasteur Pfister, c'est encore le 
dialogue de Freud avec la religion, cette 
figure tenace et apparemment irréduc- 
tible de l'illusion, qui se poursuit. Rien 
d'étonnant, par conséquent, à ce que 
son point culminant soit la publication 
de «l'Avenir d'une illusion » (1927) et 
la réponse de Pfister: «l'Illusion d'un 
avenir » (1928). 
«ll n'y a guère de danger que vous 
vous présentiez au baptême ou que je 
saute à bas de la chaire », écrit Pfister 
à Freud en 1928. Sa fermeté, sa rigueur, 
Sa fidélité à la psychanalyse, son refus 
de concilier dans un syncrétisme dou- 
teux herméneutique* freudienne et herméneutique chrétienne en ont im- 
posé à Freud et l'ont réjoui. Ce sont 
ces qualités qui ont permis leur dia- logue, admirable de respect et de pro- 
fondeur. A lire ce qui en subsiste, on voit que la psychanalyse, si elle ne rend pas’ (nécessairement) les hommes meil- 
leurs, les rend du moins plus aptes à s'entendre et, par là même, à se com- prendre et à s'estimer. 
UNE MÊME ‘CONCEPTION 
RATIONALISTE 
DE L'INCONSCIENT 
Quelle image du pasteur Pfister trans- paraît à travers sa Correspondance ? Si le terme n'était pas galvaudé et s'il avalt encore un sens, nous dirions celle d'un homme de bien. D'un homme confiant en la nature humaine, altruiste, guidé par des idéaux élevés, naturel- lement bon. Mais Ja vertu est-elle compatible avec l'analyse ? Dans sa lettre du 5 juin 1910, Freud, critiquant un article de Pfister, lui écrit: « Je Pense donc que (votre travail) souffre du mal héréditaire de. la vertu : il est l'œuvre d'un homme trop comme il faut, qui se croit donc aussi tenu à Ja discrétion. Or, ces choses psychana- lytiques ne sont compréhensibles que Si elles sont relativement complètes et détaillées, tout Comme l'analyse Les 
grandes dates 
d'une vie 
1873 : naissance à Zurich. 
1909 : essai intitulé « Délire et 
suicide des étudiants ». 
25 avril 1909 : première 
rencontre avec Freud. 
1920 : publication des « Bases 
psychologiques et biologiques 
de l'expressionnisme en art ». 
1928 : publication de 
« l'Tllusion d'un avenir » (en réponse à l'ouvrage 
de Freud : « l'Avenir 
d'une illusion »). 
1956 : mort à Zurich. elle-même ne marche que si Je at 
descend des abstractions Substitutiy jusqu'aux petits détails, 1] en résulss 
que la discrétion est incompatible ae 
un bon exposé d'analyse: ;] faut te 
sans scrupule, s'exposer, se livrer en pâture, se trahir, se conduire Comme un artiste qui achète des couleurs avec l'argent du ménage et brûle lent 
les meubles pour chauffer le modèle. Sans ces actions criminelles, on ne Peut rien accomplir correctement. » 
Rien de criminel, rien de démoniaque chez ce « cher homme de Dieu », D'où il résulte sans doute que, à l'opposé de Freud, de Ferenczi, d'Abraham ou de Jones, il n'a pas laissé une Œuvre mais plutôt des ouvrages de Vulgari. sation ou d'hygiène mentale, rédigés à l'adresse de lecteurs croyants 5. Et si, dès 1908, il pratique des Cures analytiques, ce n'est pas à des fins strictement thérapeutiques ou Scient- fiques, mais morales. Dans «la Psy. 
chanalyse au service des éducateurs ». il écrit: « On le voit, la tâche de la psychanalyse n'est rien de moins que la reconstruction morale des êtres dont le développement normal a été entra- vé par l'inconscient. » 
Avec Freud, il pense que  l'in- conscient, c'est le mal en nous et que le grand mérite de la psychanalyse 
est Sa vertu purificatoire : dire le mal, c'est s'en libérer. « Combien de reli gieux, écrit-il encore dans le même 
ouvrage, m'ont avoué que la pensée de 
Dieu les aidait durant l'analyse. La seule 
assurance que Dieu favorise les 
hommes droits, que la vérité est tou. 
jours, en définitive, un bienfait, le men- 
Songe toujours une entrave à la vie, 
stimule la volonté à une confession 
libre. » 
Ce que Freud et Pfister ont en com- 
mun, c'est une certaine conception ra- 
tionaliste de l'inconscient: ni l'un ni 
l’autre ne sont vraiment sensibles à sa 
poésie (d'où l'amour malheureux des 
surréalistes pour Freud: on sait qu'il 
les trouvait fous «à 95% comme on 
dit de l'alcool»; à Pfister, il écrit: 
« Sachez, en effet, que dans la vie je 
Suis terriblement intolérant envers les 
fous, n'y découvre que ce qu'ils ont 
de nuisible... »). L'entreprise psychana- 
lytique, pour eux, est avant tout une 
démarche de la raison pour élargir son 
royaume et jeter l'éclat de la connais 
sance sur les ténèbres de l'irrationnel. 
D'où leur commune opposition à Jung, dont Pfister parle en termes trés 
durs: «Ces “interprétailleries” qui 
présentent toutes les  immondices 
- d 3. Voir Correspondance de Sigmund, and avec le pasteur Pfister, traduit de Laer (Pa- par L. Jumel, préface de Daniel Widlôche ris, Gallimard, 1966). jenes 4. Théorie de l'interprétation des Re. Comme éléments symboliques d'une Ua Psy- 5. De Pfister, on peut lire en français gs (tra chanalyse au service des éducatet e du 
duction de P. Bovet ; Berne, 1921) tra- vieil Evangile par un chemin nouvel 
duction de H. Malan ; Berne, 1919) "
42,43,"comme Une marmelade spirituelle d'un 
enre élevé, toutes les perversités 
D omme des oracles et des mystères 
sacrés et Introduisent frauduleusement 
un petit Apollon et un petit Christ dans 
les âmes les plus biscornues ne valent 
rien, » Et dans « la Psychanalyse au ser- 
vice des éducateurs », Sans citer Jung, 
mais visant Ses théories, Il écrit: « De 
prétendus analystes se sont tellement 
éloignés du vrai sens de l'analyse 
qu'ils se sont perdus dans un vrai 
culte de l'inconscient, rejetant la criti- 
que de l'intellect comme un rationa- 
lisme vide. » 
UN ESPRIT POSITIF 
AU ROYAUME DES OMBRES 
Le pasteur Pfister est un esprit posi- 
tif; ce n'est pas un mystique. S'il 
descend dans le royaume des ombres, 
c'est pour y détacher les âmes enchaï- 
nées: il y a un esclavage de l'in- 
conscient, et c'est à libérer ceux qui 
ont recours à lui que le psychanalyste 
doit s'employer, qu'il soit croyant ou 
athée. Sur ce point encore, Pfister 
adopte la position de Freud: l'analyse 
est une affaire purement « séculière ». 
Aussi, dans bien des cas, ajoute-t-il, 
je n'ai pas dit un mot de la religion : 
«Le bon Samaritain, lui non plus, ne 
faisait pas de sermons, et ce serait 
d'un goût douteux que de faire payer 
une cure couronnée de succès après 
coup, par l'engagement de croire. » 
Pourtant, et là Pfister s'éloigne de 
Freud, certains patients éprouvent au 
terme de leur analyse le besoin d'une 
réflexion éthique. C'est alors au « Seel- 
sorger » (terme qui revient fréquem- 
ment dans la correspondance et que 
l'on pourrait traduire par « conseiller 
spirituel ») d'intervenir. 
Freud, à ce propos, lui fera observer 
deux choses : d'abord que la psycha- 
nalyse repose sur la conception scien- 
tifique générale du monde, avec 
laquelle la conception religieuse reste 
incompatible, qu'elle se réclame des 
idéaux du Christ, de Bouddha ou de 
Confucius : ensuite que semblable pro- 
blème ne se pose pas à Vienne où 
« notre clientèle, quelle que soit son 
origine raciale est irréligieuse ; nous 
le sommes aussi, pour la plupart, de 
façon tout à fait radicale, et comme les 
autres voies de sublimation qui nous 
tiennent lieu de religion sont trop pé- 
nibles pour la majorité de nos patients, 
notre cure débouche le plus souvent 
Sur la recherche de la satisfaction ». 
Dans la même lettre, Freud avoue, 
non sans ironie, envier le pasteur 
Pfister de pouvoir amener ses jeunes 
patients à la forme la plus commode 
de sublimation, la sublimation reli- 
gieuse, et de pouvoir conduire le trans- 
fert jusqu'à Dieu, « rétablissant ainsi 
ces temps bénis — du moins sur ce 
point — où la foi religieuse étouffait 
les névroses ». Cependant, dans «l'Avenir d'une 
illusion » qui s'adresse à un Interlocu- 
teur invisible qui n'est autre que le 
pasteur Pfister, Freud écrit: « Pensez 
au contraste attristant qui existe entre 
l'intelligence rayonnante d'un enfant 
blen portant et la faiblesse mentale 
d'un adulte moyen. Est-il tout à fait 
impossible que ce soit justement l'édu- 
cation religieuse qui soit en grande 
partie cause de cel étlolement ? » 
Le dialogue entre psychanalystes et 
croyants est le plus souvent un dia- 
logue de sourds ; aux critiques que le 
psychanalyste formule contre la fol, le 
croyant répond: «Notre religion est 
une religion d'amour et ce que vous 
visez n'en est, hélas! que la sinistre 
caricature Quant à la morale chré- 
tienne que vous observez chez nos 
contemporains, et dont vous dénoncez 
justement l'aspect malsainement ‘“sur- 
moîïque 6”, il est bien évident qu'elle 
est étrangère aùü Nouveau Testament 
et à l'enseignement du Christ, ce fou 
d'amour. » 
Et, lorsque Freud demande pourquoi 
la psychanalyse n'a pas été créée par 
l'un de tous ces hommes pieux, pour- 
quoi il fallut attendre que ce fût un 
juif tout à fait athée, Pfister a beau 
jeu de lui répondre : « Eh mais, parce 
que la piété ne fait pas encore le 
génie de la découverte et que les 
hommes pieux n'étaient pour la plu- 
part pas du tout dignes d'accomplir 
une telle tâche. Et puis, d'ailleurs, pre- 
mièrement vous n'êtes pas juif, ce qui, 
étant donné mon immense admiration 
pour Amos, Isaïe, Jérémie, le poète de 
Job et l'Ecclésiaste, me fait beaucoup 
de peine et, deuxièmement, vous n'êtes 
pas un athée, car quiconque vit pour 
la vérité vit en Dieu, quiconque lutte 
pour la libération de l'amour est, selon 
Jean, 1V-16, dans le sein de Dieu. Si 
vous éleviez et ressentiez jusque dans 
votre conscience votre Insertion dans 
de larges ensembles, insertion qui, 
pour mol, est aussi indispensable que 
la synthèse des notes pour qu'il y ait 
symphonie de Beethoven, je dirais aus- 
si de vous: “Jamais il n'y eut meil- 
leur chrétien...” » 
Il est souvent plus difficile de 
convaincre un chrétien que l'on est 
athée que de plier une barre de fer ! 
UE ———————— 
UN DIALOGUE DE SOURDS 
SUR LA RELIGION 
EEE …… 
En écrivant «l'Avenir d'une illusion », 
Freud ravivait une opinion très répan- 
due dans sa jeunesse, mais qui, à cette 
époque, n'était plus autant d'actualité. 
Freud résume sa pensée dans une 
lettre de janvier 1927; il s'y exprime 
en fidèle disciple d'Auguste Comte : 
« Secrètement — on n'ose pas le dire 
à haute voix — je pense que la méta- 
6. Allusion au surmoi de la topique freu- 
dienne composée du ça, du moi et du sur. 
moi. TRAITÉ DE PSYCHOLOGIE APPLIQUÉE sous la direction de 
Maurice REUCHLIN 
1/les applications 
21les méthodes 
3/travailleurs et 
systèmes techniques 
4 travailleurs et emplois 
5 / l'éducation 
6 / les institutions éducatives 
7 ! diagnostic des handicaps 
et rééducation 
8 / applications médicales 
9 / psychologie sociale 
10/la psychologie 
appliquée 
à la vie quotidienne : 
économie - art 
habitat - automobile 
2 2 OS EE CS En CI CS Eu © En © 
BON À RETOURNER 
à votre libraire habituel 
ou à la librairie générale des 
Presses Universitaires de France 
49 Bd Saint-Michel 75005 Paris 
M., Mme, Mlle..................... 
PLÉNOM.....e.seeecseseessess.se. 
Adresse 
Commande franco de port les volu- 
mes cochés du Traité de Psychologie 
Appliquée. 
Q t.1: 26,20 F [1] t.2:40,00 F [1 t.3: 
38,70F Ojt.4: 2600F CJt.5: 2490F 
[1 t.6: 35,00 F (1 t.7: 36,50 F DJ t.S: 
29,80 F O3 t.9: 34,55 F (1 t.10:42,00F 
Règlement joint: mandat-lettre, chè- 
que bancaire ou virement postal 
(3 volets). 
Date et signature: 
Du"
