,page,text
0,1,"MNaISSance POTRES 
Le FR. ; au s 
poire i ——— = J 
idéesiriquess Lan 
où © 20 ansz # 
6 4 be cs { 
rt 
Es Î 
! 
j "
1,2,"$ 47 CRT L rit 94 ue Y 
AE. me une Guire conception 
au lecieur Si vous vous souciez avant tout de connaître et comprendre votre époque, votre société, alors vous n’avez pas le choix : le NOUVEL OBSERVA- TEUR est VOTRE HEBDOMADAIRE, et il est e seul. 
Dans tous les domaines, politique, économie, affaires sociales, manifestations culturelles, le NOUVEL OBSERVATEUR vous informe les pre- miers de ce que vous devez savoir, vous apporte tous les éléments qui vous permettent de vous for- ger une opinion : la vôtre, pas la nôtre. Pour les journalistes du NOUVEL OBSERVATEUR, c’est ce qui Importe avant tout : votre liberté, Evidem- ment, elle peut se manifester par des lettres de protestation, où de mise au point ; c’est un signe de vitalité et pour vous et pour notre journal. . Le NOUVEL OBSERVATEUR, Pour vivre mueux, même si c’est moins confortable. 
LE NOUVEL OBSERVATEUR, CHAQUE SEMAINE, ANALYSE L'ACTUALITE. 
Pour un surcroit de conscience, pour vivre en toute connaissance de cause les événements qui dé- l ù u l crminbnt n tre existence. 
NOUS GVONS ina ee Pévén ce SN EEE 
FR ROUTE CRE 
Lorsque l’événement survient, il est souvent 
—trop-tard : trop tard pour le comprendre, trop tard 
pour réagir efficacement. LE NOUVEL OBSER- 
VATEUR s’est fait un devoir d’informer ses lec- 
teurs de ce qui se prépare secrètement, de ce qui, 
aujourd’hui, passe inaperçu de tous, mails pe 
demain connaîtra un retentissement considérable. 
Lire régulièrement le NOUVEL OBSERVA- 
TEUR, c’est assister à la naissance et au dévelop- 
pement de l’événement. C’est même, souvent, Er ticiper directement à sa révélation : combien de ai 5 
essentiels seraient restés dans l’ombre sans. R 
journalistes et les lecteurs du NOUVEL OBSER- 
VATEUR ! 
Pour profiter de l'offre ex- 
ceptionnelle réservée aux 
lecteurs de psychologie, 
découpez le bon ci-contre 
et retournez-le dès aujour- 
d'hui au : 
ODSCnateur 
11, rue d'Aboukir. 75081 PARIS. Cedex 02 
="
2,3,"LS) RER À VAS 
comprendre, savoir agir dans le monde d'aujourd'hui DenE 
Avril 1974 - 7 F- N° 51 
Enfance, adolescence 7 L'éducation des enfants en U.R.S.S. 
Mieux adaptée que la nôtre à la civilisation moderne ? 
par Geneviève Jurgensen 
Psychologie du comportement 15 L'habit fait le moine 
Une série d'expériences en apporte la preuve 
par Leonard Bickman 
Psychologie expérimentale 19 Le déclin de l'intelligence dans le 3° âge 
Une idée reçue qu'il faut dénoncer 
par Paul B. Baltes et K. Warner Schaie 
Notre société 27 Les suicides dans les prisons 
Une épidémie qui force à réfléchir 
par Pierre F. Moreau 
En bref 31 Grande-Bretagne 
“A Notre époque 33 Dossier Japon 
 — 33 Les Japonais sont-ils des Martiens ? 
)! 39 Entretien avec Hiroshi Minami, 4 a professeur de psychologie à l'université de Tokyo 
par Jean Chaguiboff 
En bref 40 Canada 
Un personnage extraordinaire 45 Oskar Pfister 
.Un pasteur chez Freud 
bar Roland Jaccard 
Les tests 51 La guerre du QI. 
Entre Blancs et Noirs, les différences sont réelles 
par Arthur' Jensen 
En librairie 62 « Groupes de rencontre marathon » (J. Durand-Dassier) 
« L'Inégalité des chances » (R. Boudon) 
« Psychanalyse à Vienne » (J. Wortis) 
Les autres parutions 
En bref 66 France 
Who's who 71 dans « Psychologie » 
Le prochain numéro sera mis en vente le 2 mai 1974 
EST EDITE PAR LE CENTRE D'ETUDE ET DE PROMOTION DE LA LECTURE POUR VOU À. ChaMPs- “ELYSEES 75008 PARIS - 359.86.50 et 225.02.88. $ ABONNER n ns 7 n ar] ‘ti RORRATR Q et + VOYEZ PAGE 72 
CT PTE TE RE CE CE CA UE ET LE CET ENS EEE RTE TE TR ER TERRES TT "
3,4,"0000 p% 
: 
“oo 
ar, AUS 
: HS 
e9.0 
0 
0 6.6:9 
#40 
09 
©. 
o & of"" A == — — "
4,5,"enfance , aclolescence 
L'ÉDUCATION 
DES ENFANTS 
EN URSS par Geneviève Jurgensen 
Urie Bronfenbrenner est un professeur de psycho- 
logie américain qui a poursuivi des recherches à 
l'Institut de psychologie de Moscou, afin de compa- 
rer l'éducation des enfants dans chacune des deux 
cultures. C'est une partie du résultat de ces 
recherches qu'il nous donne dans un livre intitulé 
« Enfants russes, enfants américains », qui vient 
de paraître en français aux Editions Fleurus. Cet 
Ouvrage a le mérite de nous confronter à deux 
Philosophies d'éducation, très simplement et 
Concrètement présentées, à un moment où nous- 
mêmes, Français, nageons dans l'incertitude en ce 
Omaine. 
Le inonde soviétique sernble avoir mieux résolu 
que le monde occidental les problèmes éducatifs posés 
Par la civilisation moderne. (Illustration Daniel Sinay) TE CZ #8 : Be 
ll suffit de feuilleter les revues, spécialisées ou 
non, pour se rendre compte que, en matière d'édu- 
cation, parents et éducateurs professionnels 
oscillent confusément entre leur désir d'abandon- 
ner les schémas anciens (déverser son savoir sur 
l'enfant comme s'il était une boîte vide) et leur 
regret de voir l'enseignement et l'éducation déva- 
lorisés (plutôt que remis en cause) au point 
qu'éducateurs et enfants ne font plus que res- 
sentir leur malaise réciproque. Et si les initiatives 
personnelles restent fréquentes, elles ne rencon- 
trent que peu ou pas d'écho au ministère de 
l'Education nationale. 
On peut, dès lors, se demander si l'ambivalence 
de chacun devant la conduite éducative à tenir 
n'est pas le reflet de l'ambivalence devant le 
choix de la société à construire : si l'on ne sait"
5,6,"PARLEMENT PAU AUTRES EE EU LE 
‘enfant devienne, 
pas quel adulte on veut que L non ? 
comment saurait-on penser son uvent pas ce 
Visiblement, les Soviétiques M raide de Bron- 
désarroi, du moins si l'on en croit l'êt LGAINS ». 
fenbrenner, « Enfants russes, enfanté ne EE, 
qui vient d'être publiée et qui est or Toutefois, 
chie d'extraits de textes soviétiques D SbUrS 
ses remarques sont prises Sur le terra Fa Villes 
de longs séjours dans Îles principa sance 
d'URS.S., et non à partir de Codes es 
livresques : en effet, sept voyages Union sovié- 
mené ro ne d er sa fan e observé adultes tique, entre 1960 et 1967. La, d'enfants, écoles, 
et enfants en crèches, jardins den nets 
jardins publics et autres espaces ouver x 
arents dt aux enfants. En outre, les rencontres El 
ont pu se produire entre Sa Propre famille el ges 
familles russes ont inspiré à l'auteur quelq 
réflexions. TT ——————— 
UNION SOVIÉTIQUE, . 
L'ALLAITEMENT MATERNEL EST LA RÈGLE 
Très naturellement, Bronfenbrenner ouvre son 
récit par une description du comportement des 
mères avec leurs tout-petits, et il remarque que 
l'allaitement maternel est fortement recommandé 
et très couramment pratiqué (les Etats-Unis et la 
France, de leur côté, mènent campagne pour l'allai- 
tement maternel, mais c'est un courant trop récent 
pour qu'il soit encore largement suivi). Parallèle- 
ment à cela, on observe en Union soviétique des 
contacts physiques plus fréquents entre la mère 
et son enfant: elle le tient longuement dans 
ses bras et le transporte ainsi serré contre elle, 
lui procurant un maternage plus intense, tout en 
le privant d'une autonomie dont jouissent les bébés 
occidentaux; pour les enfants qui ne sont plus 
des nourrissons, on retrouve ce même souci de 
les tenir au chaud et à l'écart du danger dont les 
adultes se savent les meilleurs protecteurs : c'est 
ainsi que, dans un square, lorsque les deux enfants 
de l'auteur, pourtant âgés de quatre et neuf ans, s'éloignaient un peu de leurs parents, il se trouvait toujours un passant russe pour les leur ramener, avec quelques commentaires réprobateurs. On voit ainsi que l'éducation, en U.R.S.S. n'est pas une affaire privée, familiale, mais qu'elle est la respon- sabilité de tous les adultes qui, d'ailleurs, s'ils ne se privent pas de réprimander quand bon leur semble les enfants des autres, les maternent éga- lement à l'occasion: il n'est pas rare, en effet, de Voir dans un autobus une maman russe poser tout naturellement Son fils sur les genoux de son Voi- sin, que l'enfant appelle spontanément « tonton » OU « tata ». Et il en va de même pour les plus grands enfants, qui se montrent très chaleureux avec les plus jeunes auprès desquels ils jouent ouvertement le rôle d'aînés. Cela étant, la discipline et l'obéissance sont de règle générale dans les familles, où les jeunes sont destinés à obéir plus tard à l'Etat socialiste. Mais obéir ne suffit Pas: cette notion implique une attitude passive en total désaccord avec l'idéal faut au contraire que l'enfant 
reprenne à son COMpÉe le, désir des adultes, en 
d'autres termes qu'il , im £ e» pour s' 
conformer non plus en 0 jet passif, mais en sujet 
actif: en somme, la tâche ces. qnés consiste à 
inculquer le sens de l'auto CP ine aux cadets 
et l'obéissance devient ainsi le meilleur moyen 
dont dispose l'enfant pour témoigner son amour 
à ses parents, puisqu aux yeux de ceux-là elle 
représente la valeur suprême. 
Mais il convient d'examiner plus attentivement 
cette notion d'obéissance, afin de ne pas tirer de 
conclusions hâtives sur le système d'éducation 
russe, en particulier quant à ce que nous, occiden. 
taux, aurions tendance à appeler « autoritarisme ». 
En effet, il faut noter en premier lieu que les pro. 
blèmes d'éducation suscitent le plus grand intérêt 
chez les parents soviétiques, qui S informent, se 
réunissent, assistent à des conférences, lisent les 
articles que la presse publie sur ce sujet, ete. : 
ils participent donc activement à l'établissement 
de la «morale éducative » qu'ils choisissent de 
prôner et à la recherche de moyens pour perpétuer 
cette morale. D'autre part, pour inculquer l'obéis- 
sance, les parents ne font rigoureusement jamais 
appel à la contrainte, mais toujours au raisonne- 
ment: les punitions corporelles sont stricte. 
ment bannies et, d'une manière générale, le sys. 
tème des punitions et des récompenses n'est pas 
utilisé, si ce n'est, à l'occasion, comme une tech- 
nique d'appoint. soviétique ; il 
LES PARENTS RUSSES N'HESITENT PAS 
À UTILISER LE CHANTAGE AFFECTIF 
Comment agissent alors les parents ? Ils exercent 
une pression sur les enfants d'une manière qui 
peut nous paraître retarder d'un demi-siècle: c'est 
une attitude moralisante telle que nos grands- 
parents en adoptaient, et les notions de «bien» 
et de «mal» ne sont pas remises en question. 
Les adultes désapprouvent ouvertement l'enfant et 
ne Se soucient pas de le voir se disculper, car les 
motifs qui l'ont poussé à se conduire « mal» n'im- 
portent pas: on retrouve donc, là encore, une 
différence fondamentale avec les pays occidentaux 
influencés par les apports de la psychanalyse e 
de la psychologie infantile. Pour les parents SOVIÉ- 
tiques, ce qui compte, c'est que l'enfant n€ recommence pas ; pour appuyer cette volonté, ils 
retirent ou feignent de retirer momentanément leur 
affection à l'enfant pendant un temps qui varié 
avec la gravité de la faute commise : ils ne SOU 
rient plus, se montrent fâchés et utilisent, en Somme, ce que nous appelons le « chantage affec” tif ». Père et mère adoptent exactement la Même attitude, l'un ne se liguant jamais contre l'autrê avec l'enfant fautif. l Cette cohésion entre les parents existe égale ment, d'une manière plus générale, entre tous lES 
aînés et entraîne une cohérence dans l'attitude éducative des adultes à travers toute l'Union SOVié tique, attitude qui prépare fort bien l'enfant à accepter l'éducation qu'il recevra dans les institu- "
6,7,"ME COR ILU TS D LCA VO US ES LA LA VELO ENS 
tions collectives. Car la grande majorité des balle des mains de son voisin, en utilisant d'em- femmes russes travaillant, elles sont donc ame- nées à confier l'éducation de leurs enfants, en partie du moins, à des éducateurs professionnels. Citons quelques chiffres : 
— Plus de 10% d'enfants de moins de deux ans sont confiés à une crèche : 
— Plus de 20 % d'enfants de trois à six ans sont confiés à des établissements préscolaires : — Plus de 5% des enfants d'âge scolaire (à par- tir de sept ans) sont confiés à des internats ou à des « écoles de journée continue » (ils reviennent 
alors chez eux le soir pour dormir). 
Mais les parents ne placent jamais les enfants dans ces établissements par Simple souci de com- modité ou «parce qu'ils ne peuvent pas faire autrement» (cette dernière réponse étant celle que l'on obtient le plus souvent des mères fran- çaises qui placent leur enfant à la crèche dans la journée ou à la maternelle dès l'âge de deux ans); ils le font quand ils considèrent en conscience que la nature de leur travail ne leur permet pas de fournir à leur enfant l'éducation considérée par eux comme souhaitable. Dès lors, on voit tout de suite que les relations entre les parents et les éducateurs professionnels s'établi- ront Sur un mode foncièrement différent de celui que l'on observe en France, et que la coopération et la cohésion seront sans faille entre les parents et le personnel des établissements. a ———————"" 
EN RUSSIE, L'ACCENT EST MIS 
TRES TOT SUR LA VIE COLLECTIVE 
Les tout-petits (enfants âgés de moins de un an) doivent tout d'abord s'accoutumer à la vie collec- tive ; on observe en particulier que, contrairement à l'habitude occidentale, plusieurs enfants sont mis dans le même parc. D'autre part, les puéri- cultrices s'attachent Systématiquement à dévelop- per les fonctions sensori-motrices en encourageant le développement des cinq sens grâce, par exem- ple, à des objets de couleurs vives, à des objets musicaux. Il faut également souligner que, dès cet âge, l'accent est mis sur l'idée de responsabilité : l'âge de la propreté tourne autour de dix-huit mois, alors qu'en France (bien que rien ne soit considé- ré comme une loi sur ce Sujet) les mères n'espè- rent pas, en général, que leur enfant soit continent avant deux ans et que les psychiatres d'enfants ne parlent pas d'énurésie proprement dite avant l’âge de cinq ans. A dix-huit mois également, les enfants Soviétiques commencent à apprendre à s'habiller seuls. 
Dès le début aussi, le développement du langage ESt attentivement surveillé et encouragé avec méthode: la puéricultrice nomme toutes ses propres actions, n'encourage pas le « langage Ébé », mais suit toutefois la progression sponta- née de l'enfant en lui faisant répéter les syllabes qu'il prononce de lui-même. Enfin, la puéricultrice se soucie d'inculquer le sens de la propriété Commune en favorisant le jeu collectif, en désap- Prouvant ouvertement un enfant qui arrache une blée la critique collective ; les enfants sont habi- tués dès leur plus jeune âge à voir juger à haute voix, devant tous et d'un point de vue collectif, 
les comportements de leurs camarades : ce sont 
les premiers pas vers l'autodiscipline qui permettra 
à l'adulte, peu à peu, de prendre de la distance 
Par rapport au groupe d'enfants. . Dès le début de leur seconde année en crèche, 
les enfants soviétiques savent donc mettre la table, nettoyer leur classe, déblayer la neige, 
s'occuper du jardin, à un âge auquel on ne demande 
encore rien de ce genre aux enfants occidentaux, 
qui sont élevés encore selon le principe de plaisir 
et qui commencent seulement à apprendre à diffé- rer leur désir de satisfaction immédiate. Ces responsabilités, qui sont considérées comme au- dessus des forces de nos enfants, développent chez les enfants russes un sentiment de confiance en eux-mêmes et le goût de la camaraderie. ——————— ————— 
EN UNION SOVIÉTIQUE, . , LE MÉTIER D'ENSEIGNANT EST TRÈS VALORISÉ 
L'âge scolaire, nous l'avons dit, commence à sept ans, Soit un an plus tard qu'en France. La rentrée Scolaire, qui a lieu à travers toute l'Union sovié- tique le 1* septembre, est une véritable fête natio- nale. Les enfants rentrent en classe les bras char- gés de fleurs qu'ils offrent à leur maître dont le travail est très valorisé, et toute la famille est présente pour l'événement. A la radio, dans la presse, on célèbre cette entrée des enfants dans leur nouvelle vie. Les enfants et leurs maîtres nourrissent des rapports où affection et respect se mêlent étroitement. lei encore, on ne peut que constater l'attitude foncièrement différente des adultes français, se répercutant ensuite sur les enfants qui cherchent continuellement, tout au long de leur scolarité, à « monter » leurs parents contre leur professeur et vivent (pour la plupart) leur relation avec leurs maîtres comme une relation d'inimitié et l'éducation, de manière générale, comme une contrainte plutôt que comme une for- mation. Contrairement aux enseignants russes, les enseignants français voient par ailleurs, et plus fortement encore dans les dix dernières années, leur profession se dévaloriser dramatiquement aux yeux de la population tout entière, ce qui, par réaction, entraîne une dégradation de l'ensei- gnement qu'ils dispensent. 
En URSS. le secret de la cohésion des adultes face à l'éducation des enfants semble bien résider dans leur absence d'ambivalence quant à Ja manière dont ils envisagent l'avenir de ces enfants ; les qualités à développer se conforment Strictement à la morale communiste, et on peut les résumer ainsi: sens du bon et du mauvais, loyauté, esprit Scientifique, bonne camaraderie, patriotisme soviétique et internationalisme prolé- tarien, application à l'étude, effort Pour contrôler Sa vie, appréciation esthétique de la nature, de Îla vie sociale, des œuvres d'art, hygiène corporelle, sport. "
7,8,"Il est bien clair maintenant que l'école, en 
U.R.S.S., ne se charge pas seulement d'enseigner 
la culture, mais plutôt de former la personnalité 
tout entière ; l'enfant y apprend la politesse envers 
les adultes comme envers ses camarades, le goût 
de la santé, du sens civique. D'autre part, les 
enfants voient leur jeunesse divisée en trois étapes 
qui remplissent des fonctions bien distinctes : 
— les Octobristes, de sept à neuf ans; 
— les Pionniers, de dix à quinze ans; 
— le Mouvement des jeunes communistes, de 
seize à vingt-huit ans. 
Les objectifs et les principes de ces organisa- 
tions forment un tout homogène avec les pro- 
grammes scolaires eux-mêmes, et chaque organi- 
sation a ses lois propres. 
DANS LE MONDE SOVIÉTIQUE, L'ÉQUIPE COMPTE PLUS QUE L'INDIVIDU 
Les enfants sont, selon un slogan, formés « dans, 
par et pour le collectif». Ainsi la compétition n'est-elle pas individuelle, mais collective ; le 
maître ne dit pas «tenez-vous droits», mais 
« voyons quel est le groupe qui se tient le mieux »; 
de sorte que l'enfant participe à sa propre promo- 
tion, mais plus encore à celle de toute son équipe 
à laquelle il doit d'ailleurs rendre des comptes 
au cas où il la ferait perdre. Au tableau sont affi- 
chés les résultats obtenus par chacune des 
équipes, dans un domaine ou dans un autre : jamais 
on n'y voit apparaître le nom d'un individu. Mais 
si c'est le maître qui fixe les critères au début, il est bientôt remplacé par un moniteur, respon- sable désigné dans chaque équipe parmi les enfants, et cela dès l'école primaire : l'enfant-moni- teur compte alors les bonnes et les mauvaises notes obtenues par son équipe dans un domaine quelconque, et l'équipe victorieuse est l'objet du respect et de l'admiration des autres. Ainsi l'en- fant grandit-il dans une morale foncièrement diffé- rente de celle que nous connaissons : il ne voit pas le moniteur comme un élément de répression, et quand un camarade fait constater à un membre de l'équipe qu'il n'a pas bien fait son problème mathématique, cela n'est pas vécu comme un “ Fagot», car l'enfant sait que ce camarade se proposera ensuite pour l'aider à mieux comprendre les mathématiques. Peu à peu, en classe de troi- Sième année, l'institutrice apprendra aux enfants que remarquer les lacunes de ses voisins ne suf- fit pas au bien de l'équipe : il faut aussi et surtout Savoir remarquer ses propres lacunes. Nous avons assez montré, je crois, la cohésion qui existe ainsi entre l'attitude familiale, l'atti- tude des éducateurs professionnels et celle des camarades. [] nous faut maintenant nous inter- roger sur les conséquences de cette harmonie entre ces trois mondes pour la formation de la personnalité de l'enfant. (Il est intéressant de noter au Passage que, pour les enfants occiden- taux, ce Sont bien les mêmes trois mondes qui jouent un rôle dominant dans son éducation, mais qu'il ne faut pas négliger d'y ajouter les mass 
Lo Ain 
ne NE Re hot - = 
ont dun Pi NN ———— media, dont Bronfenbrenner ne parle guère à h;c. 
pos des enfants soviétiques, sans doute Parce que 
ces mass media ne dérangent pas la Continuité 
dont il est question; mais c'est là une Simple 
supposition.) La première des constatations de 
Bronfenbrenner est que l'enfant soviétique appa. 
raît comme rarement délinquant : les conduites 
antisociales sont exceptionnelles et L agressivité 
ne se manifeste pas comme chez les jeunes Occi. 
dentaux. Elle est plutôt investie dans la curiosité scientifique et dans l'idéalisme collectif ; cela est d'autant plus logique que si les jeunes Occiden- 
taux trouvent en leurs camarades des auxiliaires 
empressés pour lutter contre tous ceux qui repré. 
sentent la loi, c'est l'inverse qui se passe pour 
l'enfant russe, puisque ses camarades sont des représentants de la loi au même titre que les 
adultes. D'autre part, le culte de la vérité est moins 
fort en U.R.S.S. que dans d'autres sociétés, parce 
que la vérité individuelle cède le pas à la vérité collective. 
Bronfenbrenner relate à ce sujet une expérience frappante : on présente aux enfants d'une même équipe deux bâtonnets de taille inégale, en leur demandant de désigner le plus grand. Mais on 4 pris soin, auparavant, de demander en secret aux premiers interrogés de fournir à haute et intelli- gible voix la mauvaise réponse: un sur trois des enfants suivants fournira alors, lui aussi, ]a mauvaise réponse, en faisant taire sa conviction intérieure. 
Enfin, pour clore ce tableau rapide de l'éducation des enfants soviétiques, il faut souligner que jamais le Parti n'a prétendu remplacer l'éducation familiale par l'éducation collective : simplement, et en premier lieu pour des raisons économiques 
(afin que les femmes puissent travailler), il a mis l'accent sur l'éducation collective plus que ne l'ont 
fait les pays occidentaux, et il a établi une grande harmonie entre les deux modes d'éducation. ——————— 
AUX ÉTATS-UNIS, LA FAMILLE A ÉCLATÉ SANS ÊTRE REMPLACÉE Aux Etats-Unis, si la famille conserve légalement Son rôle d'« élèver » les enfants, elle n'en a plus, en fait, les moyens, nom pas tant parce que les Parents veulent démissionner que parce qu'ils ÿ Sont contraints par les conditions de la vie, qui Ont considérablement changé depuis la dernière 
Juerre. La tribu familiale était plus importante alors, et avait son mot à dire sur la vie de l'en fant. Dans la rue également, voisins et passants VOUS connaissaient, vous reconnaissaient, Vous demandaient Pourquoi vous aviez manqué la messe le dimanche précédent, etc. Le contact avec les adultes était beaucoup plus fréquent qu'il ne l'est aujourd'hui dans les grandes agglomérations urbaines. Aujourd'hui, dans ces zones urbanisées: 
la famille se réduit à une cellule isolée autour de deux adultes. Le Voisinage est anonyme et noire PAS aux enfants l’occasion d'expériences JneTeles : par exemple, ils ne voient pas l'artisan dans l'exercice de son métier. Ils vivent dans Un 
(Voir suite de l'article p. 12) = sm PONT sn pm ue pe 
LADITE LE 
SIT 04 
ep Te S 
4 LL ne ES SE ae re eu pe) a. TL 7 er 
“È . "
