,page,text
20,21,"N groupe 
néricalns 
971, une 
éliminer 
rlorailon 
rm ces 
lon plus 
Y mation 
de pro 
l'innovs: 
Jontalre 
paration 
réallon 
ure ul 
fectées 
condi: 
rances 
ONNES 
s occl: 
:6510n- 
de la 
lation. 
jérons 
opsŸ 
fl de 
yê l 
âde. 
gtuel 
gsl 
15 8 
ss LE COUPLE, SES 
TRIOMPHES... SES ÉCHECS 
Dr G. Bazoilles 
éditions 
GUY DE MONCEAU 
Il aura fallu vingt siècles pour 
que l'amour physique ose exister. 
Mais les tabous, les interdits, le 
secret, ne tombent pas en un 
jour. Le livre du Dr Bazoilles 
nous apprend, surtout à connaître 
et à comprendre l'amour. Or, les 
médecins sont formels : c'est une 
méconnaissance totale d'’eux- 
mêmes qui conduit tant de cou- 
ples à la faillite. 
Sans fausse pudibonderie, mais 
sans choquer, ce livre nous ins- 
truit des réalités biologiques et 
des causes de ces « maladies >» du 
corps qu'on. appelle la frigidité, 
l'impuissance, l'incompréhen- 
sion, qu'il suffit souvent de bien 
peu de choses pour guérir. 
Aisé à comprendre, ce livre doit 
aider tous les jeunes couples. 
Il fait un sort à bien des préjugés, 
apporte des réponses claires à 
bien des questions, confirme que 
les corps ne chantent pas, si les 
cœurs Se taisent 
Ce n'est qu’un potit agenda de cuir noir, 8nonyme on apparence, mais il Peut changer la vie des fommas en les LE CALENDRIER CONCEPTIONNEL LA CONTRACEPTION 
AU SERVICE DE L'AMOUR 
Dr Lagrous Weill-Hallé 
Dr LAGROUA WEILL-HALLÉ . 
Commentaires sur 
la sexualilé par lo 
DTVALENSIN 
EDITIONS GUY DE MONCEAU 
Depuis quinze ans, une des plus 
grandes gynécologues françaises, 
le Dr. Lagroua Weill-Hallé, se bat 
pour que les femmes obtiennent 
le seul droit qui fera d'elles des 
êtres libres : le droit à la contra- 
ception. Écrit avec la collabora- 
tion du Dr Valensin, ce livre est 
un recueil de témoignages boule- 
versants. En trente-sept cas clini- 
ques observés sans préjugés, ni 
complaisance, deux spécialistes 
font le tour de la contraception. 
Car il n'y 8 pas une, mais des 
contraceptions. Ce livre sans fard, 
est un manuel d'éducation qui 
aborde tous les problèmes : celui 
du mari volage, du couple qui a dix 
enfants, de la virginité à la*dispa- 
rition du désir, de l'angoisse du 
cardiaque aux amitiés particu- 
lières… 
Ces confessions, qui, toutes, 
montrent mieux que de longues 
explications, que la contraception 
a une morale qui est de rendre à 
l'amour sa dignité et sa beauté. 
libérant de cetre terreur de la mater- 
nité qui 8 transformé tant de vies en 
enfer, et tué tant de couples à force 
d'enfants venus trop tôt ou trop vite. 
Pour celles qui ne veulent pas prendre 
la pilule, l’agenda M. O. est un calen- 
drier conceptionnel grâce auquel n‘im- 
porte quelle femme peut appliquer la 
méthode naturelle, découverte par les 
docteurs Ogino et Krauss. Il suffit de 
noter, chaque mois la date d’appari- 
tion des règles. Une simple marque 
graduée, contenue dans l'agenda, 
posée sur la page du mois correspon- 
dont indique, au premier coup d'œil, 
la période critique. La méthode de 
température, elle aussi expliquée dans 
ce cornet donne une sécurité supplé- 
mentoire à la méthode noturelle et doit 
compléter cette dernière pour les 
femmes dont les cyclos sont irrégu- 
liers, Épargnor à toutes les femmes la 
peur d’avoir des enfants contro leur 
volonté, mais aussi ot surtout, dos ris- 
ques inutiles, cost sans doute [a vraio 
victoire de lo contraception noturolle, L'AMOUR APRÈS 
QUARANTE ANS 
Dr Valensin-Dr Weill-Hallé 
L'AMOUR 
APRES 
EÙ ANS 
© LAGAGUA TL MALE O'YALINSDN 
Patent ny (5 oc 
Mme C... a quarante-sept ans. 
« Depuis trois ans, je vis un grand 
amour... » 
M. R... : «J'ai soixante-sept ans 
etme voici marié depuis une tren- 
taine d'années, mais mon amour 
pour elle n'a pas faibli., Je demeu- 
re fort empressé mais ma femme, 
bien qu'elle n'ait que cinquante- 
cinq ans, prétend que «ce n'est 
plus de notre âge». Ce ne sont 
que deux exemples choisis parmi 
Ces différents ouvrages sont en 
vente par correspondance ou à 
nos bureaux : Editions Guy de 
Monceau, 34, rue de Chazelles, 
Paris-1 7e. Tél, : WAG. 34-62. 
Modes de paiement : chèque 
bancaire, chèque postal C.C.P. 
67-47-57, ou timbres français. 
les dizaines de lettres, qui toutes, 
sont des appels. Les miroirs des 
angoisses de «ceux qui ne sont 
plus jeunes» et pourtant ne se 
résignent pas. 
À tant parler de la jeunesse, on 
oublie qu'elle n'est que le début 
de vies qui, souvent, sont bien 
longues. On ferme les yeux sur 
ces adultes qui, jamais, n’ont osé 
confier «leurs» problèmes. A 
l’âge où viennent les maladies, la 
lassitude, la solitude, qui les 
conseillera? Qui les écoutera? 
Le Dr Valensin l'a fait. Et il nous 
livre cette révélation : l'amour 
n'est pas l'apanage des adoles- 
cents et des jeunes couples. 
L'amour ne meurt jamais. Et s'il 
existe une jeunesse de cœur qui 
serait celle de nos artères et de 
nos muscles, il existe, aussi, pour 
ceux qui veulent bien la gar- 
der, une jeunesse du corps 
qui est celle de l'amour. 7 
Une jeunesse qui n'a TA? 
pas d'âge. T 
4 s 
e® n° ""4e 
er ee ef yo 4 A 
COR EN 
PR GO gt NE O6 SEXUELLE 
TECHNIK 
Dr Sha Kokken 
2 500 000 exemplaires, c'est le 
tirage atteint actuellement, en 
Angleterre, en Allemagne, dans 
les pays nordiques et naturelle- 
ment au Japon, du livre d’un des 
plus éminents sexologues de ce 
pays : le docteur Sha Kokken. Ce 
chiffre suffit à exprimer la néces- 
sité d’un tel ouvrage. 
Le sexe et sa technique, par le 
texte et par l’image. Le titre 
peut choquer. Il ne choquera que 
ceux qui n'ouvriront pas le livre 
du docteur Kokken. 
Pour la première fois, un médecin 
ose dire ce que chacun de nous 
devrait penser — on apprend tout 
aux hommes, sauf ce qui leur est 
essentiel, l'amour. Pourtant, que 
d'échecs, de drames, d'insatisfac- 
tions pour n'avoir pas admis cette 
évidence : il n’est pas possible, 
pour un amour vrai, de séparer ce 
qui vient du corps de ce qui vient 
de l'esprit. 
I a fallu sans doute bien du cou- 
rage et beaucoup de vraie simpli- 
cité au docteur Kokken pour réus- 
sir cette gageure : un livre qui 
met l'amour en images sans tom- 
ber à aucun moment dans la por- 
nographie. Les petites poupées du 
médecin japonais ne heurteront 
qui que ce soit. Elles ont la fran- 
chise et la fraîcheur de 
contes pour ces adultes J 
qui ne sont, trop 
Souvent, que des 
enfants de- sd 
vant l'amour J Pé "
21,22,"Eu ra 
k 
CA 
; £4, 
ee 
US$. 
» P£ 
pe: Ne à 
SP TAN EN 
4° À x C5 
F ; Lire + L/ , a“ 
#2, Nr RE ) 
He, MSN TE 
Ent "
22,23,"Les journaux d'une époque consti- 
tuent un bon document non seule- 
ment sur les faiis dont ils parlent, 
mais aussi (et peut-être surtout) 
sur les idécs, la mentalité, la 
bonne ou la mauvaise conscience 
collective de leurs lecteurs. Le 
lien qui unil le journal à son pu- 
blic est complexe: le journal 
« fait » l'opinion, mais il doit tenir 
compte d'une certaine masse 
d'idées reçues et de leurs change- 
ments, faute de quoi il ne sera pas 
« suivi». C'est pourquoi la pré- 
sence insistante d'un événement, 
ou d'un type d'événement, dans la 
presse indique souvent que l'opi- 
nion publique commence à se sen- 
tir concernée par des faits qui, 
jusque-là, la laissaient insensible. 
EN DÉPIT DE MULTIPLES 
PRÉCAUTIONS... 
Depuis deux ou trois ans environ, 
la presse accorde beaucoup plus 
d'importance qu'auparavant à ce 
qui se passe dans les prisons, et 
tout particulièrement aux suicides 
de détenus. On dirait que la 
France découvre qu'elle a un uni- 
vers pénitentiaire. Les communi- 
qués du Groupe d'information sur 
les prisons (G.I.P.) sont régulière- 
ment contestés par les pouvoirs 
publics, mais la discussion sur le 
nombre des suicides est déjà une 
reconnaissance de l'importance à 
la question. Il y a d’ailleurs de 
quoi réfléchir: quand on se rend 
compte qu'il y a une quarantaine 
de suicides effectifs par an dans 
les prisons françaises (sans comp- 
ter les tentatives), on se dit que 
les débats récents sur la peine de 
mort ne suffisent plus. Car quel 
sens peut-il y avoir à éviter l’exé- 
cution de un ou deux condamnés 
si c’est dix fois plus qui se don- 
nent eux-mêmes la mort parce 
qu'ils sont broyés par la machine 
pénitentiaire ou par leur senti- 
ment de solitude ? 
On peut discuter la part de res- 
ponsabilité directe de l'adminis- 
tration pénitentiaire. Certes, il y 
a les cas où la surveillance (ou la 
négligence) administrative rem- ———————— 
place les soins médicaux, comme 
le prouve une des réponses à une 
enquête du G.IP.: «Il y avait un 
gars qui n'allait pas du tout à 
cause de sa femme. Ça faisait deux 
jours qu'il ne mangeail pas. Je lui 
disais : “mange, il ne faut pas te 
laisser’ abattre”. Je le sentais ve- 
nir ; le soir, il dit au malon: “ça 
va mal, donnez-moi des calmants, 
je craque”. Le maton gueule ; à 
la fermeture, il le boucle à double 
tour. Le gars s'est pendu dans la 
nuit.!» Mais même si la surveil- 
lance est plus rigoureuse, même 
si l'on prend soin d'ôter aux déte- 
nus tout ce qui pourrait ressem- 
bler à une arme, cette tendance 
suicidaire est tellement puissante 
qu'ils recourent à tous les moyens 
et qu'ils arrivent toujours à dé- 
jouer les précautions. Une autre 
réponse à l'enquête citée ci-dessus 
est révélatrice, à propos de l’h6- 
pital de Fresnes: «Les chirur- 
giens voyaient toutes les semaines 
arriver les types qui avaient ava- 
jé n'importe quoi: des clous, des 
lames de rasoir, du verre, des 
boutons de métal. Un type est re- 
venu sept fois. Il y en a un qui 
s'est enfoncé un clou de char- 
pentier à travers le crâne. Le chi- 
rurgien collectionne ce qu'il trouve 
dans l'estomac et le ventre des 
gens; ce qui l'a mis en conflit 
avec l'administration. I] avait em- 
porté un plein bocal d'objets trou- 
vés dans des ventres, il paraît 
qu'il voulait montrer tout ça dans 
une conférence. Le directeur a 
fait passer une note de service : 
tous les objets trouvés dans le 
ventre des détenus appartiennent 
à l'administration pénitentiaire. 2» 
Réaction qu'il faut souligner : il 
n'est pas certain qu'il y a un 
siècle cetie affaire aurait été ma- 
tière à conflit; à curiosité, tout 
au plus. Quelque chose a changé : 
l'administration se sent respon- 
sable de faits qu'elle n’a pourtant 
pas causés directement ; et si elle 
cherche à en limiter la publicité, 
—————— ""TT 
}J. Enquête dans vingt prisons 44 2. Enguête dans vingt prisons, D. 45."
23,24,"c'est que l'on ne rapporte plus la 
tentative de suicide à la seule vo- 
lonté du prisonnier, mais aussi 
aux conditions dans lesquelles il 
vit. C'est ainsi que, récemment, 
le Conseil d'Etat a tranché dans 
ce sens une affaire où la seule 
faute imputable à l'administration 
était le manque de surveillance. 
Ce qui est nouveau, ce n'est pas 
que l'on se suicide en prison: 
Pierre Rivière, le parricide dont 
Michel Foucault vient de publier 
le dossier 3, a mis fin à ses jours 
en 1840, à la prison de Beaulieu. 
Mais, à l'époque, les journaux 
avaient mentionné ce suicide 
comme un fait divers. Aujour- 
d’hui, l'opinion se sent concernée 
et a cessé de rejeter la responsa- 
bilité de la mort sur le détenu 
lui-même. Il y a là un fait social 
nouveau: la prison a peut-être 
toujours été insupportable pour 
les prisonniers, elle ne l'était guère 
pour ceux qui restaient dehors; 
qu'elle le devienne traduit un 
changement radical dans la men- 
talité d'une partie au moins de 
la population. 
UN UNIVERS QUI ÉTAIT 
INCONNU 
Aussi, pour en prendre la mesure, 
faut-il faire un bref retour non 
sur l’histoire des prisons elles- 
mêmes, mais sur la connaissance 
qu'en ont les non-prisonniers et la 
justification qu'ils en donnent. 
« Les prisons demeurent un monde 
aussi ignoré que célèbre », notail 
en 1966 le spécialiste des questions 
pénales Georges Picca 4. Qu'est-ce 
à dire ? Essentiellement que l’opi- 
nion publique répète un ou deux 
thèmes auxquels elle tient (le cri- 
minel est dangereux pour la socié- 
té, il est nécessaire de punir, il faut tenter d'amender, etc. — l’im- 
portance relative des différents 
thèmes indiquant les secteurs 
idéologiques de ceux qui font de telles déclarations), mais sans être informée de la manière réelle 
dont fonctionne l'institution pé- nitentiaire. De cette information 
concrète tiennent lieu un certain 
nombre de mythes (les évasions 
célèbres, etc.) qui sont souvent 
passés dans la conscience collec- 
tive par le biais de la littérature 
populaire. 
Examinons ces thèmes justifica- tifs. Il faut d’abord noter que l'usage de l'emprisonnement 
comme moyen de punition est re- 
28 ‘ En 1973, 
. quarante-deux détenus 
se sont suicidés 
. dans les prisons françaises 
Quarante-deux détenus se sont 
\ suicidés en 1973, conire 
trente-sept en 1972. Pour 
\ la première fois depuis 
: de nombreuses années, 
une femme fait partie 
de la liste: Mme Georgette 
Amar-Gillet, qui s'est suicidée 
le 20 septembre 1973 à la prison 
de Fleury-Mérogis par ingestion 
de produits toxiques. 
Pour d'évidentes raisons 
. « pratiques », la pendaison 
reste le premier moyen choisi 
: (trente-cinq cas), suivie de loin 
par l'ingestion de produits 
toxiques (cing cas). On relève, 
d'autre part, un suicide 
par le feu, un autre par asphyxie 
résultant d'un incendie volontaire 
de cellule. 
Le jeune âge relatif 
des désespérés est une autre 
des constantes de cette 
statistique : deux d'entre eux 
avaient respectivement quinze 
et dix-sept ans. En dehors 
de ces deux cas, sept détenus 
avaient entre dix-huit et 
vingt el un ans, et vingt-cinq 
moins de trente ans. Cinq détenus 
seulement avaient cinquante ans 
Ou plus. 
Une constante encore, 
l'importance de ceux qui 
attendent en prison d'être 
déclarés coupables des faits 
qu'on leur reproche : vingt-six 
(soit 63,41 %), c'est-à-dire 
une proportion légèrement 
supérieure à celle de l'an passé (59,45 %), mais largement 
supérieure à la proportion 
des prévenus par rapport aux condamnés dans les prisons françaises. 
Enfin, le nombre des détenus d'origine étrangère est, lui aussi, important : dix personnes 
(sur Juarante-deux), chiffre beaucoup plus important, 
proportionnellement, que l'effectif de ressortissants 
étrangers relenus dans les prisons J lançaises par rapport à l'ensemble de la Population pénale. 
AE 
‘ 
D CR lativement récent: l'Antiquité et 
une bonne partie du Moyen Age 
l'ignoraient. Longtemps, la prison 
ne servait que pour retenir l'accy- 
sé pendant le jugement ou dans 
l'attente du châtiment qui était 
souvent corporel et donné en place 
publique. C'est l'Église qui intro. 
duisit l'usage pénal des quatre 
murs . Au XVII siècle, le système 
se généralisera dans toute l'Eu 
rope : plutôt que d'infliger un ch4. 
timent corporel, on essaie d'em- 
pêcher le coupable de commettre. 
de nouveaux délits ; ce qui néces- 
site qu'on le sépare de la majo- 
. rité des gens, ces derniers étant 
ainsi protégés par l'isolement de 
l'individu dangereux. Sous la Res- 
tauration, on s’occupera .d'amélio- 
rer l'état des prisons, mais sans 
revenir sur cette justification. Le 
condamné est donc quelqu'un 
qu'il faut tenir à l'écart dans l'in- 
térêt de la communauté. 
Un deuxième thème apparaît en 
même temps : celui de l'’amende- 
ment du criminel. Il s’agit de le 
rééduquer pour refaire de lui un 
homme normal. Le ton est donné 
par l'article 441 du Code de pro- 
cédure pénale qui fixe comme 
objet de l’'emprisonnement : « fai- 
re comprendre aux détenus les 
exigences de la morale indivi- 
duelle et de la vie en société et 
leur faire prendre conscience de 
leurs responsabilités propres ». 
Pourquoi insiste-t-on là-dessus ? 
Sans doute parce qu'il est diffi- 
cile d'accepter, pour l'esprit indi- 
vidualiste qui s’est imposé depuis 
le xvrrr° siècle, que l’on contraigne 
un homme sans lui donner une 
chance de se «racheter»; mais 
cela ne veut pas dire que l'on ad- 
mette sa différence : un tel indivi- 
dualisme bâtit les individus Sur 
une norme ou plutôt sur une 
moyenne ; donner sa chance au 
condamné signifie lui permettre de 
ressembler aux autres. 
3. Texte présenté par Michel Foucault : Moi, 
Pierre Rivière, ayant égorgé ma nière, WA Sœur et mon frère (Paris, Gallimard, 1973). 
. G. Picca: Pour une politique du crime (Paris, Le Seuil, 1966). : 5. «C'est généralement à l'influence de l'Eglise que les rares historiens des prisons s'accordent 
à attribuer l'origine et l'importance que les prisons vont acquérir à partir du XVII siècle. En effet, l'Eglise, répugnant par tradition aux 
Châtiments corporels, avait, semble-t-il, perçu très Lôt le parti que l'on pouvait rer de 
l'isolement dans un couvent en vue de l'ex- Plation du péché que représentait le crime. Est ainsi qu'on attribue au Concile d'Aix la-Chapelle, en 817, la codification d'un véri- table système pénitentiel qui préfigurait, au moins par un élément essentiel, nos systèmes pénitentiaires contemporains : l'encellulement individuel.» Extrait de G. Picca: Pour té politique du crime, p. 80. 
NN 
ee 
ee UN 
PUS Er DE — 4 [RCE — FU 
IN 
EL 
Pen IT OLIS y =: Ft 
= "
24,25,"La conscience commune juxla- 
pose ces exigences avec d'autant 
plus de facilité qu'elle n'y est pas 
confrontée. Le délinquant est sé- 
paré, comme le fou, comme le ma- 
lade contagieux: hors de l'hori- 
zon des hommes s'édifient des ins- 
titutions qui regroupent ceux dont 
l'humanité se défait: prisons, h6- 
pitaux, asiles, hospices de vieil- 
lards. Toute une « population des 
limites» est ainsi parquée aux 
franges du territoire humain. Ce 
n'est peut-être pas par hasard que 
ces différents secteurs se mettent 
à « bouger » en même temps : mal- 
gré la diversité de leurs origines, 
ils jouent sociologiquement le 
même rôle: cloisonner les adap- 
tés et ceux qui ne le sont pas, ou 
qui ne le sont plus. 
LE MYTHE DE LA PRISON MODÈLE 
Mais si l'opinion publique admet, 
diffuse et reproduit ces deux 
grandes justifications, comment le 
détenu, lui, peut-il les vivre ? D'un 
côlé, on l'enferme, avec tout ce 
que cela comporte à la fois de 
contraintes physiques et surtout 
d'infantilisation (on ne le consi- 
dère pas comme un « sujet»); en 
même temps, on prétend le corri- 
ger ou l'éduquer, c'est-à-dire que 
l’on exige de lui qu'il se comporte 
en adulte, en responsable — en 
« sujet», justement. Paradoxale- 
ment, la contradiction entre les 
deux exigences est atténuée là où 
les conditions de vie laissent à 
désirer : elle n'est ressentie qu'à 
travers les conditions matérielles. 
Mais lorsque celles-ci s’'améliorent, 
c'est-à-dire quand le conflit est vé- 
cu le plus directement, il semble 
qu'il devienne intolérable. Le 
nombre des tentatives de suicide 
ne diminue pas dans les prisons 
modèles, au contraire. À Fleury- 
Mérogis, où un prisonnier reste 
seul vingt-trois heures sur vingt- 
quatre, est-il plus à même de 
« s'amender » que dans la promis- 
cuité des prisons « ancien style » ? 
Georges Picca, qui décrivait la 
nouvelle maison d'arrêt au mo- 
ment de sa construction, semblait 
déjà le prévoir : « Maïs, notait-il, 
en se dépouillant ainsi de son mys- 
tère et de sa crasse, il semble que 
la prison révèle encore plus sa na- 
ture profonde. Une nature qui la 
destine davantage à établir une 
ségrégation entre les délinquants el la société qu'à préparer leur 
reclassement social. Que ce soit 
dans un ‘“pourrissoir” ou dans 
une cellule climatisée, le but est 
identique : mettre un homme 
“hors jeu” pendant un temps 
plus ou moins long, durant lequel 
il ne nuira pas.é» 
La solitude paraît bien être l'ul- 
time forme du « renfermement » 
el la plus intolérable : il suffit de 
lire les interviews réalisées par le 
G.I.P. sur Fleury-Mérogis pour le 
confirmer : « Tous les gars qui sor- 
tent de Fleury te diront: “Seul 
vingt-trois heures sur vingt-quatre, 
tout plutôt que ça !” Je suis allé à 
Fresnes. À deux, à plusieurs, vn 
peut s’entraider, discuter, travail- 
ler. Il n'y a que deux éducateurs 
pour toule la prison et on n'a pas 
toujours les matons sur le dos, 
et on peut voyager librement entre 
les étages, descendre tout seul 
chez le coiffeur. C'est vrai, ce n’est 
pas propre commé à Fleury, mais 
je préfère la crasse à être tout 
seul. Et les autres sont comme 
moi. Etre tout seul, c'est la pire 
souffrance. 7 » 
Contre cette solitude et la sépa- 
ration d'avec le monde qu'elle cou- 
ronne, que faire? Les merveilles 
de la prison modèle, bien loin 
d'en diminuer l'effet, le multi- 
plient. On a la radio à Fleury, 
donc le contact avec le monde ex- 
térieur ; mais ne rend-il pas plus 
douloureux le fait d'en être exclu ? 
Comment réagit le détenu qui en- 
tend vanter les mérites d'un pro- 
duit solaire quand débute le prin- 
temps ? Dès lors, une forme 
d'adaptation consistera à s'enfer- 
mer dans cette exclusion, à jouer 
l'asocialité contre la « responsabi- 
lité»; c'est contre celle-à que 
Georges Picca mettait en garde, 
après les prévisions que nous 
avons citées : «Mais pendant ce 
temps, il (l'homme mis hors jeu) 
pourra aussi se confirmer dans 
son asocialité, préparer de nou- 
velles entreprises criminelles, 
alors que ce qui compte, c'est de 
lui apprendre les “règles du jeu” 
social. » Et si l'on n'a même pas 
cette solution ? Si le détenu, écar- 
telé entre la responsabilité que la 
conscience collective veut voir re- 
naître en lui et l’état d'irrespon- 
sabilité dans lequel elle le main- 
6. G. Picca : Pour une pollitique du crime 
(op cit). 
. Brochure sur Fleury-Mérogis, éditée par 
1e G.I.P. (p. 25). [] profession 
[] o trésor de la langue française 
VOIOIODOOnE NOTION DE 
PERSONNE 
EN AFRIQUE NOIRE 
L'individu est, en Afrique 
noire, situé en un ou plusieurs 
points d'une chaîne d'ancêtres 
ainsi qu'en plusieurs lieux du 
cosmos ou de son entourage 
naturel et social. 
nm/é 128,40 Comportement social 
et caractéristiques 
individuelles 
16 X24 /108 pp. /broché 
Psychologie du 
goût en matière 
de peinture 
16 X24 /140 pp. / broché 11,80 
32, 
HsiquaiAnatole= France 
CCP Paris 9061-11-TÉI: 555. E 
EEE. 
adresse 
achète lelivre 
chez son libraire 
à défaut aux Editions du CNRS 
(chèque joint) 
et demande votre documentation 
ao Sciences exactes et naturelles 
o Sciences humaines ARRETE a revue de l'art 
D autres revues 
Ne INDUSTRIE SERVICE 
29 "
