,page,text
51,52,"sur les chances respectives des 
Noirs cu des Blancs. Pourtant de 
telles statistiques avaient pu élre 
établies lors de nos expériences avec 
les groupes anglais et californiens 
ou lorsqu'il s'agissait de différences 
sexuelles à l'intérieur d'un même 
groupe ethnique. Ainsi, même en 
utilisant le P.P.VT, c'est-à-dire l'un 
des tests les plus nettement orientés 
culturellement, les résultats obtenus 
par les Blancs et les Noirs ne reflè- 
tent pas le type de déviation que 
l'on pourrait attendre en se bor- 
nant à l'hypothèse qui attribue le 
déficit du Q.I. noir à un parti pris 
culturel. Je considère qu'il y a là de 
bonnes raisons de mettre en doute 
la validité de cetle hypothèse. 
Un examinateur noir 
ne change rien aux résultats 
Que peut-on dire encore de l'in- 
fluence subtile de la situation inhé- 
rente à l'épreuve et qui pourrait 
avoir en elle-même un effet négatif 
sur les performances des Noirs ? 
On a supposé, par exemple, que la 
présence d'un examinateur blanc 
pouvait inhiber les enfants noirs, 
mais la plupart des études qui ont 
été faites pour contrôler cetie hypo- 
thèse ne sont pas concluantes. Au 
cours de mes expériences, neuf mille 
enfants noirs et blancs ont été sou- 
mis à des tests d'aptitudes mentales 
et scolaires par des examinateurs 
noirs et blancs, et nous n'avons pu 
isoler aucune différence dans les ré- 
sultats en fonction de la race des 
examinateurs. Que dire également 
de la langue parlée par l'examina- 
teur, du dialecte employé ou de 
l'accent ? Dans l'une de nos études, 
le test Stanford-Binet (que l'on peut 
considérer comme un test verbal et 
fortement individualisé) a été tra- 
duit dans le dialecte du ghetto noir 
et administré par un examinateur 
noir qui parlait couramment ce 
dialecte. Le groupe d'enfants noirs 
qui passa le test dans ces condi- 
tions obtint moins d'un point de 
plus que la moyenne du groupe de 
contrôle qui avait passé le même test en anglais courant. 
Pour tester la croyance populaire 
selon laquelle les enfants noirs réussissent médiocrement les tests de QI. parce qu'ils sont victimes d'une «carence verbale », nous avons étudié les résultats obtenus par les plus grandes victimes de «carence verbale» que l'on puisse rencontrer, c'est-à-dire des sujets totalement sourds de naissance. Comme on pouvait s'y attendre, ces enfants obtinrent des notes très médiocres aux tests verbaux, mais leurs résultats s'élevaient bien au dessus de la moyenne pour les tests non verbaux dits « culturellement 
58 
DST FUIT ii 
ul. ui Î 
penis, Lu Ut ON RO ER UT équitables ». En fait, leurs résullais 
élaient absolument OPpOses à ceu 
des Noirs, prétendument victimes 
de «carence verbale » et qui o e- 
naient cependant des noles plus 
élevées aux [Lests verbaux qu'aux 
Lests non verbaux. 
La différence raciale n'apparaît pas 
dans toutes les aptitudes mentales 
Si l'on considère l'hypothèse selon 
laquelle le déficit du QI. des Noirs 
pourrait être imputable à la fai 
blesse de leurs motivations et à leur 
attitude peu coopérative lors de 
l'examen, il faudrait encore expli- 
quer le petit nombre ou l'absence 
de différences dans les résultats ob- 
tenus par les Noirs et les Blancs 
dans les quelques tests qui font 
appel à la mémoire et à l'étude « par 
cœur ». Ces 1iests sont précisément 
ceux qui réclament le plus d’atten- 
tion, d'effort et de persévérance, 
mais ils n'impliquent aucune des 
aptitudes au raisonnement abstrait 
qui caractérisent les tests dits « cul- 
turellement équitables ». Nous avons 
donc mis au point des ilests expé- 
rimentaux qui minimisaient, d'uné 
part, le rôle du raisonnement et des 
aptitudes à l'abstraction et met- 
taient, d'autre part, l'accent sur la 
mémoire et les acquisitions non 
conceptuelles. Pour ces derniers 
tests la moyenne était sensiblement 
la même pour les enfants noirs et 
les enfants blancs. Il est donc per- 
mis de conclure que la différence 
raciale ne se manifeste pas dans 
toutes les aptitudes. mentales. En 
fait, cette différence semble particu- 
lièrement sensible dans les opéra- 
tions qui font appel au raisonnement 
conceptuel et abstrait, mais elle 
n'intéresse pas la mémoire ni l'étude 
« Dar cœur », 
On cite encore une autre expli- 
cation possible du déficit du Q.I. 
noir. Il s'agit ici de la notion selon 
laquelle les résultats obtenus par 
l'enfant répondraient à l'opinion que 
Son instituteur a pu former à son 
sujet en se fondant le plus souvent 
sur des préjugés et des stéréotypes. 
Pourtant, de nombreuses études des pronostics des instituteurs n'ont pas réussi à étayer cette thèse de l'influence de l'opinion préconçue des enseignants sur la faiblesse du QI. noir. 
Ainsi, pour contrôler l'hypothèse examine Ju raliste, nous avons 
Xamimé résultats des tests sus- ceptibles de refléter le plus claire- 
ae les Sources  environnemen- 
te ee on nee en tests qui ont n précisément ces 
eee l accusé le moins de différence dans les résultats moyens des Noirs et des Blancs. En re- 
vanche, les différences les plus mar. quées dans les résultats des groupes raciaux ont été observé dans les tests qui paraissent rellé ter les variations génétiques. Si “ version de l'influence cultur environnementale était 
c'est exactement Île contr 
devrait se produire. 
Pour essayer de réfuter l'hypo thèse génétique du déficit du ST noir, les environnementalistes citent fréquemment les comparaisons deux 
elle et 
Correcte, 
A 4 : 
ui ont pu êlre élablies entre des groupes raciaux appartenant au même milieu socio-économique el 
insistent sur le fait que la diffé. rence de résultats est dans ce cas 
nettement inférieure aux quinze 
points d'écart moyen entre les deux races. Ce point de vue illustre bien ce qu'il est convenu d'appeler « les 
sophismes des sociologues», En 
effet, si l'on considère que les Nüirs 
et les Blancs ont en moyenne des 
Statuts Socio-économiques (S.S.E.) 
différents, la comparaison des deux 
groupes raciaux sur la base des va- 
riables du S.S.E. telles que l'éduca- 
tion, l'emploi et la classe sociale, 
signifie nécessairement que le groupe 
noir est plus rigoureusement sélec- 
tionné en termes de caractéristiques 
et d'aptitudes propres au S.SE, y 
compris l'intelligence. Ainsi la com- 
paraison de ces deux groupes en 
termes de Q.T. est fausse. 
En outre, les personnes qui 
s'appuient sur ces comparaisons 
socio-économiques négligent de tenir 
compte des différences génétiques 
bien établies entre les -classes so- 
ciales noires, qui invalident leur 
comparaison. En effet, lorsque l'on 
compare Blancs et Noirs sur la base 
du milieu socio-économique, on 
constate que la couleur de la peau 
des sujets du groupe noir devient 
de plus en plus claire à mesure 
que l'on s'élève vers les couches 
supérieures. Cette différence indique 
encore que les caractéristiques gé- 
nétiques varient avec le S.S.E. À ce 
niveau, la réduction de la différence 
de Q.I. est non seulement imputable 
à un meilleur contrôle des facteurs 
environnementaux, mais également 
à une plus grande égalité des fac- 
teurs génétiques. 
Les thèses des environnementalistes 
sont battues en brèche 
Une multitude d'autres constatations 
sur tous les facteurs environnemen 
taux réfutent encore la théorie 
strictement environnementaliste du 
déficit du QI. noir: Par exemple, 
pour ce qui concerne la plupart des 
facteurs socio-économiques, alimelr 
taires, éducatifs et autres, dans Jes- 
quels les sociologués veulent voir 
la cause des différences de al. el 
d’aptitudes scolaires des Noirs, on 
RSR 
Se. -e, 
""8. 
A. <= PT 
LS 
1 
A mt pp"
52,53,"sait que le standard de vie des In- 
diens américains présente par rap- 
port à celui des Noirs un écart 
presque aussi important que le sta- 
tut socio-économique des Noirs par 
rapport à celui des Blancs. L'in- 
fluence de ces facteurs environne- 
mentaux devrait donc être sensible 
à l'intérieur de chaque groupe eth- 
nique et être reflétée par une va- 
riation relative dans les résultats 
des tests d'intelligence et d'apti- 
tudes scolaires. 
Dans la mesure où la santé, l'édu- 
cation parentale, l'emploi des pa- 
rents, le revenu familial et quelques 
autres facteurs environnementaux 
encore plus subtils sont supposés 
avoir une influence sur les perfor- 
mances scolaires des enfants, le 
très grand dénuement des Indiens, 
encore plus grand que celui des 
Noirs, devrait être observé dans les 
résultats comparés des tests des In- 
diens et des Noirs. Or, en 1967, lors 
d'une enquête nationale américaine 
publiée dans le rapport Coleman, les 
résultats des Indiens étaient supé- 
rieurs à ceux des Noirs pour tous 
les tests des douze premières 
classes. Par exemple, aux tests non 
verbaux administrés dans la pre- 
mière classe élémentaire, avant que 
la scolarité ait pu avoir beaucoup de 
prise sur les enfants, les jeunes 
Indiens dépassaient les résultats 
moyens des Noirs du même âge avec 
une avance correspondant à environ 
quatorze points de Q.ÏI. 
Des constatations similaires ont 
été faîtes avec les Mexicains habi- 
tant aux Etats-Unis, dont le niveau 
de vie et le milieu sont inférieurs 
à ceux des Noirs et qui obtiennent 
pourtant des résultats très supé- 
rieurs, en particulier aux tests non 
verbaux. Ainsi, la différence de Q.Ï. 
observée entre les Indiens et les 
Noirs et entre les Mexicains et les 
Noirs réfute encore la théorie pure- 
ment environnementaliste, laquelle 
affirme que les chances génétiques 
Sont égales pour tous en ce qui 
concerne l'intelligence sans avoir 
pu fournir une preuve valable pour 
Soutenir cette hypothèse. 
Enfin, la sous-alimentation est 
encore fréquemment citée par les 
environnementalistes qui refusent 
l'hypothèse génétique. En effet, on 
a constaté que la sous-alimentation 
et la malnutrition pouvaient affecter 
le développement physique et men- 
tal d'un petit pourcentage d'enfants 
nés dans certaines régions où sévit 
une famine endémique, telles que les 
Indes, l'Amérique du Sud, l'Afrique 
du Sud et le Mexique. Mais les Noirs 
américains ne donnent pas de tels 
Signes de malnutrition et je n'ai pas 
rencontré aux Etats-Unis de cas 
Majeurs de retards mentaux liés à 
la malnutrition. LE RACISME 
DEVANT LA SCIENCE 
Le racisme est une plaie, 
un Scandale. À ce titre, tous 
les moyens qui peuvent contribuer 
à l'enrayer sont bons, et parmi eux 
la lutte au niveau des préjugés 
d'ordre intellectuel. C’est pourquoi 
il faut apprécier la réédition 
par Gallimard, sous l'égide 
de l'Unesco, de l'ouvrage 
« le Racisme devant la science » 
(la première édition était de 1960) 
gui groupe un certain nombre 
d'études où le phénomène 
du racisme est abordé selon 
les perspectives les plus diverses. 
Car c'est une véritable coalition 
de tout le savoir humain 
— tant sur le plan de la biologie, 
de l'anthropologie, de la psychologie, 
que de l'économie — qui est mise 
en Œuvre, sous forme d'études 
rinutieuses, très élaborées, 
parfois complexes. Il s'agit, 
au sens le plus précis du terme, 
d'une compilation scientifique, 
celle-ci ayant le mérite d'apporter 
l'exactitude et la rigueur là 
où règnent préjugés et passions. 
Parmi ces études, il faut noter 
la très intéressante mise au point 
de Lévi-Strauss, où il s'applique 
à montrer combien la notion 
de culture est relative, comment 
elle « résulte de la position 
ethnocentrique dans laquelle 
nous nous plaçons toujours 
pour évaluer une culture différente », 
et comment le rôle de la civilisation 
occidentale elle-même — 
compris à l'intérieur 
du processus global de l'Histoire — 
doit être apprécié avec modestie. 
IT faut noter aussi la contribution 
du biologiste L.C. Dunn qui combat 
l'idée selon laquelle « il existerait 
des différences fixes et absolues 
entre les races humaines », 
èt pour qui le préjugé racial 
est une élaboration culturelle 
qui « ne trouve aucune justification 
dans la biologie ». 
Le psychologe Otto Klineberg, 
quant à lui, affirme que l'inégalité 
des capacités intellectuelles 
ne peut être repérée qu'au niveau 
de l'individu et que « la gamme 
des capacités innées et les taux 
de fréquence des divers degrés 
d'aptitude héréditaire sont à peu 
près les mêmes dans tous 
les groupes raciaux ». 
Cette conclusion est effectuée 
à la suite d'une longue étude 
où il examine les thèses qui 
ont tenté de prouver le contraire. 
La visée globale de l'ouvrage — 
extirper le préjugé raciste 
à tous les niveaux où il peut se loger — repose sur la croyance 
implicite que la connaissance 
vraie engendre une attitude fondée 
sur la justice. Or, cette relation 
de cause à effet n'est 
malheureusement pas évidente. 
Trop de cas — célèbres 
ou inconnus — contraignent 
à la meitre en doule, manifestant 
par là l'existence d'une dichotomie 
en l'homme, entre ce qu'il sait 
ei ce qu'il sent : la lecture 
d'un ouvrage comme celui-ci, 
qui aura convaincu l'honnête 
homme de la précarité et 
de la relativité de la notion de race 
(cette dernière « n'étant. pas un fait, 
mais un concept »), et de la fausseté 
radicale de toute «idée 
d'une hiérarchie entre les races », 
l'aura-t-elle débarrassé pour autant 
de toute attitude raciste, 
qui se manifeste, on le sait, 
de façon insidieuse, sournoise ? 
C'est pourquoi, s'il faut saluer 
avec chaleur la réédition 
d'un tel livre — ou la publication 
de tout autre ouvrage de ce genre —, 
il faut aussi en préciser 
les limites : c'est que cet ouvrage 
omet, et de façon évidente, 
de poser la problématique 
essentielle qui est de savoir 
pourquoi l'homme est raciste. 
À cet égard, il ne suffit pas 
— quelle que soit la portée 
de ces facteurs — d'expliquer 
le racisme par les « antagonismes 
reposant sur la structure 
économique des sociétés modernes », 
comme le fait Michel Leiris, 
ou d'affirmer, comme le fait 
John Rex, que «la discrimination 
raciale et les préjugés de race 
sont des phénomènes liés 
au colonialisme ». 
À vrai dire, une étude opérant 
au moyen de concepts 
psychanalytiques — scrutant 
ce qui, à l'intérieur du système 
psychique, rend possible 
l'élaboration de la pensée raciste — 
permetirait peut-être mieux 
de répondre à la question 
de savoir pourquoi l'homme 
ne tolère pas l'Autre en tant 
que différent. C'est donc 
en se portant au niveau le plus 
profond, qui est celui 
des motivations psychiques 
inconscientes, que la réflexion 
peut être à même de déceler 
les causes ultimes du racisme el de comprendre pourquoi 
l'argumentation intellectuelle 
elle-même a tant de mal 
à l'extirper. 
Janine Modlinger "
53,54,"A ma connaissance, on n'a pas 
encore pu prouver que la sous j- 
mentation de la mère chez les nu- 
mains puisse avoir une influence 
prénatale ou postnatale sur le de 
loppement mental de l'enfant. Au 
cours de la Seconde Guerre mon 
diale, les Pays-Bas ont subi une 
grave période de famine qui fournit 
un terrain d'études pour une telle 
hypothèse. Des milliers d'hommes, 
qui ont été conçus, portés et mis 
au monde au cours de cette peé- 
riode, ont été soumis au moment 
de l'adolescence aux tesis non ver- 
baux de raisonnement des « ma- 
trices progressives standards » de 
Raven. Leurs résultais n'étaient pas 
sensiblement différents de ceux de 
leurs compatriotes du même âge qui 
n'avaient pas subi cette privation 
maternelle. 
Je ne mets pas en cause 
le niveau individuel d'intelligence 
Mais quelles seraient les implica- 
tions pratiques de ces constatalions 
si des recherches ultérieures établis- 
saient définitivement l'existence de 
différences conditionnées par la gé- 
nélique entre certaines races ? Il 
faudrait écrire plusieurs articles 
pour envisager correctement ce pro- 
blème, mais la seule position humai- 
nement soutenable resterait inchan- 
gée: tout individu doit être traité 
selon ses propres caractéristiques 
individuelles et non en fonction de 
son appartenance à tel ou tel groupe. 
J'insiste sur le fait qu'aucune des 
recherches que j'ai exposées ici ne 
permet de tirer des conclusions sur 
le degré d'intelligence individuelle 
d'une personne donnée, quelle que 
soit sa couleur. 
L'égalité des droits et des chances 
est certainement l'une des meil- 
leures conditions de la vie en socié- 
té. Le fait d'admettre l'existence de 
différences dans les aptitudes men- 
tales des hommes devrait simple- 
ment souligner la nécessité de don- 
ner à chaque individu des chances 
égales  d'accomplissement. Pour 
tenir compte et tirer parti des apti- 
tudes diverses, et de ce fait servir 
également tous les citoyens, les 
écoles publiques devraient élargir 
leurs conceptions étroites de la réus- 
site scolaire. Elles devraient offrir une plus grande variété d'options et permettre ainsi aux enfants de béné- ficier d'une éducation conforme à leurs aptitudes quelles qu'elles soient. 
J'ai essayé d'attirer l'attention sur la faiblesse de nos connaissances 
concernant la cause des différences 
raciales d'aptitudes mentales. Je n'affirme pas avoir trouvé une preuve ‘directe ou définitive, en lermes de recherche génétique, de 
60 CHERCHEUR un BATAILLE 
Grand dévoreur 
de livres depuis 
son enfance, AT- 
thur Jensen avalil 
découvert les ou- 
vrages de J.B. 
Watson et de E.L. 
Thorndike, les 
fondateurs du be- 
[ haviorisme bien 
=. f avant d'entrer à 
l'université de Berkeley (Californie), 
où il a fait ses études de psychologie. 
Après avoir passé ses examens, il a 
effectué des recherches en psycho- 
logie à San Diego. En 1952, il est 
parti à l'université Columbia, où il 
a obtenu son diplôme de psycholo- 
gie en 1956. 
Arthur Jensen a passé deux ans 
en Grande-Bretagne à effectuer des 
recherches sous la direction du pro- 
fesseur Hans J. Eysenck à l'univer- 
sité de Londres. « Presque {ous mes 
travaux ultérieurs ont surgi des pro- 
blèmes que j'ai eu à résoudre pen- 
dant que je travaillais avec 
Eysenck », dit-il. Comime celui-ci, Jen- 
sen est spécialisé dans la psycholo- 
gie différentielle: «Comment et 
pourquoi les individus ont-ils des 
comportements différents 25 
À Londres et depuis, Jensen s'est 
penché sur les recherches expéri- 
mentales quantitatives concernant 
les différences d'apprentissage indi- 
viduel. En 1958, il est retourné à 
l'université de Berkeley en 
qu'assistant. Là, il fut à l'origine 
de la création, en 1961, de l'Institut 
d'apprentissage humain. IL est pro- 
fesseur de psychologie des sciences : de l'éducation depuis 1966. 
C'est en 1962 que Jensen a com- mencé ses expériences sur les en- fants des émigrés mexicains aux Etats-Unis et sur d'autres minorités Pour tenter de développer un test d'intelligence indépendant de toute cullure. En examinant les travaux existant en ce domaine, il fut sur- pris de s’apercevoir de l'absence Presque lolale d'études sur Le rôle éventuel des facteurs génétiques dans les différences individuelles d'intelligence el dans les résultats scolaires. Ses recherches SUT Ce Ssu- jet ont suscité des controverses vi- rulentes. 
Arthur Jensen a pi 6 tblié près cent trent P de rente arlicles pour des revues et a écril en [ant qu'auteur OU Co- auteur cinq Ouvrages dans Île do- Maine de l'éducation. liant : l'existence de différences Sénotyp; ques de Pintelligence entre pi 
races ou les ethnies. Je n'ai pas non plus avancé une hypothèse en 
m'appuyant sur des bases insuff. 
santes. J'ai seulement voulu démon. 
trer que les faits que nous avons 
pu observer ne confirment pas la 
théorie environnementaliste, laquelle 
était jusqu'à présent considérée 
comme scientifiquement établie. En 
général, les sociologues ont accepté 
cette théorie sans discussion et dans 
les autres disciplines la plupart des 
chercheurs se sont contentés de don- 
ner leur assentiment silencieux, Je 
crois avoir rassemblé assez de preu. 
ves pour que cette complaisance ne 
soit plus guère possible et pour que 
ce débat ouvert donne lieu à de sé. 
rieuses recherches ultérieures. 
De telles recherches 
ne doivent pas être politisées 
La plupart des savants et des intel. 
lectuels avec lesquels j'ai pu dis 
cuter cette question au cours de ces 
dernières années ne voient aucun 
danger dans le fait d'élargir nos 
connaissances sur les origines géné- 
tiques des différences raciales dans 
les aptitudes mentales et le com- 
portement. Ils ne voient aucun dan- 
ger à ce que le monde scientifique 
reconnaisse de telles différences 
génétiques, si cette constatation doit 
servir de base éventuelle à des re- 
cherches scientifiques ultérieures. 
Mais, en revanche, ils verralent Un 
très grand danger dans le fait de 
politiser une question fondamentale- 
ment scientifique qui doit rester 
du strict domaine de la recherche. 
La plupart des tentatives de poli- 
tisation du problème que j'ai pu 
observer sont venues de la gauche 
radicale. Les vrais libéraux et les 
vrais humanistes ne songent, EUX, 
qu'à élargir leur connaissance des 
faits. Ils me veulent pas gaspiller 
leur énergie à soutenir des mythes 
ou des illusions. Ils veulent resar 
der la réalité en face, quelle que 
soit cette réalité, parce que c'est le 
seul moyen de résoudre effective- 
ment les problèmes réels. Cela Sr 
gnifie qu'il faut poser de dures ques 
tions et chercher des réponses 
scientifiques avec rigueur et SIncé- 
rité, comme je l'ai déjà demandé. 
Cela signifie qu'il faut examine 
toutes les hypothèses raisonnables, 
y compris les plus impopulaires: 
Cela signifie qu'il faut savoir douter 
de ce que nous souhaitons le plié 
ardemment croire, qu'il faut admet 
tre l'incertitude de nos conf . é- sances et envisager les nouvelles té couvertes en termes de probabill e provisoires plutôt qu'en termes 
conclusions absolues. 
Arthur Jensen "
