,page,text
17,18,docteur jean-claude lacroix/l approche théorique laquelle repose acupuncture tout fait contraire l'esprit scientifique analytique occidental pourtant acupuncture efficace plus plus employée docteur lacroix explicite ici cette approche globale homme déduit analogie correspondance entre caractéristiques psychologiques homme éléments constituants univers ciales parfois difficiles entre chinois européens ceux-ci trouvent déroutés font souvent fautes psychologiques majeures inverse ailleurs doit être vrai orient mode raisonnement globalanalogique contrairement nôtre analytique particulier général l'opposition ainsi exprimée certes simpliste car trop schématique faut pourtant bien comprendre saisir abord psychologique homme chinoise relations humaines elles culturelles commerî raisonnement oriental part global l'homme partie intégrante univers reflète moment qu'il vivant résulte pouvait être comme tout existe cette résultante procède deux forces abstraites départ opposées complémentaires inn yang notion retrouve tous niveaux réalité choses existence procède cette opposition cette complémentarité matière exemple inn rapport énergie yang ciel rapport terre lêtre vivant rapport inanimé femme inn rapport homme yang homme taciturne introspectif inn rapport homme exubérant bon vivant yang parmi derniers inn celui manuel rapport intellectuel yang etc ainsi tous niveaux référence constituons comme tout existe somme znn yang chacun éléments univers vie mou- vement entre deux aspects /nn- yang perpétuent façon héréditaire renouvellent cha- instant fonction environnement ainsi global l'univers arrive individu intéresse mental dernier fois reflet partie prenante tout reste sein l'individu yang orga- nisme matière niveau univers énergie -puisqu globale aussi étudiant forge nisme observant univers tou simplement analogie doit pouvoir mieux comprendre mental ainsi procèdent orientaux. niveau l'univers l'observation chinois décrivent yang énergies ciel agissent réagissent éléments nature znn terre rapport origine mouvement vie yang note toujours selon principe énergies yang très yang moyennement yang légèrement yang rapport énergies inn très inn etc aborde noms chinois reflètent pourtant plus exactement notions abstraites mode raisonnement d'emblée appliquer dernier passe terre déjà forcément notion inn matérialisation l'énergie simple fait mani- festation partant global déduit analogie note ainsi vent feu chaleur l'humidité sécheresse froid ous manifestations globales énergies ciel terre matière constate éléments paraissent illustration peter goodfellow extrait vols icare alexander mosley publications
18,19,sre steuteee bas eur eee d'ou pierre rue las rain pris
19,20,"stables matérialisation n'existe parce agissent énergies ciel peut s'exprimer système référence planèteterre bois correspond vent feu correspond feu céleste chaleur terre l'humidité métal sécheresse eau froid l'ensemble bois-feu-terre-métal-eau constitue éléments base d'uñe façon générale matière loi éléments a/tout matérie dous niveaux retrouve référence ainsi parmi etes corps exemple onre organes indispensables vie app jés organes-trésors foie cœur feu rate-pancréas ter poumons métal reins loi correspondances loi jon référence choisie js-foie réagit sut autres éléere façon parmi aus réagir aigre parmi souleurs bleu parmi éléne ceonstitutifs corps cles ndons parmi sens vue etc tableau ci-dessous limitatif donne vol premier éléments rien elque idée eau métal foie cœur rate hiver organes printemps fin autom nuit saisons pes midi fin d'après-midi tombée jour salé moments journée matin ames doux sucré piquant saveur aigre blanc noir couleur bleu-vert rouge jaune peau eléments corps muscles tendons artères sang chair odorat audition cinq sens vue goût toucher oreilles organes correspondant yeux langue lèvres bxerétons larmes sueur salive crachats urines mens colère joie pensée réflexion tristesse peur mode expression clameur rire chant mélodieux sanglot gémissement attitude psychique extériorisation circulation equilibre psychique intériorisation mutations eic.… parmi autres recueillement tiré livre 101 réponses acupuncture jean-claude lacroix hachette 1981 voir compte rendu rubrique librairie b/par l'observation toujours analogie constater éléments structurent ensemble stable /nn peut être schémafeu tisé ainsi terre métal bois eau déduira deux autres volets loi éléments loi engendrement bois engendre feu engendre terre cendre contient métal engendre après mutation phénomènes mutation font tous niveau eau métalloïde h,0 permet bois pousser etc loi dominance. bois domine terre domine eau éteint feu fait fondre métal coupe bois concerne mental constatation référire rence mentale différentes lois éléments correspondance engendrement dominances peu- vent être schématisées ainsi circulation parmi autres joie colèreextériorisation clameur recueillement chant-mélodieux pensée réflexion peur mutation gémissement tristesse intériorisation sanglo"
20,21,correspondances référence tableau correspondances mêmes réactions bois autres éléments foie autres organes colère autres sentiments extériorisation autres mouvements énergie clameurs autres moyens expression etc feu-cœur fait correspondre joie-circulation parmi autres rire etc terre-rate réflexion ainsi suite comme l'indique tableau engendrements selon cette loi peur longue engendre colère colère bien exprimée devrait aboutir certaine joiesatisfaction amène réflexion trop réflexion rend triste trop tristesse aboutit peurappréhension choses dominances expriment alors grande réflexion permet dominer peur grande peur détruit toute joie grande joie supplante chagrin grand chagrin inhibe colère grande colère rend aveugle permet réflexion applications diagnostiques thérapeutiques découlent directement compréhension abord psychologique l'individu trouve éclairée envisagerons successivement deux exemples parmi cinq grands types individus correspondant éléments bien entendu applique global applique façon particulier ainsi exemple attitude psychologique valable façon continuelle envers coléreux hépatique installé état valable cette fois instant donné face colère exceptionnelle autre type individu premier exemple l'élément extériorisation après tableau correspondances ci-dessus défaut extériorisation peut entraîner déficience hépatique l'inverse malade foie extériorise mal souvent fimide brusques accès colère teint verdätre yeux font mal envie frotter vision déficiente sujet myalgies douleurs muscles-tendons peut être amélioré favorise chez extériorisation man- bois-foie-colère- nue biosphère humaine détail peinture jean-pierre alaux galerie d'art place beauvau paris sport exemple surtout matin promenades forêt bois notamment printemps guérir cet hépatique non seulement faut soigner foie loi engendrement améliorer fonction rénale rein-eau engendre foie-bois conseille boire beaucoup eau contre colère faut faire trop peur peur engendre colère faire rire entourer personnes joyeuses cela ferait augmenter cette colère rancœur foie-bois-colère doit engendrer cœur-feu-joieapaisement non contraire popposé loi dominance tristesse entourage prise conscience tristesse état apaise coléreux poumon-métaltristesse domine foie-bois-colère réflexion normalement détruite colère peut très forte empêcher cette dominance contribuer apaiser celle-ci deuxième exemple l'élément métal-poumonstristesse-intériorisation après tableau correspondances malade poumon triste mélancolique teint blanc diaphane intériorise tout arrive recherche nourritures épicées pimentées inverse grand chagrin viscéralement ressenti diminue résistance pulmonaire favorise bronchites répétition voire installation tuberculose peau devient sèche préfère être seul replie soi complaisant parfois état mélancolie favorisé soir l'automne aborder cette personne triste fragile poumon meilleure façon faire réflexion pensée chinoise nour- rit élément terre-rate loi engen- drement expliquant choses rate engendre poumon tubersuite page
21,22,bhotographie extraiteldu merveitieux livreldelrotandfetts abrina lon ens aabo hachette réalités lacie obairelbrilentaes kishnarmunt djencens nelconsistel das ttl lkr lea rep cdti assal var paur arret parurne ets pot perent aus frs ets noel
22,23,monde d'aujourd'hui propos recueillis émissions télévision fies hindoues bouddhistes tibétaines écrit expériences rencontres faités cours daniel roumanoff/arnaud desjardins bien connu réalisées traditions spirituelles orientales soue nombreux livres raconte voyages afghanistan inde japon occasion sortie dernier livre grain sagesse spécialement destiné jeunesse plus particulièrement comparai tions orientales psychologie comment venu intéresser sagesse arnaud desjardins aujourd hui enseignements spirituels orientaux très mode probablement trop mode directement visés travers suspicion éveille mot secte quand vers 1949 découvert genre enseignement existait célébrité beaucoup moins grande d'autre part bien moins charters rendre inde enfin toutes psychothérapies modernes gestalt bio-énergie autres existaient encore trouve âge vingt-quatre ans j'étais très insatisfait j'étais trouvais hanté pourrais presque dire obsédé idée voulais changer pouvais rester tel j'étais destin fait mis contact appelle psychologie-n° 143 janvier 1982 photo mathieu rechopinn rares ftas res l'enseignement gurdjieff contact l'enseignement juste avant mort monsieur gurdjieff produite avant occasion rencontrer travers enseignement gurdjieff sychologie interviewé dirigeant débat entre psychologie moderne tradij'ai entendu prononcer mots enseignement ésotérique enseignement initiatiqué pendant années temps assistais assidûment réunions groupes gurdjieff pratiquais nombreux exercices proposés pendant années tout que-je pouvais lire français puis anglais genre enseignemnet partir 1959 existence pris tour différent c'est-à-dire a.été donné beaucoup voyager faire séjours six mois neuf mois inde séjours pendant lesquels -je vivais auprès maîtres qui'ont abord hindous puis tibétains puis soufis musulmans puis maîtres zen apon finançais longues expéditions-bar tournage films documentaires télévision vers années 1969 dizaine d'émissions heure
23,24,diffusées rediffusées télévision deuxième chaîne entretiens duraient trente cinq minutes chacun entretiens producteur andré voisin j'avais possibilité répondant questions expliquer j'avais ressenti compris important occidentaux au-delà lpexotisme images soufies afghanistan tibétaines 'himalaya autre part j'ai écrit aussi certain nombre livres témoignages j'avais observé questions posées réponses données questions honnêteté préciser parlais sages aucun cas moi-même sage peine disciple émissions télévision valu comme autres producteurs très abondant courrier mille deux mille lettres émission courrier lequel peu près tous types humains représentés certaines lettres fautes orthographe grammaire montraient niveau instruction très faible maïs contre profonde compréhension important émissions beaucoup lettres médecinspsychiatres compris combien psychiatres intéressaient techniques transformation personnelle pratiquées asie lettres prêtres religieux aussi lettres représentant échantillonnage société française cela donc fait dix douze mille lettres quelques années j'ai toutes lues attentivement aux- quelles j'étais obligé très souvent répondre lettre photocopiée quels critères communs ous gens intéres- saïent questions critère commun dominait découverte travers images musique commentaire aütre niveau vie possible autre dimension dont j'ai senti combien manquait monde moderne confirme toutes critiques faites pie société consommation égard frappé ment célèbre ancien mar part bre bureau politique communiste français cet jsait aujou garaudy disait ver raie révolution sion l'échelle société entiere redécouverte finalité mére vie humaine seulement nouveaux moyens répartition production répartition richesses courrier recevais propos émissions télévision montrait échantillonnage assez complet population française soif nostalgie autre chose convenu appeler société consommation matérialisme vienne. d'autre part pratiquais molmême méditation ascèses proposées constatant malgré nombre années mois heures quotidiennes consacrais transformation intérieure répondait attente rencontré sage hindou swami prajnanpad pratique ment inconnu autrefois certaine notoriété bénarès parlait anglais couramment formation scientifique guidé jusqu promesses lisais certain nombre livres finissent réaliser après sérieusement douté certaine époque vie rencontré beaucoup gens faisaient recherche j'ai effectivemént amené rencontrer europe asie beaucoup vingt cinq ans j'ai connu plusieurs milliers per- sonnes comme intéres- saient enseignements mode aujourd hui cet égard peu peu j'ai remarqué tiré clair certain nombre malentendus certain nombre vues fois trop rapides trop superficiel question 1siel d'abord quand parle spiri ven d/a2 photo faut savoir tualit hindouisme boudparle général dhisme dégénérescence asiatique ité sous nérée celle valeur tait otrien onction elles raditions éventuellement apporter comme guérison diverses maladies émotionnelles c'est premier point est-ce parlons société hindoue ensemble aujourd hui compris pauvreté misère corruption est-ce parlons enseignement donné maîtres authentiques d'autre part certains propagandistes orientaux font conférences monde entier milliers disciples peuvent relation complicité d'il mie lraud desjardins trouve
24,25,infl\mité entre maître disciples être considérés comme représentatifs tradition plus rigoureuse attire occidentaux décidés engager assez sérieusement fait sage soufi bouddhiste hindou totalité expérience dont voudrions pouvoir bénéficier trouve réunie manifeste occident religion science différentes psychothérapies plus rattachées tronc commun forment totalité peut être très grand psychologue tout très piètre opinion religion peut être prêtre rayonnant tout manquant complètement connaissances psychologiques inconscient découvert étonnement dis bien étonnement parce doutais approchons spiritualités orientales l'arrière plan information religion chrétienne uve milieu swami prajnanpad droite psychologie 143 janvier 1982 juive méprenonsc'est pourquoi emploie presque jamais mot religion toujours mot spiritualité. j'ai découvert toutes traditions dis bien toutes comportaient connaissance psychologique notamment connaissance l'inconscient rien envier celle occident ailleurs ceci découverte seul avoir fait notoriété publique très grands noms psychologie américaine européenne intéressés taoïsme bouddhisme zen védanta hindou points plus importants lesquels pourrais insister faisais peu bilan expérience sagesses toujours inclu non seulement tout appelons psychologie appelons psychologie profondeurs simplement manière accéder cet inconscient manière rendre conscient inconscient change suivant différentes voies c'est fois connaissance libération inconscient aussi pratique agit toujours pratique révélation premières lectures comme jeune homme c'était deux mots mot réalisation français traduction mot anglais réalization mot expérience agit croire dogme agit faire expérience soimême agit réaliser sens as-tu bien découvert'que réaliser sens accomplir aussi réaliser sens accomplir encore plus le.sens .de découvrir encore découvert prendre conscience dont encore pris conscience certain nombre de.termes toujours utilisés différentes langues étrangères utilisés français tels libération sagesse éveil grand sens mot guérison d'abord parce vingt quatre ans fait deux ans sanatorium sais être complètement guéri maladie dont atteint autre part expérience personnelle résumerait très bien mot guérison guérison pire maladie s'appelle souffrance parle souffrance physique parle souffrance émotionnelle souffrance morale anxiété angoisse inquiétude désespoir ristesse peur surtout peur peut-on guérir émotions douloureuses bien sûr diminution émotions douloureuses but psychothérapies prétention enseignements anciens c'est guérison définitive toute souffrance disparition possibilité souffrir paraît vraiment important beaucoup plus perdre détails divinités tantriques mandalas tibétains est-il possible être humain cette vie non paradis après mort démonter jusqu bout mécanisme fait souffrance aucun sage jamais jamais épargné causes apparentes souffrance trahi meilleur disciple autre calomnié critiqué attaqué troisième rencontre.de grandes difficultés financières autre torturé comme cela cas histoire aujourd hui certains sages tibétains. appelons problèmes difficultés soucis est-à-dire causes extérieures disparaîtront mécanisme fait souffrance peut disparaître affirmation tous enseignements quels promettent tous état liberté intéd toute crainte comp disparition crainte toute promesse mythe con teen illusoire phurs uen létement cle siècle our saine siè- consoler bercer est-ce vrai connaissance psychologique
25,26,faut payer finalement cette question motivé animé pendant toutes années voyage recherche conviction aujourd hui cette promesse leurre véridique contre autre conviction rajoutée moins être génie comme existe deux trois siècle parlons exception faut payer prix élevé effort persévérance acharnement prix sûrement plus important plupart occidentaux intéressés genre spiritualité estime expérience montre très grande valeur bon marché dis possible dis facile rapide remarqué occidentaux impatients espéraient toujours domaine résultats très rapides personne imagine peut devenir grand pianiste grande danseuse classique grand médecin spécialiste deux ans raison heure semaine beaucoup pensent deux ans raison demi-heure jour méditation peut atteindre sagesse cette espérance paraît contradiction tout voir vérifier moimême seulement heure méditation dix-huit heures méditation jour parfois suffisantes autre aspect beaucoup impressionné années recherche beaucoup impressionné parfois intense malaise personnel rencontrer certains indiens européens exemple bénéficié chances dont contentais rêver est-à-dire passer vingt ans vie place ashram hindou lieu être obligés reve- nir salles montage télé- vision bout vingt ans conditions paraissaient idéa- toujours anxieux jaloux brouillés autre disci- ple susceptibles peu tolérants vais permettre expression peu forte dépasse pensée certain moment cela fait froid dos compris fallait trouver autre chose pratiques spir rituelles telles elles présentées telles pratiquais jusque-là rendu chez maître hindou ose peine dire hindou tellement au-delà toutes formes chez maître indien trouvait être fois tradition ancienne régulièrement 1ntié gourou très bon sanscritiste certes cas tous swamis jeunesse formation scientifique sens aigu appelons psychologie moderne comme accès toute littérature anglais plupart ouvrages sigmund freud maître manière plus régulière comportait comme maître traditionnel inde obligé voir face certains aspects moi-même prendre bras-le-corps propres émotions plonger propre inconscient faire tout travail auquel fait allusion tous enseignements sous nom récurage mare purification profondeurs psyché termes plus moins vagues aperçu fait allusion partout travail l'avais encore jamais pratiqué risquais bien jamais pratiquer rencontré gourou particulier aucune prétention psychologie comme tout français peu cultivé cer- tain nombre livres freud jung adler autres dis aucune prétention psychologie comprend bien but psychothérapeute trans- former moins certaine mesure l'être client considérant difficulté vivre vient lui-même seulement société conditions extérieures pourrais dire suivi jusqu'au bout chemin sens oriental mot chemin psychothérapie poursuivie plus loin psychothérapies habituelles font est-à-dire aller jusqu rix élevé effois iti tale possibilité dia fre découvrir urnes appelle très souvent cœur entre l'axe profondeur d'autres mots tels consciencesoin var exemple établit lab peur donne l'absence l'extraordinaire impression être porté l'existence non plus avoir porter fardeau existences diriez-vous jeunes viendraient voir souhaiteraient mener vie spirituelle jeunes nombreux parfois très jeunes quelquefois étonné voir comment lycéens lycéennes quinze seize ans écrivent lettres n'aurais jamais capable écrire avant vingt-trois vingt-quatre ans montrent maturité dont totalement dépourvu âge dont crois peu près tous dépourvus génération concerne sens vie dirais jeunes abord quand jeune comme j'ai aussi dix-huit ans vingt ans vingt-quatre anis sou viens mal trouver place cette société matéria- liste appelait encore société consommation pétait déjà ceux sentent plus perdus voudrais promettre presque solennellement espoir sortir vain peut-être sortir beaucoup plus loin osent rêver faudra payer prix moon expérience amène consi- dérer comme plus important l'une ane enr merde côté magnifique vie spiri pautre pirituelle recherche iri spiri- tuelle aboutit rien fuite comp main totalité lité exis
26,27,tence vais être peu sévère peutêtre sévérité appliquée moi-même conséquent peux utiliser peut être plus moins raté nullité grand nombre domaines essayer compenser cela réussite spirituelle cette réussite spirituelle fausse réussite spirituelle tout fait égocentrique alors but toute ascèse dépasser cet égocentrisme être libéré engagez jeunes essayer modifier société actuelle risque utiliser spiritualité comme compensation comme anesthésiant méditation outrance peut-être simplement anesthésiant presque stupéfiant bien encore fuite refuser vrais problèmes cracher société consommation imbéciles matérialistes travaillent bureaux faire l'argent spiritualité consiste faire brûler baguettes encens lisant krishnamurti écoutant ravi shankar cela mènera jamais disparition souffrance cela peut être immense mensonge souviens avoir parlé fois jeune pendant heure moins expliqué refusait complètement argent seule spiritualité intéressait terminé disant bien dommage comme dit proverbe monde mal fait parce récemment quelqu'un cherchait jeune très bien fait paffaire remarquez c'était intéressant c'était 000 deux premiers mois 000 bout troisième mois jeune méprisait argent bondi exclamant qu'est-ce dites intéressé passionné face vérité lui-même genre situation dizaines dizaines exemples sous yeux éprouvé besoin autre chose monde matérialiste proposait certain n'aurais passé sinon dix années vie sillonner iran afgha- nistan inde propre voiture maître maître sage sage comprends bien cette nostalgie autre chose chez tant jeunes intéressant cette autre chose devienne réalité comme dit inde inclut tout embrasse tous aspects existence jeunes dégoutés société consommation peuvent aussi engager action politique quel rapport voyez-vous entre politique spiritualité recherche spirituelle incompatible action société upanishads parlent sage temps souverain existe aussi exemple illustre prince l'épopée indienne histoire rama disciple grands sages ermite forêt marc-aurèle lui-même sage tout empereur spiritualité incompatible fait avoir action société compris militer parti politique âme conscience tout cherchant dépasser illusions aveuglements émotions motivations inconscientes certains psychothérapeutes considèrent troubles émotion- nels gens viennent consulter directement produits société laquelle vivent pathogène guérison personnes passe abord transformation société affirme possible moins titre individuel personne plus autre personne plus autre personne guérir avant attendre société transformée concerne ceux approchent toujours encouragés être vrais rapport eux-mêmes fidèles eux-mêmes tels voient choses aujourd hui surtout mentir certains lecteurs livres contact assez étroit engagés action politique parfois actions politiques divergentes intervenir sim- persévérance acharnement plement aider ceux tant peu confiance connaitre mieux mieux connaître mieux mieux leurs motivations profondes manière leurs actions vraiment actions non uniquement réactions seriez-vous accord formule selon laquelle faut vivre monde tel non propre monde etre monde non monde idée retrouvée partout enseignement gurdiieff disait vivre monde subjectif rêves mêlent réalité vivre monde objectif est-à-dire voir choses comme elles propre gourou employaïît expression sanscrite bien connue fatva darshi désigner celui voit réalité telle voir réalité supposer cette suprême réalité métaphysiciens existe possible voit abord telle toute simple réalité quotidienne instant instant arnaud desjardins sagesse ble ronde arnaud desjardins publié editions table ronde message tibétains 1972 chemins sagesse 1972 tome iii monde moderne sagesse ancienne 1973 ashrams 1974 yoga spiritualité 1975 recherche soi 1977 vedanta inconscient 1978 au-delà 1979 celà 1980 grain sagesse 198
