,page,text
36,37,fed illustrations pierre laffillé nee maximum exactitude possible tente retracer itinéraire intellectuel cours période fertile découvertes créatives contrairement-aux historiens biographes efforce construire modèle permettant découvrir voie suivie résoudre problème charles darwin mas 1809-1882 pouvez-vous donner exemple livre darwin recherche visait retracer changements pensée darwin cours dix-huit mois suivant retour londres après voyage beagle période travail théorique intense effectué sans témoins rapporté merveilleux cahiers transmulation cercles scientifiques jeune darwin alors célébrité très recherchée parvint malgré cela réserver moments tranquillité réfléchir idées capitales origine théorie évolution pouvez-vous expliquer plus détail façon travailler comment avez-vous utilisé cahiers darwin exemple cahiers sorte fourre-tout écrits terminologie propre darwin abréviations langage particulier pris comme explorateur face contrée sauvage lisant relisant cahiers demandé quelle idée directrice signifiaient notations cryptiques efforcé recréer processus réflexion jour jour essayé saisir courant pensée moments cruciaux principales découvertes faut très longtemps mettre point nouvelle idée pourrait prétendre contraire beaucoup gens aujourd hui encore ouvrages plus connus créativité celui d'arthur koestler acte création. titre résume conceptions acte koestler élément principal idée nouvelle bi-association réu- nion soudaine deux choses jamais combinées auparavant explique ailleurs jamais pourquoi deux seu- lement autre exemple théo- rie nouvelles idées instantanées réorganisation soudaine défen- due tenants psychologie forme gestalt agit processus différent toujours idée rapidité traduit français sous titre génie folie homme cri archime calmann-lévy 1980 rchimède
37,38,dernier paru collection confluents psychanalhtiques visiteurs alain mijolla sans être nécessairement possédés diable certains êtres changent souvent d'allure comportement voix surprise entourage comme s'ils trouvaient envahis ombre venue passé père mère grand-parent frère sœur disparus depuis longtemps serait-ce sous l'empire inconscient tels visiteurs rimbaud fui désert beethoven pris tutelle neveu karl freud conçu l'interprétation rêves c'est tout cas méconnaissance fantasmes d'identification animent tant d'hommes femmes condamnent vivre souffrir parfois mourir nom autre déjà paru anzieu carapanos gillibert green nicolaidis potamianou psychanalyse culture grecque delcourt oedipe légende conquérant précédé oedipe roi selon freud stein paraître finck thomas mann psychanalyse printemps 1982. cain rosolato rousseau-dujardin schaeffer trilung psychanalyse musique automne 1982 belles lettres raspail 75006-paris bon commande commande ... visiteurs fttc ... paiement joint chèque bancaire ccp 33657 franco port désire recevoir gratuitement catalo- gue éditions belles lettres renvoyer société d'édition belles lettres raspail 75006 paris pouvez-vous résumer évolution pensée darwin exemple avait-il déjà théorie évolution lorsqu'il comimença cahiers oui théorie assez étrange ailleurs point vue début 1837 darwin vint croire existait formes élémentaires distinctes appelées monades surgies génération spontanée monade terme employé également lamarck forme vivante élémentaire hypothétique monades originelles mises évoluer façon arbre branches irrégulières espèces différentes proliférant chaque branche darwin heurta bientôt problème comment certaines espèces disparaissaient-elles avait-il réponse cela très satisfaisante établissait parallèle entre individu espèce durée vie espèce dépendu monade originelle lorsque celle-ci fait temps diverses espèces auxquelles donné naissance mouraient également assisterait donc disparition masse espèces entières .fossilisées formations géologiques telles traces retrouvaient effet absence preuves constituait seul problème darwin sortait cinq années lutte intellectuelle contre théorie dite catastrophes -concernant évolution terrestre croyait plus mythe biblique déluge doutait phénomènes permanents proviennent désastres soudains grande échelle théorie monades donc effondrée elle-même oui donner lieu théorie évolution cours année 1837 darwin dit cer- taines espèces anciennes pouvaient donner naissance nouvelles idée importante car découverte fossiles montre espèces anciennes tantôt survivaient tantôt disparaissaient fallait toujours décider quelles espèces demeureraient lesquelles engendreraient lignées différentes manquer encore mécame sélection exactement mystere claircit septembre 1838 orsque darwin lit distraire l'essai malthus péc tion darwin frappé lutte survivre ire malthus variantes favora espèce tendraient durer tan dis variantes défavora tendraient disparaître résu rait apparition nouvene darwin darwin visualisé origine espèces sous forme arbre branches inégales espèce fallut encore quelques mois darwin arriver principe sélection naturelle cela donne aperçu lenteur complexité réflexions darwin préliminaires grande théorie tout fait minute magique. n'êtes seul psycholo- croire lenteur ppro- cessus évolution intellectuelle non bien sûr précisé- ment côté passionnant découverte pia développement enfants déro puisque maint geons travai de-comp développement radicalement diffé- certaines ristiques communes saractéî cependant difficile géné- îse 4-partir seul échantil- étudié fond
38,39,fais aussi recherche quantitative seulement lorsque indiqué comprendre structure exemple émergence théorie hautement organisée mesure variables isolées risque conduire impasse l'élaboration théorie évolution l'élément prépondérant trouva être image arbre nature branches inégales premier schéma darwin rectifia maintes fois sous forme extrêmement travaillée schéma constitue unique modèle l'origine espèces efforcé retrouver tous diagrammes arbres effectués darwin cours années chacun comporte petite différence souligne point particulier m'étais concentré seule variable exemple références sujet donné comme hybridationi j'aurais incapable déceler structure évolutive réflexion arbres darwin sont-ils bien connus tout naturellement tout monde connaît celui origine plupart autres enfouis collection manuscrits ami martin rudwick écrit collègues historiens sciences comme plupart psychologues orientation trop verbale intéressent assez langage visuel science oubli arbres darwin constitue bon exemple j'appelle type visualisation image grande envergure telles images sont-elles courantes percées créatives elles probablement essentielles ans einstein imaginaïit porté faisceau lumineux telle image observateur déplaçant lui-même objet observé conservée théorie relativité élabora beaucoup plus tard gens créatifs sont-ils seuls avoir telles images j'imagine possédons tous créatifs fabriquent nouvelles servent constamment travail images grande envergure outils d'expression prenez image gaz comprime récipient clos peut servir compréhension toutes sortes situations explosives volcans révolutions sociales l'expression sexuelle comprendre réflexion freud exemple faudrait voir comment emploie cette image volcan également étudié vies nombreuses autres personnalités créatives domaine sciences arts quelles caractéristiques distinguant personnes hautement créatives chose certaine diffèrent tous entre attirés chacun cause œuvre particulière pourquoi alors attendre trouver semblables peut dire piaget einstein seize ans einstein s'imaginait porté faisceau lumineux l'observateur déplaçant objet observé devenu plus plus abstrait tandis darwin atteint degré abstraction maximum dès début cantonna prendre orientation plus concrète vers fin non seulement façons travailler différentes leurs courbes développement divergent cela signifie-t-il individus créatifs rien commun non non existe certainement caractéristiques communes d'une part être créatif nécessaire avoir grandes connaissances cultiver compétences spécialisées darwin étudia moraillest huit années durant connaissait mieux quiconque léonard vinci dessina milliers mains. caractéristique plus générale vie créative dur long travail travaillant naturellement transforme difficile autres devient aisé physicien freeman dyson décrit comment adolescent découvrit calcul-intégral passa tout l'été travailler comme fou résolvant tous problèmes proposés gros manuel sujet aprés cela calcul intégral devint presque instinctif entendre tout dur labeur paraît presque amusant oui autre caractéristique l'individu créatif amusement préféré travail rappelez-vous darwin lisait malthus distraire créatifs combinent donc goût prononcé travail capacité s'amuser seraient-ils bourreaux travail george santayana décrit fanatique comme redoublant efforts dès perdait sori objectif vue gens dont parlons perdent leurs buts vue bourreaux travail psychanalystes rôle motifs inconscients prépondérant créativité contraire remarques impliquent but conscient effet gens étudiés tous tendance être forts robustes énergiques sentiment but global direction veulent prendre cette recherche objectif guide choix leurs entreprises individus créatifs réseau entreprises ceux peuvent facilement faire activités appa- remment différentes deviennent jongleurs très habiles processus entièrement conscient bien sûr tout grande partie bridation croisement entre deux indivi- taces plus rarement 'espè iffé- d'espèces diffé morailles tenailles maintenir nez chevaux difficiles ferrer
39,40,pouvez-vous donner exemple jongleries prenez cas bertrand russell cours très longue vie attaché philosophie mathématique politique mondiale particulièrement pacifisme plus tard désarmement nucléaire agissait projets précis fin bien déterminée entreprises continues permanentes parvint orchestrer très habilement vers fin première guerre mondiale emprisonné autorités britanniques écrits contre guerre écrivit articles philosophiques réclusion introduction philosophie mathématique voilà j'appelle jongler tous créatifs ont-ils .un réseau entreprises aussi vaste celui russell autres géants étudiés commençons peine aborder sujet avis tous réseaux créatifs aussi étendus diffèrent portée complexité durée projets personnes étudiées jusqu'ici possèdent ensemble objectifs assez complexes durables ont-elles technique destinée mettre objectif entre parenthèses concentrer autre pense créatifs peuvent mettre problèmes entre parenthèses savent lorsqu question importance fondamentale peut encore être résolue faut mettre côté pendant certain temps moins tourner vers peut être fait telle mise entre parenthèses serait-elle utile tout monde pratique utile oui dangereuse fait habitude peut mettre entre parenthèses légère élément avèrerait capital traiter peu ténacité savants travaillent fron- tières inconnu mise entre parenthèses revêt souvent caractère urgence cas newton postulant lexistence gravité fallait présumer corps pouvait agir autres corps distance idée étrange plaisait plus détracteurs doutait bien cause devait être liée structure interne matière trop tôt savoir savait assez époque structure matière donc mis problème entre parenthèses darwin rencontra obstacle similaire élaborant théorie évolution devait faire hypothèses hérédité aucune théorie génétique utilisable existait moment travaux mendel connus beaucoup plus tard gruber tous créatifs adorent travail n'auraient idée d'en faire autre psychologue philip -johnson-laird suggère nécessité savants machine détruire éliminerait champ attention problèmes risquent retenir années durant sans qu'ils puissent trouver solu- tion exactement fait darwin lieu évacuer pro- blème génétique mettait régulièrement entre parenthèses attaquer nouveau cette façon examiner périodiquement domaines difficiles rappelle cartes médiévales lesquelles régions inexplorées marquées noms séduisants tels mers inconnues terre dragons plupart entre face problème obstacle tendance fermer yeux éti- queter inconnu grands créa- tifs étudiés préfèrent oser société donnée conformiste grand-chose japon aucune culture peut être monolithique efforce pression conformisme dont parlez combine peut être japon vision nature différente perspective occidentale conception homme comme participant nature lieu dominer telle notion peut-être très utile accom- plir tâches intellectuelles définies jusqu présent étonné atti- défier monde quoiqu soudécrit darwin comme homme prudent maladif bonne dose courage physique nécessaire cinq beagle courage intellectuel publier théorie attirerait immangue ment colère famille amis sans parler clergé anglais vent cela évoque sujet délicat peut-il avoir gens créatifs société punit sèverement ceux rompent certains japonais exemple demandés pourquoi peu prix nobel remportés leurs chercheurs explication possible japon attache telle importance conformité groupe individu isolé redoute montrer trop initiative ainsi immenses progrès technologiques accomplis japon travail d'équipe trouve personnages faustiens comme science occidentale cette question comporte fait deux parties concerne faust isolé pense existe beaucoup exemple lorsqu einstein immergeait profon- dément sujets plus abs- traits encore compagnons parler souvent beau- coup autre partie demande peut devenir trop connais imaginez révèle plus fructueuse plus éclai- rante besoins futurs mettez oute créatifs solement idé généralem gérée darwin ent exa piaget travaillaien
40,41,"tous deux très bien autres newton constitue sans doute cas extrême isolement scientifique connaissance rapports scientifiques importants fructueux collègues quel genre relation créatifs leurs pairs contentent-ils travailler sein équipe point important individus créatifs doivent utiliser leurs compétences mettre place environnement favorable travail doivent inventer nouveaux groupes pairs adaptés leurs projets fait être créatif implique lance nouvelles directions lieu accepter rapports tout faits créativité comporte donc clairement part courage indiscutablement non seulement courage dire choses nouvelles parfois dangereuses aussi celui remodeler monde personnel parfois cela arrive assez tard vie lorsque œuvre arrivée maturité demande être proclamée voix unique autres fois contraire courage vient très tôt ans bertrand russell exprimait déjà écrit doutes religieux extrêmement douloureux notaït pensées journal intime lequel prit peine inventer notation secrète faite lettres grecques orthographe phonétique anglais courage avouer famille croyait plus existence âme immortelle celui affronter réflexions coûtaient beaucoup cinquante ans plus tard courage défendre point vue public valut perdre poste city college new-york courage labeur acharné jongler entreprises sans jin ... malgré allusion amusement tout cela semble écrasant fait aventurer linconnu affaire sérieuse exaltante aussi trouvé chaque fois créatifs adoraient travail idée faire autre stimulés idée d'accomplir grands desseins façon prendre plaisir pourriez-vous nommer deux trois artistes scientifiques dont aimeriez explorer pensée point vue créativité m'intéresse interpénétration différents niveaux expérience rapports entre diverses modalités pensée recherche donc particulièrement gens travaillé plus milieu dont modalités réflexion particulièrement intéressantes peintre-poète william blake constitue bon exemple ainsi inventeur-théoricien thomas edison cadre référence conceptuel reste encore découvrir saurait manquer être fascinant avez-vous quelque chose dire conclusion oui trop ignorants façon dont gens travaillent ensemble exemples magnifiques collaboration marx engels russell whitehead wordsworth coleridge helen keller anne sullivan picasso braque inhelder piaget marie pierre curie comment arrive-t-on conserver individualité tout unissant efforts talents ceux autre poursuite quelque chose transcende deux voilà question vitale survie humanité pourquoi dites-vous cela fallu années patiente collaboration entre individus créatifs arriver capacité actuelle détruire environnement nous-mêmes pollutions diverses surtout l'affrontement thermo-nucléaire processus auto-destruction progresse très rapidement présent besoin effort colossal créativité coopération concevoir mettre pratique solutions nouvelles telle tâche appelle génie solitaire solution doit trouver nouvelle manière penser d'agir cal eee vtt css \le comment j'ai rencontré eric comme romantique vis temps j'ai pensé qu'il plus intelligent choisir l'homme vie parmi garçons dont façon vivre caractère tempérament conviennent vraiment maintenaïit plus heureuse femmes eric garçon épanoui crois alors faites comme commencez rénseigner agnès lon international institut psychologie fondé 1950 paris bruxelles geneve bon gratuit veuillez m'envoyer sans engagement sous pli neutre cacheté livret d'information couleurs couple nouveau mme mile prénom .......... ......... age ionrrance 75009 paris tél 526,70.85 seini-lazare ion rhone-alpes psr .av rockefeller 69003 -té ion midi-aquitaine psn sales demoiselles 31400 toulouse tél 53.25.95 gion belgique psb r.dumarché-aux- 105 1000 bruxelles tél 511.74,30 ionsuisse pss rue petitot c.p 283 1211 geneve tél 022 75.0"
41,42,———— jean coguelle/en argentine homosexuels disparaissent chili abattus pleine rue bien souvent policiers fusille iran enferme cuba union soviétique pays législateur prévu peines pouvant aller jusqu cinq années travaux forcés loin combien civilisations grecques romaines tenaient homosexualité plus honorable hétérosexualité alors celle-ci émanait aphrodite populaire vulgaire celle-là procédait aphrodite céleste supérieure l'homophobie religieuse l'homophobie médicale interdit pèse homosexualité vient tout droit religion judéo-chrétienne origines condamnait raisons plus politiques morales communauté devant accroître numériquement sexualité non productive trouvait rejetée volonté nataliste donc directement placée sous autorité dieu incontestable appliquée laïcs devenus bras séculier clercs uniformisation religieuse puis sociale conduisit sait massacre cathares mise mort homosexuels bien religions procédé ainsi sorte anathème ancée contre homosexuels fait derniers autant infidèles considérés comme hérétiques avant être jugés comme éléments troublant ordre social bafouant morale bref après avoir transgressé loi divine phomosexualité tombée sous coup loi civile peu peu privé sori support raisonnement sans doute fatal mécanisme invalidation sociale enclenché automatiquement l'interdit pèse homo tout droit religion judéo- résister parce croyaient guère mansuétude législateurs non plus celles prêtres homosexuels entrepris médicaliser comportement base cette tentative postulat punit malades fait allemagne fin xix® siècle apprête adopter loi réprime actes contre nature entre hommes femmes exclues cette disposition jusqu avènement nazisme afin lutter contre texte médecin hongrois forge nouveau terme 1860 karoly maria benkert crée mot homosexuel grec homo semblable latin sexus double échec non seulement paragraphe 175 nouveau code pénal allemand adopté homosexuels encore souffrir nosographie aberrante certains médecins comme krafft-ebing homosexuel devint épileptique hérédo- .syphilitique alcoolique tout cas dégénéré ainsi homophobie légale judiciaire doubla homophobie médicale aussi redoutable première 1884 médecin américain préconisait bains glacés soigner homosexuels partir 1893 jusqu 1953 autres praticiens firent apôtres castration rare voir magistrats décider eux-mêmes l'opération moins généreux 1is laissent justiciable choix décider seul remède scalpel peine prison 1933 américain forest potter atrophiait thymus glande super-active soumettant expositions rayons but reconstruire caractère masculin combinant extraits post-pituitaires adrénaline concentré testiculaire procédé faisait également appel psychothérapie psychanalyse thérapie devient supplice autres praticiens recours méthode pavlovienne dite inversion non exempte sadisme cette méthode consiste associer fantasmes homosexuels maladies injection émétiques provoquant très péni- bles nausées recourant chocs électriques particulièrement douloureux deuxième temps adeptes telle techni- employaient associer sug- gestion hétérosexuelle drogues euphorisantes résultats presque toujours nuls citons médecins britaniques weïinberg belle thérapie aversion expérimentée homosexuel mâle problème cardia- technique curative supposait création nausées chez patient émétiques seconde partie traitement comprenait sortir sexualité vient chrétienne
42,43,2861 haianvyp ebl 3190710h94sd saypaxrig asmot anueab suod pnosqugno ons joyovug ésr aprojpo puaisnpoxe l82pf udfois 24niui2x 17270 rss epnssosth +25 step
43,44,conversations associant nausées fantasmes idées plaisantes érosexuels momens lappoint quelques doses l.s.d cas présent patien mourut crise cardiaque prove quées usage émétiques inutile attarder ravages causés régime hitlérien responsable mort plusieurs centaines milliers homosexuels entre deux cent vingt quatre cent mille quand nétaient parqués camps extermination hommes porteurs triangle rose condamnés expériences médicales nazis également franquistes espagnols pratiquèrent lobotomies pré-frontales nulles quant réduction homoérotisme cette opération particuliè rement redoutable plan psychique puisqu'elle provoque troubles graves personnalité sans dire hypnose psychothérapie inspiration psychanalytique également utilisées résoudre combattre homosexualité plus efficaces autres moyens procédés présentent mérite infliger souffrances physiques patients théoriquement moins depuis pon connaît cas psychiatre français pratiquait bien art culpabilisation massive clients mort suicide littérature médicale traitant homosexualité abondante quelques exceptions près agit réquisitoires destinés justifier mise écart supplices thérapeutiques partir seuls cas observés leurs cabinets nombre médecins établi généralisations sans prendre compte homosexuels nombreux éprouvent besoin consulter fondant approche pourrait affirmer hétérosexualité forme maladie mentale titre homosexualité souviens confie psychiatre ernest van den haag force avoir entendu confrères répéter tous tons clients homosexuels malades fini rétorquer clients hétérosexuels aussi ... névro1 jonathan katz gay american history cité guy hocquenghem race ep. hallier sychoses existent parmi tout comme elles exisles hétérosexuels uns courent psychothéd ensult homosexualité inéluctablement associée autres manifestations déséquilibre homosexuëé tent parm autres médecin homosexuel trop souvent médecin appare législateur élas discours nte celui clergé jadis peut-être cette attitude explique-t-elle conservatisme semble-t-il imprègne corps médical sait effet médecins doivent rendre compte leurs activités conseil ordre organisme sourcilleux plan morale conventionnelle scandalise volontiers non-conformisme aussi curieux cela paraisse psychiatres intimement persuadés homosexualité phénomène naturel titre hétérosexualité osent affirmer crainte affronter jugement leurs pairs quant action association médecins homosexuels reste france quelque peu souterraine d'une manière générale sans angoisse certains psychiatres psychologues dont phonnêteté intellectuelle saurait être mise doute admettre nombreux homosexuels majorité peut-être sentaient bien peau jouissant existence harmonieuse voulant changer orientation affective homophobes .sont parmi beaucoup expliquent confort d'âme homosexuel heureux image pervers installé perversion cependant con- sidère force constance l'oppression sournoise pèse cette catégorie humaine faut bien mettre petvers installés malité hétéils subi
