,page,text
52,53,voir enfin clair vous-même aaa met lee voir comment juge voir meilleures chances tndesplusiimportants centres hrançais graphologielanpliauéel complet etavisualisé consultation spéciale formule nouvelle conclusions développées conditions tout fait exceptionnelles tel examen honoraires 280 seulement lesquels n'adressez demande participation frais solde 210f n'étant réglable qu'après réception l'étude satisfait sinon renvoyez celle-ci jours devrez plus rien inconvénients nombreux tests s'appuie l'étude scientifique l'écriture c'est-à-dire sut l'une meilleures méthodes psychologie moderne chaque diagnostic entièrement établi spécialiste doit rien ordinateur pius tous dossiers contrôlés fieschi graphanalyste diplômée dont l'expérience porte plusieurs milliers d'examens professionnels privés suffit renvoyer bulletin ci-dessous direction diagnostics centre sésame rue rouvet 75019 paris accompagné d'un spécimen écriture d'une simple participation frais recevoir confidentiellement remarquable étude comprenant comment autres vous-voient schéma couleurs fonctionnement personnalité indique principales tendances apparentes cachées premier lieu l'image peut surprendre autres font parce chaque cas traité plus grand soin parce qu'une telle consultation doit être placée sous signe confiance qu'une telte consultation doît être placée sous signe confiance qu'une telle garantie offerte recevoir bilan visualisé meiljeures conditions suffit d'utiliser bulletin spécial ci-dessous trois raisons donc faire établir propre bilan visualisé vôtre celui d'un tiers car bien entendu cette étude également réalisable mieux connaître autre personne suffit celà légitime propriétaire delun écrits exemple lettre destinée considériez résultais l'étude comme strictement confidentiels caractéristiques fond tableau descriptif repère précise clairement caractéristiques positives négatives définissent mieux plans l'intelligence l'affectivité contacts action qu'il s'agisse propre bilan celui d'une personne proche raison saisir l'occasion vousestofferteaujourd hui effet centre sésame propose cette n'attendez conditions ci-dessus peuvent être garanties courte période chaque diagnostic établi contrôlé fieschi personnellement seul nombre limité dossiers peut être traité délai normal dee bulletin consultation confidentielle donnant droit bilan complet visualisé personnalité person itéd'unti pfus ans bilan conclusions développées établi parle sésame honore res 280 seulement lesquels adressez bulletin participation frais solde 210f réglable jours réception l'étude sauf renvoyez celle-ci délai non satisfaction auquel cas devrez plus rien peut changer plus d'annotations main graphanalyste conclusions pratiques répondent questions soulignent tout peut accélérer contraire freiner épanouissement réussite ci-joint spécimen écriture l'écriture d'un tiers document dont déclare avoir libre disposition joindre bulletin scripteur sexe maséulin féminin age sesseussseses douce deré- niveau d'instruction dprimaire clsecondaire supérieur rence lettre courante l'étude spéciale propose ici centre technique signature défaut sésame n'est donc simple test rare situation famille célibataire marié nbre d'enfants vpiusieurs autres docur ment fond choses analyse fleuve l'essentiel souvent noyé faitun véritable check-up psychologique sous formetrès claire éonneun maximum d'informations directement utiles évolution person- profession activité principale ................... sesseseessseses reres r6co ics demande cette étude but mieux connaître mieux connaître ess meet résoudre problème particulier ci-joint letire explicative ete non tudes- documentation générale participation chèque mandat l'ordre centre sésame urgence nelle trois raisons bien simples expliquent l'étonnante efficacité nouveau type d'analyse système visualisation adopté éclaire mieux personnalité participe découverte découverte chacun sait voie royale libérer nombreuses forces chasser certaines angoisses s'engager meilleures voies technique d'examen utilisée supprime bien entendu cette demande conclusions considérées preuine etangsr frais part d'autre comme strictement confidentielles ci-dessus plus signature nom sssenesesesesseoossess pténoms ... ...... sessesesooes supplémentaires ....... rue lieu-dit .... ............... date signature code postatl ville ........... rte indispensable adresser d'urgence sous pli centre esser pli fermé sésame direction diagnostics rue rouvet 75019 paris
53,54,see ira
54,55,bien qu'aucun détruise harmonie nuit ... peinture makodo oshima psychologie 143 janvier 1982 danger extérieur ernest hartmann ongtemps couché bonne heure peutêtre a-t-il souffert marcel proust frayeurs nocturnes violentes dormeur assied brusquement lit prononçant paroles incohérentes agitant levant parfois terrifié invisibles apparitions instants bien aucun danger extérieur détruise l'harmonie nuit rythmes cardiaques respiratoires dormeur accélèrent point souvent doubler cauchemar cru pendant longtemps sait désormais tels phénomènes peuvent provenir deux causes différentes .le cauchemar chacun connaît mauvais rêve survenu tard nuit terme duquel éveille brutalement terreur nocturne venons décrire dont manifestations produisent durant deux trois premières heures sommeil. cauchemars bien sûr savamment analysés cependant jusqu date récente difficile interpréter études dont disposions donné confusion qu'elles entretenaient entre cauchemars terreurs nocturnes grâce travaux d'henri gas taut roger broughton charles fisher noûs capables aujourd hui distinguer identi- fier deux phénomènes durant nombreuses années équipe effectué études non seulement sujets normaux encore différents groupes malades quatre-vingts personnes questionnées permis d'établir rapports cliniques détaillés portant environ vingt cas ————————— terreur nocturne amnesie n'oublie cauchemar demeure gravé mémoire comme rêve frappant intense effrayant contre oublie terreur nocturne patient redresse agite sans être tout fait réveillé plonge nouveau sommeil lendemain part éventuelle brève image angoissante impression avoir supporté poids poitrine sentiment intrus entré chambre souvient rien existe truc permettant savoir l'individu victime cauchemars terreurs nocturnes suffit poser cette question cauchemars sont-ils rêves méthode emploie souvent cette question serbe aussi bien dores cauchemars
55,56,jusqu'où peut-on reculer limites mémoire curieuse expérience rapide montai premier compartiment parut vide sans douter qu'un compagnon invisible trouvait déjà dont conversal passionnante devait tenir éveillé jusqu'au matin train s'ébranla lentement regardal lumières stockholm s'éteindre peu peu puis roulai couvertures attendant sommeil j'aperçus alors face banquette livre laissé voyageur pris machinalement j'en parcourus premières lignes cinq minutes lus tard lisais avidité comme récit d'un ami révélait trésor apprenais effet tout monde possède mémoire mémoire suffisante réaliser prouesses fantastiques rares personnes savent servir cette merveilleuse faculté expliqué titre d'exemple comment l'homme moins doué peut retenir facilement après seule lecture attentive toujours notions aussi compliquées liste cent principales villes monde chiffre population parut invraisemblable d'arriver caser pauvre tête quarante ans énumérations interminables chiffres dates villes souverains fait désespoir lorsque j'allais l'école mémoire toute fraîche résolus vérifier livre disait bien exact tirai indicateur valise mis lire posément manière prescrite nom cent stations chemin fer séparent stockholm trehôrningsjé constatai qu'il suffisait d'une seule lecture pouvoir réciter cette liste l'ordre lequel l'avais lue puis sens inverse c'est-à-dire commençant fin pouvais indiquer instantanément position respective n'importe quelle ville exemple énoncer qu'elle 27° 84° 36° tant leurs noms s'étaient gravés profondément cerveau demeurai stupéfait d'avoir acquis pouvoir aussi extraordinaire passai reste nuit tenter nouvelles expériences toutes plus compliquées unes autres sans arriver trouver limite forces .bien entendu bornai exer- cices amusants dès lendemain j'utilisai d'une façon plus pratique connaissance lois l'es rit pus ainsi retenir incroyable facilité lectures airs musique j'entendais nom physiono- mie personnes venaient voir adresse rendez-vous d'affaires apprendre quatre mois langue anglaise j'ai obtenu vie fortune bonheur quantité suffisante c'est livre dois car révélé comment fonc- tionne cerveau voulez savôir comment obtenir mé- résultats acquérir cette puissance mentale encore meilleure chance réussir vie priez w.r. borg envoyer intéressant petit ouvrage documentaire lois eternelles succès distribue gratuite- ment quiconque désire améliorer mémoire voici adresse w.r. borg dpt 880 chez aubanel place st-pierre 84028 avignon nom aubanel garantie sérieux depuis 250 ans aubanel diffusent travers monde meilleures méthodes psychologie pratique dorlier bon gratuit -——-— découper recopier adresser iw.r borg dpt 880 chez aubanel place st-pierre 84028 avignon recevoir sans engagement part sous pli fermé lois eternelles succès nom prenom rue code postal age profession laucun démarcheur rendra visite eme mme net ceux dont terreurs nocturnes perturbent sommeil répondent manière ceux font cauchemars disent evidemment sans doute estiment-ils cauchemars rêves particulièrement épouvantables dès lors incapables imaginer cauchemar comme autre chose songe amenés raconter longue histoire emplie détails précis rêve devenu cauchemar fur mesure prolongement victimes terreurs nocturnes cauchemars sauraient être rêves question répondent toujours bien sûr non comme tout chacun individus rêvent ignorent jamais moments terreurs absolument comparables rêves dont ailleurs souviennent rarement cauchemar personnalité terreurs nocturnes semblent liées type particulier personnalité certaine forme maladie mentale cauchemars paraissent aller pair forme sensibilité qualifierons artistique moins observé auprès individus particulièrement sujets cauchemars plupart cas individus très ouverts souvent exposés psychoses dernier phénomène s'explique sans doute très seconde cycles sommeil nuit sommeil présente comme phén cing périodes quatre-vingt-dix minutes chacune cycle sommeil assez léger première phase approfon passant phase deux sommeil confirmé phase profond jusqu quatrième considérée comme forme repos revenir graduellement troisième sec première comme plupart rêves cauchemars sceptivité monde exténe leurs pulsions leurs désirs leurs peurs telle sensi bilité avère très utile expression artistique individus assez fragiles contrôlent diffici leurs impulsions éprouvent souvent plus grandes difficultés engage relation diffé- rompre rencient nettement sommeil caractéristi- état veille autan ques facilitent certainement développement rêves pulsions primitives connaissons tous l'enfant terreurs nocturnes led nombre adultes sans doute majorité affirment avoir cauchemars occasionnels beaucoup moins souffrent terreurs nocturnes troubles sommeil infiniment plus fréquents durant l'enfance entre trois huit ans enfant quatre environ souffre autre phénomènes plus victimes terreurs nocturnes leurs sentiments subjectifs épouvante moins prononcés chez adultes revanche manifestations somnambuliques hallucinatoires caractéristiques terreurs nocturnes non cau- chemars plus fréquentes chez l'enfant chez adulte enfants souffrent davantage terreurs nocturnes adul- sans doute parce système nerveux encore clique quatre premier
56,57,"années d'expérience permis équipe pluridisciplinaire d'intégrer pratique recherche partir courants psychanalytiques psychosociologiques actuels collectif ariane s'adresse tous ceux désirent retrouver mieux vie relations vie tout court propose groupes reguliers psychodrame analytique hebdomadaires soirée paris mensuels week-end l'yonne lyon psychanalyse yoga identité apparence image corps prochaines sessions corps vécu corps parlé expression corporelle analytique février expression dynamique personne session psychodrame janvier téléphonez 727.59.84 mardi jeudi vendredi de9h30à12h30eti4hà17 h30 écrivez collectif ariane rue hamelin 75116 paris ecole pacho-craphologie menthauxmtechniquesepsys chologiques cotsien genie organisme prive d'ensergnement distance fonde 1953 regu loi 12771 cours correspondance cours oraux sessions confé rences paris enseignement gradué professeurs spécialisés psychologie psychanalyse psychologie l'inconscient caractérologie morphopsycho logie graphologie orientation sélection professionnelles inscriptions toute l'année rythme d'étude individualisé conventions formation permanente documentation gratuite gaillat 12. villa st-pierre 94220 charenton tél 376.72.01 analyses lections pit professeurs etipréparationk complètement développé supposons terreurs nocturnes traduisent sorte désordre neurologique cerveau probablement tronc cérébral n'étant .pas encore parfaitement formé brusque excitation pendant sommeil profond peut produire décharge électrique mini-choc semblable légère crise épilepsie appui assertions rappellerons électroencéphalogrammes sujets souffrant graves terreurs nocturnes ressemblent parfois ceux épileptiques nombreux épileptiques plaignent terreurs nocturnes loin cependant idée selon laquelle victimes terreurs nocturnes épileptiques simple fait rassurer point aide parfois réduire nombre gravité incidents stress terreur nocturne terreurs nocturnes augmentent nettement période stress elles peuvent croître encore patient étouffe sentiments rancœur rage certaines personnes sujettes terreurs nocturnes après traumatisme psychologique perte parent divorce accident cas psychothérapie fournit parfois aide appréciable autre méthode administrer dose tranquillisants afin réduire quatrième phase sommeil cependant malgré bons résultats saurions trop conseiller tranquillisants raison leurs effets secondaires toxicité dépendance interaction alcool toutefois faut dramatiser terreurs nocturnes exposent parfois dormeur certains risques quelques situations extrêmes elles peuvent conduire accidents elles inoffensives dañs plupart cas bien sûr elles occasionnent inquiétudes désagréments quelle mère effrayée voir enfant agiter marcher parler état second confrontée cette situation rassure enfant certainement moins terrifié elle-même après quelques instants trouble allongera nouveau reprendra nuit ... comme avant bomet vademecum l'infirmière chirurgie volume relié toile 12,5 576 pages 136 vadecum l'infirmière chirurgie reflète plan adopté principales activités l'infirmière service chirurgie l'important trouver très rapidement renseigne ment utile permettra geste efficace voire salvateur rôle l'infirmière décrit précision justesse font livre référence indispensable samama infirmière salle d'opération fasc généralités digestif urologie volume 212 pages illustrées planches h.t cet ouvrage d'équivalent bibliographies existantes rôle général l'infirmière salle d'opération l'instrumentiste chirurgie digestive décrit après rappels anatomiques physiologiques indispensables chaque intervention sommaire œsophagectomie chirurgie l'estomac hernies hiatales chirurgie l'intestin grêle côlon rectum foie voies biliaires chirurgie pancréas rate chirurgie l'hypertension portale chirurgie d'urgence urologie. autres fascicules préparation sortiront courant l'année 1982. scc bon commande veuillez m'adresser ouvrage coché ci-dessous bomet vademecum .... 136f port port ci-joint règlement chèque bancaire c.c.p volets nom soso adresse samama fasc ... eme sos sonne esse retourner mate éteur moaotéreeomein"
57,58,bechtel jean-claude carrière ménage bien étranges rencontres côloye empereurs romains dictateurs sudaméricains calculateurs prodiges illuminés allemands milliardaires américains maniaques ordre savants étourdis fous littéraires sans oublier notaire trouvant travail journée suffisamment payé ajoutait note quelques heures nuit avoir rêvé affaire confiée morale sociale exige plus plus distinguions rien semblables tous hommes pareils grains sable devraient ressembler sacrifier singularité fanlaisie autel uniformité dictatures règne monstre cauteleux normalité plus bizarres écrivent guy bechtel jean-claude carrière yen voit rase tout dépasse reste membres parti fous toute façon cellule nul surpris apprendre iles britanniques bizarrerie trouvé terre élection effet dogme iné- branlable primauté indi- vidu laisse chacun liberté être soi-même est-à-dire cultiver différence cet art culmine art vivre georges brummel prince dandys anglais maître disait monde tout temps produit effet restez l'effet produit allez-vous-en cet ascète l'élégance détonnait silence étonnait souci capter apparences journée passait habiller l'ajustement cravate pouvant prendre trois quarts heure chaque essai ralé jetait prenait autre rien dehors tenue touchait excentricité comme folie comporte paliers ainsi livre bizarres guy monstres hizarres j-mé cès liberté être soi-même ... roland jaccard ouy bechitel ian-claude carriere livie bifarres offrant fratcde extranrdinalre personnoges cxfravagrants tous temps tous pays exceniriques originaux tyrans ermnlies iuminés solltatres dandys misérables cmpercurs ine venteurs deslunatiques manlaques yucls apoité irrégullers sexuels prècheurs oubliés den égarés cxallés aventurlers aveniurlères chercheurs d'absolu plusieurs porieurs vérités secrètes finir quelques hurluberius rdurt lthet amuse apprenant certain claude lognes autroche 1744-1832 écrivain traducteur français consacra vie rectifier chefs-d œuvre huménité après virgile trouvait impar- fait attaqua tasse horace milton améliora car selon manqué temps bien faire revanche peu inquiet lorsqu entend antoine fuzi théologien fin xvie siècle soutenir sang menstruel femmes pro- priété éteindre incendies perd conjectures ajoutent auteurs application pratique entendait tirer cette intéres- sante propriété enfin saisi vertige lisant biographie plus féroce despotes connu xixe siècle amérique latine francia folie président paraguay mant quil notamment postes danger social perme tre habitants communiquer chien jour aboyé derrière ordonna mise mort tous chiens capitale habitué voir foule courber devant demanda climat pays contribué voûter habitants donner penchement spécial tête prétendit faire examiner chirurgiens reste savoir arrête bizarrerie commence monstruosité précisément monstres physiques non point moraux entretient martin monestier ouvrage remarquablement documenté illustré rappelle antiquité considérait naissance monstres est-à-dire enfants présentant graves malformations comme calamité publique indi- quant colère dieux annonçant fléaux sans nombre apparition comportait signe occulte nom mons- tre rattache étymologiquement moneo signifiant averti aussi cachait-on sans remords tendresse contraire martin monestier présente dédie ailleurs livre celui are peus nommaient dieu mêmes oubliés livre bizarres guy bechtel jean- robert laffont 380 carrière monsyres martin monesti estier pont neuf 400
58,59,corps cosmos suite page culeux parmi malades ceux faut tout expliquer traitement état maïs lieu prendre référence métal fonction normale poumon éléments propos organes considère référence métal tristesse propos sentiments évident façon trop réflexion peut engendrer tristesse combattre celle-ci dominer loi dominance faut entourer joie feu-joie-cœur domine mentalchagrin-poumon donc plonger cette personne triste milieu bons vivants faire oublier état surtout effrayer faire peur conséquences possibles chagrin .l'aggraverait poumon-tristesse engendre loi engendrement reinpeur non inverse style raisonnement applique chacun cinq organes sentiments colère-joieréflexion-tristesse-peur chacun subit action relation chacun autres l'ensemble forme tout indissociable fois cela admis possible tiers aborder meilleures conditions excès insuffisances cet élément mama concept malade-maladie-psychologie malade acupuncture l'acupunouie partant non dissociation particulier reflet partie global ensemble complémentarité opposition /nn yang classification tout constitue être vivant selon loi éléments organes mouvements mental sentiments etc. résulte aspect psychique l'individu directement lié aspect matière-organe l'inverse toute perturbation psychique résonne ensemble lêtre vivant aucune dissociation possible domaine médecine psychosomatique absolue privilégierait aucun termes psyché soma 'acupuncture découle directement tel abord points cutanés acupuncture méridiens ensembles points existent comme reflet partie tout reste points méridiens résonance directe poumon exemple agissent sécheresse peau intériorisation l'individu façon surmonter chagrin etc stimulation points choisir fonction plus grand nombre paramètre connus acupuncteur prétend relancer toute insuffisance stimuler tel tel organe mot rééquilibrer l'individu quoi plus précis stimuler point servir aiguille tout art repose choix points facile lorsqu sait plus critères résultant loi éléments faut tenir compte environnement temps fait temps passe schéma ancestral héréditaire âge relation médecin-malade etc possibilités immenses justifient tous efforts quoi plus satisfaisant exemple faire disparaître fois bronchites répétition légère douleur l'épaule peau sèche humeur triste mélancolique frisant dépression simplement stimulant aiguille point situé avant-bras combien autres développements donner étude mode raisonnement oriental surtout lorsqu'il vient compléter connaissances analytiques occident jean-claude lacroix attaché consultation hôpital broussais chargé enseignement administrateur association française acupuncture formation psyghanalystes psychologues praticiens modulation selon disponibilité niveau chacun rend accessible tous renselgnements inscriptions rendezvous tout moment l'année téléphone 306.34.44 métro pasteur 182 rue vaugirard 75015 paris institut hautes études recherche appliquee idhera néopsychanalyse psychanalyse portée tous courte durée m.-n. cugnot psychanalyste président l'institut hautes etudes recherche appliquée donne personnellement rendez-vous consultations mène psychanalyses siège l'idhera téléphone 306.34.44 30-31/1 formation psychothérapeute 21/1 morphologie 22/1 graphologie paris personnalité relations interpersonnelles 30-31/1 formation concrète individualisée entretien soir d'après-midi séminaires journées d'études enseignement correspondance paris province lyon bordeaux marseille animée universitaires praticiens convention formation continue ————p— formations psychologie appliquée graphologie morpho-psychologie psychologie profondeurs caractérologie symbolisme psychopédagogie créativité formation d'animateurs orientation para-psychologie psychotechnique rorschach psychosociologie sexologie relaxation psychosomatique 0000000000 informations bureaux pur correspondance rue joubert 75009 paris tél 874.43.60 etablissement privé d'enseignement pese déesse eee demande sans engagement formule d'orientation sune documentation gratuite entretiens soir après-midi séminaires cours correspondance ps1 ans
