,page,text
0,1,ouérir voix cerveau nucléaire l'agressivité bonnel sexualité confiance rapporte rss fall arrnsez fes igngaage engnes francoise
1,2,mccann-erickson guy san preullen nes kes crier ess rnlee rose has
2,3,françoise dolto bouchon/afp laffont dalaïlama voix premier outil je\ vour communiquer autres chose trop tendance oublier psychologie demandé catherine dreyfus enquêter différentes psychothérapies centrées voix cette journäliste passionnée depuis plusieurs années développement personnel particulier intéressée alfred tomatis oreille électronique bien très différentes méthodes présentées câtherine dreyfus inspirent philosophie commune suffit bien souvent être plus aise voix sentir mieux corps être vivacité intelligence coutumiëère jrançoise dolto parle part mois-ci enfants inventent toutes pièces propre langage texte choisi rédaction psychologie extrait nouveau livre grande psychanalyste française séminaire psychanalyse d'enfants ainsi l'explique cet article grande clarté langages imaginaires découlent plus souvent conflits latents mère absence communication harmonieuse cercle familial françoise dolto décrit aussi enfants peuvent communiquer musique jeu comme tous français journalistes psychologie bouleversés histoire petit david alfred tomatis nov 1982 enfermé longues années durant parents placard demandés comment hommes femmes apparémment normaux peuvent martyriser ainsi progéniture marianne gomez terme long reportage livre réponse pareñts tortionnaires eux-mêmes graves problèmes familiaux erifance fait étonnant bourreäux d'enfants loin d'être cas sociaux apparaissent comme gens comme autres aimables voisin prenant grand soin chien psychologie présente enfin mois novembre document excéptionnel martine castello nouvelles techniques dépistage scanner maladies mentales obtenues grâce progrès fulgurants médecine nucléäire bon côté atome doit faire oublier dangers civils militaires saisissantes photographies couleur laissent voir nettes différences entre cerveau homime dit normal celui schizophrène dépressif profond présentons pärticulier photo cerveau john hinckley homme tenté dernier assasiner président reagan sommet deux hémisphères cérébraux traversé nombreuses fissures cette méthode révolutionnaire perce mystères cerveau grand secours diagnostiquer troubles psychiques donc mieux soigner psychologie
3,4,rea con directeur rédaction bernard loiseau rédacteur che urent samue nlsls informations scientifiques martine castello conseillers rédaction pierre chapelot daniel roumanof directeur artistique didier chapclot administration administrateur bertrand lobry secrétaire général agnès loiscau marketing guy laporte services administratifs chantal baste nadine gonthier micheline lecornec christine léoni yvette lombard andrée migeot editeur loft international byron 75008 paris sarl capital 000 paris 322 624 818 publicité loft-régie rue lord byron 75008 paris directeur général anne-marie lesage chef publicité hubert blin assistante christine paly abonnements toutes questions relatives abonnements réglement adressez-vous psychologie rue vanne 92120 montrouge tél 656.89.00 numéros france 165 dont tva etranger 185 abonnez-vous page ——— imprimerie sima-rotomag z.i sud rue epinettes 77200 torcy imprimé france dépôt légal novembre 1982 rnuméro d'imprimeur 802 £ommission paritaire 512 issn 0032-1583. diffusion nmpp mensuel dont tva ——— directeur publication bernard loiseau photos couverture rush gauche mage bank-martens droite kck aute sue mans terview contrat confiance intéressante thérapie j'aime bien see piblio® fol oloe msabilité pau nicipale pie mébiec activité militaire depuis s'abonner j'en j'ai mâles 407 ires mble décisions d'acheter nef mnce pout terres depuis prépare ativ massacres voici ci-joint mor tion bats ent conquê d'abonnement association française viols nage ommes vice-présieen chologie humaniste entièrement exclues epsycholoes complègne femme plus temps priorité gauche dune comment interpréter ersonne tendance ans fation débat group£s salle conférence ors d'échecs jogging autour res situer toujou gauc êmes interlocuteurs trices pro résoudre paysage consta ogging n'ai durant jbe rner sens sphère cérébral privi peuvent être pier face cachée miracle japonais 150 septembre 1982 message-flash silverman virginia adams donné très bonne description recherches l'utilisation messages subliminaux psychothérapie article choc messages-flashs psychologie 150 septembre 1982 affirmations nécessite cependant précision affirme effet certains chercheurs arrivés reproduire résultats réalité trois fois plus recherches recoupant résultats travaux recoupant tous venant scientifiques indépendants peu travaux sérieux psychologie peuvent avis targuer pourcentage aussi favorable vérifications lloyd silverman new york usa culine gont innées chaféminine culture jalisation sociale actions positives out place mot mement quel statut psychologues humanité planète âge nucléaire dire mouveles négociations désarlisabeth duval 13005 marseille syndicat national psycholoues adresse cette réaction information parue 150 psychologie septembre 1982 projfession psychologue coordination nationale organisations psychologues représente environ 000 000 psychologues exerçant france donc très large majorité entre autres représentés société française psychologie auteur déontologie adoptée plupart organisations psychologues syndicat national psychologues seule organisation nationale représenter adhérents toutes formes d'exercice psychologie syndicat psychothérapeutes syndicat psychologues l'éducation nationale etc entre syndicat quelques centaines membres comme psy quelques milliers professionnels enseignants praticiens chercheurs libéraux etc différence appréciable tous coordination nationale regroupe majorité pratitiens secteur public contrairement affirmations s.n.p syndi suite page
4,5,eee courrier agressivite sexualite gilbert tordiman zeste agressivité nécessaire vie sexuelle épanouie dla langage imaginaire enfants françoise dolto d'un conflit latent rhère nombreux enfants inventent eux-mêmes langage confiance rapporte moine bons vendeurs crééent climat favorable adaptant désirs interlocuteur vêtement cacher et/ou seduire dominique martin habits servent dissimuler corps mettre valeur attiser désir sle maison reèves test pratique franca barda dalaïi lama france luc trégnier maître spirituel aussi chef temporel trouver voix catherine dreyfus méthodes pratiques sentir mieux fois voix être découvertes tomatis cerveau nucleaire martine castello grâce scanner révolution diagnostic maladies mentales battus enquête marianne gomez parents maltraitent leurs enfants souvent gens presque comme autres certain regard être bien peau richard driscoll comment plus traîner problèmes comme autant boulets attachés pieds pse actualités calendrier woody allen cinéma livres petites annonces numero 152 novembre 198
5,6,suite page chothérapeutes aussi énormément adhérénts travaillant totalement partiellement libéral différence entre psy coordination opposition ic/privé public/prt problème comme signalez trop allusivement coordination nationale reconnait comme seule formation base d.e.s.s psychologie cinq années universitaires puisque loi française fait d.e.s.s diplôme visée professionnelle plus demande comme s.n.p fait depuis longtemps année stage auprès d'un professionnel l'acquisition titre affaire essentielle coordination veut habilitée importe quelle formation instituts privés dont sérieux toujours démontrable exige cursus universitaire n'est-ce uné garantie public psy oppose soi opinion respectable effet parlement aussi bon sens alignement autres pays plus avancés france tranchera s.n.p peut accepter écriviez propos article déontologie évoquant utilisation normal pathologique fins répressives cela préjuge actes concrets s.n.p présent combats significatifs liberté congrès psychologie libertés fait démonstration quotidienneté combat psychologie libertés actes-sud oct. jean-luc viaux secrétaire général syndicat national psychologues rue pascal 75013 paris coordination nationale orga- nisations psychologues raison dénoncer formations peu sérieuses proposées certains instituts privés n'est cependant évident qu'une for- mation universitaire constitue public garantie absolue compé- fence idées méthodes nou- velles naissent souvent dehors monde universitaire dori- mage psychologie française priver apports proposition formulée psy contrôle public formations privées repré sente donc solution moyenne manque bon sens maintenant parlementaires juger illumination intensive con ersonnes intéressées communiqné séminaires intensifs pillumination paru avant page numéro d'octobre psyco10 souhaiteraient sävoir peuvent gie approc cette davantag jéques jon intensive référer ouvrage panafieu l'illuminatio retz vertus téléphone j'ai frappée information téléphone ment psychologie 148 juin 1982 etant journaliste pigiste j'ai moi-même souvent remarqué téléphone donne interviéws biens meilleurs résultats contacts tête-ä-tête gens révèlent beaucoup plus facilement leurs opinions leurs sentimients intimes voix sans visage quelqu'un assis face claudine martin boulay-lés-trôus dynamique émôtionrielle riche idée venons créer idbe institut dynamique émotionhelle exprimée souhaiterions porholsete puisse faire part lecteurs lancement nouveau centre dynamique émotionnelle fonde principalement expression émotions réintégration satisfaisante matériel psychique refoulé principaux inspirateuts chercheur américain casriel cette méthode psychothérapie intègre éléments empruntés différents courants psychologie humaniste bio-énergie gestalt primal techniques respiratoi- res néglige apport psychanalyse objectifs pidee suivants faire connat- qerique émotionnelle rechefche publi tions former théra come tents agréés fer joe mpé- formation cons entre praticien contrôle dynamique émotionnelle ider 75017 paris comme reconnai haïisse franklin singer pri article présenter tra vaux comme démontrée hypothèses pro pendant stimulantes zone existe-t-elle point tendûment établie voir recherche psychologie auteurs ont-ils seu perry non définitivement série incertaines das whipp vérité com ovocatricess l'existence féminin prés sexologues zone 151 octobre 1982 lement interrogé nombre suffisant femmes franklin singer raison interroger sétieux cette découverte arrière-plans idéologiques reste trop mesuré face semble rien être autre supèrcherie pseudo-scientifique trois sexologues américairis visiblement amalgamé faits séparés constatés chez certain nombre femmes l'orgasme vaginal éjaculation féminine etc. partir cela concocté cocktail liste best-sellers sans oùblier pimenter quelques exercices pratiques cette opération sans nul doute coup marketing réussi rien très sérieux avis existe autres recherches plus sérieuses sexualité féminine autres livres moins racôleurs sans doute leurs auteurs ont-ils moins sens relations publiques ceux point autres découvertes sexualité humaine fortement plaisir doute très françoise lefevre 75013 paris tous renseignements idee chet rue lecluse 75017 paris 294 pages numéro publiés l'accord dépone chology today publicationte mar- pany vor 10016 york u.s. not ion logi extraite numéro rase desmond morris rapp jüre enfin titre très bon livre jours msi extrait article page tou- delachaux niesils 151 reletien couple rem
6,7,mieux ci-dessous suffit renvoyer bulletin direction diagnostics centre sésame rue rouvet 75019 paris-accompagné d'un spé men écriture simple participation frais recevoir confidentielleme arqueble triple étude peut permettre voir enfin clair vous-meme tableau descriptifrepère précise clairement caractéristiques positives négatives définissent mieux plans l'intelligence affectivité contacts action voir comment juge schéma couleurs fonctionnement personnalité indique principales tendances apparentes cachées premier lieu image peut surprendre autres font voir meilleures chances plus annotations main graphanalyste conclusions pratiques répondent questions soulignent tout peut accélérer contraire freiner épanouissement réussite l'étude spéciale propose ici centre sésame donc simple test rarement fond choses analyse fleuve l'essentiel souventnoyé faitun véritable check-up psychologique sous forme très claire donne maximum informations directement utiles évolution personnelle trois raisons bien simples expliquent étonnante efficacité nouveau type analyse système visualisation adopté éclaire mieux personnalité participe découverte découverte chacun sait voie royale libérer nombreuses forces chasser certaines angoisses s'engager meilleures voies technique d'examen utilisée supprime inconvénients nombreux tests s'appuie l'étudé scientifique l'écriture est-à-dire l'une meilleures méthodes psychologie moderne chaque diagnostic entièrement établi spécialiste doit rien ordinateur plus tous dossiers contrôlés fieschi gra- phanalyste diplômée dont expérience porte psycho-billan isunise rsonnelle maîtriser voire image evolution professionnelle let vie affective voire présenté etude stricteun dépliant grand see ment personnelle format réalisée psychotableaux couleurs graphologue diplômé jale formule nouvelle plusieurs milliers d'examens professionnels pri conutae spéci ere mons éout vés fait exceptionnelles untel amer hong rai ire établir propre bilan raîres 350f seulement lesquels n'amsn vote d'un tiers car bien dressez demande particientendu cette étude également réalisable pation frais solde 260 n'étant régler mieux connaître autre personne suffit ble qu'après réception étude ené celà légitime propriétaire del satisfait sinon renvoyez celle-ci écrits exemple lettre jours devrez plus rien destinée considériez résultats l'étude comme strictement confidentiels cette garantie hors commun témoigne rare qualité cette etude maisle tarif honoraires peut être garanti courte période chaque cas examiné plus grand soin seul nombre limité dossiers peut être traité délai normal hésitez donc utiliser dès maintenant bulletin ci-dessous s'agisse propre bilan celui personne proche raison saisir occasion offerte aujourd hui effet centre sésame propose cette enr inirtinle ile bulletin consultation confidentielle n== donnant droit bilan complet visualisé personnalité personnalité tiers plus ans bilan conclusions développées établi centre sésame honoraires 350 fseulement lesquels n'adressez bulletin participation frais solde 260 réglable jours réception l'étude sauf renvoyez celle-ci délai non satisfaction auquel cas devrez plus rien ci-joint spécimen écriture l'écriture tiers document dont déclare avoir libre disposition féminin abb joindre bulletin spécimens écriture analyser préfé- scripteur sexe masculin niveau études primaire secondaire supérieur rence lettre courante technique signature défaut situation famille célibataire marié nbre d'enfants ... plusieurs autres docu- ments exemple dizaine lignes recopiées ci-dessus plus signature participation chèque mandat ordre centre sésame urgence particulière etranger avion ajouter 20f frais supplémentaires ... rue lieu-di leu-dit see esceueee date signature indispensable profession activité principale ........... csssssssess seen demande cette étude dansle butde mieux connaître mieux connaître diers pores résoudre problème particulier ci-joint lettre explicative informer études m'adresser sans engagement documentation générale bien entendu cette demande onclusions con part d'autre comme strictement confidentielles sidérées nom ........... ......... prénoms ................ ............ adresser d'urgence sous pli fermé entre sésame direction diagnostics rne rouvet 75019 paris
7,8,min res
8,9,tre personnalité voix reflet lumière cette constatation nombreux psychothérapeutes font travailler organes vocaux leurs patients retrouver timbre idéal plaît conclusion logique lorsque sent bien epuis dizaine minutes sons plus surprenants sortent fine jeune femme brune bouclée devant tangue tourne comme animal trace senteur alléchante feulements fauve défensive hurlements sirène folie trilles moïineau gémissements stridents chats sentier amour accords soprano baryton passe grave aigu énergie féroce douceur extrême facilité déconcertante entrecoupant tout gémissement rauques heurtés comme sanglots donner frissons dos ... margaret pikes ose aller jusqu bout elle-même rien voix étranger cela fait plus quinze ans travaille peut tirer pratiquement tout veut aucune note aucun cil aucune émotion font catherine dreyfus fille aer net 512 peur margaret appartient roy hart théâtre communauté théâtrale basée cévennes voix indépendamment mots instrument expression excellence fait partie nombre croissant chercheurs thérapeutes d'artistes explorent cet outil voient jeu mots doit rien hasard voie royale découverte soi-même travailler voix estiment-ils rien tel assurer maximum développement personnel sent bien voix être vice-versa façons plus gratifiantes parvenir rien plus personnel voix rien plus révélateur reconnaît yeux fermés ceux chers sent état bonne voix aujourd hui tiens qu'est-ce arrive drôle voix réagissons aussi instinct plus souvent sans savoir voix plupart interlocuteùrs timbre intonation peuvent transformer rencontre désastre coup foudre négociation éclair fiasco voix insupportables entend plus propriétaire dire passe-moi sel autres séductrices reste malgré soi sous charme voix hésitantes inaudibles elles appellent l'agression catastrophe autres forcées elles éraillent font
9,10,installé labora toire physiologi micro casque sut tête parlez. besoins ele revien qu'avec ere bout cer bégayer jentôt rrez plus parler tout drez momentanément ne. expérience parmi beaucoup d'autres mis évidence rôle l'oreille l'émission parole termes techniques c'est qu'on appelle boucle audiophonatoire parler émettre sons pout utiliser voix faut s'entendre c'est sut base constatations lsi beller mis point 1969 méthode rééducation troubles langage sémiophonie prend mal racine en-deçà lecture l'écriture parole langage naissance voix question base effet comment contrôler voix bien sûr utilisons sensation interne transmettent cordes vocales glotte pharynx etc c'est surtout grâce l'oreille pouvons connaître timbre justesse puissance voix vie courante contrôle beaucoup moins raffiné fait inconsciemment presque niveau réflexe appris écouter parler d'abord imisi trouve dons prédilection correspondant chaque culture européenne peutêtre cause région tête vibrent phonèmes langages nationaux assure marie-louise aucher néerlandais vibre surtout vers l'occiput l'arrière tête bas l'aire visuelle est-ce cela qu'il tant grands peintres pays-bas l'allemand vibre aussi l'arrière crâne peu plus haut sommet l'aire visuelle cela favoriserait plutôt vision intérieure d'où grand développement philoso- péveloppement tant l'autre nou ensuite réalisant sons uire capable troubles lecture l'écriture anifester enfant c'est signe auis trôle primordial pes enode façon satisfaisante ersé odes classi com étayer cette ile pédagogie malgré tout construir lue fondations lézardées s'emper contourner symptômes sujet réapprendre voix s'entendre s'écouter l'un8 tec lisées consiste augm sémiophone démontrer aigus stimulent centre langage cerveau sémiophonie utilisée principalement rééducation troubles langage chez l'enfant pourcentage important réussite peut aider comédiens chanteurs tirer maximum instrument permet également ceux apprennent langue étrangère d'acquérir bon accent d'entrer corps langue constance morel sémiophonie troubles langage dyslexie rééducation sémiophonique maloine 1973. vibrations sonôres facultatives mentales phie conceptuelle pays l'italien monte droit sommet tête zone cortex situe conscience pieds d'où qualités d'équilibre faciité naturelle naturel parfait complications sons entales quant gaonpais débouche près zone préf celle l'intell igence paques rationalisés nglais enfin problème dons iculiers seuls euro péens envoyer directement lèvres nance dre massage indre réso- crâne sans moin- vibratoire cerveau ées assurées por lles-mêmes ma. ent elles gfet autant plus respecte brutal reste généraprofon® onscient- ons jement inc apprend dons domaine n'est donne dicap surmontable dit uis-jacques ronde- chant dicrvatoire national art dramatique far instrument ualité obtenu musique manière indispensable m'est aire gymnastique retrouvée aussi simple marche vraie difficulté assumer laisser voix dire cequona dire offrir plaisir prendre s'offrir risque travers exprimer ... parfois mêême découvrir l'important c'est larynx émettre fait vibrer cordes vocales situées larynx fait dernières mettent rapprocher écarter périodiquement cisaillant l'expiration air contenu glotte note émise fondamental voix plus moins aiguë grave suivant rapidité fréquence mouvement liée partie longueur épaisseur cordes vocales pourquoi voix aggravent âge particulier moment mue cordes vocales développent fortement chez hommes jeu muscles larynx joue rôle tout déve important een l'étendue voix émotions plus sensible cou région gorge timbre acquiert passage ond sonore résonan ans cais naturelles consgore pharynx fond ent bouche nez ajoute grticulation mouvements lèvres loue mâchoire page osforment landonné encore tout fois malléable corps entier instrument vibrant plus
