,page,text
30,31,presque comme film d'alfred hitchcock crime presque parfait récemment ressorti écrans français daniel poire engagé tueur gages éliminer femme infidèle scénario comme voit tant d'autres montpellier ailleurs l'affaire devient moins banale c'est mari jaloux précisément choisi d'aller voir sompagnie file sophie d'hitchcock moment crime alibi puisque core trouve paris quelques entaines kilomètres domique res ars cile conjugal tout comme film grain sable fait déraper plan prévu femme débat tueur gages détale avant faire cueillir police complice tardent avouer forfait daniel poire arrêté retour coïncidence troublante moment vedette film grace kelly mourait suites d'un accident voiture triste fin cette grande actrice évoque quelque peu dénouement autre classique d'hitchcock soupçons rediffusé voici peu temps télévision film joan fontaine s'imaginait tort mari cary grant voulait tuer auto comme quoi réalité dépasse souvent fiction lve réussite profossionolle sociale aflect methodes d'action maurice restez toujours calme-serein-dynamique bio-harmonie apprendra vivre calme détendu malgré soucis contrariétés maîtriserez énervement irritation colères sautes d'humeur éliminerez peurs angoisses découragement baïsse moral irez facilement autres car sûr ferme bonne humeur réussirez mieux vie professionnelle sociale affective hyper-emotivité mal siècle stress vie moderne assaillent sans cesse plus être responsable cultivé plus ilest soumis l'hyper-émotivité car plus embrasse préoccupa- tions simultanées santé améliorera stress rongent énergie cause plus maladies apprenez éviter comprenant leurs mécanismes physiologiques retrouverez equilibre dynamisme vraie personnalité profonde riche d'atouts prendra dessus deviendrez heureux vivre malgré vicissitudes vie quotidienne confiance ira développant eee bio-harmonie changera vie façon spectaculaire méthode action étudier chez pratiquer chaque jour vie concrète simple efficace apprendra techniques maîtrise l'emotivité comment agir concrètement situations pratiques perturbent nouveau comportement positif tout détecter symptômes malaises d'origine émotive préserver maurice ogier institut français communication rue plaine 75020 paris tél 373.11.70 nation eau petit livre maurice ogier nouveau pitia cons lltt note ttl ————— lesr 28.779 comment maîtriser émotivité ans engagement sous pli confidentiel ainsi tous nselgnements concermant nouvelle méthode ac- ccs mcs one sos sds ssi
31,32,leo rue congrès tél respect personne thérapie primale neurolinguistique novembre paris rens jacqueline barbin a.f.p.h. rue dalou 75015 paris novembre paris rens boulangers 75005 paris 354.72.53. l'école milieu 26-27 novembre inscriptions c.d.a.c. sarrail 90000 belfort tél 21.22.63. société informatique matin midi soir 5-7 novembre grenoble rens autrement atelier création rue d'enghien 75010 paris marjolaine marché mieuxvivre 5-14 .novembre ateliers débats l'écologie l'alimentation médecines douces etc journée santé novembre conférence animée amis terre quai d'austerlitz 76013 paris conférences problèmes contraceptifs sexologie l'adolescence novembre 30. hôpital necker amphithéâtre claude bernard rens 727.96.67. psychosomatique quels buts médecine psychosomatique 6-7 novembre montreux rens senarclens 1052 mont-lausanne suisse tél 021.33.43.31. initiation l'interprétation rêves claude-marc perrot psychanalyste novembre centre galande rue valentin haüy 75015 paris temps vieillissement société organisé l'association internationale gérontologie psychanalytique 13-14 hypnosophrologie télépathie prénatale mère-enfant novembre 14h fyoody allen pouvoir consonmimateur fur anis gmpenve arr dodda rares rouge rie sex pal rens 33000 bor message monde moderne kovitch novembre grenelle 75006 paris ——————— médecine douce phytothérapie daniel dufour novembre institut psychosexologie tél 663.60.30 .p.p. cours intendance deaux tél 44.24.52. théosophie radovan nedel16h rue méditation transcendentale quatrième état conscience novembre 15h rens rue etienne marcel 75001 paris tél 236.04.78. rééducation karaté médical sophrologie décembre 19h sous présidence professeur rené poirier rens j.p. guyonnaud félix faure 92000 nanterre tél 204.34.77. inn
32,33,"ateliers stages ile france rituel l'apocalypse gestalt psychosynthèse intégration terreurs novembre rens a.r.a.a.f. didelot 75017 paris tél 294.14.29. —————————— expression corporelle angèle saul 6-7 novembre rens i.r.e.p b.p 91450 soisy-seine tél 075.29.46. utilisation techniques vidéoanälyse formation orga nisation 6-7 novembre rens cabassu escribano tél 207.73.683. formation psychologie cours soir limite inscriptions novembre rens institut supérieur psychologie paris tél 858.30.85. devenir groupe développement personnel novembre rens françoise david rue mélon- cru nière 92500 rueil-malmaison tél 751.50.93. maîtriser gérer temps dirigeants cadres commerciaux 1819 novembre rens pierre nicolas consultants rue pelloutier 92100 boulogne tél 604.,85.19. formation gordon parents 13-14 28-29 novembre rens formation gordon rue royale 75008 paris tél 548.30.57. ——————— sémantique générale 13-14 novembre culture environnement nationale 91300 massy tél 920.47.81. ————————— formation sophrologie 11-14 novembre rens institut supérieur psychologie rue lilas 93100 montreuil tél 858.30.35. sophrologie épanouissement personnel 20-21 novembre rens cocpp rue washington 75008 paris tél 562.38.22. marathon thérapie émotionnelle 20-21 novembre rens claude-marc aubry passage dubail 75010 paris tél 208.98.60. ——î ———— connaissance soi communication expression corporelle verbale 22-23-24 novembre rens cabinet panissod-suhner 109 rue turenne 75003 paris tél 271.21.25. ——————— questions d'actualité filtre psychologie adlérienne café zimmer place châtelet 75001 paris 2728 novembre rens société française psychologie adlérienne nadaud rés moulin grais 91300 massy —————— apprentissage progressif plaisir amoureux sexologie humaniste analytique michel meignant rens b.p 78430 louveciennes tél 918.45.93 —————— ——— formation l'astrologie groupe soirée correspondance"
33,34,"école psychologie integrative yte4 bis rue jouffroy 75017 paris tél 227.09.43 cvgles formation analyse transactionnelle gestalt georges thomson analyse transactionnelle bio-énergie vincent lenhardt programmation neuro-linguistique n.l.p gene early sexologie analyse transactionnelle val garfield gestion stress kohirieser pratique géstalt blin vayner seminaires theoriques formation psychothérapeute sémantique générale developpement personnel vidéo-thérapie week-ends conseil superieur psychanalystes syndicat professionnel département spécialisé intégré l'institut hautes etudes recherche appliquee organisent permanence formation psychanalystes débutant tout moment l'année conçue fonction disponibilité lieu résidence renseignements inscriptions idhera rue maubeuge 75009 paris tél 281.17.44 n.-d. lorette vivre sans siress conférence d'information mardi 20h samedi dimanche 15h rue etlenne-marce 75001'paris tél 236,04,78 233.84.60 meditation tramscemdantale matin soir suffisent nelles rue musset vincent lenhardt. rens continus hebdomadaires mardi 5-7 novembre'en héatre d'austerlitz 35.44.45 place erythéia urg tél institut recherches tradition- 67000 strasbo 75016 pais tél 288.61.20. intégration l'analyse transat nelle bio-énergie cycle jours mation week-ends bis rens la- personnel perion couple authon che 11-14 novembre rens 20. rue joubert 75009 paris tél :874.43.60. développemen 75017 paris tél 227 approche relationnelle malade alcoolique stage ive destinée -20 novembre rens pandicapés physiques rens rouet a.n.p.r.a rue chenevières 78760 jouars-pontchartrain. gestalt analyse psycho-énergéps jei bre rens ience corps d'quei- tique 20-21 novem groupe santé rue victor jacomini rue prêtres 31000 massé 7009 paris tél 281.59.10 toulouse tél 25.38.02. ibioénergie épanouissement art- groupes formation l'ert-thérapiés since charleville-mézières 20-21 novembre 16h rens atelier pin- rens l.c.h in-des-pré 75018 eaux mouitr ... expression corporelle 22-26 novemor bre bretagne groupe expres- ger sion créativité rens 87.68.78. régions étran sensibilisation morpho psychg- initiation grapho psychologie .logie strasbourg 4-5 novembre rens .c.h eee ... formation f'animation rens formation dimension préven- facettes grand rue blancheface tive travail social 5-6 19-20 91530 saint-chéron tél 459.51.73. novembre rens université liège institut psychologie sociale 'särt rencontre développement per- tilman bte 4000 liège tél sonnel gestalt thérapie groupe 41.56.20.82 hebdomadaire rens agora méditer- poe ranée julien 06100 nice tél peur plaisir sexualité 51.35.43. belgique centre psychomatique wiener 123 1170 bruxelles tél 673.54.81 blois 27-28 novembre rens 1.c.h tte psychothérapie centrée per- sonrer programme européen conçu carl rogers partir novembre géintégration voyage initiatique rens route st-germain 78620 et.13-14 movembre rens centre l'etang-la-ville tél 958.71.35. out tron studio champs-elysées paris 723.35,10 fous bas-fonds maxime gorki adaptation gildas bourdet théâtre salamandre 54.52.30 théâtre gérard-philippe saint-denis 243 00.59 novembre puis tournée havre grenoble tourcoing vertiges clochardisation laurie anderson 25.28 novem- bre bobino paris 322,74.84. musique surgie d'espaces inconnus paroles robot schizophrène angoisses d'une amérique l'électronique mbrant enfants silence medoff mise scène pierre bart 30. com- ment communiquer sourd- muette refuse rééducation l'affrontement mots signes expositions l'oreille oubliée l'of tob fier 83. centre georges pompien rie c.c.i. étage 10h-22h sauf mardi ouverture dès 10h lvers paysages sonores pollutions auditives gressent modifier sensa- écoute plus active art"
34,35,psychologie fondamentate epi 405 120 vocabulaire base sciences humaines anne ancelin-schützenberger vocabulaire d'ensemble psycho jogie psychiatrie psychologie sociale malgré contemporaine révèle unité celle objet homme tel fil conducteur recueil signé quelques-uns grands noms actuels cette discipline particulier mau- rice reuchlin serge moscovici rené zazzo collette chiland plupart éducation clarifie différentes notions fait point nouvelles thérapies groupes formations outil travail très utile comprendre nouvelles approches portement humain psychologie demain sous direction paul fraisse col. psychologue p.u.f. 344 135 diversité psychologie d'entre insistent liens entre biologie comportement humain chez l'enfant bredart j.a rondal activités méta-linguistiques pierre merdaga peu trop univ soulignant place particulière psychologie carrefour entre sciences vie fes sciences sociales ensemble très riche documenté parfois taire l'analyse langage ersivoulez-vous tout apprendre pres- méta-linguistique développementale alias psychologie lan- gage suffit cela lire livre bredart rondal sujets abordés donnent image assez complète domaine actuellement pleine expansion l'évaluation valeur informatique messages l'analyse parole unités phoné- ques jugements correction 'ämmaticale énoncés l'apparition lernee privé latalretdent l'humour linguistique autrement dit jeux mots capacités produire comprendre métaphores construction récits livre très clair intéressera non seulement ceux s'occupent langage l'enfant éducateurs orthophonistes aussi parents l'ensemble public our on'le met'dans privé autrement 240 dossier complet sans aucun préjugé sujet soulève depuis années passions 'et onine connaît partiellement ... quoi commun effet entre institution religieuse boîte bac école parallèle qu'elles pratiquent toutes l'enseignement privé dossier lire pour'pouvoir pronon- cer connaissance cause parents martyrs chartier privat depuis dix ans j.p.'et chartier reçoivent écoutent voire accompagnent parents martyrs .et leurs enfants 'bourreaux récit entraîne style alerte rapide sein familles drame s'ins- talle puis éclate grand jour quand l'adolescent violent agressif com met l'acte visant donner pouvoir s'enfuit retrouver ailleurs rêvé meilleur alors parents dérive désespoir après avoir tenté d'oùvir toutes portes prometteuses solution demandent veut bien jles écouter protège enfant tortionnaire maître chanteur l'éloignant d'eux plus possible auteurs font part quelques exemples sympathie êtres démunis profondément déprimés fameux bourreaux leurs deux derniers chapitres livrent réfexions rencontres faire naître chez d'ge privé d'enseignement cycles courts paris fjournées therapie familiale 13/29 novembre décembre 8/22 janvier février pratique test rorschach décembre pratique graphologie janvier février mars pratique morphopsychologie janvier février mars methodes relaxation 15/29 janvier 12/26 février 12/26 mars lee ateliers paris week-ends ssl face autres sut 20-21 janvier corps analyse 27/28 novembre 18/16 janvier 26/27 mars psychodrame 4/5 décembre 19/20 février 16/17 avril processus psychotherapique 11/12 décembre 26/27 janvier l'approche psychanalitique 23/24 janvier l'analyse transactionnelle 23/30 janvier ppse informations i.c.h rue joubert 75009 paris tél 874.43.60 demande sans engagement formule d'orientation documentation gratuite cours oraux séminaires cours correspondanc
35,36,
36,37,ssl fsç ron snsn rss url cononoon dee nounou nes nes roc marie-josé jeubert remodelage personnalité culpabilité renforcée l'abandon famille dépression muitiples décompensations niveau corps ici l'expression d'une difficulté d'adaptation d'une incommunicabilité l'autre l'on admet l'universalité l'inconscient maghrébin exprime mêmes conflits tout chacun sous forme différente tous confrontés difficultés d'adaptation rapport agressions monde extérieur patients dont parle ici a.lfrah m'évoquent certains enfants adolescents perdent famille génitrice vivre famille nourricière elizabeth bey-janaud hommes accouchent marie-josé jaubert stock 222 l'auteur passe revue toutes nouvelles méthodes d'accouchement depuis techniques inspirées leboyer jusqu'aux vieilles recettes l'hypnose arrive finalement conclusion femmes perdu aujourd hui maîtrise maternité profit d'idéologies seule compte naissance l'enfant-roi autoportrait loup jack alain léger flammarion 224 ocean boulevard jack-alain léger flammarion 332 rassemblant souvenirs plus ointains .usant méthodes psychanalyse jack-alain léger décrit autoportrait loup l'enfer come nce adolescence ment parvient sauver folie jack-alain ocean boulevard sflammarion annemarte vilune mère léger intérieure roman kéront mere learn maladif qu'il récit autobiogra- phique lit comme roman mérite auteur constituer l'auto-analyse sauvé rien voir second roman océan boulevard paraît simultanément chez éditeur s'agit vie guido magnifique expert art florence grand seigneur s'est trompé d'époque réfugie survivre souve- nir roman amour nostalgique fait écho autoportrait mère interieure anne-marie vilaine mercure france 236 mère intérieure celle l'on porte soi toujours source vie maerécage mortifère vague dangereuse lac tranquille parfois tout cela fois maïs mère chair meurt passe-t-il femme plonge deuil regarde cette mort face tatonnements bouleversement vérité celle découvre lutte authentique soi-même surgit petit petit vérité l'amour haine l'être maternel peut-on aimer mère morte réalité l'identification ambiguë féminin masculin chez femmes actuelles peur soulagement face mort l'autre aussi naissance libération celle demeure mort mère permet d'accoucher soi aussi arrière-plan du-récit entremêlé réflexion réalités banales authentiques vie d'une femme fille mère mari-enfantmaison travail l'auteur féministe écologiste conclut suis-je deuil suis-je deuil d'une partie moimême j'accepte enfin trop tard d'une partie monde train d'être écrasée autre très beau récit touffu généreux maladie médecine imparfaite mort d'où naît sans cesse comme force vive l'amour vie l.b prête-moi plume ljete dirai rien regaril dant écriture faites-en graphologue avisé capable dire qualités défauts gratuite- ment expérience adressant i.p.s quelques lignes écriture retour re\ cevrez diagnostic sommaire dont l'exactitude stupéfera cette passionnante expérience engage rien découpez bon adressez-le joignant enveloppe nom timbres frais il.p.s. b.p 53.08 75362 parts cedex grapho-test gratuit ana nternanon chonservice faus
37,38,icomédie érotique ld'une nuit d'ête partie campagne fois couple vivait heureux ravissante mai- campagne andrew hobbs conseiller financier wall street accessoirement inven-f teur loufoque adrian aussi ravissante timorée amoureuse tendre farfelu ste pates tisme conceptuel cousin d'adrian doit épouser lende- main jeune jolie fille rencon- psc prêts heures malice enclin imaginer. jeune médecin ressé seur peuvent lender adrian épouse s'est jamais éct revi llen trompé d'inst 174 d'été œil mps pommes encore léger comique par- echine débile retirer limite l'absurde poisson encore plus pou débile remettre atten- pat réflexions ant toujours peu déca- rgen c'est mendels tionn auec réalité incondi- jour nuit d'ék réalisateur new-yorkais via farrow désir comédie marcheront encore fois stance julie hagerty réfé temps morts certaine nuité liberé limpressionn oui complexes tous alles sme dan dur vont tout dès lors personnages enir nourri sens marivaudage vien- touffu bois grisés res pere brimer l'élan film voudrait plus rapide plus plus enlevé ariane villiers €njou sar
38,39,"e————— los potitos annonces doivent parvonir rédaction avant mois précéd ent exemple octobre numéro novombre ellos gratultas demandeurs d'emploi tarif autres rubriques ligne caractères trois lignos minimum règlement doit être joint commando prièro précisor souhaitez rocovoir facture n'acceptons plus annonces domiciliées journal ost donc obligatoire mentionner annonce adresse uno boîte postale téléphone merci stages approche psycho-corporalle gestaltmassage-rebirth-sophro séances indivi duelles week-ends c.r.e.e. avenue pré pêcheurs 83000 toulon tél 92.96.19 46.29.08 62.15.14. séances individuelles bio-énergie primal gestalt thérapie j.c. arati tél 602.38.90. stages région toulouse analyse transactionnelle 23-24 novembre anim lenhardt massage shiatsu anim abrassart 27-28 novembre a.f.d.p. gege 31510 barbazan tél 88.34.56 88.456,34 terpsychothérapie thérapie danse séances individuelles enfants adotescents adultes tél entre 321.23,27. groupes développement personnel analyse corporelle psychodrame photo-langage week-ends l'année partir d'octobre 1982. atelier psy avenue richaud 94110 arcueil rer laplace rens 631.25.19 après heures analyse transactionnelle groupe continu entretiens individuels marathon résidentiel 4-5 décembre tél 523,08.80 analyse énergético-structurale groupes continus stages individuelles tél 070.36.57 070.36.11. sessions individuelles rebirth massage californien réflexologie shiatsu petit groups semaine musico-relaxation bio-énergym in/acu yoga centre chrysalide 208.05,76. séminaire développement psychologique l'imagination active orientée iao conception jungienne groupes week-end l'est rens centre erythéia place d'austerlitz 67000 strasbourg tél 35.44.45 tal chi chuan caen dimanche mois partir novembre michel lebigre rue ecuyère 14000 caen tél 86.05.80 projets cherche témoignages personnes pratiquant rolfing rebirthing musicothérapie autres méthodes épanouissement dépassement sol foutrel 118 avenue république 94300 vincennes amis partout île monde informations gratuites concordia-cjub international correspondance c.p 185 snowdon montréal h3x 3t4 canada j'offre demi-heure d'écoute attentive téléphone s.r.v psychothérapl8 problème famille adresses communiee vii cation mieux vivre 100 demiheure peut changer vie sandrine 297.59.87 danielle pommier gordes 69360 simandres cherche tous documents causes psychologiques affections der matologiques traitement former groupe auto-géré développement personnel expérience préalable souhaïtée non indispensable claude calvet 541.19.18. demandes d'emploi ans maîtrise dess psychopathologie complet sauf mémoire soutenance mois d'octobre expérience hop psy. animation enfance formation jeunes cherche poste toutes régions alain orssaud apt lac 21000 dijon ans psychologue clinicienne licence psycho diplôme psychopa thologie institut psychologie paris formation spécialisée techniques projectives rorschach t.a.t ans formation analytique thérapie verbale corporelle psychodrame ans d'expérience secteur l'enfance l'adolescence inadaptée ans d'expérience groupe balint milieu psycho-éducatif recherche poste c.m.p.p centre médico-psychopédagogique travail équipe éducative psychopédagogique thérapeutique région parisienne sud-ouest sud-est toulouse demande d'emploi valable toute j'année cours écrire p.a 318 j.f ans dess psychologie paris formée diverses techniques psychocorporelles recherche vacations poste tél 576.61.87 j.f bac technicienne science médico-sociale rech emploi secrét médi cale région lyonnaise libre suite pourrait eff travaux dactylo dom. travail sérieux soigné étudie ttes propositions écr danielle pommier gordes 69360 simandres j.f ans bts économie sociale familiale poste établissement enfants-ado. région sud-est étudie toutes propositions braccioli dominique sipière 13700 saint-victorêt tél 75.26.83 thème fcez ginalte monte destétudesjsérieuses utilestempassionnantes cours groupe soirée mi-octobre 220 francs mois cours correspondance tous moments 220 francs mois devoirs corrigés documentation contre timbres 1,80 nom adresse institut recherches traditionnelles lrt rue musset 75016 paris nouvelle éducation meilleure société entendre ainsi l'éducation devient entreprise exaltante car touche l'essentiel l'apprentissage liberté. psyghologie c'est véritable révolution fonction éducative invite auteur l'expérience d'un éducateur d'un psychanalyste education 2000 île sssr lit alst das lin17"
39,40,eur car sre lodt illustration frank frazetta chêne jascdee ssrs rare plan
40,41,chêne sexualité bon cote l'agressivité agressivité sexualité vont souvent pair urie alliance peut être sourée bonheur lorsque dosage cés deux ingrédients amour réussi cerveau il'suffit qué cette harmonie délicate modifiée paï facteurs psychologiques tout bascule côït violence l'érotisme aussi liés doigts maïn reste désir violence combinés font forcément bestialité car homme distancié animal sait devrait savoir contrôler cette violence latènte l'affût derrière désir l'hommé toujours efforcé canaliser et-de socialiser pulsion sexuelle faisant sexualité lieu rencontre privilégié celui arficulation etre culture nature célèbre sexologue kinsey jotäit déjà éxcitation sexuelle déchaïge agressivité induisent inodifications physidlopiques commufñes montée tension l'accélération pouls exémple sait ailleurs circuits agressifs sexuels tous deux relation directe plan anatomique lobe olfactif autrè similitude mis homme bête réjoignent gilbert tordjman évidence rôle identique joué testostérone activation libido modulation comportement agressif cela tant chez homime chez femme tout modulation comportements agréssifs sexuels semblent bien dépendre équilibre existant entre deux neuro-médiateurs dopaminé sérotonine clés plaisir heuro-médiateurs chimiques molécules chargées transporter intérieur systèmé nerveux éléments information chaque type médiateurs fabriqué certaines cellules vient fixér récepteur correspond récepteur lui-même molécule dônt structure tèlle prévu liér plusieurs médiateurs peu corime serrure type donné peut recevoir type clef maïs admet deux clefs très voisines configurations très proches dopamine intervient activant comportements sexuels agressifs côté sérotoniné inhibe plupart facteurs impliqués agressivité l'anxiété dépréssion combativité dysharmonie sociale tel point médiateur reçu surnom civilising neurohormoñous neurohormone civilisatrice semble mécanisme inhibition emporte l'explication sexualité excitation érotique comportements sexuels résulteraient défaillance momertanée systèmes inhibition dus incitation interne externe cétte censure rétablirait suite rééquilibrage deux médiateurs impliqués apparaît donc refouiement agressivité
