,page,text
33,34,j'avais visé juste membres kgb présentèrent pressèrent questions issue conférence voulais avoir occasion dire j'avais déjà dit département défense américain savoir fallait trop attendre cette méthode sauf peut-être certains cas exceplionnels comme interrogeait professionnels crime bien entraînés gens-là sentent coupables essaient dissimuler tout prix leurs fautes agissent cohérence intérieur système valeurs propre seulement nôtre observations pourtant très précises ekman garde bien tirer conclusions hâtives tant étude expression émotion complexe m'intéresse maintenant précise-t-il d'étudier visage liaison passe l'esprit reste corps veut étudier émotion opti- globale tous signes doivent être analysés qu'ils visuels comme expressions visage auditifs comme inflexions voix physiologiques comme rythme cardiaque ainsi déclarations patient lui-même seulement abordant globalement problème recherches pourront être fructueuses quelques utilisations concretes paul ekman espère voir système cartographie visage couramment utilisé dix prochaines années combinaison autres systèmes mesure déterminer mécanismes fondamentaux réaction émotionnelle actuellement seules douze personnes parvenues maîtriser suffisamment système facs pouvoir enseigner applications courantes largement mises pratique linguiste gallander college charlotte baker travaille dégoût aussi facilement reconnaissable décodable selon système d'analyse muscles faciaux propose ekman l'expression dégoût manifeste surtout plissement nez élévation lèvre supérieure poussée l'extrême cette éxpression provoque élévation joues rabat paupières bouche recourbée commissures tournées vers bas acs essayer découvrir comment sourds lisent visage suppléer lan signes rainer kause tlemand l'utilise psychologue ssible étude rôle poss l'émotion cas bégaieme université pennsylvates psychologue harriet oster système facs étude tions nouveaux-nés différents goûts enfin ekman lui-même travaillé collaboration chirurgien esthétique roger crumley san francisco appliqué méthode évaluation nécessité intervention chirurgicale visant relier certains muscles nerfs visage chez patients paralysés servit également évaluer progrès après l'intervention mettre point exercices destinés renforcer maîtrise muscles faciaux patients ekman espère pouvoir ouvrir jour laboratoire chercheurs diverses branches psychologie pourraient aborder émotion chacun selon point vue effort commun plus siècle déclare ekman darwin fait preuve cette capacité approche globale fait défaut aujourd hui livre expression émotions chez homme animaux 1872 illustre parfaitement vision d'ensemble système nerveux central réactions lysiologiques parole expression visage travaux ekman facs encore trop récents avoir confirmés autres spécialistes ampleur contribu- tion recherche semble guère faire doute robert rosenthal seur psychologie univernoms com lun grands bale dit munication veravancer qu'il fait sances dome connaispeut-être res taut-il autant nce travaux système cstème décodage com- savoir heureux das feelqu'un daniel goleman fait partie rédaction psycholon oday titulaire chologie université han
34,35,atttules corporelles mamonautes olivier gillissen —————— attitudes apparemment naturelles corps d'homme femme affiche nationalité out individu aussi animal social groupe lequel vit marque façon indélébile manière agir être penser chaque culture spécificité travers attitudes corporelles communes individus représentent bien études faites comportement français matière nourriture sexualité habillement exemple corps lui-même expressions communes fallu attendre professeur honoraire université harvard laurence wylie auteur nombreuses études consacrées société françaisel long article intitulé joindre geste parole recense toute série attitudes village vaucluse 1979 chanzeaux village d'anjou 1970 gallimard français êtes-vous essais chiffres ouvrage collectif sous direction j.d reynaud grafmeyer documentation française 1981. corporelles communes spécifiques tous français résultat plus surprenants balayant revers main traditionnelle image petit français béret tête baguette sous bras dont acteur jean lefebvre paraît-il caricature-type outreatlantique propose image plus conforme réalité celle monsieur hulot incarné jacques tati laurence wylie explique chez français plupart temps tête légèrement penchée avant bien semble force motrice déclenche mouvement avant reste corps faisant suivre inverse américains français tendance marcher comme s'ils descendaient corridor étroit espace personnel beaucoup plus restreint démarche régulière relativement peu balancement chez hommes jambe projetée très loin avant sorte genou tend jusqu limite pied retombe talon chaque puisque torse demeure rigide bras doivent bouger énormément contrebalancer mouvement jambes comme haut bras resie collé corps l'essentiel mouvement vient -bras lotion verticale immobile américain tient jambes écartées balance autre tarde généralement s'appuyer contre mur meuble plus stoïque français contente légère oscillation… avant arrière pieds retrait autre position d'autant plus pratique permet d'appuyer conversation effets brusques avancées non moins brusques reculs. position assise compatriotes aussi attitudes très marquées faisant décontraction mode oseraient afficher autrement jambes parallèles croisées question exxemmple poser pied genou opposé sous peine faire taxer impolitesse être bien faut savoir bien tenir sans doute pourquoi français prisent encore beaucoup sièges ligne rigide contraignent garder corps droit tendance canapés ras-du-sol gagne plus plus terrain conditions confort extrême pourtant tous tendance adopter attitude commune bien traditionnelle bras croisés plus subtilement bras replié poitrine coude opposé vient s'appuyer main autre main occupée caresser menton lèvre joue cheveux mystères chorégraphie gestuelle contrepoint indispensable discours français envolées manches ballet mains ajoutent saveur particulière simple battement rythmique appuyant temps forts conversation multiples sursauts nuancer caractère destinés péremptoire affirmations gestes parfois valeur description voire remplacent purement simplement mots eux-mêmes point langage suite page
35,36,psychol lautonomie arrié autonomi sexualité signifi plus souvent ifie questi sexualité mond rés pro socié questi fonds travai question travail début quest passage enfance adolescence ion alors sort mois rivés séjourner ans demi interneme éoriquement meille âge plupar érait pital au-delà evaien trique cette limite dansunh age loi entre quatre age tal psychia- cinq ans jeunes cin méritaient seize permet pro- difficile hôpital arrié stanislaw tomk cri lewicz maux adolescence têés men taux entrée dan adolescence enfants enfants nors société 55. del ôpital ava tient intell brachot sion dui enfants imi refu enfant phôpital consid inf cat érieure égori moins ient toujours ectuel inférieur vécu cet intro- mis- 50ficients quo- peinture danielle permanence galerie avenue louise bruxelles l'adolescence mentaux
36,37,soa dst profonds ficien pre
37,38,fleur suppose wie conscience afiectivité normales représente seule présence féminine groupe lorsqu'elle atteint ans proteste vivement dit fille vit comme garçon mène toujours vie comme malgré q.i relativement élevé 1/2 ceux aiment psychométrie.… point aperçue identité féminine pourtant évidente premier coup œil premières règles louise fillette difforme disgracieuse choquent véritablement partie équipe jusqu demander suppression pilule administrée trente jours mois rapidement règles finissent être bien tolérées malgré dysmorphies adolescente l'influence psychisme état psychologique soma- tique enfant plus grande iñfluence développement l'adolescence cinq modalités peu- vent être distinguées tout abord grabataires passage adolescence manifeste avant tout prise poids deviennent lourds encombrants difficiles laver soigner parfois font peur cepen- dant parmi jes grabataires peut distinguer deux sortes d'enfant ceux peuvent établir aucun contact affectif nomme parfois terme assez vilain végétatifs regard vide réagissent voix sourire souvent chatouillement certains réclament jamais manger laisseraient mourir faim sans gavage constitue moment privilégié relation plupart entre meurent adolescence tout cas avant ans faut avoir courage dire tout monde soulagé cette mort semble délivrance l'enfant entourage fantasme mort fait jour plus facilement soignants plus dévoués plus impliqués affectivement permettent dire médecin fin épisode infectieux guéri mieux valu meure pourtant idée euthanasie déguisée jamais effleuré discours hôpital quel désir mort refoulé paru scandaleux soigner enfant jusqu bout ceux sans langage muets quasi immobiles savent montrer existent qu'ils êtres humains montrent qualité l'expression regard modulation sourire adapte personne situation manifestations reconnaissance différentes personnes parfois amour musique expression tristesse enfants souvent considérés comme malades comme anormaux suppose conscience affec- tivité normales seulement entravées expression troubles instrumentaux comme paralysie pabsence langage l'idée mettre hôpital psychiatrique insupportable équipes parents médecins tou- jours sommés trouver tout prix autre solution séparation être aimé rendait adieux tristes regrets tempérés constat évidence vraiment trop grand hôpital enfants puberté physiologique enfants jamais signalée dis- cutée médecin l'équipe per- cevaif bien signes cette puberté mails osait parler ouverte- ment officiellement dévoiler ambivalence sen- pitié seule arrivait jadroitement comme timents parfo s'exprimer mmä malheurenx bre tout ... grand comme parfois pitié ang cachaient evo péiones jes plus moins 8riw salles garde ainsi puberté grabataires semble provogner angoisse profonde fle derrière silence pitié plaisanterie deuxième catégorie compose enfants peut appeler arriérés profonds privés langage sans quelques dysmorphies sans quelques troubles -neurologiques surajoutés vie relationnelle modeste sans troubles affectifs sans trop angoisse visible puisqu peuvent marcher esquirol appelé idiots ambulants aujourd hui terme paraîtrait juste titre injurieux vivant hôpital enfants tellement infantilisés passage adolescence passe quasiment inaperçu oublie toujours âge quand atteignent 17-18 ans tout étonné devoir déjà entreprendre démarches transfert hôpital psychiatrique passe pourtant sans drame sans remords personne cherche précipiter personne pleure lorsqu'ils partent voulez- fasse autre enfants comme cela hôpital psychiatrique normal ail- leurs tolérance l'égard jeunes diminue fur mesure deviennent plus forts peut rendre contacts difficiles équipe divise alors bons faut garder plus longtemps possible méchants faut transférer plus vite hôpi psychiatrique l'hôpital troisième catégorie inclut quelques enfants rôle comme psychotiques mcarnent malaise termes moins titre mauvais esprit ins- appelle sou
38,39,vent vrai diable démon plus scientifiquement mauvais objet devient exceptionnellement tel mauvais objet suite automutilations ainsi rolande gabrielle subissent jusqu lie démence asilaire petits coups répétés les-globes oculaires elles finissent priver vue caresser ficeler comme saucisses peut empêcher drame rolande première entre elles vécue comme remords vivant nul veut attendre ans âge officiel placement hôpital psychiatrique ans transfert s'avère plus laborieux tellement grande résistance certains secteurs malades plus graves départ rien amélioré l'ambiance l'hôpital gabrielle peut bénéficier cette triste expérience rester l'hôpital voire apaiser suite changement salle partie angoisse plus souvent devient mauvais objet suite comportement hétéro-agressif envers autres enfants adultes objets jeunes provoquent peur peur authentique angoisse métaphysique peur folie chère poète maïs tout simplement peur physique propre intégrité corporelle peur recevoir coups cette crainte entraîne demande plus plus insistante augmenter mesures sécurité fermeture portes clef attachement contention doses fortes neuroleptiques enclos fermé milieu cour longue comportement agressif enfants dont gestes innocents ressentis comme violents peur contre-agressivité engendrent risquent toujours entraîner hôpital vers formule asile archaïque quête illujsoire permanente sécurité permet entraver voire supprimer liberté physique élémentaire tous deux exemples opposés illustrent manière résoudre type problèmes rudolph certes tous vices veut étrangler plus petits crache terre donne coups tête derrière dès dos tourné dieu sait quoi encore plus tous vices yeux bleus ressemblent manière étrange yeux officiers nazis temps parle beaucoup psychochirurgie médecin laisse tenter cette technique propose opération japonaise très raffinée réputée peu mutilante appelle cingulectomie neuro-chirurgien préfère pratiquer lobectomie temporale très étendue ceux connaissent peu neurophysiologie 1maginent résultats début amélioration est-à-dire diminution voire disparition l'agressivité mieux-être fugace dès abrutissement post-opératoire dissipe rudolph redevient encore plus agressif plus brutal quasiment plus bestial qu'avant intervention neurochirurgien consulté propose enlever lobe temporal restant l'opposition générale rudolph part hôpital psychiatrique dès qu'il atteint ans depuis personne suggère l'intervention psychochirurgicale chez adolescent psychotique agressif deuxième appelle gabriel prénom particulièrement bien beau comme ange grand blond yeux noirs lippe sensuelle sans moindre disgrâce visage corps atteint psychanalystes appellent psychose pure sans aucun trouble neurologique contraire mouvements rapides habiles gracieux gestes rapides gracieux sans aucune raison apparente renverse brusquement table lit casse carreau balaye toute vaisselle table cet enfant puberté très précocement dès âge 12-13 ans déjà nanti force herculéenne réputation véritable diable-démon également pression très forte faire quelque chose hôpital sait résister tentation exclusion service public créé payé supporter gabriel semblables moins jusqu ans donc psychochirurgie transfert l'hôpital psychiatrique changement salle apporte amélioration accalmie spectaculaires devient toléré aimé parfois encore trouve discrètement ligoté chaise quatrième groupe composé psychotiques spécialisés fonctions mau- vais objet l'institution pourrait appeler psychotiques ordinaires chez passage adolescence semble passer manière progressive discrète aucun drame aucune demande transfert avant date habituelle baisse progressive tolérance diminution sympathie dont jouir enfants morphologie harmonieuse parfois jeur beauté attirent pendant longtemps cette sympathie voire souvent beaucoup d'affection espère amélioration impresson faut peu deviennent normaux puis années passent amélioration parfois spectaculaire début tasse rapidement monotonie difficultés quotidiennes déception résulte absence progrès parfois épaississement traits visage perte allures enfantines prennent dessus partir ans équipe accepte volontiers jeur transferts hôpital psychiatrique fous place date transfert 1820 voire ans dépend surtout l'insistance famille telle telle personne hôpital repousser maximum délai fatidique reste décrire passage adolescence groupe 7-8 enfants pourrait nommer intellectuels arrivés dès ouverture hôpital ternps eavées exdiess cles msumenau
39,40,arriérés cas sociaux abandonnés famille services compétents moins regardants degré arriération cas sociaux placent souvent l'enfant milieu plus arriérés intellectuels aïnsi plus éveillés autres enfants hôpital plus abandonnés aussi plus aimés chance trouver aide-soignant véritable pédagogue spontané fait fonction instituteur afrique dit enfants ressemblent vraiment beaucoup ceux brousse peut faire uns fait autres thèse fausse permet former petit groupe vivant éducatif plein chaleur affective enfants évolues au-delà prévisions apprennent marcher parler deviennent psychotiques long séjour hôpital accompagné angoisse effroyable est-ce allez faire peine évoluent tellement bien puisqu doit mettre hôpital psychiatrique grands intellectuels jamais victimes sentiment rejet tient garder plus longtemps possible tout cas jusqu trouve solution autre hôpital psychiatrique heureusement juste bon moment c.a.t foyer ouvre portes ville avoisinante fois placés structure extra-hospitalière permet contacts variés sorties rue différenciation entre lieu d'habitat lieu travail apprentissage valeur argent possibilité minime prendre charge soi-même adolescents poursuivent évolution tant niveau langage réactions sociales débrouillardise allure exclus malades anormaux diminue manifestement cette issue heureuse impossible sans soins amour dont bénéficié l'hôpital emmène pique-nique invite quelques-uns familles membres équipe construit atelier fait efforts pédagogiques essaie mettre école vil- lage sait hélas garder attentions diminuent âge contraire devant évolution positive efforts faveur redoublent quand plus âgés entre partent c.a.t. plus jeunes devaient rester l'hôpital commencent plaindre rejeter milieu quand est-ce partir ici hôpital idiots hôpital fous rien faire ici veut partir ainsi angoisse équipes voir envoyés l'hôpital psychiatrique heureusement vaine rejet dont enfants objet lorsqu grandissent tempéré voire amorti chez intellectuels refus absolu transférer mesure font progrès conversation préfère sans discussion voir rester l'hôpital au-delà ans cependant dès peutêtre plus intelligent commence voler médecin seul réjouir apprendre mentir voler n'est-ce beau signe succès rééducation correspond veuille non entrée monde gens normaux entre autres men- tent volent cette position assez peu partagée maïs permet résister facilement velléités d'exclusion c.a.t placé pourtant veut modèle avère moins tolérant équipe supporte certes petits vols mensonges jérémie non autre vices savoir peu empressement travail manuel péché paresse interné.… sexualité souvent platonique robert grabataire ans toujours couché assis lit sans langage musculature puissante proie crises colère effroyables équipe demande toujours augmenter doses neuroleptiques personne comprend causes colères chez cet enfant ailleurs mignon aimant câlins jouant jamais toujours lit bout plusieurs mois seulement devient évident robert fait colères car personnel peu versé psychologie moderne croit bien faire empêchant paï tous moyens masturbation incessante uniquement .sif prolongé ment caractère pure cette masturber dire onvaincant plus miel masturber déchirer bien ser tout cas seul droit avons-nous interdire mettons rien autre place quoi qu'il robert disparaissent oses neuroleptique diminuées masturbation put conquiert droit cité hôpita vue provoque détournement pudique yeux mots pitié plus rarement plaisanterles grivoises plus évolués apprennent faire plaisir cachette amours titi nielle chez intellectuels sexualité prend souvent forme platoniue titi psychotique très doux sans aucune auto hétéro-agressivité réputé être amoureux nielle l'hôpital joue rôle lourdes dossier admission comporte série examens prouvant aveugle dès apprend marcher tout monde aperçoit conservé bonne partie vision titi aveugle transformé amblyope garde quelques tics promène partout allure peu guindée avant tout aime musique nielle celle-ci suite malfor- mations osseuses articulaires mul- tiples jamais quitter hôpi- tal depuis jour naissance parents renoncé oubliés chirurgiens soula- get souffrance enlèvent deux articulations hanche utiles jambes complètement plafond toujours centre univers visuel arrivé vers âge ans trés bien devient pipelette l'hôpital mentale psychométrique résulte nielle heures manger passe ser fauteui avant tout mai
40,41,aussi parce elles permettent avoir toujours quelqu'un pousser nielle… marthe comme paralysée cérébrale considérée tout monde occidental chrétien refuse label infirme moteur cérébral faute quelques points q.i réputée débile quasiabandonnée famille assez pugnace trop pauvre lutter contre verdict médecine officielle arrive convoi arriérés profonds marthe d'emblée adoptée aimée aidée l'équipe peu sensible nuances nosographiques pleine affectivité dévouement enfant répond positivement démarches mérite bien s'occupe malheureux avoir envoyée ici apprend taper machine petites lettres faire fonctionner pick-up marcher deux cannes tricoter devenue adolescente tombe amoureuse jeune médecin celui-ci reste longues années après départ marthe aime toujours attend lettres visites fait belle tente maquiller quand espère viendra jour fête exprès pleure silencieusement décommande après avoir promis venir cet amour dit enfantin accepté valorisé comme familles bourgeoises dit enfants quatre ans vas marier bonne gouvernante dit marthe vas marier docteur ... quand part institution toute neuve adultes paralysés marthe sait mariera docteur acquis principe réalité vers état toute autre l'attitude hôpital envers sexualité lorsqu perd aspect platonique commence ressembler sexualité adolescents normaux certes expliquer touche-pipi entre garçons intellectuels jamais fait mal personne ressemble rien vices sodome certes tolère trois quatre garçons attaquent pelotent embrassent seins abondants jeune psychopsychologie 147 mai 1982 tique nénés sylvia sont-ils objets jubricité déjà adulte substitut sein maternel garçons certainement privés séances sexualité primitive homo hétéro bien connues l'équipe parle coins mi-amusée migênée jamais indignée drame manque d'arriver lorsqu'un soignant récemment recruté croit bon confier découvertes haute administration celle-ci convoque rapidement médecin peut quand transformer hôpital bordel aussitôt demande renforcer mesures sécurité séparer garçons uns autres empêcher homosexualité écarter tous grands garçons sylvia mettre fin hétérosexualité cet orage bref comme orage d'été bout quinze jours tout rentre ordre semi-clandestinité jusqu départ l'hôpital psychiatrique sylvia nénés entretiennent libido intellec tuels années après membre l'équipe ailleurs estimé très bien coté permet sodomiser sans violence aucune peut-être gentillesse intellectuels partie équipe crie scandale veut déposer plainte attend orage bien plus puissant haute administration celle-ci répond calmement non sans bon sens faut bêtise comme cela ennuyer homme père famille irréprochable travailleur infatigable dévoué bien noté indignation résisté réflexion haute administration peut-être tort scandale apparait quand arriéré adolescent non rentable assisté prend liberté être sujet surtout veut être sujet propre sexualité tout reste règle tant quitte place objet qu'importe alors objet rejet amour propre sexualité opie s—— docteur sianislaw tomkiewicz directeur scientifique l'unité recherche santé mentale déviance enfant l'adolescent cadre l'inserm institut national santé rectierche médicale montrouge hauts-deseine cimicz- gimca c'est équipe spécialistes l'innovation communication intervient quatre entreprises netudes recherches instantest testimage recherche créative intégrée r.c.l brand image inventory bil toutes études produits communication nconseil innovation mise place formation anima tion groupes créatifs l'entreprise aformafion treize séminaires traitant tous aspects développement ressources humaines création marques désirez recevoir gratuitement informations activités gimca merci renvoyer cette colonne photocopie cochant rubriques intéressent conseillons également manuel créativité pratique hubert jaoui crea prat pouvez obtenir contre chèque francs franco bon commande veuillez m'envoyer franco port crea prat joins chèque nom adresse gimca mont 25006 paris
41,42,rapente ras eva bouge reste dessin christian broutin crées michael chase commence comprendre quel mécanisme pouvons généralement rêver sans autant agiter tous sens ————————— ——— rêveur s'engage folle poursuite aucun muscles sans aucune difficulté ferrons sous menace monstre extra-terrestre étreignons bien-aimé escapade vol voile au-dessus atoll pacifique tout cela sans bouger seul muscle quel- ques instants plus tard réveillons frais savons tous dort jamai cent milli aussi actifs ous enjambons gratte-ciel aires motric cerv tent actives pend res ant rêve messages elles parviennen
