,page,text
41,42,entraîne ipso facto réactions sexuelles l'inverse ment sexuel peuvent inhibition l'agressivité ire comprend qu'en auor dysfonctions dehors leurs causes souvent inhibition l'agressivité. défaut agressivité peut valise tasmes semblent déloyaux préfère inhiber retenir réactions sexuelles plutôt risquer éprouver angoisse liée excitation érotique affirmation désir malsain défaut agressivité transparaît forcément niveau phantasmes peut aussi manifester plan mouvements corporels ainsi éjaculateur précoce immobilité peur femmes défend contre accession femme transpose parfois conflit conjugal plan sexuel réfugie mieux pourquoi sexuelles organiques provienne tre lorsqu'une femme phan statut homme passivité indifférence l'égoisme nécessaire l'amour agressivité peut être inhibée niveau communication affective cette communication fait alors mode pathogène parce partenaires refusent clarifier composante agressive message plus souvent agit d'individus très dépendants leurs parents leurs partenaires trop concernés plaisir autre accordent égoïsme nécessaire prendre propre plaisir cas femme incapable d'affirmer ouvertement individualité poser clairement demandes affectives préfère réfugier attitude non-coopération attitude résistance entraîne tension muscles périvaginaux rend femme anorgasmique façon sélective est-à-dire seulement certains partenaires général partenaire dont plus proche plan émotionnel résulte l'objectif toute démarche thérapeutique matiére dysfonctions sexuelles doit aider jes consultants inhibition abstinence refoulent aboutir eur contraire croient d'un engager besol affectif plus teleée itat enq dar gregory white chere l'université marylan selon psychologue cette étude confirmerait autre® fem tats termes desquels considèrent souvent hommes comme bêtes obnubilées sexe tandis hommes perçoivent comme avant tout tournées ariage l'enquête white montre deux sexes plus partenaires sent menacé plus enclin penser comportement l'autre motivé désir sexuel white conclut soupçons l'infidélité partenaire pourraient refléter peur inconsciente vis-à-vis propre pouvoir d'attraction sexuel faut néanmoins considérer résultats commentaires white prudence mesure étude porte étudiants californiens dont seulement mariés s'applique forcément couples légitimes chère vieille europe chose certaine hommes fem- réagissent différemment quand conjoint trompe tive infériorité permettre mieux exprimer agressivité première est-à-dire leurs besoins triple plan désir plaisir communication affective faut dire souci homme toujours contrôler cette agressivité l'empêcher €xprimer tous moyens pos- sibles premier obstacle opposé impulsions incontrôlées libido linterdit religieux morale médiévale occidentale exemple entièrement centrée dogme péché chair ascese écartait ailleurs tradition biblique autre bastion position violence sexuelle jui affirme travail bridez sexualité pare émancipation prolé eat priorité donné uctivité éécono produits religieux contrôler violence ontraire homme fem contraintes stérilisés vie cor vale créativité érotiq -mêmes réduits d'objets consommation jus désir sexuel désirs triangulaires cette violence cette agressi intervient lacte sexuel peut trouver bien expl tions différentes point psychologique apparaît désir esserice triangulair cette structure triangul implique lutte implacable triompher rivalités potentiel triangle traduit sein couple rivale potentie fait homme fen puissent plaire quelqu rien jamais acquis désir obligation séduire permanence partenaire tuant combat contre naire imaginaire pou très bien exister lorsque alternative cesse agressivité vie disparaît couples asso installent indiffére sexuelle ronronnement dien guerre terminée rival tué désir aussi. cette composante sivité hostile révèle cela fie autant affaire pervers puisse différence peut-être sujet sain fantasme fait nomie réalité hél atrive pervers scé échappe contrôle lors sommes-nous condami violence sexualité doute peut sortir dilemme lamour dub croyons-nous peut jrumanité démence iser composante sadique-qui souvent chez nombre indi conditionne entretient tion érotique
42,43,"ilest jeune beau fait séduire objectif sveltonic baisser prix sans faire concession qualité efficacité service pratique l'appatell très soigné sveltonic présente élégante mallette moulée beige clair faible encombrement rigide contenant couvercle mode d'emploi toujours sous yeux poste commande sous lequel tient circuit électronique simple bouton supérieur commande mise route l'appareil aussi gdence contractions envifon minute témoin lumineux permet d'en contrôler bonne marche pie inférieure boutons elonic commandent puissance mtractions chaque paire plaques côté droit sous sangles tient ditier destiné recevoir piles rondes jupe r20 1,5 sangles élastiques meture velcro permettent maintenir essayez sans risques 'efficacité appareils excito-moteur réside qualité contraction donc important d'en faire l'essal sveltonic muscle contracte pro fondeur douceur signal moteur mobilise muscle place cerveau respectant scrupuleusement impératifs physiologiques naturels oui sveltonic efficace vérifiez-le l'es- pre aseltonte tomnte sayant façonnez affinez silhouette sveltonic nouvelle grande marque plaques n'importe quelle région corps donne moyens profitez-en prix actuel prix lancement vendus aussi grands magasins printemps bhv samaritaine plaques caoutchouc conducteur système breveté jessé assurant parfait contact peau branchement fil-plaque donc risque gymnastique passive mauvais contact fils plats ouvei grande marque s'entortillent après quelques séances lan garantie ans puissance 0,6 rue rodon alimentation 78320 mesnil-st-denis 461.74.65 made france bon d'essai jours sans risque compléter recopier retourner sveltonic rue rodon 78320 mesnilstdenis tél 461.74.65 -nom pen rue code postal iville oui désire recevoir mettre croix cases choisies sveltonic complet plaques sans piles choisis payer dau comptant:1.295f+25f participation frais port 1.320 joins commande ent 1.295 participation frais d'envoi c/r total 1.334 crédit gratuit 335 participation frais port 360 joins commande puis mensuatés 320 total l320f 250 total 1.010 désire seulement documentation désire seulement documentation ———— joins chèque ccp mandatettre ordre cjj sveltonic. n'étais entièrement satisfait cet essai jours renverrais l'ensemble emballage d'origine intégralement remboursé sveltonic complet plaques sans piles choisis payer avt por 2607 ris date signature indispensable svel-2-psy cos oosorh ssuqo eacnn frs sssr ssssme"
43,44,
44,45,didier parle inventé partant eee cise cét'ex aire cher rat pates sos psychiquement être filiat langagière donc d'adoption souci départ enfant cons d'être élevé parents nais- symboliquement rela sance .partir moment autrui bien sûr fonc d'autres êtres humäins permettent mammifère biologique développement potentiel libi- humain existe aussi ell dinal éduquent capacités vers totalement marquée lan jeur destin échange langagier sans doute cause disprc créatif procréatif être humain tion existant entre physiquement mammifère encéphale corps
45,46,moyens parole enfant incar parler j'avais j'ai thérapi est-ce sachant iment nts fait éta qu'eux bien jouant piano passaient temps temps ressentais aiors ajoutait tout suite d'apprendre via obéir pare bien plus musicien fait analyse toutes images continuai disais n'ai compris alors qu'exprimait-elle image etil disait jaune rouge caire c'était totalement abstrait telligent perverti tous niveaux. d'autres moyens d'expression parole cette dernière souvent déjà entachée tant faussetés enfants peuvent s'en servir dire vrai puisque men- quand c'était enfant exprime gestes postures dessin modelage musique l'image intérieure fantasme tout être humain symbolise fantasmes auditifs gustatifs olfactifs tactiles visuels peut exprimer autrement parole c'est d'ailleurs font bébés ... travail psychanalytique consiste toujours faire s'exprimer sujet autrement crois certains enfants dont langue maternelle toujours porteuse leurres faussetés peuvent continuer l'utiliser sans trouver piégés travers langage projections faites méchant c'est peut-être cet-enfant toujours entendu dire ... d'autres termes plus théoriques relation mère fait travers satisfaction besoins accompagnés langage désirs émotionnels gestuels mimiques l'enfant boit fontaine mère temps corps propre s'entretient fonctionnement digestif extrait séminaire d'enfants seuil 1982 psychanalyse ifèress mar tres m'est ter disque encép miné vingt-huit vingtcinq ans tandis père mère per rues travers ous adaptan celui s'occupe puis temps castration garçon exemple peut pli laisser aller vers mère renonce féminité retrouvera extérieur femme choisira cela île véritable oedipe vit intérieur sujet effectue tout travail père mère ainsi fonction émissive masculine réceptive féminine éléments constituent narcissisme primaire lequel corps entièrement impliqué corps fois émissif réceptif lui-même selon sexe chaque ëtre favorisera dominante renongant appartient autre sexe pouvoir adapter vie société ceux classe âge sexe l'oedipe processus interne être humain peut être faussé relations langagières mère père fixées érotiquement façon inconsciemment incestueuse enfant mène certains humains homosexualité dominante corps génital sait aussi cette homosexualité adulte permet plus grandes sublimations culturelles fécondité également paternité maternité symboliques peuvent réaliser plan génitalité trouvent issue mode langagier culturel artisti- voilà cas didier petit garçon cinq ans parle langage inventé comprends comment prendre f.d enfant musicien f.d usiciens très intellides enfa imbéciles gents parlé aren comprenaient temps jeur parlait eragnajangag attendre réponse chercher savoir d'eux ent c'est vraiment ompreet psychothérapie enfant rce conserve indiquée attitudes négatijui société adul sûrement doué auditivemais payé tête langage avoir là-dessous hise naissance petit ère lieu adresfrère den mise parler comme nourrisson stupides nagnagna l'instant vois surtout mère présence f.d maïs pourquoi parlez-vous mère toute façon parler f.d pouvez-vous entre contact pré sence mère pou prenn valeur sujet interlocuteu valable faisant faire silence mère veut répondre place enfant faites-lui con prendre index che doit répondr mieux vaut saisir répon enfant plutôt laisser mère interpréter dit répondre place poux dire mère exemple besoin exprimer chose écrivez petit papier fai passer dites didi veux mère importes ell quelque chose dire écrira mère écrit chose lisez petit n°y mèr souvent aussi grand-père grand-mère petit frère toute famille alternativement onde vient fois quelquefois tous viennen temps bien faites entrer monde cela aucune didier veu
46,47,langage imaginaire enfants richard frieman etes-vous françoise dolto françoise dolto née paris 1908 médecin psychanalyste depuis 1939 membre l'école freudienne paris très vite spécialisée psychologie enfants fait partie chercheurs ouvert champ psychologie ceux l'on appelle inadaptés précoces pendant plusieurs années france-inter répondu quotidiennement centaines lettres parents embarrassés cette démarche permis comme souligne françoise dolto elle-même dédramatiser métier psychanalyste françoise dolto sait parler simplement choses compliquées sait aussi présenter d'une manière humaine chaleureuse comme quelqu'un n'oublie jamais qu'il devant non cas clinique enfant souffre ajnsi travail consiste toujours trouver plus vite moyens mots soulagent théorie continuité directe celle freud fait anticipe étudiant naissance développement l'enfant devenir fait cette approche freudienne théorie tout fait originale plus importantes psychanalyse france aujourd'hui originalité humanité simplicité trois qualités françoise dolto possède pleinement explique certainement succès connaissent livres parmi ouvrages plus célè- bres peut citer psychanalyse pédiatrie 1939 cas dominique 1971 lorsque l'enfant paraît tomes 1977 l'évangile risque psycha- nalyse jeu désir petite histoire ajoutera chanteur carlos fils fran- çoise dolto exemple parfait d'épanouissement personnaité
47,48,c'est tout fai intéresser poa faut respec ingulières sonner sensibilité auditive unc tard enfant bien plus rassurés savoir l'école moins parlait perplexes fois devant nnage maison cessé après verte vie commëe maison déroulée commu cette famille finaleï chament mère fait psy nalyse parents venus chez avoir l'adresse honiste envoyés dent imait bon con- médecin esti seil certain cette famille soumis l'enfant consultation médico-pédagogique bon rééducation orthophonique duré mois tant n'allait école motivé corriger langage sans musique reconnu type intelligence auditive besoin être pris considération concerne didier avezvous père parle-t-il fils oui f.d dit-il choses intéressantes oui très concerné surtout mère toute lignée maternelle intéresse f.d dis voir mère jour l'enfant qu'elle vienne lesjour vient enfant taise puis demandez donc jour didier vient voir accompagné bar père grand-père cet enfant entouré femmes peuvent dire choses parfaitement ennuyeuses sans doute désiré resre squ dec langage adultes niquement représé femmes présentés enfant ble complète9 ice corpe mmes isse asser présence voulait sevr concerne mère garçon arr ins cas dés jours catestrop dire c'est snblait important enfant perçu didier avc mère fantastiq jet travailler ais plus essentrès 101 gon n'avait comprendre cote erlocuteur valable tiel con affective compen parler selon dil mit langage comme endre sta didier pinaire préféré pen être compence scoiane ape tut d'ange apres jangage sir dernier humain parlant voilà eulemer iles rrien age ent fragiles cet ange parle autre joe enfants lee traumatiser femmes homries moindre cas autre garçon jangage pare faites-vous j'ai puit ans dont mère femme sept devant encore là-dedans vait dégager pou père pouve enfant qit ère passer père comme dhabi entrer séance fermé porte nez j'ai senti salle attente train sanglote alors enfant allés consoler dit fenfant parce grandi très vite attendue maman triste alors pris parol sais maman maintenant faut demandes papa faire autre bébé comme huit ans âge occuper c'était incroyable constater évolution cet point deveni délinquant fixé mère pouvait sévrer alors ças didier exemple truc längue siènne oblige encore relation mère car seule décoder jargon cela fond l'histoire c'est moins grave êtr élève parce qué société croit alors enfant détac mère issuë donc encoa faut absolument cinq ans n'est-ce retardé langage bizarre avoir mère entendez-vous enfant retardé f.d didier pas-pour libido performances fait penser autre cas récemment sultation jeune garçon tellement intelligent disait mère fallait äbsolument faire sauter classe. heureusement médecin consultant également psychanalyste avisé toutde suite posé série questions pertinentes mange-t-il tout seul coupet-il seul viande lave-t-il seul torche-t-il seul chaque question réponse non bon dit médecin aide sauter cette classe revient quinze jours sachant fäire cela tout seul est-à-dire cet enfant promotionnait conquête motrice sans médecin garçon filait droit psychose parce mis école tout demeurant encore objet partiel corps mère mois cet enfañt tout aire tout seul lee vant enfant parle faut sache faire tout cela sans quoi embarque seule musicalité parole coupe sociabilité langäge texte extrait sémin psychanalyse enfants olto edition réalisés dion louis caldaguès copyright
48,49,enfants jeu mesure enfant demande jouer quelle doit être position françoise dolto c'est fait jeu quoi demande-t-il jouer c'est très souvent jeu deux lettres tirets f.d lettre c'est lettre c'est établit tiret entre deux alors pose devinettes qu'est-ce vert s'accroche arbres dois-je répondre f.d dites-lui qu'est-ce répondrais jouer dit veux répondre f.d non veux répondre paies réponde paie répondes payée écouter alors n'arrives jouer personne très souvent enfants prennent poupée jouent faisant deux personnages mère l'enfant c'est vrai finissent jouer seuls c'est très stressant f.d stress résister l'érotisation toutefois jeux marchands très importants puisque jeux l'oral l'anal exemple fillette dit boucher ... c'est bien cela qu'elle vient puisqu'elle l'est bouchée ... puis cliente alors madame désirezvous dit-elle comme personnage molière tout bas qu'est-ce .que dirais dirais qu'il faut deux tranches ceci alors répétez monocorde veux deux tranches ceci exactement qu'elle dit sans ajouter propre effet puis adressez tout bas nouveau aparté l'enfant qu'est-ce dirais qu'est-ce qu'elle dirait cliente l'enfant proteste disant exemple fais cliente sais expli- quez cliente idiote alors dis dois faire peu peu situation évo- lue finalement c'est fait jeu utilisant l'analyste exprimer signifie jeu elle-même c'est toujours jeu oral anal très souvent manque jement marchande conro vendre produits s'en sans payer. ausou d'enfants disent qu'il faut payer alors c'est dire bout d'un certain temps crois c'est comme chez vrais marchands introduisant paiement valeur l'argent apprenez l'enfant l'on rien sans rien c'est jeu ouvre autre chose rappelle cas d'une petite fille disait cliente prenait toujours tant parts demandais maïs pourquoi prendelle tant parts alors répondait c'est mari répli- quais combien a-t-elle d'enfants toujours part manquante enfant fait faisait jouer cliente rôle mère quatre enfants réalité n'en prenait jamais trois c'était cliente transférée qu'elle donnait responsabilité vouloir faire vivre dernier petit frère c'est point départ d'une association sous-jacente qu'il faut décoder bien négation réalité c'est toujours travail lorsque réalité oblige sujet bloquer vie imaginaire ... revanche inflation imaginaire nie réalité peut non plus s'adapter vie quoti- dienne laquelle demande fois sens réalité préservation œune vie imaginaire enroulée autour travail consiste toujo mettre disposition l'enfant expressions symboliques faciles comprendre permettre rencontrer d'autres êtres humain lesquels échanger communiquer n'est cas ceux entourage jeux marchandes jeux complicités chorche t'enfant cherche quelqu'un niveau c'est piacer surtout d'apporter propres fantasmes devons rester l'analyste cherche l'enfant nie réalité contraire trop réalité impose d'être sadi- comme monde l'est autour c'est cela dites qu'on doit commencer apprendre métier adultes enfants malheureusement c'est généralement l'inverse f.d hélas oui effet social tient enfants détecteurs leurs parents bien sûr certains enfants problèmes propres très augmentés ceux leurs parents fond comment définiriezvous rôle psychothérapeute d'enfants f.d rôle consiste justifier désir s'exprime chercher l'enfant répète désir qu'il exprimer jour jour l'entourage devons également retrouver affects entourant désirs refoulés autour d'un surmoi imposé l'ambiance éducatrice pulsions désir dont affects n'ont s'expri- mer directement façon détournée troublent fonctionne- ment somatique idéatoire l'enfant provoquent l'angoisse c'est tout fait schéma freud livre /nhibition symptôme angoisse l'inhibition chez enfant peut aller jusqu stopper fonctionnements vitaux crois- sance rôle consiste établir circulation entre tout cela certainement normaliser veut rien dire consiste surtout permettre iment aussi coexistent mer assumons justement vie symbolique n'est out langage pie bibliothèque psychanalytique p.u.f. 1978
49,50,nes spate old lot
50,51,entreprise comance rapporte ... vendeurs plus convaincants créent climat confiance reproduisant mode pensée voix débit humour client appliquent ainsi sans savoir certaines techniques l'hypnose moine ette jeune femme agent efficace travail utilise john grinder partir travaux sre immobilier dont voix inconsciemment mêmes techni- maître l'hypnose milton naturellement forte débit ques hypnotiseurs dont erickson suite étudié rapide répond doux but induire chez l'interlocuteur arguments quatorze très bons correspondant exprime niveau attention récepti- vendeurs travaillant immobi3 lui-même sans heurts lentèur vité particulier permettant lier automobiles luxe après entrée matière classi- argumentation plus convaincante bourse etc. testé conclu mauvais temps expli- tous bons professionnels sions auprès plus cinquante client hésitation vente cherchent établir tel cli- commerciaux faire visiter telle maso mat sans toujours rendre compte sûre vou iriez voir nature procédés font sais peux mon- intervenir communion trer prix sst élevé pause première étude réalisée d'esprit imperceptible voir suffirait 1981 portait huit démarcheurs faire acheter quelques assurances quatre entre usa nee créé instants plus tard fait allusion excellents résultats auprès l'observation rythme commentaire ancien client leurs clients quatre autres ypnotique est-à-dire maison vrai paradis obtenaient résultats plus l'emploi phrases attitudes nou regrettons moyens l'âge pexpérience reprennent commentaires rgent nouvelle pause puis huit sujets comparables pre- expérience comportement sui arr phrase arrive nant place client rencon- technique offre hésit quoi hous tré huit hommes enregistré puis miroir implique sug- l'acheter. longtemps avant analysé conversations fonction trente procédés per ssuua- voir dossier erickson programma- cette ême jeune inguisti femm €xtrémemerit sion établis richard andler pacha muistique poggr der bandier gie vricr 1982
