,page,text
20,21,ervice protechior ineurs dont enquête app drésomptions circonstances mauvais traitements ... tant l'absence preuves ant placé pouponnière rendu bout deux mois famille sous surveillance éducative assistante spécialisée dépendant juge enfants mois après consultation protection maternelle infantile constate trois ecchymoses parallèles suï joue gauche faisant penser traces doigt explication l'enfant tombé chaise ecchymose frontale frère fait tomber mère demande què enfants placés effectué l'intermédiaire juge enfants personnalité cette mère jeuñe aimable vit intérieur propre soigné maintenant être cernée egocentrique rlarcissique parlait désirs qué matériels indifférence totale vis-à-vis enfants manifeste anime lorsqu'elle évoque situation passé orpheline père rejetéé mère dit-elle ättachée sœur mettait poïte recevoir amants rétrouve long passé troubles comportement vols fugues placée centre bon pasteur apprit métiér aide comptable paru tirée affaire revanche peu renseignements père quatrième famille huit père alcoolique mère s'était mise ménage autre alcoolique brutalisait femme enfants cas illustre manifestation personnalité subnormale marginale retrouve fréquemment parmi parents maltraitants caractérise inaffectivité extrême impossibilité aimer bébé cette ificapacité attachement humäin assortie quête affective importante grande dépendance autrui marquée besoin soutien réconfort mères apparteïñant typè égocentrique narcissique atten- dent nourrisson réponde leurs besoins apporte gra- tifications rôles parent-enfant inversés äjoute cela signak sont-ils battus grande intolérance frustration recevant l'enfant labs scomptées ves d'amour pté pps pleurs mètes laissent aller accès rôlés cours desquels celui-ci alors vécu comme pers fait exprès bus dit d'elles propos enfant larmes aucune trace culpabilité apparaît habituellement chez femmes explique jeur attitude dégaee telles distorsions comportement parental s'expliquent carence affective histoire parent maltraitant révèle effèt enfance gravément perturbée marquée frustration massive découle sentimènt être mal aimé peut agir anciens püpilles assistarce publique d'enfants élevés plusieurs placements süccessifs ayänt relations très conflictuelles leurs géniteurs. chercheurs américains steele pollock notent milieux incriminés forcément dissociés négligénts cause plutôt selon inadéquation dés soins maternels paternels frustration maltraitance physique morale sous forme exigences excessivés inadaptées bref passé tout point similaire anciens martyrs font revivre progéniture. s'ils s'étaient peu peu stabilisés souvent prix effort important arrivée enfant remis cause fragile équilibre venue monde enfant mobilise chez mère tous sentiments relieñt propre mère relation celle-ci toujours insatisfaisante résulte cette incapacité aimer autres cas mauvais traiterhents surviennent cours suite page ddass directi dir ion départementale action afritem association tion recherche l'enfance érrres dan dération nationale comités alexis rue valence 75005 paris tél auteurs sévi snfants krèisler straus archives mçbe sde pédlatie 1971 249-26 enfants victimes sévic houzel psychiatrie l'enfant dde mazet ent vol maloine 1978 ladoles- violences institutionnelles équipe neuf éducateurs spécialisés sous direction docteur tomkiewicz directeur recherches l'inserm institut national santé recherche médicalé s'est attachée cours d'une enquête commencée 1981 repérer france institutions dépendantes l'etat violences commises lès enfants lls recenser dizaine cas reflètent mêmes caractéristiques établissemerits isolés direction très forte commande personnel peu qualifié socialement fragile cette étude fait l'objet d'une communication lors récent congrès internätional enfants maltraités s'est tenu paris plusieurs cas particulièrement flagrants godefroi bouillon ün-foyer semi-liberté liévin enfants crâne rasé vivaient sous uni régime type militaire bon pästeur dion vingt fillés subissaient gime semi-incarcération foyers aujourd'hui fermés suite cette enquête
21,22,pscier attrs sas rea anne carr rte marol ragu pnr ens sna insserss ars
22,23,personnalité etre bien peau trop souvent tend comme autant boulets chaque envoyons réalité entou dont connaissons ance traîner problèmes fois dévalorisons rage message codé -même teneur être mieux peau faut avant tout décoder signaux secrets prendre conscience causes réelles comportement répéter bon rien tous actes tournent catastrophe emilie ans employée postes plaint continuellement auprès mari considère comme mauvaise mère famille bête peu intéressante connaissons tous gens comme jérôme emilie interrompent énumération leurs défauts plus personne écouter pourquoi comportement autodépréciation souvent manque confiance soimême sentiment infériorité culpabilité autocritique sert aussi souvent exprimer agressivité colère établir position statut vis-à-vis monde extérieur quelles raisons érôme ans lycéen arrête richard driscoll comportement personne dévalorise rend malheureuse rend compte cause propre malheur comprenant pourquoi agit cette façon difficile changer attitude vertus l'autocritique autocritique constitue souvent manière obliger mieux comporter l'avenir étu- diant conscient faiblesse mathématiques peut avoir raison vouloir s'orienter vers autre voie jeune fille peut faire bon choix refusant sortir camarade lycée plus âgé car ne-se sent assez mûre frontière entre pautocriti- justifiée celle exagérée toujours évidente ailleurs chacun doit façon autre imposer contraintes accomplir tel tel travail surtout agit tâche peu intéressante fait montrer dur soi-même peut renforcer motivation moins manière momentanée punit exhorter faire preuve plus d'enthousiasme mettre plus sien moins croit-on car plupart cas comppcrtement permet améliorer situation faut demander est- marche est-ce contrainte encore plus forte donne- rait meilleurs résultats autocritique fréquemment aussi moyen interdire tout acte dangereux non conformiste marie-france ans assez jolie trouve mari
23,24,envisage setait trouvé cela immoral mari renonce donc projet adultère met peu peu attacher importance ben sarite défauts physiques croit affligée effet ruiner confiance dévalorisation devien moyen dissuasion accomplir actlon jugée néfaste excessives protéger contre attaques tant gens dévalorisent c'est souvent aussi protéger contre attaques d'autrui difficile faire reproches personne donne d'elle-même image d'insécurité fragilité laisse penser incapable sortir oserait tirer ambulance modestie demeure vertu société actuelle toute personne fait preuve prête flanc critique autodépréciation peut encore être üne façont prendre risques jouer sécurité mieux vaut montrer surpris bonne nouvelle qu'être sans cesse démuni face échec déception personnes préfèrent prendre devants critiquant elles-mêmies plutôt trouver butte critiques autres car elles tendance penser reproches encontre justifiés faut comprendre critiques souvent motivées jalousie envie correspondent forcément réalité réalité fait admettre culpabilité peut pousser lés autres reconnaître leurs torts premier avoir fait miea culpa retire grand prestige moral plus conféssion fautes peut apparaître comme preuve noblesse idéaux montre ainsi faire bien importance capitale dénonçant doigt propres faiblesses personne exprime volonté être inflexible envers elle-même ane fonction fréquente autopréclation former rempart -à-vis demande ans mule utilisée analyse comptez car voyez-vous j'ai jam bois n'est oir amis puter privilège être plus digne pitié sein roupe crest quelquefot attirer sympathie antodépréciation françoise ans éducatrice montre los gérément sévère envers elle-mêm ést inciter amis relations rassurer dire tout mal sent fait moins seule moins mal aimée évite temps avoir écouter doléances géns plus inälheureux amis risquent longue rendre compte manège prendre leurs distances vis-à-vis françoise répren dra alors pied cycle infernal l'isolement autocritique recherche üne oreille attentive rompie cercle vicieux françoise doit dépasser apitoiement égocentrique aÿprendre parler autre chose sés propres problèmés aussi recourt motifs cachés autocritique peut encore constituer môyen indirect d'expression sentiments marie-claüde ans mère famille passé heures préparer bon petit plat mari rentre tard bureau dit mot pendant tout repas tranchant poulet trop sec marieclaude répond époux voix amère décidément cuisinère épouvañtablé réussit jamais rien ramasse poulet part courant cuisine jeter poubelle marie-claude fait ainsi savoir fnari blessé efforce metre embärras ailleurs dités ment personne dévale trop dur toi- mêrne risque trouver cela satire l'opinion dole ipresfait contredite répliquera exägère sais très bien idiots pourras rouver personne orise considère fois victime peut toute énergie droit émettre ssent-ils négatifs battre ave coriserver jugements apprendre plus déva ant fout prendré joriser faut ble conscience fait probiéme monde extérieur vient non tiel nous-mêmes essentie consiste prendre conscience propres motivations dévajorise paicë pensé être vraiment stupide bon rien visons toujours but précis contraindre changer comportement gagrier syrnpathie entourage éviter responsabilités etc différerites écoles psychothérapie peuvent aidèr mieux coinprendre racines problème lorsque autocritique vécuë comme moyen pénitencé conception freudiennë surmoi retenir contraire ellé utilisée véhiculer agressivité côté analyse tran sactionnelle théorie jeu faut tourner toutefois aucune théorie suffit rendre compte complexité phénomène pourquoi approche pragmatique indispensable celui utilise dévalorisation but attirer sympathie autres doit recevoir träitement personne cherche äinsi faire face agréssions pratique plusieurs raisons conjuguent souvent chez individu solutions deviennent fait encore plus exes maïs premiër cette réduire silence voix intérieure destructrice toujours prise rte raisons ras conscience ner one ondes font domi comporteinent nestes mice richard drischh cost psyckesss knoxÿillé tennéecee ennesses usa ness csst
24,25,thérapeute quarante cent patients avouent cacher quelque chose psychothérapeute résultat d'une enquête effectuée deux chercheurs texans risque faire retourner tombe freud analysé devait absolument tout dire pourtant con- clusions daniel shuman l'école droit l'université méthodiste sud myron weiner psychiatre clinique centre sciences santé l'université texas sans appel sujets plus censurés patients concernent actes sexuels pen- sées érotiques pen- sées violentes affaires d'argent arrivent loin derrière chacun enfin faits dissimulés relatifs cri- délits principale raison invoquée patients réside peur sentir désapprouvé thérapeute revanche gunter rambow s'inquiètent peu risque psy révèle leurs actes délictueux justice d'entre font confiance sens moral thérapeute pensent qu'il respectera secret professionnel d'ailleurs garanti loi récernment votée l'etat texas peut néanmoins deman- der quelle mesure résul- tats cette enquête peuvent être extrapolés france reste monde ainsi montre actuellement écrans télévision feuilleton dallas texans sont-ils 'éminents spécialistes mensonge dissinulation
25,26,purificateurs air vita lux respirez l'air pur tous locaux purificateurs air vita-flux l'air dépollué désodorisé assaini vita-flux protège contre nuisances l'air pollué sté eurodic rue général clergerie 75116 paris tél 704.61.55/553.67.54 praticien spécialisé analyse intensive courte durée donnant consultations caractère informatif m.-n. cugnot psychanalyste président conseil supérieur psychanalystes professeur agréé 1.d.h.e.r.a reçoit rendez-vous cabinet rue maubeuge 75009 paris tél 281.17.44 n.-d. lorette modalités particulières résidents hors région parisienne economisez 20f abonnez-vous lent jorité mascues portent l'opposé emploi femmes trava environnement lin sveltes grand cheveux courts celles milieu domi petites grosses cheveux longs telle conclusion deux chercheurs université virginie selon analyse phénomène non prédispositions génétiques fait société actuelle imposerait normes d'apparence physique femmes différentes selon type d'emploi nancy tarrand jerry wolff estiment qu'il possible jusqu certain point modifier physique coller profil souhaité employeurs souhaitez décrocher poste domaine réservé masculin conseil madame faites-vous couper îles cheveux commencez régime fem- pile contre l'autisme médicament appelé flenfura mine d'une certaine effica cité traiter l'autisme telle conclusion provisoire d'une étude actuellement réalisée biochimiste edward geller équipe centre médical brentwood los angeles u.s.a l'autisme rappelons-le trouble mental très grave développe dès petite enfance manifeste certains symptômes schizophrénie l'arriération mentale l'enfant autiste reste muet refuse rela- tion autres essayait jusqu'ici d'améliorer état attaquant racines psychologi- ques profondes trouble savoir réaction violente l'enfant contre mère l'emploi médicaments constitue donc virage 180 degrés atti tude face l'autisme chercheurs californiens choisi fenfluramine cause capacité réduire production produit chimique présent cerveau sérotonine autistes effet élevé cette substance ainsi l'explique new england journal medicine donc fenfluramine enfant administrées trois autistes non seulement taux sérotonine rapide- ment baissé liora- tions import amélio tement compor eurs fonctions intelont constatées l'équipe professeur refuse tirer conçite enc résultats échang ants portent être 'eprésentat trop réduit être poursui recherches vent médicament
26,27,pee l'exercice physique excellent non seulement corps aussi équilibre psychologique telle conclul sion série d'études scientifi ques récentes portent catégories sociales aussi diverses étudiants policiers pompiers malades car diaques l'exercice physique aug mente effet sang taux d'une substance chimique proche morphine béta- res ens der endorphine particularité d'améliorer humeur fait pourrait expliquer pourquoi certains joggers affirment ressentir états comparables ceux éprouvés grâce drogues pourtant étude montré adeptes jogging n'ont taux béta-endorphine plus élevé moyenne chercheurs émettent malgré tout l'hypothèse produit chimique pourrait expliquer l'accoutumance éprouvée certains coureurs fanatiques plusieurs points tout cas établis l'exercice physique augmente dynamisme général organisme donc capacité faire face situations sentez déprimé sortez chez courez c'est aller chez psychanalyste too bioéthiquemrere médicale jean-pierre chevènement ministre d'etat ministre recherche l'industrie annoncé création d'un comité bioéthique médicale comité analogue existait déjà depuis plusieurs années l'inserm institut national santé recherche médicale intéressait qu'aux travaux menes cadre cet organisme nouveau comité constitue élargissement précédent fonction traiter grands problèmes moraux soulevés recherche biologique médicale prononcera aussi l'évolution techniques leurs incidences homme société garde-fou indispensable cancer classe second rang causes mortalité france constatation justifie amplement décisions ministre santé lancer grande concertation nationale thème différents sujets abordés l'inégalité sociale devant maladie rôle l'attitude médias réinsertion guéris aussi l'apport médecines parallèles l'idéologie cancer entre mythe morale public professionnels pourront formuler propositions mails tout devra être terminé mi-janvier 1983. fort informations jack ralite proposera gouvernement plan politique nationale cancer
27,28,dur privé distnnco fondé 1963 loi 12.7.71 cours correspondance cours oraux sessions formation conferences paris enseignement gradué correction individualisée exercices psychologie psychanalyse psychologie l'inconscient caractérologie morphologie graphologie orientation sélection professionnelle relations interpersonnelles inscriptions toutes l'année rythme d'étude individualisé conventions formation permanente analyses sélections professeurs ecole psycho-graphologie département villa saint-pierre 94220 charenton tél 376.72.01 mme mile désire recevoir sans enga- gement documentation gratuite ronflement riez problèmes être l'origine couple sépare pouvoir dormir pars c'est peut-être début incompréhension pallier inconvénient pierre gros inventeur français vient mettre point nouveau produit baptisé sonarex celui-ci mouille muqueuse rhino-pharyngée dont sécheresse responsable ronflement 137 fois testé produit d'hygiène médicament taux d'efficacité d'au moins faites partie restant ronfleurs irréductibles reste plus offrir boules quiès partenaire aller chez dentiste sans aucune appréhension laisser bercer musique éthérée cas- oreilles tandis praticien parle doucement arrachant dent sagesse c'est l'hypnosophrologie appliquée soins dentaires nouvelle méthode utilisée plus plus dentistes rern- place avantageusement chez beau- coup patients anxieux l'anes- thésie classique cette technique présentée lors dernier con- grès dentistes entretiens garancière particulièrement recueilli l'attention partici- pants car constitue moyen nouveau original dédramati- ser l'intervention dentiste avant l'âge ans enfant trois moment quelconque vie vécu parent unique parent unique jusqu dernières années toujours presque mère compte aujourd'hui plus 625 000 mères isolées france dont 4000 regroupées fédération syndicale femmes chef famille syndi- cat vient d'accepter pères iso- lés effet plus plus papas-poules france rencontrent mêmes problèmes mères seules entrée s'est fait sans mal cepandant partie adhé- tentes syndicat craignant main-mise hommes pro- ème devrait théorique- ment retrouver chez représentants sexe masculin gun irontés aujourd'hui type depuis femmes connaissent encore éternités peut ester macho lorsque doit changer bébés faire ménage
28,29,étonnantes possiiites mémoire loin douter arrivant chez ami j'allais être témoin d'un spectacle vraiment extraordinaire décupler puissance mentale m'avait fait venir stockholm parler suédois pasteuretdenos grands savants français soir arrivée après champagne conversation roula naturellement difficultés parole public grand travail impose autres conférenciers nécessité savoir perfection mot mot discours w.r. borg dit alors qu'il probablement moyen m'étonner connu lorsque faisions ensemble droit paris plus amstsr etes fre ong sens snl nue ques ars déficit auditif souvent confondu chez très jeune enfant retard mental c'est pourquoi dépistage précoce essentiel vient monde enfant sourd 000 naissances chiffre assez faible traduit tout l'échelle france quelque millions sourds malentendants population faut veiller suites otites fréquentes l'enfance l'usage antibiotiques ainsi l'intensité bruit milieux professionnels âge adulte sourd souvent rejeté nombre structures institutionnelles entend grâce appareil handicap néfaste l'enfance accélère l'âge adulte effets sénescence psychologique parlement européen part guerre contre violence celle jouets abord aussi celle télévision jouets parlement recommande etats membres l'interdiction jouets guerriers députés européens prolifération jouets identifiant armes guerre présente danger sécurité physique enfants parlementaires européens savent cette mesure peu près inapplicable proposent donc premier temps l'interdiction publicité jeux guerriers suite industriels invités réduire progressivement fabrication jouets reste définir qu'est jouet guerrier suède depuis 1979 jouets reproduisant armes utilisées entre 1914 1945 interdits colts déplorable mémoire recula jusqu'au fond salle manger pria d'écrire cent nombres trois chiffres ceux voudrais enles appelant haute voix lorsque j'eus ainsi rempli haut bas marge d'un vieux journal w.r.borg récita cent nombres l'ordre lequel écrits puis sens contraire c'est-à-dire commençant derniers laissa aussi l'interroger position respective différents nombres demandals exemple quel 24° 72° 38° etje vis répondre toutes questions sans hésitation sans effort instantanément comme chiffres j'avais écrits papier aussi inscrits cerveau demeurai stupéfait pareil tour force etje cherchai vainement l'artifice permis réaliser ami dit alors semble extraordinaire réalité fortsimple toutlemondepossède assez mémoire faire autant maïs rares personnes savent servir cette merveilleuse faculté m'indiqua alors moyen d'accomplir tour force reur sans effort comme parviendrez vousmême demain bornai expériences amusantes j'appliquai principes m'avaient appris occupations chaque jour pus ainsi retenir incroyable facilité lectures conférences j'entendais celles devais prononcer nom personnes ren- contrals fût-ce qu'une fois adresses qu'elles donnaient mille autres choses d'une grande utilité enfin constatai bout peu temps non seulement mémoire pro- gressé j'avais acquis attention plus soutenue jugement plus sûr rien d'étonnant puisque pénétration intelli- gence dépend surtout nombre l'étendue souvenirs voulez savoir comment obtenir mêmes résultats acquérir cette encore meilleure chance réussir vie priez w.r. borg envoyer intéressant petit ouvrage documentaire lois éternelles suc- cès distribue gratuitement quiconque désire améliorer mémoire voici adresse bor dpt 115 chez aubanel place st-pierre 84026 avignon cedex nom aubanel garantie sérieux depuis 250 ans aubanel dif- fusent travers monde meilleures méthodes psychologie pratique p——— bon gratuit remplir lettres majuscule permanente felourner sarant borg dpt 115 chez aubanel place st-pierre 9028 avignon cedex recevoir sans engagement part sous pli fermé lois éternelles nom ville age center isere ————————— prénom ———————— code postal profession parvins aussitôt sans erpuissance mentale barsan ——————
29,30,"célibataires aimeriez-vous changer voire vie existe maintenant moyen sérieux rencontrer partir d'une véritable étude psychologique toute liberté personnes pouvant répondre attente personnalité efficacité moyen ajoute charme neuf plaisir classique dela rencontre avivé l'attente curieuse contacts imprévus hors cadres traditionnels échantillon s'être connues ains let sier relevé fois jois moins divorces étude sta- tistigue envoyée demande vers civilisation couple l.m. jentel toutes librairies congrès l'association internationale psychologie appliquée liège montréal munich edimbourg :28 juiller 1982 paris-bruxelles.geneve ion international bes 105 boîte 1000 bruxelles tél 511.74,30 eme far west revanche tour jours vendus véritable mar ché noir armes deux guerres mondiales s'est développé parlement n'en reste s'attaque aussi télévision autres médias sans aller jusqu censure bien sûr bornant souligner qu'il urgent d'agir réduire violence médias comment mystère premier ascenseur semble tou- jours aller mauvaise direc- tion sûrement déjà fait cette constatation contrairement apparences phénomène n'est fausse impression due mécanisme psychologi- inexpliqué vérifie réalité faut fier bon sens selon lequel autant d'ascenseurs sens autre tout cela fait simple question calcul probabilités eur nendez étages babl l'immeuble pro- aude voulez monter vers plus d'étages dessus qu'en dessous l'ascenseur d'être vers premier ascenseur donc pesterez attendant prochain passage contraire ntrair étage supérieur femmes commettraient plus crimes pendant période leurs règles telle moins conclusion deux médecins britanniques p.t d'orban dalton royal free hospital selon enquête relatée revue psychological medecine femmes coupables crimes d'actes violents accompli leurs forfait pendant paramenstrum période commence jours avant règles termine jours après cette enquête confirme étude antérieure selon laquelle échantillon 156 femmes impli- quées vols racolages états d'ivresse trouvaient période paramensirum chercheurs anglais souli- gnent plupart fem- n'ont invoqué leurs règles demander clémence justice égard toutes cycles menstruels réguliers aucune d'entre elles n'était atteinte troubles physià mportement d'orban dalton affirment ment agressif déclencheraient agression lors paramens- trum ceci n'est encore hypothèse mier s'arrêter probablement train monter raisonnement s'applique rez-de-chaussée dernier étage ainsi phénomène qu'on croit généralement psychologique réalité causes matérielles"
