,page,text
51,52,freud décrit amnésie infantile termes curieux phénomène transforme étrangers égard six huit premiéres années vie couvrant voile épais selon freud oubli essentiel veut dépasser succès stade complexe d'œdipe désirs violents incestueux pervers maïs mur refoulement élève peu avant cinq six ans mène également névrose psychanalyse certaine mesure méthode permet lézarder mur fait revivre revoir autre œil émotions enfouies passé cette notion amnésie infantile telle formulée début siècle freud semble remise question nouvelles théories connaissance psychologues contemporains adultes éprouvent difficultés remémorer événements enfance non cause refoule- ment parce plus capables penser comme enfants perdons faculté reconnaître facilement indices aideraient rappeler petite enfance l'amnésie infantile phénomène oublié psychologues byron campbell université princeton norman spear université pétat new-york binghamton u.s.a. relevé très peu études consacrées phénomène amnésie infantile depuis freud voici plus soixante ans phénomène semble avoir totalement refoulé communauté scientifique après rares recherches effectuées datant presque toutes années 1940-1950 souvenirs trois cinq premières années vie laissent pratiquement aucune trace mémoire adulte nombreux adultes totalement amnésiques cette période certains aucun souvenir avant âge huit neuf ans âge moyen auquel remontent premiers souvenirs trois ans demi puis nombre augmente chaque année rythme accroissement accélère rapidement jusqu âge cinq ans puis commence décliner observations semblent confir- mer théorie freud faisait débuter amnésie infantile moment oedipe vers âge cinq ans certains faits jettent doute explication phénomène ulric neisser psychologue connaisssance université cornell remarque théorie freud laisserait supposer patient devrait retrouver facilement souvenirs enfance aprés avoir achevé cure psychanalytique hypothèse jamais confirmée selon neisser enfants construisent structures pensée appelées schémas primaires permettent situer leurs perceptions rapport cadre référence lorsque enfant atteint âge scolaire structures pensée multiplient perfectionnent enfant deux ans verra livre sorte gros cube peut poser terre autre enfant quatre ans saura contient histoires lisent grands-parents enfant six ans lira lui-même rappeler livre enfant réfèrera catégories définissent cubes empilés histoires racontées grands-parents livre préféré neisser inspiré travaux psychanalyste ernest schachtel pense catégories schématiques utilisées remémorer événements passés doivent correspondre celles utilisées enregistrer comme schémas primaires changent âge décalage entre catégories pensée enfant celles adulte empêche remémoration événements petite enfance l'école exerce influence considérable façon enfants découper expérience réalité souligne neisser enfant apprend parler raisonner image camarades professeurs mesure adapte contraintes norme linguistique ajoute neisser devient prisonnier analyse quel- peu arbitraire réalité qu'impose langage particulier adoptant modes pensée parole plus acceptables socialement enfant perd habitudes mentales avant entrée école telle évolution entraîne incapacité progressive enfants retrouver souvenirs leurs pre- mières années l'espace nouvelle pros récents blème apport déve- travaux uniloppement 5he pillei harvard david aptes collège wellesley arbciné kihlstrom participé l'ouvrage dus evans æfunctional disorae memory désordres foncii nels mémoire amnésie provient uniquement inadéquation schémas primaires enfant signes évocateurs souvenir enfantdevenu-adulte également différence entre faculté attention enfant celle adulte théorie appuie travaux juan pascual leone ancien élève piaget genève yeux psychiatre complexité pensée personne dépend quantité informations attention peut retenir moment étendue cet espace mental espace lequel structure pensée détermine approche nombre schémas primaires distincts auxquels personne peut penser moment donné plus grand espace plus nombreux concepts retenus plus complexes peuvent être pensées selon pascual leone étendue espace enfant augmente âge enfants moins deux ans fonctionnent presque uniquement réaction habitudes espace très réduit trois ans adolescence faculté d'attention espace cessent élargir vers trois quatre ans enfants capables retenir seul schéma suite espace s'enrichit unité information tranche deux ans plafonner vers âge quinze ans dès lors peut mémo- tiser simultanément sept unités information distinctes prenons comme exemple test psychologique bien connu con- siste faire lire sujet liste chiffres demander réci ter commençant dernier chaque chiffre représente unité information pascual leone chacun occupe unité espace suivant calculs lpenfant trois ans capable répéter
52,53,moyenne seul chiffre enfant cinq ans moyenne deux chiffres adulte retrouvera moyenne sans tromper sept chiffres cela semblerait indiquer selon white pillemer avant important possibilités résurgence souvenirs toutes premières années vie espace enfant suffisamment développé disposer mémoire volontaire facilement disponible explique l'apparition amnésie suite white pillemer font également observer différence entre souvenirs reviennent mémoire intentionnellement ceux surgissent l'esprit spontanément chaque type souvenir revient l'esprit selon mode propre héros recherche temps perdu marcel proust inondé souvenirs seul goût madeleine pareille celles enfance événements reviennent mémoire cette manière toujours émotions intenses événements répétés expériences resurgissent stimulées sensation image bruit odeur associés émotion déjà présente situation initiale autre type souvenir résulte contraire démarche volontaire découle appréhension intellectuelle événement souvenirs-là prennent place espace font appel raisonnement présents mémoire fois l'événement pensées rattachent non seulement chute bicyclette toutes résolutions prendre afin être plus vigilant route mouillée souvenirs peuvent donc réapparaître évocation seules pensées semble adultes gardent plutôt mémoire leurs souvenirs selon procédé rappelant événements grâce similitude situation réfèrent également catégories mentales associées souvenir rappeler adultes mémoire active participe espace tel cas très jeunes enfants vivent leurs expériences biais espace souvenirs cette période peuvent donc être évoqués mémoire appris pps 410 lialianon adulte heurtent effet modes pensée mémorisation différents habitudes mentales l'enfance faut-il autant opposer bruta- lement conception cognitive moderne amnésie infantile théories freudiennes censure intérieure frappe souvenirs l'enfance avant cinq six ans exactement refoulement dont parle freud selon white pillemer identifie plutôt pouvoir croissant raisonnement traitement informations dépendance résulte l'association libre cependant leurs yeux moyen efficace contrecarrer cette dépendance vis-àvis espace permettant avoir plus facilement accès souvenirs plus anciens association libre réconcilie anciens modernes association libre pensez rien particulier laissez-vous porter pensées peut interrompre activités espace mesure situation recréée relation psychanalytique rejoint celle l'enfance association libre peut faire resurgir spontanément chez patient émotions intenses cette période point vue freud raison affirmer l'association libre permet stimuler réminiscence d'émotions normalement censurées sans donner explication exacte amnésie infantile toutefois chercheurs encore beaucoup travail perspective avant pouvoir proposer théorie définitive selon psychologue elizabeth loftus université washington spécialiste mécanismes mémoire amnésie infantile reste bien égards énigme ila prouvé enfants .même très jeunes souviennent d'événements lieu jours semaines parfois mois auparavant pourquoi souvenirs estomperaient-ils temps pouvons apporter aucune réponse cette question simplement hypothèses daniel goleman fait partie comité rédaction revue américaine psychology today demande sans engagement formule d'orientation aune documentation gratuite entretiens soir après-midi cours correspondance ps5 vient paraître morpho-psychologie document formation nouvelle anthologie hippocrate docteur corman outil travail essentiel psychologue l'animateur éducateur responsable relations sociales orienteur vendeur formation concrète individualisée entretien soir après-midi séminaires journées d'études enseignement correspondance paris province lyon bordeaux marseille animée universitaires praticiens convention formation continue ——— formations psychologie appliquée graphologic morpho-psychologie psychologie profondeurs caractérologic symbolisme psychopédugogie créativité formation d'animateurs orientation para-psychologie psychotechnique rorschach psychosociologie sexologie relaxation psychosomatique 0000000000 informations bureaux correspondance rue joubert 15009 paris tél 874.43.60 etablissement privé d'enseignement nom ... profession .............. séminaires
53,54,dessi
54,55,howard leventhal tout homme bien portant est-il malade ignore docteur knock jules romains tout fait tort tout cas plus moitié patients suivent prescriptions médecin cherchent-ils ainsi éviter conflit entre leurs théories personnelles maladie diagnostic médecin —————— enfant bonne toux respiration sifflante fièvre nez pris mal gorge symptômes laissaient guère doute quant nature affection après avoir demandé comment sentiez avoir établi diagnostic médecin prescrivait médicament donc tout naturel conclure doutiez maladie traduisait signes concrets symptômes dont disparition signalait l'approche guérison premières expériences créent ensemble croyances inconscientes non formulées implicites maladie bien souvent suivent vie adulte maladies chroniques comme troubles cardiovasculaires l'hypertension cancer diabète souvent asymptomatiques toutefois adultes conditionnés leurs expériences sentent rhumes dessin jean-bernard blanchet enfance raisonnent comme toutes maladies devaient manifester symptômes témoins gravité évolution affection malades faut symptômes s'ils détectent symptômes faut diagnostic médecin explique nécessairement symptômes maladie dont souffrent continueront obstinément chercher. étude réalisée 1979 dan meyer université wisconsin interrogé près 300 patients suivant traitement contre l'hypertension artérielle selon p'avis patients plupart gens incapables savoir quand tension élevée entre convaincus qu'eux-mêmes capables deviner après signes concrets maux tête rougeur teint énervement expériences menées conjointe- ment laboratoires université virginie prouvé gens incapables savoir exactitude tension élevée non plupart temps associent fait sentir-nerveux our avoir subi stress l'élévation tension symptômes ceux hypertension estimations patients dénuées fondement comme témoigne l'expérience réalisée collègues linda baumann quelques patients étudiés capables donner estimation peu près valable tension sanguine précisément ceux croyaient être incapables alors sujets convaincus contraire très loin vérité croyances inconscientes conclusions relèvent simplement anecdote effet patients conditionnés leurs croyances inconscientes l'écoute certains symptômes orientent décision suivre non prescriptions médecin ïinfirmière affirma jour pouvait savoir quand tension élevée car chaque fois migraines mesurait comme forte prenait médicaments jusqu maux tête disparu puis arrêtait traitement avant nouvel accès migraine prenait tension
55,56,maladies san dehors imoments-là donc incapable savoir cette derhière restait élevée lorsqu'elle souffrait migraines patients savent devraient arrêter fumer suivre régime sans sel réduire consommation sucres graisses cela reste abstrait pourtant selon croyances inconscientes substances inoffensives santé elles bon goût procurent sen sation bien-être plupart cas signès maladie cardio-vasculaire cancer observables dès début personnes interrogées parlent comportent comme elles savaient instinctivement moment apparition maladie modifiaient conséquence mode vie peut-être trop tard david neérenz karin ringler moi-même nouveau constaté l'importance signes concrets idées reçues intéressant perception patients atteints cancer suivant chimiothérapie évolution maladie chimiothérapie provoque toute série effets secondaires difficiles supporter nausées vomissements perte cheveux fatigue générale endolorissement faiblesse membres avantage apporter quelquefois longues .rémissions nerenz ringler interrogé femmes atteintes cancer sein hommes femmes atteints lymphosarcome selon leurs premières conclusions fort surprenantes patients atteints lymphosarcome dont amélioration grâce traite- ment chimiothérapique plus spectaculaire tumeurs disparues deux semaines justement plus déprimés traitement chez patients moins per- turbés traitement régression tumeur moins rapide comment expliquer phéno- mène nerenz aperçut certains patients déprimés parce traitement poursuivi plus manifestation physique amélioration leurs symptômes grosseur diminue volume supportaient beaucoup moîns bien désagréments devaient endurer malades sentaient plus leurs tumeurs redoutaient également cancer essaimé autres parties corps tel cas pourquoi continuait-on traitement réactions peu prés similaires chez femmes atteintes cancer sein traitement moins bien supporté femmes chez poursuivi titre préventif après intervention chirurgicale réussie celles souffrant forme plus grave plus avancée maladie ee————————— représentation dangers angoisses incertitudes relatives traitement rendent vie difficile patients peuvent amener laisser tomber traitement suivre thérapie moins intensive selon statistiques courent risque réduction jeurs chances survie cinq ans .même plus offre chimiothéra.pie certains effets secondaires traitement conduisent parents certains patients considérer comme plus néfaste maladie elle-même statistiques abstraites montrant augmentation taux survie certes moins parjantes symptômes spectaculaires comme nausées perte cheveux quatre facteurs prise conscience-de augmentation cause durée conséquences constituent donc traits dominants représentation dangers maladie esprit gens éléments influent manière réagir maladie facteurtemps durée présumée maladie permet savoir patient atteint hypertension suivre non traitement pa- tients abandonné traitement considéraient maladie comme généralement courte durée .avec guérison rapide seuls patients considérant lhypertension comme maladie chronique interrompu traite ment représentation initiale maladie chez patient semble être jargement influencée sens terme donné pre ten hypertension aneuins plu identifient tension das maladie cardiaque sre toujours cas l'associat çaine cœur éci l'hypertension devrait être appete pression sanguine élevée exp sion plus neutre onc surprenant patients voir symptômes maladie énervement accélération rythme cardiaque peuvent cependant prendre autres symptômés con- sidération selon nouvelles informations recueillies cas exemple aperçoivent tension élevée sans accélération simultanée rythme cardiaque face maladie patients cherchent seulement symptômes concrets causes réelles ainsi certaines personnes attribuent hypertension excès sport récente dispute conjoint employeur encore échec professionnel appelons cette sorte appréhension maladie modèle phase aigué cas-là patient convaincu augmentation tension peut être imputée grosse contrariété événement inhabituel disparaîtra bout quelque temps causes passagères ainsi patient mangé plat particulièrement épicé grande quantité frites rendra res- ponsable hypertension absorption excessive sel sujet fait actuellement objet nom- breux débats médias pendisparaîtra tôt acci déterminer chez ident semblent tion symptôm
56,57,symptômes sans maladie tion convictions souvent définitives confirmées médecin lui-même demande-t-il pendant consultation comment sentons n'est-il attentif symptômes d'après collègues david steele mary gutmann tom jackson médecins suggèrent quelquefois sans vouloir symptômes particuliers hypertension notamment quand essaient déceler certains effets secondaires médicaments prescrits complications patient peut déduire but questions posées prouver existence hypertension elle-même d'ailleurs est-il droit suivre tel raisonnement bien rare personnel soignant quel explique motif questions posées malade systemes d'idées reçues engendrées principes fondamentaux attitude face maladies souvent plus complexes patient atteint lymphosarcome arrivera penser exemple ganglions tumeurs apparaissant unilatéralement cancéreuses alors celles surgissant simultanément deux côtés inoffensives patiente atteinte cancer sein pensera douleurs situées siège initial maladie signe rechute contrairement douleurs apparaissant ail leurs cancer donc patients comme résultat processus rnécanique isolé géographiquement ailleurs malade idées très-arrêtées nature trouble peut arriver pense savoir plus médecin traitement suivre respect .des prescriptions médecin malades fait objet grand nombre études part psychologues selon analyse littérature existante effectuée .david sackett brian haynes memaster university marshall becker université michigan plus quelquefois patients suivent vont jusqu bout traitemént prescrit quelles raisons poussent personne normale suivre psychologie nte 247 sratanon prescriptions médecin avis malades cachent véritable motif refus éviter conflit entre leurs théories personnelles maladie diagnostic médecin peut-être peur être mal aise argumentation être ridicule peuvent également vouloir formuler leurs craintes quant interprétation maladie encore vouloir éviter mettre ouvertement question autorité médecin redoutant apporte plus soutien nombreux malades admettant toutefois opinion maladie encontre celle médecin -avouent souvent négliger prescriptions médecin décider eux-mêmes quand prendre leurs médicaments dites surtout docteur répètentils décrivent façon évaluer doses médicaments dont besoin soigner hypertension ainsi patient prenait médicaments après déjeuner dîner enrayer maux tête après repas lieu intervalles plus rapprochés selon ordonnance médecin lors consultation médecin étonna voir restait encore environ tiers comprimés patient répondit absent chez pendant semaine oublié emporter savoir malade l'opinion selon laquelle patients objets sans volonté doit pousser prendre leurs médicaments ressort conception dépassée relation médecinmalade largement discréditée heure actuelle malade personne douée esprit perpétuelle activité interprète informations maladie effort guérir afin assurer leurs patients suivent bien traitement médecins doivent parler longuement con- naissance cause symptômes évolution maladie ainsi finalité traitement faut bien sûr patient courant gravité affec montré tion étu effets peur généra courte durée peuvent etre double tranchant certains sujets tellement effrayés qu'ils plus vulnérables moins bien armés lutter contre mal redoutant autant remède maladie suivent prescriptions médecin malgré fait exemple examen radiologique prioritaire établir diagnostic traitement éventuel cancer poumon rares gens acceptant proposition être radiographié tout suite après projection documentaire sujet malades veulent avant tout information claire précise nature dangers .de maladie possibilités y.faire front. faut instructions concrètes arrêtez fumer faites-vous vacciner contre tétanos succès échec traitement dépend souvent capacité médecin évoquer danger compris évalué malade donner exemple réaction avoir devant maladie également essentiel comprendre comment patients visualisent leurs problèmes comment font face leurs idées reçues maladie étant-souvent fausses patients font souvent remettre place praticien grave erreur effet idées pouvons avoir santé bien ancrées esprit elles repo- sent longue expérience maladie seulement reflet opinions communément admises fondent faits seuls savoir exactement ressentons après tout pourrait savoir place —————— howard leventhal professeur psychologie université wiscon- sin u.s.a. recherches actuelles portent l'éducation malades signes avant-coureurs cômpor- tements d'accoutumance chez l'enfant perception de.la maladie personnes âgées leventhal directeur journal publié quon américaine psycholo- health psychol logie santé fsycho
57,58,"ciatiomaute corps suite page gestuel automobilistes particulièrement éloquent quoi étonnant parler mains laurence wylie répond différence notable distingue hommes américains hommes français peut-être également hommes européens nord ceux sud c'est hommes américains conservent certaine rigidité leurs poignets efats- unis plier poignets considéré comme geste féminin france semble avoir cette différenciation sexe editions cnrs publient ouvrages très haut niveau sciences exactes naturelles sciences humaines recevoir docu- mentation publiée lors parution tout ouvrage veuillez entourer d'un cercle sections inté- ressent inscriptions modification d'une inscription antérieure goindre l'étiquette dernier envoi arts conversation françaises épousé américains constaté leurs nouvelles familles accusaient interrompre impoliment avant elles fini parler con- sciences humaines écologie agriculture alimentation archéologie historique archéologie préhistorique architecture/urbanisme arts graphiques/peinture/ sculpture clusion toutes françaises cinéma/photo/théâtre/ mal élevées bien sûr non ... spectacle vérité états-unis danse/musique droit mêmes principes conversa- économie 40. éducation. ethnologie études africaines tion là-bas personne prend pa. role avant avoir certaine génie cuteurs üne pause silencieuse géographie signal frarice règle histoire histoire médiévale linguistique littérature philosophie politique psychologie sciences -religieuses sociologie information réunions rare orateur faire face üne assistance entre écouter conférencier constatation choquante autant peu rompu habitudes européenries bavard compatriotes voilà réduit silence dès trouve milieu frariçais et'inca- désire recevoir questionnaire sciences exactes naturelles cours orateur.et conversations particulières dont nôus paraît-il capacité tarde guère retrouver tête-à-tête violent mal crâne peut-être verrons-nous bientôt apparaître rubrique nouvelle guides voyage recen- présentera touriste sou- cieux se.mêler gens habitu- corporelles culturelles cha- popülation habitudes résistent changement renforcent continuité l'identité nom prénom capitales rüe code -postal ville documentation gratuite demande librairie editions cuecnrs gorietb ere ben -sociéié manière invité interlo- chacun soi prime .dans apparemment plus occupée à-discuter déroutante américain pable suivre tout fois dis- eco peycho-c ment techniques extoud chologiquesjet éparetien organisme privé dense eeten shstaneg fonde 7:71 cours correspondance cours oraux sessions con ences paris. enseignement gradué professeurs spécialisés psychologie psychanalyse psychologie l'inconscient caractérologie morphopsycho logie graphologie orlentation sélection professionnelles inscriptions toute l'année rythme d'étude individualisé. formation conventions permanente documentation gratuite gaillat villa st-pierre 94220 charenton tél 376.72.01 analyses selections pire professeurs diplomes langues vie professionnelle pratique utile d'au moins langue étrangère devenue indispensable presque tous secteurs professionnels augmentera qualification compétence surtout complétée diplôme pratique tels ceux chambres commerce étrangères l'université cambrid- b.t.s traducteur commercial interprète d'entreprise langues affaires établ chés lang service 2717 affaires paris-levallois té1 270.81,88 92303 ———- bon d'infor veuillez m'envo ation yer gratui documentation service ment"
