,page,text
16,17,"femme sue dont naissance volontairement retardée clinique comme cela pratique couramment attendre venue médecin alors sentait prête venir monde bloquée sentiment blocage accompagnée tout long vie relations comportements actions pouvait rien réaliser sans créer elle-même obstasle exemple pouvait préparer tasse café sans nettoyer toute maïson abord après pouvait agir manière totalement normale oui façon spontanée sans rien passé blocage revienne oui cela fait jour lendemain seul primal permis être complètement libérée blocage processus réalisé petit petit cette libération manifestée tous domaines vie oui domaine sexuel parce transformation également manifestée point vue hormonal hormones sexuelles modifiées hormones stress diminué hormones croissance apparues hormones croissance oui pendant années observé sans vraiment bien comprendre après primals seins augmentaient volume doigt pieds grandissaient mâchoires développaieñt.… explication phénomène attachaïs grande importance jusqu jour découvert mesuré hormones croissance elles fonction précise permettent notamment guérison importe fracture mesurer également diminution taux cortisol est-à-dire hormones stress ceci est'très important supposons doive prendre décision relâcher non violeur peut effectuer examens psychologiques savoir changé comportement mesure niveau stress permet savoir manière précise constitue danger société vus tout fait opposés intervention faut laisser dérouler circuit biologique niveau hormones stress peut fluctuer suivant période vie patient moment journée effectue mesures manière régulière jour déterminé semaine heure plus sait série primals stressé moment-là stress niveau minimum mesures effectuées patients fait primals pendant combien temps après fin traitement trois semaines six mois toute mesures biochimiques coûtent fortune finançons nous-mêmes pourquoi effectuer mesures période plus longue revanche effectué mesures autres paramètres déterminer caractère définitif guérison toutes thérapies rencontre souvent partisans enthousiastes tout moins début traitement puis enthousiasme diminue disent début sentais effectivement changement maintenant trois cinq ans après rends compte n'ai changé primal assure-t-il changement permanent enthousiasme qu'un aspect secondaire trouve début fin niveau d'enthousiasme reste élevé important niveau hormones ainsi tous indices concernant souffrance étude faite ordinateur aide questionnaire adressé patients cinq ans après fin primal partie ailleurs reproduite dernier livre ainsi déterminer effets durables non gens recommencé boire fumer vie sexuelle restait améliorée guéri migraine revanche ulcère nouvelle étude réalisée neuro-physiologue puniversité copenhague publiée journal scientifique scandinave acta scandinavica trouvé diminution fréquence amplitude ondes cérébrales modification voltage entre deux hémisphères étudié patients deux ans après fin thérapie quel pourcentage guérison constaté ordinateur pourcentage assez impressionnant étonné institut recherches 94,5 noûs-mêmes impressionnés primal thérapie plus efficace existe mesures effectuées également parmi adeptes méditation transcendantale l'augmentation ondes alpha semble être mesure scientifique l'efficacité méthode méditation transcendantale biofeedback constate augmentation amplitude ondes cérébrales primal constate con- traire diminution cette diffé- rence importante car corrélation certaine entre augmen- tation amplitude ondes refoulement souffrance agit état fausse satisfaction"
17,18,toutes thérapies prétendues réussites seule preuve efficacité mesures physiologiques patients déclarent satisfaits psychanalyse biofeedback religion fait vrai aussi méditation répriment souffrance. comme tranquillisant personne sent mieux plus calme plus détendue parce renvoyé tout agitait intérieurement enfer primal fait sortir deux chemins différents exactement opposés réalité primal fait sortir méditation referme couvercle plus possible aide ainsi système endorphines… ceci vrai certains types méditation peut généraliser tous cas certaines traditions extrême-orient méditation phases justement utilisée libérer émotions oui bien possible toute façon expert méditation revanche concerne méditation transcendantale wallon mis évidence augmentation amplitude ondes cérébrales cela signifie cerveau fonctionne très vite patient sent bien peau alors souffrance reste toujours présente camouflée sentiment subjectif satisfaction n'est donc suffisant déterminer réalité amélioration seules mesures objectives permettent tout fait maïs personne médite sent bien toute vie qu'est-ce permet dire mal tout cas messie tout simplement détenteur certaine vérité valable tous êtres humains découvert quelque chose ceux souffrent ceux souhaitent mettre terme souffrance tout important maintenant technique moyens mettre fin souf18 france l'humanité car beaucoup gens arrivent vivre tous matins souffrent migraines appréhension dépression invivable certains suicident pendant dix-sept ans j'ai pratiqué psychanalyse freudienne plus orthodoxe beaucoup patients m'ont dit sauvé suls bien peau maintenant j'ai amené patients faire primals j'ai découvert masse énorme souffrance restait ela prend toute vie éliminer souffrance accumulée avant primal croyiez guéris croyaient guéris finalement tout intérieur oui absolument peut-on dire chose primals certainement pre- mière fois pouvons mesurer souffrance toujours présente personne peut dire sens bien ensemble mesures physiologiques prouve contraire inversement peut-il arriver personne dise sens bien bien mesures physiologiques onnes ession subjective également variable importante dont faut tenir compte toute façon far recherches indiun grand nome ine évéquent maniere certaine else nements enfance avant naissance restent engrammés cerveau viens écrire livre sortir cette année france naissance l'influence événements pré-nataux vie melsak heure actuelle plus grand spécialiste souffrance physiologique notamment fait expériences chiens planté électrodes système limbique fait passer décharge électrique quotidienne montré stimulus reste engrammé produit effet cumulatif chose produit traumatismes enfance audelà certain seuil apparaît symptômes expériences chats montré souffrance occupe certain nombre cellules cérébrales plus souffrance grande plus aire cérébrale concernée étendue seule souffrance engramme cerveau plaisir oui plaisir occupe petite surface faut beaucoup cellules occuper souffrance car celle-ci menace développement tout cerveau doit faire face cette menace faut beaucoup cellules cerveau refouler alors plaisir agression laisse donc trace exactement l'enfant soumis trauma- certain stade cobpement possi- comprendre réagi refouier agir doit donc oui peut réagir ard fois adulte faire moment del eurait matisant événement trauceci l'enfant vrai quand ntre mère peut être agressé rie faire suite page
18,19,"abonnez-vous psycnoegie huile enr roogie après ans ges pros nourritures pont lez pratique théorique tous horizons psychologie mms francs tarif d'abonnement voie ordinaire toutes destinations fans tan emos zansf tan france 777 jzmelwrfwrf dom tom zone franc 270f\ 145f 80f \39f 205 105f europe 810f 16f 90f 430f 225 120f afrique compléter collection numeros déjà parus voici liste numéros encore disponibles 132 133 134 135 136 137 138 139 140 141 142 143 144 145 numéro port compris 122 hors zone franc asie amérique océanie cepins blusion vente bulletin d'abonnement commande enuxelles renvoyer règlement psyke rue choiseul 75002 paris 02/345.91,99 ccp 000-0069021-54 souscris abonnement abonnement fans ans numéros 270 étranger 310 commande numéros numéros 145 étranger 165 canada 6mois numéros étranger parus pri xemplaire cre cre canadiens com mande rellure joins l'étranger convient souscrire classer parutions pai chèque dance poele ... mandat international chèque francs fran- f'port compris chèque postal çals banque française enger mandat lettre nota toute correspondance relative abonnement changement d'adresse merci nom joindre possible l'étiquette figurant dernière bande d'envoi eee pes localité ..."
19,20,peut refouler parce système endorphines existe déjà ventre mère placenta rempli endorphines c'est fantastique usine endorphines vient découvrir peine très important fœtus patients souvenus d'événements produits ventre mère seulement cours dernier trimestre avant non raison physiologiques avant cela supports matériels mémoire existent encore comment souvient mouvements mouvement caudal fœtus revient gens savent très bien passe corps met bouger manière très caractéristique pendant certain temps savent très bien train arriver tout coup comprennent qu'ils train revivre naissance naïssance avant. avant assez rare certains ont-ils retrouvé vies antérieures constaté sous influence l.s.d pourtant cas gens souvenus vie antérieure sans avoir absorbé l.s.d. comment peut-on savoir vie antérieure existe vraiment aucune preuve plus preuve dire souviens m'est arrivé ventre mère tout fait pareil système nerveux existe dès huitième semaine peut engrammer… système nerveaux indispensable mémoire génétique. gènes viennent mére vie antérieure ... sceptique très toute façon primal quinze ans pratique jamais cela revient-il dire patient retrouve expériences passées fonction thérapeute traite quand psychanalyste patient parlé souvenirs intra-utérins.… justement cela passé ainsi début quand commencé prêter attention phénomène primal patients commencé avoir primals naissance croyais disais moquez qu'est-ce cinéma arrêtez immédiatement suffit comme mettre porte immeuble alors renseigné problème neurologique savoir possible gens revivent naissance important libérer souffrance prématurément faire sortir choses intérieures manière trop rapide sinon arrive phénomènes symboli- sation souffrance voulez-vous dire souvenirs retrouvés primal pourraient être image produites non expression souffrance maïs répression souffrance partie échappe quand méme symbolisée façon être intégrée acceptée système quel sens relation cause effet joue-t-elle découvre-t-on cause souffrance aide souvenir événements traumatiques bien invente-t-on souvenirs rendre compte souffrance primal cela correspond tou- jours événement réel début connaît effets fur mesure descend découvre source quel- chose invente quand mal plié deux pouvez inventer pareil vies antérieures peut très bien inventer histoire hurler mort expli- comme pest justement souffrance symbolisée l'interprétation symbolisée oui parlez symbolisation vie antérieure petit bébé sais connais très bien problème vies antérieures primal tout monde retrouve mêmes besoins primal peu sorte entonnoir milliers comportements milliers idées milliers symbolisations différentes fur mesure descend problème devient plus plus simple exemple donnais tout l'heure patiente disait début j'ai peur patron ose parler. puis devenu j'ai besoin aide quelqu fin disait maman aide-moi papa besoin tous primals descendent niveau plus simple besoin plus simple enfant plus moment grandes théories longues histoires juste enfant souffre dit besoin prends-moi bras aime-moi gentil très simple redescendent quand arrivent stade naissance plus paroles besoin très simple très primitif cette descente primal suit-elle toujours ordre chro- nologique ordre dépend-il intensité souffrance système nerveux stratifié fur mesure croissance abord niveau niveau pré-verbal niveau celui émotions niveau celui intellect passe niveau niveau pouis niveau pui témonte vers toujours ans cet ordre-là oui dre-là faut provo mai
20,21,selon ordre séquences lequel enregistrés aussi question intensité corps laisse accepter petit petit plus grande intensité souffrance commence donc petites choses qu'on peut intégrer toujours senti seul l'impression jamais aimé ressent petit bout petit petit fur mesure s'ouvre peut supporter plus intensité souffrance donc corps laisse remonter plus c'est sorte processus naturel absolument cela thérapie primale fait très attention jamais provoquer quoi jamais pousser gens suggérer jamais aide gens tout touchez-vous appuyezvous certaines parties corps favoriser remontée souffrance rarement faut patient dise thérapeute besoin prennes bras thérapeute jugera alors bonne chose non cela peut être très mauvais exemple empêcher personne ressentir besoin puisqu donne dont besoin donc thérapeute juge opportunité ... toujours demande patient exemple quelqu'un sent étouffer puis cela apaise thérapeute pourra-til intervenir mettant étouffer.… non non jamais vient intérieur suffit patient rougit rougit jusqu devenir bleu peut plus respirer france arthur janov ltd rero mère fume fœtus recevra plus oxygène nécessaire bien puisse dire souffre est-ce intervenez moment-là ... non corps fait automatiquement provoquons arrêtons circuit biologique faut laisser dérouler jusqu bout tout fait opposés intervention psychiatres très connus pratiquent rebirthing leonard orr londres très dangereux parce ordre biologique respecté faut plonger tout coup naissance certaines personnes besoin revivre naissance autres vaut mieux revivre visage larme beaucoup apprendre l'étude larmes car elles peu choses près mêmes composantes exemple psychotiques notamment alors prenez tout monde traitement non sélectionnons beautcoup gens devraient jamais faire primal demandons personnes remplir questionnaire médical psychologique effectuons examen médical examinons particulièrement capacité vitale poumons recherches viennent effet trer longévité dépendait cette capacité primal effet augmenter suite clair blocage cette libération peut donner lieu système sanguin hormis globules rouges entrepris étude biochimique larmes patients coopération willlam frey biochimiste département biochimie l'université st-paul minnesota frey analysé près chimie larmes découvert hormones stress hautes concentrations qu'on retrouve larmes causées irritation provoquée exemple l'épluchage oignons s'il effectivement décharge d'hormones stress larmes devient psychologie 147 mai 1982 accumulation hormones considérons pleurer fonction biologique importante fait répandre larmes essentiel non acsesseire résolution névrose guérison par\a parole n'existe fait pleurer aide soulager souffrance non seulement armes éllminent substances toxiques l'œil elles jouent également rôle précis l'élimination lstne miques nature toxique tout extrait prisonniers souffrance robert laffont 1982
21,22,—=— ohdye oloh4 rues gate deskherapie émmoti01 lasommetes
22,23,photo rapho l'evolution thérapies paimale claude allais thérapie primale méthode puissante permet atteindre niveaux conscience très profonds agit outil doit faire perdre vue but final développement global individu famille thérapies émotionnelles beaucoup développées états-unis partir années soixante issues travaux reich puis perls lowen thérapies rattachent lignée freudienne critiquent intellectualisme souvent excessif principe commun importance attachée vécu émotionnel thérapie toutes considèrent difficultés psychologiques essentiellement dues conflits inconscients ordre émotionnel voie plus rapide résoudre passe prise conscience émotions refoulées thérapie primale créée janov états-unis fin années soixante approche thérapeutique pousse plus loin l'application principes aussi méthodes plus connues public moins nom expression-cri primal devenue monnaie courante thérapie primale appartient psychologie 147 mai 1982 action rapide spectaculaire cherche comprendre raisons popularité aperçoit celles-ci regroupent autour trois facteurs principaux premier simplicité théorie proposée janov met évidence facteur essentiel névrose refoulement expériences douloureuses tient cette dimension essentielle sans perdre théories complexes deuxième raison succès thérapie primale surtout auprès grand public aspect concret familier descriptions janov chacun reconnaît récits émaillent livres touche doigt texture névrose alors freud décrivait façon peu lointaine malaise civilisation janov fait profondément sentir comment malaise progressivement ampli- fié cours enfance comment toute somme besoins insatisfaits aboutit névrose padulte dernier facteur responsable popularité thérapie primale action rapide spectaculaire alors nombreuses psychothérapies analyses débuts lents personne thérapie primale voit produire dès premiers mois transformations importantes vie quotidienne regain énergie plus grande sensibilité etc cela veut dire loin problèmes personne définitivement résolus peut sentir rapidement façon concrète tangible force cette thérapie dès début qualités entraînent nécessairement défauts correspondants simplicité plaît grand public peut heurter certains spécialistes voient simplisme dogmatisme puisse reconnaître facilement descriptions janov produit chez certains lecteurs adhésion aveugle nuit ultérieurement conduite thérapie depuis sept ans j'exerce analyse primale vois constamment personnes janov telle foi elles refusent voir propre évolüution tout correspond exactement janov
23,24,annoncé enfin vrai thérapie primale produit changements rapides cela veut dire janov reconnaît volontiers thérapie ensemble courte tout changement profond structures psychiques long revivre souffrance refoulée analysant causes névrose janov constate schéma revient constamment l'enfant moment besoins grands entre conflit environnement doit satisfaire insatisfaction besoin crée souffrance celle-ci trop intense être vécue pleinement intégrée conscience sauvegarder organisme trop-plein souffrance refoulé refoulement inscrit structure fois psychique biologique perpétuer souffrance niveau inconscient compenser cette souffrance inconsciente sujet élabore névrotique irréel dissocié réalité alors l'individu croit authenticité irréel celui-ci fait autres but déjouer souffrance latente inscrite organisme janov guérison troubles névrotiques peut produire agit base mécanisme guérir faut revivre souffrance refoulée tout autre solution partielle illusoire intransigeance vis-à-vis toute thérapie respecterait principe fait janov homme seul principe celui revécu souffrance refoulée ouvrages justifications illustra- tions principe unique cherche ailleurs car nécessaire élaborer théories plus complexes structures psychiques parti-pris janov con- centrer principe unique sou- levé certaines critiques particulier part spécialistes européens prenant peu recul aperçoit cette critique vient opposition entre deux approches thérapie d'un côté écoles américaines récentes défendent principe thérapie pragmatique tenants écoles l'essentiel dégager principe action permette effectuer thérapie efficace fois principe trouvé applique aussi systématiquement possible sans incorporer théorie plus complète ainsi pendant vingt dernières années cinq écoles américaines correspondant cinq grands principes thérapie comportements principe reconditionnement rogers l'écoute inconditionnelle perls prise conscience lowen travail corporel enfin janov revécu souffrance refoulée chacun cas tant détail théorie compte l'application systématique principe travail efficace autre côté trouvons européens freud jung tous fondateurs écoles psychanalytiques européennes jusqu lacan cherchent contraire développer systèmes théoriques globaux systèmes américains axés seul principe semblent excessivement simplistes déjà querelle manifestée entre freud adler loin être antagonistes deux approches semblent complémentaires chacune leurs avantages leurs inconvénients avant mieux définir champ action limites thérapie primale utile décrire sommairement structure psychisme humain entre naissance âge adulte être humain passe série stades chacun laissant trace psychisme individu peut façon imagée représenter celui-ci comme bâtiment plu- sieurs étages conscience corres- pond étage vit étages dessous dessus représentent deux aspects inconscient inconscient dessous lincons- cient freudien ensemble structures psychiques passées refou- lées est-à-dire non intégrées structure consciente présente étapes dessus selon ken wilber école cognitive américaine stades développement psychique venir autre inconscient représentant ensemble états conscience plus élevés encore état potentiel parmi étages psychisme retrouve stades classiques psychanalyse stade oral anal phal- dessous remiers états infantiles thérapie primale peus bien étudier étages occupés stades per sonnels correspondent supérieurs conscience sens rares personnes étudiés psychothérapen l'exception quelques analy existentiels jungiens transformation besoins comprendre nature thérapie faut voir chaque stade besoin métamorphose prend forme différente besoin sécurité exemple manifestera chez nourrisson demande être bercé mère plus tard âge ans pourra être simplement demande être proximité mère âge ans fait être reconnu maîtresse école âge adulte cela deviendra besoin vivre couple être reconnu profession atteint niveaux développement transpersonnels besoin sécurité traduira recherche nou- velle jdentité intérieure non plus sociale reprend métaphore psychisme considéré comme série étages peut comparer besoin essentiel comme besoin sécurité ensemble forme différente chaque étage base pilier solide ensemble risque écrouler tient toires faut desc lique génita placent quelle théra choisir its position appropriée donné évolutio
