,page,text
0,1,mai1982 pen faculté sclénces sociales politiques bibliothèque boum entretien dar cas t//p net art dat actes crete fan ele ven tee niaies nes luse atata site 1eue dés antl fes nate pause fig mere line dde lit raa ean slt primal l:48 tri bcu lausanne tlttu mnt bis jus
1,2,opera mundi king features perte souvenirs d'enfance page 18.déc.1966 lausane souviens adultes oubliaient aussi quand j'avais qubliaient enfants âge ... temps passe croient tout plus lentement qu'on dit let pire tout /ls oubliaient nosai notr alent présence d'enfanc vec souvenirs farlaient wous comprendre comme n'étions fas devenun l'adulté j'aidétestée
2,3,vie est-souffrance cette souffrance possible libérer deux mille cinq cents ans après bouddha continue discuter nature cette souffrance moyens libérer arthur janoy découvreur cri primal dont publions l'interview l'existence souffrance évidente manifeste maladies troubles mentaux cause besoins non satisfaits refoulés sommaire 147 mai 1982 calendrier psycho-actualités dossier mois primal souffrance revécue entretien arthur janov daniel roumanoff l'évolution thérapie primale outil manier discernement claude allais sept mille visages ekman visages parlent langage universel daniel goleman .la nationalité.des corps nourrisson enfi ant moyen gestes expriment culture olivier gillissen libérer revivré adolescéncé déficients mentaux profonds primal émotions oubliées dire choses comme élles stanislaw tomkiewicz cet oubli'se trouve confirmé rêveur immobile perte souvenirs fance pourquoi muscles bougent michael chase choisir profession comment prendre décisions rationnelles irving janis dan wheeler dont parle daniel goleman ... certaines personnes conscience de.souffrir souvenirs d'enfance empêche souffrance être pourquoi noûs oublions daniel goleman présente howard leventhal \55 idées fausses maladies étudie lés idées fausses tout bien portant est-il malade ignore faisons maladie lee rar pouvons sentir très bien cinéma georgia laurent samuel cepéndant réalité être malades machines cslculent plu vite hommes après examens cliniques evan harris walker côté ekman montre caractère universel émotions-par l'étude visages milliers personnes civilisations différentes enfin claude allais présente développements actuels thérapie primale yeux celle-ci devrait seulement libérer personne ses-émotions cachées pièges propre histoire aussi explorer dimension transpersonnelle d.r librairie petites annonces courrier 149 abonner offrir psychologie amis couverture l'enfant peinture tudor mironesco entretien arthur l'adolescenc janov primal reveur ent deficients mentaux immobile hologie 147 mai 198
3,4,calendrier conférences pensées positives négatives mercredi mai centre revivre rue petits-hôtels 75010 paris psychiatrie spiritualité rafacl estrada villa lundi 17maià21h éveil rue saint-ferdinand 75017 paris suggestion relaxation psychologique bois lagedamont vézinet lundi mai 30. aspirale barbès esc étage 7501 paris créativité selon carl rogers pierre cattelin mardi mai 20h centre psychosomatique vwiener 123 1170 bruxelles belgique astrologie utile neuro-psychiatrie solange mailly-nesles mardi juin 20h domus médica latour maubourg 75007 paris congrès itinéraires nouvel âge réseaux actions spiritualité médecines douces développement personnel samedi dimanche mai domaine baume près aix-en-province contact aquarius rue mal.-joffre 13100 aix-en-provence rencontre internationale méthodes santé traditionnelles mai juin alpbach autriche renseignements forum international p.o box 2841 7000 stuttgart tél 0711 24.80.28. congrès l'association européenne psychologie psyke paris 1982 mensuel diffusion n.m.p.p daniel roumanoff claude allais appia blanchet françoise bouchet jean-jacques berreby eric edelman olivier-gillissen daniel goleman pierre chapelot irving janis howard-leventhal georges nizard rédaction tudor mironesco puig-rosado gabriel racle conseiller artistique articles îllustrations suivantes publiés l'accord psychology-today publication and tm-of ziff-davis publishing company park avenue n.-y 10016 new york usa psychologie traductions françaises l'équipe revue psychologie peut étre-tenue responsable dés manuscrits documents envoyés communiqués titres sous-titres intertitres psychologie établis rédaction imprimerie s.i.e.p zone d'activités marchais 77590 bois-c-roi imprimé france photogravure cachan dépôt légal mai 1982 numéro d'imprimeur 181 r.c 321 986 093. commission paritâire n°54 512. issn 0032-1583. directeur publication participé numéro conseillers rédaction christian broutin michael chase danielle daniel roumanoff stanislaw tomkiewicz evan harris walker colette roumanoff dan wheeler laurent samuel cédric philibert didier chapelot mois précédent informations destinées calendrier doivent parvenir avant aniste paris aude beaulieu rue tél 271.87.62. jal psychiatrie sociale au9 juillet .m.v. verbizier b.p 246 92205 neuilly-sur-seine psychologie hum turenne 75003 paris congrès mond ateliers séminaires las introduction psychosynthèse mai santor stadecoubertin 92100 boulogne connaissance conduite hommes mai cnof rue cassette 75006 paris tél 544.38.80. thérapie hypnose philippe forum rue châtillon 75014 paris rens association française psychologie humaniste rue dalou 75015 paris tél 306.80.44. l'approche centrée personne 7au9 mai rens georges adamcezewski rue moscou 75008 paris. créathérapie mai gysa jaoui montparnasse 75006 paris sophrologie 8-9 mai degré institut supérieur psychologie rue lilas 93100 montreuil tél 858.30.35. bioénergie relationnelle partir mai facettes grande-rue 91530 blancheface maîtrise gestion .du temps pierre nicolas mai juin rue fernand-pelloutier 92100 boulogne lire mains science superstition mai rens jean-claude guillemain girod mai psychologie publié psyke editions rue'de choiseul 75002 paris tél 260.95.00. école graphologie morphopsychologie tél 872.96.64. programmation ñeuro-linguistique larry goldfarb mai rens figuière rue vienne 75008 paris sensitive gestalt massage mai rens éole 80. tél 970:60.39. initiation manupuncture 15. mai rens lierre coudrier rue la-fontaine-au-roiï 75011 paris week-ends développement pérsonñel 15-16 mai 12-13 juin cvenraets rens ins goarant 182 rue fg-st sophrologié 20. mai 1er degrés institut supérieur psychologie rue eilas 93100 montreuil stage résidentiel 20-23 mai jérôme liss rens centre développement du° potentiel humain rue tarenne :75003 paris door atelier bonheur 22-23 mai isabel fil- liozat rue michel-le-comte 75003 paris clinique thérapies mai rens ins association recherche psychothérapie rue buffon 75005.paris interview et.entrétien 26-28 mai association recherclie l'intervention psyÿchosociologiques bis rue bachaumont 75002 paris tél 236.40.56 vers llumination 28-31 mai jacques .de panafieu rue fossés-st bernard 75005 paris. tél 633.72.16 province utilisations praüques de-læ graphologie ler mai rennes réns institut frangais culture humaine paris 874.43.60. communauté thérapeutique ler mai salles angles près de-côgnac stacke korenfeld. rens eveil rue st-ferdinand 75017 paris développement personnel orthologie mai limousin rens ass edo bonnac-la-côte 87270 couzeix. anglais suggestopédagogie mai c.lr.a.s avenue prado 13006 marseille tél 37.17.01. thérapeutes gestaltistes mai jacques j.-m. delacroix institut gestalt grenoble delacroix rue r.-rolland 38400 st-martind hères tél 24.24.69 formation gordon 7-9 mai marseille rens centre persona prado 13006 marseille tél 37.17.01. suite page
4,5,suffit renvoyer bulletin ci-dessous direction diagnostics centre sésame rue rouvet 75019 paris accompagné d'un spécir men écriture simple participation frais recevoir confidentiellement remarquable étude comprenant comment autres voient schéma couleurs fonctionnement personnalité indique principales tendances apparentes cachées premier lieu l'image peut surprendre autres font caractéristiques fond tableau descriptif repère précise clairement caractéristiques positives nëgatives définissent.le mieux plans l'intelligence affectivité contacts action peut changer plus annotations dela main graphanalyste conclusions pratiques répondent questions.et soulignent tout peut accélérer contraire freiner épanouissement réussite l'étude spéciale propose ici centre sésame n'est donc simple test rarement fond choses analyse fleuve l'essentiel souvent noyé fait vé= gitable check-up psychologique sous forme très claire donneun maximum d'informations directement utiles à-votre évolution personnelle trois raisons bien-simples expliquent l'étonnante efficacité'de nouveau type'd'analyse système visualisation adopté.éclaire mieux pérsonnalité'et participe découverte découvérte chacun sait voie royale pour.libérer nombreuses forces chasser cértaines angoisses s'engager meilleures voies technique d'examen utilisée supprime entin vous-même enmment lon sostmeileurestehances plus importants centres français .de graphologie appliquée propose bilan complet visualisé voire personnalité chaque diagnostic entièrement établi pation frais solde 210f n'étañt régla- turn inconvénients nombreux tesis appuiesur consultation spéciale formule nouvelle l'étude scientifique l'écriture est-à-dire conclusions développées conditions tout l'une meilleures méthodes psychologie fait exceptionnelles tel examen honomoderne raîres 280 seulement lesquels n'adressez demande f-pour particispécialiste doit rien ordinateur deplus ble qu'après réception l'étude tous dossiers contrôlés paï fieschi gra satisfait sinon renvoyez celle-ci phanalyste diplômée dont l'expérience porte jours devrez plus rien. plusieurs milliers d'examens professionnels'et pri- vés parce chaque cas traité pue cent etablir grand soin parce-qu une.teile consultation doit trois raisons donc faire établir propre bilan être placée sous signe nfance qu'une elvisualisé vôtre celui d'un tiers car bien pou condo mieux connaître autre ersonne suffit suffit utiliser bulletin spécial ci-dessous. celà voussoyez légitime propriétaire l'un écrits exemple lettre'qui destinée éonsidériez résultats l'étude commè strictement confidentiels s'agisse propre kbilan cejui d'une personne proche a-pour raison saisir l'occasion estofferteaujourd hui effet centre sésame propose cette attendez conditions actuelles peuvent être garanties courte période chaque diagnostic établi contrôlé fieschi pérsonnèllement seul nombre limité dossiers peut être traité délai normal. pme enree bulletin consultation confidentielle donnant droit bilan complet visualisé personnalité personnalité d'un tiers plus ans bilan conclusions développées établi centre sésame pourdes honoraires 280 seulement lesquels adtessez bulletin participation frais solde 210 réglable jours réception l'étude sauf ren- voyez celle-ci dans'le délai pour.non satisfaction auquel cas vous-ne devrez plus rien ci-jointun-spécimen c'mon écriture.o l'écriture d'un tiërs document dont joindre bulletin ou.les spécimens l'écriture analyser préférence lettre courante signature défaut .un plusieurs autres docu- déclare avoir libre disposition scripteur sexe masculin féminin age .......... niveau d'instruction primaire secondaire csupérieur technique situation famille célibataire marié nbre d'enfants profession activité principale ...... tessssessessessesrererree vo. demande cette étude lebutde:0 mieux connaître mieux connatlre ticrs micux résoudre problème particulier ci-joint lettre explicative faire unc cxpérience m'informer études documentation générale m'adresser sans engagement bien enténdu cette demande conclusions considérée part d'autre comme strictement confidentielles ments exemple dizaine lignes recopiées texte ci-dessus plus signature participation chèque mandat l'ordre centre sésame urgence particulière etranger avion ajouter frais supplémentaires pers eeeeeeet eee eeseeeee prénoms .......... mere sessrsese ... ruc lieu-dit.… date ersigrauure enssssses eteseerere eussspesessss ... indispensable code postal ville ........ desesaqremeessss adresser d'urgence sous pli fermé entre sésame direction diagnostics rue rouvet 75019 paris nes sos
5,6,ecole graphologie morpho-psychologie 7-71 enseignement privé distance lol 7-71 soumis contrôle pédagogique etat cours correspondance corrigés stages conférences préparation profession graphologue morphopsychologue convention formation continue cours stages graphologie morpho-psychologie psychologie générale psychanalyse chirologie scientifique test l'arbre sélection personnel documentation gratuite demande renseignements inscription écrire téléphoner jean-claude guillemain allée alma 94170 perreux tél 872.96.64 eormation auxstechniques rpsychoz corporelles eveil organise trois cycles distincts formation formation thérapeutes analyse reichienne gestalt intégration posturale rebirth mouvement/relaxation tai chi chuan yoga danse relaxations méditation massages shiatsu californien réflexes suédois toutes formations comprennent enseignement théorique pratique anatomie physiologie psychologie éveil 574.21.57 rue saint ferdinand 75017.paris association loi 1901 convention formation 117503264765 paycro-actualites mignonnes grosse connectieut vient vérifier qu'une thomas alley sbés déclenchant l'amour l'affecinci éristiques physiques eon dues envers état forme tête 1948 l'éthologiste kon déjà suggéré d'un dinateur alley dessine vingt tétes pébé différant leurs formes mêmes yeux nez oreilles pou et. montrées sujets demandant désigner.les bébés plus ianons 72.8 d'entre désignèrent têtes forme saillante secon expérience selon principe dessin base différent confirma résultat ère nouvelle mélancolie mot déprime maintenant entré langage courant désigne plupart temps certaine morosité cette perturbation l'humeur commune plus souvent passagere revanche dépression plus grave caractérise souffrance morale l'inhibition l'anxiété peut simplifiant distinguer deux formes dépressions dépressions réactionnelles névrotiques dépressions endogènss l'on appelle aussi mélancolie plus dangereuses parce qu'elles peuvent conduire suicide d'une façon générale dépression augmentation chiffre ventes médicaments calmer l'angoisse d'ailleurs significatif france vend chaque année million boîtes d'antidépresseurs quaire millions boîtes tranquillisants chiffres reflètent mal civilisation alarmait récemment président un-congrès chicago consacré troubles l'affectivité l'émotion l'humeur semble bien a-t-il déclaré assistions l'avènement nouvelle ère mélancolie semblable celle connut moyen age plus curieux dépression touche seulement comme tendance croire occidentaux obsédés bonheur national brut aussi populations pays voie développement monde huit mille tonnes tranquillisants consommés tous lés ans deux trraneumams
6,7,psycho-actualites l'effet hawthorne démenti faits gens isolés expérience améliorent leurs performances productivité raison l'attention qu'on porte non cause conditions l'expérience ainsi peuton énoncer l'effet hawthorne bien connu outre-atlantique depuis années trente tient nom l'usine western electric hawthorne près chicago menées 1924 1932 études productivité travailleurs fonction conditions travail cette théorie vient d'être remise cause dana bramel ronald friend deux chercheurs l'université new-york selon l'expérience principale retenue comme preuve l'effet hawthorne menée façon sérieuse portait productivité d'un groupe d'ouvrières selon l'intensité lumineuse atelier durant toute l'expérience cette productivité augmenta quel l'éclaifage bramel friend affirment fondant sur-leur rencontre ans plus tard cinq seulement ouvrières groupe deux d'entre elles remplacées cours route parce trop lentes assez coopératives ailleurs elles partagaient prime attribuée globalement fonction productivité manipulations enlèvent toute valeur scientifique l'expérience bramel friend s'interrogent l'étonnant succès cette théorie etats-unis attribuent fait psychologues d'entreprise leurs patrons l'ont interprété ainsi possible d'accroître productivité travailleurs simplement s'intéressant sans améliorer conditions travail salaires l'attention portée autrui élément important relations humaines toute l'erreur d'en faire facteur d'explication global exclusif ——————— ——violence fiabilité témoignages plus scène violente moins témoins garderont souvenir précis montre l'étude récente deux psychologues londoniens -brian clifford clive hollin lis présenté soixante étudiants deux sexes scènes filmées cours desquelles homme aborde femme tantôt l'agresser violemment tantôt lui.-demander chemin témoins reconnurent parmi plusieurs photographies protagoniste scène non violente seulement reconnurent l'agresseur maigre confiance accordable témoignages oculaires général bien connue notamment magistrats beaucoup croient fiabilité d'un témoignage augmente violence scène observée c'est contraire vrai pièges sentiment d'obligation t'as fränc répondez oui mendiant rue prenez garde risque d'en profiter extorquer double phénomène vient d'être vérifié deux psychologues américains jerry burger'de l'université wake forest caroline'du nord richard petty l'université missouri ges chercheurs demandé étudiants faire travail échange poiñts supplémentaires leurs examens quand personne formulé proposition annonça elle-même suppression récompense partie groupe plupart étudiants choisirent continuer faire quand travail rapportait plus rien prévenus tierce personne autres étudiants décidèrent d'arrêter frais explication psychologues présence interlocuteur semble créer chez plupart gens impression d'obligätion guérison imite parle beaucoup d'une récente découverte permettrait guérir radicalement timidité d'aprèsw.r.borg latimidité maladie morale maladie physique prenez dit-il timide empêchez-le trembler rougir perdre attitude naturelle prendre attitude ridicule montrez-lui comment.il peut éviter manifestations physiques émotion l'aurez guéri mal jamais plus troublera passer examen déclarer amour jeune fille nimême s'il doit jour parler public seul mérite d'avoir découvert moyen permet chacun instantanément sans etfort maîtriser réflexes semble bien effet w.r.borg trouvé remède définitif timidité j'ai révélé méthode plusieurs amis l'un d'eux avocat point renoncer carrière tant sentait bouleversé chaque fois qu'il devait prendre parole prêtre malgré vaste intelligence pouvait décider monter chaire tous stupéfaits résultats qu'ils obtinrent étudiant échoué plusieurs fois l'oral baccalauréat étonna professeurs dernière session passant examen brio étourdissant employé osait peine regarder directeur sentit soudain l'audace soumettre idée intéressante vit doubler appointements représentant hésitait cinq bonnes minutes devant porte clients avant d'entrer devenu vendeur plein cran etirrésistible sans doute désirez-vous acquérir aussi cette maîtrise vous-même cette audace bon aloi précieuses gagner dures batailles vie peux court article exposer détail méthode borg j'ai décidé auteur diffuser auprès lecteurs priez borg envoyer intéressant ouvrage documentaire lois éternelles succès l'adressera gratuitement voici adresse borg dpt 935 chez aubanel place st-pierre 84028 avignon cedex castro methode borg bon gratuit remplir lettres majuscules donnant adresse permanente retourner borg dpt 935 chez aubanel place st-plerre 84028 avignon cedex recevoir sans engagement part sous pli fermé lois eternelles succès nom prénam code postal ville age profession ————————— rue auc isite démarcheur rendra visite
7,8,savoir exprimer moyen plus sûr celui celle désire faire écouter s'imposer var circonstances vie sociale priv milieux professionnels affaires amitiés tions rapports familiaux affectifs n'être écouté déprime paralyse dessert personnalité arrive certainement dire après entretien n'est ainsi j'aurais aborder conversation faire comprendre pourtant conversation science règles clés acquiert analysant chez grâce cours technique conversation différents problèmes soulevés rapports humains gagnerez quelques mois force persuasion surprendra vous-même cours correspondance traite manière pratique détaillée tous aspects conversation psychologie conversation technique élocution pratique contacts humains susciter l'intérêt sympathie l'estime animer diriger conversation langage affaires correspondance privée affaires etc demain saurez utiliser toutes ressources parole disposerez meilleurs atouts ceux personne sait parler facilement efficacement documentation gratuite 950 simple demande ct.c rue collange paris-levallois ants centre d'étude techniques hypnose recherche 500 personnes voudraient libérer timidité parle beaucoup nouvelle méthode basée auto-hypnose permettrait débarrasser définitivement toute appréhension face autres actuellement c.e.t.h centre étude techniques l'hyp- nose distribue gratuitement ceux font demande dessin hypnotique ainsi livret explicatif cette étonnante méthode écrire c.e.th. rue grande 27760 ferrière risle dossier spécial réservé psychologues médecins suffit recevoir écrire papier en-tête psycho-actualites après divorce ture vivent mieux mari helen newman l'univers questionnaire portait leu possible femmes l'aient aussi temps mar femmes divorcées acceptation sait quelle cause niser vie est-ce réciproque vraie 'la'clef îde déprime certains médicaments dépresseurs comme l'imipramine exercent action analogue celle substance naturelle non encore isolée arrive identifier cette substance possible remédier causes dépression mettant point thérapeutiques nouvelles travaux cette question équipe française langer centre synthélabo reçu récemment prix fondation allemande anna monika attribué tous deux ans recher- che originale dépression selon autre étude réalisée celle-là drs zarifian sechter clinique psychiatrique sainte-anne paris liaison l'imipramine plaquet- sanguines perturbée chez tous déprimés compris ceux atteints psychose maniato-dépressive tradi- tionnellement classés part france zarifian conclut qu'il vaut donc mieux classer dépressions fonc- tion gravité comme font américains toujours domaine l'équipe montigny l'hôpital lafontaine montréal canada mis point traitement évite recours électro-chocs malades résistants anti- divorce bonheur pres reconnaissent avoir joué rôle rupe celles rejettent lle har- ité -york ellen langer rat errogeant femmes divorcées depuis vard ciasses moyennes modestes new-york ans âgées appréciation subjective d'optimisme bonheur jabilité niveau d'activité sociabilité sos plus heureuses actives après divorce iage avant lien entre bonheur partage torts établi l'est l'effet peut proposer l'interprétation suivante mésentente implique définition torts partagés jen contac s'en rendent compte davantag donc plus facilité aménager vie celles impression toute responsabilité mauvaise relation vient conjoint sentent gene ral responsables arrive attendent autres résolven problème place elles donc bonne position réorga l'étude aussi montré femmes plus actives heureuses celles s'entendent mieux ex-mari encore ceci.-explique t-il cela anti- utes responsabilités exdépresseurs suffit d'associer lithium ariti-dépresseurs alors bien tolérés efficaces l'action lithium s'explique peut-être modification perméabilité meñbrane cellules différents travaux mettent évi- dence rôlé membranes cellulai- res genèse dépressions ner- veuses recherches plus approfondies -nécessaires comprendre pleinement mécanis- cela n'empêche chimio- thérapies d'être plus -en plus effica- puisque anti-dépresseurs per- mettraient guérison cas taux réussite dont nom- pteux médicaments éprouvés oin
