,page,text
0,1,"je F + MENSUEL + JUIN 85 e 023 !: 
IL nn ane eee me come ne emme à 
” . ° L ‘ l TT l CNT ré à j ‘ 
À s L ; 
À Î 
; l / 
M 2978» 23e 18 F BELGIQUE 139 FB + SUISSE 7,50 FS CANADA 64 » ISSN 0032 1583 « UNE PUBLICATION LOFT » 
À DA : 
LL AT ee"
1,2,"Profovuslon : 
poychologue 
En falsant adopter ce mols-ct par 
la Parlement une lol (article 7 do 
lo loi n° 26-61} protégeant le 
tro da psychologue, le gouvor 
nement va parmattra enfin aux 
usagars do S'y reconnaitre dans 
le maquis dos psys, Par cotte lol 
{1}, seules pourront être autorl 
S00S à port le titra do psycho: 
logue, les parsonnos qui auront 
eu une formation profassion- 
nelle et scientifique sanctionnéo 
par un diplômo univorsitairo do 
haut niveau, L'usurpation do 
titre sera sanctionnable, ot par 
décrot en Consoll d'état il sara 
prévu la listo des diplômes don- 
nant droit à porter lo titre ot los 
modalités de roconnalssance do 
ceux-ci (notamment pour los 
équivalences dos diplômes 
étrangers), 
Tous caux qui, occasionnollo- 
ment ou régulièrement, ont 
recours aux sorvices dos 
psychologues doivent se réjouir 
d'une telle loi : il y a, en France, 
beaucoup de charlatans {2} qui 
s'affublent du nom de psycho- 
logue sans en avoir la compé- 
tence, et il y a, par ailleurs, une 
diversité trop grande des 
niveaux et des formations de 
certaines branches de la psycho- 
Communiqué 
Clare Synodinou intormewdo dans 
Psychologies n° 22 est l'autour do 
«Autisme mfantle, approche théra- 
peutique », Editions Aubior. 
Autisme 
infantile 
Ayant thraettaque logle {la formation dos payoho 
logues scolalras par exomplo ant 
trop courte}, La lol va contraln- 
dro dans los annéos à vonir, par 
la forco dos chosen, los unlvor- 
sltés à homogänblser las forma 
tons, à réguler lo flux d'ôtu 
dlants, à so posor la question do 
la Hinallté profosslonnallo ot dos 
débouchés, À tormo, ot quello 
qua soit la spéclalité on psycho: 
loglo {la lol préclso, on offot, 
qu'elle s'applique au tro do 
2 ANTE sulvi où non d'un 
adjectif}, los psychologuos 
soront mioux formés, Et tous 
coux qui, dos gourous aux 
psychiatres, on passant par tou- 
tos sortos do profossions para- 
médicales jouont sur l'ambiguïté 
{« J'ai uno formation onpsycho- 
loglo », « Tout lo mondo ost un 
pou psychologue »} soront obll. 
gôs de changor do rogistro, Lo 
public doit ôtro informÿ ot com- 
prondro qu'avoir do la psycho- 
logie at Ôtro psychologuo co 
n'ost pas la même choso. 
En tant quo disclplino, la 
psychologie ost utilo à tous los 
domaines do la vie soclalo, dès 
lors qu'il est question.des rola- 
tions entro les porsonnos, do:ln 
porsonne ella-même dans ses 
comportemants [conscionts ou 
non), sociaux, famillaux ouiintl- 
mes, La psychologio n'appar- 
tiont, en tant que sclonco, d:por- 
sonne et los psychologuos ne 
demandent pas de monopole 
. d'exercico. Mais, les psycholo- 
gues affirment que seuls Ils sont 
compétents, parce que formés, 
pour mettre en pratiquo avec 
toute la prudence nécossaire, les 
- techniques de la psychologie. 
Cr la psychologie n'est pas 
neutre, et ses pratiques non 
plus, et il est nécessaire, pour 
l'intérêt des personnes qui ont 
recours aux psychologues, que 
ceux-ci maîtrisent correctemont 
les conséquences de leurs 
actes. Qui ne sait les ravages 
causés par une mauvalse orion- 
tation à l'école, par la non détec- 
ton d'un trouble sensoriel, par 
la mauvaise adaptation à un 
poste de travail? Qui ne se 
doute que le climat d'une entre- 
prise dépend de la qualité des JRUM NDESIPSYCH 
communtontlong, du one 
{parfola oachô}-dorpriea do décl- 
alon, ota, ? Qui n'a pag un Jour 
aubl désagréablomont log mau- 
valaos conditions pryooul 
quoa do aolna à l'hôpital, alors 
quala médocino ranguino oat ln 
molllauro dumondo ? Pour tout 
cola los poyahologuos ont dos 
répongos à apportor, 
Rosto à régoudro la:quogtion do 
l'éthiquo profosslonnollo, très 
importante pour ln protaction du 
publie : co quo lo psychologuo 
ost amoné à comprondre du 
fonetionnomont-:paychologiquo 
d'unoporsonna ou:d'un:groupo 
do-porsonnos, no dolt pas pou- 
voir Gtro utillsé contro cos por- 
sonnas, Lo psychologuo doit 
Ôtro obligé à.uno démardho pru- 
donto, duno formation oxigonto 
continuo, pour Ôtro ofclont 
dans saprofossion, Cos règlos, 
quo nous nous sommos fIx60s 
ontra nous, nous souhaitons 
qu'ollos dovionnont légalos, car 
l'intimité psychologiquo dos por- 
sonnos on toutos situations et lo 
raspoct absolu do leur autono- 
mie sont lo fondement do nos 
pratiquos. 
Dès diprésant faco à uno profes- 
slonreconnue, légalisée, j'invite 
lo public à so montrer oxigoant 
tant sur le socrot professionnel, 
quo sur la qualité des interven- 
tions des psychologues. Los 
psychologues, ce ne sont pas 
des inquisiteurs-testeurs ou des 
mages... ce sont dos profession 
nels qui peuvent expliquer leurs 
pratiques, énoncer leurs mêtho- 
des, répondre sans ambiguïté 
aux demandes qui leurs sont 
faites, J.-L, Viaux, 
socrétairo général du 
Syndicat national des 
psychologues 
1} Quo dos décrots d'application 
n'ont pas oncoro ontôriné, 
{2} À co sujot Il faut mottra on gardo 
le public contra cortainos publico- 
tlons, qui.n'étant pas faitos par dos 
organisations profosslonnollos com- 
portent dos noms do psychologuos 
qui no sont ni diplômés, nl qualifiés. 
nl psychologuos, 
* Los 8° Assisos notlonalos dos 
psychologuos auront liou los 21, 22 
ot 23 juin à Morsolllo au Palals dos 
Congrès, Los poydhologues 
ot la société 
Enavntpronre du Forum lo 
la paycho og qui 80 tlondra à 
Cannos log 19-ot 20 Juin 86 (14, . 
lo Journal dos psychologuos 
proposa récommont dans los 
ooaux lo da FNAC uno Intor- 
vontion-débat sur lo thèmo : Los 
paychologuos ot ln soclôté.: 
Goucl dog organisatours : axpll- 
quor ot promouvoir auprès du 
publie lo rôlo du psychologue 
dans la soolôté actuollo, C'ost 
ainsl quo la Fédération dos 
psychologuos, par oxomplo, 50 
proposo pour l'anno à vonir de 
plancher sur lo thèmo dos impll-"" 
cations psychologiquos du chô- 
mago, ot-quo los psychologues . 
prôgonts ont pu évoquer comme 
faisant partio do leur champ do : 
réfloxion ot d'action : les:bôbés 
éprouvottos, le divorco, les gar-. 
dos d'onfants, la crise, etc, Ce: 
travail no sera possible, cola va, 
sans dire, que s'll est étayé 
d'une réflexion portant sur 
l'imago que la société a de ces 
môêmos psychologues — ot, 
parallèlement, sur celle que les : 
psychologues eux-MÊMES VOU- 
ont faire passer, Sur ce dernier: 
point, la tendance 85 est à la 
réassurance : fini le temps où: 
l'on rovendiquait unrôle subver- 
sif, dérangeant, d'empêcheur de 
tourner en rond, Le nouveau: 
psychologue (crise oblige ?). 
s'efforce plutôt de mettre de 
T'hulle dans les rouages, se vou- 
lant avant tout homme de dia- 
loguo, de confiance. Une image 
de marque qu'il aura bien du mal 
à faire passer, si l'on en juge 
d'après les réactions du public 
présent ce jour-là dans le: 
locaux de la FNAC, etd'oùilros 
sortait principalement que !: ! 
psychologue : soit on ne Sn : 
pas très bien ce que c'est ni » 
quol il sert, En pointant los eff: "" 
des changements qu'ils sus { 
tent, les psychologues prentu ‘: ! 
désormais des problèmes à bre. : 
le corps, Une affaire à suivre. 
Marianne Gomez, Paris 
{1} Au palais dos fostivals, suivi 
Jusqu'au 23 de trois Journées 
profossionnallos,"
2,3,"Géant Diuctour do In pubticotion 
Bornard Loïsoou 
REDACTION 
Rédactrics on chof 
Michèle Costn-Hngna 
Socrétolro générel do In rédaction 
Gaorgos Gi 
Bocrétalras do rédacilon 
Fronçoiso Morckhng ot Ston Lanson 
Diroctour artistique 
fuhppo Canviio 
Moquattistos 
Jacky Gelon ot Louront Chuenor 
Révision 
over Alious 
ADMINISTRATION 
Administrotour général 
Michel Landoschi 
Socrétoiro générnl 
Agnbs Loiseau 
Sorvicos odministrotife 
Dominique Avanzo, Réjine Huyard, Micheline 
Lecornec, Chaishng Léon, Yvelto Lombard, Andrég 
lAigcot 
Promotlon rolotions axtérlouros 
HMagol Hoél 
PUBLICITE 
LOFT-REGIE 
1, sue Lord Byron, 76008 Paris 
TA. : 225.65.20 
Directeur do la publicité 
Pierre Delsau 
Chof do publicité 
Chsaboth Werenne 
ABONNEMENTS 
Pour toutes quesuons relatives aux abonnçmnents 
ou à leur réglsrnent, adie5227-v0u5 à 
Psychologlos 
1, suc Lod-Byron, 75008 Paris 
T4, : 225.65.20 
VENTES 
NMPP-RASSORTS 
1, cus Lord Byron, 75008 Paris 
Tél. : 229.65.20 
Code ordnoteur : C26 
ES 
COMPOSITION 
Compotour : 71-78, rug Decnoucitss 
76015 Paris 
Photogravure couleur R.P.I4. Clichy 
IMPRIMERIE 
lnpamerie Joan Didier 
91200 HMo25y 
RS 
Dépt légal 
Humnéro imprneur 607 
Commission pastgire n° 54812 
1501 0042-1683 
DIFFUSION HIAPP 
IAENISUEL 
18 F tdont TVA à Le) 
Tr 
fous los urticlos sont ls propdété do Psychologios. 
Tous drots do raproduction © Psychologies Les étonnantes possibilités 
de la mémoire J'étais loin de me douter, en arri- 
vant chez non ami W,R, Borg, que j'al- 
las Gtre Ie témoin d'un apectacie vrai- 
ment extraordinaire et décupler ma 
puissance mentale. 
JT m'avait fail venir à Stockholm 
pour parler aux Suédois de Pasieur et 
de nos grands savants français et, le 
soir de mon arrivée, après Je cham- 
pagne, Ja conversation roula naturclle- 
ment sur les difficultés de Ja parole en 
public, sur le grand travail que nous 
impose à nous autres conférenciers la 
nécessité de savoir À la perfection le 
mot à mot de nos discours, 
W.R. Borg me dit alors qu’il avait 
probablement le moyen de m’étonner, 
moi qui lui avais connu lorsque nous 
faisions ensemble notre droit à Paris, 
Ja plus déplorable mémoire. 
Ï1 recula jusqu’au fond de la salle à 
manger ct me pria d'écrire cent nom- 
bres de trois chiffres, ceux que je vou- 
drais, en Jes épelant à haute voix. Lors- 
que j'eus ainsi rempli de haut en bas la 
marge d’un vieux journal, W.R. Borg 
me récita ces cent nombres dans 
l’ordre dans lequel je les avais écrits, 
puis en sens contraire, c’est-à-dire en 
commençant par les derniers. JI me 
Jaÿssa aussi l’interroger sur la position 
respective de ces différents nombres: 
je lui demandais par exemple quel 
était Je 24°, Je 72°, le 38°, et je le vis 
répondre à toutes mes questions sans 
hésitation, sans effort, instantané- 
ment, comme si les chiffres que j'avais 
écrits sur le papier étaient aussi inscrits 
dans son cerveau, . 
Je demeurai stupéfait par un pareil 
tour de force et je cherchai vainement 
Partifice qui avait permis de le réaliser. 
Mon ami me dit alors : “Ce que tu as 
vu et qui te semble extraordinaire est 
en réalité fort simple : tout le monde 
France, pour recevoir sans engagement de 
du Succès”, 
N° —— 
Profession AGE BON GRATUIT 
A remplir en lettres majuscules en donnant volre adresse permanente et à relourner à: 
y 4 banel, dpt 638 — 6, place Salnt-Plerre, 
Mode RE men votre part et sous pli fermé “ Les Lois Eternelles 
Code postal Gi ————— 
Aucun démarcheur ne Vous rendra visite possède assez de mémoire pour en 
aire autant, mais rares sont Jes person- 
nes qui savent se servir de cette mer- 
veilleuse faculté”, 
I! m’indiqua alors le moyen d’ac- 
complir Ie même tour de force et jy 
parvins aussitôt, sans erreur, sans 
effort, comme vous y parviendrez 
vous-même demain, 
Mais je ne me bornai pas à ces expé- 
ricnces amusantes et j'appliquai les 
principes qui m'avaient été appris à 
mes occupations de chaque jour. Je 
pus ainsi retenir avec une incroyable 
facilité mes lectures, les conférences 
que j'entendaïs et celles que je devais 
prononcer, le nom des personnes que 
je rencontrais, ne fut-ce qu’une fois, 
les adresses qu’elles me donnaient et 
mille autres choses qui me sont d’une 
grande utilité, Enfin je constatai au 
bout de peu de temps que non seule- 
ment ma mémoire avait progressé, 
mais que j'avais acquis une attention 
plus soutenue, un jugernent plus sûr, 
ce qui n’a rien d’étonnant puisque la 
pénétration de notre intelligence 
dépend surtout du nombre et de 
l'étendue de nos souvenirs. 
Si vous voulez savoir comment 
obtenir les mêmes résultats er acquérir 
cette puissance mentale qui est notre 
meilleure chance de réussir dans la vie, 
découvrez donc cet intéressant petit 
ouvrage d’introduction à la Méthode 
W.R. Borg: “Les Lois Eternelles du 
Succès”. Ecrivez simplement à l’édi- 
teur qui, spécialiste des meilleures 
méthodes de psychologie pratique, 
l'envoie gratuitement à quiconque 
désire améliorer sa mémoire. 
L'adresse ?.. Méthode W.R Borg, 
chez Aubanel, dpt 638 — 6, place 
St-Pierre, 84028 Avignon Cedex. 
E. BARSAN 
841028 Avignon Cedex,"
3,4,"DRE en ne 
Suilo do la pago ? 
Vulgariser ? oui, 
masse 
Qui peut valablement animer le 
débat ouvert par le docteur Guy 
Maruani sur la vulgarisation de la 
psychorogie ? Les journalistes ? 
es psychanalystes ? La clientèle 
de la Psychologie ? Les philoso- 
phes des sciences ? On ne peul 
éviter que soient posés des pro- 
blèmes de fond {tels ceux avan- 
‘cés par François Châtelet dans le 
numéro 17}, que soient débattues 
des notions aussi centrales que 
celles de « normalité », d'«adap- 
ation », de « maladie mentale », 
de u science humaine ».… Et la 
presse peut être un bon lieu pour 
en débattre. 
À qui s'adresse-t-on ? Profession- 
nel ou amateur, qui est le con- 
sommateur de psychologies ? 
Qu'attend-il de la psychologie ? Ici 
intervient la question complexe 
des usages sociaux de la psycho- 
logie, lorsqu'elle franchit les gril- 
les de l'université et les vitres des 
laboratoires pour se disséminer 
dans le grand public. Des théori- 
ciens aussi différents qu'Helmut 
Schemsky, Gérard Mendel ou 
Michel Foucault ont abordé ce 
problème. La psychanalyse vulga- 
risée remplacerait la morale défail- 
lante, la religion ébranlée, par une 
forme laïque, positiviste, idéolo- 
gisée de contrôle social. 
Graphologie : 
adeligif 
A la suite de son article : « Votre 
écriture pour vous soigner » paru 
dans Psychologies n° 19, Marie- 
Madeleine Forestier avait indiqué 
les adresses d'organismes où on 
peut apprendre la graphologie. 
Malheureusement, à l'impression 
une des adresses a été oubliée ; 
nous vous la communiquons 
aujourd'hui : Ecole de psycho- 
graphologie - 12, villa Saint- 
Pierre. B3 - 94220 Charenton - 
Tél. : (1) 376.72.01 
Les cours sont donnés le soir : La revendication hédoniste, le 
thème du droit au bonheur, la 
morale du confort et de l'utilité 
expliquent partiellement la 
demande d'une psychologie boni- 
fiante, d'un happy-end aux souf- 
frances humaines. Significatif est 
à cet égard le succès de masse 
d'un auteur comme Pierre Dacco 
(Les prodigieuses victoires de la 
psychologie modeme et Les 
triomphes de la psychanalyse) 
dont les ouvrages et les titres sont 
à eux seuls les symboles de la 
quête moderne collective. L'Amé- 
rique a été la première à donner 
l'exemple de ce pragmatisme du 
bonheur et à démentir Freud qui 
croyait naîvement apporter la 
peste sur le nouveau continent en 
apportant la psychanalyse. 
Aujourd'hui, Woody Allen a 
achevé le travail: le psy est 
devenu un stéréotype des 
mass media. 
Avec humour, le D' Maruani 
affirme, parlant de la psycha- 
nalyse : « C'est elle qui vend aux 
Occidentaux l'idée qu'ils sont des 
êtres irremplaçables. » Voilà qui 
donne beaucoup à penser et qui 
situerait le débat au niveau où 
l'ethnopsychiauie (Georges Deve- 
reux) et l'anthropologie ou l'eth- 
nologie (Claude Lévi-Strauss) le 
oseraient. Lacan jetait déjà cette 
Éoutade selon laquelle un Japo- 
nais ne peul être 
psychanalysé.… 
L'effet télévisuel de la psy est radi- 
calement différent de l'effet livres- pas 
que, d'où l'intérêt des canaux par 
lesquels cette vulgarisation 
s'opère. Îl peut s'agir de livres de 
poche (Pierre Dacco est aussi lié 
à ce monde de diffusion, pour 
reprendre cet exemple d'incon- 
testable réussite), de journaux {la 
plupart des journaux féminins ont 
eur rubrique psychologique}, de 
télévision (Psy-show), de radio 
(Ménie Grégoire et tous ceux qui 
l'ont suivie}, avec chaque fois les 
effets inhérents à ce type de 
média, tels que les a analysés 
Marshall Mac Luhan. 
Voilà de très nombreuses ques- 
tions pour un débat que l'effet 
Dacco ou Dolto illustre, et que 
d'autres personnes relanceront 
sans aucun doute. 
P.C., Paris Sectes et sectes 
Votre article sur les sectes m'a 
beaucoup choqué. Anne Dupont 
déforme la réalité. Comment 
pouvez-vous comparer et 85SIMI- 
ler Moon ou Krishna aux Adven- 
listes ou Pentecôtistes ? [...] 
Quant à la campagne anti-tabac 
dont vous parlez, elle est seule- 
ment ce qu'elle annonce : une 
action à caractère sanitaire menée 
par la ligne «Vie et Santé » sans 
aucun but de prosélylisme pour 
l'Adventisme. Je le sais, y ayant 
moi-même participé. Le fait de 
s'inscrire à ce plan de cinq jours 
ne nous engageait en rien, en ce 
qui concerne la foi. Vous regrou- 
pez sous le nom de sectes des 
groupes extrêmement différents, 
c'est-à-dire des groupes dange- 
reux et des groupes non dange- 
reux. Un public non averti pour- 
rail s'y tromper. 
Marie-Hélène Ducrocq, Lallaing 
Aveuglement 
On a toujours la liberté de s'aveu- 
gler; la prudence à avoir 
lorsqu'on commence une théra- 
pie par le cri était à souligner. 
Cependant, il y a aussi des erreurs 
à dénoncer : 
« Richard Meyer dit que Jalen- 
ques fait un travail de recherche 
à Sainte-Anne. C'est entièrement 
faux ; tout d'abord, il n'est plus 
à Sainte-Anne ; ensuite lorsqu'il 
exerçait dans cette mecque de la 
psychiatrie dont il profitait de la 
réputation sur sa carte de visite, 
il ne faisait qu'occuper des 
locaux ; il traitait surtout des gens 
venant de l'extérieur ; pour les 
malades de Sainte-Anne, sa pré- 
tention allait même jusqu'à inter- 
dire tout traitement chimiothéra- 
pique. Ce que les psychiatres 
avaient prescrit était annulé. 
« Ensuite Richard Meyer dit qu'il 
y a toujours plusieurs traitements 
possibles à une même maladie : 
c'est le problème des indications. 
Je pense que le futur client d'une 
thérapie quelconque n'ayant 
aucune boussole pour s'orienter 
pratique l'automédication. Il n'est 
pas du tout au courant des dan- 
gers qu'il encourt. Richard Meyer est thérapeute el 
défend sa pratique ; moi je m'ex- 
prime au nom des clients éven- 
tuels de ces thérapies qui promet- 
tent toujours plus qu'elles ne tien- 
nent; pourquoi ne parle-t-on 
jamais des échecs el toujours des 
miracles ? 
Janette Mayot, Cannes 
L'homéopathie 
contre l'angoisse 
N'a-t-on vraiment rien trouvé con- 
tre l'angoisse quand elle est à un 
niveau important ? Il me semble 
avoir un blocage en ce qui con- 
cerne l'homéopathie que je 
prends assez régulièrement mais 
qui ne me donne pas de résultats 
vraiment probants. 
J'aimerais avoir l'avis de quel- 
qu'un qui me donne témoignage 
de résultats précis pour ce cas : 
spécifique. 
Michel Dumont, Messimy 
Autres 
analysés 
J'affectionne la rubrique : « J'ai 
rencontré des analysés heureux » 
que je dévore chaque mois. 
Voilà mon problème : il y a six ans 
j'ai entrepris une analyse que je : 
continue toujours et comme tout 
être qui se cherche je traverse des 
périodes difficiles, pénibles , 
même ; aussi, je voudrais corres- 
pondre, échanger avec des per- 
sonnes fréquentant le divan et 
désireuses bien sûr de m'écrire. 
Christophe Victor 
(écrire au journal) 
Suggestion 
Suite à l'article « Dénouez vos 
conflits professionnels », je ne 
peux m'empêcher de vous sug- 
gérer de bien vouloir faire ou faire 
faire une enquête auprès d'un 
ergonome, afin qu'il nous expli- 
que au mieux ce qu'est l'ergono- 
mie (Etude scientifique du travail), 
qui est une nouvelle science pas 
très connue encore, mais qui 
gagneraït à l'être pour un public 
le plus large possible. 
Et, évidemment, de nous publier 
un article sur le fruit de vos 
recherches. 
M.H., Paris 
ns"
4,5,"ASTROFLASH Posters La comparaison de votre ciel de naissance et de celui de votre parte- 
naire, la recherche de leurs harmonies et de leurs dissonances permettent 
d'établir un diagnostic, de mettre en évidence les affinités etlesincompati- 
bilités dont dépendil'équilibre de votre couple sur les différents plans phy- 
sique, intellectuel et sentimental. 
Pour savoir tout ce qui vous rapproche et tout ce quirisque de vous éloi- 
gner de celui oude celle à qui vous vous intéressez, demandez une étude 
ASTROFLASH “Adam et Eve"". Vous recevrez un document personnalisé 
de 5 à 8 pages dont l'auteur n'est autre qu'André BARBAUIT, le célèbre 
auteur de la-Collection du Zodiaque. 
Comment faire pour recevoir votre dossier, dans les 8 jours, sous pli discret? 
Remplissez complètement le bon de commande ci-dessous 
(sans-oublier:les’heures de naïssance) et adressez-le avec 
votre réglement de 100 F à : 
ASTROFLASA 
84, avenue des Champs<lysées 
75008 PARIS 
[ BON DE COMMANDE . 
Ï à renvoyer avec votre réglement à ASTROFLASH, 84, Champs-Elysées - 75008 PARIS. 
(merci d'écrire en lettres majuscules). 
Nom: Prénom: 
I Adresse : 
Code Postal Ville : 
Veuillez m'envoyer l'étude personnalisée “Adom et Eve” concernant le couple suivant {remplir obligatoirement les deux 
questionnaires) : 
Ï O données correspondant à la FEMME O7 données correspondont à l'HOMME 
Dote et heure de naissance Date et heure de naissance 
Lulu ls us JL] Li) [li] Lu tt aa d Lu] Lil 
Jour Mois Année Heure Minutes Jour Mois Année Heure Minutes 
{0l-à 24) (01 à 24) 
Lieu de naissonce Lou de naissance 
«vi j1 L 1 France : ville Fronce : ville un Dpar. 
Hors de FrOnce + pOÿs Hors de France : pays 
Ville : V8 — 
Gronde ville la plus proche : Grande ville la plus proche + 
Je Joins mon réglement de 100 F (frais d'envol Inclus) à l'ordre d'ASTROFLASH. Date : 
C] por chèque bancaire CO] por chèque postal (Paris 10196 38H) Signature : 
Cette étude es1 réservée aux plus de 18 ons. 
ee 
matt 
num. 
es 
ire Ses 
CC ES 
Us, 
€ Mr 
gum 
cs fe Le RICE) Un ee 
ep 
re 
PET, 
DA 
“y 
6 "
