,page,text
32,33,"Ÿ 
d k Fo d'anticipations cognitives dans un 
cerlain contexle. Les supporters, en 
fonction du groupe auquel ils s'affi- 
lient et des interprétations partagées. 
qu'ils donnent au spectacle sportif, 
ont une jouissance symbolique diffé- 
rente. 
Une pré-enquête (2) a permis de 
mettre en évidence que les suppor- 
ters exlrémistes représentent une 
sous-culture dans laquelle les diver- 
ses modalités de transgression sont 
codifiées par le groupe : et que le 
speclacle sportif est une occasion 
pour les jeunes de se calquer sur leur 
modèle de supporter anticonfor- 
miste. Le stéréotype du supporter 
fort, passionné, juste, solidaire, mul- 
tiplie le nombre de ceux qui s'y con- 
forment, et accroît l'importance d'un 
rôle transgressif, celui de supporter 
ultra, dans la vie d'un jeune. Celui 
qui se coule dans le moule du sup- 
porter extrémiste trouve une identité 
toute faite avec des normes, des 
valeurs, des raisons. Il pourra ainsi, 
poussé par son besoin d'identité 
sociale et d'affiliation, choisir un type 
de comportement, faire siennes ces 
règles et ces images de conduite à 
À partir des articles de la presse spor- 
tive italienne de 1979 à 82, les cher- 
cheurs ont établi sept groupes de 
croyances quant aux raisons de cette 
violence : les causes socio-politiques ; 
les causes éducatives et culturelles ; les 
causes liées au monde sportif ; les cau- 
ses imputables à la criminalité ; les cau- 
ses liées à la jeunesse ; les causes liées 
à la nature humaine (dans le domaine 
de l'instinct et de la psychopathologie). 
° 2494 questionnaires ont été remplis 
par des membres de clubs, officiels ou 
non, à Milan, Gènes, Florence, Rome 
et Naples. 
— Les modérés partagent davantage 
les convictions sociales diffuses sur la 
violence dans les stades. Ils optent pour 
les points de vue les plus pessimistes 
vis-à-vis des extrémistes, relevant ainsi 
de la force des stéréotypes et d'un cer- 
lain racisme anti-jeunes. 
— Les extrémistes partagent les mêmes 
convictions mais ont en général préféré 
ne pas adhérer aux jugements négatifs. 
° L'implication dans la partie est appa- 
rue différente pour les deux groupes. 
— Les modérés sont plus motivés par 
la réalité de la partie tandis que les 
extrémistes voient surtout la dimension 
expressive, ludique et conflictuelle du CE QU'ILS PENSENT DE LEUR VIOLENCE 
(ENQUÊTE AUPRES DE 2494 SUPPORTERS ITALIENS 
spectacle. Pour ces derniers par exem- 
ple, les violences et transgressions 
résultent davantage du comportement 
de l'arbitre et des supporters adverses 
que de la partie et rares sont ceux qui 
considèrent les qualités techniques de 
la partie et les actions des joueurs. 
e Dans leurs réponses aux questions 
relatives aux croyances sociales géné- 
ralement partagées : 
— Les modérés ont davantage recours 
aux explications apocalyptiques, pré- 
férant imputer la déviance des suppor- 
ters aux carences éducatives de la 
société, aux tendances à la délinquance 
des jeunes, à la présence de personna- 
lités psychopathes et à l'irrationnalité 
de la foule. 
— Les extrémistes ont préféré les expli- 
cations fatalistes liées à la nature 
humaine, à la décharge agressive, à la 
perte de self control, aux instincts. Ils 
ont aussi montré une plus grande tolé- 
rance vis-à-vis de la déviance, une 
moindre propension à recourir à des 
déterminismes extérieurs à leur expé- 
rience. Ils n'ont pratiquement pas 
retenu les facteurs socio-politiques et 
les intérêts finangiers el flarisies liés 
onde sportif (qui auraient en 
revanche reçu l'adhésion des précé- retiennent que leurs excès relèvent de dentes générations de jeunes). 
° Dans leurs réponses aux questions 
relatives aux justifications de leur 
violence : 
— Les modérés ont choisi essentielle- 
ment les explications déresponsabili- 
santes. Ils justifient la violence par la 
solidarité envers leur propre équipe, ou 
par le manque de sens du réel de cer- 
tains supporters déchaînés. 
— Les extrémistes, eux, refusent cette 
fois les explications fatalistes, et ont pré- 
féré aux explications stéréolypées cel- 
les qui attribuent à leurs propres actes 
une intentionnalité : se considérant 
comme un groupe susceptible d'émet- 
tre des sentences sous forme de criti- 
que, désaccord, intimidation et passage 
aux voies de fait à l'égard des adver- 
saires, de l'arbitre et des opposants 
sportifs. 
En réclamant la juste punition, ils légi- 
timent leur conduite et se revendiquent, 
même dans leur tort, comme responsa- 
bles de transgression. Ils refusent tou- 
telois d'assimiler cette conduite 
déviante particulière à d'autres. Et 
la justice sportive plus que de la justice 
ordinaire revendiquant la particularité 
et la moralité qui guide leurs altitudes. 
les)"
33,34,"travers lesquelles il pourra confirmer 
son moi. Au cours des entretiens, un 
jeune garçon a dit : « Il vaut mieux 
être des supporters de choc, 
méchants et violents, que de n'être 
personne. » 
Des chercheurs d‘'Oxlford (3) ont 
également souligné le rôle constitu- 
tif de la territorialité, l'ambiance du 
stade favorisant les actes violents. 
Selon eux, une bonne part de l'atti- 
tude des supporters relève de la vio- 
lence symbolique sans désir de pas- 
sage à l'acte et engendre plutôt des 
coups expressifs rituels. Le passage 
à l'acte est plus le fait de malenten- 
dus, de mauvaise communication 
que de violence intentionnelle. 
L'analyse des entretiens a fait appa- 
raître qu'un supporter extrémiste 
opte pour la violence parce qu'il doit 
rétablir son estime de soi et sa puis- 
sance menacée. La nécessité de sau- 
ver la face lui est imposée malgré lui 
aussi bien quand l'insulte, la provo- 
cation ne sont pas prises au sérieux 
par le supporter adverse, que quand 
ce dernier prend trop au sérieux la 
menace, se méprenant sur l'élément 
rituel de la communication. Ainsi, 
l'exigence morale d'être à la hauteur 
du personnage qu'il joue fait courir 
au supporter le risque constant de se 
voir contraint au passage à l'acte 
agressif. Les recherches des psycho- 
logues d'Oxford (3) et la recherche 
en cours (2) ont révélé une attribu- 
tion différente de signification à 
l'événement « partie de foot » de la 
part des supporters extrémistes ou 
modérés. Ce qui a été vérifié à tra- 
vers les adhésions différentes des 
supporters violents ou non violents 
aux explications sociales courantes 
sur les causes de la violence dans les 
stades (voir encadré). 
Selon Angelo Mucchi Faina, se fon- 
dant sur les travaux de Tajfel et Fra- 
ser « l'agressivité collective sélec- 
tionne les objets à frapper sur la base 
d'un consensus social de type essen- 
tiellement idéologique. Le choix de 
la cible ne résulte pas d'une agres- 
sivité déviée ou d'une irrationnalité, 
mais découle des processus cognitifs 
qui soutiennent l'activité. » 
L'analyse des comportements des 
supporters déviants doit prendre en 
considération la signification morale 
qu'ils donnent à leurs actes en fonc- 
tion de la situation. Les études sur la 
moralité des jeunes déviants sont 
passées par quatre phases : la pre- 
mière considère le jeune délinquant 7 a —————— 
E stéréotype 
du supporter fort, 
passionné, 
juste, solidaire, 
multiplie le nombre 
de ceux qui S'y 
conforment 
et accroît l'importance 
d’un rôle transgressif, 
celui de supporter ultra, 
dans la vie d’un 
jeune. Il trouve ainsi 
une identité toute faite avec 
des normes, des valeurs, 
des raisons. 
comme incapable de distinguer ile 
bien du mal, souffrant en somme de 
carence morale ; la deuxième attri- 
bue la délinquance du jeune à des 
troubles psychopathologiques, à une 
carence de son surmoi ou aux effets 
d'un vécu familial désastreux : la 
troisième introduit la notion de sous- 
culture et de relativité éthique : le 
jeune a pour toute référence les 
règles morales du groupe auquel il 
est affilié ; la quatrième phase, d'ins- 
piration cagnitiviste (travaux de 
Kohlberg) est centrée sur la forme du 
jugement moral, et non sur son con- 
tenu, défini comme semblable chez 
l'enfant et l'adulte. Toujours dans 
cette optique, mais plus récemment, 
Turiel a distingué la moralité de la 
convention sociale : tandis que la 
morale privilégie le sentiment per- 
sonnel de justice, la convention 
sociale tend à maintenir un état de 
fait en le fondant sur ce qui est juste 
ou injuste. Ce dernier modèle, qui 
permet le‘mieux de comprendre le type de jugement moral présidant 
aux comportements des supporters 
extrémistes, est celui utilisé pour la 
recherche en cours. La pré-enquête 
a déjà mis en évidence que les sup- 
porters extrémistes semblent perdre 
de vue l'élément de fiction, de jeu, 
d'un accord passé le temps d'un 
match de foot. Sous l'emprise de 
l'impératif moral, ils se comportent 
en justiciers. La remarque d'un jeune 
Tifoso apparaît dans ce contexte 
riche de sens : « On va au stade 
comme à la guerre pour établir qui 
a tort et qui a raison. » Le jugement 
moral, qui permet de définir la situa- 
tion, établit la signification de la ren- 
contre et les façons appropriées d'y 
participer. ! 
La recherche montre que la compé- 
tence sportive est relativement rare 
chez les jeunes interviewés, ce qui 
pourrait expliquer leur difficulté 
d'adhésion aux règles sociales défi- 
nissant le spectacle sportif. Les jeu- 
nes supporters extrémistes instifu- 
tionnalisent, par ailleurs, le specta- 
cle de leurs agissements selon des 
règles morales elles aussi conven- 
tionnelles mais de type alternatif. 
D'où le heurt entre les deux grilles 
dé conventions. Il apparaît alors 
compréhensible que les supporters 
retiennent leurs propres actions 
comme illégitimes en fonction des 
règles officielles de la sportivité en 
même temps qu'ils affirment que 
leurs éventuels débordements relè- 
vent de la justice sportive plus que 
de la justice ordinaire. Ils se révèlent 
conscients des divers plans de réa- 
lité dans lesquels s'inscrivent leurs 
actes agressifs. C'est à travers les 
règles morales que l'on entrevoit le 
lien entre le moi et la société entre 
l'image que nous revendiquons et 
celle que les autres nous attribuent. 
Amélie Blancaud 
d'après Alessandro Salvini 
(c) Psicologia contemporenea 
(1) D'après le Dictionnaire de psychologie de Norbert Sillamy (Ed. Bordas) F « fa cognition (connaissance) et la conation (effort volon- 
taire) sont les deux aspects étroitement liés de 
la personnalité : les éléments cognitifs peu- vent être évalués quantitativement par des tests de connaissance. Les aspects conatifs 
peuvent êlre appréciés qualitativement par les techniques projectives (tests). » (2) Recherche menée en collaboration avec Pietro Delfini, Mirella Pirrinato et Marco Guicciardi, Enquête financée par la C.O.N.I. 
et rendue possible par l'Association italienne 
des supporters des équipes de foot. (3) Recherche menée à Oxford par Peter Marsh, Elisabeth Rosser et Rom Havré."
34,35,"\ La-carlo anil-stross ros- 
\ somble à uno carte da 
\ crédit avoc un palit 
\ card do plactiquo 
\ noir Incorpord, En 
À proseanl lorlomont 
, lo pouco dessus on 
\ arrivo à mosurer 
\ son alreso, 1! y à 
\ dos modes d'em- 
plol pour 
approndro à 
} vous délendre 
Pal TT 
CHRONIQUE D'UNE GARDEUSE D'OIE NEURASTHENIQUE 
Toujours angoissée et à l'affût du premier gad- 
gel miracle venu, je ne quille plus la carte anti- 
Stress que ma mère m'a offerte. Je déteste le 
métro et comme par hasard, tout m'arrive tou- 
jours dans le métro. En général, je liens trois 
stations et je remonte à la surface. Ce jour-là, 
stoïque, mes lunettes dans la poche — je suis 
myope, je reste ainsi dans un flou artistique — 
je me retrouve au milieu d'un troupeau d'oies 
dont heureusement je ne suis pas la gardienne. 
Je bute dans un vrai cul de jatte, un faux men- 
diant me tape de dix balles, un groupe de flü- 
tistes des Andes me jette un regard si sombre 
que j'y laisse encore quelques deniers. Je crois 
pouvoir tenir plus que d'habitude, même si ma 
carte anti-stress indique le noir le plus dense, 
signe abominable de stress. Sur le quai de 
Strasbourg-St-Denis, je tente une sorlie. Un 
quêteur de la Croix rouge me fait face, je pige 
tout de suite, non il n'aura pas ma dernière 
pièce, Je remonte dans le wagon el me dis : 
u Tiens bon Martine on arrive », le stress ne 
diminue pas, il ne vire pas, je suis obstinément 
au noir. Pourtant je presse de toutes mes for- 
ces mon pouce sur le carré en plastique. À Chä- 
telet, je refais une tentative, au milieu des ras- 
tas et des smurfeurs et je remonte à la surface. 
Ouf 1 i fait un temps superbe, je croise des yeux 
comme je les aime et je tombe en arrêt devant 
des fringues. D'abord rouge, signe d'un léger 
MIEUX, Ma carte vire au vert ; ça Y est JE SUIS 
calme. Je rentre dans le magasin, j'essaie le 
tailleur de lin, je suis pas mal du tout, ma carle 
es bleue azur maintenant, le ciel peut me tom- 
ber sur la tête, je suis complètement relax. 
Je demande le prix, la vendeuse, l'œil narquols 
m'annonce la couleur. À ce propos, mon MÉla- bolisme en reprend un coup et c'est le noir 
Intense, Fini le shopping, je saute dans l'auto- 
bus, el le chauffeur me semble étrange (parano, moi, à peine}. Il démarre sur les cha- 
peaux de roues, il'a l'air pressé. Timidement 
une dame très respectable à la mise en plis 
blanc bleuté lui fait:remarquer qu'on ne con- 
duit pas un autobus comme on tape à la 
machine, C'eslbienimonavis, Apparemment, 
le conducteur s'en fout, il: fonce, il connaît 
mieux sa machine qu'une dactylo, de plus il 
faut qu'il. soit au dépôt à 20:heures.pétantes. 
Il'attend'uncoupide filide la'Guadeloupe. Heu- 
reusement, la.circulation:est fluide. J'enmène 
pas large et je suis.au noir:intense. Je lis mon 
mode d'emploi pour me déstresser. Je serre 
les poings vigoureusementen:comptant jusqu'à 
10 et je laisse aller mon corps jusqu'à éprou- 
ver une certaine mollesse. Je respire à fond, 
môlhodo PSYCHO:RELAX 
14, bd Guérin + 13008 Marsoille PSYCHOSOMATIQUE 
ane © 4 Tnt St 0 Ou ue ns ©e me nt un M Qu et O0 + de ee 
ee 0 mm + 
Jo désir recovolr, GRATUITEMENT, sans angage- 
mont do ma parl toutos informations sur votro LL AR LS V7 Cat Cr 
# , 06 0: 7 Si 
reliens autant que possible mon souffle avant 
d'expirer doucement. Victoire, je suis vert 
rouge. Le conducteur n'en a cure, il entame : 
« Ecoutez les braves gens, la goualante du pau- sus 
caution et j'imagine que je marine-en philoso- 
phant dans un bain chaud. C'est gagné je suis 
auibleu le plus pur. Je rate presque ma station. 
Inutile de dire qu'appuyer sur le bouton ne sert 
à rien. Je hurle : « La porte s'il vous plaît ». Je 
saute quasiment en marche et rentre dans une 
pauvre aveugle qui me demande de l'aider à 
traverser. Oui mais où ? Avec mon grand sens 
de l'orientation, je la mets dans la mauvaise 
direction. Elle me remercie, lâche, je n'ose lui 
avouer mon erreur, et j'espère qu'une âme cha- 
ritable laremettra dans le bon chemin. Ouf, je 
crois être au rouge. Je monte quatre à quatre 
mes escaliers. J'habite au second. Je croise 
mon fiancé quin'a même pas le temps de me 
dire où il va. En tous cas, il a pris la peine de 
faire griller des sardines si j'en juge par l'odeur 
qui règne dans l'appartement. Au bord des lar- 
mes, ma carte a encore viré au noir, je télé- 
phone à Catherine, ma copine et voisine du cin- 
quième. Elle compatit et me dit qu'elle a un 
superbe engin pour assainir l'atmosphère en 
changeantles ions. Plus ils sont négatifs, plus 
l'air est pur. On respire à trois mille mètres, on 
voit la vie en rose. Je ne fais ni une ni deux, 
jele lui échange contre ma carte anti-stress. 
Martine Ollier 
L'AUTO-RELAXATION 
Eflace : :la fatigue, l'angoisse, l'anxiété, la 
déprime - l'insomnie, la timidité, le trac, l'ex- 
cès de consommation d'alcool, de tabac - les 
kilos superiius, la migraine, la constipation - les 
troubles sexuels féminins et masculins - les 
peurs ou phobies. Elle prépare à l'accouche- 
ment sans douleur. Elle améliore le travail sco- 
laire des enfants. Elle vous apprend à conser- 
ver la jeunesse, à supprimer les troubles de 
la ménopause. À rester optimiste, dynamique. 
Vous saurez contrôler le rythme respiratoire, 
dominer la douleur, etc. 
RIEN NE RESISTE A LA FORCE 
DES SUGGESTIONS POSITIVES 
C'est une méthode ultra-moderne, par cassel- 
tes audio, couramment utilisée aux U.S.A., éla- 
borée grâce aux Consells de Médecins. Tout 
se réalise sans même que votre volonté ait à 
Prénom . 
Age Prolession 
Adrosse 
Ville Code postal 
35"
35,36,"RETABLIR 
LA 
COMMUNICATION 
AU SEIN 
DE LA FAMILLE L’échec scolaire, 
l’anorexie ou la dépression 
d’un enfant proviennent 
souvent de mauvaises 
communications inconscientes 
au sein de la famille. En 
France, depuis quelques 
années, des thérapeutes 
s'inspirant soit des théories 
systémistes de l'école de Palo 
Alto (Californie) soit de la 
théorie analytique s’attachent 
à dénouer les interactions 
fautrices de troubles. Cette 
mise au jour permet à 
la famille de jouer un 
rôle plus sécurisant. 
Patrick Gosling e pas communiquer c'est 
déjà communiquer : tout 
comportement influence 
les autres » explique Paul 
Watzlawick (1) et les au- 
tres ne peuvent pas ne pas réagir à 
ces communications. Même un 
homme qui regarde droit devant lui 
sans bouger dans un bar rempli de 
monde communique aussi son inten- 
tion de ne parler à personne, et en 
général son message ‘est correcte- 
ment compris par ses voisins. 
Toute communication présente deux 
aspects : le contenu ou l'information 
transmise par le message et la rela- 
tion qui indique la manière dont on 
doit entendre le message. Le danger 
du premier mode de relation est la 
rigidité des rôles. Le danger du 
second est l'escalade de la rivalité 
entre les partenaires. « Sois spon- 
tané ! » La relation ordonne d'obéir 
et le contenu encourage à la sponta- 
néité : il y a paradoxe, c'est-à-dire 
qu'il n'existe pas de comportement 
qui permette de répondre en même 
temps aux deux injonctions conte- 
nues dans le message. 
La nature d'une relation dépend de 
la ponctuation des séquences de 
communication entre les partenai- 
res : l'ignorance de cette réalité 
donne lieu à des débats intermina- 
bles. Prenons un exemple : un mari 
croit, en toute bonne foi, que son 
attitude de repli et de passivité n'est 
que la conséquence des critiques RTC EEE 
RE A, : Fou gs - < 
AT ART NE ER ES: “ PAN/FSSPIEE AU 
AD Fe AA SAR. < 
FAN or AN Be . ° 6 7 RE ses AA 
r., ES 
. ff RE Fée UD pe 
panier TN ap L £ ae 
CEE ROSE CORRE 
hargneuses de sa femmes alors que 
celle-ci reste persuadée qu'elle le 
critique en raison de sa passivité. Il 
n'y a pas de solution : l'attitude de 
l'un renforce l'attitude de l'autre. Ils 
ne peuvent sortir de ce cercle 
vicieux qu'en prenant conscience de 
leur mode de relation : c'est ce qu'on 
appelle méta-communiquer et, 
comme M. Jourdain, beaucoup de 
familles sont d'ailleurs capables de le 
faire sans le savoir. Les êtres 
humains usent de deux modes de 
communication : la parole ou l'écrit 
d'une part et le geste. Dans le pre” 
mier système de communication, le 
lien entre le mot et la chose est arbl: Dr 
OL » 
. MST ENRRLE 
.)  — RE te 
LES RES tu 
traire. I 
ler un c 
quatre l 
cet anir 
En reva 
commu 
direct a 
la com 
posture, 
inflexio: 
tonatior 
contenu 
le prem: 
second 
aussi ve 
méta-co 
Tout éct"
36,37,"Sephs 
me 2 + 
% . .* NS DS) 
1e ls De OCT E CS er 
traire. Il n'y a aucune raison d'appe- 
ler un chat un chat, c'est-à-dire les 
quatre lettres C-H-A-T pour désigner 
cet animal. 
En revanche, le second système de 
communication a un rapport plus 
direct avec ce qu'il représente : c'est 
là communication non-verbale, la 
Posiure, la gestuelle, la mimique, les 
inflexions de voix, le rythme et l'in- 
tonation des mots. Très souvent, le 
Contenu du message est transmis Sur 
le premier mode et la relation sur le 
second mode, Cependant, on peut 
aussi verbaliser la relation (c'est la 
méta-communication). 
Tout échange de communication est A le 
Ju MORT AT) HT qu ar NAN PRE 
Re Eee DORE RES PRET Gren rte a 
+ a jee s LES Sir Sr 
Ver UN TE RS PS NT ET BR re 
er à PME ARC RI AI A SX FNGE nos tes ob Je EU 
e 
1 COTE 1 nee 
symétrique où complémentaire : la 
relation complémentaire est fondée 
sur la différence, l'un des partenai- 
res occupe la position haute (one- 
up), l'autre la position basse (one- 
down). La relation symétrique 
repose, elle, sur l'égalité et les deux 
partenaires ont tendance à adopter 
un comportement de miroir. Citons 
encore la notion de collusion, qui est 
une sorte de contrainte licite qui se 
met en place dès les premiers 
moments d'une relation et qui est à 
la base de l'attrait initial dans une 
on de couple. 
ee ressort que la clé d'une grande 
partie des comportements humains se trouve dans la communication, en 
particulier dans les interactions qui 
se répètent, et finissent par structu- 
rer la vie du groupe familial. Tous 
ces phénomènes ne sont pas néces- 
sairement pathologiques, mais si les 
règles de la communication sont trop 
rigides ou trop floues, la famille joue 
un rôle pathogène vis-à-vis de l'in- 
dividu, sans que l'on puisse en atiri- 
buer la responsabilité à tel ou tel de 
ses membres. 
Ce sont les tentatives de thérapie des 
schizophrènes, aux USA, qui ont 
conduit à mettre en lumière l'insuf- 
fisance de la notion de pathologie 
individuelle : on s'est rendu compte 
que le trouble du patient était lié à 
un trouble de l'interaction au sein de 
la famille. On peut véritablement 
parler de maladie de la communica- 
tion : dans ce type de familles, il est 
très difficile d'obtenir une définition 
claire des relations entre les mem- 
bres, de la place que chacun occupe 
par rapport aux aulres. Les frontiè- 
res entre les sexes et les générations 
(enfants et parents et parfois grands- 
parents) sont imprécises (ou exces- 
sives), on perçoit mal qui parle réel- 
lement à qui. Dans ce contexte, l'en- 
fant éprouve de grandes difficultés à 
définir les frontières de son moi, à 
trouver son identité. Cette approche 
n'est pas contradictoire avec la 
psychothérapie individuelle : elle en 
est au contraire le complément. 
Toute maladie peut avoir pour but 
37 "
