,page,text
18,19,"CR 
mort. Elle s'offre mais, ce faisant, elle 
provoque la réponse de l'autre. L'im- 
portance du regard donne lieu à l'at- 
tirance pour la parure et le vêtement, 
qui aimantent l'œil en même temps 
qu'ils masquent le réel du sexe et des 
organes génitaux. Thérèse, ancien 
mannequin, a fait l'épreuve de cette 
importance du regard : « La fonction 
du regard a toujours revêtu une 
importance capitale pour moi. Ado- 
lescente, je fréquentais un pension- 
nat religieux, la discipline y était plu- 
tôt stricte : il m'était interdit de me 
tenir n'importe comment, je devais 
garder les genoux bien droits lors- 
que j'étais assise. La petite fille vit 
déjà sous le regard, elle doit savoir 
se tenir, se surveiller en même temps 
qu'elle est surveillée : surveillée et 
surveillante, elle est comme scindée, 
à la fois sujet et objet. La profession: 
de mannequin prolonge cet état de 
fait, cette nécessité du maintien : le 
mannequin se contrôle, il doit savoir 
faire jouer les différentes parties du 
corps, les mains doivent être fonc- 
tionnelles, les mouvements'sont exé- La féminité n'est pas donñée mais à découvrir. 
cutés en fonction du vêtement, ils 
doivent révéler sä coupe, sur- 
tout dans la haute couture, où 
aucun geste ne doit venir faire 
signe au spectateur. Quant au 
regard, il est souvent fuyant, bien 
qu'un regard jeté par-dessus l'épaule 
puisse parfois provoquer le public. 
Je crois que quelque chose de l'or- 
dre de la séduction trouve là son ori- 
gine : vous vous donnez à voir vous 
regardant. C'est de cela que joue la 
femme séductrice dont le comporte- 
ment doit être constamment étudié. 
Il m'est rarement arrivé de jouer le 
jeu de la provocation hormis les 
quelques fois où je suis arrivée en 
cours, à l'Université, maquillée 
comme pour une présentation de 
mode. Malgré cela, je ne suis pas 
une séductrice, je séduis à mon insu, 
par contre je suis fascinée par les 
séductrices. En rentrant dans l'am- 
phithéâtre de la fac, je savais que les 
autres allaient me regarder, je vou- 
lais voir comment ils allaient réagir. 
Moi, je me sentais belle et cela me 
suffisait. Pour moi, s'habiller et se maquillor vont clos gacloaux quo l'on 
offre aux aulros, lornquo je mo 
maquille, c'onl quo J'al onvio do fairo 
plaluir, » 
Capléo, fauctnéo par lo regard, Thé- 
rso a dos diffioultés à Intégrer la 
dimension do l'aulro-cdans ua vio, File 
se souvient qu'olle onviail los roli- 
giousos de son ponslonnal : « J'admi- 
rals-cos femrnosui complètes, si auto- 
nomes. » lhérdso ge trouve trop 
aularolque, trop aulo-suffisante, elle 
n'arrive pas à avoir besoin d'un 
homme. Jn fait, olle ne 8e sent pri- 
vée de rien, elle ne manque de rien 
qu'elle puisse espérer trouver chez 
un partenaire : «Je n'ai aucune 
demande véritable que je puisse 
adresser à un homme, en fait je pré- 
fère rêver. De plus, je n'ai pas assez 
de temps pour pouvoir en accorder 
à un homme, aussi, il m'arrive de 
réclamer de l'argent, rien que pour 
parler : c'est normal ça me prend du 
temps ! Je crois qu'il est possible de 
vivre dans la chasteté, et je pense 
que rentrer au couvent ne me déplai- 
rait pas. » 
L'hétérosexualité n'est pas l'unique 
possibilité qui puisse s'offrir à la 
femme, une autre voie s'ouvre à elle, 
l'homosexualité. Elle résulte de posi- 
tions identificatoires et de choix 
objectaux qui peuvent être divers : 
l'homosexuelle peut être toujours 
attachée à son premier amour pour 
sa mère, elle peut être identifiée au 
père faisant ainsi de sa mère son 
objet d'amour. À ces cas de figure 
peut s'ajouter un autre : celui de 
l’äpparente homosexualité de l'hysté- 
rique qui, dans son amour pour son 
père, aime celle qu'il aime. Ce qui 
explique peut-être qu'elle soit sou- 
vent peu jalouse, encore qu'à cer- 
täins moments, elle le soit terrible- 
ment. Lorsqu'elle paraît s'intéresser 
à une femme hors de toute référence 
au père, c'est qu'elle espère trouver 
auprès d'elle un savoir sur le mystère 
de la féminité, qu'elle suppose que 
l'autre a. L'homosexualité des jeunes 
filles est souvent transitoire. Après 
un premier échec amoureux hétéro- 
sexuel, Claude vit avec une autre 
jeune fille. Mais, malgré cette situa- 
tion, elle ne pense pas être homo- 
sexuelle. Pour elle, il s'agit de trou- 
ver une tendresse qu'elle croit ne pas 
pouvoir obtenir auprès d'un homme. 
Elle désire pourtant en rencontrer un 
et partager sa vie. D'auires motifs 
peuvent venir se grelfer sur cette 
régression homosexuelle : une"
19,20,"7 analyse a permis à Marie de décou- 
vrir que son homosexualité avail 
pour but de la protéger de sa mère 
perçue comme une rivale redoula- 
ble. Ainsi, elle se désistait en lui 
abandonnant tous les hommes. Pour 
Cécile, la situation est encore diffé- 
rente : en adoptant un objet d'amour 
similaire à celui de son père, elle se 
met en position de défier celui-ci. 
Vivant le parlait amour avec une 
autre jeune femme, inconsciemment, 
elle désire montrer à son père com- 
ment il convient d'aimer une femme. 
Sa position s'est d'ailleurs renforcée 
à partir du moment où elle s'est aper- 
çue à quel point son père était 
furieux contre elle. Autre cas de 
figure, Martine qui, elle, choisit pour 
amies de cœur des femmes dont la 
réputation est douteuse, call-girls ou 
prostituées occasionnelles (c'est là 
une condition indispensable) ce qui 
lui permet de déployer un fantasme 
de sauvetage de l'objet de son 
amour. D'après Freud, le choix 
d'une prostituée est étayé par le fan- 
tasme de sauver la mère. Et, si sau- 
ver la mère signifie lui faire un 
enfant, le fantasme de sauvetage 
d'une prostituée prend son sens dans 
le désir de lui donner un enfant. On n'ignore plus, depuls Freud, à quel 
oint la soxualité féminine diffère de 
la sexualité masculine. Il n'existe pas 
chez la femme de clivage entre 
amour et désir, tandis que la vie 
affective de l'homme est divisée. 
Cette division peut s'illustrer par les 
deux types de choix d'objet qui orga- 
nisent sa vie amoureuse : la femme 
qu'on aime et qu'on épouse, celle 
qu'on respecte parce qu'elle prend 
la place qu'occupait la mère et la 
femme qu'on désire, l'autre femme, 
maîtresse ou prostituée. 
Pour Elisabeth, le sexe a de l'impor- 
tance, mais n'est pas primordial : 
« Je suis restée un an sans avoir de 
relations sexuelles à un moment où 
j'étais prise par d'autres occupations 
plus passionnantes. Actuellement, la 
situation est différente, au bout de 
trois ou quatre jours d'abstinence, je 
commence à m'effrayer, mais je con- 
sidère que c'est lié à un certain état 
général. En tout cas, je ne suis pas 
une fanatique de la chose. L'impor- 
tant est que je trouve un homme que 
j'aime et avec qui je puisse établir 
une relation stable : je suis contre les 
aventures. J'accorde davantage d'im- 
portance à l'amour qu'au sexe, d'ail- 
leurs je pense qu'il me serait possi- 
Un métier d'avenir libéral. 
aux multiples débouchés : 
GRAPHOLOGUE 
Depuis 35 ans nous enseignons la psyoho-graphologie. Quel que solt 
votre objectif, initiation, perfectionnement ou formation professionnelle 
complète et reconnue au métier de graphologue, nous vous proposons 
un cursus pouvant se dérouler sur 1 à 3 ans: graphologle, morpho-psy- 
chologie, caractérologie, psychologie appliquée, orientation el sélec- 
tion professionnelle. 
Selon votre disponibilité et votre lieu de résidence, vous pouvez opter 
pour: 
© les cours par correspondance 
O les cours oraux à Paris 
Notre enselgnement individualisé et animé par des universitaires et 
praticiens des sclences humaines esl diffusé sous contrôle pédagogique 
de l'Education Nationale et agréé par le Syndicat des Graphologues 
Professionnels. 
Inscription permanente - Information convention de formation continue 
Documentation gratuite sur simple demande. 
Contro national do Psycho-Graphologio 
CNPG - Service Cours PSY 20 
105 avenue Victor Hugo — 75116 Paris 
Tél: 553 41 50 (demander Madame AGNASSE) 
Proiession : 
Adresse : 
Demande sans engagement une documentation gratuite sur : 
O Cours par correspondance 
20 © Cours oraux O Convention de tormation ble de rester assez longtemps auprès 
d'un homme qui serait impuissant 
pour peu que j'en tombe amoureuse. 
Ï] ne m'est arrivé qu une fois d'être 
altirée par quelqu'un pour des rai- 
sons purement physiques : ça a duré 
deux jours, pas plus. J'adore séduire 
el être séduite. Pour qu'un homme se 
rende désirable à mes yeux, il faut 
qu'il ait une belle voix et qu'il sache 
tenir de beaux discours. Par amour 
je suis capable des pires folies : j'ai 
eu, à un moment de ma vie, une liai- 
gon avec un homme qui était sado- 
masochiste. J'ai assumé cette relation 
tant que j'ai été amoureuse. En fait 
celui que j'aimais était un autre que 
j'avais pris pour lui, je le rêvais tout- 
à-fait différent de ce qu'il était et mal- 
gré la réalité de la situation, jusqu'au 
bout je suis restée dans mon rêve. » 
Si pour une majorité des femmes, le 
sexe est secondaire, pour Huguette, 
il est loin de l'être : « Bien sûr, l'idéal 
est de pouvoir associer la tendresse 
et la sensualité, mais l'abstinence me 
dérange davantage que le manque 
d'amour. Je tiens beaucoup à m'en- 
tourer d'une foule d'amants parce 
que faire l'amour toutes les nuits avec 
la même personne me déplaît. » 
On invoque souvent une différence 
fondamentale entre l'homme et la 
femme dans le rapport que chacun 
entretient à la jouissance. Gennie 
Lemoine explique cette différence 
par le fait que « la jouissance mas- 
culine est localisée au niveau de l'or- 
gane sexuel, alors que la jouissance 
féminine, même vaginale, est une 
jouissance de tout le corps qui y est 
impliqué tout entier, des pieds à la 
tête : elle est plus totale, même si elle 
ne survient qu'occasionnellement. 
Lorsqu'une femme a accédé à la 
jouissance, il lui est difficile de s'en 
passer, ce qui explique qu'elle tende 
à rester fixée à l'homme qui la lui a 
fait éprouver. » 
Tout discours sur une sexualité vagi- 
nale ou clitoridienne paraît en défi- 
nitive comiquement futile. 
Isabelle Taubes. 
Bibliographie 
+ Gennie Lemoine : Le Partage des 
femmes (ed. du Seuil) 
° S. Freud : Les Trois Essais sur la 
sexualité - (Coll. Folio) - La Vie 
Sexuelle - (P.U.F) : Les Nouvelles Con- 
férences - (Gallimard) 
+ Gérard Pommier : L'Exception Fémi- 
nine - (Point Hors Ligne)"
20,21,"RAM ———————————— 
Le monde du travail 
est riche en happenings 
conflictuels de toutes sortes. 
Depuis plus de trente ans, 
l’Analyse Transactionnelle s'applique 
à les résoudre à partir de sa théorie 
des trois états du Moi définis 
par Éric Berne : Parent, 
Adulte, Enfant. 
DENOUER 
EN CHAÏ 
« Modeste employée de bureau de 40 
ans, Madeleine, très émotive, était 
prise de panique chaque fois que son 
chef de service s'adressait à elle. Un 
homme, disait-elle, autoritaire, 
agressif, véritable Cerbère, qui lui 
faisait perdre tous ses moyens. À 
l'aide du jeu de rôle, nous avons pu 
reconstituer la scène et la filmer en 
vidéo. Aidée par le groupe et par son 
désir de mieux comprendre ce qui se 
jouait dans ces rapports de travail, 
Madeleine réalisa bien vite que ce 
qu'elle prenait pour des attaques 
personnelles n'était en fait pas dirigé 
contre elle, mais reflétait simplement 
le style, le fonctionnement psycholo- 
gique de son supérieur hiérarchi- 
que. Cette première étape franchie, 
il lui restait à opter pour un éventuel 
changement d'attitude qui lui per- 
mettrait de ne plus se laisser impres- 
sionner. Deux détails importants lui 
revinrent alors en mémoire : chaque 
fois qu'elle commençait une phrase, 
son patron lui coupait la parole. Vou- 
lant néanmoins terminer ce qu'elle 
avait à dire, ette tentait de poursui- 
vre, il l'en empéchait, et commençait alors une escalade verbale qui se ter- 
minait inévitablement par un bafouil- 
lage confus ! Tout cela, et c'est le 
deuxième détail important, au su et 
au vu de ses collègues, qui avaient 
tout loisir d'assister à l'algarade à tra- 
vers la porte du bureau. Madeleine 
résolut alors, non seulement de ne 
plus se livrer à une surenchère de la 
parole, mais de refermer la portes 
derrière elle quand elle entrerait 
dans le bureau de son patron. Elle 
n'a plus eu de problème depuis. » 
Modifications minimes, direz-vous. 
Pas pour l'intéressée, qui avait réussi 
à abandonner un « pattern » ina- 
dapté à la situation, celui de l'Enfant 
Adapté Soumis, pour adopter un 
comportement de type Adulte. A 
faire, en somme, un pas de géant, 
comme l'explique Christine Cheva- 
lier, formatrice, responsable à 
D.H.D.O (Développement des hom- 
mes et des organisations) et théra- 
peute en analyse transactionnelle, 
qui utilise pour analyser ce cas la 
grille des trois Etats du Moi: le 
Parent, l'Adulte et l'Enfant. À eux 
trois, ils représentent la structure de 
21 "
21,22,"la personnalité telle que l'a décrite 
Eric Berne (1), fondateur, dans les 
années cinquante, de l'Analyse Tran- 
sactionnelle. Si une personne équi- 
librée sait jouer alternativement et 
d'une façon positive des trois compo- 
santes de sa personnalité, selon les 
exigences d'une situation donnée, 
tout le monde n'a pas cette souplesse. 
On peut être amené, en fonction de 
son histoire personnelle, à recourir 
plus souvent à l'un de ces rôles, 
comme Madeleine, prisonnière 
d'une attitude d'Enfant Adapté Sou- 
mis. Nous avons demandé à Meyer 
Ifrah, directeur de l'E.A.T.C. (Ecole 
d'Analyse Transactionnelle) et de 
D.H.D.O, ce que recouvraient ces 
termes : « I] y a deux manières d'être 
“Enfant”, sur le mode “Libre” ou 
Une personne 
équilibrée sait jouer 
alternativement 
et d'une façon positive 
des trois composantes 
de sa personnalité selon 
les exigences d’une 
situation donnée. 
“Adapté”. L'enfant Libre a fait une 
large place à la part intuitive et créa- 
trice qui est en lui, à la spontanéité, 
au naturel. L'Enfant Adapté, lui, 
peut être dit “Soumis” lorsqu'il a ten- 
dance à ménager autrui, à se mon- 
trer timide et dépendant, à se déva- 
loriser et à acquiescer à tout ce qu'on 
lui dit ou à se plier d'une façon posi- 
tive aux règles sociales. À l'inverse, 
il y a l'Enfant Adapté Rebelle, qui se 
pose en s'opposant, refusant systé- 
matiquement toute autorité sachant 
aussi se battre et prendre des ris- 
ques, car c'est un conquérant ». Le 
« Parent », lui aussi, est double : 
« Nourricier », il fera montre, dans 
son aspect positif, de chaleur, de. 
bienveillance et d'affection, toujours 
prêt à soutenir autrui, à le prendre 
en charge ; si l'aspect négatif l'em- 
porte, on aura affaire à un paterna- 
liste. « Nous appelons cette catégo- 
rie de personnes des Sauveteurs, 
poursuit Meyer Ifrah, car ils veulent 
à tout prix assister leur prochain, lui 
22 faire plaisir. Is rendent ainsi les 
LA s = . 
autres très dépendants d eux, àl ins- 
tar des mammas italiennes * » Quant 
1P a soi rent « Normatif », ce ser 
Un decider, un leader, un garant de 
la loi (aspect positif), soit un agres- 
sif abusant de son autorité, un « Per- 
sécuteur » (aspect négatif). L'Adulte 
enfin, contrairement à l'Enfant et au 
LE STAGE 
D’ANALYSE 
TRANSACTIONNELLE Les séminaires d'analyse transaction- 
nelle font l’objet d'un contrat entre l en- 
reprise et les intervenants, qui précise 
le contenu de la formation souhaitée : 
‘animation ou direction de groupe, ges- 
tion des conflits, apprentissage de la 
négociation, du travail en groupe, amé- 
Jioration de la communication, elc. 
Un groupe d'une douzaine de partici- 
pants est ensuite constitué. Le stage se 
déroule de la façon suivante : chaque 
participant expose son objectif de tra- 
vail, puis.on recueille des cas concrets. 
La situation problématique est jouée, 
“enregistrée au magnétoscope et analy- 
sée. À ce stade du programme, l'inté- 
ressé peut choisir d'en rester là ou de 
poursuivre en décidant de changer son 
‘comportement. Dans ce cas, il passe à 
la phase dite de « recherche des. 
‘options » qui consiste à chercher, avec 
l'aide du groupe, de nouvelles manié- 
res de réagir à la situation problémati- 
que. La dernière phase, celle de l'en- 
traînement, lui permettra d'expérimen- 
ter un nouveau comportement à l’aide 
des jeux de rôle. Chacun est libre, à 
tout instant de ce parcours, de poursui- 
vre ou d'arrêter l'expérience engagée. 
Ces stages peuvent élire ponctuels, 
d'une durée de quelques jours, ou pro- 
gressifs : un à deux jours tous les deux 
mois, pendant un, deux ou trois ans. 
‘Pour tous renseignements, s'adresser 
à : D.H.D.O, 15 rue Faraday, 75017, 
Paris — Tél. 227.33.77 
Parent, fonctionne sur un mode non 
pas subjectif, mais rationnel. Pour 
lui, seul importe la réalité des faits, 
et toutes ses prises de positition tien- 
nent compte de données objectives, 
un peu comme le ferait un ordina- 
teur ; il gère la réalité. On voit bien 
comment une telle grille peut per- 
mettre de décrypter les causes de 
certains dysfonctionnements dans le 
monde du travail : mettez ensemble 
deux Persécuteurs, et ils risquent de 
se livrer une joute sans merci, cha- 
cun cherchant à prendre le pouvoir : 
opposez un Persécuteur à un enfant 
Adapté Soumis, et là encore, le désé- quilibre relationnel nuira à un 
bonne communication. Or, Comme 
l'a souvent énoncé Paul Watzlawicz 
la communication ne se borne pas : 
transmettre une information, elle 
induit un comportement. Proposition 
vérifiée par l'A.T. grâce à l'analyse 
des transactions entre les personnes . 
« Il est essentiel de pouvoir repérer 
à partir de quel Etat du Moi je vous 
parle, auquel de vos trois Etats du 
Moi je m'adresse et à partir de que] 
état du Moi vous me répondez, expli. 
que Meyer Ifrah. Soit ce qui se passe 
entre nous est une transaction com- 
plémentaire simple : je vous 
demande l'heure, vous me la don- 
nez ; soit c'est une transaction croi. 
sée, et je n'obtiens pas la réponse 
que j'attendais : je vous demande 
Ï est essentiel 
de repérer à partir 
de quel état 
du Moi je vous parle 
auquel de vos trois états 
du Moi je m'adresse 
et à partir duquel vous 
me répondez. 
l'heure, et vous me reprochez avec 
véhémence de ne pas avoir de mon- 
tre ! Soit encore, et là, le jeu de la Communication devient beaucoup 
plus subtil, je ne vous demande 
l'heure que pour vous faire observer 
que vous êtes en retard, mais sans 
formuler de reproche explicite. » On comprend comment la communica- 
tion peut aboutir à des quiproquos et 
à une détérioration de la relation, 
sans que les usagers en aient 
conscience ! 
De même, l'analyse des « signes de 
Reconnaissance », qui mettent en jeu 
l'attention que nous portons à autrui 
et la façon dont nous le gratifions - 
Où pas-, est riche d'enseignement : « Manager dans une entreprise de 
construction d'ordinateurs, Félix avait été amené, à un tournant de sä 
Carrière, à s'entourer de plusieurs 
collaborateurs, raconte Meyer Ifrah. 
Au bout de quelque temps, la direc- 
tion s'inquiéta de l'augmentation du"
