,page,text
53,54,"BIRDY 
ou la fascination de la folie 
tier. « Dis cela à ton fils » répond la mère 
avec une lucidité dramatique. Le docteur 
Gavard explique : « C'est extrêmement 
touchant de voir cette femme qui sait el 
qui pourtani, ne fait rien comme souveni 
les mères de schizophrènes. Adoptant 
parois à son égard une attitude très thé- 
rapeutique, elle ne l'a cependant jamais 
fait soigner. En cela, on peut dire qu'elle 
tient un double discours. Lorsqu'elle réa- 
git sainement de temps à autre, c'est une 
façon de se déculpabiliser. Mais elle a 
probablement inconsciemment besoin 
que son fils soit malade ; ne serait-ce que 
pour masquer la pathologie du père. 
Pendant des années, elle a aussi conservé 
des balles de base-ball confisquées aux 
autres enfants. On peut penser que ces 
balles sont le symbole d'une enfance nor- 
male, celle que Birdy n'a pas eue. Si elle 
ne les rendait pas, c'est sans doute par 
jalousie, par amertume. Mais en les gar- 
dant ainsi des années, elle témoignait 
aussi de son respect. La projection d'un 
film comme celui-ci est certainement très 
positive. Il montre que la folie existe, 
qu'on là rencontre et qu'on peut vivre 
avec, dit le docteur Gavard. Il montre 
aussi qu'il faut faire un effort social pour 
parvenir à vivre ensemble en conservant 
toute la palette des expériences humai- 
nes. Les gens comprendront qu'on peut 
avoir un rapport humain avec un malade 
mental et que celui-ci peut nous appor- 
ter beaucoup. Mais, il ne faut pas rêver : 
la folie, ce n'est pas quelque chose de 
beau : c'est une intense souffrance quand 
elle se réalise véritablement. La seule 
folie superbe est celle qui habite tous les 
gens normaux. Celle qui n'est qu'une 
aspiralion. » 
Florence Villermont Les médecins 
en France 
Une étude portant Sur l'ensemble du.corps 
médical montre que le nombre des 
médecins a doublé en dix ans : avec 258 
médecins pour 100 000 habitants, la 
France se place dans le peloton de tête des 
pays d'Europe occidentale derrière l'Italie el 
devant l'Allemagne. 26 % d'entre eux sont 
des femmes mais ce taux varle 
considérablement selon le mode d'exercice 
et la discipline : sur 100 000 généralistes, 
on ne trouve que 16 femmes alors qu'elles 
‘sont 26 pour 100 spécialistes. 
‘Selon l'étude, l'augmentation des femmes 
‘dans la médecine résulte de deux 
processus : féminisation universitaire 
{chaque promotion de diplômés compte 
35 % de femmes] et changement de 
comportement en face de l'activité 
professionnelle. Les diplômées d'aujourd'hui 
s'engagent pour la quasi-totalité dans 
l'exercice professionnel. 
Françoise ‘Brisset-Vigneau 
Conférence 
internationale de 
psychiatrie de 
l'adolescent 
La 1'e conférence internationale de 
psychiatrie de l'adolescent se tiendra à 
Paris, du 21 au 24 juillet prochain, sous le 
patronage de l'INSERM. Son thème : les 
conflits à l'adolescence. Dégager la 
spécificité de l'adolescent et réfléchir à de 
nouvelles modalités de prise en charge, tel 
est l'objectif des organisateurs, qui 
entendent bien aussi attirer l'attention des 
pouvoirs publics : aujourd'hui, 15 % des 
jeunes souffrent de troubles psychiques à 
un moment ou à un autre de leur 
adolescence {plus d'un million de sujets 
âgés de 12 à 25 ans), et 30 % d'entre eux 
risquent de devenir des malades mentaux 
ou des handicapés à vie. Des chiffres 
alarmants, et qui concernent plus 
particulièrement certaines conduites 
pathologiques en augmentation à l'heure 
acluelle : la toxicomanie, les troubles du comportement alimentaire, les tentatives de suicide el les pathologies schizoïdes {retrait el désinvestissement du monde extérieur). Les trois journées seront respectivement 
consacrées au monde intérieur de l'adolescent {compréhension psychanalytique, organisation des 
personnalités limites, inhibition 
intellectuelle}, à son environnement [la 
famille, les aspects transculturels de 
l'adolescent et l'impact des institutions], 
enfin à une synthèse de ces deux aspects 
(le suicide, les troubles alimentaires el la 
drogue). Marianne Gomez 
Inscriptions * envoyer un chèque de 1600 F à 
Pr Philippe Jeammet, hôpital international de 
l'Université de Paris 42, bd Jourdan - 75014 - 
Paris. 
Le premier congrès 
international 
de la santé 
des adolescents 
Afin de remédier à la carence 
d'informations concernant la santé des 
adolescents, le Comité français de 
l'adolescence, en collaboration avec les 
ministères de la Santé et de la Jeunesse et 
des Sports, a prévu des programmes de 
sensibilisation du public aux problèmes des : 
jeunes. Reconnaître et faire mieux 
comprendre l'adolescence, tels sont les 
objectifs de ce comité qui, dès juin 1986, 
lancera diverses campagnes de presse et de 
télévision, ainsi que plusieurs colloques à 
Paris et en province. Différents spécialistes 
français, suisses et canadiens, aborderont 
les problèmes les plus aigus ‘du moment, 
afin de répondre aux attentes de nombreux : 
parents, éducateurs et médecins. 
Contraception, sexualité, M.S.T. [maladies 
sexuellement transmissibles), avec entre 
autres le choix du type de contraception, 
seront à l'honneur. « 50 % des jeunes 
n'ont pas de rapports sexuels, ou alors très. 
espacés et irréguliers. Il n'est pas 
nécessaire de prescrire la pilule, mais plutôt 
d'informer correctement sur les divers types 
de contraceptifs, comme les contraceplis 
locaux, mieux adaptés », remarque le Dr 
Boukris, L'accent sera mis particulièrement 
sur les M.S.T. en pleine recrudescence en 
France actuellement, et qui atteignent en 
premier les moins de 30 ans. Comment les 
éviter, les dépister rapidement, autant de 
conseils pratiques qui seront prodigués De 
même, la sociologie et la psychologie des 
adolescents, thèmes sur lesquels butent de 
nombreux parents tous les jours, seront 
amplement analysés. 
Dominique Piccinini 
Comité français de l'adolescence 
33, rue de la Chapelle, 75018 Pans Tél 
240.13.93"
54,55,"“13, représentez 1vsi préseéntez-vous physique-} ‘Men - 
{ment le chiffre (les miens étaient en relief et l ae en couleur), réstez dessus : 
que qu es Of = 
le2, secondes... et passez à: 
«59 J puis continuez jusqu'à [: 
; à ne 
Â5ez « 49 revenez en arfière, pen- 
préférence, et vous aurez 
s bonne base de dépaït 
‘oyance Cas plus complexes 
2ce. C'est une des leçons de (1). La voyance, pou 
naturel. « En réalité, 
Imonde est voyant. 
matériel pour l'être. 
ll 4ent que ce don subira: dit-il, tout leil 
Chacun a lel 
Mais il' est évi-[! 
de nombreu-! 
cours de la vie dell 
uvent con-: 
def i-1R] pour que les clichés paraissent.. » !\: 
] Maintenant, en m'éveillant, chaque! * 
. » C'est un peu aussi 
(2) : *], quoi. Elles peuvent done s'induire.en: 
erreur sansle vouloir. Le voyant res 
semble au médium. Il a des clichés 
Le clairvoyant, lui, est quelqu'un de! 
À très équilibré, quelqu'un qui n'ést! 
A] pas susceptible. 11 a des clichés au} \"" 
contact de certaines choses. Il faut [” 
qu'il soit intérieurement disponible UE 
[[ matin je pratique la rétention respi-\ 
[ratoire. Avant le petit-déjeuner, je J 4 (des voyances) à certains moments. 
S HÈù Ù "
55,56,"les pieds au sud (et nus), les bras le. 
long du corps. Je vide complètement 
mes poumons puis je les gonfle au 
maximum en inspirant par le nez. Je 
retiens l'air le plus longtemps possi- 
ble, ce qui ne va guère au-delà de 
trente secondes, Ensuite, :j'expire 
lentement par la bouche et je recom- 
mence à me gonfler. Depuis que je 
pratique cet excercice numéro un 
dans l'entraînement à la voyance, je 
suis beaucoup plus calme, même 
avec mon chien. Etat naturel pour 
Bernard Tan T'iem, la voyance est un 
don pour Jacqueline Lebeau. Soi- 
gnant une maladie pulmonaire dans 
un préventorium de l'Aisne, sa pre- 
mière consultante (involontaire) ne 
fut autre que la directrice de l'éta- 
blissement qui lui reprochait ses 
mauvaises notes et son état second. 
Elle avait dix ans. Elle lui annonça 
un deuil : « Je vous vois en noir et 
vous pleurez. » Evénement qui se 
vérifia trois mois plus tard... Pour 
Bernard Tan T'iem, son « champ de 
conscience agrandi » s'étend à des 
souvenirs de la toute petite enfance : 
couleur du berceau, couleur d'un 
médicament pris entre trois et six 
mois, souvenir de situations préci- 
1. La voyance proprement dite 
{ou clairvoyance) 
Elle a pour objet, par la production de 
clichés (ou voyances), de projeter la 
personnalité du consultant dans le 
futur. Les clichés obtenus, le problème 
du voyant est de savoir ce qu'il doit 
révéler. Un voyant sérieux tient compte 
de l'équilibre nerveux du consultant, de 
son état psychique. S'il a devant lui un 
être malheureux ou en crise, il agira le 
plus souvent comme un conseiller pour 
l'aider à faire face. Il évitera, de toute 
façon, le traumatisme que pourrait 
apporter la révélation d'une maladie, 
d'un décès, d'un ennui imminent. Si le cliché révèle une tendance néfaste, il refusera de nuire, sur commande, à un tiers. Inutile donc de solliciter un malé- Îice auprès d'un des voyants que nous avons consultés... 
2. La télépathie 
Elle a pour objet la transmission de cli- chés entre deux personnes séparées par la distance ou un obstacle leur interdisant LE DOMAINE DE LA VOYANCE ses... alors que, normalement, un 
bébé de cet âge n'a pas la possibi- 
lité de retenir parells détails. « J'étais 
dans un état semi-comateux ce qui, 
peut-être, explique ce champ de 
conscience agrandi... » Jusqu'à l'âge 
de cinq ans, il eut des « flashes de 
voyance » et des prémonitions, mais 
il lui était impossible de les traduire 
par des mots, faute d'un vocabulaire 
suffisamment étendu. 
Sur ce chapitre du don de voyance, 
Monique Brianti a également 
demandé leur avis à Vichna Bél, une 
jeune coréenne d'origine mongole, 
et à Omelenko, né de père antillais 
et de mère charentaise. Tous deux 
sont voyants de grande réputation. 
Omelenko s'est formé aux réoits 
d'aventures étranges racontés par 
son père. On voulait l'éloigner mais 
il écoutait tout et tout lui semblait 
naturel. Il n'existait, pour lui, aucune 
séparation entre le fantastique et le 
réel de tous les jours. Vichna Bél, 
également tenue à l'écart des discus- 
sions familiales, était néanmoins par- 
faitement au courant de tout ce qui 
se décidait, de tout ce qu'on lui 
cachait. Vente de l'appartement, 
maladies intimes de sa tante, rien de 
de communiquer à vue. En règle géné- . 
rale, la télépathie n'est possible 
qu'entre deux personnes en relations : 
alfectives et se connaissant parfaite- 
ment. La production de clichés est assu- 
rée par l'une ou l'autre. S'il s'agit de cli- 
chés décidés par un tiers, l’un des deux 
voyants agit en médium. : 
3, Le voyage astral 
Il s'agit, par dédoublement de l’esprit 
et du corps, d'obtenir un déplacement : 
spatio-temporel de la partie immaté- 
rielle d'un individu, de son corps astral. 
Relèvent aussi de la voyance (prise 
comme ascèse) : 
° le traitement de certaines maladies où 
la part du psychosomatisme est 
majeure ; 
+ la recherche, à distance (souvent 
dans l'inconnu), d'objets perdus ou de 
personnes disparues ; 
+ la lutte contre des influences néfas- 
tes d'origines cosmiques ou humaines. 
GT. SON TALMIN UUVIL 
les yeux très grands et 
fixais le point du plafond 
situé exactement à la verticale. 
Tout en ayant conscience de 
la régularité 
de ma respiration 
et de la décontraction 
de mes muscles, 
il me fallait 
penser mon Visage, 
au-dessus de moi, » 
(ne nero eo 
lui échappait. Encouragé par ces 
témoignages, j'ai commencé de tenir 
un compte rigoureux des prémoni- 
tions me concernant et je me suis 
aperçu, finalement, qu'on peut très 
bien connaître le contenu d'une let- 
tre sans avoir à l'ouvrir, qu'il suffit 
d'un peu de concentration pour 
découvrir l'origine d'une lettre 
recommandée. L'essentiel est d'être 
sensibilisé. Essayez. De ces premiers 
pas sur la trace d'un ancëtre sorcier, 
je ne tire aucune gloire. Je sais que 
la route est longue pour parvenir à 
l’art des augures. Si je voulais per- 
sévérer, je crois que j'adopterais 
l'entraînement proposé par Bernard 
Tan T'iem. On serait tenté, en abor- 
dant cette spécialité de la parapsy- 
chologie qu'est la voyance, de for- 
muler une apostrophe à la manière 
de celle que Rabelais avait inscrite 
sur la porte de Thélème : « Cy n'en- 
tez pas incrédules... » Non point 
qu'il s'agisse d'adhérer, de se con- 
vertir, de solliciter une admission 
dans quelque secte où le Grand Mai- 
tre règne en despote sur les corps et 
les esprits. Non ! La démarche est 
exactement à l'inverse, tout entière 
tournée vers les autres, en une 
recherche de l'unité des composan- 
tes de l'homme, L'interdiction formu- 
lée à la manière du créateur de Gar- 
gantua et de Pantagruel concerne 
finalement ceux qui refusent de"
56,57,"prendre en considération l'ensemble 
des phénomènes apparemment inex- 
plicables qui ont à voir avec le souf- 
fle et le cerveau humain. Aux esprits 
forts, inutile de faire la leçon. Ils sont 
d'avance convaincus, même si vous 
jeur dites que la lune et les astres 
ayant une influence sur les marées... 
et les accouchements, il est plus que 
probable qu'ils en ont une aussi sur 
le comportement des hommes, sur 
leur humeur et sur leurs choix. Un 
scepticisme dédaigneux révèle le 
Moi profond bien davantage qu'il ne 
porte atteinte à l'exercice de la 
voyance. Au temps où les esprits 
{orts croyaient que le soleil tournait 
autour de ce nombril du monde 
qu'était l'Europe, ils riaient au nez de 
Christophe Colomb et de Galilée. 
Tout commence, en voyance, par de 
l'humilité, par une remise en ques- 
tion des notions culturelles chères à 
notre XXe siècle (s'il en a encore...) 
Avec Bernard Tan T'iem, il faut se 
dire que deux tiers de l'humanité 
vivent dans un autre univers mental 
que le nôtre, et ce, depuis beaucoup 
plus longtemps. Nos célèbres ancè- 
tres les Gaulois, avant d'être coloni- 
sés par les Gréco-Romains, partici- 
paient d'ailleurs d'une conception du 
monde qui avait plus à voir avec 
l'Extrême-Orient qu'avec les parents 
de Romulus et Remus. Pour simpli- 
fier (c'est souvent un crime), disons 
que l'homme n'est pas le centre de 
l'univers, mais une parcelle infime 
Que traversent, habitent, conduisent 
des forces cosmiques. L'idée que 
homme est à l'image d'un dieu créa- 
leur appartient seulement à quelques 
religions de la planète. Les autres, 
es cultures plusieurs fois millénai- 
res, ont pris en compte des phéno- 
Mênes physiques et psychologiques 
Que les nôtres, tout à fait respecta- 
les par ailleurs, ont niés, ridiculi- 
868, interdits et, finalement, atro- 
Phiés. S'intéresser à la voyance c'est 
NC aussi restituer cette partie du 
“ Matériel » humain qui s'est 
80lérosé, ‘ 
N après-midi, seul dans l'apparte- 
nl, mon chien enfermé, j'ai 
0rdé l'exercice qui me fascine le 
Plus depuis que j'ai pris aux sérieux .mes dispositions personnelles : ] eou Kien ou voyage astral. L'am- biance de la grande ville m'a paru mieux adaptée à ma tentative que e 
Vichna Bél], tenue 4 ] 
4 FE i 4 
‘4 + AY 
1 EE : ""1 
TE 
7 ke 
QE L NN l 
Pr OUT DAT 
Fi 
71 
; Ti PA dé 
4 ficile de ne pas m'enfermer dans la 
petite sieste de l'après-midi. La 
digestion n'était pas en cause. Je 
n'avais pris qu'une salade de riz 
‘écart des discussions familiales, savait tout ce qu'on lui cachait. 
ACL #. 
5 À RELRE » LA 
Rete""! MS lei, 
Deux tiers de l'humanité 
vivent dans un autre univers mental que le nôtre et 
depuis beaucoup plus longtemps. 
celle de la campagne où les agres- 
sions des bruits sont plus percutan- 
tes. J'ai tiré les persiennes,je me suis 
allongé sur le lit à même le couvre- 
pied irlandais aux dessins géométri- 
ques et j'ai attendu... « 1», « 2 », 
« 3 ».… etc. Je suis monté sans diffi- 
culté jusqu'à « 50 », ce qui n'est pas 
toujours le cas. Ensuite, j'ai com- 
mencé une « respiration consciente » : 
hininin.….. j'inspire.… pfououou.… 
j'expire. C'était étonnant comme 
mon esprit était « à côté ». Je sentais 
‘endgourdissait, en mon corps qui seng® 
revanche. Au point qu il m'était dif- complet trois heures avant. C'était 
plutôt le bien-être lié à la respiration 
régulière. Alors, j'al essayé d'imagi- 
ner le couvre-pied irlandais sur 
lequel j'étais allongé. Bon exercice. 
En même temps, je suis passé à la 
pensée des muscles de mon crâne. 
Comme j'ai le crâne rasé, il m'a été 
facile de me les représenter. Surtout 
celui de la nuque, qui a du gras. 
« Ces muscles se détendent », me 
suis-je dit. J'ai eu tout de suite des 
tiraillements sur le front et les tem- 
pes : « Les muscles du front se 
délendent », ai-je dit. Je me souve- 
[der 
PS7 
LE 
het 
ireS 
Cor 7 PP 7 
ee fini 
cet cm mme. see ue 
mm qu, 
77"
57,58,"nais qu'il ne fallait pas dépasser la 
ceinture. Parce qu'on a vu des maï- 
tres de la décontraction faire des 
choses absolument sensationnelles 
avec leur sexe. Et que si on mélange 
les genres... « Les muscles autour 
RE 
AI AT en (Ze J'ouvris donc les yeux très grand et 
fixai le point du plafond situé exac- 
tement à la verticale. Tout en ayant 
conscience de la régularité de ma 
respiration el de la décontraction de 
mes muscles, il me fallait penser mon 
RS UT mn x Le? Ÿ CCR PRE fa À A 7 
SIA EU ! n — VS à OE } 
AP ANS ; 9 A+ + x LA 
*: ee a Du Ge 4 +. 
* 
\ ce dl * “h- A 
TT 
en ” 
à 4 r4u . > À « # 
D PU pl PSS PRES 
ss: pe) j Nu \t DL Li 
TS SNL ' Ch Da j. LU 7 à 
VT {bn & 
HD LJ PT ! ln le 
12: 9 
OUmelenko s est torme aux récits d'aventures étranges que racontait son père antillais. 
des orbites se détendent », ai-je mur- 
muré, un peu trop fort... « Les mus- 
cles des mâchoires se détendent ».… 
« Les muscles du cou se déten- 
dent »... « Les muscles des épaules 
se détendent »... « Les muscles des 
mains se détendeni ». Ici, Bernard 
Tan T'iem dit qu'il faut s'arrêter. Je 
m'arrêtai. J'avais prononcé exacte- 
ment toutes les phrases. Ma décon- 
traction était au moins théorique. Il 
me fallait vérifier encore si mon 
esprit, en revanche, n'était pas trop 
mollasson. Brièvement, je me mis à 
penser aux rives du Gange, à Béna- 
rès.. L'escalier. Les fleurs. Les bâtonnets d'encens.… Il était plus que 
temps de me mettre au vrai travail. Î vous consacrez 
en moyenne une heure par jour 
à votre entraînement 
pendant dix ans, 
vous accomplirez 
des-performances qui vous 
surprendront. 
Seulement, la 
route est 
longue. 
visage, là, au-dessus de moi. Je sais 
que je vais recommencer. Parce que 
je dois « voir » mon visage, passées 
les premières expériences. Je dois 
non seulement voir mon visage, mais 
monter m'y coller, m'y fondre, me 
perdre dans ce tout de même curieux 
miroir. Et, plus fort encore, une fois 
fondu dans cette projection, je vais 
me retrouver et regarder en bas ! Et 
mon corps va m'apparaître, détaché 
de mon esprit, totalement endormi 
sur le couvre-pied irlandais, respi- 
rant de plus en plus lentement, 
comme s'il ne m'appartenait plus, 
comme s’il était celui d'un étranger. 
LA VOYANCE, UNE AFFAIRE DE GLANDE 
La partie centrale de notre cerveau, qui 
est la plus archaïque, correspond aux 
fonctions parapsychologiques. Là se 
trouve la grande pinéale ou épiphyse 
dont les fonctions sont encore mal con- 
nues du monde médical. Elle est éga- 
lement appelée par certains glande spi- 
rituelle ou encore troisième œil et per- 
met à l'individu d'entrer en contact avec 
l'absolu. Telle un muscle qu'on n'utilise 
pas, dans notre type de société, avec 
nos conditionnements, elle se trouve 
atrophiée. Sans doute parce que dans 
un but de survie de l'espèce, l'individu 
a fait travailler la périphérie de son cer- 
veau dont la fonction est l'intelligence 
spéculative. Cette dernière à pris des proportions considérables, au détri- 
ment de la partie centrale. Mais un 
entraînement approprié peul redonner 
toutes ses facultés à cette zone et à la 
glande épiphyse, qui permetlant l'ac- 
cès au subconscient, est la clef de toute 
l'énigme en matière de voyance. Cer- 
tains médecins, réceptifs à l'hypothèse 
de Bernard Tan T'iem, reconnaissent 
que le rôle de l'épiphyse est peu connu 
par rapport à celui de l'hypophyse. Les 
taoïstes, philosophes chinois, pensent 
quant à eux que la glande épiphyse, 
dans un domaine médical, joue un rôle 
à la fois antagoniste et complémentaire 
de celui de l'hypophyse. M.B "
58,59,"paraît que là, j'aurai peur, que je 
erai pour le moins estomaqué, mais 
que, une fois aguerri, je pourrai voyager, COTPS astral, objet immate- 
riel. Ça, je veux connaître. Et je suis Sir que c'est possible. Comme la corde qui tient toute seule en l'air 
dans Le Tigre du Bengale. « Si tout 
va normalement, dit Bernard Tan 
T'iem, vous vous trouverez trans- 
porté instantanément où votre 
inconscient vous conduira... Quel- 
que deux tiers de seconde vous suf- 
front. » Et votre corps astral ne 
connaîtra aucune limite spatio- 
temporelle, vous pourrez passer 
dans la pièce à côté ou aux antipo- 
des, vous vous retrouverez dans les 
lieux et situations de votre enfance 
comme dans des lieux, avec des per- 
sonnes, que vous ne connaissez pas 
encore. « Si vous consacrez en 
moyenne une heure par jour à votre 
entraînement, et cela pendant dix ans, je vous gar aCCombplirez de vous Surprendron », encore, assure-t-i] 
squlement là route est longue. tez-vous lentement ! , recom- mandent les maîtres du Tao. Voir 4 
4 
eg conné qu à celui qui persévère sn aîne ses facultés vers ce but. sprès l'humilité, disons que la Voyance est affaire de patience, Tout être humain est certes disposé. Selon les anciens chamanes des steppes, il existe trois catégories d'individus : les « Dragons », les « Chauves- Souris » et les « Hommes ». Vos résultats seront fonction de votre äppartenance à l'une ou à l'autre de 
ces catégories. Les premiers seront 
entendus de tous.dans leurs rugisse- 
ments, sauf d'eux-mêmes, car ils sont 
sourds de naissance. Les seconds 
resteront muets mais entendront tout. 
Les troisièmes, seuls, pourront entendre et se faire entendre. Mais, 
tous, vous devez vous soumettre à un 
entraînement qui porte aussi bien sur 
la manière de respirer que sur vos 
habitudes alimentaires, sur le déve- 
loppement de votre attention, sur la 
maîtrise de l'imagination et le con- 
trôle absolu de vos gestes. Préparez- 
vous à une ascèse…. 
Maintenant, même si vous n'êtes pas 
assurés de vos dispositions, dites- 
vous que les exercices proposés par 
Bernard Tan T'iem intéressent tout le 
monde, « même ceux qui ne désirent 
en rien développer leurs talents 
cachés de voyant... » La gymnasti- 
que psychique, physiologique et spi- 
rituelle qu'il conseille ne manquera 
pas de vous apporter une améliora- 
tion de l'équilibre général. 
Gérard Thomas 
(1) Paru aux Editions du Léopard d'Or. 
(2) Interviewée par Monique Brianti. 
mean 4 Connaissez-vous Anastral ? 
Anastral vous connaît. 
c'est l'analyse astrale de votre personnalité conçue 
ANASTRREN CAE et saluée par la Presse comme le meilleur outil 
i et des autres. - de connaissance de soi € MATIN MAGAZINE) 
s : « nettement supérieur » (LE , L 
‘ étonnant. fascinant » (EXPONE Leurs astrologiques classiques. permet de reproduire l’activité 
“ diffère fondamentalement des oran de la Foire de Paris, Concours LE ) sicoite » idien Mentale de l'astrologue... une réussite ? (raisons de son interprétation » (VOIR) “ vous explique, grâce au thème dessiné,  OMATISME) 
“un véritable Système expert » (LE NOUVEL AUT 
Offrez-vous; offrez Anastra ; éle, 75008 PARIS L : 95, rue La Boële, 
>glement à ANASTRA du ciel en couleurs. 
PON gp OMMANDE à envoyer ae ASTRAL : analyse psycho lage ae LL Minutes LL] ur 80 F adressez-moi mon € Anne 
mandal Lieu de nalssance : 
D DS DE D EN EE EE De 
eo 
ee re : 
ep 
ee 
D 
en 
.. 
eg 
pee 
me: 
ee 
. CEPErE 
PC 
CN 
CAC 
OR 
SR RE 
2 
-i 
LE 
LR. 
DERSRTS 1 
# 
PC 
N 
. NES 
25 2 
s 
Fo 
un 
de CS 
, 
ë 
: 
: 
- MOT 
ue 
2 
4 
2,8, 
Le nn 
£ 
du 
- 
SE 
1 i 
+ 
ic o 
# 
AE 
ON 
h 
eu 
+ 
NE 
: 
Crjoint un reglement par chéque  CCP * 10F bou expédinon hors de France pocaltè 
D En Mon nom Pays Lt 
Mon adresse Lance Metropoltiunt® N' departanent Lt} 
prrangur Indique la ville la plus Proche ft 
DONNEES RELATIVES À L'ETUDE SOUHAITÉE LL EL Lt Lt 1) Prenom I Sexe LI LL ii 
Mois - nd Une mem CT 
D — Le ’ ale et heure de votre naissance : Joui AD TT a —————————————"" 2 "
